awardnumber,organization,name,title,abstract,section,review_section,keyword1,keyword2,keyword3,keyword4,keyword5,keyword6,keyword7,keyword8,keyword9,keyword10,keyword11,keyword12,keyword13,keyword14,keyword15,keyword16,keyword17,keyword18,keyword19,keyword20,keyword21,keyword22,keyword23,keyword24,keyword25,keyword26,keyword27,keyword28,keyword29,keyword30,keyword31,keyword32,keyword33,keyword34,keyword35,keyword36,keyword37,keyword38,keyword39,keyword40,keyword41,keyword42,keyword43,keyword44,keyword45,keyword46,keyword47,keyword48,keyword49,keyword50,keyword51,keyword52,keyword53,keyword54,keyword55,keyword56
18K12532,総合地球環境学研究所,中尾 世治,独立直前の西アフリカにおけるリテラシーの社会的位置づけ：ハンパテ・バの活動から,最も大きな研究成果は、著書1冊、査読付き学術誌の特集である。著書『西アフリカ内陸の近代』では、ブルキナファソのムフン川湾曲部における前近代から20世紀半ばまでの長期的な歴史的変動を明らかにし、リテラシーを植民地統治以前と以後の双方において考慮し、その政治・経済・宗教のそれぞれの側面での意義とそれらの関連について明らかにした。なお、本著作は日本アフリカ学会研究奨励賞を受賞した。また『年報人類学研究』で「西アフリカ・イスラーム研究の新展開」と題した特集を構成し、言説的伝統の概念を援用し、書記言語ごとに言説を構成する伝統が異なり、それらの差異によるブルキナファソの改革主義運動への影響を明らかにした。,若手研究,小区分03030:アジア史およびアフリカ史関連,リテラシー,西アフリカ,ブルキナファソ,言説的伝統,アマドゥ・ハンパテ・バ,『プレザンス・アフリケーヌ』,人類学史,アフリカ史,グリオール,イスラーム,西アフリカ内陸,文字言語の社会的布置,ハンパテ・バ,仏領西アフリカ,ネグリチュード,スーフィズム,フルベ,フランス語圏西アフリカ,アフリカ文学,,,,,,,,,,,,,,,,,,,,,,,,,,,,,,,,,,,,,
18K12531,関西大学,池尻 陽子,東北アジアの歴史展開に青海チベット仏教寺院ネットワークが果たした役割に関する研究,本研究課題は、青海地方のチベット仏教寺院が明清時代の中国やモンゴル高原にまたがる広範な東北アジア地域においていかにネットワークを形成し、どのように機能していたかに着目するものである。,若手研究,小区分03030:アジア史およびアフリカ史関連,青海チベット仏教寺院,駐京チベット仏教僧,転生化身高僧,清朝,フフホト,チャンキャ,清・チベット関係,雍和宮,転生化身僧,ラプラン,慧通禅師,ジェドゥン・ホトクト,乾隆帝,西蔵自治区档案館,ダライ・ラマ政権,東方ユーラシア,チベット仏教寺院,南モンゴル,青海,明・清,クンブム僧院,東北アジア,寺院ネットワーク,明清,,,,,,,,,,,,,,,,,,,,,,,,,,,,,,,,
18K12530,中部大学,大澤 肇,「地方文献」を用いた教育社会史による、近現代中国における国家統合の研究,本研究計画は、中国において「地方文献」（県などの地域社会において独自に編集・発行された地域社会の様相を示した文献のこと）と呼ばれる新史料を発掘・駆使し、これまで本格的に考察されたことのない、近現代中国、特に1930～50年代の中国において、国家が近代教育を普及、あるいはそれに介入することで、地域社会が国家にどのように統合されていったのか（あるいは統合されなかったのか）という問題を、主として中国江南地域の農村を対象として分析する、という点に独自性がある。,若手研究,小区分03030:アジア史およびアフリカ史関連,中国現代史,中国近現代史,学校教育,地域社会,中華民国史,中国教育史,上海新華書店旧蔵書コレクション,日中戦争,教科書,国家-社会関係,反日教育,傀儡政権,対日協力,政治教育,動員,汪兆銘,,,,,,,,,,,,,,,,,,,,,,,,,,,,,,,,,,,,,,,,
18K12529,中京大学,鶴田 綾,ルワンダの「旧難民」と国際政治：1960年代を中心に,2022年度の研究実績報告書では、2023年度の研究計画として、研究ノートの出版と史料調査の実施を挙げた。それをふまえた2023年度の研究実績は以下の通りである。なお、2022年度の研究実績報告書に記載したThe International Society for Regional Historyでの報告はアクセプトされなかった。,若手研究,小区分03030:アジア史およびアフリカ史関連,ルワンダ,難民,1960年代,アフリカ,脱植民地化,国際政治,国際政治史,アフリカ研究,国際関係,,,,,,,,,,,,,,,,,,,,,,,,,,,,,,,,,,,,,,,,,,,,,,,
18K12528,早稲田大学,小二田 章,近世東アジアの地方史誌と中国の地方志編纂の影響―編纂過程を手掛かりに,中国の宋代以降における「地方志」の編纂活動の社会的背景を検討するとともに、近世東アジア地域の同様の書物についても考察を行い、「地方志」の他地域への影響関係を検討した。まず、主に清初期の地方志編纂の背景、章学誠の地方志改革の初歩的検討を行った。また、日本・江戸期の「藩史」「国志」検討の初歩として『訓読 豊後国志』の書評を行った。次に、シンポジウム「東アジアの一統志」を主催し、基調報告「東アジアの一統志」を行った。加えて、ミニシンポジウム「一統志研究の現在」にて講演「「一統志の時代のあらまし」を行って活動成果の浸透に努めた。そして、それらの成果をまとめ、『書物のなかの近世国家』を主編し刊行した。,若手研究,小区分03030:アジア史およびアフリカ史関連,地方志,編纂過程,社会,中国,東アジア,地方史誌,一統志,杭州,近世中国,史学史,影響関係,近世東アジア,,,,,,,,,,,,,,,,,,,,,,,,,,,,,,,,,,,,,,,,,,,,
18K12527,明治大学,会田 大輔,中国南北朝隋唐時代における歴史の忘却と創造,南北朝隋唐時代は遊牧民と漢人が対立から融合に至った時代である。その過程で多くの歴史書が編纂されてきた。このうち王朝主導で編纂された正史は、王朝の正統化・理想化や同時代批判などの理由で歴史の一部の忘却や創造がなされることがある。本研究では、そのうち北周の六官制・梁の武帝像などの忘却と創造過程を解明した。また研究成果を反映した概説書『南北朝時代―五胡十六国から隋の統一まで』（中公新書）も刊行した。,若手研究,小区分03030:アジア史およびアフリカ史関連,正史,歴史像,北周,梁,北魏,南北朝,帝王略論,六官制,梁武帝,隋唐,歴史の創造,石刻史料,,,,,,,,,,,,,,,,,,,,,,,,,,,,,,,,,,,,,,,,,,,,
18K12526,明治大学,石野 智大,唐朝支配地域における基層社会構造の研究,唐朝の支配地域における基層社会がどのような人的構成を持ち、そこにいかなる構造が存在していたかを、当時の様々な出身や階層の人々をまとまって記録する石刻題記を中心的に用いて分析した。とくに、本研究では郷望層などの在地の人々の役割や位置づけに注目し、彼らと地方の官吏や雑任との関係性を解き明かしつつ検討を進めた。その結果、唐代の基層社会には、州県以下の地方行政制度や村落制度の基本的な枠組みと並行して、在地社会内部での多様な人的結合や非制度的な人的序列なども存在していたことが明らかとなった。,若手研究,小区分03030:アジア史およびアフリカ史関連,唐代,領域支配,地方行政,村落制度,基層社会,碑刻史料,石刻題記,村落社会,在地有力者,碑刻資料,仏教石刻,,,,,,,,,,,,,,,,,,,,,,,,,,,,,,,,,,,,,,,,,,,,,
18K12525,中央大学,海野 典子,近代中国ムスリムの起源説話とアイデンティティ形成：民族政策への影響を中心に,本研究の目的は、近代中国の漢語を話すムスリム（回民）の起源説話が、彼らのアイデンティティ形成過程、及び中国の民族政策において果たした役割を解明することである。新型コロナウイルスの感染拡大により、当初予定していた海外での資料調査やインタビュー調査を実施することができず、回民の起源説話が民族政策に与えた直接的影響について十分な考察を行うことができなかった。しかし、近代中国領中央アジアのテュルク系ムスリム歴史学者までもが回民の起源説話を「史実」として引用していたことを示し、回民の起源説話が広く中国領のムスリムの歴史認識や民族・宗教・国家観に影響を及ぼしてきたことを明らかにすることができた。,若手研究,小区分03030:アジア史およびアフリカ史関連,中国,イスラーム,ムスリム,回族,起源説話,民族政策,中央アジア,歴史,回民,アイデンティティ,ソ連,民間伝承,歴史叙述,民族概念,歴史認識,,,,,,,,,,,,,,,,,,,,,,,,,,,,,,,,,,,,,,,,,
18K12524,東京大学,海老根 量介,新出戦国竹簡に含まれる説話史料の歴史学的研究,本研究では上博楚簡中に含まれる春秋時代の楚を中心とする各国に関する説話を取り上げ、歴史学的観点から検討した。これらの説話には登場人物の会話など史実と見なしがたい内容も含まれているが、説話の基本的なプロットは歴史的な事件に基づいて組み立てられており、史料批判を経て歴史学の研究に役立てることも可能であることを示した。また、これらの説話には『春秋左氏伝』と対応する内容も少なからず含まれている。従来の研究では両者の類似点ばかりが指摘されているが、本当に注目すべきは両者の相違点である。本研究ではその相違点を手がかりにして『春秋左氏伝』が先行する説話をどのように取り込み、成書されていったかを考察した。,若手研究,小区分03030:アジア史およびアフリカ史関連,上博楚簡,楚,説話,出土史料,出土文字史料,申,中国古代史,左伝,,,,,,,,,,,,,,,,,,,,,,,,,,,,,,,,,,,,,,,,,,,,,,,,
18K12523,九州大学,橋本 妹里,植民地期李王家の神聖空間に対する同時代的認識の研究－李王家陵園墓の検討を中心に,本研究では、植民地期の朝鮮王朝の墓所の管理体制について検討した。,若手研究,小区分03030:アジア史およびアフリカ史関連,李王家,李王職,陵園墓,孝昌園,朝鮮貴族会,普植園,胎室,西三陵,,,,,,,,,,,,,,,,,,,,,,,,,,,,,,,,,,,,,,,,,,,,,,,,
18K12522,信州大学,豊岡 康史,清朝中期漢地政策の変容とその社会経済的背景の再検討（1736-1854）,清朝滅亡前後、革命派は支配者たる満洲と、被支配者たる漢人の関係は一貫して緊張関係にあったかのように叙述した。しかし、19 世紀後半以来、清朝はむしろ「漢」文化の庇護者として認識されていた。18 世紀、漢人人口の増加にともない、清朝領内の漢人経済の占める割合が急速に拡大し、また開拓地の飽和により暴動が増加したのに対し、清朝が漢人に配慮した政策を取るようになった結果である。本研究は、経済史・政治史的な背景の検討を通じて、19 世紀初頭の清朝の清朝中期の漢地政策の展開を、変動する政治・社会経済構造への対応として再評価したうえで、「漢化」ゆえに硬直化したその政策傾向を指摘する。,若手研究,小区分03030:アジア史およびアフリカ史関連,清朝史,中国政治史,中国経済史,経済史,政治史,嘉慶,中国史,,,,,,,,,,,,,,,,,,,,,,,,,,,,,,,,,,,,,,,,,,,,,,,,,
18K12521,金沢大学,小川 道大,18-20世紀におけるボンベイ市の経済発展　-インド史からの再考,本研究は、前植民地期の18世紀においてはボンベイ市を含めた沿岸の港町から内陸に向かう商品の多くが、マラーター同盟の中心都市であるプネー市に集められた後に、各地に再分配されていくことを示した。1853年のボンベイ市における鉄道開通が、ボンベイ市とその後背地の関係に大きな影響を生じさせたことを示した。その後、ボンベイ島周辺の埋め立てが進み、港湾施設が拡充した結果、ボンベイ市はインド西部の政治経済の中心都市となった。ただしプネー市も鉄道ネットワークに接続することで内陸の商業拠点としての地位を保っており、同市の19世紀後半以降の経済発展に関しては改めて検討する必要がある。,若手研究,小区分03030:アジア史およびアフリカ史関連,ボンベイ,マラーター,植民地化,交易,鉄道,交通,ボンベイ港トラスト,貿易統計,植民地都市,鉄道交易,歴史GIS,プネー,マラーター同盟,通関税,東インド会社,倉庫,通関税（Zakat),近世,都市,アジア経済,,,,,,,,,,,,,,,,,,,,,,,,,,,,,,,,,,,,
18K12520,横浜国立大学,辻 大和,18世紀朝鮮王朝の対清朝貿易の変容～物流および貿易品に着目して,18世紀朝鮮の対中国貿易の変化の内実はどのようなものであったのかという関心のもと、研究を進めた。その結果清が朝鮮に対して強く輸出を制限した物品があったこと、一方で朝鮮は燕行使貿易を進めて、開市貿易は官貿易にとどめ、さらに中国商人の流入を止めたり、海路開拓は進めなかったりなどの策を行ったこと、17世紀以降、次第に朝鮮社会内部で人蔘需要が確実にできていたことを明らかにし、研究成果を公表した。,若手研究,小区分03030:アジア史およびアフリカ史関連,韓国,朝鮮,貿易,朝貢,互市,嗜好品,人参,清朝,銀,人蔘,東アジア,朝鮮王朝,国境,地理書,,,,,,,,,,,,,,,,,,,,,,,,,,,,,,,,,,,,,,,,,,
18K12519,東京外国語大学,小倉 智史,ムガル宮廷における翻訳活動―『ヨーガヴァーシシュタ』ペルシア語訳の研究,本研究は、ヴェーダーンタ思想の重要なテキストである『ヨーガヴァーシシュタ』の、ムガル宮廷で編纂された3つのペルシア語訳、およびそれに派生して編纂された小さい作品群を対象とした、翻訳文献研究である。主たる対象となったのは、サリーム皇子の命令で編纂されたパーニーパティー版、アクバル皇帝の命令で編纂されたファルムリー版、そしてダーラー・シュコーの監修による版である。未校訂であったファルムリー版の校訂作業を、ダブリンとラホールに所蔵されている写本を基に進め、また原典におけるヴェーダーンタ思想や、生前解脱の思想がどのようにペルシア語で表現されているかを分析した。,若手研究,小区分03030:アジア史およびアフリカ史関連,ムガル帝国,ヨーガヴァーシシュタ,ヴェーダーンタ,ペルシア語,翻訳,ヴェーダーンタ思想,ムガル宮廷,サンスクリット,翻訳活動,,,,,,,,,,,,,,,,,,,,,,,,,,,,,,,,,,,,,,,,,,,,,,,
18K12518,東京外国語大学,篠田 知暁,初期近世西地中海地域の「境域」における異教徒間関係の形成,本研究は、初期近世西地中海地域のムスリムとキリスト教徒の境域における政治・外交的関係の形成と、それが地域の部族社会に及ぼした影響を、特にモロッコ地域北西部に焦点を当て、明らかにした。キリスト教徒の君主との外交関係は、ムスリムの政体の正当性と大きくかかわる問題であったため、その変化はしばしばムスリム同士の政治的関係に波及したこと、そして、政治的に敵対するキリスト教徒の存在が、ムスリム宗教知識人の危機意識を喚起し、境域とその周辺地域における部族社会の習俗改良運動をもたらしたことを明らかにした。,若手研究,小区分03030:アジア史およびアフリカ史関連,モロッコ,ポルトガル,境域史,外交史,境域,宗派間外交,法社会史,イスラーム,写本研究,部族,地中海,イスラーム法,異教徒関係史,,,,,,,,,,,,,,,,,,,,,,,,,,,,,,,,,,,,,,,,,,,
19K13381,公益財団法人東洋文庫,小澤 一郎,20世紀初頭の西・南アジア境界域におけるアフガン人武器交易ネットワークの研究,この研究では、西・南アジア境界域で20世紀初頭に盛行したアフガン人の武器交易を対象とし、以下の３つの課題に取り組む。１）ペルシア湾からユーラシア大陸内陸部まで広がるアフガン人の交易網について、海陸両域の交易網を結びつける観点からその全容を明らかにする。２）イラン・インド・アフガニスタンという三国家の狭間で海上・陸上交易の結節点となったペルシア湾北岸マクラーンの「フロンティア」性に注目しつつ、アフガン人による交易活動の具体相を解明する。３）英領インドをはじめとする周辺諸国家による交易禁圧の過程を追うことで、近代国家の成立とフロンティアの周縁化・消滅、超地域的交易網の変容の過程を跡付ける。,若手研究,小区分03030:アジア史およびアフリカ史関連,アフガン人,武器交易,バルーチ人,イギリス帝国,ガージャール朝,マクラーン,インド洋,フロンティア,英領インド,イラン,アフガニスタン,ペルシア湾,,,,,,,,,,,,,,,,,,,,,,,,,,,,,,,,,,,,,,,,,,,,
19K13380,公益財団法人東洋文庫,山口 元樹,20世紀前半のインドネシアにおけるイスラーム運動とアラブ地域,本研究は、20世紀前半のインドネシア（当時のオランダ領東インド）におけるイスラーム運動とアラブ地域との関係について考察するものである。国民国家形成期のインドネシアのイスラームについて、この地域の固有の論理とイスラームの持つ広域性・普遍性の双方を踏まえた分析を試みる。,若手研究,小区分03030:アジア史およびアフリカ史関連,東南アジア史,インドネシア,イスラーム,アラブ地域,エジプト,留学,マラヤ,,,,,,,,,,,,,,,,,,,,,,,,,,,,,,,,,,,,,,,,,,,,,,,,,
19K13379,龍谷大学,塩野崎 信也,ロシア帝政期南東コーカサスの「シーア派化」と「非イラン化」,ロシア帝政期（19世紀～20世紀初頭）の南東コーカサス（現在のアゼルバイジャン共和国に該当する領域）において同時並行的に進展した「シーア派化」と「非イラン化」の実態を解明することで、南東コーカサスにおける民族意識形成の様態を解き明かす。さらには、ある地域が1つの文化圏から別の文化圏に移行するとはいかなる現象なのかを、近年盛んな帝国論の研究とも結びつけながら論ずることで、より大きな問題に接続する視座を提供する。,若手研究,小区分03030:アジア史およびアフリカ史関連,アゼルバイジャン,ロシア帝国,コーカサス,ペルシア語文化圏,裁判制度,離婚,村落,都市,司法制度,結婚,写本,離婚裁判,南東コーカサス,民族意識,イラン,民族,,,,,,,,,,,,,,,,,,,,,,,,,,,,,,,,,,,,,,,,
19K13378,大谷大学,岩本 真利絵,陽明学派の三教合一思想と皇帝政治,中国明朝の創設者太祖朱元璋は三教合一思想（儒教・仏教・道教）を有していたが、明代中期以前の史料では儒教的価値観の体現者として記述される。しかし、明代後期になると陽明学の影響を受けた思想家たちが太祖を三教合一思想の集大成として尊崇するようになる。,若手研究,小区分03030:アジア史およびアフリカ史関連,御製文集,明朝史,太祖,朱元璋,洪武帝,明代,嘉靖,高皇帝御製文集,楊起元,出版,版本,祖制,中国,万暦,,,,,,,,,,,,,,,,,,,,,,,,,,,,,,,,,,,,,,,,,,
19K13377,多摩大学,水盛 涼一,近代中国における旗人官僚社会の実態と変容,本研究の目的は、中国の近代を当時の“支配民族”出身の一般的官僚の動態から観察することにある。“支配民族”とは主に満洲族やモンゴル族を指す。彼らは清朝の建国に功績を挙げ、官僚の重要な供給源となった。しかも彼らはしばしば中央や地方の枢要な地位に在って政治動向に影響を与えたのである。それにもかかわらず、彼ら少数民族官僚の実態は長らく曖昧であった。そこで、新発見にかかる清朝後期の旗人官僚名簿の整理と分析、新たに公開された旗人作成文書の内容分析と送信側・受信側の関係性調査といった作業を通して解明を目指す。この作業は李鴻章など“著名人”に偏重していた中国近代史像とは異なる新たな清朝像を提供できるだろう。,若手研究,小区分03030:アジア史およびアフリカ史関連,官僚制度,人事査定,旗人社会,少数民族政策,近代化,歴史認識,,,,,,,,,,,,,,,,,,,,,,,,,,,,,,,,,,,,,,,,,,,,,,,,,,
19K13376,早稲田大学,周 俊宇,1920年代在台日本人社会の「台湾人」認識―台湾議会設置請願運動をめぐって,本研究は、戦前の植民地台湾と日本内地において、1921年から1934年まで台湾人エリートにより展開された代表的な反植民政治運動、すなわち台湾議会設置請願運動について、これまで注目されてこなかった在台日本人の言説を考察し、そこから在台日本人社会の「台湾人」認識がどのように反映されているかを検討することを目的とする。,若手研究,小区分03030:アジア史およびアフリカ史関連,台湾,民族性,中国,台湾議会設置請願運動,他者認識,日本,台湾研究,植民地政治史,台湾政治史,台湾思想史,,,,,,,,,,,,,,,,,,,,,,,,,,,,,,,,,,,,,,,,,,,,,,
19K13375,明治大学,速水 大,石刻史料を用いた唐代武官の包括的研究,本研究は、編纂史料と石刻史料をもとに、唐の中央軍事組織である南衙禁軍および北衙禁軍の任官状況を網羅的に整理し、唐代の中央軍事組織の人的構成とその変遷を明らかにするものである。これまで研究に利用されてきた歴史書の記述だけでなく、『冊府元亀』などの類書の記述や、『文苑英華』に見える任官に関する詔勅、そして、石刻に見える官歴をもとに武官の任官状況を明らかにし、機関ごとに年代順に就任者を整理する。その整理を通して、唐代武人官僚はどのような人々によって構成され、どのような活動を行い、どのように唐代社会に位置づけることができるのかを明らかにする。,若手研究,小区分03030:アジア史およびアフリカ史関連,中国史,唐代史,石刻資料,唐代墓誌,武官,官僚制,唐,官人,土地所有,武官制度,均田制,宋,開封,繁塔,唐代,石刻,,,,,,,,,,,,,,,,,,,,,,,,,,,,,,,,,,,,,,,,
19K13374,東京女子大学,森 万佑子,近代朝鮮と交隣－事大交隣から交隣、そして外交へ,元来、朝鮮は「事大交隣」を外交の基軸とし、中国との事大と中国以外の国々との交隣を有していた。そして19世紀末には、そうした在来の秩序に併存して近代国際関係も有した。朝鮮がいかに条約関係に対応し、近代外交を実践したかについては多くの研究があるが、事大交隣の実態や、その条約への変容・転換については十分な議論がなされていない。,若手研究,小区分03030:アジア史およびアフリカ史関連,朝鮮近代,高宗,韓国併合,中華,属国自主,交隣,事大,大韓帝国,朝鮮,外交,宗属関係,朝鮮政治外交史,近代東アジア国際関係,朝鮮外交,国際関係,,,,,,,,,,,,,,,,,,,,,,,,,,,,,,,,,,,,,,,,,
19K13373,成蹊大学,久保 茉莉子,戦時中国における刑事裁判の実態,中国・台湾各地の公文書館に所蔵される刑事訴訟関連文書を用いて、戦時（1930年代後半～1940年代前半）の中国における裁判の実態を明らかにする。,若手研究,小区分03030:アジア史およびアフリカ史関連,中国法,近現代,日中戦争,法学,戦時法,法学者,法学雑誌,中国法学,戦時,刑事裁判,刑法,刑事訴訟法,中国近現代史,中華民国,第二次世界大戦,中華人民共和国,法学専門雑誌,法律家,中国,刑事,裁判,法,,,,,,,,,,,,,,,,,,,,,,,,,,,,,,,,,,
