awardnumber,organization,name,title,abstract,section,review_section,keyword1,keyword2,keyword3,keyword4,keyword5,keyword6,keyword7,keyword8,keyword9,keyword10,keyword11,keyword12,keyword13,keyword14,keyword15,keyword16,keyword17,keyword18,keyword19,keyword20,keyword21,keyword22,keyword23,keyword24,keyword25,keyword26,keyword27,keyword28,keyword29,keyword30,keyword31,keyword32,keyword33,keyword34,keyword35,keyword36,keyword37,keyword38,keyword39,keyword40,keyword41,keyword42,keyword43,keyword44,keyword45,keyword46,keyword47,keyword48,keyword49,keyword50,keyword51,keyword52,keyword53,keyword54,keyword55,keyword56
20K13196,お茶の水女子大学,佐々木 満実,法的家族の成立要件にみる国家支配―秦代・漢初の家族制度の復元を通して,本研究は、秦代から漢初にかけての「家族」の成立と国家支配との関係を解明しようとするものである。その方法として、簡牘（竹簡・木牘）資料に散見する家族関連の制度を収集・分析し、時代ごとの「家族制度」を体系的に復元する。制度とは施行する国家の支配意識や現実的要請を反映するものであり、そこから各時代の国家がいかなる「家族」を創出しようとしていたのかを明らかにできると考えるためである。家族制度の復元と考察から、家族の成立と国家支配との関係を解明していきたい。,若手研究,小区分03030:アジア史およびアフリカ史関連,秦漢史,家族史,法制史,簡牘資料,中国史,,,,,,,,,,,,,,,,,,,,,,,,,,,,,,,,,,,,,,,,,,,,,,,,,,,
20K13195,お茶の水女子大学,阿部 尚史,"「衰退期」にあるイスラーム聖者廟の生存戦略：18,19世紀のシェイフ・サフィー廟",西アジアのムスリム社会において、近現代にいたるまで、イスラーム神秘主義、聖者、そして教団は、民衆の信仰上のよりどころとして、また時には政治権力とも結びつき、重要な役割を有してきた。教団の廟に関する研究は世界的にも多いが、主として影響力拡大期または安定期に関するものが多い。本研究は、イラン北西部のアルダビールにあるイスラーム聖者廟、シェイフ・サフィー＝アッディーン廟を例にとり、支配王朝という政治権力による庇護を喪失した後の時代に、聖者廟が主体的にどのような生存戦略を実践したのかを分析する。,若手研究,小区分03030:アジア史およびアフリカ史関連,イラン,カージャール朝,シェイフ・サフィー＝アッディーン廟,ムスリム聖者廟,サフィー＝アッディーン廟,アルダビール,タブリーズ,アルダビール文書,ワクフ,サファヴィー朝,イスラーム聖者廟,サフィー＝アッディーン,,,,,,,,,,,,,,,,,,,,,,,,,,,,,,,,,,,,,,,,,,,,
20K13194,筑波大学,岩田 啓介,近世アムド・チベット社会の形成と清朝支配の変容,本研究課題は、漢地（中国本土）・チベット・モンゴル・東トルキスタンの接壌地帯に位置するアムド地方（東北チベット）を対象として、清朝の档案史料（公文書）とチベット語史料を併用し、18世紀後半から19世紀前半のアムド地方における社会の動態を近世チベット社会の形成と位置づけ、清朝の政策と現地社会の動向との相互関係を分析する。そして、18世紀中葉までに形成された多様な文化的背景を持った人間集団を包摂する清朝の帝国支配がどのように変容し、それがアムド地方における近世チベット社会の形成との間でどのような関係にあったのか、その動態を解明することを目的とする。,若手研究,小区分03030:アジア史およびアフリカ史関連,チベット,清朝,アムド,青海モンゴル,交通路,ダライラマ政権,アムド地方,交通,ツァイダム盆地,ラクダ,档案,牧地,青海,乾隆帝,チベット仏教,,,,,,,,,,,,,,,,,,,,,,,,,,,,,,,,,,,,,,,,,
20K13193,東京大学,大塚 修,イスラーム時代西アジアにおけるイラン概念の復活と変容,「イラン」とは何か。これこそが本研究課題の核心をなす学術的問いである。意外なことに、この言葉が国号として採用されて100年にも満たない。それ以前には、この言葉に込められた意味やそれが指し示す地理的範囲は歴史的に大きな変貌を遂げてきていた。本研究では、歴史書や地理書、そして、地図などを網羅的に収集・分析することで、前イスラーム時代に起源を持つ「イラン」という語が、イスラーム時代に、どのような形で地理的概念として使用されるようになり、それが後に政治的概念として利用されるに至るまで発展を遂げていくのか、について通時的に明らかにする。,若手研究,小区分03030:アジア史およびアフリカ史関連,イラン,歴史書,写本,『オルジェイトゥ史』,ラシード・アッディーン,イルハーン朝,セルジューク朝,スルターン,地理書,カーシャーニー,ハムド・アッラー・ムスタウフィー,写本研究,ハムドッラー・モストウフィー,ティムール朝,イスラーム,,,,,,,,,,,,,,,,,,,,,,,,,,,,,,,,,,,,,,,,,
21K13127,独立行政法人国立文化財機構奈良文化財研究所,畑野 吉則,中国古代簡牘における規範字体算定の基礎的研究,本研究は、秦始皇帝の統一事業における「文字の規範化」について、その程度や度合いといったような、従来の文献史学や簡牘学では考察の対象とすることができなかった領域に対して、出土簡牘資料に記された実際の筆跡を数値化する分析アプローチを確立し、新たな角度から検証を加えるものである。,若手研究,小区分03030:アジア史およびアフリカ史関連,中国古代史,簡牘学,古文書学,文書行政,筆跡,複合文書,文書処理,里耶秦簡,中国古代,簡牘,文字文化,規範,漢字字体,,,,,,,,,,,,,,,,,,,,,,,,,,,,,,,,,,,,,,,,,,,
21K13126,桃山学院大学,辻 高広,清末の釐金徴収と地方財政,本研究は流通税である釐金の徴収を題材とし、中国清朝末期における内陸地域と沿海地域との経済的関係について再検討することを目的とする。本研究の方法と到達目標は以下の通りである。,若手研究,小区分03030:アジア史およびアフリカ史関連,閙糧,抗糧,升科,釐金,抗捐,閙捐,『申報』,統捐,申報,官報,江西,釐ソウ,,,,,,,,,,,,,,,,,,,,,,,,,,,,,,,,,,,,,,,,,,,,
21K13125,立命館大学,成田 千尋,戦後沖縄保守勢力の形成と経済・通商構想,本研究の目的は、①米軍統治下の沖縄の保守勢力の形成過程、②同時期の沖縄の韓国、中華民国との経済・通商関係に焦点を当て、日米沖関係や革新勢力の動向を中心に検討が進められてきた当該時期の沖縄の政治状況を、より立体的に解明することである。史料としては、十分に活用が進んでいないUSCAR文書、琉球政府文書や、韓国、中華民国の一次史料を使用する。このことにより、冷戦期の沖縄の政治状況及び東アジアの国際関係史の発展に貢献することを目指す。,若手研究,小区分03030:アジア史およびアフリカ史関連,沖縄,韓国,中華民国,冷戦体制,東アジア,米穀輸出,沖縄返還,経済関係,朝鮮戦争,保守政党,経済界,戦後政治史,,,,,,,,,,,,,,,,,,,,,,,,,,,,,,,,,,,,,,,,,,,,
21K13124,同志社大学,土肥 歩,在華プロテスタント宣教師の太平天国認識,本研究は、上帝会の武装蜂起（1851年）から太平天国の滅亡（1864年）に至るまで、プロテスタント宣教師（以下、宣教師と表記）が太平天国に対する認識をどのように変化させたかを描く。本研究は、これまで断片的にしか扱われてこなかった宣教師の視点から、太平天国の興亡を長期的に俯瞰しようとする試みである。,若手研究,小区分03030:アジア史およびアフリカ史関連,宣教師,プロテスタント,史料,太平天国,広西省,辛亥革命,地域社会,広東,キリスト教,広東省,,,,,,,,,,,,,,,,,,,,,,,,,,,,,,,,,,,,,,,,,,,,,,
21K13123,大谷大学,濱野 亮介,中国近世における儒・仏・道三教の死者儀礼と明朝宗教政策との関連について,"中国社会における死者に対する儀礼は,主に儒・仏・道教の所謂「三教」によって行われた。その中で,宋代以降においてはそれらの死者儀礼の中での孤魂（無縁仏）に対する儀礼の重要性が高まり，明代には，「祭厲」と呼ばれる国家制度として取り入れられるまでに至った。",若手研究,小区分03030:アジア史およびアフリカ史関連,明代,瑜伽宗,葬送儀礼,仏教儀礼,道教儀礼,三教,瑜伽集要焔口施食儀,朱元璋,死者,孤魂,祭祀,儀礼,儒教,仏教,道教,中国,宗教,,,,,,,,,,,,,,,,,,,,,,,,,,,,,,,,,,,,,,,
21K13122,学習院大学,莊 卓燐,秦漢時代の国家支配における亭の役割-交通検問機構としての側面を中心に-,本研究の目的は、秦漢時代の国家支配における亭の役割を考察し、「交通」の視点から秦漢帝国の「権力構造」を解明することである。秦漢帝国の権力構造はこれまで、西嶋定生・増淵龍夫・木村正雄などの研究において、皇帝と臣民の間にあった人格的な結合関係や、小農民が国家の生産機構に対する依存が明らかにされてきたが、「交通」に関しては周辺的な出来事として記述されるだけだった。本研究課題では、国家支配の末端である「亭」という施設に注目し、亭がつかさどる「符」という通行証を検閲する機能を媒介として、「交通」という視点から秦漢帝国の「権力構造」の解明を目指す。,若手研究,小区分03030:アジア史およびアフリカ史関連,質日,簡牘,交通,亭,秦漢史,奏ゲン書,簡牘史料,符,律令,中国史,古代の交通,国家構造,中国古代史,簡牘資料,,,,,,,,,,,,,,,,,,,,,,,,,,,,,,,,,,,,,,,,,,
21K13121,長崎大学,岩本 佳子,オスマン朝とトルコにおける遊牧民イメージと対遊牧民政策の連関性の歴史学的研究,オスマン朝の公文書史料、新聞、学術および一般雑誌などの定期刊行物の分析を、本研究の中心とする。現代トルコにおける遊牧民に対する表象やその活用の分析を補助線とし、17世紀末以降のオスマン朝における,若手研究,小区分03030:アジア史およびアフリカ史関連,遊牧民,オスマン帝国,トルコ共和国,定住化,言説,エルトゥールル,ハミト期,,,,,,,,,,,,,,,,,,,,,,,,,,,,,,,,,,,,,,,,,,,,,,,,,
21K13120,大阪大学,阿路思,前近代東部内モンゴル地域支配秩序の変容：官吏の職能に対する考察を中心に,本研究は、地方社会における官吏の活動をめぐる人的結合のメカニズムの考察を通して、前近代東部内モンゴル地域支配秩序の変容を明らかにするものである。前近代遊牧社会における属人支配構造および社会の分配システムは、農地化以降も基本的に継承され、モンゴル人農耕社会は、遊牧社会の構造的特徴を有する。本研究は、前近代内モンゴル末端社会内部の支配秩序を系統的に考察する必要性から、農地化されなかった「伝統的」遊牧社会の官吏と地域の支配秩序を分析し、農地化による官吏制度および地域支配秩序がいかに変化したかを明らかにする。,若手研究,小区分03030:アジア史およびアフリカ史関連,内モンゴル,札薩克衙門档案資料,清朝,遊牧地域社会史」,内モンゴル近現代史,官僚制,遊牧地域社会史,近代,支配秩序,官吏,,,,,,,,,,,,,,,,,,,,,,,,,,,,,,,,,,,,,,,,,,,,,,
21K13119,大阪大学,西田 祐子,唐代史研究史料としての『新唐書』志の研究,『新唐書』とは，宋代に編纂された中国の正史であり，唐代史研究の基本史料の一つである。従来，唐代史研究の分野では，ほぼ無条件でこの書物が使用されてきた。しかし実際には，この書物のテキストは編纂により多くの問題を生んでおり，歴史学の論証に使用できない部分が含まれることを応募者はこれまでに明らかにした。,若手研究,小区分03030:アジア史およびアフリカ史関連,唐代史,唐帝国,『新唐書』,史料批判,正史,羈縻,志,新唐書,編纂史料,北宋,,,,,,,,,,,,,,,,,,,,,,,,,,,,,,,,,,,,,,,,,,,,,,
21K13118,京都大学,北澤 直宏,20世紀ベトナム演劇の歴史研究,本研究は、ベトナムの伝統劇に着目し、その伝播と受容の歴史を明らかにするものである。分析対象とするのは、20世紀初頭に同国南部で誕生した、カイルオンと呼ばれる歌舞劇である。これは「改良」を意味する漢語由来の言葉であり、ベトナムと歴史的関係が深い中国の戯曲に、宗主国であるフランスの話劇を取り入れた、当時最先端の娯楽であった。今日、伝統文化の1つに数えられるカイルオンは、いかに形作られ、どのような変化を余儀なくされて来たのか。カイルオンの実態と、それを取り巻く政策の変遷を明らかにすることで、文化面からベトナム近現代史を捉え直す。,若手研究,小区分03030:アジア史およびアフリカ史関連,ベトナム,伝統文化,文化政策,演劇,近現代史,,,,,,,,,,,,,,,,,,,,,,,,,,,,,,,,,,,,,,,,,,,,,,,,,,,
21K13117,金沢大学,肥後 時尚,古代エジプトの「二柱のマアト」の実体解明－「死者の書」を手掛かりにして－,本研究は、古代エジプト文化の根底にあるマアトの概念の特殊な神格化である「二柱のマアト」の実体を古代エジプト史の後半期（紀元前16世紀～紀元後4世紀）の史資料から解明するものである。,若手研究,小区分03030:アジア史およびアフリカ史関連,「二柱のマアト」,『死者の書』,「死者の審判」,冥界,「無罪の宣言」,「死者の裁判」,古代エジプト史,宗教史,文化史,マアト,死者の書,,,,,,,,,,,,,,,,,,,,,,,,,,,,,,,,,,,,,,,,,,,,,
21K13116,独立行政法人日本貿易振興機構アジア経済研究所,上田 朋広,南アフリカにおけるズールー・エスニシティの変容：人種隔離から排外主義へ,本研究の目的は、19世紀後半の人種隔離形成期から現在に至るまでのズールー・エスニシティの変容の過程を（1）農村と都市におけるズールー王家の影響力と（2）書き言葉・話し言葉としてのズールー語の歴史という二つの観点から分析することで、ズールー・エスニシティの境界の広がりと排外性を解明することである。本研究はズールー語で書かれた歴史書・小説、及びズールー語新聞を史料として用いることで、主として英語史料のみに依拠して描かれてきたズールー・エスニシティの形成・変容をズールー語話者の視点から捉え直すことを目指す。,若手研究,小区分03030:アジア史およびアフリカ史関連,ズールー語,南アフリカ,移民排斥,ヨハネスブルク,アパルトヘイト,都市と農村,クワズールー・ナタール,,,,,,,,,,,,,,,,,,,,,,,,,,,,,,,,,,,,,,,,,,,,,,,,,
21K13115,東京大学,板橋 暁子,魏晋南北朝隋唐時代における婚姻規範と実践,本研究は、魏晋南北朝隋唐時代における婚姻実践とその背景、後の時代や他地域への影響を、規範と反規範という観点から明らかにすることをめざす。レヴィレート婚をはじめとする反儒教倫理的な婚姻や家族形成の実例が史料上に多出するように、魏晋南北朝隋唐時代の婚姻規範と実践は非中国的性格が強いとされるが、それらはいかなる歴史的経緯のもとで社会的に容認・要請されていたか、中国史全体の展開にどのように位置づけられるか、また、古代日本や朝鮮半島諸国の法制と実態にいかなる影響を及ぼしたかを検討する。,若手研究,小区分03030:アジア史およびアフリカ史関連,魏晋,五胡十六国,南北朝,隋唐,妻妾,嫡庶,レヴィレート婚,ジェンダー,婚姻,礼法,ジェンダー史,以妾爲妻,以妻爲妾,貞節,魏晋南北朝,中国史,,,,,,,,,,,,,,,,,,,,,,,,,,,,,,,,,,,,,,,,
21K13114,東京大学,前野 清太朗,植民地移行期台湾における水利「旧慣」の連続性と非連続性に関する研究,本研究では植民地台湾の水利をめぐる制度史的研究と、対比的な2事例の地域史的分析を組み合わせて行う。研究資料としては日本統治期の公文書群に残る水利関係の旧慣調査書等を中心に用い、一部清朝統治期の資料を用いる。資料からまず清朝から統治を引き継いだ日本の植民地当局が各地の水利慣行を「旧慣」として統合していったプロセスの制度史的分析を行う。ついで2事例地域を対象に1870年代から1910年代にかけての水利施設管理の形態の変遷とそれに関与した人員の変動を分析して比較する。分析をふまえ「植民以前」の台湾のローカルな社会関係が「植民以後」の体制下へいかに受け継がれ、ないし変容・再編を経験したかを検証する。,若手研究,小区分03030:アジア史およびアフリカ史関連,地域社会,台湾,旧慣・慣習法,植民地統治,台湾総督府,水利,親族集団,植民地社会史,地域エリート,植民地台湾,農村リーダー,社会史,,,,,,,,,,,,,,,,,,,,,,,,,,,,,,,,,,,,,,,,,,,,
21K13113,東北大学,堀内 香里,18－20世紀初頭のモンゴルにおけるジェンダー秩序の解明,前近代から今日にかけてモンゴル社会のジェンダー秩序がどのような変化／不変化を見せたのかを描き出すには、各時代のそれを明らかにすることが必須である。しかしながら、社会主義期以降を対象とした研究は既に着手されているのに対して、それより前の時代については実証的な研究がほぼ皆無である。従って、まずはアーカイブ史料の豊富な清代から社会主義に入る直前のボクト政権期までの間を対象にモンゴルのジェンダー秩序を早急に明らかにし、そのうえで他時代の既存研究との比較を通してモンゴル社会におけるジェンダー秩序の変容を明らかにし、ジェンダーが当該社会全体の構造を如何に規定してきたのかを考察する。,若手研究,小区分03030:アジア史およびアフリカ史関連,モンゴル史,近世内陸アジア史,ジェンダー史,家族史,モンゴル,清朝時代,ハルハ,遊牧民社会,ボクト政権,ジェンダー,ボクト政権期,アジア史,清代,,,,,,,,,,,,,,,,,,,,,,,,,,,,,,,,,,,,,,,,,,,
22K13225,独立行政法人日本貿易振興機構アジア経済研究所,植田 暁,ロシア帝国領中央アジアにおける植民地統治と匪賊,本研究の目的は、ロシア帝国統治期中央アジアの匪賊の活動を郷レベルの権力との関係に注目して検討し、植民地統治の特徴と限界を明らかにすることである。小規模な匪賊の活動に注目し、大規模反乱のなかった期間を含めて通時的な分析を実施する。対象地域としてロシア帝国領中央アジア全体を視野に納め、対象時期は植民地化の確立した19世紀後半からバスマチ運動の沈静化した1920年代までとする。併せて、バスマチ運動などを含めた匪賊が歴史表象としてどのように変遷してきたかを文学等における表象を含めて調査する。,若手研究,小区分03030:アジア史およびアフリカ史関連,中央アジア,匪賊,反乱,ロシア帝国,植民地統治,,,,,,,,,,,,,,,,,,,,,,,,,,,,,,,,,,,,,,,,,,,,,,,,,,,
22K13224,駿河台大学,福島 大我,基層社会の動態把握による新たな秦漢史像の提示―集落の内と外と周縁と,睡虎地秦簡・張家山漢簡・嶽麓秦簡などの簡牘史料には、統一秦から前漢初期の法律関連文書が含まれる。ここからは、国家の支配から抜け落ちた人々や逃れた人々が、山地や沼沢（集落外部）に居住し、農耕のみに拠らず生存していた様子がうかがえる。また、一般農民とは位相の異なる刑徒やアウトローが、集落の周縁に存在していたことも読み取れる。これらの人々は、集落から完全に独立して生活していたわけではない。本研究では、新出の簡牘史料から、集落の内・外・周縁の間での人や物の移動、経済的・心情的な関係性などの動態を把握し、中国古代の基層社会の多様な実相と、その社会の統合を図る国家の性格を明らかにする。,若手研究,小区分03030:アジア史およびアフリカ史関連,中国古代,秦漢,簡牘,国家,社会構造,,,,,,,,,,,,,,,,,,,,,,,,,,,,,,,,,,,,,,,,,,,,,,,,,,,
22K13223,京都府立大学,井上 直樹,百済における将軍号受容と官位制―古代東アジア世界の史的動向解明のための基礎的研究,本研究では、6世紀の百済における中国将軍号の受容とその意義ならびに官位制による百済独自の支配体制構築過程を解明することによって、百済の史的展開過程だけでなく、百済の事例を通して、その背後にある中国皇帝を頂点とした古代東アジア世界の史的動向の一端の解明を目指す。,若手研究,小区分03030:アジア史およびアフリカ史関連,百済,中国将軍号,官位制,古代東アジア世界,冊封関係,将軍号,古代東アジア,『武寧王墓誌』,,,,,,,,,,,,,,,,,,,,,,,,,,,,,,,,,,,,,,,,,,,,,,,,
22K13222,釧路公立大学,岩本 真利絵,明代後期における「祖制」の誕生と定着―政治史の動向と関連して―,中国明王朝の歴代皇帝・官僚にとって、祖先が定めた制度、すなわち「祖制」は、君臣両者の行動範囲を拘束する規範を形成していた。ただし、「祖制」は古くから存在した言葉ではなく、明代後期から恒常的に使われるようになった。祖先が定めた制度を表す新たな政治用語の誕生をもたらした明代後期の政治環境や政治議論の変化は明らかにされていない。,若手研究,小区分03030:アジア史およびアフリカ史関連,明代,嘉靖,祖制,洪武帝,礼制改革,中国,皇帝,政治,嘉靖帝,張居正,,,,,,,,,,,,,,,,,,,,,,,,,,,,,,,,,,,,,,,,,,,,,,
22K13221,琉球大学,中村 春菜,帝国崩壊後の台湾にできた幻の学校―沖縄人子弟への教育をめぐる記憶の掘り起こし,日本の敗戦に伴い、多くのシステムが刷新された。「教育」もその一つである。,若手研究,小区分03030:アジア史およびアフリカ史関連,台湾引揚,沖縄籍民調査書,スタンフォード大学,フーバー研究所,戦後教育,引揚港,台湾疎開,久場崎,学童疎開,教育,沖縄,地域史,オーラルヒストリー,沖縄同郷会連合会,難民,,,,,,,,,,,,,,,,,,,,,,,,,,,,,,,,,,,,,,,,,
22K13220,大阪大学,岡野 翔太,閉じていく日本帝国と台湾：「華僑」概念の再検討を通して,在日台湾人に関する研究は、これまで在日華僑研究の枠組みで議論されてきた。その在日華僑研究はまた「二つの中国」による歴史認識の提示と深く関わりながら進展した。こうした日本居住の華僑を考える際に重要なこととして、台湾の存在をいかに捉えるのかという問題がある。なぜならば旧植民地出身の在日台湾人を「華僑」と呼ぶことそれ自体、植民地期から戦後日本という在日台湾人が経験した変化を象徴するものだからである。それは戦後日本の植民地の忘却と表裏一帯の関係にあった。,若手研究,小区分03030:アジア史およびアフリカ史関連,華僑,東アジア,日本,台湾,台僑,歴史認識,中華民国,,,,,,,,,,,,,,,,,,,,,,,,,,,,,,,,,,,,,,,,,,,,,,,,,
