awardnumber,organization,name,title,abstract,section,review_section,keyword1,keyword2,keyword3,keyword4,keyword5,keyword6,keyword7,keyword8,keyword9,keyword10,keyword11,keyword12,keyword13,keyword14,keyword15,keyword16,keyword17,keyword18,keyword19,keyword20,keyword21,keyword22,keyword23,keyword24,keyword25,keyword26,keyword27,keyword28,keyword29,keyword30,keyword31,keyword32,keyword33,keyword34,keyword35,keyword36,keyword37,keyword38,keyword39,keyword40,keyword41,keyword42,keyword43,keyword44,keyword45,keyword46,keyword47,keyword48,keyword49,keyword50,keyword51,keyword52,keyword53,keyword54,keyword55,keyword56
19K13372,駒澤大学,澤田 望,計量テキスト分析を用いた英領ナイジェリア新聞の世界報道に関する研究,本研究は、アフリカからみた世界史を記述する際に有用な新聞史料の分析手法を探求するものである。その一端を明らかにするために、英領ナイジェリアで出版された英字新聞における外部世界報道の諸相に注目し、従来用いられてきた質的手法に加えて、計量テキスト分析による通時的な分析を試み、その可能性と留意点を検討する。英領西アフリカの出版公共圏が拡大したと指摘される1880年から1940年において、ナイジェリア新聞が描いた世界もまた広がりを見せたのであろうか。本研究によって、アフリカ出版文化史学界に新たな手法を提示するための基礎研究を行う。,若手研究,小区分03030:アジア史およびアフリカ史関連,アフリカ,ナイジェリア,新聞,デジタル・ヒューマニティーズ,テキストマイニング,計量テキスト分析,メディア,歴史,世界,,,,,,,,,,,,,,,,,,,,,,,,,,,,,,,,,,,,,,,,,,,,,,,
19K13371,学習院大学,植田 喜兵成智,墓誌史料よりみた7・8世紀の新羅・唐の人的交流の実態,本研究の目的は、7・8世紀にかけて朝鮮および中国の両地域で活動した人物の墓誌を分析することで、古代東アジアにおける両国間の人的交流の実態を追究することである。,若手研究,小区分03030:アジア史およびアフリカ史関連,東アジア,金石文,墓誌,朝鮮,中国,新羅,唐,古代,,,,,,,,,,,,,,,,,,,,,,,,,,,,,,,,,,,,,,,,,,,,,,,,
19K13370,獨協大学,小宮 秀陵,現代韓国における東洋史学の再編と東アジア論の形成,歴史学において東アジア論は、歴史の共有という目標の下で進展したが、いまだに日韓両国で東アジア論の異同は対話がなされていない。その前提的作業として韓国の東アジア論の研究史および思想的・社会的特色の検討が必要である。,若手研究,小区分03030:アジア史およびアフリカ史関連,東アジア,ナラティブ,冷戦,朝貢・冊封,国史,東北工程,歴史認識論争,史学史,韓国史,東亜,韓国学,近代化,東洋史,東アジア史,集合的記憶,オーラルヒストリー,,,,,,,,,,,,,,,,,,,,,,,,,,,,,,,,,,,,,,,,
19K13369,明治大学,鈴木 開,新出史料『吏文謄録』を利用した朝鮮燕行使の基礎的研究,本研究は、豊臣秀吉の朝鮮侵略後の朝鮮王朝と明朝中国の関係を具体的に知ることのできる新史料『吏文謄録』に対する基礎的研究である。本史料には膨大な数の外交文書が収録されているが、この時期の朝鮮と明、双方の事情があまり知られていなかったこともあって、その史料的価値が十分に認識されているとはいえない。そこで、『吏文謄録』所収文書のうち、特に朝鮮から明に派遣された燕行使に関係する文書や、漂流民の送還に関係する文書の分析を行い、当時の朝明関係の具体像を明らかにする。,若手研究,小区分03030:アジア史およびアフリカ史関連,壬辰戦争,燕行使,吏文謄録,事大文軌,朝鮮王朝,明,外交,明清交替,燕行録,清,,,,,,,,,,,,,,,,,,,,,,,,,,,,,,,,,,,,,,,,,,,,,,
19K13368,大阪大学,伊藤 一馬,北宋軍事基盤と西北「辺境軍事社会」の東部ユーラシア世界における歴史的意義,本研究は，文治主義・中央集権を推進したと広く認知される北宋王朝（960～1127年）における軍事や“武”の意義を，北宋を取り巻く国際情勢とその変動にともなう軍事情勢の中で北宋を支えた軍事的基盤がいかなるものであったか解明することで再評価することを目指すものである。,若手研究,小区分03030:アジア史およびアフリカ史関連,北宋,辺境軍事社会,西兵,経略安撫使体制,東部ユーラシア,蕃兵,石窟題記銘文,「宋西北辺境軍政文書」,宋夏戦争,将門,宋西北辺境軍政文書,軍事基盤,,,,,,,,,,,,,,,,,,,,,,,,,,,,,,,,,,,,,,,,,,,,
19K13367,大阪大学,日向 伸介,外交史料からみる近代タイの文化政策： 絶対王制期を中心として,本研究は、近代タイの文化政策史を、対外関係を視野に含めて再検討するものである。とくに、近現代における文化政策の原型が確立された絶対王制期（19世紀後半～1932年）の対フランス・イギリス関係と、その影響を最も強く受けたと考えられる文化財行政に着目する。当該分野においては、これまではおもに王権とナショナリズム、さらにお雇い外国人の果たした役割などについて、国内的な要因に比重を置いた研究が蓄積されてきた。,若手研究,小区分03030:アジア史およびアフリカ史関連,タイ,文化政策,外交関係,イギリス,フランス,日本,ダムロン親王,プリッサダーン親王,外交史,,,,,,,,,,,,,,,,,,,,,,,,,,,,,,,,,,,,,,,,,,,,,,,
19K13366,防衛大学校(総合教育学群、人文社会科学群、応用科学群、電気情報学群及びシステム工学群),岡田 雅志,近世から現代までの東南アジア山地民の移動が国家にもたらした影響に関する研究,本研究は，近世～現代の東南アジア山地民の地域間移動が，関係諸国家に与えた影響を明らかにすることを目的とする。,若手研究,小区分03030:アジア史およびアフリカ史関連,移民,ラオス,国家,ベトナム,山地世界,タイ,フランス,アメリカ,山地民,越境,移住,ネーション形成,難民,東南アジア,タイ族,インドシナ,移動,,,,,,,,,,,,,,,,,,,,,,,,,,,,,,,,,,,,,,,
19K13365,新潟大学,川西 裕也,朝鮮時代の古文書の様式論的研究,本研究では、朝鮮時代（14～19世紀）の古文書の様式、とくに①年号表記の実態、②捺印の方式、③サイン（署名・花押）のメカニズムを解明することを目的とする。調査の対象となるのは、主として韓国の研究機関や図書館に所蔵されている古文書である。データベースや資料集に掲載されていない古文書については、所蔵機関を訪問して原物調査を行う。収集した古文書の内容分析には、年代記・法典類・文集類を利用する。,若手研究,小区分03030:アジア史およびアフリカ史関連,古文書,壬辰戦争,高麗,朝鮮王朝,アーカイブズ,東洋史,歴史学,朝鮮史,古文書学,文禄慶長の役,様式論,朝鮮,様式,,,,,,,,,,,,,,,,,,,,,,,,,,,,,,,,,,,,,,,,,,,
19K13364,東京大学,野口 舞子,マグリブのアラブ化に伴う社会統合の再検討：初期イスラーム史構築に向けた比較分析,リビア以西の北アフリカ（マグリブ）地域では、7世紀中葉以降、アラブ人勢力の進出によってイスラーム時代を迎え、宗教的・政治的変動が生じた。その実態は、イスラームの受容、征服者・移住者であるアラブ人の言語や文化の混淆、在地のベルベル人社会の存続といった様々な現象を含み、その進展速度や水準も各地で異なっていた。本研究ではイスラーム到来後の社会変容と統合の過程における「アラブ化」という現象に着目し、アラビア語年代記や地理書、旅行記といった叙述史料を用いて、7世紀後半から13世紀前半までのマグリブ地域におけるアラブ人とベルベル人の人口動態と勢力間交渉を、地域間の異同とそれが生じた原因から解明する。,若手研究,小区分03030:アジア史およびアフリカ史関連,ベルベル,ウラマー,イブン・ハルドゥーン,バラウィー,旅行記,リフラ,アンダルス,マグリブ,イスラーム化,アラブ化,ベルベル語,アラビア語,ムワッヒド朝,,,,,,,,,,,,,,,,,,,,,,,,,,,,,,,,,,,,,,,,,,,
19K13363,東京大学,宮本 隆史,監獄のアーカイブ形成と歴史認識－近代のアジアにおける英領植民地と日本を事例として,近代のアジアにおけるイギリス領植民地と日本の監獄の歴史を事例とし、歴史的情報の集積としての「アーカイブ」がいかに形成され変化しネットワーク化されてきたのか、そしていかなる歴史の叙述が生産されてきたのかを分析する。両地域において、近代化の過程で監獄制度が形成された19世紀半ばからの1世紀間の変化を観察する。アーカイブを歴史研究の所与の前提としてとらえるのではなく、アーカイブ自体の変化と歴史叙述の相互作用を、社会・政治・技術的な文脈に置いて考察する。,若手研究,小区分03030:アジア史およびアフリカ史関連,監獄,アーカイブ,歴史認識,歴史叙述,,,,,,,,,,,,,,,,,,,,,,,,,,,,,,,,,,,,,,,,,,,,,,,,,,,,
19K13362,筑波大学,佐野 克司,アッシリア王碑文におけるプロパガンダ,王権は「権威」と「力」の側面から構成されているが、アッシリア学者は長きに渡って前者に研究の焦点を当ててきた。それゆえ、王の存在を正当化たらしめた「権威」にかんする知識は、すでにかなりの程度蓄積されているが、「力」の側面にかんしてはほとんど明らかになっていない、というのが現状である。本研究の目的は、アッシリア王の業績を詳細に記録した「王碑文」において、どのような技術や方法を用いて「強い王」が表象されたのかを体系的に明らかにすることにある。,若手研究,小区分03030:アジア史およびアフリカ史関連,アッシリア王碑文,アッシリア学,プロパガンダ,王碑文,アッシリア王碑文研究,,,,,,,,,,,,,,,,,,,,,,,,,,,,,,,,,,,,,,,,,,,,,,,,,,,
19K13361,中央大学,渡井 葉子,新バビロニア時代における女性の社会経済的役割,本研究では、紀元前7世紀から4世紀末（新バビロニア時代・アケメネス朝時代）のバビロニアにおける楔形文字文書史料、特に私的文書・行政経済文書・書簡といった実生活に関わる文書に登場する、様々な身分・立場の女性たちが、社会・家庭においてどのような権利・自由を持ち、どのような活動を行い、どのような経済的役割を果たしていたのかについて体系的に研究する。また、文書に登場する数千人におよぶ女性を網羅するデータベースを作成し、オンライン上での公開を目指す。,若手研究,小区分03030:アジア史およびアフリカ史関連,アッシリア学,楔形文字学,バビロニア,女性史,ジェンダー史,社会経済史,新バビロニア時代,アケメネス朝ペルシア,女性,ジェンダー,メソポタミア,社会経済,西アジア,楔形文字,プロソポグラフィー,アケメネス朝,,,,,,,,,,,,,,,,,,,,,,,,,,,,,,,,,,,,,,,,
20K13209,名城大学,石原 聖子,感情史的アプローチによる中国北朝墓誌の分析と文化的社会集団の復元,北朝墓誌には被葬者の官歴・事績等が記されるが、実はこの項目より、銘辞という韻文形式の文学的修辞に多くの文字数が使われている。本研究では、従来の歴史学研究において全くと言ってよいほど注意が払われてこなかった墓誌の銘辞部分を検討することにより、北朝墓誌の銘辞部分の用語法の社会集団ごとの偏差によって、悲しみを共有する多様な社会集団の存在を復元するとともに、その文化的影響関係を解明する。,若手研究,小区分03030:アジア史およびアフリカ史関連,テキストマイニング,北魏,墓誌,石刻資料,感情史,社会集団,,,,,,,,,,,,,,,,,,,,,,,,,,,,,,,,,,,,,,,,,,,,,,,,,,
20K13208,中部大学,朱 琳,多領域をむすぶ日本知識人の中国認識の形成――中国文学研究会同人の戦後,「中国文学研究会(1934-1958)」は、戦前から戦後にかけてほぼ継続して同時代の中国文化に注目した学術団体である。本研究は、この中国文学研究会を介して、戦争を境として発生した日本における「中国認識の分裂」という現象に注目し、民間知識人の中国認識の潮流がどのような分裂・変容を見せたのか。その動態をこれまでにない詳細なレベルで分析したい。またその目的達成のため、明確化の障壁となっていた狭い領域での拘泥を排除し、近年公開された資料から浮かび上がった新たな動向を積極的に取り入れ、多角的・実証的に解析したい。,若手研究,小区分03030:アジア史およびアフリカ史関連,中国現代文学,近代化論,パール・バック,岡崎俊夫,竹内好,鶴見和子,戦後知識人の民衆観,中国近代文学の受容,丁玲,趙樹理,武田泰淳,松枝茂夫,翻訳,脈絡転換,文化触変論,中国文学研究会,近代日本の中国文学受容史,中国認識,近代中国文学受容史,,,,,,,,,,,,,,,,,,,,,,,,,,,,,,,,,,,,,
20K13207,金沢学院大学,佐々木 聡,〈発病占〉についての社会史的研究：近世以降を中心に,本研究は近世の発病占について、（1）中国の古書市場にある発病占書の収集および整理・研究、（2）国内外の研究機関が所蔵する発病占文献（発病占を含む術数文献や暦書等）の調査・研究、（3）台湾・香港等における発病占および関連史料の調査、の三点から研究を進める。特に清末以降に単行本として流布した発病占書をはじめ、近世の発病占をめぐる史料群が中国で等閑視されている状況を踏まえ、斯界の研究者にその史料的価値と意義、さらに保全の必要性を提起してゆく。,若手研究,小区分03030:アジア史およびアフリカ史関連,発病占,通俗信仰,鬼神,民間医療,術数,甲馬子（紙）,道教,辟邪,占術文化,,,,,,,,,,,,,,,,,,,,,,,,,,,,,,,,,,,,,,,,,,,,,,,
20K13206,早稲田大学,小野 亮介,「ウザクバイ」対「ウズベクのゾルゲ」：1930年代日本の中央アジア進出を巡る攻防,本研究は、ロシア革命後にトルキスタン（現在の中央アジア）から亡命したテュルク系の人々の機関誌・書簡や日本の外交史料の検討、インタビュー調査など通じ、1930年代にアフガニスタンからソ連の後背地たる中央アジアへの進出を狙った日本の対ソ戦略とその破綻をユーラシア規模の視点から考察することを目的とする。,若手研究,小区分03030:アジア史およびアフリカ史関連,トルキスタン,新疆,中央アジア,諜報,亡命者,シベリア出兵,カザフ,東トルキスタン共和国,インテリジェンス,プロパガンダ,汎テュルク主義,タタール人,カザフ人,ロシア革命,アラシュ・オルダ,白軍,オスマン帝国,,,,,,,,,,,,,,,,,,,,,,,,,,,,,,,,,,,,,,,
20K13205,明治大学,石野 智大,唐代地方支配制度の新研究,本研究は、唐代の地方行政制度や村落制度の内部構成を究明し、それらを含む地方支配制度の枠組みがどのようなものであったかを、当時の地方官人や雑任などの記録を多く伝える石刻題記を用いて考察する。従来注目されてきた地方官人のみならず、雑任、胥吏、村落内責任者を含めた構成員の内訳・役割・序列を明確にし、その背後にある彼らの多様な結びつきを解き明かしつつ、唐代地方支配制度の実態を描き出すことを試みる。,若手研究,小区分03030:アジア史およびアフリカ史関連,唐朝,地方行政,村落制度,雑任,律令,石刻史料,唐,地方行政制度,基層社会,村落社会,戸籍制度,身分制度,出土文字史料,領域支配,州県制,郷里制,坊村制,,,,,,,,,,,,,,,,,,,,,,,,,,,,,,,,,,,,,,,
20K13204,津田塾大学,光成 歩,多宗教社会とムスリム女性：脱植民地化期のマレー語月刊誌『カラム』の記事分析より,多宗教社会におけるムスリム女性の社会的地位を明らかにするため、1950年から1969年にかけてシンガポールで発行され、マレー・イスラム世界で読まれた月刊誌『カラム』を分析する。20世紀半ばは、社会の近代化にともない女性の社会的地位が流動化した時期であり、雑誌記事の通時的分析により、ムスリム女性が直面していた生活実践上の課題を明らかにするとともに、社会の多宗教的な構成がその動向に及ぼした影響を検討する。,若手研究,小区分03030:アジア史およびアフリカ史関連,イスラム教,シンガポール,マレーシア,イスラム家族法,多宗教社会,雑誌,ムスリム女性,ジェンダー,ムスリム家族法,東南アジア,イスラム,女性,,,,,,,,,,,,,,,,,,,,,,,,,,,,,,,,,,,,,,,,,,,,
20K13203,大阪市立大学,貝原 哲生,イスラーム時代初期（7～8世紀）エジプトにおけるキリスト教諸派の教会組織の分析,451年のカルケドン公会議は、同公会議の決定を支持するカルケドン派とこれを認めない反カルケドン派にキリスト教徒を分断した。,若手研究,小区分03030:アジア史およびアフリカ史関連,イスラーム時代初期,エジプト,教会・修道院,アラブ・ムスリム,カルケドン派,反カルケドン派,カルケドン公会議,教会組織,ビザンツ帝国,,,,,,,,,,,,,,,,,,,,,,,,,,,,,,,,,,,,,,,,,,,,,,,
20K13202,名古屋市立大学,小野 純子,日本統治最末期、台湾先住民の島内軍事動員 ーー『留守名簿』を手掛かりとしてーー,本研究は、1945年に台湾で結成された在台日本軍（台湾軍のちの第10方面軍）、高砂特設警備部隊に焦点をあて、日本軍の先住民動員の実態を解明する。それにより、既往の朝鮮人動員・（漢族系）台湾人動員や高砂義勇隊（＝東南アジアに派遣された先住民）の研究では収まらない、日本植民地動員体制そして植民地・占領地防衛体制の解明を目指す。,若手研究,小区分03030:アジア史およびアフリカ史関連,日本統治期台湾,軍事動員,先住民,特設警備部隊,大戦末期,植民地軍事史,留守名簿,戦場動員,高砂族,,,,,,,,,,,,,,,,,,,,,,,,,,,,,,,,,,,,,,,,,,,,,,,
20K13201,大阪教育大学,井上 岳彦,ロシア帝国における仏教教団と社会事業の相互関係に関する研究,本研究は、ロシア帝国におけるカルムィク人仏教教団の社会事業について、同じチベット仏教徒のブリヤート人社会やムスリム社会（特にタタール人）と比較し、多宗教帝国におけるマイノリティの信仰世界の生成、接触、変容、多様化、さらに帝国外部との相互関係を歴史学的に解明する。仏教徒、キリスト教徒、ムスリムの三者が混住・共存する地域の未公刊史料を利用し、とくに孤児や高齢者の保護、貧民の生活改善などの社会事業に焦点をあて、仏教徒社会がロシア正教徒社会やムスリム社会といかなる関係を構築したのかを分析する。さらに、カルムィク人仏教徒がロシア市民社会や「チベット仏教世界」の公論形成に果たした役割についても考察する。,若手研究,小区分03030:アジア史およびアフリカ史関連,ロシア帝国,チベット仏教,宗教政策,民族政策,社会事業,生態環境,牧畜経済,ボランタリー,カルムィク人,教育,福祉,慈善,保護,ロシア正教,,,,,,,,,,,,,,,,,,,,,,,,,,,,,,,,,,,,,,,,,,
20K13200,京都大学,秋田 朝美,国民政府期のアメリカの経済援助,本研究は、1930年代のアメリカから中国への対物借款が国民政府の経済建設に果たした役割を解明する。特に、1933年の棉麦借款から1939年の桐油借款への連続性に着目し、桐油借款の実施に至る経緯と国民政府およびアメリカ政府の思惑、また、借款締結後の中国経済への具合的な影響を明らかにする。従来、戦間期と戦時期に分けて検討されてきた対物借款の歴史を連続的に分析することで、国民政府の経済政策、およびアメリカの対中経済援助の包括的な理解へとつなげていくことを目指す。,若手研究,小区分03030:アジア史およびアフリカ史関連,借款,国民政府,アメリカ,経済援助,桐油,棉花,1930年代,棉麦借款,中米関係,桐油借款,救済,経済建設,,,,,,,,,,,,,,,,,,,,,,,,,,,,,,,,,,,,,,,,,,,,
20K13199,京都大学,芹澤 隆道,1930年代フィリピンにおける農民運動とコミンテルンの革命運動,1930年代世界恐慌によって大打撃を受けた東南アジア各地の農村では、植民地経済からの解放を求める農民蜂起が頻発していた。さらに当時は東南アジアに共産主義が紹介された時代でもあり、各地に共産党が結成され、コミンテルンの指導によって世界革命を目指された。,若手研究,小区分03030:アジア史およびアフリカ史関連,フィリピン,コミンテルン,農民,共産主義者,ルガスピ,,,,,,,,,,,,,,,,,,,,,,,,,,,,,,,,,,,,,,,,,,,,,,,,,,,
20K13198,京都大学,宮本 亮一,古代中央アジアにおけるフン系集団の研究,4世紀以降の民族大移動期，ユーラシア大陸北方の草原地帯からフンという言葉で総称される集団が中央アジア，さらには南アジアへと侵入した。関連する資料が少なく，またそれらの資料も適切に利用されていないことから，長い研究の歴史にも関わらず，この集団に関しては不明な点が多く残されている。本研究は，イスラーム時代以前の中央アジアに大きな影響を及ぼしたこの集団の詳細な歴史的展開，支配のあり方，内部構造を明らかにし，今後の発展的な学際的研究の基盤を形成することを目的とし，これまでの研究で活用されてこなかった，アラビア語年代記，バクトリア語資料に着目して研究を進める。,若手研究,小区分03030:アジア史およびアフリカ史関連,フン系集団,キダラ,エフタル,アルハン,バクトリア語文書,アラビア語年代記,トハーリスターン,アラビア語年代期,キダーラ,エフタル（アルハン）,,,,,,,,,,,,,,,,,,,,,,,,,,,,,,,,,,,,,,,,,,,,,,
20K13197,お茶の水女子大学,大江 平和,社会事業形成期における児童福祉：北京・上海・南京の孤児院の比較を中心に,本研究では、1920年代の中国における児童福祉について、伝統的な慈善事業から近代的な社会事業への転換という視点から捉える。これまでにない財務状況の分析からその実態を明らかにしようというものである。本研究では、すでに解明した北京における児童福祉の財務状況をふまえて、北京の転換期の状況と、上海・南京における転換期の状況とはどのように異なるのかという課題に迫る。まず上記3都市について、それぞれ転換の実態を整理・分析を行う。そのうえで比較の視点を用いて、その特質と意義を明らかにするとともに、地域の多様性に即した児童福祉のあり方を解明する。,若手研究,小区分03030:アジア史およびアフリカ史関連,中国近代史,中国社会福祉史,中国児童福祉史,中国慈善事業と女性,北京香山慈幼院,熊希齢,慈善事業と女性,児童福祉,中華民国期,慈善事業,社会事業,孤児院,香山慈幼院,中国民国期,,,,,,,,,,,,,,,,,,,,,,,,,,,,,,,,,,,,,,,,,,
