awardnumber,organization,name,title,abstract,section,review_section,keyword1,keyword2,keyword3,keyword4,keyword5,keyword6,keyword7,keyword8,keyword9,keyword10,keyword11,keyword12,keyword13,keyword14,keyword15,keyword16,keyword17,keyword18,keyword19,keyword20,keyword21,keyword22,keyword23,keyword24,keyword25,keyword26,keyword27,keyword28,keyword29,keyword30,keyword31,keyword32,keyword33,keyword34,keyword35,keyword36,keyword37,keyword38,keyword39,keyword40,keyword41,keyword42,keyword43,keyword44,keyword45,keyword46,keyword47,keyword48,keyword49,keyword50,keyword51,keyword52,keyword53,keyword54,keyword55,keyword56
18K04157,株式会社豊田中央研究所,田中 宏哉,車載センサネットワークにおける微弱信号検出技術に関する研究,本研究では、車載センサネットワークの通信感度向上を目的として、干渉信号を用いて確率共鳴現象を発生させ、微弱な信号を検出する手法を提案した。提案手法における確率共鳴現象の発生メカニズムと、提案手法から得られる無線機の受信感度の向上効果を、数値シミュレーションにより明らかにした。受信機の周辺に配置した端末から送られる干渉信号を用いた受信端末の感度向上手法について、振幅変調および位相変調での効果を検証した。その結果、干渉信号の存在により通信容量が増加していることがわかった。これは干渉信号により通信エリアを拡大できることを示唆している。,基盤研究(C),小区分21020:通信工学関連,確率共鳴,通信,無線通信,,,,,,,,,,,,,,,,,,,,,,,,,,,,,,,,,,,,,,,,,,,,,,,,,,,,,
18K04156,国立研究開発法人情報通信研究機構,PHAM TIENDAT,,我々は以下３点の新規技術により、高周波帯における大規模 MIMO (multiple-input multiple-output)無線信号のためのモバイルフロントホールシステムの開発を行った:（i）高周波数利用効率な光無線（radio-over-fiber)システム技術、 (ii)高精度キャリア信号発生技術、(iii)高出力集積フォトディテクター技術。,基盤研究(C),小区分21020:通信工学関連,radio over fiber,mobile fronthaul,mobile network,optical communications,fiber radio,wireless- wired,optical and mobile,Millimeter wave,Signal processing,communication systems,,,,,,,,,,,,,,,,,,,,,,,,,,,,,,,,,,,,,,,,,,,,,,
18K04155,早稲田大学,片山 光亮,無線接続クラスタ型スーパーコンピュータを実現する小型ＲＦフロントエンドの研究,本研究課題は、複数の計算ノードを無線で束ねて計算速度の台数効果を得る。しかしながら十分な台数効果を得るためには、高速な通信を実現するＲＦフロントエンドが必要不可欠である。実際の運用を考慮した場合、ＲＦフロントエンドは小型であることが望ましい。ＲＦフロントエンドの大きさを決めるのは主にアンテナであるため本研究では、クラスタ型スーパーコンピュータに適した放射パタンを持ち高利得、広帯域なスタック構造を持つ八木アンテナをプリント基板上に構成した。この世界最小サイズのスタック八木アンテナを１２の計算ノードに適用し、無線クラスタを構成した場合、１計算ノードに比べて６００％の高速化が確認された。,基盤研究(C),小区分21020:通信工学関連,平面フィルタ,群粒子最適化,プリント基板,ラットレースバラン,八木アンテナ,無線分散コンピューティング,電力分配,エッジモデル,24 GHz,超高速無線通信,計算機クラスタ,超小型低消費電力,RFフロントエンド,,,,,,,,,,,,,,,,,,,,,,,,,,,,,,,,,,,,,,,,,,,
18K04154,法政大学,中野 久松,円偏波放射メタマテリアルラインを基礎とした特性再生可能アンテナの理論構築と実現,"直線偏波を使用した通信系においては，送信アンテナ・受信アンテナの偏波面を合わせる必要がある．他方，円偏波を使用した通信系のアンテナでは，偏波整合を必要としない．このような優位性があるにもかかわらず,「円偏波放射ビーム走査・特性再生可能アンテナ(RecANT)」の実現例は皆無に近い. 本研究では, 円偏波メタアトムから成るRecANTを実現し，その特性を電気磁気学上から系統的に考察している．",基盤研究(C),小区分21020:通信工学関連,アンテナ,円偏波放射,特性再生,特性再生化,円偏波,メタマテリアル,円偏波アンテナ,特性再生可能,放射パターン,再生可能特性,,,,,,,,,,,,,,,,,,,,,,,,,,,,,,,,,,,,,,,,,,,,,,
18K04153,東京理科大学,福地 裕,擬似位相整合高次非線形アレイ導波路による全光コヒーレントシリアルパラレル信号処理,インターネットを支える光通信は、この30年で性能が飛躍的に向上し、今後も高速大容量化が求められています。なぜなら、4K・8K放送やメタバース、動画配信などによって、流通する情報量が爆発的に増えることが明らかだからです。,基盤研究(C),小区分21020:通信工学関連,フォトニックネットワーク,超高速情報処理,先端機能デバイス,光スイッチ,先端的通信,,,,,,,,,,,,,,,,,,,,,,,,,,,,,,,,,,,,,,,,,,,,,,,,,,,
18K04152,東海大学,呂 国偉,,当該研究課題の主な研究成果は以下のとおりです。（a）コヒーレント検出によるサブキャリアマルチキャストおよびデータアグリゲーション。（b）コヒーレント重ね合わせによる低次直交振幅変調（QAM）ツインSSBからの高次QAMサブキャリアの合成。さらに、コヒーレント重ね合わせプロセスにおける不完全な位相回転を補償するために、階層的ブラインド位相推定という独自のアルゴリズムを提案しその実験的検討を行った。コヒーレント検波・直接検波いずれの場合も、合成された高次サブキャリアに対するエラーフリー動作と明確なコンスタレーションが実験的に実証され、本研究で提案するスキームの有用性を裏付けることに成功した。,基盤研究(C),小区分21020:通信工学関連,optical communications,four-wave mixing,nonlinear optics,Four-wave Mixing,Subcarrier Multiplexing,Single-side band signal,Signal Processing,Single-Side Band,Four-wave mixing,Subcarrier multiplexing,Signal processing,Optical Processing,Four-Wave Mixing,Nyquist,,,,,,,,,,,,,,,,,,,,,,,,,,,,,,,,,,,,,,,,,,
18K04151,中央大学,山村 清隆,数理的手法を用いた非線形システムの大域的求解法に関する研究,大規模集積回路をはじめとする非線形システムの解析問題は科学技術における重要かつ難しい問題の一つで、現在でも「解に収束しない」「効率的な解法が存在しない」「実用化が難しい」などの困難が生じている。本研究では、非線形システムの解析問題の中でも特に難しいとされる「解に収束することが理論的に保証された解法」「すべての解を確実に求めることができる解法」などの大域的求解法の分野を対象に、数理的手法（ホモトピー法、線形計画法、整数計画法など）を用いた非線形システムの“効率的で実用的な”大域的求解法の開発を行った。また「連続系の全解探索問題」に「離散系の最適化ソルバー」を適用するという新しい方法論を確立した。,基盤研究(C),小区分21020:通信工学関連,非線形理論・回路,非線形数値解析,大規模集積回路,全解探索,数理計画法,整数計画法,ホモトピー法,区間解析,回路シミュレーション,予測子修正子法,非線形システム,,,,,,,,,,,,,,,,,,,,,,,,,,,,,,,,,,,,,,,,,,,,,
18K04150,専修大学,野村 亮,未知パラメータを含む情報源符号化問題に対する情報スペクトル的アプローチ,本研究課題は，情報源符号化におけるいくつかの重要な問題設定を対象に，確率構造が未知の状況における高効率符号化に関する研究を行うものである.特に本研究ではこれらの問題において誤り確率を適切に設定すると確率構造が未知の状況が混合情報源を対象とする問題設定として表現できることに着目し特に混合情報源を対象とした解析に重点を置いている.研究機関を通じて情報源符号化およびそれと関わりの深い情報理論的乱数生成問題である情報源Resolvability問題およびIntrinsic Randomness問題について解析を行った．これらの結果からそれぞれの問題に内在するあらたな関係が明らかになった．,基盤研究(C),小区分21020:通信工学関連,情報理論,情報理論的乱数生成,情報源符号化,確率分布の近似問題,シャノン理論,乱数生成,,,,,,,,,,,,,,,,,,,,,,,,,,,,,,,,,,,,,,,,,,,,,,,,,,
18K04149,千葉工業大学,佐波 孝彦,移動体通信における通信路情報に基づくポーラ符号化法とその応用,本研究では，次世代無線通信の分野で注目を集めているポーラ符号について，限られた符号語長の場合に誤り訂正能力の低下を抑えられる符号化法および復号法を確立することを目的として，次の3つを柱に研究を行った。1つ目は，通信路の状態に応じたビットの並び替えを用いるポーラ符号化であり，2つ目は，半凍結ビットの概念を導入したポーラ符号化である。最後にパンクチャリングを用いる際のパンクチャドビットの生成法に関する研究である。いずれの研究も，通信路分極特性を強調することに着目しており，誤り訂正能力を改善を可能であることを明らかにしている。,基盤研究(C),小区分21020:通信工学関連,ポーラ符号,通信路分極,パンクチャリング,移動体通信,通信路特性,,,,,,,,,,,,,,,,,,,,,,,,,,,,,,,,,,,,,,,,,,,,,,,,,,,
18K04148,大阪市立大学,林 和則,劣決定線形観測に基づく離散値ベクトルの再構成,MIMO通信の性能解析に使用されるCGMT （convex Gaussian min-max theorem）による手法を適用し，劣決定線形観測からのSOAV (sum-of-absolute-value) 最適化に基づく離散値ベクトル再構成の理論的な性能解析を行い，大システム極限におけるシンボル誤り確率や平均二乗誤差を導出することに成功した．また，SOAV最適化を拡張することで，複素の離散値ベクトルの再構成やグループスパース性を考慮した複素離散値ベクトルの再構成手法も新たに開発した．さらに，非凸の正則化項を採用することで大幅な特性改善を達成し，IoT環境での有効性を計算機実験により確認した．,基盤研究(C),小区分21020:通信工学関連,劣決定線形観測,スパース性,離散性,グループスパース性,非凸最適化,圧縮センシング,スパースモデリング,IoT,複素信号,離散値ベクトル,過負荷信号処理,,,,,,,,,,,,,,,,,,,,,,,,,,,,,,,,,,,,,,,,,,,,,
18K04147,長崎大学,藤本 孝文,高精度化を図った血管検出用電波型腹腔鏡アンテナシステムの実スケールモデルの開発,本研究では，脂肪中の血管をリアルタイムで画像投影可能な電波を用いた内視鏡を実スケールモデルで研究開発を行った．本研究により以下の成果が得られた．測定実験により提案する電波型内視鏡と差分信号処理法を組み合わせることにより，直径4㎜の血管を脂肪表面からの深さ2mmまで検知可能である．実験用のファントム作成においては，脂肪の比誘電率，血管の誘電正接は概ね理論値に一致したが，他の特性が理論値より低い値となった．今後，成分比の検討が必要である．アンテナの高精度化に関しては，広帯域アンテナと狭帯域アンテナを比べた場合，広帯域アンテナがより深い位置での血管検出が可能であることが明らかになった．,基盤研究(C),小区分21020:通信工学関連,電波型内視鏡,アンテナ,医療応用,血管検知,ファントム,内視鏡,血管検出,平面アンテナ,合成開口処理,腹腔鏡,,,,,,,,,,,,,,,,,,,,,,,,,,,,,,,,,,,,,,,,,,,,,,
18K04146,九州大学,金谷 晴一,バッテリーレス生体情報センサプラットホームの開発,無給電インプラントプラットフォームを実現するために、微弱な電磁波を受電し、昇圧するための共振・整流回路（コッククロフト・ウォルトン回路）を開発した。無線周波数帯において、電圧振幅を増大することでその後に続く整流回路の寄生素子による影響を軽減することに成功した。医療応用に向けた基本回路の実現に成功した。,基盤研究(C),小区分21020:通信工学関連,無給電,インプラント,ヘルスケア応用,エネルギーハーベスト,バッテリーレス,センサプラットフォーム,フィルムアンテナ,整流回路,昇圧回路,センサプラットホーム,Bluetooth,生体情報,,,,,,,,,,,,,,,,,,,,,,,,,,,,,,,,,,,,,,,,,,,,
18K04145,山口大学,松元 隆博,長距離伝送と多重通信が可能な海中光無線通信方式の実現,本研究では，海中で，省電力で長距離伝送ができ，かつ複数機器による同時通信が可能な高速光無線通信方式を提案した．この方式では複数の送信局の識別や中継経路の識別を行なうための符号分割多元接続技術と中継途中に並列に配置した複数の中継器を複数のアンテナに見立てたMIMO技術によるダイバーシティ効果によってビット誤り率を低く抑える．本研究ではこの方式に適した光無線通信用の新しい拡散符号や時空間ブロック符号を設計し，それらを用いた通信方式を赤色，緑色，青色のLEDやアバランシェフォトダイオード（APD）を用いた通信システムと計算機シミュレーションによって評価し，有効性を明らかにした．,基盤研究(C),小区分21020:通信工学関連,光無線通信,水中通信,光CDMA,光ZCZ系列,ZCZ-CDMA方式,,,,,,,,,,,,,,,,,,,,,,,,,,,,,,,,,,,,,,,,,,,,,,,,,,,
18K04144,岡山大学,藤森 和博,複雑多様化する無線送電環境のレイアウトを可能にするメタ表面の提案,ワイヤレス電力伝送技術は配線が不要であるため，日常生活の様々なシーンにシームレスに適用でき，生活様式を一変させる可能性を秘めている．一方，送電設備と受電機器との配置には一定の制約があり，どんなものにでも電力を送ることは難しい．,基盤研究(C),小区分21020:通信工学関連,メタ表面,メタマテリアル,ワイヤレス電力伝送,無線電力伝送,近傍電磁界測定,無線送電,円環配列構造,近傍界測定,GPGPUクラスタ,円環配列,,,,,,,,,,,,,,,,,,,,,,,,,,,,,,,,,,,,,,,,,,,,,,
18K04143,岡山大学,冨里 繁,IoT時代に対応した広帯域LED可視光通信システム構成法の研究,本研究では，LED可視光通信用送受信機において，送信側の非線形歪補償で残留する非線形歪を，受信信号の仮判定結果から受信側でキャンセルし，送信側のプリディストーションと組み合わせる送受協調非線形歪補償手法を提案し，有効性を明らかにした．,基盤研究(C),小区分21020:通信工学関連,可視光通信,LED,空間的並列信号伝送,非線形歪補償,高速信号伝送,空間多重化,IoT,広帯域信号伝送,,,,,,,,,,,,,,,,,,,,,,,,,,,,,,,,,,,,,,,,,,,,,,,,
18K04142,岡山大学,田野 哲,非線形プリコーディングを用いるXOR物理層ネットワークコーディングの研究,高速化のために多値変調を適用した場合に発生する中継端末の演算量増大問題を解決する、新しいストリーム毎利得制御を備えた非線形プリコーディングを提案した。これにより中継局の演算量を数百分の１に低減できた。加えて、誤り訂正を導入するための新しい多値変調のための符号化変調方式も提案した。中継端末の演算量増大を抑圧しつつ、16QAMや256QAMの多値変調を適用した場合でも、BER＝1.0E-4点において2dB程度の利得が得られた。また、物理層ネットワークコーディングのための中継端末選択法を提案した。BER＝1.0E-3点で13dBの利得が得られることを示した。,基盤研究(C),小区分21020:通信工学関連,ネットワーク符号化,マルチホップ無線,MIMO,符号化変調,プリコーディング,過負荷,無線通信,演算量低減,空間多重,ネットワークコーディング,無線中継,双方向通信,多値変調,周波数利用効率向上,マルチホップ,周波数利用効率,双方向無線通信,中継,,,,,,,,,,,,,,,,,,,,,,,,,,,,,,,,,,,,,,
18K04141,和歌山大学,葛岡 成晃,ビッグデータ解析のためのデータ圧縮法の開発,関数計算のためのデータ圧縮，および，多端子仮説検定問題に関する研究に取り組んだ．関数計算のためのデータ圧縮に関する研究では，主に関数の引数が2の場合を扱っていた既存結果を引数が3の場合に拡張する成果を得た．さらに，計算を行うノードに観測データを送信する際の通信路雑音を考慮した設定で研究を進め，通信路雑音を考慮しない従来研究の結果を拡張することに成功した．多端子仮説検定問題に関する研究では，複数の達成可能最適誤り指数の間に成り立つ一般的な関係式を導出した．,基盤研究(C),小区分21020:通信工学関連,情報理論,多端子仮説検定,分散関数計算,情報源符号化,推測問題,関数計算,仮説検定,多端子情報理論,,,,,,,,,,,,,,,,,,,,,,,,,,,,,,,,,,,,,,,,,,,,,,,,
18K04140,京都工芸繊維大学,梅原 大祐,成功優先ランダムアクセスプロトコルに関する研究,通信媒体となる空間を共有したパケット衝突があるWi-Fiなどのパケット無線通信システムに，パケット送信に成功した無線局が一定の確率で他の無線局と比べて優先的に送信することができる成功優先の概念を導入した．この成功優先メカニズムの導入により，パケット衝突を大幅に低減することができ，パケット衝突により生じる空間使用時間やパケット送受信エネルギーのロスを少なくすることができる．これらの効果がファイルアップロード時間の低減やバッテリの長寿命化につながることを定量的に明らかにした．,基盤研究(C),小区分21020:通信工学関連,ランダムアクセスプロトコル,IEEE 802.11 DCF,非持続型CSMA,バックオフアルゴリズム,成功優先確率,伝送効率向上,エネルギー効率向上,スケーラビリティ向上,成功優先ランダムアクセス,スロットアロハ,成功優先ランダムアクセスプロトコル,パケット無線ネットワーク,メディアアクセス制御,伝送効率,エネルギー効率,,,,,,,,,,,,,,,,,,,,,,,,,,,,,,,,,,,,,,,,,
18K04139,京都大学,久門 尚史,遅延結合を含む回路のトポロジーに基づく電磁場の幾何学的設計,Maxwell方程式から系統的に導体構造と等しいトポロジーの等価回路を導出し、電磁場の遅延結合を考慮すると、複雑な構造における固有モードや周波数特性、放射・分散特性などが得られる。このことを利用して、明示的な帰路線の無い回路において、回路の外部に存在する電磁界との結合を回路としてグラフラプラシアンを用いて幾何学的に設計し、種々の電磁現象が設計できることを示した。具体的には、帰路線の無い伝送線路の終端設計や短絡、周波数特性の設計、ライトライン上の特異性を利用した単一モード励振、時間領域モデルの中立型遅延微分方程式による記述とその安定化、単導体線路の屈曲線路への拡張などを提案した。,基盤研究(C),小区分21020:通信工学関連,回路モデル,遅延電磁結合,トポロジー,幾何学的設計,等価回路,グラフラプラシアン,単導体線路,離散ダランベール演算子,遅延ポテンシャル,終端,ネットワーク,メタマテリアル,伝搬遅延,回路のトポロジー,電磁現象,ラプラシアン,,,,,,,,,,,,,,,,,,,,,,,,,,,,,,,,,,,,,,,,
18K04138,豊橋技術科学大学,上原 秀幸,稠密な無線分散センシングのための低遅延かつ省電力なネットワーク構成法,本研究では，大量かつ高密度に配置された多様な無線センサ端末で構成されるネットワークを対象として，省電力・低遅延・高スループットを実現する１）トポロジとその構成法，２）耐干渉アクセス制御法，３）基幹網の全二重化を目指し，主に次に示す結果を得た。１）CSMAを用いたクラスタ型ネットワークではクラスタ数とキャリアセンス閾値に配慮した設計が重要であり，仮想全二重化ではクラスタヘッドの配置と送信電力に最適値がある。２）他セル干渉が存在する環境下では受信成功の可否に基づく電力制御が有効である。３）高性能な自己干渉キャンセラを開発し，BlockACKがマルチホップ通信で有効である。,基盤研究(C),小区分21020:通信工学関連,センサネットワーク,トポロジ,省電力,低遅延,アクセス制御,全二重,トポロジー,スケジューリング,,,,,,,,,,,,,,,,,,,,,,,,,,,,,,,,,,,,,,,,,,,,,,,,
18K04137,名古屋工業大学,平山 裕,無線電力伝送のための高周波パワーエレクトロニクス理論の確立,無線電力伝送技術には、インバーターの応用としてのパワーエレクトロニクスに基づく技術と、アンテナ・高周波回路の考え方に基づいたマイクロ波技術によるものがある。それぞれの分野における研究は活発に行われているが、さらなる発展のためには、両者を融合した理論体系の確立が有用である。本研究では、「周波数変換」「インピーダンス変換」「伝搬モード変換」の考え方に基づいた、無線電力伝送工学の体系化を行った。さらに、その応用として、高周波におけるインピーダンス整合を、パワエレ回路のDC-DCコンバーターで実現する方法を提案した。,基盤研究(C),小区分21020:通信工学関連,無線電力伝送,マイクロ波,アンテナ,パワーエレクトロニクス,結合共振,アンテナ工学,,,,,,,,,,,,,,,,,,,,,,,,,,,,,,,,,,,,,,,,,,,,,,,,,,
18K04136,名古屋工業大学,岡本 英二,無線セキュリティを有する即時送信可能なIoT超多数端末接続方式の構築,本研究では５Gの多数端末接続シナリオにも即している電波暗号化即時送信型超多数IoT端末接続非直交多元接続手法の構築を行った．GaBP（Gaussian belief propagation）アルゴリズムを大規模伝送時の受信機の復号に適用することにより，100台程度までの同時通信の信号検出が妥当な計算量で行えることを明らかにした．さらに提案手法の理論的性能を通信路容量を導出することで明らかにし，準ランダム信号の伝送でありつつ，完全ランダムな信号伝送よりも大容量化が実現できることを示した．また安全性についても，共有鍵の許容類似度の条件が厳しく，同一鍵を有しない場合は秘匿性が保てることを示した．,基盤研究(C),小区分21020:通信工学関連,無線通信方式,非直交多元接続手法,電波暗号化,物理層秘匿性,IoT,カオス,IoT通信,大規模化,電波暗号化検出,超多数端末非直交多元接続手法,即時送信型,ioT,超スマート社会,,,,,,,,,,,,,,,,,,,,,,,,,,,,,,,,,,,,,,,,,,,
