awardnumber,organization,name,title,abstract,section,review_section,keyword1,keyword2,keyword3,keyword4,keyword5,keyword6,keyword7,keyword8,keyword9,keyword10,keyword11,keyword12,keyword13,keyword14,keyword15,keyword16,keyword17,keyword18,keyword19,keyword20,keyword21,keyword22,keyword23,keyword24,keyword25,keyword26,keyword27,keyword28,keyword29,keyword30,keyword31,keyword32,keyword33,keyword34,keyword35,keyword36,keyword37,keyword38,keyword39,keyword40,keyword41,keyword42,keyword43,keyword44,keyword45,keyword46,keyword47,keyword48,keyword49,keyword50,keyword51,keyword52,keyword53,keyword54,keyword55,keyword56
23K03856,熊本大学,福迫 武,ミリ波帯電波伝搬路形成および推定のためのメタ表面技術の構築,平面構造に金属素子等を周期的に，または準周期的に並べたメタ表面（メタサーフェス）反射板に電波の高分解能到来方向推定技術，および電波伝搬路形成のための入射角及び反射角制御技術を持たせることを目的とする．これらに対し，メタ表面を用いたハード面からのアプローチのほか，信号処理に工夫をし，ソフト面からのアプローチを行う．,基盤研究(C),小区分21020:通信工学関連,メタ表面,リフレクトアレー,到来方向推定,B5G,電波到来方向推定,ミリ波反射板,,,,,,,,,,,,,,,,,,,,,,,,,,,,,,,,,,,,,,,,,,,,,,,,,,
23K03855,香川大学,石井 光治,通信不確実性を考慮した無線ネットワーク化制御システムの高信頼化に関する研究,本研究は、コントローラと制御機器(遠隔ロボット)とが無線を介して制御される無線ネ ットワーク化制御システムに着目し、無線通信と制御とを 統合的に設計することで、無線制御システムを高信頼化/高効率化する。本研究の独創性は、 「平均」誤り率や「最大」スループットなどを基準にした従来の無線設計ではなく、制御システムの状態に応じた無線設計、また通信リソースの柔軟な配分により通信不確実性を可変 にした無線制御システムを設計する点である。研究では、基礎研究、応用研究、発展研究とを同時に行い、理論から実践的な無線制御システムの高信頼化/高効率化を目指す。,基盤研究(C),小区分21020:通信工学関連,無線ネットワーク化制御,無線制御同時最適化,マルチホップ通信,最適リソース配分,通信不確実性,無線通信,制御理論,,,,,,,,,,,,,,,,,,,,,,,,,,,,,,,,,,,,,,,,,,,,,,,,,
23K03854,山口大学,井田 悠太,時間-周波数チャネル学習による多段階協調中継通信の信号構築,本研究は多段階協調中継通信の時間と周波数の通信路状態を学習したパケット分割伝送とインターリーブ割当による信号を構築し，これまでにない実用的なシステム創出を目的とする．近年の通信環境では，信号を高速，低遅延，かつ高品質で送受信できる多段階協調中継通信は必須であるが，これまでの方法は評価した通信路モデルが限定的であり，各通信路がそれぞれ独立しているため通信路環境の把握が不十分であった．本研究は様々な環境での通信路モデルを取得し，総合的に評価することで，通信路状態推定のためのパイロット信号，パケット分割伝送，インターリーブ割当，学習を用いた信号構築による通信品質の向上を示す．,基盤研究(C),小区分21020:通信工学関連,多段階協調中継通信,時間-周波数チャネル学習,,,,,,,,,,,,,,,,,,,,,,,,,,,,,,,,,,,,,,,,,,,,,,,,,,,,,,
23K03853,京都工芸繊維大学,大柴 小枝子,メラノピック照度制御照明を用いた波長多重可視光通信,本研究は、複数色の発光ダイオード(LED: Light emitting diode)チップから構成される照明を用いた可視光通信で色多重マルチアクセスネットワークを構築し、通信環境と照明環境の両方のユーザ品質の最適化を確立することを目的とする。まず、照明を送信機として利用するため、色多重での送受信特性とメラノピック照度との関係を明らかにし、機械学習を用いたMIMO処理による色分離技術とスペクトル管理・最適化技術を確立することで人間に優しいスマート社会を実現するための指針を明らかにする。,基盤研究(C),小区分21020:通信工学関連,照明光通信,ユーザ体感品質QoE,色多重マルチアクセスネットワーク,MIMO,色分離技術,,,,,,,,,,,,,,,,,,,,,,,,,,,,,,,,,,,,,,,,,,,,,,,,,,,
23K03852,名古屋大学,BEN・NAILA Chedlia,IRS-assisted Optical MIMO Systems for High-Capacity and Reliable Underwater Communication Links,"Underwater optical wireless communication (UOWC) is considered a potential candidate for B5G/6G networks. The major hurdle for practical and reliable UOWC systems is the complex characteristics of the underwater channel that depend on changeful environments ranging from shallow coastal water to deep oceans.To overcome the dynamics nature of the UOWC channel, we propose a flexible and reconfigurable design of the UOWC system exploiting the concept of intelligent reflecting surfaces (IRS), the spatial diversity gain of the MIMO technique to meet the requirements of the underwater channel.",基盤研究(C),小区分21020:通信工学関連,Underwater OWC,IRS Technology,Pointing errors,Optical MIMO,Moving AUV,IRS,underwater OWC (UOWC),non line-of-sight (NLOS),spatial diversity,MIMO,,,,,,,,,,,,,,,,,,,,,,,,,,,,,,,,,,,,,,,,,,,,,,
23K03851,信州大学,西新 幹彦,情報伝達における遅延最小化問題の情報理論的解明,情報通信において遅延と効率の間にトレードオフの関係があることは定性的に知られている。本研究では、信号の伝達時間や電子回路の演算速度ではなく、数学的写像あるいはオートマトンとしての符号に起因する遅延に注目し、制約下における遅延の最小化問題を数学的に解明することを目指す。,基盤研究(C),小区分21020:通信工学関連,情報理論,符号化遅延,忠実度規範付き符号化,コスト付き符号化,遅延,,,,,,,,,,,,,,,,,,,,,,,,,,,,,,,,,,,,,,,,,,,,,,,,,,,
23K03850,東京工業大学,張 裕淵,ＭＩＭＯ－ＯＦＤＭ水中音響通信における反復干渉除去技術の研究開発,水中音響チャネルの帯域幅は厳しく制限されるため、如何に周波数利用効率を向上させるかが重要な課題となっている。水中音響通信においては、伝搬環境の大きい遅延広がりと速い変動が受信信号にシンボル間、サブキャリア間およびデータストリーム間干渉をもたらし、伝送特性が劣化してしまう。そこで、本研究はMIMO-OFDM水中音響通信に基底展開モデルを用い、高度な反復干渉除去技術の導入を検討し、周波数利用効率を20 bps/Hz以上まで向上することを目標とする。,基盤研究(C),小区分21020:通信工学関連,水中音響通信,MIMO,OFDM,反復干渉除去,基底展開モデル,,,,,,,,,,,,,,,,,,,,,,,,,,,,,,,,,,,,,,,,,,,,,,,,,,,
23K03849,埼玉大学,木村 雄一,準ミリ波・ミリ波用直交偏波共用広帯域・マルチバンド平面アンテナに関する研究,第5世代移動通信システムなどの将来の無線技術では、広い周波数帯域を有する準ミリ波やミリ波を利用して一層の高速・大容量通信の実現が求められている。平面アンテナは小型・薄型・軽量等の利点を有し、かつ、プリント基板加工技術により低コストで生産性にも優れた特長を有しているが、一般に単周波で動作し、狭帯域特性であることが欠点であった。そこで、本研究では直交偏波共用特性及びマルチバンド特性・広帯域特性を兼ね備え、さらに、アレーアンテナへの応用も可能とする機能性の高い平面アンテナを製作が容易な構成で実現し、準ミリ波およびミリ波帯でその特性を実証する。,基盤研究(C),小区分21020:通信工学関連,平面アンテナ,マイクロストリップアンテナ,2周波共用アンテナ,広帯域アンテナ,偏波共用アンテナ,広帯域平面アンテナ,Lプローブ給電マイクロストリップアンテナ,マルチバンドアンテナ,準ミリ波・ミリ波アンテナ,直交偏波共用アンテナ,,,,,,,,,,,,,,,,,,,,,,,,,,,,,,,,,,,,,,,,,,,,,,
23K03848,地方独立行政法人東京都立産業技術研究センター,小畑 輝,エネルギー回収型電波吸収体の高度化手法の開発,申請者はこれまでに電波吸収体に入射される電波の一部をエネルギーとして取り出す構造の開発を行った．これにより①電波の反射抑制と②アンテナ機能による受信/受電を同時に行えることを示した．しかし，本電波吸収体は狭帯域特性であるため，電波の入射角による周波数特性の変動からターゲットとなる周波数の①性能低下が課題として残った．,基盤研究(C),小区分21020:通信工学関連,反射抑制,電波吸収,周波数選択表面,アンテナ,スロット,広帯域化,マイクロ波,,,,,,,,,,,,,,,,,,,,,,,,,,,,,,,,,,,,,,,,,,,,,,,,,
23K03847,近畿大学,毛利 公美,仮想化技術に基づくサイバーフィジカルシステムの保護機能に関する研究,産業IoT（IIoT）の通信に拡張性や柔軟性を持たせるために仮想化技術を用いる通信基盤においては，送信者と受信者の間で真正性が保証されたデータの流通がなされなければならない．同時に，送信者と受信者のプライバシーへの懸念に対応が求められる．多数の主体がデータを利活用するための通信基盤の構築に資する，送信者と受信者の双方が安心して仮想ネットワークサービスを利用するためのプライバシーに配慮してデータをセキュアに流通させる技術を開発する．,基盤研究(C),小区分21020:通信工学関連,データセキュリティ,認証,真正性,,,,,,,,,,,,,,,,,,,,,,,,,,,,,,,,,,,,,,,,,,,,,,,,,,,,,
23K03846,関西大学,棟安 実治,深層学習を用いた敵対的摂動による新たな原理に基づいたデータ埋込・検出技術の開発,"畳み込みニューラルネットワーク(CNN)を用いた画像識別において, 知覚できない「敵対的摂動」による入力画像への攻撃に対して，誤識別などの深刻な脆弱性が存在する．しかし，敵対的摂動は意図的に識別不可能な変更を画像に加える点で電子透かしとの関連を見いだせる．本研究では，画像に敵対的摂動を用いて情報を埋め込めば，違和感なく柔軟性があり，さらに様々な種類のCNNに紐付けされることで埋め込み情報を検知されにくいマーカを開発可能であると考え，敵対的摂動をデータ埋め込み手法として発展させ，スマートフォンなどの入力デバイスを用いて多様な物体上のマーカからデータを抽出するためのセキュアな手段の開発を目指す．",基盤研究(C),小区分21020:通信工学関連,敵対的摂動,深層学習,データ埋め込み,FGSM,DCT,電子透かし,C&W攻撃,敵対的トレーニング,DNN,標的型攻撃,,,,,,,,,,,,,,,,,,,,,,,,,,,,,,,,,,,,,,,,,,,,,,
23K03845,南山大学,梅比良 正弘,通信・レーダ融合システムのためのDFTs-OFDM-PMCWレーダの研究,本研究では、通信・レーダ融合システムの実現を目的として、周波数選択性フェージング環境でGbps級の高速通信が可能で、電力有効利用を図るためピーク電力が小さいDFTs-OFDM方式と、符号系列で位相変調を行い相関検出により距離・速度検出を行うPMCW方式をベースとする通信・レーダ融合信号処理技術を提案し、計算機シミュレーションによる性能評価を行い、提案技術の実現性を明らかにすると共に設計法を確立する。,基盤研究(C),小区分21020:通信工学関連,通信・レーダ融合,DFTs-OFDM,PMCWレーダ,相関検出,Zadoff-Chu系列,通信レーダ融合,DFT,OFDM,PMCW,信号処理,,,,,,,,,,,,,,,,,,,,,,,,,,,,,,,,,,,,,,,,,,,,,,
23K03844,金沢工業大学,牧野 滋,一次放射器の位相中心位置制御によるリフレクトアレーの広帯域化,本研究は，リフレクトアレーの広帯域化を目的とするものである．,基盤研究(C),小区分21020:通信工学関連,リフレクトアレーアンテナ,ホーンアンテナ,位相誤差,,,,,,,,,,,,,,,,,,,,,,,,,,,,,,,,,,,,,,,,,,,,,,,,,,,,,
23K03843,早稲田大学,亀山 渉,映像符号化方式におけるDNNを利用した高効率動き補償予測方式の実現手法に関する研究,従来の映像符号化方式を超える情報圧縮性能を達成することを目的として、映像符号化方式の圧縮性能に大きく寄与する動き補償予測方式に着目し、符号化済みフレームを学習データとして利用するDNN（Deep Neural Network）による動き補償予測方式について研究する。多様な動きに対する追従性能向上と生成フレームのボケを改善する高画質予測フレーム生成手法の検討、多様な映像内容を含んだ大量フレームの学習による汎化性能向上、映像情報圧縮性能の統合検証を通し、映像符号化方式におけるDNNの効率的かつ汎用的な利活用手法を明らかにする。,基盤研究(C),小区分21020:通信工学関連,映像符号化,動き補償,DNN,予測フレーム生成,動き保証,,,,,,,,,,,,,,,,,,,,,,,,,,,,,,,,,,,,,,,,,,,,,,,,,,,
23K03842,慶應義塾大学,池原 雅章,信号処理技術を用いた非局所的深層学習による画像の劣化除去,最新の深層学習のキーワードは非局所的処理である。従来の畳み込みによる処理では局所的な特徴しか捉えられず、画像全体の特徴や一貫性を考慮することができないため、その性能は限界に来ている。画像には類似性がありその性質を利用して非局所的な処理を施すことにより、性能が飛躍的に向上することが知られている。最新の深層学習では、画像処理におけるNLMに相当するトランスフォーマーや非局所的ニューラルネットワークが注目されている。しかしこれらの技術は計算量が膨大で、携帯等で実装するのは不可能である。そこで本研究課題では信号処理で用いられている技術と深層学習を融合して、高速高精度な画像劣化除去技術の研究を行う。,基盤研究(C),小区分21020:通信工学関連,非局所的処理,深層学習,画像処理,画像劣化,信号処理,,,,,,,,,,,,,,,,,,,,,,,,,,,,,,,,,,,,,,,,,,,,,,,,,,,
23K03841,広島市立大学,三村 和史,量子効果を用いた分割スパース推定アルゴリズムの開発と展開,スパース性を用いて観測から未知信号を推定する枠組みであるスパース推定では、原信号のサポートがわかれば非零要素の値は比較的容易に求められる。本研究では、横磁場型の量子デバイスを用いたサポート推定の方法を提案し、そのサポート推定手法を、深層学習の技術を用いて古典計算機でシミュレートすることにより、古典計算機で動作する効率的で高速なスパース推定アルゴリズムを開発することを目指す。,基盤研究(C),小区分21020:通信工学関連,情報統計力学,スパース推定,圧縮センシング,量子効果,深層学習,,,,,,,,,,,,,,,,,,,,,,,,,,,,,,,,,,,,,,,,,,,,,,,,,,,
23K03840,佐賀大学,豊田 一彦,次世代無線システムのための周波数変換機能内蔵型アクティブアンテナの実証的研究,本研究は，次世代の無線通信システムで活用が見込まれる送受信機一体型アクティブアンテナを実現するための基本技術に関するものである．従来の無線機は，アンテナと高周波回路がそれぞれ独立に設計されており，個々に最適化されてきた．このため，アンテナと高周波回路の相互作用による利点を活用することができていなかった．本研究では，アンテナと高周波回路を一体複合化することにより，これまでの構成では実現することの難しかった高機能アンテナを実現し，次世代無線通信の研究開発に資する．,基盤研究(C),小区分21020:通信工学関連,アクティブアンテナ,ワイヤレス,周波数変換,次世代無線システム,ダウンコンバータ,イメージ抑圧,次世代ワイヤレス,,,,,,,,,,,,,,,,,,,,,,,,,,,,,,,,,,,,,,,,,,,,,,,,,
23K03839,九州工業大学,松嶋 徹,多導体線路におけるモード分割多重伝送方式の実装,有線通信の大容量化のために平衡伝送のための多対化が進んでいるが、線路間のクロストークの低減が課題である。これまでに多導体通信ケーブルにおいて、クロストークを低減し信号伝送容量の増加および信号線使用率の向上を実現する手法であるモード分割多重伝送方式を提案し、理想的な系についてシミュレーションにより有効性を実証してきた。本申請では曲がりやコネクタ部に不連続があるような実際のケーブルにおいて、電磁界のモード変換の定式化を行い信号伝送およびクロストークに対する影響を定量的に評価する。また、信号ドライバ回路の簡単化のために多値数の削減を検討し、FPGAなどを用いて実証する。,基盤研究(C),小区分21020:通信工学関連,高速信号伝送,有線通信,固有モード,クロストーク,多導体伝送線路,固有モード解析,モード多重伝送,FPGA,コモンモード,,,,,,,,,,,,,,,,,,,,,,,,,,,,,,,,,,,,,,,,,,,,,,,
23K03838,岡山大学,上原 一浩,蓄積一括信号処理による重なった無線信号の分離・復調技術の高度化と応用,IoTが本格普及すると、数百億個のIoT端末が世界中に偏在し、限られた周波数資源の中でセンサ端末等の低機能の無線端末が無秩序に通信し、衝突や干渉により従来の受信機ではデータが受信出来なくなり、時に人々の安心安全をも脅かすという課題がある。本研究では、広帯域受信スペクトルを一旦クラウドに蓄積し、過去・現在・未来のデータを用いて一括信号処理することにより、従来の受信機では実現できない、衝突した信号や干渉を受けたIoT/M2M端末信号の分離・復調技術の確立を目指す。更に、本技術を応用し、ジャミング等による通信妨害、及びサイドチャネル攻撃（SCA）の脅威に対する対策技術の確立を目指す。,基盤研究(C),小区分21020:通信工学関連,蓄積一括無線信号処理,信号分離,IoT,無線アクセス,サイドチャネル攻撃,通信妨害信号,,,,,,,,,,,,,,,,,,,,,,,,,,,,,,,,,,,,,,,,,,,,,,,,,,
23K03837,神戸大学,森井 昌克,無線LAN暗号化システム(WPA2/WPA3)の安全性評価に関する研究,現在提案されてるWPA2およびWPA3への脆弱性を利用した攻撃方法の評価、つまり不正アクセスを実現するための条件と現実的な効果を示す。さらには新たな脆弱性を指摘し、それを利用した不正アクセス手法の開発を行う。その開発を基にその脆弱性を排除する方法、更に安全なセキュリティプロトコルの開発方法を与える。WPA2およびWPA3を対象にしたサイドチャネル攻撃に注目し、現実的な新たなサイドチャネル攻撃を開発する。さらにこのサイドチャネル攻撃を防ぐ方法を提案する。,基盤研究(C),小区分21020:通信工学関連,無線LAN,脆弱性,WPA2/WPA3,5G,不正アクセス,bluetooth,BR/EDR,近距離無線通信,,,,,,,,,,,,,,,,,,,,,,,,,,,,,,,,,,,,,,,,,,,,,,,,
23K03836,静岡大学,和田 忠浩,流星バースト通信の新しい送受信技術による性能改善とソフトウェア無線機による実証,現在、無線通信分野では様々な新しい要素技術が多数提案されているが、これらの技術が流星バースト通信(MBC)システムに適用されている例はほとんどない。MBCでは、伝送路が発生する時刻が予測できず、伝送路の継続時間も極めて短いという欠点があり、そのため、これらの要素技術の適用によって通信性能の大幅な改善が期待できる。本研究では、MBCシステムへ、ダイバーシチ受信や高性能誤り訂正符号などの新しい要素技術を適用することによる通信性能向上に関して理論検討する。この結果を検証するため、国内やインドネシアで構築しているMBCシステムでの実証実験に向け、ソフトウェアモデムへ実装を行いその性能を評価する。,基盤研究(C),小区分21020:通信工学関連,流星バースト通信,低緯度地域,ソフトウェアモデム,ダイバーシチ受信,インドネシア,,,,,,,,,,,,,,,,,,,,,,,,,,,,,,,,,,,,,,,,,,,,,,,,,,,
23K03835,東京工業大学,青柳 貴洋,次世代ワイヤレス通信のための電磁界計測場の最適化と理論解析手法に関する研究,リバーブレーションチャンバー(共鳴箱)は携帯電話や無線LANをはじめとした各種の無線通信をはじめ、電子機器の性能を測定する測定場(部屋)として今後広く活用されると考えられるものである。本研究はこのリバーブレーションチャンバーの解析、設計をより効率的に行うための手法を検討するもので、この研究成果により、より高性能で低コストな無線通信機器の測定場を実現することが可能となると考えられる。,基盤研究(C),小区分21020:通信工学関連,リバーブレーションチャンバー,電磁界シミュレーション,モーメント法,有限要素法,ディエンベッディング,最適化,設計,環境電磁工学,測定法,共鳴箱,無線通信,,,,,,,,,,,,,,,,,,,,,,,,,,,,,,,,,,,,,,,,,,,,,
23K03834,秋田大学,淀川 信一,固体プラズマを利用したサブミリ波帯アレイアンテナによるビームフォーミング,サブミリ波帯の放射ビームを走査するフェーズドアレイ・アンテナの動作には各アンテナに対する複数の位相制御器が必要である。本研究は，サブミリ波帯で動作する位相制御器として固体プラズマ線路を提案し，複数のプラズマ線路をアレイ上に配置することで，放射ビームの方向および集束点を制御するビームフォーミングアンテナの実現に向け，理論解析，シミュレーション解析および実験により検討する。,基盤研究(C),小区分21020:通信工学関連,サブミリ波,固体プラズマ,アレイアンテナ,ビームフォーミング,FDTD解析,,,,,,,,,,,,,,,,,,,,,,,,,,,,,,,,,,,,,,,,,,,,,,,,,,,
24K07500,防衛大学校(総合教育学群、人文社会科学群、応用科学群、電気情報学群及びシステム工学群),道下 尚文,ホイヘンスメタサーフェスマントルクロークを用いた干渉低減アンテナの利得補償法,Beyond 5G/6Gの実現に向けて，アンテナの性能向上のために，素子間相互結合の低減と放射指向性の維持を同時に達成する方法としてマントルクロークアンテナが検討されている．しかし，クローキング構造は損失を持つため利得は低下する．本研究では，マントルクロークを構成する実構造としてホイヘンスメタサーフェスを採用することで，相互結合の低減のために反射波を低減することと，利得を補償するために透過波を増大することを同時に達成することを目的とする．ホイヘンスメタサーフェスの設計法および適用範囲を明らかにするとともに，ホイヘンスメタサーフェスを用いたマントルクロークアンテナの有効性を検証する．,基盤研究(C),小区分21020:通信工学関連,アンテナ,マントルクローク,ホイヘンスメタサーフェス,相互結合,利得,,,,,,,,,,,,,,,,,,,,,,,,,,,,,,,,,,,,,,,,,,,,,,,,,,,
