awardnumber,organization,name,title,abstract,section,review_section,keyword1,keyword2,keyword3,keyword4,keyword5,keyword6,keyword7,keyword8,keyword9,keyword10,keyword11,keyword12,keyword13,keyword14,keyword15,keyword16,keyword17,keyword18,keyword19,keyword20,keyword21,keyword22,keyword23,keyword24,keyword25,keyword26,keyword27,keyword28,keyword29,keyword30,keyword31,keyword32,keyword33,keyword34,keyword35,keyword36,keyword37,keyword38,keyword39,keyword40,keyword41,keyword42,keyword43,keyword44,keyword45,keyword46,keyword47,keyword48,keyword49,keyword50,keyword51,keyword52,keyword53,keyword54,keyword55,keyword56
19H01286,獨協大学,飯島 優雅,大学英語教育の質保証指標モデルとEAP教員コア・コンピテンシー枠組の開発,"日本の大学における学術目的の英語教育（English for Academic Purposes, 以下EAP）では、質保証と教員養成枠組の不備や、専門教育との連携の欠如などが課題となっている。それらの課題の解決に向け、本研究では「EAP教育の質保証に向けた指標モデル」を構築し、特にその重要な構成要素である教員に求められる資質・技能・知識に関する「EAP教員コア・コンピテンシー枠組」を開発する。さらに、指標の活用モデルやコンピテンシー養成を支援するリソースを整備し公開する。本研究は、質保証の参照枠組として日本の大学英語教育の発展に寄与する。",基盤研究(B),小区分02100:外国語教育関連,EAP,学術目的の英語,大学英語教育,大学英語カリキュラム,質保証,教員養成,ファカルティ・ディベロップメント,学術目的の英語教育,EAP教育質保証,EAP教員コンピテンシー,教員コンピテンシー,カリキュラム開発,,,,,,,,,,,,,,,,,,,,,,,,,,,,,,,,,,,,,,,,,,,,
19H01285,長崎大学,中村 典生,小学校英語教育におけるAIとの共存を目指したアバターの開発と教育現場への導入,"本研究は，小学校英語を取巻く喫緊の課題である①主たる指導者である担任教師の英語力不足，② Assistant Language Teacher（外国語指導助手，ALT）の人数不足，③離島等のへき地・小規模校と中・大規模校との指導環境格差，④ 教科化に伴うパフォーマンス・テスト（スピーキング）実施の困難さ，を解決するために，英語コミュニケーション能力を備えたアバター（分身キャラクター）を人工知能（Artificial  Intelligence, AI）を用いて製作し，試験的に小学校の英語教育に導入することで，現場でのAIの活用と，教員との「共存」の可能性を探るものである。",基盤研究(B),小区分02100:外国語教育関連,人工知能（AI),小学校外国語教育,指導と評価の一体化,パフォーマンステスト,小学校英語教育,指導と評価,ICT,AI,パフォーマンス・テスト,離島・へき地,へき地・小規模校,ALT,小学校外国語,外国語活動,小学校教員の英語力・指導力,離島,小学校英語,,,,,,,,,,,,,,,,,,,,,,,,,,,,,,,,,,,,,,,
19H01284,高知大学,多良 静也,英語学習における発達性読み書き障害に対するタブレット版評価・指導パッケージの開発,日本語では読み書きに困難さを示さない児童・生徒が英語学習を開始した途端，英語の文字が読めず（書けず）学習成果が高まらない事例が複数報告されている。本研究では，学習障害が背景にある読み書きに困難さを示す児童・生徒を評価するための妥当性・信頼性の高い即座的・即時的タブレット版評価・指導パッケージを開発することを目的としている。英語の読み書きに困難さを示す児童・生徒をいち早く適切に判定できれば，彼らの認知特性を踏まえた適切な教育介入が可能となる。特別支援的視点を取り入れた日本の英語教育にとって大きな貢献を示す研究となる。,基盤研究(B),小区分02100:外国語教育関連,英語教育,特別支援教育,読み書き障害,ディスレクシア,e-Screener,スクリーニング,特異的なつまずき,スクリーニングツール,タブレット,発達性読み書き障害,タブレット版評価システム,英語学習指導パッケージ,e-screener,教材開発,アプリ,,,,,,,,,,,,,,,,,,,,,,,,,,,,,,,,,,,,,,,,,
19H01282,大阪大学,王 周明,異文化理解における外国語教科書の役割ー中国語・ロシア語・朝鮮語を対象としてー,本研究は過去百年にわたって日本で出された中国語・ロシア語・朝鮮語の教科書を、顕在的及び潜在的イデオロギーという視角から体系的に分析し、そこに現れる日本・日本人のイメージ・表象の変容をも視野に入れつつ、日本人が隣国にいだいていたイメージを探る。,基盤研究(B),小区分02100:外国語教育関連,異文化理解,外国語教科書,中国語,ロシア語,朝鮮語,イデオロギー,中国語・ロシア語・朝鮮語,外国語教科書の役割,,,,,,,,,,,,,,,,,,,,,,,,,,,,,,,,,,,,,,,,,,,,,,,,
19H01281,名古屋工業大学,石川 有香,工学系日本人大学院生の博士論文英語化推進ツールEJETの開発,工学研究における国際化が進み，「工学の共通語は英語」と広く認識されるようになって久しい。しかし，一方で，工学専攻の日本人大学院生の学位論文は，いまだにその多くが日本語で執筆されている。本研究では，工学系日本人大学院生が学位論文を英語で書く際の心理的・物理的・言語的障壁を解明し，工学学位論文作成支援ツールを開発して，工学系大学院生の学位論文の英語化を推進する。,基盤研究(B),小区分02100:外国語教育関連,工学ESP,コーパス分析,論文テキスト,日英対照分析,ライティング,工学英語教育,ESP,論文,工学英語,ライティング支援,ライティング支援ツール,日英対照,,,,,,,,,,,,,,,,,,,,,,,,,,,,,,,,,,,,,,,,,,,,
19H01280,横浜国立大学,尾島 司郎,早期英語学習の認知脳科学的研究,外国語学習が学習者の年齢によってどう変化するのかは、学術的にも社会的にも重要な研究テーマである。言語習得におけるこども・年少者の優位性が出現するためには子どもの内に数千時間、対象言語に触れる必要がある。そのような超長時間の英語学習を家庭で行っている日本人の子どもが、極めて高い英語力を身に付けている事例がある。本研究では、子どもに最適な脳機能計測パラダイムを構築し、子どもの脳に対する超長時間の英語学習の影響を、英語、日本語、認知能力の3側面から調べ、早期英語学習の認知脳科学という研究領域の基礎を作ることを目指す。,基盤研究(B),小区分02100:外国語教育関連,早期英語教育,第二言語習得論,言語脳科学,,,,,,,,,,,,,,,,,,,,,,,,,,,,,,,,,,,,,,,,,,,,,,,,,,,,,
19H01279,早稲田大学,中村 智栄,第二言語の適応的な文理解とプロソディーの影響:眼球運動計測と数理モデルによる検証,"本研究は, 第二言語学習者が言語情報に対して持つ統計的推論能力と予測的文処理プロセスに焦点を当て, 第二言語の理解において音声のプロソディー情報に含まれる多様性を聞き手がどう考慮し, 情報の信頼性(reliability)にどう適応しながら文理解を行うかを明らかにする. これにより, 第二言語の文処理にプロソディー情報が予測的に使われるかを調べるとともに, 予測した情報と実際のインプットの差によって生じるエラーから引き起こされる潜在的学習(error-based learning)がプロソディー情報のreliabilityへの適応にどう影響を与えるかを分析することで適応的な言語処理を引き起こす要因の解明にあたる.",基盤研究(B),小区分02100:外国語教育関連,プロソディー,第二言語理解,予測的文処理,言語間比較,信頼性に基づく情報処理適応,統語的曖昧性,言語処理,信頼性の操作,第二言語習得,文処理,心理言語学,学習,アイトラッキング,プロソディ,潜在的学習,視線計測,計算言語学,音声,文理解,統語分析,眼球運動計測,第二言語,適応的文処理,視覚世界パラダイム,音声文,文理解モデル,,,,,,,,,,,,,,,,,,,,,,,,,,,,,,
19H01278,筑波大学,卯城 祐司,英文理解の多次元的な一貫性構築：テキスト，学習者，タスク要因を踏まえた統合的検証,本研究の目的は，英語学習者が文章理解の一貫性を構築するメカニズムについて，読解中の視線計測データに基づいて検証することである。本研究は研究代表者及び分担者がこれまで行ってきた英文理解の多次元性 (同一性・時間性・空間性・因果性・意図性) に関する研究をさらに発展させたものであり，多次元的な理解の一貫性の構築をテキスト要因，学習者要因，タスク要因の3つの観点から統合的に検証するものである。これまでに実施した研究と本研究の成果を統合することで，英文読解における一貫性構築メカニズムに関する理論的枠組みを確立し，現代に求められる英文読解力を育成するために有効な読解指導プログラムを開発する。,基盤研究(B),小区分02100:外国語教育関連,英語教育,リーディング,視線計測,文章理解,状況モデル,心理言語学,思考発話法,,,,,,,,,,,,,,,,,,,,,,,,,,,,,,,,,,,,,,,,,,,,,,,,,
19H01277,室蘭工業大学,HAGLEY ERIC,バーチャルエクスチェンジにおける英語と他文化理解向上,他国にいる学生とのオンライン交流によって日本人学生の英語力と異文化理解のスキルを向上させる。参加学生の異文化に対する感受性や国際相互交流に対する自信を高めると同時に自他の文化とその知識を深め、参加することにより英語を学ぶ動機となり、他文化への興味も喚起する。コミュニケーション能力、異文化理解能力、英語能力の向上を進めることで、このプロジェクトが学生のグローバルコミュニティでの活躍に役立つということを証明したい。,基盤研究(B),小区分02100:外国語教育関連,バーチャルエクスチェンジ,英語教育,多文化理解,文化間能力,英語能力,IVEProject,他文化間の理解,多文化交流,,,,,,,,,,,,,,,,,,,,,,,,,,,,,,,,,,,,,,,,,,,,,,,,
19H01276,北海道大学,河合 靖,多層言語環境における第二言語話者像―トランスランゲージング志向の会話方略,本研究は，第二言語習得の目標モデルをモノリンガル話者から第二言語話者に変更する方向へ向けた基礎研究である。日本語と英語を第二言語として話す話者の，文末表現，聞き手反応，意味交渉など会話方略のコード・スイッチングについて考察し，さらにそうした言語の混合使用への評価を，評価者の属性の違いにより比較して，将来の多層言語環境化した日本社会における第二言語話者像がどのように変化するか示唆する,基盤研究(B),小区分02100:外国語教育関連,多層言語環境社会,トランスランゲージング,言語混交会話方略,母語話者評価,第二言語話者像,タンデムラーニング,多層言語環境,タンデム学習,タンデム・ラーニング,会話方略,コードスィッチング,,,,,,,,,,,,,,,,,,,,,,,,,,,,,,,,,,,,,,,,,,,,,
23K20103,関西大学,新谷 奈津子,Testing and teaching second language pragmatic skills for studying abroad,"In this study, we will conduct a comprehensive analysis of the data obtained from the four tests designed to measure learners' implicit and explicit pragmatic knowledge, before and after their study abroad experience. The findings from this analysis will be presented at the American Association for Applied Linguistics (AAAL) conference in March 2025.",基盤研究(B),小区分02100:外国語教育関連,L2 pragmatics,Study abroad,第二言語語用論,語用論能力の測定,語用論能力のための教材開発,語用論能力測定,pragmatic competence,study abroad,pragmatic knowledge,SLA,implicit knowledge,,,,,,,,,,,,,,,,,,,,,,,,,,,,,,,,,,,,,,,,,,,,,
23K20102,同志社大学,赤松 信彦,概念基盤学習に関する横断的研究：日本人学習者の英語時制と相に関する知識獲得,外国語学習者にとって習得が困難であると考えられてきた文法において、概念基盤学習（言語を通して表出される概念を正しく理解し産出することに主眼をおいた学習アプローチ）の有効性が近年注目を集めている。本研究は概念基盤学習の理論的枠組みである認知言語学と社会心理学を複眼的に捉え、日本人英語学習者にとって最も効果的な概念基盤学習プログラムを探究する。具体的には、日本語と英語の表現形式のズレが学習困難を誘発すると考えられる英語の時制と相を研究対象とし、中学校・高校・大学における横断的研究を実施し、教育環境、学習内容、教材デザイン、学習形態の４つの観点から概念基盤学習の有効性について総合的に考察する。,基盤研究(B),小区分02100:外国語教育関連,外国語学習,文法知識の獲得,時制と相,認知言語学,母語の影響,英文法学習,概念基盤学習アプローチ,教材デザイン,時制,相,概念基盤学習,英語時制と相,,,,,,,,,,,,,,,,,,,,,,,,,,,,,,,,,,,,,,,,,,,,
23K20101,名城大学,西尾 由里,小・中・高・大へ接続する包括的発音に関する到達目標及び評価のガイドライン構築,小・中・高・大学生の英語発音に関する包括的な到達目標と評価のガイドラインの作成である。ガイドライン作成にあたり、各学年の代表的な教科書の単語出現頻度を調べるとともに、習得困難度（発音が困難である音声特徴）とインテリジビリティ（コミュニケーションの阻害要因となる音声特徴）の3つの視点を取り入れた音声項目を取り入れ、学習者の音声を分析し、最重要学習項目の優先順位を付ける。さらにその優先順位をつけた音声特徴を入れた教材として、英語母語話者の発音特徴を画像と学習者自身の発音映像を比較できるICT教材を開発効果測定、CAN-DOチェックリストや音声テストなどの評価の仕方を公開する。,基盤研究(B),小区分02100:外国語教育関連,英語発音,包括的発音学習基準,小中高大連携,発音困難度,評価,発音,ICT,単語頻度,発音指導書,インテリジビリティ,難易度,英語聞き取り能力,到達目標,教科書分析,習得困難度,ガイドライン,ICT教材,出現頻度,発音ガイドライン,,,,,,,,,,,,,,,,,,,,,,,,,,,,,,,,,,,,,
23K20100,早稲田大学,Detey Sylvain,From corpus to target data as steps for automatic assessment of L2 speech: L2 French phonological lexicon of Japanese learners,"The research is a multidisciplinary project involving linguists, computer scientists and second language education specialists. It aims at designing a methodological template for the development of automatic assessment systems of both phonetic forms and lexical use of L2 French phonological lexicon by Japanese learners. To do so, it is divided into two stages: (1) corpus parsing to determine essential targets; (2) specific data elicitation task design and completion to feed automatic systems.",基盤研究(B),小区分02100:外国語教育関連,spoken corpus,phonology,Japanese learners,lexicon,L2 French,Spoken corpus,,,,,,,,,,,,,,,,,,,,,,,,,,,,,,,,,,,,,,,,,,,,,,,,,,
23K20099,日本社会事業大学,斉藤 くるみ,視覚・聴覚等に障害をもつ人の英語能力の測定法の開発,既存の民間の英語検定における能力の測定が視覚障害者・聴覚障害者にとって公正なのか、ハードの面、モーダリティの視点、そして試験のコンテンツ（題材）の視点で検証する。それを通して、言語の本質とモダリティの関係を考察し、言語能力を聴力・視力と切り離せない四技能という視点で測定するのではなく、生成と理解という言語学的・脳科学的機能の視点で測定することが、より公正であることを証明する。またコンテンツによる不公正を証明することで障害を文化と認める根拠のひとつとして提示する。それらの結果を実際の試験作成により証明する。同じ工程を対象を他の障害（盲ろう・吃音・ディスレクシア等）に広げていく。,基盤研究(B),小区分02100:外国語教育関連,英語教育,検定試験,視覚障害,聴覚障害,英語検定,障害文化,能力測定,盲ろう,英語能力検定,外国語検定試験,スピーキング,ライティング,リスニング,リーディング,インターアクション,視覚障碍,,,,,,,,,,,,,,,,,,,,,,,,,,,,,,,,,,,,,,,,
23K20098,神戸大学,T・S Greer,Simulating the Wild through Experiential Language Learning (SWELL),継続課題のため、記入しない。,基盤研究(B),小区分02100:外国語教育関連,会話分析,外国語教育,英語教育,第２言語使用,英語学習,Task-based learning,Language use in the wild,応用言語学,Conversation Analysis,Task-based Learning,Role-play,Simulation,Experiential Learning,Simulated contexts,第２言語教育,Second language use,タスクベース学習,ロールプレイ学習,学外言語学習,,,,,,,,,,,,,,,,,,,,,,,,,,,,,,,,,,,,,
23K20097,名古屋大学,杉浦 正利,日本語母語英語学習者の英語産出能力の発達研究,日本語を母語とする英語学習者が、英語を使って話したり書いたりできるようになる第二言語（外国語）の習得過程に関する基礎的データを初期段階から収集し、第二言語処理能力の発達過程を明らかにする。,基盤研究(B),小区分02100:外国語教育関連,第二言語処理能力,学習者コーパス,スピーキング,統語発達,流暢性,含意スケーリング,ライティング,コンストラクション,縦断的コーパス,処理可能性理論,IPSyn,Step-Up English Project,Step-up English Project,,,,,,,,,,,,,,,,,,,,,,,,,,,,,,,,,,,,,,,,,,,
20H01294,中部大学,深谷 圭助,複言語学習における汎用的な言語間共通学習方略モデルの開発に関する国際比較研究,小学校外国語教育が日本で本格的に始まった。一方で言語学習に対する動機づけや学習方略の問題は課題として残されたままである。本研究は、複言語学習において国や言語を超えた言語間共通学習方略モデルとして期待される「辞書引き学習」に期待される動機づけと学習方略の有効性について、国際比較教育実践を通して明らかにすることを目的とする。具体的には、①日本、イギリス、シンガポールの学校においてJBモデルを導入し、②第一言語学習、第二言語学習、第三言語学習の実践からデータ収集を行い、③データ分析を通して、JBモデルの動機付けと方略の有効性について明らかにし、④汎用的言語間共通学習方略モデルを確立することを目指す。,基盤研究(B),小区分02100:外国語教育関連,複言語教育,複文化教育,学習方略,自律学習,英語教育,中国語教育,フランス語教育,辞書引き学習,複言語主義,複言語学習,学習方略モデル,外国語教育,国際比較教育,欧州共通言語参照枠,イギリスにおける言語教育,シンガポールにおける言語教育,多言語教育,共通学習方略モデル,欧州言語共通参照枠,第二言語教育,第三言語教育,中学校英語教育,高等学校中国語教育,日本語教育,,,,,,,,,,,,,,,,,,,,,,,,,,,,,,,,
20H01293,椙山女学園大学,樋口 謙一郎,対外言語普及の新たな焦点と「現地主義」アプローチ,諸国家が自国の言語を海外に普及させようとする施策・活動（対外言語普及）に関する既存研究の理念・方法論を整理した上で、対外言語普及の新たな事例として、①中国の「孔子学院」に対する普及先（現地）の受容／反発プロセスと「シャープパワー」脅威論、②韓国の「世宗学堂」の進出が対韓認識の変化と現地コリアンコミュニティに及ぼす影響について詳らかにし、③対外言語普及の「現地主義アプローチ」の可能性と課題を討究する。,基盤研究(B),小区分02100:外国語教育関連,対外言語普及,現地主義アプローチ,言語政策,消滅危機言語,アーカイブズ,現地主義,韓国,米国,英国,沖縄,ウイルタ,中国,マレーシア,ドイツ,シリア,,,,,,,,,,,,,,,,,,,,,,,,,,,,,,,,,,,,,,,,,
20H01292,早稲田大学,澤木 泰代,英語要約ライティング学習・指導用オンライン教材の作成とその妥当性の検証,本研究では、英語での学業従事や研究遂行上欠かせない要約の書きかたの学習・指導と評価のための大学英語アカデミック・ライティング授業用オンライン教材を開発し、その妥当性を検証する。潤沢な学習者用フィードバックを特徴とする学習管理システム（LMS）用教材を作成し、国内複数大学に在籍する学生の教材学習記録や教員インタビュー結果などを多方向から分析することで、本教材で提供する要約学習・練習メニューや解答フィードバックを介した学習の効果と、教材使用者（教員と学生）の視点からの本教材の意義を実証的に検証する。,基盤研究(B),小区分02100:外国語教育関連,要約ライティング,アカデミック・ライティング,形成的評価,統合型ライティング,授業内評価,自動フィードバック,ICT活用教育,Idea Unit,ICT教育,ICT妥当性,採点支援システム,,,,,,,,,,,,,,,,,,,,,,,,,,,,,,,,,,,,,,,,,,,,,
20H01290,明治大学,廣森 友人,英語学習における「やる気の伝染」メカニズムの解明,本研究の目的は，英語学習のやる気（動機づけ）が伝染するメカニズムを解明することである。ペア/グループ活動に焦点を当て，学習者の動機づけが変化/発達するプロセスを複数の研究手法を組み合わせ統合的に記述/分析する。本研究は，やる気が伝染するとはどのような心理学的現象なのか，やる気が伝染する背景にはどのような認知/情意/行動的要因があるのかを明らかにするとともに，やる気の伝染を意図した実験授業（教育介入）を実施し，その有効性を検証する。,基盤研究(B),小区分02100:外国語教育関連,英語学習,動機づけ,エンゲージメント,ペアワーク,グループワーク,グループダイナミックス,やる気,,,,,,,,,,,,,,,,,,,,,,,,,,,,,,,,,,,,,,,,,,,,,,,,,
20H01288,東洋大学,淺間 正通,小学校英語教科化黎明期に顕現する学力差の緩衝を企図したミクシ型ウェブ教材の開発,2020年4月より小学校英語がついに教科化へと衣を替えて新たなステージに突入することとなった。現場の戸惑いを他所に、これまで比較的スムーズに進展してきたが、今後の黎明期にあっては4技能指導、評価、小中接続など克服すべき課題が多い。中でも、教科化対象となる児童たちの学力差の問題は深刻である。彼らの中には幼稚園段階から保護者の意向を拠り所に早四技能指導に触れてきた子もおり、当初段階からかなりの学力差が生じていることが予測できる。そこで本研究はフィンランドの教育に通底する「ミクシ」の発想を核として、ウェブ上に有用な教材を展開して児童間の学力差の緩衝を図るのを旨とする。,基盤研究(B),小区分02100:外国語教育関連,ミクシ,CLIL,小学校英語,ウェブ教材,小中接続,フラッグフットボール,4技能5領域,語彙習得,Pay Reward,Verso Programme,小学校英語教科化,Unity,プラットフォーム,小中英語連携,スローラーナー,4技能,学校外英語学習,プレラーニング,四技能連携,強調学習,ミクシ型教材,eラーニング,MIKSI,表現運動,語彙数,四技能,小中連携,TBCL,ミクシ型ウェブ教材,wiki CMS,,,,,,,,,,,,,,,,,,,,,,,,,,
