awardnumber,organization,name,title,abstract,section,review_section,keyword1,keyword2,keyword3,keyword4,keyword5,keyword6,keyword7,keyword8,keyword9,keyword10,keyword11,keyword12,keyword13,keyword14,keyword15,keyword16,keyword17,keyword18,keyword19,keyword20,keyword21,keyword22,keyword23,keyword24,keyword25,keyword26,keyword27,keyword28,keyword29,keyword30,keyword31,keyword32,keyword33,keyword34,keyword35,keyword36,keyword37,keyword38,keyword39,keyword40,keyword41,keyword42,keyword43,keyword44,keyword45,keyword46,keyword47,keyword48,keyword49,keyword50,keyword51,keyword52,keyword53,keyword54,keyword55,keyword56
18H00696,中央大学,若林 茂則,日本語母語話者による英語の主語・動詞・時制に関わる文法規則の習得と使用,本研究では極小プログラム（Chomksy 1995）の枠組みで仮説を立て、自己ペース読解速度測定でデータを集め、第二言語学習者の文法とその使用を記述した。英語の機能範疇Ｔは複数の規則に関わっている。第二言語学習者は、これらに対し母語話者と同じ反応を示す場合（文主語の義務性）とそうではない場合（主語と一致及び過去屈折）があった。実験参加者は英語母語話者および英語を第二言語として習得する日本語，中国語，タイ語の母語話者である。その結果に基づいて，第二言語習得の仮説を検討し、母語、インプットの影響、学習可能性について、知識・処理・記憶に基づく原理的説明を試みた。研究成果は国際学会や学術誌で発表した。,基盤研究(B),小区分02100:外国語教育関連,文法習得,動詞屈折,主語,極小プログラム,自己ペース読解速度,機能範疇,母語の影響,英語・日本語・中国語,生成文法に基づく第二言語習得研究,形式素性,ミニマリスト・プログラム,時制,機能範疇T,言語の習得と使用のモデル化,一致,自己ペース読解速度測定,素性,形態・統語,読み時間,形態統語,時制節,T,言語習得と使用のモデル化,,,,,,,,,,,,,,,,,,,,,,,,,,,,,,,,,
18H00695,神田外語大学,矢頭 典枝,多様な英語への対応力を育成するウェブ教材を活用した教育手法の研究,本科研では、前科研（課題番号：24320106）で開発した欧米の英語を中心とする7つの英語変種に関するウェブ教材に続き、5つの英語変種、すなわち、インド英語、フィリピン英語、マレーシア英語、スコットランド英語、ウェールズ英語の特徴を学ぶことができるウェブ教材を開発した。これらを活用して、大学生、高校生、英語教員、社会人を対象に多様な英語の特徴を教え、本教材が有効であることを実証した。研究成果として、アジア英語の特徴や「国際共通語としての英語」を中心とする論文と図書を刊行し、研究発表を行った。,基盤研究(B),小区分02100:外国語教育関連,ウェブ教材,社会言語学,世界の英語,World Englishes,英語変種,英語教育,アジア英語,教育メディア,英語モジュール,多様な英語への対応力,社会言語学的変異研究,,,,,,,,,,,,,,,,,,,,,,,,,,,,,,,,,,,,,,,,,,,,,
18H00694,明海大学,大津 由紀雄,学校英文法と学校国文法の連携に関する理論的・実証的研究,新たな学習指導要領にも盛り込まれた、英語教育と国語教育の連携を具体化するために必要な重要な作業の1つとして、学校英文法と学校国文法の連携がある。本研究では、英語教育、国語教育、日本語教育、言語学、認知科学の視点からその連携の可能性を理論的・実証的に探った。その結果、メタ言語意識（ことばへの気づき）を基盤とした連携の現実性と有効性が明らかとなった。理論面では、言語学と認知科学の知見を活かし、学校英文法と学校国文法の連携の方法を明らかにした。実証面では、その成果を基に、教案と教材を作成し、その有効性を確認した。,基盤研究(B),小区分02100:外国語教育関連,学校英文法,学校国文法,英語教育,国語教育,メタ言語意識,ことばへの気づき,認知科学,英語教育と国語教育の連携,日本語教育,メタ言語能力,,,,,,,,,,,,,,,,,,,,,,,,,,,,,,,,,,,,,,,,,,,,,,
18H00693,九州大学,内田 諭,大規模コーパスに基づく発信型和英連語辞書の構築に向けて,"本研究の目的は、発信型の和英連語辞書の基盤を構築することである。従来の和英辞書は「単語」を基礎単位として編纂されているが、本研究では「連語」を基礎単位とする。日本語の大規模コーパスから高頻度語の連語を抽出し、用例としての適切なものに修正した上で、日英対訳を実施した。その結果、約16,000フレーズを収録するデータベースを構築し、オンラインで公開した。本オンラインアプリケーションでは、名詞を中心とした約400語の見出し語を格ベースで検索できる「見出し語検索」と、データベースの全文を串刺し検索できる「全文検索」を提供し、ニーズに応じた柔軟な検索ができるようになっている。",基盤研究(B),小区分02100:外国語教育関連,和英連語辞書,コロケーション,コーパス,フレーズ,CEFR,,,,,,,,,,,,,,,,,,,,,,,,,,,,,,,,,,,,,,,,,,,,,,,,,,,
18H00692,鳴門教育大学,畑江 美佳,正確で流ちょうな英語リーディングの基盤を育成する小学校での文字指導,音声付きピクチャーカードを見るときの児童の眼球運動調査により、文字への注視が始まる時期や児童が文字を見る時の特徴を明らかにすることを目的に研究を進めてきた。その結果、①４年生以降文字への注視回数が増加すること、②発音の提示をしない方が文字への注視回数も時間も上回ること、③文字でも絵でも上にあるものへの注視回数・時間が増すことが明らかになった。,基盤研究(B),小区分02100:外国語教育関連,小学校英語教育,英語リーディング,教材研究,英語文字指導,文字指導,眼球運動,外国語教育,リーディング,ピクチャーカード,小学校英語,小学校英語文字指導,,,,,,,,,,,,,,,,,,,,,,,,,,,,,,,,,,,,,,,,,,,,,
18H00691,大阪大学,岩居 弘樹,音声認識とビデオ撮影による自己省察を基礎としたICT支援複言語学習モデルの研究,音声認識とビデオ撮影による自己省察を基礎とした複言語学習を大学および小学校で実施した．医療系大学では1学期で3言語を学習する講座を開講し，ビデオ，音声認識，語彙学習などのアプリを活用して，短期間で簡単な対話を行えるレベルに到達することができた．学習成果をビデオ撮影し振り返りをすることも，モティベーション維持，達成感，表現の定着に効果的であることも明らかになった．,基盤研究(B),小区分02100:外国語教育関連,複言語学習,音声認識,ビデオ撮影,ICT支援言語学習,初等教育,外国語学習,医療系大学外国語学習,オンライン学習,初等教育との連携,モティベーション向上,ビデオ交流,リフレクション,ICT,,,,,,,,,,,,,,,,,,,,,,,,,,,,,,,,,,,,,,,,,,,
18H00690,関西学院大学,泉 恵美子,小中接続を目指し学習者の思考・判断・表現と学びに向かう力を促進する授業設計と評価,小学校外国語活動及び外国語科における評価について，学習指導要領の3観点の特に「思考・判断・表現」と「主体的に学習に取り組む態度」の指導と評価のあり方を考察し，文部科学省共通教材や小・中学校外国語検定教科書の分析を行った。その結果も参考に，3年～6年，中学1年の各学年のパフォーマンス課題とタスク例，並びに4段階からなるCan-Do指標によるルーブリック試案を作成した。その際，5領域別または，統合型タスクを考案し，実際に小学校で授業実践やパフォーマンス評価を行い，児童の自己評価と教員の評価を比較し，どのように児童の思考力・判断力・表現力を深め，学びに向かう力を育成することができたかを考察した。,基盤研究(B),小区分02100:外国語教育関連,小学校外国語教育,Can-Do評価,パフォーマンス評価,思考・判断・表現,学びに向かう力,小中接続,有能感・自己効力感,自律性,小学校外国語,ルーブリック,文部科学省検定済教科書,小中連携,外国語教育,Can-Do評価とパフォーマンス評価,Can-Do尺度,小学校英語,検定教科書,授業設計とCan-Do評価,授業設計と評価,リタラシー指導,英語教育,Can-Do,,,,,,,,,,,,,,,,,,,,,,,,,,,,,,,,,,
18H00689,京都大学,塚原 信行,自治体移民言語政策と言語認識に関する国際比較研究,異なる歴史的背景を持つ9つの国において、自治体レベルで行われている移民の言語に対する政策や言語観を調査し、その結果を比較分析した。具体的には、次の3つの問いに沿って、調査結果を整理分析した。①移民は移民先の言語を話せるべきか、②移民先の言語が話せないことが原因で、なにかしらの権利が制限されることがあっても、それはやむを得ないことか③どのような状態になっていることが、移民が「統合」されているとみなされているか。,基盤研究(B),小区分02100:外国語教育関連,移民,言語,社会統合,自治体,言語意識,国民国家,言語政策,包摂,マイノリティ,コミュニティ,制度的条件,言語認識,,,,,,,,,,,,,,,,,,,,,,,,,,,,,,,,,,,,,,,,,,,,
18H00688,京都大学,西山 教行,『ヨーロッパ言語共通参照枠』に関する批判的言説の学説史的考察,本研究はCEFRに関わる批判的言説の学説史的考察をめざす。日本でも2004年に翻訳が刊行され好意的に受容されてきた。しかしヨーロッパではCEFRそのものに対する言語教育学からの建設的な批判が投じられている。本研究は欧州におけるCEFRの批判的言説を学説史の中から検証し，その妥当性を精査し，日本社会へ向けたCEFRの批判的受容を目指す。そのために、ドイツ語圏，フランス語圏，英語圏の批判的言説を学説史の観点から網羅的に調査し、批判的言説とCEFR増補版の比較分析を行い，その対応を考察した。これらの成果は国際研究集会ならびに研究会、書籍の刊行によって明らかにした。,基盤研究(B),小区分02100:外国語教育関連,CEFR,文脈化,学説史研究,言説分析,外国語教育学,外国語教育,複言語主義,言語教育学,学習モデル,ヨーロッパ言語共通参照枠,批判的言説分析,,,,,,,,,,,,,,,,,,,,,,,,,,,,,,,,,,,,,,,,,,,,,
18H00687,東京学芸大学,粕谷 恭子,英語教員養成コアカリキュラムの検証と具体的・包括的プログラムの開発,「小学校教員養成課程 外国語（英語）コアカリキュラム」、「中・高等学校教員養成課程 外国語（英語）コアカリキュラム」で挙げた学習項目と目標について、どのように扱うかをモデルプログラムという形で提案した。モデルプログラム作成のために、コアカリキュラムの先行実施を妥当性・効果の検証、大学教員対象のアンケート、大学教員への聞き取り調査、各大学のシラバスの検討を行った。,基盤研究(B),小区分02100:外国語教育関連,英語教育,教員養成,コアカリキュラム,小・中・高 英語教育,モデルプログラム,教員養成コアカリキュラム,,,,,,,,,,,,,,,,,,,,,,,,,,,,,,,,,,,,,,,,,,,,,,,,,,
18H00686,東京外国語大学,富盛 伸夫,アジア諸語の言語類型と社会・文化的多様性を考慮したCEFR能力記述方法の開発研究,「ヨーロッパ言語共通参照枠組み」(以下CEFR）は急速に世界各地域に普及しつつあり言語教育の理念と現場を変容させている。本研究は日本語を含めた非EU言語へのCEFRの適用妥当性を精査しつつ、第一に、東南アジア諸語教育への適用に際して社会・文化的特質を考慮した新たな言語能力記述方法を提案してCEFRの適用可能性を拡げ、第二に、アジア諸語圏の複言語・複文化社会における言語コミュニケーション能力の評価法を検証した。第三に、日本の現代社会のニーズも視野に入れ、CEFR受容と関わる中等教育・高等教育の接続と複言語・複文化教育政策の問題点を指摘した。以上の研究成果は東京外国語大学のサイトで発信している。,基盤研究(B),小区分02100:外国語教育関連,CEFR,アジア諸語,言語類型,社会・文化的特質,言語コミュニケーション能力評価法,言語運用の社会的・文化的適切性,参照軸としてのアジア諸語研究,社会・文化的適切性,言語能力記述法,能力記述法,社会・文化的多様性,言語コミュニケーション能力記述法,,,,,,,,,,,,,,,,,,,,,,,,,,,,,,,,,,,,,,,,,,,,
18H00685,東京外国語大学,吉冨 朝子,CEFR-Jに準拠した入学から卒業までの英語スピーキング能力の指導・評価システム,本研究では、大学における英語スピーキング能力の育成を目指して、入学から卒業までの長期にわたり、CEFR-Jに準拠した体系的な指導と多面的な評価の一体化を実現するシステムを構築することを目的とした。具体的には、入学時の診断的評価として利用可能な個別試験のスピーキングテスト、および学習支援の指導過程における形成的評価のための、CEFR-Jに基づいたスピーキングタスクを開発し、評価体制および学習支援内容の構造化を行った。それぞれの評価の結果を指導に活かすことを通して、一貫した到達度指標に準拠した評価を指導につなげることを試みるとともに、学習成果をeポートフォリオの形で可視化した。,基盤研究(B),小区分02100:外国語教育関連,英語スピ―キング力能力,CEFR-J,指導・評価システム,英語スピーキング能力,,,,,,,,,,,,,,,,,,,,,,,,,,,,,,,,,,,,,,,,,,,,,,,,,,,,
18H00684,筑波大学,木田 剛,模擬国連を中心としたグローバル教育における国際交渉力の調査研究,単なる英語運用能力を越えて国際場裡の問題を解決するために交渉・対話の場でリーダーシップを発揮して合意形成を先導していく実践的な能力と定義した国際交渉力をグローバル人材育成の重要な要素と捉えて、その教材として活用されている模擬国連（MUN）に参加する異なる学生の変化を実証的に分析し、国際交渉力の発達に相応しい学修環境の特徴を調査した。異なるMUNの比較や検証結果から国際交渉力の具体的な学習評価指標を開発し、得られた評価指標をもとに合理的なグローバル教育の方向性や指針を示した。また、国際教育ためのツールとして果たす潜在性を検証し、我が国の高等教育における具体的な役割や位置付けを考察した。,基盤研究(B),小区分02100:外国語教育関連,グローバル人材育成,グローバル教育,国際交渉力,評価指標,外国語教育,模擬国連,大学の国際化,国際比較,コンテンツ中心学修,国際交渉学,外国語評価研究,英語模擬国連,コンテンツ中心学習,学際型プログラム,,,,,,,,,,,,,,,,,,,,,,,,,,,,,,,,,,,,,,,,,,
18H00683,東北大学,岡田 毅,大学入試改革を契機とする新しい高大接続英語教育用eラーニングパッケージの開発研究,研究期間初頭の令和元年末までは初期の目標を達成しe-ラーニングシステムの開発研究と実証試験、協力関係諸機関に対する普及と国内外学会・研究会での発表等を行うことができた。しかし、大学入試における英語外部認定試験導入の見送りとCOVID-19の世界的流行のために、システム開発や実践授業への普及、各種のシンポジウムを含む具体的な研究手法の決定的な変更を余儀なくされた。,基盤研究(B),小区分02100:外国語教育関連,e-ラーニング,大学入試,高大接続,英語教育,英語学習者コーパス,入試改革,eラーニング,英語学習者データ,英語読解力,学習プロセス,オンライン授業,英語読解力指導,教員コミュニティ,TOEFLテスト,TOEFL,ブレンディッドラーニング,協働学習,学習者データ,コーパスアノテーション,教員協働,EFL教材,大学入試改革,教材開発,英語4技能,,,,,,,,,,,,,,,,,,,,,,,,,,,,,,,,
18H00682,北海道大学,田邉 鉄,初級学習者を対象としたコンテンツ駆動型中国語学習基盤の構築,初級段階の外国語授業では、コンテンツへの興味で動機付けを維持するような手法は取りにくい。そこでコンテンツそのものではなく、コンテンツを学ぶために必要なスタディスキルを習得するための外国語授業の効果を検証した。スキルベースの授業に合わせた教科書、オンライン教材、単語集、レファレンスマニュアル等を開発し、それらを用いた授業を実施した。翻訳などのネットサービスを用いることで、単調な外国語訓練のストレスを減じ、また、興味ある分野を学ぶためのコンピュータ・リテラシを授業内容とすることで、動機付けの維持向上効果が見られ、主として情意面の効果を確かめることができた。,基盤研究(B),小区分02100:外国語教育関連,データ駆動学習,初修外国語,スタディ・スキル,データベース,高等教育,CLIL,アクセシビリティ,中国語学習,スタディスキル,中国語教育,データーベース,授業開発,,,,,,,,,,,,,,,,,,,,,,,,,,,,,,,,,,,,,,,,,,,,
19H01292,関西学院大学,門田 修平,シャドーイングが英語学習者のメタ認知に与える効果：ＮＩＲＳによる脳内機構の解明,シャドーイング学習には、第二言語習得に不可欠なメタ認知的モニタリングを促進する効果が仮定できる。この効果を、音声を聞いて意味を理解するリスニングと比較・対照することを通して、①学習者のシャドーイング時のメタ認知的活動（モニタリングおよびコントロール）が、リスニング時と比べて高まるのかどうかについて、特に、大脳前頭前野の活動（血中Hb濃度）を近赤外分光法（NIRS）によって検証し、②シャドーイング及びリスニング後に刺激再生法インタビュー（stimulated recall interview）を実施して、学習者の意識的な内省を指標としたメタ認知的活動の質的分析を行おうとするものである。,基盤研究(B),小区分02100:外国語教育関連,シャドーイング,顔動画,fMRI,ワーキングメモリ,メタ認知活動,リスニング,第二言語習得,英語コミュニケーション能力,刺激再生法,近赤外分光法,,,,,,,,,,,,,,,,,,,,,,,,,,,,,,,,,,,,,,,,,,,,,,
19H01291,立命館大学,田浦 秀幸,日英バイリンガルの言語習得と喪失メカニズム探索fNIRS研究,日英バイリンガルの英語習得と喪失メカニズム解明を、言語側面と脳賦活の両面から行う研究である。英語習得データは英語圏在住で現地校に通いながら土曜日本語補習校にも通学する日本人児童・生徒から、英語の保持・喪失データは国内の英語保持教室に通う小中高帰国生から収集する。研究当初２年間で横断データ、それ以降は縦断データを収集し、言語習得・喪失メカニズムの一般化モデルを模索する。英語の口頭・書記データに加えて脳賦活データも収集する。表象言語とアルファベット言語の組み合わせである日英バイリンガル対象に、英語習得と喪失メカニズムを言語面・脳コネクトーム面から探る。,基盤研究(B),小区分02100:外国語教育関連,バイリンガリズム,言語習得,言語喪失,言語脳科学,帰国生,fNIRS,表象言語,コネクトーム,EEG,眼球運動,言語習得と喪失,言語習得喪失モデル,脳賦活,言語保持,表象言語バイリンガル,,,,,,,,,,,,,,,,,,,,,,,,,,,,,,,,,,,,,,,,,
19H01290,早稲田大学,村田 久美子,多言語ビジネス環境での共通語としての英語使用実態調査とグローバル人材育成教育,本研究では、特にアジアの多言語多文化状況下、ビジネス現場で共通語としてよく使われる英語(ELF)に焦点をあて、日本人とアジアのビジネスピープルのELFコミュニケーションの実態を調査、グローバル化が進み、ELFコミュニケーション増加の中、現場の実践に基づいた声をアンケート、インタビュー、ビジネス交渉の録音等によるデータで収集、多言語多文化状況下のビジネスELFコミュニケーションの実態、特に多様な言語資源をいかに活用しコミュニケーションが図られるかを、語用論、談話分析的視点で詳細分析、解明、この結果を基にグローバル人材育成に求められる言語（英語）教育及び政策への提言を纏める。,基盤研究(B),小区分02100:外国語教育関連,応用言語学,ELF,英語教育,ESP,社会言語学,BELF,,,,,,,,,,,,,,,,,,,,,,,,,,,,,,,,,,,,,,,,,,,,,,,,,,
19H01289,早稲田大学,折井 麻美子,小学校教員の英語発話能力向上を支援する：地域の枠を越えたブレンド型研修の試み,本研究は、地域の枠を越えて、国内各地の小学校教員の英語発話能力と指導スキル向上を、ICTと対面講習を併用した「ブレンド型研修」で支援してその効果を検証する。初年度は、研修ウェブサイトを構築し、2年目は、ICT研修とブレンド型研修を実施（発音ソフトは両方で使用）して効果を比較する。3年目は、都内教員対象、４年目・5年目は、各地の小学校教員対象に研修を実施し効果的な音声研修のあり方を検討する。,基盤研究(B),小区分02100:外国語教育関連,教員研修,ブレンド型,小学校,外国語,中学校,小学校外国語,ICT,発話,やり取り,やり取り指導,ハイフレックス,オンデマンド配信講義,発話指導,やりとり,発音,教室英語,ICT併用型,教科化,評価,小学校英語,スピーキング,会話,指導力向上,e-learning,発音ソフト,英語教育,,,,,,,,,,,,,,,,,,,,,,,,,,,,,,
19H01288,早稲田大学,神保 尚武,省察ツールとしてのポートフォリオの体系化と活用ガイドの開発,本研究は、省察ツールとしてのポートフォリオによって外国語の教育と学習の枠組みを体系化し、さらにその活用ガイドを開発することによって、「主体的・対話的で深い学び」の実現に貢献することを目的としている。J-POSTLエレメンタリーと児童の省察ツール(Lap Book)をテーマにプロジェクトを立ち上げ、J-POSTL活用ガイドの作成のノウ・ハウを活かして、それぞれの活用ガイドを開発することにした。,基盤研究(B),小区分02100:外国語教育関連,ポートフォリオ,行動指向アプローチ,ヨーロッパ言語共通参照枠,自立学習,学習ポートフォリオ,省察ツール,教育実践ツール,主体的・対話的学び,主体的学び,対話的学び,教師の自己評価,教育実践ツールとしてのポートフォリオ,主体的・対話的学び学び,ツールとしてのポートフォリオ,小学校英語指導者のポートフォリオ,Lap Book,,,,,,,,,,,,,,,,,,,,,,,,,,,,,,,,,,,,,,,,
19H01287,文教大学,千葉 克裕,英語多読学習が読解力・リスニング力に及ぼす影響：fNIRSによる分析,英語学習において大きな効果を示し、長く取り入れられている多読学習（簡単な英語の本を楽しみながら大量に読む）の効果を客観テストのスコアや1分当たりの読解速度（Word per Minute)、内容把握の正答率などの行動データに加えて、最新式の多チャンネルNIRS（近赤外線分光法測定装置：赤血球の量を量ることで脳活動の変化を測定する装置）を用いて測定することで、英語多読学習の効果を脳科学的に検証する。,基盤研究(B),小区分02100:外国語教育関連,多読学習,リスニング,脳血流,fNIRS,第二言語習得,NIRS,第二言語処理,読解速度（WPM),脳血流量,,,,,,,,,,,,,,,,,,,,,,,,,,,,,,,,,,,,,,,,,,,,,,,
