awardnumber,organization,name,title,abstract,section,review_section,keyword1,keyword2,keyword3,keyword4,keyword5,keyword6,keyword7,keyword8,keyword9,keyword10,keyword11,keyword12,keyword13,keyword14,keyword15,keyword16,keyword17,keyword18,keyword19,keyword20,keyword21,keyword22,keyword23,keyword24,keyword25,keyword26,keyword27,keyword28,keyword29,keyword30,keyword31,keyword32,keyword33,keyword34,keyword35,keyword36,keyword37,keyword38,keyword39,keyword40,keyword41,keyword42,keyword43,keyword44,keyword45,keyword46,keyword47,keyword48,keyword49,keyword50,keyword51,keyword52,keyword53,keyword54,keyword55,keyword56
23K25342,順天堂大学,山下 巌,クロスリアリティ空間の創出によって展開する発信力特化型医療英語学習COILの共同開発,本研究で設定した研究目的、すなわちXR空間を援用した発信力特化型のCOILによる医療英語学習モデルの構築に関連して、「開発」「展開」「検証」「発表」の4期に分けた研究段階を設定し、研究年度別にそれぞれ4つの研究目標を立てて実施してゆくこととした。以下、年度別に定めた目標に沿って具体的に実施してゆく。,基盤研究(B),小区分02100:外国語教育関連,フィンランド,看護英語,ウェブ型学習,COIL,国際共同開発,クロスリアリティ,メタバース,医療英語,,,,,,,,,,,,,,,,,,,,,,,,,,,,,,,,,,,,,,,,,,,,,,,,
23K25341,順天堂大学,大野 直子,多言語社会に対応した医療通訳者のためのヘルスコミュニケーション教育プログラム開発,本研究の核心をなす学術的「問い」は『多文化共生社会の一員として適切なコミュニケーションを行う医療通訳者をどう育成するのか，また医療者に医療通訳者との協働をどのように認識してもらうか』である。 そこで，本研究は，多言語共生社会の一員として活躍できる医療通訳者の質保証を目的として，医療通訳者と医療者向けのコミュニケーション技術研修・資料を新たに開発し，その実施と評価を行う。,基盤研究(B),小区分02100:外国語教育関連,医療通訳,ヘルスコミュニケーション,教育プログラム,コミュニケーション,多言語社会,多文化社会,プログラム開発,研修開発,外国人医療,医療コミュニケーション,,,,,,,,,,,,,,,,,,,,,,,,,,,,,,,,,,,,,,,,,,,,,,
23K25340,宮崎公立大学,Ducker Nathan,"Investigating the dynamic nature of listening comprehension in EMI lectures: A comparison of Japan, Hong Kong, and Sweden","Students attend a pre-interview to practice using the footswitch mechanism. Participants record their comprehension during the lectures. The research assistant will observe and take notes about the lecture. Using data collected during the lecture, stimulated recall interviews will be carried out.",基盤研究(B),小区分02100:外国語教育関連,Longitudinal,Comprehension,EMI,Lecture Comprehension,CDST,Listening Comprehension,,,,,,,,,,,,,,,,,,,,,,,,,,,,,,,,,,,,,,,,,,,,,,,,,,
23K25339,北九州市立大学,ジェニファー ラーソンホール,Language Attrition Across Fifty Years and Five Languages,"This research project collects information from former missionaries who spoke one of five languages (Japanese, Korean, Finnish, Spanish and Portuguese) in order to investigate their language abilities when they do not use the language regularly. The length of time between the end of the mission and testing ranges from 2 months to more than 50 years. A total of 135 participants per language, spread out across the attrition period, will be collected. Participants are tested on vocabulary and the ability to speak the language.",基盤研究(B),小区分02100:外国語教育関連,language acquisition,attrition,vocabulary,lexical analysis,individual differences,language attrition,fluency,motivation,,,,,,,,,,,,,,,,,,,,,,,,,,,,,,,,,,,,,,,,,,,,,,,,
23K25338,神戸大学,石川 慎一郎,ICNALE-WE22：アジア圏22か国を網羅する新しい英語学習者作文コーパスの構築と分析,アジア圏国際英語学習者コーパスICNALEは世界で広く活用されているが、カバーされている国は10か国・地域にとどまる。本研究課題は新たに10か国以上で作文収集を行い、データのカバレージの向上を目指す。あわせて、研究の中心対象となる日本人英語学習者のL2産出の特性を多元的に解明するため、比較用のL1日本語データおよびL2日本語学習者データの収集と分析を実施する。,基盤研究(B),小区分02100:外国語教育関連,学習者コーパス,英語・日本語対照研究,作文分析,アジア圏,統計的言語分析,作文,評価,アジア圏学習者,,,,,,,,,,,,,,,,,,,,,,,,,,,,,,,,,,,,,,,,,,,,,,,,
23K25337,信州大学,酒井 英樹,小学校英語教育に関するエビデンス生成のためのアウトカム指標の開発・検証と公開,英語教育学において政策的・実践的判断に資するエビデンスの生成が求められているが、小学校英語教育研究では研究者や実践者が利用可能なアウトカム指標はほとんどない。そこで、学習指導要領で示されている「知識及び技能」、「思考力、判断力、表現力等」、「学びに向かう力、人間性等」の三つの構成要素から成る資質・能力に照らし合わせて５領域（「聞くこと」「読むこと」「話すこと［やり取り］」「話すこと［発表］」「書くこと」）のアウトカム指標を開発・規格化し、アウトカム指標の信頼性や妥当性を実証的に検討する。その上でアウトカム指標を公開する。,基盤研究(B),小区分02100:外国語教育関連,小学校外国語教育,アウトカム指標,テスト開発,,,,,,,,,,,,,,,,,,,,,,,,,,,,,,,,,,,,,,,,,,,,,,,,,,,,,
23K25336,東京外国語大学,野元 裕樹,マレー・インドネシア語における文法習得難易度解明のための容認性コーパス開発,本研究はマレー・インドネシア語を対象とした容認性コーパスを開発し、それを用いて同言語の主要文法現象について、学習者にとっての難易度を明らかにする。容認性コーパスとは、主要文法現象の例文をその容認性とともに収集し、整理したコーパスである。,基盤研究(B),小区分02100:外国語教育関連,容認性コーパス,文法習得,難易度,マレー語,インドネシア語,,,,,,,,,,,,,,,,,,,,,,,,,,,,,,,,,,,,,,,,,,,,,,,,,,,
23K25335,筑波大学,名畑目 真吾,日本語母語英語学習者の文章読解における眼球運動データベースの構築と公開,本研究は，日本語を母語とする英語学習者の文章読解における眼球運動データを収集し，それらをデータベースとして構築・公開することを目的としている。英文読解における眼球運動データの基本統計情報や特性を明らかにし，今後の英文読解研究が参照するための新たな基準を提示するとともに，英文読解の認知プロセスと文章及び学習者の特徴との関連を明らかにすることで，英文読解教材の開発や読解指導への示唆を得る。そして，収集したデータをデータベースとして整理し，国内外の研究者に対して広く利用可能にすることで，様々な研究者がこれらのデータを独自の視点や発想，技術で分析し，独創的かつ多様な研究を生み出すことを促進する。,基盤研究(B),小区分02100:外国語教育関連,英語教育,リーディング,視線計測,心理言語学,自然言語処理,文章理解,コーパス,,,,,,,,,,,,,,,,,,,,,,,,,,,,,,,,,,,,,,,,,,,,,,,,,
24K00097,関西大学,大津 由紀雄,外国語学習が母語への気づきを促進するメカニズムに関する理論的・実証的研究,外国語学習における学習者の母語への気づきの促進がどのような条件下で、どのようなメカニズムで起こるのかをを明らかにするために、これまでの研究成果を批判的に分析したうえで、理論の構築を行い、その理論の妥当性を検証するための実験を行う。また本研究では、現在までのところ、音韻、語の意味、語用の領域に比べ研究が手薄である統語および文の意味を主な対象とすることによって、この分野の研究に新たな展望を拓くことを目指す。この成果をもとにことばの教育に対して具体的提言を行うとともに、実証的な教材を提供することによって、研究成果を社会へ還元する。,基盤研究(B),小区分02100:外国語教育関連,ことばへの気づき,外国語学習,転移,メタ言語能力,,,,,,,,,,,,,,,,,,,,,,,,,,,,,,,,,,,,,,,,,,,,,,,,,,,,
24K00096,早稲田大学,佐々木 みゆき,第３言語圏への留学の効果：書き言葉の相互・相補作用や非認知能力の発達に注目して,留学の効果は、開始時の言語能力、滞在期間、現地語との接触時間などと有意な相関があるとされてきた。しかし、多言語主義（言語は「資源」であり、人は知り得た全ての言語を目的に応じて効果的に使う）に立った第１、第２、第３言語の長期的変化と相互の影響を調査した研究は少ない。特にAI 時代の思考力や判断力を支えるといわれる書き言葉を対象とした研究は皆無である。本研究は、日本人学習者を対象とし、第１、第２、第３言語の書き言葉やAIへ相互・相補作用や非認知能力を調査し、留学がその後の多言語共存社会で「主体的に考え、生き抜く力」にどのように影響するかを、長期的かつ大規模に調査する国内外に類を見ない試みである。,基盤研究(B),小区分02100:外国語教育関連,第３言語圏留学,書き言葉の発達,非認知能力の影響,,,,,,,,,,,,,,,,,,,,,,,,,,,,,,,,,,,,,,,,,,,,,,,,,,,,,
24K00095,早稲田大学,澤木 泰代,英語要約ライティングの形成的評価におけるフィードバック活用とその効果の検証,本研究では英語での学業や研究遂行上欠かせない要約ライティング力の育成を目指して、要約の書き方の学習から形成的評価までができる大学英語アカデミック・ライティング授業用オンライン教材を開発し、学習者や教師による本教材で提供する様々な種類の自動フィードバックや学習振り返り用資料の活用状況と、その効果を言語テスト妥当性の観点から系統立てて検証する。英語教育と自然言語処理研究者の連携により本研究を遂行し、要約、学習評価、自動ライティング評価、フィードバック自動生成の各研究分野への寄与を目指す。,基盤研究(B),小区分02100:外国語教育関連,要約ライティング,アカデミック・ライティング,形成的評価,自動フィードバック,ICT妥当性,,,,,,,,,,,,,,,,,,,,,,,,,,,,,,,,,,,,,,,,,,,,,,,,,,,
24K00094,早稲田大学,折井 麻美子,英語スピーキング指導のための小中連携型校内研修パッケージの開発と効果の検証,"本研究は, 小学校・中学校における外国語（英語）の「話すこと」の指導力の向上のために，小中の連続性に配慮した校内研修パッケージを開発し，その効果を検証することを目的とする。特に、即興性のある「やり取り」指導と「発表」指導に焦点をあて，指導法および学習内容の継続性に留意したカリキュラムを作成する。生徒が主体的に協同的に対話をしながら自律的に学習をすすめることができるようなプログラムの構築を目指す。",基盤研究(B),小区分02100:外国語教育関連,スピーキング,やり取り,発表,校内研修,小中連携,,,,,,,,,,,,,,,,,,,,,,,,,,,,,,,,,,,,,,,,,,,,,,,,,,,
24K00093,早稲田大学,Detey Sylvain,,"The aim of this research project is to evaluate the sustainable relevance of the notion of ""native speaker"" in the field of L2 pronunciation education, through an analysis of the perception of, and representations linked to, phonetic material that could be used in L2 French pronunciation education.",基盤研究(B),小区分02100:外国語教育関連,Native Speaker,Non-Native Speaker,Artificial Speaker,French,Pronunciation,,,,,,,,,,,,,,,,,,,,,,,,,,,,,,,,,,,,,,,,,,,,,,,,,,,
24K00092,早稲田大学,尾島 司郎,超長時間の早期英語学習が子供の言語・脳・認知に及ぼす影響の統合的研究,現在の日本では幼少期のうちに数千時間もの超長時間の早期英語学習を子供に与える家庭が出現している。しかし、子供の柔らかい脳に対してそのような強烈な学習経験がどう影響するか完全には分かっていない。本研究は、超長時間の早期英語学習が子供の英語、日本語・国語、一般認知能力の発達に対して及ぼす影響の全体像を明らかにするため、言語学・教育学・脳科学の複数の手法を組み合わせながら、学習の初期から最終段階までを対象とする大規模な実験を行う。これにより、人間の多言語獲得能力の性質の解明に貢献できるだけでなく、早期英語教育の議論の土台となる科学的データを社会に提供することを目指す。,基盤研究(B),小区分02100:外国語教育関連,早期英語教育,第二言語習得論,言語脳科学,,,,,,,,,,,,,,,,,,,,,,,,,,,,,,,,,,,,,,,,,,,,,,,,,,,,,
24K00091,淑徳大学,畑江 美佳,音韻符号化に焦点を当てた小・中を繋ぐ体系的な英語リーディング・プログラムの構築,本研究は，ピクチャーカードを見る時の児童の眼球運動の調査を行った前研究の結果を踏まえ，文字への注視が始まる時期や文字注視の特徴を生かした「読む」ことに焦点を当てた教材を開発し，正確で流ちょうに読むための「音韻符号化」を可能にする小学校での文字指導法を確立する。さらに，中学1～3年生に対して，意味を伴う短い文章を読む時の眼球運動を調査し，音読時，黙読時，音読の流ちょうさ，内容理解度などを検証し，「音韻符号化の自動化」を可能にする中学校でのリーディング指導法を試案し実証実験を行う。最終的に小・中連携の体系的な英語リーディング・プログラムを完成させることを目的とする。,基盤研究(B),小区分02100:外国語教育関連,リーディング,小学校英語,,,,,,,,,,,,,,,,,,,,,,,,,,,,,,,,,,,,,,,,,,,,,,,,,,,,,,
24K00090,広島市立大学,森田 光宏,英語コア語彙リストの作成とその学習可能性についての統合的研究,本申請では、日本人英語学習者の語彙習得における検定教科書の役割を解明するために、小中高生にとってのコア語彙とは何かを明らかにする。具体的には、(1) 小中高生にと,基盤研究(B),小区分02100:外国語教育関連,英語語彙学習,英語教育,教科書,コーパス,,,,,,,,,,,,,,,,,,,,,,,,,,,,,,,,,,,,,,,,,,,,,,,,,,,,
24K00089,神戸市外国語大学,濱田 彰,Professional Visionの可視化による英語教師認知の形成・変容過程の解明,本研究は，授業に対する英語教師認知が，どのような過程を経て形成され・変容するのかを明らかにする。具体的には，授業において高い指導力が要求される口頭訂正フィードバックを与える際に，教室で起こる現象 (生徒が話す英語，生徒とのやり取り，教室環境等) に対して，教師が，いつ・何に・どれくらいの選択的注意を向けているのかというProfessional Visionを視線計測で解析する。そして，口頭訂正フィードバックに対する教師認知の形成・変容に関わる要因の影響を説明する理論モデルを構築する。そのモデルに基づき，最終的には，英語教師認知の発達を促す英語教員養成プログラムの効果検証を行う。,基盤研究(B),小区分02100:外国語教育関連,英語教育,教師教育,教師認知,視線計測,訂正フィードバック,,,,,,,,,,,,,,,,,,,,,,,,,,,,,,,,,,,,,,,,,,,,,,,,,,,
24K00088,名古屋市立大学,梶浦 眞由美,マルチモーダル刺激の統合処理と外国語学習への効果 -眼球運動とMRI実験に基づく考察-,外国語学習において、動画キャプション等、様々な感覚から情報を得るマルチモーダルな刺激入力は、情報量が多く予測誤差が小さいため、理解や習得が促進されるとする一方、ワーキングメモリ(WM)に負荷がかかり過ぎ、同時に処理しきれず、習得に繋がらない可能性も示唆されている。本研究の目的は、マルチモーダル入力の効果に影響を与える要因を探索し、効果的なマルチモーダル情報の提示方法や外国語学習への応用の仕方を、トレーニング実験、視線計測実験、MRI実験から検討することである。さらに情報を瞬時に取捨選択し処理するWM実行機能に関連した複数刺激処理モデルを構築することにも取り組みたい。,基盤研究(B),小区分02100:外国語教育関連,視線計測,脳活動計測,第二言語リスニング,第二言語シャドーイング,マルチモーダル入力,,,,,,,,,,,,,,,,,,,,,,,,,,,,,,,,,,,,,,,,,,,,,,,,,,,
24K00087,広島大学,Fraser Simon,,"In the first year of the project, working with partner universities in Japan and the UK, corpora of written texts collected from students in the UK (UKC) and L1 Japanese learners (LJC) will be prepared for analysis. Corpus analysis of the UKC will begin. In the second and third years, we will analyse the LJC and work on developing IELTS knowledge-based vocabulary and collocation lists.",基盤研究(B),小区分02100:外国語教育関連,IELTS,vocabulary,writing,multiword expressions,word lists,,,,,,,,,,,,,,,,,,,,,,,,,,,,,,,,,,,,,,,,,,,,,,,,,,,
24K00086,岡山大学,阿部 真理子,縦断的データに基づいた高校生向け英語スピーキング能力の発達指標の開発と評価,本研究は、一連の研究、基盤研究(B)「縦断的コーパスの構築と日本人高校生の英語スピーキング力の発達過程の解明」（16H03455）および基盤研究(C)「縦断的コーパスを用いたスピーキング力の発達プロセスと発達要因に関する実証的研究」（20K00813）を発展させ、新たな展開・挑戦を行うものである。独自の研究資産（40万語規模の縦断的音声データとその書き起こしデータ、および5回のアンケート調査結果）を個人差という観点から分析する。スピーキング能力の発達を、言語的複雑性だけではなく、機能的適切度からも、時系列的に説明する。さらに発達に影響を及ぼしている要因についても明らかにする研究を行う。,基盤研究(B),小区分02100:外国語教育関連,縦断的コーパス,学習者コーパス,スピーキング能力,発達指標,言語産出,,,,,,,,,,,,,,,,,,,,,,,,,,,,,,,,,,,,,,,,,,,,,,,,,,,
24K00085,名古屋大学,村尾 玲美,英文産出の流暢性と動詞下位範疇化情報の知識を関連付ける基礎データの構築,本研究では動詞の使い方（動詞下位範疇化情報）の知識を測定する語彙テストを開発し、この知識が英文産出の流暢性といかに関係しているかを示す基礎データを構築する。流暢性はスピーキングとライティングにおけるポーズの生起回数・位置・長さおよび産出速度により評価する。動詞下位範疇化情報テストは、あらゆる母語を持つ英語学習者の能力値を推定できるよう、国際的な難易度基準を持ったコンピュータ適応型テストとして公開する。受験者の「動詞使用レベル」に加え、流暢性との関係や学習のヒントをフィードバックとして与えることにより、理論面だけでなく教育面においても貢献する。,基盤研究(B),小区分02100:外国語教育関連,動詞下位範疇化情報,語彙テスト,流暢性,,,,,,,,,,,,,,,,,,,,,,,,,,,,,,,,,,,,,,,,,,,,,,,,,,,,,
24K00084,名古屋大学,杉浦 正利,日本語母語英語学習者の第二言語処理運用能力の発達：習得から習熟へ,日本語を母語とする英語学習者が、英語を使って話したり書いたりできるようになる第二言語の習得過程に関する基礎的データ（スピーキング・ライティング・語彙サイズ）を、基礎段階の学習が一通り終わっている高校１年生から、大学生になる前の高校３年生までの３年間にわたって収集する。基礎的語彙・文法を一通り学習している習得段階から、そうした第二言語の基礎知識を使いこなすことができるようになる習熟段階への発達過程を分析することで、第二言語の処理運用能力がどのように発達するかを明らかにし、言語処理運用能力の発達理論を構築するための基礎的研究を行う。,基盤研究(B),小区分02100:外国語教育関連,スピーキング,統語発達,習熟段階,縦断的学習者コーパス,複雑性と流暢性,,,,,,,,,,,,,,,,,,,,,,,,,,,,,,,,,,,,,,,,,,,,,,,,,,,
24K00083,千葉大学,西垣 知佳子,ラーニングアナリティクスによる英語DDL（英語データ駆動型学習）の精緻化,2024年度は，公開中の小学生用および中高生用のDDL支援サイトについて，１)インターフェースを改修し，さらに使いやすいツールとする，2）ＤＤＬツールの機能を増やして，自学自習や家庭学習にも対応できるようにする，３)日英2言語併記の対訳付き教育用コーパスを拡大し，学習の際の適用範囲を広げる，４)自由に使えるDDLワークシートを公開する，また，5) 公開中の音韻認識ツールにあらたな学習ツールを追加する，６）ＤＤＬ実践を継続して行い，あわせて，７) DDLの普及を促すために，執筆，講習会，学会発表等でDDLを紹介していく。,基盤研究(B),小区分02100:外国語教育関連,データ駆動型学習(DDL),data-driven learning,コーパス,英文法学習,ICT,,,,,,,,,,,,,,,,,,,,,,,,,,,,,,,,,,,,,,,,,,,,,,,,,,,
24K00082,筑波大学,小泉 利恵,学習を促進する教室内スピーキング評価の継続的運用方法の検証,研究目的は、高校の英語授業内で行うスピーキング評価を、学習を促進する形で継続して運用するための方法を開発し、その有効性を検証することである。英語を適切に話す力を育成するためには、効果的な指導に加え、指導の効果を測定し、次の指導や学習に活かすために定期的に評価を行うことが必須である。しかし、その評価の運用には困難点が多い。スピーキングテストの作成、実施、採点、フィードバックという4段階において、運用時の困難点とその解決策を探り、その有効性を検証する。,基盤研究(B),小区分02100:外国語教育関連,スピーキング評価,テスト作成,実施,採点,フィードバック,,,,,,,,,,,,,,,,,,,,,,,,,,,,,,,,,,,,,,,,,,,,,,,,,,,
24K00081,筑波大学,小野 雄一,個別最適化されたe-Learningコースを活用したブレンド型授業ー学習行動に着目して,DX政策が推進され各教育機関における教育のデジタル化が加速化されている。現代日本の学校教育の二つの理念は個別最適な学びと協働的な学びとされており、さらなるICT促進が期待されている。近年のテクノロジーの進歩により学習者個々の学習成果からシステムが自動計算を行い最適な形で課題を自動提供する「個別最適化(Optimization)」が実装されている。本研究課題は広範囲の大学生英語学習者を対象に、視線計測情報なども含めた学習行動データ、教員と学習者に対する縦断的インタビュー調査、テストの成果などのデータなどに基づき個別最適化されたe-learningコースウエアを用いたブレンド型授業を検討する。,基盤研究(B),小区分02100:外国語教育関連,ブレンド学習,学習行動,個人要因,個別最適化,,,,,,,,,,,,,,,,,,,,,,,,,,,,,,,,,,,,,,,,,,,,,,,,,,,,
