awardnumber,organization,name,title,abstract,section,review_section,keyword1,keyword2,keyword3,keyword4,keyword5,keyword6,keyword7,keyword8,keyword9,keyword10,keyword11,keyword12,keyword13,keyword14,keyword15,keyword16,keyword17,keyword18,keyword19,keyword20,keyword21,keyword22,keyword23,keyword24,keyword25,keyword26,keyword27,keyword28,keyword29,keyword30,keyword31,keyword32,keyword33,keyword34,keyword35,keyword36,keyword37,keyword38,keyword39,keyword40,keyword41,keyword42,keyword43,keyword44,keyword45,keyword46,keyword47,keyword48,keyword49,keyword50,keyword51,keyword52,keyword53,keyword54,keyword55,keyword56
18K10375,公益財団法人東京都医学総合研究所,新村 順子,精神科病院における隔離拘束削減の取り組みに関する組織指導者の認識についての研究,文献検討と研究コアチームとのディスカッションにより、サービスユーザーに対する強制的なケアの削減に、ユーザーのトラウマを深く理解してケアを提供するトラウマインフォームドケア（TIC）が有効であることを確認した。また、海外の視察や先駆的実践者の招聘を通し、TICはリカバリーの視点を基盤に、サービスユーザーの参画を得ながら、スタッフ個人から組織管理者まで包括的に対象とすることが効果的であることを理解した。そして、サービスユーザーへの強制的なケアに関わる施設と地域のスタッフを対象にTICの教育プログラムを開発し効果評価を実施した。効果の継続には、組織管理者の研修への参加が影響していることが示唆された。,基盤研究(C),小区分58060:臨床看護学関連,trauma-informed care,coercive practive,mental health,トラウマインフォームドケア,態度変容,trauma informed care,coercive practice,community,human service worker,mental health nursing,co-production,acute psychiatric unit,organizational culture,精神科病院,隔離拘束,組織指導者,組織文化,,,,,,,,,,,,,,,,,,,,,,,,,,,,,,,,,,,,,,,
18K10374,福岡看護大学,岩本 利恵,患者力を高めるためのシミュレーション患者教育プログラムの開発と介入効果,本年度は、継続して、患者が医療者に伝えられること、伝えられていないことの体験についてのインタビュー・アンケート調査を難病患者を対象として実施した。またその結果を分析してまとめている。調査結果をもとに、患者を対象とした患者教育シミュレーション教育プログラムの計画を対面とZoom等を使用した教育の両方のプログラムを検討を継続して実施している。,基盤研究(C),小区分58060:臨床看護学関連,難病,患者,医療従事者,イミュレーション教育,患者教育,患者力,コミュニケーション,患者の思い,シミュレーション教育,ネットを使用した診療,インタビュー,プログラム,シミュレーション,,,,,,,,,,,,,,,,,,,,,,,,,,,,,,,,,,,,,,,,,,,
18K10373,兵庫医療大学,芝田 宏美,顔認証サーモグラフィの開発と臨床看護学への応用,研究の全体の構想は、新興感染症の感染制御に用いられているサーモグラフィの手法を基盤にして、感染症による発熱を検出する方法を確立することである。また、人工知能を用いて判定方法の客観的評価方法を構築する。本法の技術を用いて臨床看護業務に応用することである。発熱患者と健常者では顔面の温度パターンが異なることがわかった。健常者と疾患者の平均顔を作成し、特定部位の組合せにより両者の判別が可能なことがわかった。,基盤研究(C),小区分58060:臨床看護学関連,サーモグラフィ,感染制御,発熱判定,看護学,臨床看護学,検疫所,,,,,,,,,,,,,,,,,,,,,,,,,,,,,,,,,,,,,,,,,,,,,,,,,,
18K10372,武庫川女子大学,布谷 麻耶,クローン病患者の生物学的治療選択を支援するディシジョン・エイドの開発,本研究は生物学的治療選択に臨むクローン病患者の意思決定を支援するためのディシジョン・エイドを開発することを目的とした。まず専門医を対象に治療選択に関する全国規模のオンライン調査を行った。その結果をふまえ、オタワ意思決定支援フレームワークに基づくディシジョン・エイド原案を作成した。原案の有用性と妥当性、実行可能性を評価するために質問紙調査を行った。クローン病患者18名と医療者6名による評価結果から原案の有用性と妥当性、実行可能性が確認された。さらに、自由記述の評価結果から抽出された改善点をふまえ原案を修正し、エビデンスに基づくディシジョン・エイドを確定した。,基盤研究(C),小区分58060:臨床看護学関連,クローン病,ディシジョン・エイド,生物学的治療,意思決定,Shared decision making,,,,,,,,,,,,,,,,,,,,,,,,,,,,,,,,,,,,,,,,,,,,,,,,,,,
18K10371,四條畷学園大学,谷口 清弥,クリニック通院中のメンタルヘルス不調者へのセルフマネジマントプログラムの開発,研究者はこれまでセルフマネジメントプログラムを用いて介入し、介入群と対象群の群間比較により介入1か月後までの改善を確認した。そこで、本稿では介入3か月後までの変化を質的及び量的に明らかにすることを目的とした。,基盤研究(C),小区分58060:臨床看護学関連,メンタルヘルス不調,うつ,セルフマネジメント,プログラム介入,ワークショップ,心理教育,イメージ法,グループカウンセリング,セルフマネジマント,精神科クリニック,精神看護,介入研究,,,,,,,,,,,,,,,,,,,,,,,,,,,,,,,,,,,,,,,,,,,,
18K10370,摂南大学,竹下 裕子,暮らしの中でできる一般市民向け末期がん患者支援に関する教材・啓発プログラムの提案,本研究の目的は、一般市民が身近な暮らしの中で末期を含むがん患者を支える際に生じる課題抽出と課題解決に向けた教材開発、啓発プログラムの提案を行うことである。具体的には(1)終末期がん患者の社会的ネットワークに関する文献検討を行い、主介護者・家族、看護師が、患者を支える際に生じる課題について明らかにした。(2)一般市民900名を対象に無記名自記式質問紙による大規模インターネット調査法を実施した。対象者の背景、病状、交流の変化、支援、困難等の調査結果を得た。これらの成果を基に教材開発と啓発プログラムを作成し、Webサイトの基礎を構築した。,基盤研究(C),小区分58060:臨床看護学関連,がん罹患者,一般市民,支援,関係性,困難,がん患者,啓発プログラム,がん罹患,困難感,認識,がん看護,ターミナルケア,社会的ネットワーク,末期がん,患者支援,教材,,,,,,,,,,,,,,,,,,,,,,,,,,,,,,,,,,,,,,,,
18K10369,同志社女子大学,葉山 有香,IVRに携わる看護師の職業被ばく低減とチーム医療を推進する教育プログラムの開発,IVR（Interventional Radiology）は、医師・看護師をはじめとする多職種がかかわる医療であり、近年低侵襲治療として発達し利用頻度は急激に増加している。本研究の目的は、IVRに携わる看護師の職業被ばくの実態、認識・思い、知識、ニーズについて明らかにし、それをもとに職業被ばくを低減させるための研修会を行い、IVRに携わる看護師の職業被ばく低減とチーム医療を推進する教育プログラムを開発することである。,基盤研究(C),小区分58060:臨床看護学関連,職業被ばく,放射線,防護,インターベンショナルラジオロジー,チーム医療,教育,,,,,,,,,,,,,,,,,,,,,,,,,,,,,,,,,,,,,,,,,,,,,,,,,,
18K10368,金沢医科大学,深沢 裕子,統合失調症患者の過覚醒状態についてのセルフモニタリング技術の開発,地域生活をしている統合失調症罹患者4名に延べ43回のインタビューを行い，そのうち詳細に語っていた2名の語りから，自らの高い覚醒レベル（交感神経が亢進している状態）をどのように感じとっているかを明らかにすることができた．＜衝動性を伴う激しい怒りが急激に湧きおこっている感覚＞，＜攻撃的な感情が生じている感覚＞，＜苛立つ感覚＞，＜安泰を脅かされる感覚＞，＜冷静な態度がとれなくなっている感覚＞，＜気分の高揚感＞，＜精神活動が非常に亢進している感覚＞，＜身体が緊張している感覚＞を感じとっていた時は、覚醒レベルが高い状態であったことが明らかになった．,基盤研究(C),小区分58060:臨床看護学関連,統合失調症,覚醒の亢進,主観的感覚,再燃防止,増悪・再燃,過覚醒,セルフチェック,コントロール不能感,恐怖,過敏さ,頭痛,心の変調感,過覚醒状態,セルフモニタリング,再燃予防,,,,,,,,,,,,,,,,,,,,,,,,,,,,,,,,,,,,,,,,,
18K10367,東京医療学院大学,直成 洋子,がん看護に関わる認定看護師の専門的実践能力とキャリア成熟推進への支援モデルの構築,がん看護に関わる認定看護師の専門的実践能力およびキャリア成熟推進に向けた支援モデルを構築するための取り組みとして、全国のがん診療連携拠点病院のがん看護に関わる認定看護師を対象に、専門的実践能力に関する基礎的研究（量的研究・質的研究）により、専門的実践能力の特徴とその関連要因を解明した。また、キャリア成熟に関する研究によりキャリア成熟の特徴とその関連要因を明らかにした。,基盤研究(C),小区分58060:臨床看護学関連,がん看護,認定看護師,専門的実践能力,専門職,キャリア,指導,相談,支援モデル,キャリア成熟,,,,,,,,,,,,,,,,,,,,,,,,,,,,,,,,,,,,,,,,,,,,,,,
18K10366,東京慈恵会医科大学,福田 美和子,リフレクティブコミュニティを基盤としたクリティカルケア看護実践支援モデルの開発,本研究は、集中治療室や救命救急センターなどを代表とするクリティカルケア領域に勤務する看護師が、リフレクションの考えを基盤とした、互いに看護実践を支えあう関係がコミュニティとして構築できるようなプログラム開発を実施中である。,基盤研究(C),小区分58060:臨床看護学関連,クリティカルケア看護,看護実践力,リフレクション,ファシリテーター育成,プログラム開発,クリティカルケア,ファシリテーション,共同学習,ファシリテーター,教育プログラム開発,,,,,,,,,,,,,,,,,,,,,,,,,,,,,,,,,,,,,,,,,,,,,,
18K10365,昭和大学,富田 真佐子,ポートフォリオ・アプリを用いた炎症性腸疾患患者セルフケア看護支援プログラム,潰瘍性大腸炎とクローン病に代表される炎症性腸疾患は、若年者に多く発症する難治性の腸疾患である。セルフケアを支援するツールとして開発したポートフォリオアプリケーションソフトをさらにバージョンアップし、デザインの変更、患者への使用説明書の作成、Youtube動画の作成、ホームページの開設を行い、入院患者を対象としたセルフケア看護支援プログラムの準備を進めていた。,基盤研究(C),小区分58060:臨床看護学関連,炎症性腸疾患,セルフケア支援,ポートフォリオ,アプリケーションソフトウェア,健康支援アプリ,ICT,オンライン看護,セルフケア,看護支援,,,,,,,,,,,,,,,,,,,,,,,,,,,,,,,,,,,,,,,,,,,,,,,
18K10364,順天堂大学,長瀬 雅子,進行性神経難病者のエンドオブライフを見据えた支援システムに関する研究,本研究では、進行性神経難病者のエンドオブライフを見据えた緩和ケアニーズを解明し、治療選択における課題を明らかにした上で、どのような支援システムが必要かを提示することが目的だった。日本におけるWeb調査と質問紙調査を併用したサーベイランスとインタビュー調査を実施し、進行性神経難病患者・家族へのケアの継続性と包括性に着目した。インタビュー調査では、治療選択の際の思いを語ってもらい、人工呼吸器を装着するに至ったプロセスと、ケアへの期待を分析した。また、質問紙調査では、症状の進行と仕事継続との関連を明らかにした。,基盤研究(C),小区分58060:臨床看護学関連,神経難病,意思決定支援,エンドオブライフ,看護ケア,治療選択,生活上の選択,緩和ケアニーズ,緩和ケア,エンドオブライフケア,,,,,,,,,,,,,,,,,,,,,,,,,,,,,,,,,,,,,,,,,,,,,,,
18K10363,慶應義塾大学,山本 亜矢,糖尿病足病変による中足骨切断患者の歩行分析と生活の質に影響する要因の検討,今年度もCOVID-19の影響に加え、自身の所属先変更に伴い、共同研究者との会議や施設内における準備、実践が不可となり、当初の計画通り進めることができなかった。昨年度、予備的調査研究として、初年度研究協力者間で倫理審査を行い実施した、数名の糖尿病足病変患者の歩行分析を症例報告として「Comprehensive gait biomechanical,基盤研究(C),小区分58060:臨床看護学関連,糖尿病足病変,歩行分析,足底装具,足圧,QOL,中足骨切断,,,,,,,,,,,,,,,,,,,,,,,,,,,,,,,,,,,,,,,,,,,,,,,,,,
18K10362,千葉科学大学,高橋 方子,介護老人保健施設看護管理者を対象とした日本版バリューズヒストリーの開発,本研究は介護老人保健施設看護管理者を対象としたデルファイ法により日本版バリューズヒストリー（以下、日本版VH）を開発することを目的とした。その結果、日本版VHの構成項目として「安心できる環境」、「大事にしたいこと」、「健康上の問題に対する医師からの説明内容」「主治医に対する信頼」、「延命処置の希望」、「自分が希望する終末期医療に対する家族の同意」、「自分の意思決定の特徴」、「自分のコミュニケーションの特徴」などの22項目が抽出された。日本版VHの使用に関しては、深刻な健康問題が発生する前から考え、価値観は変化するため定期的に見直し、関係者と共有することが重要であることが確認された。,基盤研究(C),小区分58060:臨床看護学関連,バリューズヒストリー,介護老人保健施設,看護管理者,デルファイ法,終末期医療,施設長,入所者,,,,,,,,,,,,,,,,,,,,,,,,,,,,,,,,,,,,,,,,,,,,,,,,,
18K10361,秀明大学,瀬戸口 ひとみ,統合失調症者の病いとの「折り合い」尺度の開発及び「折り合い」支援プログラムの構築,統合失調症者が、地域で自分らしく生活するためには、病いと「折り合い」をつけることが必要と考え、まず「折り合い」の測定尺度を作成することを目的とし、協力を得られた当事者を対象に調査を行った。結果、「折り合い」尺度（案）33項目は、主因子法（プロマックス回転）によって4因子が抽出された。試案33項目は、項目分析によって24項目となり探索的因子分析の結果、信頼性は確保された。,基盤研究(C),小区分58060:臨床看護学関連,折り合い,統合失調症,病い,尺度開発,当事者,地域生活,尺度,統合失調症者,地域移行,統合失調者,,,,,,,,,,,,,,,,,,,,,,,,,,,,,,,,,,,,,,,,,,,,,,
18K10360,和洋女子大学,寺岡 征太郎,自殺企図者へのシームレスな看護支援～外来・入院・地域を繋ぐ連携と地域移行支援～,非構造化面接によって自殺企図歴がある患者（以下、自殺企図者）の体験と、自殺企図者が捉えていた支援内容を明らかにしたが、同時に自殺企図者の「生きづらさ」が浮き彫りとなった。この状況を踏まえ、自殺企図者の地域移行支援における課題の抽出を試みたが、自殺企図者の地域移行支援を阻む要素として多職種連携が機能しない要素が大きいことが分かり、当初の研究計画を一部見直すことにした。,基盤研究(C),小区分58060:臨床看護学関連,自殺予防,精神看護,地域移行支援,自殺再企図,自殺企図,自殺予防ケア,患者の体験,看護支援,,,,,,,,,,,,,,,,,,,,,,,,,,,,,,,,,,,,,,,,,,,,,,,,
18K10359,文京学院大学,奥原 秀盛,がん患者のサポートグループ参加の意味づけと生活への影響に関する縦断的研究,近年、がん患者の長期生存に伴い、治療を受けながら地域で生活するがん患者は増加している。そんな中、がん患者同士が集い語り合うサポートグループ（以下、SGとする）が注目されている。SG参加により心理的改善やQOL向上等の効果は明らかにされているが、彼らにとってのSG参加の意味づけや参加者同士の交流が、彼らの生活にどのような影響を与えているか、長期的視点から明らかにした研究は見当たらない。,基盤研究(C),小区分58060:臨床看護学関連,がん患者,サポートグループ,質的研究,がん患者支援,縦断的研究,,,,,,,,,,,,,,,,,,,,,,,,,,,,,,,,,,,,,,,,,,,,,,,,,,,
18K10358,国際医療福祉大学,石橋 昭子,統合失調症者に対するレスパイトケアモデルの開発と検証,本研究において、精神科訪問看護師と精神科病院看護管理者からみた日本の統合失調症患者のレスパイトケアの活用の現状を明らかにし、ケアモデル案を検討した。統合失調症患者のレスパイトケアは、訪問看護師、看護管理者とも約9割が必要だと回答した。看護管理者では75.4%で患者のレスパイトケアを受入れていたが、訪問看護師では16.9%しか活用していなかった。患者のレスパイトケアは、家族の休息のため以外に、患者の地域生活維持に向けた関係保持や症状悪化防止のためにも重要であり、実際に家族の要望や患者の意思決定により短期間の利用がされていた。,基盤研究(C),小区分58060:臨床看護学関連,統合失調症,地域で暮らす,レスパイトケア,レスパイトケアモデル,休息,精神科訪問看護,休息入院,統合失調症者,家族介護者,地域生活支援,レスパイト,生活の質（QOL),セルフマネジメント,ケアモデル,精神看護学,生活の質,地域生活,,,,,,,,,,,,,,,,,,,,,,,,,,,,,,,,,,,,,,,
18K10357,自治医科大学,半澤 節子,精神科病棟における身体拘束の最小化および最短化に向けた基礎的研究,本研究は、我が国の精神科病院における身体拘束の長期にある現状を踏まえ、身体拘束の解除時期、解除のための要因として精神科看護師の認知行動様式について、仮想事例を用いた自記式質問紙調査により評価した。68名の精神科看護師の回答を解析した結果、「日中3時間程度の部分解除を開始する時期」の最頻値は「7日目」およそ3割が最も多かった。その理由は、「暴力的な言動、不穏や興奮状態が減少もしくは消失する」「看護師との話し合いを理解し約束ができる」など、患者の精神状態が改善し、暴力的な言動が予測されない状況になるまで、身体拘束を継続しやすい認知行動様式があることが示唆された。,基盤研究(C),小区分58060:臨床看護学関連,身体拘束,精神科病棟,看護師,統合失調症,解除,看護師の認識,暴言暴力,精神科看護師,身体的拘束,精神科,認知行動様式,モラル,,,,,,,,,,,,,,,,,,,,,,,,,,,,,,,,,,,,,,,,,,,,
18K10356,高知県立大学,塩見 理香,自閉症スペクトラム障害者の対人関係におけるセルフコントロールを高めるプログラム,本研究の目的は、『自閉症スペクトラム障害者の対人関係におけるセルフコントロールを高めるプログラム』を作成することである。当事者に対人関係における困難感と対処方法について、看護師に対人関係におけるセルフコントロールを高める支援について面接調査を実施した。その結果、アセスメントの視点や感情や行動を制御するだけではなく、環境を整えることの必要性が考えられた。,基盤研究(C),小区分58060:臨床看護学関連,自閉症スペクトラム障害者,対人関係,セルフコントロール,困難感,自閉症スペクトラム症者,自閉症スペクトラム,自閉症スペクトラム障害,,,,,,,,,,,,,,,,,,,,,,,,,,,,,,,,,,,,,,,,,,,,,,,,,
18K10355,香川県立保健医療大学,岩本 真紀,外来化学療法を受けるがんサバイバーのストレングス尺度の開発,本研究は、がんサバイバーの力をストレングスの視点から測定し、ストレングスを基盤とした看護援助の評価に役立てるため、外来化学療法を受けるがんサバイバーのストレングス尺度を開発することを目的とした。先行研究と予備調査をもとに、29項目からなる尺度原案を作成した。外来化学療法を受けるがんサバイバーを対象に調査を実施し、147名の回答を得た。因子分析の結果、「生活に張りがある」「治療と生活のバランスがとれている」「自分の望む前向きな生活を送っている」と命名し、累積寄与率は52.92％であった。,基盤研究(C),小区分58060:臨床看護学関連,がんサバイバー,ストレングス,尺度開発,がん看護,,,,,,,,,,,,,,,,,,,,,,,,,,,,,,,,,,,,,,,,,,,,,,,,,,,,
18K10354,奈良県立医科大学,石橋 千夏,クローン病患者のセルフマネジメントの実態と関連する要因,本研究はセルフマネジメントを「慢性疾患を持ちながらも可能な限り身体の機能を引き出し人生の喜びを最大限に実現するために、その疾患が引き起こす身体上・精神上の課題に取り組むこと」とするLorig（2006）の指摘をもとに、クローン病患者のセルフマネジメントの実態と関連要因を明らかにすることを目的としている。,基盤研究(C),小区分58060:臨床看護学関連,クローン病,セルフマネジメント,尺度開発,,,,,,,,,,,,,,,,,,,,,,,,,,,,,,,,,,,,,,,,,,,,,,,,,,,,,
18K10353,大阪府立大学,徳岡 良恵,EGFRTKI投与を受ける肺がん患者が自己評価を行う皮膚障害予防プログラムの開発,本研究は、EGFRTKI投与を受ける肺がん患者による自己評価を用いた皮膚障害予防プログラムの開発と有用性や有効性を評価することを目的としている。2018年度～EGFR-TKI投与を受ける肺がん患者のスキンケア自己評価ツールを開発するために、【研究目的1・2】の看護師が患者のスキンケアを評価する視点および、患者のスキンケアの実際とスキンケアの効果を評価する指標について明らかにした。2021年度は、研究目的1、2および文献検討結果をもとに【研究目的 3】のEGFR-TKI投与を受ける肺がん患者のスキンケア自己評価ツール用いた教育プログラムを開発した。教育プログラムは、皮膚障害を予防するためのスキンケアの知識の提供とスキンケア方法の指導、皮膚の状態を自己評価するために、角質水分量の測定とGrade評価をすることとした。評価に基づいてスキンケア方法を自己で調整できるようにパンフレットを作成し提供するものとした。2021年度～【研究目的 4】教育プログラムの有効性・有用性を検証するために比較群をおく、準実験研究に取り組んでいる。プログラムは介入群にのみ実施し、有効性の評価は、Dermatology Life Quality Index（DLQI）、がん患者用自己効力感尺度、研究者が作成した皮膚の観察および実施状況調査用紙、および角質水分量、皮膚障害の重症度により、介入前/調査開始時、介入終了直後/初回調査8～12週間後、介入終了1か月後/2回目調査終了1か月後に評価を行っている。有用性の評価は、自記式質問紙により、看護プログラムの運営や内容についての有益性、難易度、負担感、看護プログラムに関する意見の自由記載により行っている。2022年度からは研究実施施設を2施設に増やしデータ収集を実施しているが、目標症例数には達していないため、データ収集を継続している。,基盤研究(C),小区分58060:臨床看護学関連,皮膚障害予防プログラム,スキンケア,評価,肺がん,自己評価,EGFRTKI,,,,,,,,,,,,,,,,,,,,,,,,,,,,,,,,,,,,,,,,,,,,,,,,,,
