awardnumber,organization,name,title,abstract,section,review_section,keyword1,keyword2,keyword3,keyword4,keyword5,keyword6,keyword7,keyword8,keyword9,keyword10,keyword11,keyword12,keyword13,keyword14,keyword15,keyword16,keyword17,keyword18,keyword19,keyword20,keyword21,keyword22,keyword23,keyword24,keyword25,keyword26,keyword27,keyword28,keyword29,keyword30,keyword31,keyword32,keyword33,keyword34,keyword35,keyword36,keyword37,keyword38,keyword39,keyword40,keyword41,keyword42,keyword43,keyword44,keyword45,keyword46,keyword47,keyword48,keyword49,keyword50,keyword51,keyword52,keyword53,keyword54,keyword55,keyword56
20K10821,四天王寺大学,宇佐美 しおり,重度・慢性精神障害者のセルフケア能力強化包括的支援マネジメントモデルの開発,"初年度に重度・慢性精神障害者の地域生活促進に実績のある精神科医療従事者60名にフォーカス・グループ・インタビュー（Focus Group Interview,以後FGI）を行い重度・慢性精神障害者のセルフケア能力強化,包括的支援マネジメントの実態を明らかにする。2年目にプロトコールを確定し介入群実施予定者77名に介入のための訓練を行う。その後，介入群40名にセルフケア能力強化を基盤とした包括的支援マネジメントを実施し，対照群40名と病状・日常生活機能・生活の質・再入院率・地域での生活期間で評価する。本研究は国内実践研究者1名,包括的支援マネジメント海外実践研究者1名の指導を得て実施する。",基盤研究(C),小区分58060:臨床看護学関連,セルフケア能力,重度慢性精神障害者,包括的支援マネジメント,PAS-SCT,セルフケア,重度・慢性,精神障害者,地域包括支援システム,重度慢性精神障害,セルフケアプログラム,PASセルフケアセラピイ,精神看護,重度・慢性精神障害,看護介入,ケアプロトコール,重度,慢性化,,,,,,,,,,,,,,,,,,,,,,,,,,,,,,,,,,,,,,,
20K10820,大阪医科大学,府川 晃子,分子標的薬内服治療を受ける肺がん高齢患者の自己管理支援プログラムの有効性の検討,本研究の目的は、研究者が先行研究で開発した「外来で分子標的薬内服治療を受ける高齢肺がん患者の自己管理支援プログラム」を臨床適用し、介入群と対照群の比較によって、プログラムの有効性および有用性を評価することである。本プログラムは、高齢肺がん患者を対象にしたインタビュー調査の結果をもとに作成し、患者が自身の望む生活や自分らしい生き方を看護師とともに振り返りながら、生活に合った自己管理の方法を考えるものである。,基盤研究(C),小区分58060:臨床看護学関連,がん看護,肺がん,高齢がん患者,がん薬物療法,がん薬物治療,分子標的薬,外来看護,分子標的薬治療,,,,,,,,,,,,,,,,,,,,,,,,,,,,,,,,,,,,,,,,,,,,,,,,
20K10819,星城大学,坂井 一也,統合失調症者に対する認知機能、対人関係改善に焦点を当てたプログラムの開発と検証,統合失調症者の社会的転帰（就労など）には、精神症状よりも認知機能と対人関係が大きく関与している。ブラインドサッカーは健常者（晴眼者）も目隠しをすることにより行えるスポーツであり、ブラインドサッカーによる簡単な練習が認知機能（注意・集中・情報処理）と対人関係の改善に効果があると報告されている。,基盤研究(C),小区分58060:臨床看護学関連,統合失調症,認知機能,対人関係,ブラインド,プログラム,,,,,,,,,,,,,,,,,,,,,,,,,,,,,,,,,,,,,,,,,,,,,,,,,,,
20K10818,日本福祉大学,高村 夢香,看護師が関節リウマチ患者に行う生物学的製剤自己注射指導プログラムの開発,関節リウマチ（RA）治療薬である生物学的製剤(BIO)のうち自己注射は、在宅医療推進、セルフマネジメント促進、患者個々のライフスタイルや社会的役割に合わせた各観点から重要な位置づけにある。身体のみならず心理社会的効果が高い一方、感染症等の副作用があり、感染予防や早期対処が求められ指導における看護の役割は大きい。,基盤研究(C),小区分58060:臨床看護学関連,関節リウマチ看護,生物学的製剤,意思決定支援,Shared decision making,意思決定ガイド,ディシジョン・エイド,生物学的治療,意思決定,自己注射,自己注射指導,プログラム開発,,,,,,,,,,,,,,,,,,,,,,,,,,,,,,,,,,,,,,,,,,,,,
20K10817,金沢医科大学,松井 希代子,糖尿病腎症患者の療養困難な認識パターンに対する療養継続を可能にする教育プログラム,先行研究で開発した「糖尿病腎症療養認識パターン分類」尺度の質問紙調査により、療養行動実行の継続と腎機能の維持ができにくい、「現実逃避」「原因不明感」認識パターンの対象を選別し、対象とする。対象の認識パターンの経験学習プロセスの特徴および構造を明らかにする。それにより、経験学習プロセスの進展に支障をきたしている原因を明らかにし、看護介入方法を検討し明らかにする。療養行動継続し、腎機能を維持する教育プログラムを作成する。,基盤研究(C),小区分58060:臨床看護学関連,糖尿病,糖尿病性腎臓病,経験学習,療養認識,教育プログラム,糖尿病腎症,2型糖尿病,経験学習理論,療養困難,認識,,,,,,,,,,,,,,,,,,,,,,,,,,,,,,,,,,,,,,,,,,,,,,
20K10816,神奈川工科大学,田代 誠,精神科病院における長期入院患者の終末期に対する意思決定支援,精神科病院では長期入院患者の死が増加しているが、患者らは疾患や障害によって死の認識ができないことや臨終までの過程について自己決定することができない。また重要他者である家族は不在であることや精神科病院における身体合併症の治療や看護の整備不十分、終末期ケアに不慣れな職員といった課題もあり、十分な終末期ケアが提供されていない。,基盤研究(C),小区分58060:臨床看護学関連,意思決定支援,精神科,終末期,長期入院,看取り,ACP,長期入院患者,,,,,,,,,,,,,,,,,,,,,,,,,,,,,,,,,,,,,,,,,,,,,,,,,
20K10815,東京慈恵会医科大学,山下 真裕子,精神障害者のウェルビーイング理論に基づくセルフマネジメントプログラムの開発,精神障害者の地域移行および定着を促す取り組みが国の施策として実施されている．精神科病院の入院期間が短縮される中，地域を拠点とした共生社会の実現に向け，精神障害者への地域支援の充実が不可欠である．本研究では，地域で暮らす精神障害者を対象に，ウェルビーイング理論に基づくセルフマネジメントプログラムを開発する．本プログラムの特徴は，これまでの課題や問題に焦点を当てた支援ではなく，ウェルビーイング理論のうち，良かったことの想起によるポジティブ感情を持つ，目標と価値観を明確にする，強みに気づきそれを伸ばす，達成感の実感という4つ要素を主軸としてセルフマネジメント能力を高めることである．,基盤研究(C),小区分58060:臨床看護学関連,ポジティブ心理学,セルフマネジメント,精神障害者,地域支援,看護,セルフコンパッション,ストレングス,ウェルビーイング,プログラム,ウェルビーイング理論,ポジティブサイコロジー,３つの良いこと日記,インタビュー,,,,,,,,,,,,,,,,,,,,,,,,,,,,,,,,,,,,,,,,,,,
20K10814,聖路加国際大学,石井 歩,重症精神疾患患者周術期ケア質向上に向けた参加型学習プログラムの開発と評価,研究者が作成した「重症精神疾患患者周術期ケア学習プログラム」を、総合病院精神科病棟看護師を対象に開発、評価するため、以下３点から研究計画をする。,基盤研究(C),小区分58060:臨床看護学関連,重症精神疾患,周術期,教育プログラム,イーラーニング,重症精神疾患患者,周術期ケア,参加型学習プログラム,,,,,,,,,,,,,,,,,,,,,,,,,,,,,,,,,,,,,,,,,,,,,,,,,
20K10813,北海道医療大学,中安 隆志,精神障がい者のリカバリーを支えるコンコーダンスを活用した看護師教育プログラム開発,日本の精神医療は入院・収容型で、諸外国と比べ精神病床数が多く、平均在院日数も長いという課題を抱えている。長期入院精神障がい者の地域移行を促進するためには、生物学的な治癒や寛解を目指す従来の病理モデルから、たとえ症状や障害が続いていたとしても人生の新しい意味や目的を見出し、充実した人生を生きていくプロセスを指すリカバリー概念へと支援概念の転換が必要とされている。本研究では、リカバリーと概念的親和性の高いコンコーダンスを活用して、精神障がい者のリカバリーを支援するための看護師を対象とした教育プログラムを開発する。,基盤研究(C),小区分58060:臨床看護学関連,精神障がい,リカバリー,コンコーダンス,,,,,,,,,,,,,,,,,,,,,,,,,,,,,,,,,,,,,,,,,,,,,,,,,,,,,
20K10812,福岡県立大学,福田 和美,一般病棟での術後せん妄ケアにおける家族のケア参加プロトコールの構築,本研究は、一般病棟での術後せん妄発症時および予防的ケアの1つとして、家族のケア参加プロトコールを構築することを目指す。まず、全国の200床以上の外科手術を行う病院を無作為抽出し、一般病棟での術後せん妄ケアにおける家族のケア参加の実態調査を行う。次に一般病棟で術後せん妄ケアの経験のある看護師を対象にフォーカスグループインタビューを行い、家族のケア参加内容の検討を行う。２つの研究結果から得られた内容をもとに５年以上の急性期看護のキャリアを有する複数人の研究協力者（看護師）と研究者らで術後せん妄ケアにおける家族のケア参加プロトコールの試案を作成する。,基盤研究(C),小区分58060:臨床看護学関連,術後せん妄,家族,ケア参加,患者,家族参加,術後せん妄ケア,参加,,,,,,,,,,,,,,,,,,,,,,,,,,,,,,,,,,,,,,,,,,,,,,,,,
20K10811,高知県立大学,山中 福子,心不全重症化予防に向けたアウトカム評価に基づく患者教育連携プログラム,心不全重症化予防のための行動変容に必要な患者教育を成果（アウトカム評価）の視点から捉えなおし、心不全患者のための教育連携プログラムを開発するものである。,基盤研究(C),小区分58060:臨床看護学関連,心不全,患者教育,連携,心不全重症化予防,アウトカム評価,,,,,,,,,,,,,,,,,,,,,,,,,,,,,,,,,,,,,,,,,,,,,,,,,,,
20K10810,和歌山県立医科大学,辻 あさみ,大腸がん患者の多施設・多職種連携による就労支援プログラムの開発と評価,１．排便障害のあるLAR後の患者の就労と、職場で労働者を支援している産業保健師に焦点をあて、自記式質問紙調査および半構造化面接より労働者の就労状況および労働者と職場双方の就労に関する認識や職場風土などの実態を調査し、LAR後の労働者が就労継続を可能にするモデル要素を抽出する。,基盤研究(C),小区分58060:臨床看護学関連,就労支援,大腸がん,直腸がん,低位前方切除術後,排便機能障害,排便障害,低位前方切除術,大腸がん患者,がん患者,QOL,,,,,,,,,,,,,,,,,,,,,,,,,,,,,,,,,,,,,,,,,,,,,,
20K10809,奈良県立医科大学,橋本 顕子,地域で生活する統合失調症をもつ男性が抱える恋愛や性行為特有の問題への支援,統合失調症は高校生や20歳代を好発年齢とする精神疾患で、 対人関係の障害と言われる。統合失調症を持つ人にとって恋愛は究極な人間関係であり、リカバリーのプロセスである。恋愛は社会的文化的な影響を受け、男性では恋愛の目的に性行為も含めて考える人もいる。本研究では、統合失調症を持つ男性の恋愛や性行為特有の問題を解決するために、地域で生活する統合失調症を持つ男性を対象に、恋愛や性行為に関する年齢に応じた考えや悩み、その対処方法や支援方法を明らかにすることを目的とする。方法として、地域で生活する統合失調症を持つ男性やその支援施設を対象にアンケートやインタビューの調査をする。,基盤研究(C),小区分58060:臨床看護学関連,恋愛,精神障害,統合失調症,恋愛関係,精神保健サービス,性行動,,,,,,,,,,,,,,,,,,,,,,,,,,,,,,,,,,,,,,,,,,,,,,,,,,
20K10808,北里大学,中戸川 早苗,統合失調症をもつ人の就労と生活との調和を目指した看護実践モデルの構築と活用,統合失調症をもつ人の離職率は高く、就労支援のあり方が注目されている。私たちは、生活者としての側面を捉えた支援を行う必要があると考え、「統合失調症をもつ人の就労と生活との調和を目指した看護実践モデル」の開発を行った。開発したモデルを用いて「就労開始時の統合失調症をもつ人」に看護介入を行った結果、継続就労が図れ、「働くことにより希望を実現させていく生き方」を追求する事ができ、モデルの効果が確認された。本研究では、モデルの適用範囲をさらにひろげ、「就労準備段階にある統合失調症をもつ人」に看護介入を行い、モデルを評価・修正し精錬作業を積み重ね、モデルの構築を図り、臨床への活用に繋げることを目的とする。,基盤研究(C),小区分58060:臨床看護学関連,精神障害者の就労支援,看護実践モデル,統合失調症,リカバリー,就労支援,就労と生活との調和,,,,,,,,,,,,,,,,,,,,,,,,,,,,,,,,,,,,,,,,,,,,,,,,,,
20K10807,千葉県立保健医療大学,三枝 香代子,運動器外傷患者の回復過程における希望を維持する看護支援プログラム開発に関する研究,救急医療施設に搬送される多発外傷患者は、生命の危機を乗り越えたとしても身体の損傷が高度である。そのため、身体損傷の回復過程は、身体的・精神的な苦痛を生じストレスフルな状態である。そして、身体損傷の治療を終えても身体的後遺症や精神的な健康問題が生じている現状がある。,基盤研究(C),小区分58060:臨床看護学関連,運動器外傷,希望,回復過程,下肢開放骨折,外傷看護,運動器外傷患者,救急看護師,,,,,,,,,,,,,,,,,,,,,,,,,,,,,,,,,,,,,,,,,,,,,,,,,
20K10806,福島県立医科大学,菅野 久美,がん薬物療法における災害看護実践シミュレーション教育プログラムの開発,災害発生時にがん薬物療法に携わる看護師には，患者の生命の危機や抗がん剤暴露の危険性の判断，対応の即時性および適切性が加わる高度な看護実践能力が求められる．本研究では，主に地震災害を想定した看護実践シミュレーション教育プログラムを開発し，その効果を検証することを目的とした．これにより，看護師の実践能力向上と患者の安全の強化が期待される．さらに，例え災害が発生したとしても，中断をすることない継続治療が保障され，わが国のがん対策に合致した「がん医療の充実」およびがん医療の向上への貢献につながる．,基盤研究(C),小区分58060:臨床看護学関連,がん薬物療法,災害,看護実践,シミュレーション教育,,,,,,,,,,,,,,,,,,,,,,,,,,,,,,,,,,,,,,,,,,,,,,,,,,,,
20K10805,青森県立保健大学,千葉 武揚,がん治療を受ける患者・家族の在宅での急変時対応に関する地域連携モデルの構築,がん治療を受ける患者・家族は、自宅等で体調が急変した時の対応が最も不安だとしている。また、がん治療を担う多職種も在宅療養中に急変した際、常時対応可能な場所の存在が治療を継続するために不可欠であるとしている。一方、地域でがん治療を担う医師は担当患者への24時間対応が困難であることや急変時の対応が課題であるとしている。そこで、がん治療を受ける患者・家族が住み慣れた地域で安心して自分らしく療養生活を送るためには、急変時対応に関する地域連携の仕組みづくりが必要であると考えた。,基盤研究(C),小区分58060:臨床看護学関連,急変時対応,がん患者・家族,がん治療,在宅,地域連携モデル,,,,,,,,,,,,,,,,,,,,,,,,,,,,,,,,,,,,,,,,,,,,,,,,,,,
20K10804,山口大学,田中 愛子,アドバンスケアプランニングと同時に開始する患者の生活関係清算への支援に関する研究,人生の最終段階にある患者の中には「生活関係の清算が進まない」ことに苦悩する人がある。本研究は、アドバンスケアプランニング（ＡＣＰ）と同時に、看護師が患者の生活関係の清算への支援ニードを把握して、必要に応じた支援を行う方法を開発することにある。本研究の方法は、医師、看護師、弁護士等の専門職を対象としたインタビュー調査、その結果に基づいた看護師の役割と医療者 連携モデルの開発、看護師を対象とした全国調査の3段階で構成する。それらの結果から、生活者としての患者が生活関連のやり残した課題を全うして最期まで自分らしい人生を送ることができるチーム医療の方法を導き出すことを目指す。,基盤研究(C),小区分58060:臨床看護学関連,人生の最終段階のケア,アドバンスケアプランニング,チーム医療,生活関係の清算,遣り残しの仕事,看護師,ヘルスケアチーム,質問紙調査,模擬カンファレンス,医師,MSW,介護支援専門員,弁護士,医療ソーシャルワーカー,インタビュー,多職種連携,,,,,,,,,,,,,,,,,,,,,,,,,,,,,,,,,,,,,,,,
20K10803,山梨大学,長崎 ひとみ,臨床看護師による頭頸部がん患者（化学療法・放射線療法）のための食生活指導の展開,本研究の目的は，頭頸部がんにより化学療法，放射線療法を受ける患者の食事・栄養摂取状態と身体状態の分析結果から，患者の食生活改善のための指導指針を示し，臨床看護師による食生活指導指針の活用・評価を通して，新たな食生活指導体制づくりに向けて一歩を踏み出すことである。筆者のこれまでの調査結果を踏まえ，食生活指導指針を示し，臨床での活用に向けて患者，臨床看護師・医療者間で共有・評価し，頭頸部がん患者（化学療法・放射線療法）のための食事指導指針作成・活用による有効性を示唆する。,基盤研究(C),小区分58060:臨床看護学関連,頭頸部がん,放射線療法,化学療法,食生活指導,看護師,食生活,,,,,,,,,,,,,,,,,,,,,,,,,,,,,,,,,,,,,,,,,,,,,,,,,,
20K10802,福井大学,橋本 容子,看護師のACP支援の影響要因の構造の明確化および教育プログラム開発と効果の検証,本研究では対象者のエンドオブライフの質向上のための効果的なACP実施に向け、Advance Care Planning :ACPを支援する看護師の内発的動機づけを高めるACP支援教育プログラムの開発を目指す。まず看護師のACP支援の行動意図の影響要因の構造因子を明らかにする。得られた結果をもとに看護師のACP支援教育プログラムを開発し、効果の検証を行う。,基盤研究(C),小区分58060:臨床看護学関連,アドバンスケアプランニング,意思決定支援,看護師,エンドオブライフケア,慢性疾患患者,意思決定,ACP,アドバンス・ケア・プランニング,エンドオブライフ,人生の最終段階,終末期,看護師教育,計画的行動理論,エンド・オブ・ライフ,がん患者・非がん患者,,,,,,,,,,,,,,,,,,,,,,,,,,,,,,,,,,,,,,,,,
20K10801,国立研究開発法人国立がん研究センター,清水 陽一,がん関連症状へのケアに関する科学的根拠に基づいた実践の促進プログラムの開発,がん患者が経験する症状に対する看護ケアのエビデンスをスコーピングレビューもしくはシステマチックレビューの手法を用いて整理し、日本で活用可能な看護ケアのエビデンスの現状を明らかにする。次に、がん患者が経験する症状に対する看護ケアとして実際に行われているケアの実態を調査しエビデンスプラクティスギャップの現状を明らかにするとともに、エビデンスに基づいた看護実践の障壁と促進因子を調査し、エビデンスに基づいた看護実践を普及するための支援プログラムや情報プラットホーム等の開発を行い、その有用性及び実施可能性の評価を行う。,基盤研究(C),小区分58060:臨床看護学関連,支持療法,がん薬物療法,看護ケア,エビデンスに基づいた実践,化学療法,分子標的薬,抗がん剤,看護実践,がん,症状緩和,ケア,Evidence-Based Medicine,,,,,,,,,,,,,,,,,,,,,,,,,,,,,,,,,,,,,,,,,,,,
20K10800,日本赤十字九州国際看護大学,山本 孝治,クローン病患者のセルフケアの再構築を促進させる看護アセスメントツールの開発,クローン病は生涯にわたり療養が必要となるため、患者は病気と生活の折り合いをつけながらセルフケアを再構築していくことが重要となる。そこで本研究では、クローン病患者のセルフケアの再構築を促進させる看護アセスメントツールを開発することを目指す。研究は３段階のプロセスで行い、第１段階では、看護アセスメントの視点を明確化し、第２段階では、デルファイ法を用い看護アセスメントツールの妥当性・実用性について専門家集団のコンセンサスを得る。第３段階では、看護アセスメントツールを確定する。,基盤研究(C),小区分58060:臨床看護学関連,クローン病,セルフケア,看護アセスメントツール,成人期,診断後間もない,構築,再構築,アセスメントツール,,,,,,,,,,,,,,,,,,,,,,,,,,,,,,,,,,,,,,,,,,,,,,,,
20K10799,福岡大学,黒髪 恵,日本型リカバリープログラムを活用した精神科病棟でのリカバリー支援モデルの構築,本研究は、精神科病棟におけるリカバリー支援モデルの構築に関する介入研究である。精神科病棟では入院期間が短縮化している一方で再入院率は上昇しており、地域生活を維持できるような退院支援が課題となっている。入院患者は急性期か急性期を脱し回復期に移行する段階で退院となる。地域生活を定着するためには、精神疾患を持ちながら自分らしく生きることをイメージし退院することが必要である。,基盤研究(C),小区分58060:臨床看護学関連,精神科病棟,リカバリープログラム,コ・プロダクション,リカバリー志向プログラム,リカバリー,IPPO,医療者の変化,参加者の変化,リカバリー支援,モデル構築,,,,,,,,,,,,,,,,,,,,,,,,,,,,,,,,,,,,,,,,,,,,,,
20K10798,関西国際大学,櫻井 信人,心的外傷後成長を取り入れた自死遺族支援グループの構築,研究者らは、自殺後に遺された遺族へのケアに長年取り組んでおり、精神看護を専門とする看護師で構成された自死遺族支援グループを立ち上げ、研究と活動の両面から地域の自殺対策に取り組んできた。今回、自死遺族が集い語る場というこれまでの内容に加えて、身内の自死を経験した中でもポジティブな視点を獲得する心的外傷後成長（PTG）という新たな視点を取り入れた自死遺族支援グループの構築を目的に研究を計画した。,基盤研究(C),小区分58060:臨床看護学関連,自死遺族,自助グループ,アクションリサーチ,ポストベンション,自殺対策,心的外傷後成長,精神看護,自死遺族支援,支援グループ,ケア,,,,,,,,,,,,,,,,,,,,,,,,,,,,,,,,,,,,,,,,,,,,,,
