awardnumber,organization,name,title,abstract,section,review_section,keyword1,keyword2,keyword3,keyword4,keyword5,keyword6,keyword7,keyword8,keyword9,keyword10,keyword11,keyword12,keyword13,keyword14,keyword15,keyword16,keyword17,keyword18,keyword19,keyword20,keyword21,keyword22,keyword23,keyword24,keyword25,keyword26,keyword27,keyword28,keyword29,keyword30,keyword31,keyword32,keyword33,keyword34,keyword35,keyword36,keyword37,keyword38,keyword39,keyword40,keyword41,keyword42,keyword43,keyword44,keyword45,keyword46,keyword47,keyword48,keyword49,keyword50,keyword51,keyword52,keyword53,keyword54,keyword55,keyword56
24K13841,和歌山県立医科大学,山口 昌子,分子標的治療を受けるがん患者の皮膚障害セルフケア能力評価尺度の開発,分子標的治療薬による皮膚障害は、患者自らが皮膚の観察や予防（スキンケア）を中心としたセルフケアに取り組むことが対処方法となる。また、分子標的治療は、外来通院で受ける患者がほとんどで、今後もそのような患者は増えると考えられる。外来通院で患者が皮膚障害へのセルフケアを継続して重症化を予防していくためには、患者のセルフケア能力を高めていけるよう働きかけることが看護の役割である。以上のことから、皮膚障害の重症化予防および個々のニーズに合わせた看護支援を促進するために、看護師が活用できる「分子標的治療を受けるがん患者の皮膚障害へのセルフケア能力を把握する質問紙」を開発し、患者支援の質の向上につなげる。,基盤研究(C),小区分58060:臨床看護学関連,分子標的治療,皮膚障害,セルフケア,尺度開発,,,,,,,,,,,,,,,,,,,,,,,,,,,,,,,,,,,,,,,,,,,,,,,,,,,,
24K13840,兵庫県立大学,西岡 英菜,AYA世代がんサバイバーのトランジションを支える地域ケアモデルの開発,近年、がん治療成績の向上に伴い治療後長期生存者（サバイバー）が増加しており、長期的な生活の質の向上が重要な課題となっている。医療機関でがん治療を終えたAYA世代のがんサバイバーは在宅療養へ移行（トランジション）するため、地域医療の中でフォローアップが可能となる看護支援の在り方を検討する必要がある。,基盤研究(C),小区分58060:臨床看護学関連,AYA世代,がんサバイバー,長期フォローアップ,看護,,,,,,,,,,,,,,,,,,,,,,,,,,,,,,,,,,,,,,,,,,,,,,,,,,,,
24K13839,名古屋市立大学,飯田 美沙,腎代替療法選択におけるSDM（共同意思決定）を実践するための看護教育プログラム開発,本研究の目的は，慢性腎臓病患者の腎代替療法選択の意思決定プロセスに関わる看護師を対象にした，SDMを実践するための看護教育プログラム作成と効果の検証である．腎代替療法選択時のSDMは浸透しているとは言い難く，看護師が積極的にSDMを実践していくための方策は不充分な状況が続いている．本研究では，第1段階でSDMの実態と課題抽出，第2段階でSDMを推進する看護師のスキルや能力の明確化，第3段階で看護師の教育プログラムの作成と効果を検証する．本研究によりSDMを実践する看護師の育成が進むことによって，腎代替療法選択における患者の納得のいく意思決定に繋がる可能性があり，医療の質向上に貢献できる．,基盤研究(C),小区分58060:臨床看護学関連,Shared Decision Making,慢性腎臓病,腎代替療法選択,意思決定支援,看護教育プログラム,,,,,,,,,,,,,,,,,,,,,,,,,,,,,,,,,,,,,,,,,,,,,,,,,,,
24K13838,愛知県立大学,広瀬 会里,VRと広範囲投映によるリスクアセスメント教材を持続的に作成する学習モデルの構築,リスクアセスメントを学習するための360度全方位画像の映像教材を用いた学習プログラムを構築する。臨床現場の実践者の研究協力のもと、リスクアセスメントが必要とされる状況、課題、ニーズをふまえた学習コンテンツとし、没入感による知覚を伴う体験となるVRによる全方位画像の視聴から「気づく力」の育成を期待した教材とする。看護実践に不慣れな学生や新人看護師の看護実践への準備性を高める一役を担うと考える。,基盤研究(C),小区分58060:臨床看護学関連,看護教育,映像教材,リスクアセスメント,VR,,,,,,,,,,,,,,,,,,,,,,,,,,,,,,,,,,,,,,,,,,,,,,,,,,,,
24K13837,石川県立看護大学,美濃 由紀子,「司法精神看護学」教育のカリキュラムの開発と多職種連携教育方法の検討,日本における司法精神医療は、2005年の医療観察法の施行によって飛躍的に発展した新しい領域ではあるが、それらを支える看護職者への大学・大学院教育は、欧米に比べ立ち遅れている。そこで、本研究は「司法精神看護学」の学部・大学院教育の実態を明らかにすることを通じて、精神看護学のサブスペシャリティとしての教育基盤の確立にむけた「司法精神看護学」教育のカリキュラムの開発と多職種連携教育の方法を検討することを目的とする。本研究の実施は、大学における「司法精神看護学」教育の基盤作りと普及、司法精神医療に携わる看護師の底上げに寄与すると考えられる。,基盤研究(C),小区分58060:臨床看護学関連,司法精神看護学,医療観察法,多職種チーム医療,指定医療機関,精神保健看護学,,,,,,,,,,,,,,,,,,,,,,,,,,,,,,,,,,,,,,,,,,,,,,,,,,,
24K13836,東京都立大学,山下 真裕子,ストレングス強化型の精神障害者雇用促進モデルの開発,本研究は，ストレングスに焦点を当てた精神障害者参画型就労支援により，精神障害者のディーセントワークを実現できるかという問いに基づき，精神障害者のストレングスに焦点を当てた精神障害者雇用促進モデルを開発する．本モデルの特徴は，困りごとや障壁に焦点を当てた合理的配慮の促進ではなく，当事者参画によるストレングス強化型の就労アセスメントにより精神障害者と企業のニーズマッチングを図るものである．,基盤研究(C),小区分58060:臨床看護学関連,精神障害者,ストレングス,雇用促進モデル,地域支援,,,,,,,,,,,,,,,,,,,,,,,,,,,,,,,,,,,,,,,,,,,,,,,,,,,,
24K13835,筑波大学,大脇 由紀子,飲酒に弱い体質や顔面紅潮を自覚する飲酒者への遺伝子多型情報を用いた介入の検討,アルコール代謝酵素の活性型と飲酒や喫煙などの生活習慣により、急性アルコール中毒、がん、依存症等の健康障害のリスクは異なる。特に代謝酵素の活性型と生活習慣の関連が指摘されている食道がんや口腔・咽頭がんのリスク要因として、喫煙の影響も大きい。本研究は、アルコール代謝酵素の低活性型が予測される対象を中心に、アルコールと喫煙による健康障害予防の簡易介入法を検討し、ランダム化比較試験を実施する。主な目的はアルコール代謝酵素の体質別の留意点や喫煙に関する簡易介入により飲酒習慣や飲酒および喫煙に関する認識の変化を検討すること、飲酒量の経過と飲酒量が増える傾向や影響要因との関連を明らかにすることである。,基盤研究(C),小区分58060:臨床看護学関連,アルコール,代謝酵素,遺伝子多型,健康障害,簡易介入,,,,,,,,,,,,,,,,,,,,,,,,,,,,,,,,,,,,,,,,,,,,,,,,,,,
24K13834,福島県立医科大学,見城 明,看護師特定行為研修修了者の活動促進を目指したフォローアッププログラムの検証,特定行為研修修者には、医療の質の向上に資する活動が期待されている。活動を促進し効果的なチーム医療を提供するためには、研修終了者の所属施設毎の問題点や課題を明らかにして、個別の対策を講じることが重要であると考える。,基盤研究(C),小区分58060:臨床看護学関連,看護師特定行為研修,研修修了者,フォローアッププログラム,,,,,,,,,,,,,,,,,,,,,,,,,,,,,,,,,,,,,,,,,,,,,,,,,,,,,
24K13833,宮城大学,小松 容子,精神障害者を含めた家族システム全体を踏まえたアウトリーチ家族支援ガイドの開発,本研究の目的は，家族のライフイベント・ライフステージによって影響を受ける家族全体の健康促進を目指した支援が円滑に提供できるための「精神障害者を含めた家族システム全体を踏まえたアウトリーチ家族支援ガイド」を開発することであり、目的達成に向けて次の３つの課題：【１】精神障害者を含めた家族全体のシステム・ケース・ブックの作成，【２】家族システム全体を踏まえた精神科アウトリーチ家族支援ガイドの作成，【３】作成した精神科アウトリーチ家族支援ガイドの評価，に取り組み段階的に開発を進めていく。,基盤研究(C),小区分58060:臨床看護学関連,家族看護,精神看護,家族システム,ガイドライン,,,,,,,,,,,,,,,,,,,,,,,,,,,,,,,,,,,,,,,,,,,,,,,,,,,,
24K13832,宮城大学,庄子 美智子,クローン病患者のヘルスリテラシー尺度の開発,本研究の目的は、クローン病患者の体験に基づいたヘルスリテラシー尺度を開発することである。そのためには、１）青年期から成人初期にクローン病を発症し、在宅療養生活を送っている外来患者が、ヘルスリテラシーを活用し、セルフマネジメントしながら生活の質の維持・向上できるために、申請者が進めている、患者のヘルスリテラシーに着目した療養経験の質的研究に基づいて質問項目等を検討し、クローン病患者の体験に基づいたヘルスリテラシー尺度の原案を作成する。２)１）より、クローン病患者の体験に基づいたヘルスリテラシー尺度を開発する。,基盤研究(C),小区分58060:臨床看護学関連,クローン病,ヘルスリテラシー,,,,,,,,,,,,,,,,,,,,,,,,,,,,,,,,,,,,,,,,,,,,,,,,,,,,,,
24K13831,札幌市立大学,栗原 知己,大規模データベースとAIの活用による看護師が活用可能な有害事象の予測モデルの開発,集中治療室に入室する患者には様々な有害事象が発生する可能性が高いことが知られている。それらの有害事象は患者、看護師双方に悪影響をもたらすため、その発生を予測し、予防することは極めて重要な課題である。近年では人工知能（AI）の活用に関する研究が盛んに行われており、大規模データベースとAIを活用することで、看護師にとって活用性の高い予測モデルが開発できる可能性が高い。本研究では、大規模データベースとAIを活用し、ICUに入室する患者の有害事象の発生を簡便に予測するモデルを開発し、医療機関の患者データを使用することで、外的妥当性を検証することを目的とする。,基盤研究(C),小区分58060:臨床看護学関連,予測モデル,有害事象,看護,集中治療室,AI,,,,,,,,,,,,,,,,,,,,,,,,,,,,,,,,,,,,,,,,,,,,,,,,,,,
24K13830,札幌医科大学,春名 純平,日本におけるICU患者の家族の集中治療後症候群の実態とリスク因子の解明,PICS は患者だけでなく家族にも生じ、ICU 患者の家族は、患者が ICU 退室から6ヶ月経過した後も2/3がメンタルヘルスの障害を抱えている。これらは PICS -Family ( PICS -F )と呼ばれ、患者が呈する症状と合わせて注目されつつある。 PICS -F は家族の QOL に影響を与える重要な問題であるが、 本邦においては、その実態を明らかにした調査は存在しない。そこで 本研究ではICUに入室した患者の家族を対象に、精神症状・QOL、生活調査を実施し、PICS -F の実態調査とともにリスク因子を解明することを目的 とする。本,基盤研究(C),小区分58060:臨床看護学関連,集中治療後症候群,家族,,,,,,,,,,,,,,,,,,,,,,,,,,,,,,,,,,,,,,,,,,,,,,,,,,,,,,
24K13829,徳島大学,森 裕香,がん自壊創を有する進行性乳がん患者のセルフケアを支援する看護実践モデルの構築,"がん自壊創は, がんの転移や浸潤により創傷を形成するため, 難治性で有効な治療法,ケア方法が確立されていない. かつてがん自壊創を有する進行性乳がん患者は緩和ケアが中心であったが, 医療の進歩により在宅療養や社会復帰を目指すまでに至っている. がん自壊創を抱えながら地域に戻るには, 患者自身ががん自壊創をセルフケアできることが重要である. 本研究は, 治療期から在宅療養期の患者・家族が抱える苦悩や問題, 必要不可欠なセルフケア, Survivorshipを充実するための障壁を明確化し, 自壊創を有する進行性乳がん患者のセルフケアを支援するための看護実践モデルを構築することを目指す.",基盤研究(C),小区分58060:臨床看護学関連,自壊創,乳がん,セルフケア支援,,,,,,,,,,,,,,,,,,,,,,,,,,,,,,,,,,,,,,,,,,,,,,,,,,,,,
24K13828,三重大学,中谷 中,がん遺伝子パネル検査を受検する患者・家族の心理的特性の解明と支援プログラムの開発,受診者は、切除不能な転移再発をみとめ、標準治療がないまたは標準治療が終了（または終了見込み）のさまざまな固形癌患者であり、ほとんどのケースで家族が同伴する。外来受診は、初診時にてがん遺伝子パネル検査の受検の意向があった場合には、同日受検し、4-6週間後に結果説明の再診となり、多くの症例で2回の外来受診となる。初診までに郵送で研究内容の説明をし、研究協力同意の確認をとる。同意が得られた場合、初診前と初診後、結果説明後の縦断調査を行う。また同時に外来対応した医師・カウンセラーの心理的ストレスの客観評価を加えるほか、紹介症例のその後の心理的状態について、紹介医にもアンケート調査を行う。,基盤研究(C),小区分58060:臨床看護学関連,がん遺伝子パネル検査,受検者,家族,心理的支援,,,,,,,,,,,,,,,,,,,,,,,,,,,,,,,,,,,,,,,,,,,,,,,,,,,,
24K13827,新潟大学,内山 美枝子,抗がん剤脱毛時の発毛段階に即したスカルプケアを目標とした頭皮画像評価の策定,悪性腫瘍の治療である抗がん剤治療の副作用である脱毛は不可避であり、アピアランス（外見）の変化から就労がん患者の社会的苦痛を生み出している。抗がん剤脱毛は毛髪の有無による外見変化だけでなく、対象の抗がん剤による易感染状態と外的刺激（ウィッグ等）により、頭皮の悪化や炎症を招き、がん患者の不快・苦痛が増強する。,基盤研究(C),小区分58060:臨床看護学関連,化学療法,脱毛頭皮,画像解析,,,,,,,,,,,,,,,,,,,,,,,,,,,,,,,,,,,,,,,,,,,,,,,,,,,,,
24K13826,独立行政法人国立病院機構(京都医療センター臨床研究センター),坂根 靖子,インスリン療法による皮下硬結を作らない糖尿病療養指導プログラムの開発と効果検証,インスリン注射を同じ部位に繰り返すと皮下硬結（リポハイパートロフィー、LH）ができ、血糖コントロールが悪化したり、血糖変動が大きくなったり、予期せぬ低血糖を起こすことがある。しかし皮下硬結をつくった人に対して同じ部位に打たずに、ローテーションするようにといった単純なアドバイスだけでは、改善しない患者も少なくない。インスリン治療による皮下硬結の頻度と危険因子、皮下硬結を作りやすい患者心理を明らかにし、看護師に対する皮下硬結を作らない、あるいは皮下硬結ができた人に対する糖尿病療養指導プログラムを開発しその効果を検証する。,基盤研究(C),小区分58060:臨床看護学関連,糖尿病,皮下硬結,インスリン療法,リポハイパートロフィー,,,,,,,,,,,,,,,,,,,,,,,,,,,,,,,,,,,,,,,,,,,,,,,,,,,,
24K13825,福岡大学,高木 良重,腹壁状況に応じたストーマ装具選択基準の開発と有用性の検証,ストーマ保有者が安心できる排泄管理の基本は、排泄物の漏れがなく、ストーマ周囲皮膚障害のない生活を送るためのストーマ装具選択である。これまでにもストーマ装具選択基準が紹介されているが、ストーマ装具を貼付する腹壁状態についての説明が不足しており、実践につながる臨床判断の根拠が明記されていない。,基盤研究(C),小区分58060:臨床看護学関連,ストーマ,装具選択基準,腹壁状況,,,,,,,,,,,,,,,,,,,,,,,,,,,,,,,,,,,,,,,,,,,,,,,,,,,,,
24K13824,日本赤十字九州国際看護大学,山本 孝治,診断後間もない成人期クローン病患者へのセルフケア支援アプリの開発と検証,クローン病は生涯にわたり療養が必要であり、診断後間もない成人期患者は病気と生活の折り合いをつけながらセルフケアを構築していくことが重要となる。看護師は患者のセルフケアを的確にアセスメントし、患者が主体的にセルフケアを構築できるように支援することが必要である。そこで、すでに開発ずみの診断後間もない成人期クローン病患者のセルフケア状況を看護師が捉えるための看護アセスメントツールををもとにセルフケア支援で活用できるアプリを開発し、その効果を検証する。本研究で開発するセルフケア支援アプリにより、看護師は簡便かつ迅速にアセスメントから支援に繋ぐことができ、患者のセルフケア構築が進むことが期待される。,基盤研究(C),小区分58060:臨床看護学関連,クローン病,成人期,診断後間もない,セルフケア支援,アプリ開発,,,,,,,,,,,,,,,,,,,,,,,,,,,,,,,,,,,,,,,,,,,,,,,,,,,
24K13823,聖カタリナ大学,白柿 綾,精神科看護管理者のモラルディストレスの様相と活動理論に基づく支援体制に関する研究,精神科看護は強制入院や隔離・拘束、または社会的入院といった倫理的課題が多く、看護師がモラルディストレスを感じやすい。モラルディストレスは、苦悩というストレスである反面、より良い看護実践や看護師の成長のための契機になるという側面もあり、そのためにはモラルディストレスに気づき、自分たちで問題解決に向けた取り組みを考えて行動することが重要だと考える。そこで今回の研究では、精神科看護管理者がどのようなモラルディストレスを抱えているのかを明らかにし、適切なサポートにより、心理的負担と疲労が軽減させ、新たな看護管理実践を構築する目的で研究を進める。,基盤研究(C),小区分58060:臨床看護学関連,精神科,看護管理者,モラルディストレス,活動理論,拡張的学習,,,,,,,,,,,,,,,,,,,,,,,,,,,,,,,,,,,,,,,,,,,,,,,,,,,
24K13822,愛媛大学,竹井 友理,外来がん薬物療法を受ける独居の成人期大腸がん患者の療養生活を支える看護の探索,外来で薬物療法を受ける大腸がん患者において、治療継続とQOL維持のためのセルフマネジメントは重要である。その中で、独居の成人期大腸がん患者は、独居という他者からの支援が得にくい環境に加えて、成人期特有の多様な社会的・生活背景があり、自己の価値観に基づき様々な選択・判断を行いながら療養生活を送っていると考えられる。,基盤研究(C),小区分58060:臨床看護学関連,外来薬物療法,独居,成人期,大腸がん,療養生活,,,,,,,,,,,,,,,,,,,,,,,,,,,,,,,,,,,,,,,,,,,,,,,,,,,
24K13821,天理大学,山中 政子,患者のがん疼痛セルフマネジメントを高めるための看護師教育プログラムの開発,麻薬性鎮痛薬を使用するがん患者が増加しており、看護師には、患者ががん疼痛の諸問題に主体的に取り組めるよう援助することが求められている。そのため、研究代表者は、“通院患者のがん疼痛セルフマネジメントを促進する看護介入プログラム（以下、CPSMプログラム）”を開発した。今後は、がん患者の疼痛緩和とQOL向上のためCPSMプログラムを普及させる必要がある。そこで、本研究は、文献レビューと臨床看護師からの意見をもとに「患者のがん疼痛セルフマネジメントを高めるための看護師教育プログラム」を開発し、開発したプログラムを用いて臨床看護師に教育を行い、質問紙調査によってプログラムの有用性を評価する。,基盤研究(C),小区分58060:臨床看護学関連,がん疼痛,セルフマネジメント,看護師教育,,,,,,,,,,,,,,,,,,,,,,,,,,,,,,,,,,,,,,,,,,,,,,,,,,,,,
24K13820,武庫川女子大学,天野 功士,前立腺がん術後患者の下部尿路症状に対する自己管理支援プログラムの効果検証,前立腺がん術後患者は、術後の下部尿路症状による身体的な問題に加え、それから派生する心理社会面の問題に対して自己管理を余儀なくされる。しかし、在院期間の短縮化や生命に直結しない下部尿路症状への過小評価等が相まり、看護師の自己管理支援が課題となっている。作成した「前立腺がん術後患者の自己管理支援プログラム」について、プログラムの洗練化を図り、適切性と臨床適用可能性を評価する。また、改定したプログラムの妥当性を検証する。,基盤研究(C),小区分58060:臨床看護学関連,前立腺がん,前立腺全摘除術,自己管理,下部尿路症状,支援プログラム,,,,,,,,,,,,,,,,,,,,,,,,,,,,,,,,,,,,,,,,,,,,,,,,,,,
24K13819,甲南女子大学,松岡 純子,精神障害をもつ人のパーソナルリカバリーを促進する地域精神看護の対話実践モデル,我が国の精神医療は入院中心から地域中心への移行の途上にあり、地域精神看護の充実が期待されている。地域精神看護では、当事者や家族の生活や人生を包括的に捉える視点が必要であり、パーソナルリカバリーの概念が有効である。本研究では、精神障害をもつ人のパーソナルリカバリーを促進する地域精神看護の対話実践モデルを構築することを目的とする。地域で暮らす精神障害をもつ当事者約20名および精神科訪問看護師約20名にインタビューを行った分析結果と文献検討を基に、精神障害をもつ当事者のパーソナルリカバリーを促進する地域精神看護の対話実践モデルを構築する。,基盤研究(C),小区分58060:臨床看護学関連,地域精神看護,パーソナルリカバリー,対話,モデル,,,,,,,,,,,,,,,,,,,,,,,,,,,,,,,,,,,,,,,,,,,,,,,,,,,,
24K13818,梅花女子大学,福田 正道,骨転移を有するがん患者のセルフマネジメントを促進する看護介入モデルの開発,骨転移を有するがん患者は骨転移部位、治療の内容によって様々な動作制限が求められる。さらに、患者個々の生活背景に即した動作制限に関しては、従来の医療者主導の教育指導では対応が難しくなっている。そこで、患者自身が自分の病気と療養に関するテーラーメイドの知識と技術を持ち、生活と折り合いをつけながら疼痛緩和や骨折のリスクをセルフマネジメントしていく患者主導の実践が重要となる。,基盤研究(C),小区分58060:臨床看護学関連,骨転移,セルフマネジメント,行動変容,,,,,,,,,,,,,,,,,,,,,,,,,,,,,,,,,,,,,,,,,,,,,,,,,,,,,
