awardnumber,organization,name,title,abstract,section,review_section,keyword1,keyword2,keyword3,keyword4,keyword5,keyword6,keyword7,keyword8,keyword9,keyword10,keyword11,keyword12,keyword13,keyword14,keyword15,keyword16,keyword17,keyword18,keyword19,keyword20,keyword21,keyword22,keyword23,keyword24,keyword25,keyword26,keyword27,keyword28,keyword29,keyword30,keyword31,keyword32,keyword33,keyword34,keyword35,keyword36,keyword37,keyword38,keyword39,keyword40,keyword41,keyword42,keyword43,keyword44,keyword45,keyword46,keyword47,keyword48,keyword49,keyword50,keyword51,keyword52,keyword53,keyword54,keyword55,keyword56
19J23290,京都大学,本多 慎之介,レトロトランスポゾンMuERV-Lがマウス初期胚の細胞分化に及ぼす影響,本研究では、ERVレトロトランスポゾンとのキメラmRNAとして発現するヒストン修飾酵素群と胚発生・細胞分化の関連を明らかにすることを目的とする。ERVとのキメラ転写産物として転写されることのわかっている3遺伝子を初期胚において抑制することで発生への影響を調べる。また、その中に含まれているヒストンアルギニンタンパク質は初期胚の細胞分化に寄与することが知られていることから、アルギニン残基を他のアミノ酸残基に置換したものを初期胚で過剰発現させることによって、ヒストンアルギニンのメチル化を抑制し、発生への影響を調べる。,特別研究員奨励費,小区分42010:動物生産科学関連,レトロトランスポゾン,哺乳類初期胚,内在性レトロウイルス,エピジェネティクス,内在性レトロトランスポゾン,受精卵,ZGA,ERV,ヒストン修飾酵素,,,,,,,,,,,,,,,,,,,,,,,,,,,,,,,,,,,,,,,,,,,,,,,
19J22578,信州大学,生井 楓,腸内常在性乳酸菌の生体外機能強化系の確立と宿主への還元性評価,本研究では、宿主の腸内環境に適応している腸内常在性乳酸菌を単離した後に、リボソーム工学（リボソーム攻撃性の抗生物質を用いて微生物に薬剤耐性変異を導入し、その潜在能力を引き出す手法）を適用し薬剤耐性変異株を取得する。そして、得られた変異株の機能性及び腸管定着性を細胞株及び炎症モデルマウスを用いて検証することで、宿主適応性と機能性を兼ね備えた乳酸菌創出の方法論確立を目指す研究である。,特別研究員奨励費,小区分42010:動物生産科学関連,乳酸菌,リボソーム工学,腸管常在性乳酸菌,,,,,,,,,,,,,,,,,,,,,,,,,,,,,,,,,,,,,,,,,,,,,,,,,,,,,
19J22544,広島大学,市川 健之助,ニワトリfoxl3遺伝子の解析から探る， 鳥類特有の性分化機構,"本研究は, ニワトリForkhead box L3 (foxl3)遺伝子が生殖細胞の雌性分化に及ぼす影響を明らかにすることを目的とする. まず, 免疫蛍光組織染色によりニワトリFOXL3発現細胞を同定する. 続いて, ニワトリfoxl3発現に関与しうる因子をマイクロアレイ法により同定したのち, 得られた因子の転写活性能を評価する. 加えて, ニワトリfoxl3をKOしたのち, その表現型を解析する. これらの解析からニワトリFOXL3/foxl3の局在, および上流と下流の分子機構を明らかにし, ニワトリFOXL3/foxl3と生殖細胞の雌性分化との関係性を体系的に評価する.",特別研究員奨励費,小区分42010:動物生産科学関連,始原生殖細胞,ニワトリ,性分化,性決定,foxl3,RNA-seq,,,,,,,,,,,,,,,,,,,,,,,,,,,,,,,,,,,,,,,,,,,,,,,,,,
19J20888,信州大学,二橋 佑磨,肉用鶏の形質マーカーの確立を目指した骨格筋芽細胞の網羅的な遺伝子発現解析,骨格筋の形態は肉用鶏と卵用鶏で大きく異なるが、これらの系統間で筋芽細胞の遺伝子発現を比較した研究は極めて少ない。本研究では、RNA-seqで得た、卵用鶏と肉用鶏の筋芽細胞における網羅的な遺伝子発現データをもとに、肉用鶏の形質マーカーの探索を行う。まず、RNA-seqデータを解析し、筋芽細胞の性質に寄与する因子を探索する。次に、同定した遺伝子群が、実際に筋芽細胞の増殖・分化に寄与しているかを実証する。さらに国産鶏の筋芽細胞を採取・解析し、同定した遺伝子群が、肉用鶏の形質マーカーとして有用であるかを検証する。本研究は、鶏肉に関する遺伝的形質を科学的に評価する定量的な指標の確立を目指す研究である。,特別研究員奨励費,小区分42010:動物生産科学関連,骨格筋幹細胞,筋芽細胞,ニワトリ,遺伝子発現解析,オリゴDNA,コレシストキニン,オピオイド,,,,,,,,,,,,,,,,,,,,,,,,,,,,,,,,,,,,,,,,,,,,,,,,,
19J12823,東北大学,西原 昂来,ウシルーメン上皮崩壊の予防に向けたルーメン上皮バリア機能の調節機序の解明,濃厚飼料といった易発酵性の飼料の多給は、乳牛や肉牛の生産効率を高めたが、エネルギー産生・吸収の場であるルーメン（第一胃：ミノ）に負荷を掛け、亜急性ルーメンアシドーシス(SARA)といった生産病を招くことがある。このSARAを罹患すると、採食量の低下や下痢を引き起こす上に、ルーメンの表面の上皮を崩壊させ、ルーメン微生物などの宿主への侵入を許し、全身で炎症が起きる。本研究の目的は、ウシルーメン上皮の崩壊機序の解明とバリア機能調節因子を探索することである。本研究が上手くいった場合、SARAで苦しむウシを救うことができ、また、農家の生産効率も向上することが考えられる。,特別研究員奨励費,小区分42010:動物生産科学関連,ルーメン上皮細胞,インターロイキン１β,ルーメン,亜急性ルーメンアシドーシス,Toll様受容体5,インスリン様成長因子結合蛋白質,ウシ,,,,,,,,,,,,,,,,,,,,,,,,,,,,,,,,,,,,,,,,,,,,,,,,,
19J11689,東北大学,古川 睦実,宿主免疫による黄色ブドウ球菌の増殖抑制を促す乳房炎ワクチン用新規抗原の探索,本研究は、①黄色ブドウ球菌が乳房内に侵入した段階において、黄色ブドウ球菌の制御を可能にする乳房炎ワクチンを構築すること、および②黄色ブドウ球菌の細胞内感染機序を解明し、乳房炎ワクチンの乳房炎発症に関するプロセスに与える影響を精査することを目的としている。具体的には、宿主抗体によって誘導される黄色ブドウ球菌の増殖阻害に関する分子を特定することで、特定抗原に対する抗体産生の効果的な誘導によるワクチンの改良を目指す。また、本研究ではGFPを強制発現する黄色ブドウ球菌を作出し、乳房炎in vivoモデルに供することで、細胞内感染を受ける宿主細胞を特定する。,特別研究員奨励費,小区分42010:動物生産科学関連,黄色ブドウ球菌,乳房炎,宿主抗体,,,,,,,,,,,,,,,,,,,,,,,,,,,,,,,,,,,,,,,,,,,,,,,,,,,,,
19J10687,帯広畜産大学,羽立 薫,乳牛の骨吸収活性を指標とする初乳中の産後疾患バイオマーカーの確立,乳牛は分娩時に初乳中に大量のカルシウム（Ca）を失うため、低Ca血症に陥りやすい。分娩性低Ca血症は産後疾患のリスクを高めることが知られており、乳牛の長命性にも関わる重大な疾患である。Ca恒常性は骨からのCa動員（骨吸収）と関連することから、分娩乳牛の骨吸収活性は低Ca血症の発症と関連すると考えた。さらに、初乳は妊娠後期の母体の生理状態を反映する物質に富むことから、本研究では乳牛の初乳中の骨代謝関連マーカーを対象に産後疾患バイオマーカーを同定し、初乳を用いた産後疾患の診断法を確立することを目的とした。,特別研究員奨励費,小区分42010:動物生産科学関連,乳牛,初乳,産後疾患,骨代謝,,,,,,,,,,,,,,,,,,,,,,,,,,,,,,,,,,,,,,,,,,,,,,,,,,,,
19J10189,北海道大学,津上 優作,乳腺上皮細胞の乳生産性に対する植物エストロゲンの生理作用と作用機序の体系的解明,乳牛による乳産生は、乳腺実質を構成する乳腺上皮細胞が担っている。乳腺上皮細胞は、妊娠期に増殖し、泌乳期に乳成分を産生し、乾乳期に退縮する。一方、乳牛が摂取するマメ科植物には多種多様な植物エストロゲンが含まれており、その生理作用は種類依存的である。そこで、植物エストロゲンが妊娠期、泌乳期、乾乳期の乳腺上皮細胞へ及ぼす生理作用を体系化し、選択的な植物エストロゲン給与によって乳牛の乳生産性を向上するための学術的な知見を得る。,特別研究員奨励費,小区分42010:動物生産科学関連,乳腺上皮細胞,植物エストロゲン,乳産生,乳生産,タイトジャンクション,乳房炎,,,,,,,,,,,,,,,,,,,,,,,,,,,,,,,,,,,,,,,,,,,,,,,,,,
19J10044,広島大学,稲生 雄大,子牛の栄養代謝機能発達に関する研究,現在、酪農現場では、子牛の出生後における低血糖や哺育期における下痢症による死亡率増加および発育停滞が問題となっている。糖代謝に関連するグルカゴン様ペプチド（GLP）-1および下部消化管上皮を成長させるGLP-2は、下部消化管から分泌される消化管ホルモンであり、これらの分泌を栄養管理により調節することにより、死亡率の低下・発育の向上が期待される。一方、子牛などの反芻動物では、これら消化管ホルモンの分泌機序には不明な点が多い。我々の研究では、様々な飼養管理法が子牛のGLP-1・GLP-2分泌に及ぼす影響を検討し、適切な飼養管理法を確立することを目的とする。,特別研究員奨励費,小区分42010:動物生産科学関連,仔牛,内分泌,グルカゴン様ペプチド,消化管発達,糖代謝,酪酸,,,,,,,,,,,,,,,,,,,,,,,,,,,,,,,,,,,,,,,,,,,,,,,,,,
20J21541,東京都立大学,林 凌也,ヒストン修飾による母性エピゲノム遺伝機構の解明,本研究では、哺乳類のエピゲノム遺伝機構の理解に向けて、マウス卵のヒストン修飾がどのように胚の遺伝子発現と次世代個体の形質に影響するかを明らかにする。哺乳類において代表的なヒストン修飾であるH3K4me3、H3K9me2、H3K9me3、H3K36me3を欠損した胚を作成し、着床前発生時のヒストン修飾の動態と遺伝子発現を明らかにする。また胚移植により、着床後の発生遅延、胎盤形成異常、出生児の代謝異常などの表現型を解析する。これにより、ヒストン修飾による母性エピゲノム遺伝機構の分子基盤の構築を目指す。,特別研究員奨励費,小区分42010:動物生産科学関連,ヒストンバリアント,エピジェネティクス,ヒストン修飾,初期胚発生,経世代エピゲノム,父母アレル非対称性,卵子,,,,,,,,,,,,,,,,,,,,,,,,,,,,,,,,,,,,,,,,,,,,,,,,,
20J15021,京都大学,佐藤 元映,新規脂肪酸カルシウムによる牛のメタン低減～菌叢解析によるメカニズムの解明～,ウシ等の反芻動物は第一胃（ルーメン）に生息する微生物による消化過程で地球温暖化の一因となるメタンガスを排出する。脂肪酸カルシウムは通常エネルギー補給飼料として用いらられ、脂肪酸の割合を高くすることで同時にメタンも低減させる可能性がある。本研究では「脂肪酸のモル比を高くした新規脂肪酸カルシウム」を様々な品種のウシに給与した際のメタン低減効果を検討する。また、メタン低減メカニズムを解明するために、次世代シーケンサーを用いたルーメン微生物叢の解析を行う。,特別研究員奨励費,小区分42010:動物生産科学関連,反芻動物,メタン,脂肪酸カルシウム,ルーメン微生物,,,,,,,,,,,,,,,,,,,,,,,,,,,,,,,,,,,,,,,,,,,,,,,,,,,,
20J14275,東京大学,伊藤 遥,転写因子FOXL2から探る、卵巣発達・疾患のメカニズム,本研究では、転写因子FOXL2による卵巣発達・機能制御メカニズムの解明、および、FOXL2の変異や発現異常によって引き起こされる卵巣疾患の発症機序の解明を目的とする。まず、顆粒層細胞においてFOXL2の下流因子を特定することで、卵巣におけるFOXL2シグナルの全容を理解する。また、FOXL2変異型マウスの作製、表現型の解析によって、FOXL2の変異がどのような病態を引き起こすのかを特定する。最後に、観察された表現型がレスキューされる条件を検討し、FOXL2変異から表現型に至るまでに経由するシグナル経路や因子を同定する。,特別研究員奨励費,小区分42010:動物生産科学関連,FOXL2,卵巣,顆粒層細胞,,,,,,,,,,,,,,,,,,,,,,,,,,,,,,,,,,,,,,,,,,,,,,,,,,,,,
20J13712,九州大学,松吉 祐児,筋幹細胞分泌因子Sema3Aによる筋線維型制御機構の食品機能学的調節,骨格筋を構成する筋線維は、その特性の違いから遅筋型と速筋型に分類される。遅筋型筋線維は速筋型に比べ、疲労耐性や脂質代謝能が高く筋委縮も起こりにくい。さらに鉄分やタウリンなどの機能性栄養成分の含量も多いといった特性を持つ。後天的な変換が可能である筋線維型の制御は、その特性を利用した筋持久力の向上、生活習慣病の予防、健康寿命の延長、食肉への付加価値提供など幅広い分野への貢献が見込まれる。,特別研究員奨励費,小区分42010:動物生産科学関連,骨格筋,筋幹細胞,衛星細胞,Sema3A,神経筋接合部,筋線維型,食品機能性,,,,,,,,,,,,,,,,,,,,,,,,,,,,,,,,,,,,,,,,,,,,,,,,,
20J12906,東京農業大学,鈴木 大介,マウス栄養外胚葉においてCdx2発現を制御する新規分子機構の解明,"着床は胚盤胞と子宮のコミュニケーションにより制御される。胚盤胞は内部細胞塊（ICM）と極栄養外胚葉（polar TE）、壁栄養外胚葉（mural TE）から構成される。マウス胚盤胞ではmural TEが分化することで、浸潤能が獲得され、着床が進行することが分かっているが、mural TEの分化を制御する分子機構については不明点が多い。本研究では、シングルセルRNA-seqによりpolar TE, mural TE間の遺伝子発現プロファイルを比較することで、いつどのようにmural TEが分化するかを解析するとともに、mural TEの分化を制御する子宮内因子の特定を目指す。",特別研究員奨励費,小区分42010:動物生産科学関連,マウス,栄養外胚葉,Cdx2,子宮内因子,着床,トランスクリプトーム,細胞分化,初期胚,CDX2,mural TE,胚盤胞,RNA-seq,シグナル伝達,,,,,,,,,,,,,,,,,,,,,,,,,,,,,,,,,,,,,,,,,,,
20J11776,北海道大学,國井 宏樹,ウシ子宮外組織に及ぼす胚由来因子インターフェロン・タウの影響解析,反芻動物のウシにおいて、妊娠時の子宮内における着床前胚からは、インターフェロン・タウ(IFNT)と呼ばれるタンパク質が分泌され、子宮組織に作用することでインターフェロン誘導性遺伝子の発現が顕著になる。このような遺伝子の発現は子宮外の組織においても報告されているが、子宮内に存在するIFNTがどのようにして子宮外組織に作用しているのかについては不明である。そこで本研究では、子宮外組織におけるIFNTの直接検出ならびに組織特異的応答を明らかにすることで、従来子宮内のみで議論されてきたウシにおける妊娠応答機構を、子宮外に拡張して解明することを目指す。,特別研究員奨励費,小区分42010:動物生産科学関連,インターフェロンタウ,子宮頸管,ウシ,,,,,,,,,,,,,,,,,,,,,,,,,,,,,,,,,,,,,,,,,,,,,,,,,,,,,
20F20394,東北大学,北澤 春樹,菌体外多糖産生イムノバイオティック乳酸菌による抗ウイルス性家畜健全育成戦略,,特別研究員奨励費,小区分42010:動物生産科学関連,,,,,,,,,,,,,,,,,,,,,,,,,,,,,,,,,,,,,,,,,,,,,,,,,,,,,,,,
21J15868,県立広島大学,藤内 慎梧,鉄が誘導するライディッヒ細胞の代謝亢進作用の解明とその応用,本研究では、ライディッヒ細胞特異的に鉄の取り込みを阻害したTfr1欠損(Tfr1cKO)マウスが生じる精子形成不全の原因究明および，それを応用した種雄牛選抜マーカーの探索を行う。鉄は、様々な酵素の補因子として働くことから、精子形成不全の原因は、ライディッヒ細胞における代謝異常であると考えた。そこで、代謝物を網羅的に解析するメタボローム解析により野生型(WT)マウスを用いて比較解析を行い、精子形成との関連を調べる。さらに，種雄牛不適合個体においてTfr1cKOマウスと同様に鉄不足が低繁殖性を示したかの割合を調べ，種雄牛選抜マーカーとして使用可能かを検討する。,特別研究員奨励費,小区分42010:動物生産科学関連,,,,,,,,,,,,,,,,,,,,,,,,,,,,,,,,,,,,,,,,,,,,,,,,,,,,,,,,
21J13556,東京大学,菅家 卓哉,線維芽細胞増殖因子に着目した哺乳類卵巣機能制御メカニズムの解明及び繁殖障害の同定,卵巣は女性ホルモンの産生などの内分泌機能と、卵母細胞の産生機能を持つ、メスの生殖システムの中核を担う重要な臓器である。しかし、卵巣機能異常に起因する家畜繁殖障害や女性不妊症といった課題は山積しており、この根底には、卵巣異常・疾患に至る原因や発症機序の多くが未だ解明できていない現状がある。本研究では卵巣機能制御に関与することが示唆されている線維芽細胞増殖因子に着目し、マウスをモデルに卵巣機能制御メカニズムの解析を行っていく。さらに、マウスを用いた解析から得られた知見をブタ卵巣器官培養系で評価することで、哺乳類に保存されたメカニズムの解明及び、その異常による繁殖障害の同定を目指す。,特別研究員奨励費,小区分42010:動物生産科学関連,卵巣,線維芽細胞増殖因子,FGF,顆粒層細胞,繁殖能力,,,,,,,,,,,,,,,,,,,,,,,,,,,,,,,,,,,,,,,,,,,,,,,,,,,
21J13430,北海道大学,三浦 広卓,黒毛和種牛の飼料効率とルーメン細菌叢のリンクとその機序の解明,ウシが摂取した飼料は第一胃（ルーメン）に共生する細菌によって分解・発酵され、宿主の栄養源へと転換される。近年、ルーメン細菌叢の構成が宿主の生産性に影響する可能性が指摘されている。本研究では、黒毛和種牛における重要ルーメン細菌群の分布量と宿主の飼料効率との相関解析により、本品種の生産性に影響しうるルーメン細菌群の特定を目指す。ついで、特定した細菌群の分離株を用いた培養試験により、各細菌群の分布量や分布バランスがルーメン発酵、ひいては宿主の飼料効率に及ぼす影響について検討する。,特別研究員奨励費,小区分42010:動物生産科学関連,黒毛和種,ルーメン細菌,ルーメン発酵,飼料効率,細菌叢解析,,,,,,,,,,,,,,,,,,,,,,,,,,,,,,,,,,,,,,,,,,,,,,,,,,,
21F50400,東京農工大学,杉村 智史,卵子の発生能獲得に関与する卵胞内微小環境の解明,,特別研究員奨励費,小区分42010:動物生産科学関連,,,,,,,,,,,,,,,,,,,,,,,,,,,,,,,,,,,,,,,,,,,,,,,,,,,,,,,,
21F50394,東北大学,北澤 春樹,菌体外多糖産生イムノバイオティック乳酸菌による抗ウイルス性家畜健全育成戦略,近年、プロバイオティクスの中でも特に粘膜免疫調節機能性を発揮するイムノバイオティクスやそれが生産する多糖などの免疫活性因子（イムノジェニクス）が注目され、ヒトのみならず家畜健全育成における薬剤代替としての発展的利用性が大いに期待されている。本研究では、世界共通課題である薬のみに頼らない家畜健全育成技術の飛躍的向上から安全な畜産食品の持続的生産に貢献することを目標として、抗ウイルス免疫機能性を発揮する菌体外多糖生産性イムノバイオティクスに着目し、家畜健全育成における発展的利用性について追究する。,特別研究員奨励費,小区分42010:動物生産科学関連,イムノバイオティクス,イムノジェニクス,ポストバイオティクス,菌体外多糖,,,,,,,,,,,,,,,,,,,,,,,,,,,,,,,,,,,,,,,,,,,,,,,,,,,,
21F40400,東京農工大学,杉村 智史,卵子の発生能獲得に関与する卵胞内微小環境の解明,,特別研究員奨励費,小区分42010:動物生産科学関連,,,,,,,,,,,,,,,,,,,,,,,,,,,,,,,,,,,,,,,,,,,,,,,,,,,,,,,,
22KJ2529,鹿児島大学,中村 南美子,草地におけるシカの視覚心理を利用した侵入防止柵の開発とその有用性,電気柵は電線に接触した動物が感電による痛みを忌避学習することで，柵内への侵入を抑制するものである．一方，シカが草地に設置した電気柵を通り抜け，侵入するケースが問題視されている．これまでの研究ではシカが優れた視覚と嗅覚を用いて柵を認識しており，跳躍ではなく下部から電気柵を通り抜ける行動に関しては，その下向きの視野が関係していることが示唆された．,特別研究員奨励費,小区分42010:動物生産科学関連,シカ,電気柵,色覚,視野,嗅覚,オペラント条件付け,跳躍,通り抜け,,,,,,,,,,,,,,,,,,,,,,,,,,,,,,,,,,,,,,,,,,,,,,,,
22KJ2488,九州大学,前野 岳大,筋幹細胞が分泌する多能性因子netrin-4による筋線維型及び筋管形成の制御機構,骨格筋の量や質の向上には、筋細胞（筋線維）の肥大や筋線維型（遅筋型・速筋型）の制御が不可欠である。私は筋分化の過程で筋幹細胞が互いに融合して新生筋線維（筋管）を形成する際に多能性因子netrin-4が合成・分泌されていることを見出した。また、netrin-4が筋管の速筋化に加えて筋管形成も誘導する新規多能性を有する可能性に着目し、要求する受容体ならびに細胞内シグナル経路といった詳細な制御機構の解明を目指している。研究成果は、食肉生産技術の向上や健康・スポーツ科学に貢献することが期待される。,特別研究員奨励費,小区分42010:動物生産科学関連,筋幹細胞,新生筋線維（筋管）,筋線維型,速筋型,netrin-4,Unc5A,Unc5B,neogenin,,,,,,,,,,,,,,,,,,,,,,,,,,,,,,,,,,,,,,,,,,,,,,,,
22KJ2331,広島大学,加藤 正暉,ニワトリにおける新規神経ペプチドを介した脂質代謝調節機構の解明,鳥類の視床下部で発見されたNeurosecretory protein GL（NPGL）、Neurosecretory protein GM（NPGM）は新規の神経ペプチドであり、ニワトリにおいて脂肪蓄積を促進する作用があることを見出している。昨年度は、鳥類のウズラにおいてもNPGLとNPGMの遺伝子が存在することを見出すことに成功し、NPGLが脂肪蓄積作用を持つことを明らかにした。そこで本年度もウズラを用いて投与実験、遺伝子発現解析、行動学的解析を用いてNPGL及びNPGMの個体レベルでの作用メカニズムの解明に取り組む予定である。,特別研究員奨励費,小区分42010:動物生産科学関連,視床下部,神経ペプチド,ウズラ,脂肪,ニワトリ,ペプチドホルモン,脂肪蓄積,,,,,,,,,,,,,,,,,,,,,,,,,,,,,,,,,,,,,,,,,,,,,,,,,
22KJ2101,大阪大学,樋口 智香,変異型ミトコンドリアDNAの排除機構の解明を目指した卵母細胞分化誘導系の構築,卵子形成過程において排卵に至る卵子へと分化するのはわずか0.1%程度である。そのため排卵に至るまでの間、卵母細胞の質を管理する「品質管理機構」の存在が示唆されているが、その詳細な分子制御は未だ不明である。本研究では、卵母細胞の品質管理機構の解明を目的とし、卵細胞系列で生じる変異ミトコンドリアDNA (mtDNA）の排除に着目する。そこで、変異mtDNAを有するiPS細胞と、独自の卵母細胞の体外分化誘導系を用いることで、卵母細胞系列における変異mtDNAの排除機構を再構築する。さらに変異mtDNAを追跡し、その排除に関与する因子の同定を行うことで、変異mtDNAの排除機構の理解を目指す。,特別研究員奨励費,小区分42010:動物生産科学関連,卵母細胞,ミトコンドリア,mtDNA,原始卵胞,体外培養,,,,,,,,,,,,,,,,,,,,,,,,,,,,,,,,,,,,,,,,,,,,,,,,,,,
