awardnumber,organization,name,title,abstract,section,review_section,keyword1,keyword2,keyword3,keyword4,keyword5,keyword6,keyword7,keyword8,keyword9,keyword10,keyword11,keyword12,keyword13,keyword14,keyword15,keyword16,keyword17,keyword18,keyword19,keyword20,keyword21,keyword22,keyword23,keyword24,keyword25,keyword26,keyword27,keyword28,keyword29,keyword30,keyword31,keyword32,keyword33,keyword34,keyword35,keyword36,keyword37,keyword38,keyword39,keyword40,keyword41,keyword42,keyword43,keyword44,keyword45,keyword46,keyword47,keyword48,keyword49,keyword50,keyword51,keyword52,keyword53,keyword54,keyword55,keyword56
18H00675,大阪大学,田畑 智司,機械学習によるコーパス文体論分析モデルの提示とそれに基づく国際連携基盤の創成,本研究では，トピックモデリングやワードエンべディングに代表される機械学習に基づく自然言語処理技術を後期近代英語期の小説作品コーパスの分析に適用し，新たなコーパス文体論研究モデルを提案した。それにより，従来のコーパス言語学の手法では統計の網から外れてしまうような，出現頻度の低い多数の単語によって構成されるトピックや語群にも新たな光を当てること，そして従来の手法ではアプローチすることが困難であった「意味の問題」を量的に考察する足掛かりを築いたと言える。この研究から得られた手法や知見をもとに，研究協力関係にある国内外の研究グループと大規模な共同研究ネットワーク構築へ向けた連携基盤形成を図った。,基盤研究(B),小区分02080:英語学関連,コーパス文体論,国際連携,研究ネットワーク形成,自然言語処理,デジタルヒューマニティーズ,トピックモデリング,ワードエンべディング,言語学的文体論,機械学習,可視化,テクスト分析,テクストマイニング,国際連携基盤創成,トピックモデル,国際連携拠点,テクスト分析方法論,ワードエンベディング,文体,小説言語,フォーラム,,,,,,,,,,,,,,,,,,,,,,,,,,,,,,,,,,,,
23K20094,札幌大学,時崎 久夫,統語から音韻への写像：理論・類型・歴史,生成文法のミニマリスト・プログラムに基づき、統語（計算）部門で作られる構造（集合）が、どのように音声に写像されるかを、理論的・実証的に明らかにすることが目的である。線型順序のない統語構造に基づいて強勢と韻律が決定され、その特徴によって語順や「移動」などの「統語的」特徴が決定されるという新しいモデル Structure-Phonology-Order (SPO) を提案し、統語と音韻のインタフェイス（外在化）を理論的に明らかにする。,基盤研究(B),小区分02080:英語学関連,インターフェイス,統語と音韻のインターフェイス,統語論・音韻論インターフェイス,主要部移動,外在化,生成文法,ミニマリスト,音韻論,インタフェイス,,,,,,,,,,,,,,,,,,,,,,,,,,,,,,,,,,,,,,,,,,,,,,,
20H01268,筑波大学,島田 雅晴,Dvandva型等位複合語の比較・対照研究,英語では「becon and egg」というが、日本語では「ベーコンエッグ」となり、いわゆるdvandva型等位複合語と呼ばれる形式を持つことになる。つまり、日本語では「ベーコン＆エッグ」、「ベーコンとエッグ」のように「＆」や「と」といった等位接続をあらわす表現は用いない。本課題では、dvandva型等位複合語に着目して、ヒトが生得的に脳内にもつとされる言語間差異をもたらす仕組みを研究する。,基盤研究(B),小区分02080:英語学関連,語形成,生成文法,英語史,言語比較,複合語,形態論,形態統語論,併合,ラベル付け,名づけ,等位複合語,等位構造,外在化,言語接触,,,,,,,,,,,,,,,,,,,,,,,,,,,,,,,,,,,,,,,,,,
23K20468,早稲田大学,近藤 眞理子,多様な英語の音声理解のメカニズムの研究：アジア・アフリカの英語を中心に,本研究は、アジア・アフリカなどの新興英語圏の英語の特性を調査し、日本語母語話者が新興英語圏の英語をどの程度理解できるかを検証するものである。その上で、音声学、言語習得の面から、①なぜ第二言語では学習したモデルの発音から逸脱した方言への対応が困難か、②第一言語から第二言語への音声理解へのストラテジーを考察し、③第二言語音声習得が方言習得とどうかかわるのかを検証し、方言音声を含む第二言語音声理解のメカニズムを包括的に研究するものである。,基盤研究(B),小区分02080:英語学関連,英語の多様性,アジア英語,アフリカ英語,第二言語方言習得,多様な英語の音声理解,音声習得,第二言語音声習得,多様な英語,第二言語音声理解,,,,,,,,,,,,,,,,,,,,,,,,,,,,,,,,,,,,,,,,,,,,,,,
23K20467,東海大学,成田 広樹,日英語の省略構造の統合的解明に基づく理論横断的オープンアクセスデータベースの創生,本研究は、言語事例-仮説-理論の包括的記述を一元管理し、オープンアクセスの、柔軟なエントリ間リンクが可能な、ソーシャルネットワーキングサービス(SNS)機能付きのデータベースGrammarXivを開発提示する。構築の出発点として、特に日英語の省略構造研究の分野を題材に取 り、当該分野における理論データの合目的的・理論横断的な参照機会を言語研究コミュニティ全体に提供することで、透明性の高い研究を支え 、隣接分野との学際的研究を促進する基盤を創出する。,基盤研究(B),小区分02080:英語学関連,言語学,オープンアクセス・データベース,文法,省略,オープンアクセス,データベース,言語理論,容認性判断,削除,オープンアクセスデータベース,省略/削除,理論言語学,シンタクス/統辞論,意味論,,,,,,,,,,,,,,,,,,,,,,,,,,,,,,,,,,,,,,,,,,
21H00531,実践女子大学,時田 朋子,統合文脈N-gram分析によるCOCAからの全定形表現抽出と英語教育への応用,定形表現は、言語運用において重要な役割を担う。本研究は、定形表現を包括的に頻度順にして自動抽出するために開発された統合文脈N-gram分析を、現代アメリカ英語の実態を反映する大規模コーパスCOCA（Corpus of Contemporary American English）に適用し、全ての定形表現およびジャンルごとの定形表現を抽出する。まず、抽出された定形表現の特徴を明らかにする。次に、高頻度の定形表現については、CEFRのCan-doリストに照らしてコーパスの用例をもとにキーフレーズとして選定し、一般的およびジャンル別の英語eラーニング教材を開発する。,基盤研究(B),小区分02080:英語学関連,定形表現,COCA,統合文脈N-gram分析,英語教材,,,,,,,,,,,,,,,,,,,,,,,,,,,,,,,,,,,,,,,,,,,,,,,,,,,,
