awardnumber,organization,name,title,abstract,section,review_section,keyword1,keyword2,keyword3,keyword4,keyword5,keyword6,keyword7,keyword8,keyword9,keyword10,keyword11,keyword12,keyword13,keyword14,keyword15,keyword16,keyword17,keyword18,keyword19,keyword20,keyword21,keyword22,keyword23,keyword24,keyword25,keyword26,keyword27,keyword28,keyword29,keyword30,keyword31,keyword32,keyword33,keyword34,keyword35,keyword36,keyword37,keyword38,keyword39,keyword40,keyword41,keyword42,keyword43,keyword44,keyword45,keyword46,keyword47,keyword48,keyword49,keyword50,keyword51,keyword52,keyword53,keyword54,keyword55,keyword56
22K06234,東京医科歯科大学,田賀 哲也,神経幹細胞の自己複製誘導性合成ポリマーを用いた神経幹細胞ニッチシグナル経路の解明,神経幹細胞の自己複製能は細胞外微小環境（ニッチ）により制御され、神経系の発生と恒常性維持に重要であるが、神経幹細胞ニッチは要素複雑性に因り全容解明は困難であった。本研究は独自に開発した神経幹細胞の自己複製を誘導するニッチ擬態ポリマーPA518を用いて、神経幹細胞のニッチシグナル経路の全容解明を目的に行われる。ニッチ擬態ポリマーPA518と対照ポリマーによりトリガーされる経路の網羅的比較解析やPA518結合分子の探索など、この先駆的なポリマー手法を用いた研究の実施により、複合的要因で構成される神経幹細胞の自己複製を制御するニッチシグナル研究における新機軸を打ち出せることが期待される。,基盤研究(C),小区分44020:発生生物学関連,神経幹細胞,自己複製,ニッチ,ポリマー,シグナル伝達,,,,,,,,,,,,,,,,,,,,,,,,,,,,,,,,,,,,,,,,,,,,,,,,,,,
22K06233,山形大学,越智 陽城,パイオニア転写因子による再生エンハンサーのプライミング機構,魚類や両生類はほ乳類と比べて高い再生能を持つ。これら動物が損傷を受けた組織を再生する時、再生で使う遺伝子のエンハンサーは閉じた状態からオープン状態へと移行する必要がある。エンハンサーのクロマチンオープンニングは組織再生において極めて重要なステップであるにも関わらず、その実体は全くわかっていない。そこで本研究は閉じている再生エンハンサーのクロマチンを開けるパイオニア因子の同定と開いた状態を維持するメカニズムの解明を試みる。,基盤研究(C),小区分44020:発生生物学関連,腎再生,パイオニア因子,再生縁ハンサー,機能ゲノム解析,ATAC-seq,核内構造体,ツメガエル,再生,エンハンサー,遺伝子発現制御,ゲノム,KLF,ゲノム機能,エピゲノム,,,,,,,,,,,,,,,,,,,,,,,,,,,,,,,,,,,,,,,,,,
22K06232,鳥取大学,阿部 玄武,魚類正中ヒレの進化発生学で新規器官獲得の機構を紐解く,新たな器官構造の獲得は、大規模な形態進化として古くから興味を持たれる進化発生学の大テーマである。しかしこれまでその具体的なメカニズムの理解には至っていない。,基盤研究(C),小区分44020:発生生物学関連,有対尾ヒレ,Twin-tail形態,四肢発生,新奇形質,異所的筋肉,ヒレ発生,進化発生学,正中ヒレ,器官獲得,Twin-tail,脊椎動物付属肢進化,,,,,,,,,,,,,,,,,,,,,,,,,,,,,,,,,,,,,,,,,,,,,
23K05798,国立遺伝学研究所,川口 茜,発生的拘束を生み出す染色体立体構造に比較クロマチン解析から迫る,種を超えた組織構造の保存性は遺伝子ネットワークなどの内因的な制約によると考えられ、種間での全ゲノム配列や網羅的な遺伝子発現比較で説明されてきた。しかし、遺伝子発現はより多階層の染色体制御に基づく出力結果であることから、種分化の間に存在する発生的拘束と進化の駆動力を紐解くためには、高次の染色体構造の精査と比較が必須である。本研究では、ゲノム配列からは読み取ることのできないエピゲノム、DNA-loop、そして転写単位 (TADs)といった転写の上位制御を種横断的に比較することで、どの階層の染色体構造が発生的拘束を生み出す実体として作用するのかに迫りつつ、新たな比較クロマチン解析学を切り開く。,基盤研究(C),小区分44020:発生生物学関連,クロマチン高次構造,Hi-C,脊椎動物の種間比較,エピジェネティック制御,発生的拘束,染色体立体構造,クロマチン,,,,,,,,,,,,,,,,,,,,,,,,,,,,,,,,,,,,,,,,,,,,,,,,,
23K05797,関西医科大学,林 真一,完全再生動物イモリにおける脊髄再生原理の解明と非再生動物の再生阻害要因克服,ヒトにおける脊髄損傷は運動機能障害を引き起こす重篤な疾患であるが、イモリでは完全再生することが可能である。本研究では遺伝学的解析が可能なイベリアトゲイモリを用い、脊髄再生における再生原理の一端を明らかにする。トランスクリプトーム 解析から得られた再生時高発現遺伝子30個に注目し、イモリ脊髄における発現細胞の特定、イモリ脊髄再生における遺伝子破壊による機能解析、マウスへの遺伝子導入による脊髄損傷における再生促進効果を検証する。本研究によりイモリの再生原理となる分子機構を解明し、マウスを用いその再生作用を検証することで、ヒト脊髄の再生に繋がる可能性を模索する。,基盤研究(C),小区分44020:発生生物学関連,脊髄再生,イモリ,再生遺伝子,神経新生,,,,,,,,,,,,,,,,,,,,,,,,,,,,,,,,,,,,,,,,,,,,,,,,,,,,
23K05796,兵庫県立大学,八田 公平,単純な脊椎動物の消化管運動を単細胞で制御できる細胞群の同定、その発生と機能,腸神経系は脳以外で独立した反射回路をもつ唯一の神経細胞集団であり、腸の内部環境を感じ取り、自立的に運動し、外・内分泌腺を通じて、粘液、消化液や伝達物質などを分泌する。より単純な腸神経系を持ち、一つ一つの細胞の活動と腸の大域的な運動の両方をin vivoで同時に観察できるゼブラフィッシュの幼生は、腸神経系発生・機能を調べるよいモデルになる。本研究では、主にCa2+イメージングと光遺伝学的手法によって、１。機能的な回路が形成される機構、２。ペースメーカー細胞の多様性、３。腸脳相関をつかさどる神経回路の制御を行い、腸において多様な運動を実現する仕組みを、生きた個体内で、単一細胞レベルで明らかにする。,基盤研究(C),小区分44020:発生生物学関連,副交感神経,交感神経,腸,光遺伝学,ゼブラフィッシュ,PFGFRa,カルシウムイメージング,脳腸相関,,,,,,,,,,,,,,,,,,,,,,,,,,,,,,,,,,,,,,,,,,,,,,,,
23K05795,国立研究開発法人理化学研究所,大塚 大輔,SHHシグナル依存的な細胞力覚から明らかにする普遍的形態形成則,本研究では前脳と心臓の形態形成における細胞動態について比較解析を行うことでSHHシグナル依存的な細胞力覚を介した形態形成則 (分子・細胞レベル) のどの部分に共通性があるのかを明らかにする。さらに、SHHシグナル依存的な力覚を実装する分子経路の同定にも取り組む。これらの研究が達成されることにより、モルフォゲンSHHの形態形成における機能が明らかになる。この知見は次世代再生医療において期待されるオルガノイドを用いた臓器再生を達成するための基盤となることが期待できる。,基盤研究(C),小区分44020:発生生物学関連,形態形成,力覚,SHHシグナル,心臓,前脳,細胞力覚,器官を超えた普遍性,,,,,,,,,,,,,,,,,,,,,,,,,,,,,,,,,,,,,,,,,,,,,,,,,
23K05794,東京都立大学,高鳥 直士,胚葉運命分離に至る非同調的な細胞周期制御機構の解析,本研究の特色は、ホヤの胚発生において中・内胚葉細胞の細胞系譜が明らかになっていることを活かして、胚葉運命の分離に至る過程を、遺伝子発現・細胞形態・表層張力・細胞周期の制御といった様々な側面から調べ、一つ一つの細胞において統合して、胚葉運命分離に至る因果関係を理解することである。16細胞期で細胞周期のズレを作り出す因子を明らかにし、その局在の原因を1細胞期へと遡って探ることで、受精卵から胚葉運命分離に至る因果関係の連鎖を明らかにすることを目指す。本研究は、力・形態の制御と、発生運命決定に至る因果関係を統合して細胞レベルで理解する端緒の一つとなるであろう。,基盤研究(C),小区分44020:発生生物学関連,胚葉運命,細胞周期,核移動,原腸陥入,,,,,,,,,,,,,,,,,,,,,,,,,,,,,,,,,,,,,,,,,,,,,,,,,,,,
23K05793,高知大学,藤原 滋樹,胚発生において遺伝子発現開始の適切なタイミングをはかるしくみの解明,ホヤ胚の細胞は厳密に決まった回数の分裂の後に分化する。胚の発生初期にDNA複製を阻害するといつまで待っても遺伝子が発現しない。DNA複製回数をかぞえるしくみとしてヒストン修飾が考えられるが，その分子機構は不明である。本研究ではDNA複製阻害や，原がん遺伝子Mycの強制発現，Cdk阻害因子の機能阻害などにより細胞周期の回数を人為的に操作し，遺伝子発現開始のタイミングに及ぼす影響を調べる。また実験胚におけるヒストン修飾の変化を調べる。ヒストン修飾を人為的に操作して遺伝子発現開始のタイミングの変化を調べる。これらの実験により，細胞周期の進行に合わせて適切な時期に遺伝子発現が開始するしくみを解明する。,基盤研究(C),小区分44020:発生生物学関連,ホヤ,細胞周期,遺伝子発現,Myc,Cdk阻害因子,DNA複製,細胞分化,ヒストン修飾,転写調節,,,,,,,,,,,,,,,,,,,,,,,,,,,,,,,,,,,,,,,,,,,,,,,
23K05792,京都大学,山田 真弓,光操作技術とNGS解析を用いた神経幹細胞の制御メカニズムの解析,光作動性Tetシステムを用いて、神経幹細胞において分化運命決定因子Ascl1のダイナミックな発現を人工的に光制御し、神経幹細胞の増殖およびニューロン分化過程におけるAscl1下流遺伝子を探索する。さらに、光操作技術を用いてAscl1やその下流遺伝子の発現を体系的に光操作し、これらの因子がどのように協調的に機能して、細胞増殖やニューロン分化を制御しているのかを明らかにする。さらに、脳組織中においてもニューロン分化運命決定因子群の発現の光照射を試みる。これらの解析は、ヒトの神経変性疾患・神経障害の治療や、再生医学に適応するための新規戦略の開発に繋がると期待される。,基盤研究(C),小区分44020:発生生物学関連,神経幹細胞,ニューロン分化,光作動性Tetシステム,bHLH型転写因子,遺伝子発現,細胞増殖,NGS解析,振動発現,光操作技術,NGS,転写因子,ニューロン,,,,,,,,,,,,,,,,,,,,,,,,,,,,,,,,,,,,,,,,,,,,
23K05791,東京大学,山元 孝佳,神経外胚葉分化における、ヘパラン硫酸修飾酵素によるモルフォゲンの分布制御,多様な化学修飾パターンを持つヘパラン硫酸（HS）は、Wnt等のモルフォゲンに結合することでその濃度勾配やシグナル伝達を制御する。これまで我々は２つのHS修飾に着目し、細胞内への取り込み頻度が異なることを明らかにした。しかしHS修飾の発生過程における役割はほとんど不明である。そこで本研究では、既存の単純な濃度勾配モデルでは説明できないパターニングの見られる神経外胚葉分化を対象として、そのパターニングを担う複数のモルフォゲンに対するHS修飾の効果を調べる。,基盤研究(C),小区分44020:発生生物学関連,モルフォゲン,ヘパラン硫酸,濃度勾配,,,,,,,,,,,,,,,,,,,,,,,,,,,,,,,,,,,,,,,,,,,,,,,,,,,,,
23K05790,埼玉大学,川村 哲規,ゼブラフィッシュHoxコードの発生遺伝学解析,脊椎動物の発生において、体軸に沿った位置情報を司るHox遺伝子群の機能は未だ不明である。研究代表者は脊椎動物Hox遺伝子の機能解明を目指し、ゼブラフィッシュhoxクラスター欠失変異体を作製し、解析を進めてきた。その結果、ゼブラフィッシュではマウスとは異なり機能重複は限定的で、特定のhoxクラスターへの機能集中が示唆された。従って、機能重複度の低いゼブラフィッシュを用いることで、脊椎動物Hox遺伝子群の新たな役割を解明することが可能となる。本研究では既にhoxクラスター変異体で見出した新規の表現型を軸に、原因となるhox遺伝子を同定し、ゼブラフィッシュhox遺伝子群の機能の全体像を明らかにする。,基盤研究(C),小区分44020:発生生物学関連,Hox遺伝子,ゼブラフィッシュ,CRISPR-Cas9,脊椎動物の形態多様性,脊椎動物の初期進化,CTスキャン,発生遺伝学,脊椎動物の進化,形態の多様性,,,,,,,,,,,,,,,,,,,,,,,,,,,,,,,,,,,,,,,,,,,,,,,
23K05789,秋田大学,鮎川 友紀,細胞骨格を介した新たなPCP制御機構の解明,平面内細胞極性（Planar cell polarity：PCP）は、上皮の組織平面内で細胞の向きを揃えるのに必要な極性で、組織・器官が固有の機能を発揮する上で重要である。PCP制御機構の破綻は、二分脊椎症や心臓弁膜症といった疾患を引き起こすことも報告されている。,基盤研究(C),小区分44020:発生生物学関連,平面内細胞極性,PCP,細胞骨格,,,,,,,,,,,,,,,,,,,,,,,,,,,,,,,,,,,,,,,,,,,,,,,,,,,,,
23K05788,東北大学,松居 靖久,解糖系活性による多能性状態の変換機構に関する研究,奇形腫から樹立した多能性幹細胞株CDGCの多能性状態は、解糖系の阻害によりプライム型からナイーブ型へ変化する。そこで解糖系の下流でナイーブ型への変化に関与する代謝経路を、阻害剤および代謝酵素遺伝子のノックダウン実験により同定する。さらにナイーブ型への変化の初期段階で発現変動する遺伝子のノックダウンおよび強制発現により、解糖系の下流でナイーブ化の誘導に関与する遺伝子を明らかにする。またそれらがマウスやヒトの様々なプライム型多能性幹細胞のナイーブ化でも普遍的に働くことを明らかにする。,基盤研究(C),小区分44020:発生生物学関連,生殖細胞,奇形種,ナイーブ型多能性幹細胞,プライム型多能性幹細胞,解糖系,,,,,,,,,,,,,,,,,,,,,,,,,,,,,,,,,,,,,,,,,,,,,,,,,,,
23K05787,国立研究開発法人理化学研究所,呉 泉,脳の拡大化を支配する時間スケーリング機構を解く,胚発生の時間が生物の種によって大きく異なることはよく知られている。脳の発生の場合、マウスでは1週間以内、フェレットでは約1か月、ヒトでは約4か月続く。申請者が異なる種の神経幹細胞において、遺伝子の発現パターンが保たれたまま発現時間が延長される現象、すなわち「時間スケーリング」の存在が発見した。しかし、そのメカニズムは明らかになっていない。本研究は、マウス、フェレット、ヒト（オルガノイド）という異なる時間スケーリングを持つ神経発生を主な対象として、神経幹細胞に内在する時間スケーリング機構の分子メカニズムを解明し、生物がいかにして時間をコントロールするかという生物学の大きな謎を解決する道を拓く。,基盤研究(C),小区分44020:発生生物学関連,神経発生,神経幹細胞,,,,,,,,,,,,,,,,,,,,,,,,,,,,,,,,,,,,,,,,,,,,,,,,,,,,,,
23K05786,中部大学,大沼 耕平,ホヤの細胞系譜解析から紐解く、「正常」発生脳にある神経細胞の分化と動態の制御機構,脳の細胞がわずか数百個しかないホヤ幼生は、脳の発生を個々の細胞レベルで理解できるモデルである。これまで、脳の細胞系譜解析を通して、幼生の脳細胞が発生過程で従来の報告よりも複雑な動態を示すことを見出した。そこで、脳細胞の発生制御を分化と動態の両面から理解する第一歩として、本研究ではまず、脳にあるすべての神経細胞に注目し、その細胞系譜と動態の様子を完全に明らかにする。次に、神経細胞系譜における転写因子とシグナル分子の発現パターンを網羅的に調べ、その発生に必須な因子とそれらの因子がつくる発現制御ネットワークを特定する。また、動態制御の仕組みを、開発技術とオミクス解析とを組み合わせて明らかにする。,基盤研究(C),小区分44020:発生生物学関連,ホヤ幼生,脳,細胞系譜,動態,発生メカニズム,脳神経細胞,分化,,,,,,,,,,,,,,,,,,,,,,,,,,,,,,,,,,,,,,,,,,,,,,,,,
23K05785,東邦大学,村本 哲哉,組織構築のタイミングを制御する発生タイマーの作動原理,細胞自律的に組織を構築するメカニズムやそのタイミングを制御する発生タイマーの作動原理の理解を通し、組織構築の基本原理を時空間的に解明する。そのためには、細胞内分子の物理パラメータを抽出する計測技術や協調的な振る舞いを操作する技術が欠かせない。そこで、新たに発見したMYB転写因子に焦点を当て、局在変動リズムを刻む仕組みや、周波数の変調が時間制御機構にもたらす影響を明らかにする。,基盤研究(C),小区分44020:発生生物学関連,ライブイメージング,遺伝子発現振動,発生タイマー,光操作,,,,,,,,,,,,,,,,,,,,,,,,,,,,,,,,,,,,,,,,,,,,,,,,,,,,
23K05784,広島大学,田川 訓史,Brachyury 発現細胞のシングルセル解析から左右相称動物の口と肛門の進化に迫る,地球上に現存する動物のほとんどは、左右相称動物に分類され。それらは慣例的に発生学的な特徴に基づいて、さらに新口動物と旧口動物に分類される。新口動物では、初期発生過程の原口から肛門が発生するのに対し、旧口動物では、原口から口が発生する。このように発生様式が異なるにもかかわらず、Brachyury 遺伝子は、どちらの動物群でも同様に、口と肛門で発現が見られる。本研究では、半索動物ヒメギボシムシを用いて、シングルセル解析を行い、口と肛門で Brachyury を発現している細胞の種内等質性を明らかにすることを目的とし、新口動物ならびに旧口動物の異なる発生様式の進化を明らかにする糸口としたい。,基盤研究(C),小区分44020:発生生物学関連,口と肛門,シングルセル解析,ギボシムシ,Brachyury,,,,,,,,,,,,,,,,,,,,,,,,,,,,,,,,,,,,,,,,,,,,,,,,,,,,
23K05783,鳥取大学,竹内 隆,イモリの尾部追加現象と尾再生との関連を探る,有尾両生類の多くは生涯、尾椎を尾端から追加する。一方、これらの動物は尾を再生できる。そのため、この平常時の尾部追加現象は尾再生との関連が示唆される。最近、私たちはHox13変異体イモリが異常に尾部を追加することを発見した。本研究では、この変異体イモリを用いて、平常時で尾部を追加するしくみを明らかにする。ついでその不活化により、この機構が尾の再生にどれだけ、また、どのように使用されているかを検証する。本研究から (1) 多くが謎である尾再生機構の詳細の解明、 (2) 平常時の成体で稼働している生理的な機構が付加再生においても活用される初めての例になること、が期待される。,基盤研究(C),小区分44020:発生生物学関連,組織比率,尾長比,尾再生,Hox,イモリ,尾形成,Hox13,組織サイズ比,,,,,,,,,,,,,,,,,,,,,,,,,,,,,,,,,,,,,,,,,,,,,,,,
23K05782,大阪大学,下條 博美,エピブラスト運命決定過程における多能性因子Nanogの時期特異的な機能の解析,Nanogは着床前胚の内部細胞塊において細胞周期に伴った周期的な発現を示し、クロマチン構造変化や標的遺伝子の発現を誘導することでエピブラスト分化を制御している。しかしながらNanogの時期特異的な機能については不明な点も多く、エピブラスト分化の時間制御機構についてはよく分かっていない。そこで本研究では着床前胚発生過程におけるNanogの標的遺伝子とクロマチン構造の変遷を明らかにし、Nanogを時期特異的にノックダウンして遺伝子発現やクロマチン構造に現れる変化を解析することでNanogの時期特異的な機能を明らかにし、エピブラスト運命決定のタイミング制御機構を明らかにすることを目指す。,基盤研究(C),小区分44020:発生生物学関連,細胞分化,幹細胞,着床前胚,遺伝子発現動態,エピジェネティクス,ライブイメージング,,,,,,,,,,,,,,,,,,,,,,,,,,,,,,,,,,,,,,,,,,,,,,,,,,
23K05781,京都大学,森本 裕子,精子幹細胞における銅代謝制御機構の解明,最近我々は酸素濃度がNOX1の活性に影響を与える事を見出し、酸素制御に関わる金属と精子幹細胞活性の検証実験過程で銅が選択的に精子幹細胞に蓄積している事を明らかにした。銅欠乏は精子形成を阻害し過剰量も悪影響を与えるが、幹細胞の自己複製との関わりは知られておらず、幹細胞に特異的に金属が集積している例はない。本研究では銅が精子幹細胞に及ぼす役割を明らかにする事を目的とする。銅はROS代謝に関わりが深い分子である事から、銅がROSに及ぼす影響に特に着目して精子幹細胞に及ぼす影響を調べる。さらに銅の作用する直接の標的遺伝子を同定し、幹細胞と分化細胞に与える銅代謝の違いを明らかにし、幹細胞の特性に迫る。,基盤研究(C),小区分44020:発生生物学関連,精子幹細胞,銅代謝,,,,,,,,,,,,,,,,,,,,,,,,,,,,,,,,,,,,,,,,,,,,,,,,,,,,,,
23K05780,京都大学,櫻井 英俊,iPS細胞由来MSCを活用した骨格筋再生メカニズムの解明,我々はiPS細胞由来間葉系間質細胞(iMSC)の移植により筋ジストロフィーモデルマウスの筋再生を促進し治療に成功した。しかし、骨髄や脂肪由来MSCを移植した際、移植後の筋再生能には明らかな差があり、iMSCは骨格筋MSCと同等の高い骨格筋再生能を有していることが分かってきた。本研究課題では、このiMSCの持つ骨格筋再生能が何によって規定されているのかを明らかにし、筋疾患への移植治療に向けた治療メカニズム解明を目指す。,基盤研究(C),小区分44020:発生生物学関連,間葉系間質細胞,筋再生,分泌因子,６型コラーゲン,iPS細胞,ウルリッヒ型先天性筋ジストロフィー,,,,,,,,,,,,,,,,,,,,,,,,,,,,,,,,,,,,,,,,,,,,,,,,,,
23K05779,静岡大学,齋藤 貴子,同種異個体を識別する卵子と精子の細胞間認識機構,新しい個体を生み出す、つまり受精を成立させるために、ほぼ全ての生物が多大な労力を費やして有性生殖を行う。その戦略の一つとして雌雄同体の形態をとる生物がある。雌雄同体は有利に働く場面もある一方で、有性生殖の利点を失う自家受精という危険性も隣り合わせている。そこで固着性の雌雄同体生物ホヤは、精子と卵子が自己と非自己を識別して自家受精を回避する自家不和合性機構を独自に獲得した。本研究では、研究代表者らが同定した自他認識分子がどのように自己と非自己を識別するのか、そして自己と認識された精子がどのように排除されるのか、その分子機構を解明し生殖医療や発生工学への発展を目指す。,基盤研究(C),小区分44020:発生生物学関連,受精,卵子,精子,自家不和合性,ホヤ,細胞間認識,,,,,,,,,,,,,,,,,,,,,,,,,,,,,,,,,,,,,,,,,,,,,,,,,,
