awardnumber,organization,name,title,abstract,section,review_section,keyword1,keyword2,keyword3,keyword4,keyword5,keyword6,keyword7,keyword8,keyword9,keyword10,keyword11,keyword12,keyword13,keyword14,keyword15,keyword16,keyword17,keyword18,keyword19,keyword20,keyword21,keyword22,keyword23,keyword24,keyword25,keyword26,keyword27,keyword28,keyword29,keyword30,keyword31,keyword32,keyword33,keyword34,keyword35,keyword36,keyword37,keyword38,keyword39,keyword40,keyword41,keyword42,keyword43,keyword44,keyword45,keyword46,keyword47,keyword48,keyword49,keyword50,keyword51,keyword52,keyword53,keyword54,keyword55,keyword56
18K06272,大学共同利用機関法人自然科学研究機構(新分野創成センター、アストロバイオロジーセンター、生命創成探究,加藤 輝,生物画像の定量的解析のためのソフトウェアの開発,近年，多次元画像化・大容量化した生物研究における観察画像から，生物学的に重要な特徴を効率よく抽出し測定する必要に迫られている．また，生物学領域全般では，観察対象の広さゆえに，多様な画像データが産生される．この現状に対処すべく生物画像データ解析に特化したソフトウェア開発を実施した．本ソフトウェア系は，画像中の生物学的特徴を幾何的な表現として簡潔に表現・記述を可能とする基盤であり，比較的小規模なプログラミングによって解析システムを構築することができる．この系を使用し，培養細胞系における細胞内小器官から魚類の自由泳動様式の解析に至るまで，広範な生物実験における定量的画像解析を実施した．,基盤研究(C),小区分44020:発生生物学関連,生物画像データ解析,生物画像解析,生物画像情報解析,,,,,,,,,,,,,,,,,,,,,,,,,,,,,,,,,,,,,,,,,,,,,,,,,,,,,
18K06271,国立研究開発法人産業技術総合研究所,佐藤 隆,アクロソーム中心に発現する新規糖鎖分解酵素による糖鎖修飾の生物学的意義の解明,円形精子細胞から伸張精子細胞への分化過程は、精子形成の中でも最も劇的な形態的機能的変化を伴う。我々は、その過程で形成される精子特異的なオルガネラであるアクロソームの中心に存在する糖鎖分解酵素Glb1lが精子機能に必須であることを明らかにした。In vitro およびin vivoの解析からGlb1lはO結合型糖鎖を分解する酵素活性を有していた。Glb1l遺伝子を欠損したマウスの精子は、外見上は正常であったが、卵子細胞の透明帯を通過できないために不妊となった。Glb1lによる糖鎖リモデリングがアクロソーム内部の酵素群の機能制御に関連している可能性が考えられた。,基盤研究(C),小区分44020:発生生物学関連,糖鎖分解酵素,精子発生,アクロソーム,糖鎖リモデリング,雄性不妊,糖質分解酵素,精子形成,生殖,,,,,,,,,,,,,,,,,,,,,,,,,,,,,,,,,,,,,,,,,,,,,,,,
18K06270,愛知学院大学,遠藤 哲也,四肢再生系を応用したマウス関節再生能力の評価,本研究ではまずマウスの指の関節軟骨が生後約3週間かけて成熟すること、その際には関節において相対している先端側の骨と基部側の骨の関節軟骨同士の相互作用が必要であることを明らかにした。さらに成熟過程にある中節骨の基部側半分を切り出し、基部先端部をひっくり返して元の場所に戻す移植実験を行うと、中節骨の切断部位に、本来関節ではない場所であるにも関わらず関節軟骨と思われる組織が作られることが分かった。これは切断部位に隣接している正常な関節軟骨からの何らかの作用を受けて作られたものと考えられる。以上の結果は、少なくとも生後しばらくの間マウスは指関節を再生する能力を潜在的に持っている可能性を示唆する。,基盤研究(C),小区分44020:発生生物学関連,再生,関節,関節軟骨,四肢,関節再生,四肢再生,器官再生,enthesis,,,,,,,,,,,,,,,,,,,,,,,,,,,,,,,,,,,,,,,,,,,,,,,,
18K06269,立教大学,木下 勉,心臓の組織再生に関わるIslet-1の転写制御機構の解析,成体になっても心筋再生が可能なツメガエルと心筋を再生できないマウスの間で、心筋前駆細胞の制御遺伝子Islet1の転写調節機構を比較解析した。ツメガエルでは心筋切除術後1日目にIslet1とHIF1αの遺伝子発現が上昇した。Islet1の転写制御に関わるHIF1αの作用点は、Islet1遺伝子の上流に存在する８番目の保存領域（MCR８）に存在していた。マウスやヒトではMCR8に存在しているHIF1α結合モチーフが失われていた。,基盤研究(C),小区分44020:発生生物学関連,心筋再生,心筋前駆細胞,Islet-1遺伝子,転写制御,HIF1α,種間比較,Islet1,両生類,Islet-1,アフリカツメガエル,前駆細胞,,,,,,,,,,,,,,,,,,,,,,,,,,,,,,,,,,,,,,,,,,,,,
18K06268,東洋大学,小柴 和子,真骨魚類の動脈球獲得におけるエラスチンの機能,多くの脊椎動物の心臓流出路が心筋から構成されているのに対し、ゼブラフィッシュなどの真骨魚類はエラスチンに富んだ平滑筋からなる心臓流出路（動脈球）を有する。これまでの研究から動脈球の獲得にはトロポエラスチン遺伝子の重複と新規機能の獲得が重要であることが分かってきた。本研究では、エラスチン重合に関与するltbpやファイブリンに着目し、ゼブラフィッシュの心臓発生における発現パターンを詳細に観察するとともに、トロポエラスチン遺伝子も含めこれら遺伝子が動脈球に発現する制御機構を明らかにした。,基盤研究(C),小区分44020:発生生物学関連,ゼブラフィッシュ,動脈球,エラスチン,心筋,平滑筋,心臓流出路,心臓進化,,,,,,,,,,,,,,,,,,,,,,,,,,,,,,,,,,,,,,,,,,,,,,,,,
18K06267,高知工科大学,蒲池 雄介,発生における分化スイッチを担うSoxパートナー因子複合体のin vivo作用機構,Sox転写因子群は、胚発生過程において様々な組み合わせのSox-パートナー因子複合体をつくり、細胞の分化状態の制御に重要な役割を果たしていると考えられる　本研究では、Sox-パートナー因子複合体のin vivoでの解析を進めるため、ゲノム編集を用いたノックインにより、ゼブラフィッシュの内在のSoxならびにパートナー因子に複合タグ配列を付加した。CRISPR-Cas9によるゲノムの切断、それに引き続く長鎖ssDNAドナーを用いた修復を引き起こすことで、sox3、sox11a、pax6a遺伝子への複合タグ配列のノックインが効率的に行えることを示した。,基盤研究(C),小区分44020:発生生物学関連,ノックイン,複合タグ,ゲノム編集,転写因子,Sox,エヒトーフタク,エピトープタグ,分化スイッチ,,,,,,,,,,,,,,,,,,,,,,,,,,,,,,,,,,,,,,,,,,,,,,,,
18K06266,兵庫県立大学,餅井 真,再生を制御する傷表皮シグナルの解明,尾部再生過程の傷表皮とAEC細胞で特異的にEGFPを発現するトランスジェニック・アフリカツメガエル幼生から、これら組織の細胞をソーティングにより単離し、トランスクリプトーム解析をおこなった。その結果、傷表皮/AECから分泌され再生を制御する可能性のある分子の遺伝子として数10の遺伝子を同定した。さらに再生肢芽における発現も検討した結果、一部遺伝子は肢芽で発現しないこともわかった。一方、肢芽の傷表皮/AEC由来因子として知られているfgf8の発現は尾部では検出されなかった。,基盤研究(C),小区分44020:発生生物学関連,アフリカツメガエル,再生,傷表皮,apical epithelial cap,分泌性シグナル因子,AEC,尾部再生,トランスクリプトーム,分泌生シグナル因子,,,,,,,,,,,,,,,,,,,,,,,,,,,,,,,,,,,,,,,,,,,,,,,
18K06265,熊本大学,永井 宏樹,漿尿膜融合を誘導する機能性を指標にした、新しい中皮細胞EMT制御分子の探索,ヒト疾患や胚発生などの様々な局面に関わりを持つ中皮細胞EMTの調節メカニズムについては、不明な点が数多く存在する。本研究では、新しい中皮EMTモデルとしてニワトリ胚の漿尿膜融合に着目した。漿尿膜融合では漿膜中皮と尿膜中皮のクロストークにより中皮EMTが誘導される。漿尿膜融合を駆動する中皮EMT制御分子の探索をおこない、EMTコア転写因子、WNTおよびTGFシグナル分子、中皮腫マーカーWT1などが漿尿膜融合の中皮EMT調節制御に関与していることを明らかにした。,基盤研究(C),小区分44020:発生生物学関連,漿尿膜融合,中皮EMT,ニワトリ胚モデル,EMT,ニワトリ胚,上皮間葉転換,中皮細胞,胚発生,胚体外組織,,,,,,,,,,,,,,,,,,,,,,,,,,,,,,,,,,,,,,,,,,,,,,,
18K06264,熊本大学,江良 択実,起源が異なる２つの間葉系幹細胞の細胞生物学的特徴の解析と疾患モデル治療,人工多能性幹細胞 (iPSC) は個体にかわるの細胞源として期待されている。私たちは、ヒトiPS細胞から中胚葉様および神経上皮様細胞を介して MSC に分化させるための新しい方法を確立しました。派生した両方の MSC 集団は、褥瘡マウスモデルの皮膚潰瘍や変形性関節症のマウスモデルで治療効果を有していた。興味深いことに、2種類の疾患モデルのでは、 2つの由来が異なるMSC 間で治療効果が異なり、治療効果は細胞の起源に依存することが示唆された。この違いは、MSCの分泌する蛋白因子の発現の差に起因することが考えられました。,基盤研究(C),小区分44020:発生生物学関連,間葉系幹細胞,細胞由来,,,,,,,,,,,,,,,,,,,,,,,,,,,,,,,,,,,,,,,,,,,,,,,,,,,,,,
18K06263,熊本大学,伊藤 尚文,リボソーム取り込みによる多分化細胞誘導機構の解明,本研究ではリボソームを外部から細胞に導入することで細胞塊を形成し多分化能を誘導する。大腸菌由来のリボソームをマウス胚性線維芽細胞に添加すると細胞塊が形成され、多能性マーカーであるNanogやOct4の発現が免疫染色によって確認された。このマウス細胞塊での多能性マーカーの発現はモザイクパターンであり、ヒト皮膚繊維芽細胞で作出した細胞塊と同じであった。さらにこの細胞塊を胚性幹細胞(ES細胞）の培養条件に近い培養液で培養すると、細胞塊周辺に通常の細胞と比較して小さい細胞（小細胞）が出現した。この小細胞は免疫染色でOct4a陽性であったが、細胞核だけでなく細胞質にも発現がみられる、核構造にも変形が見られた。,基盤研究(C),小区分44020:発生生物学関連,細胞初期化,初期発生,リボソーム,微生物,進化,,,,,,,,,,,,,,,,,,,,,,,,,,,,,,,,,,,,,,,,,,,,,,,,,,,
18K06262,熊本大学,小川 峰太郎,マウスES細胞から造血幹細胞を分化誘導する培養法の開発,造血幹細胞は背側大動脈の造血性内皮細胞からプレ造血幹細胞を経て発生する。マウス胚体から単離した造血性内皮細胞とプレ造血幹細胞を造血幹細胞に分化させる培養系を確立した。マウス胚体組織のsingle cell RNA-sequencingを行い、造血性内皮細胞以前の早期の前駆細胞から造血幹細胞に至る分化経路を特定した。これらの成果から、より早期の前駆細胞から造血幹細胞を分化誘導する培養系の開発とES細胞分化系への応用が可能になる。,基盤研究(C),小区分44020:発生生物学関連,造血幹細胞,血管内皮細胞,造血性内皮細胞,中胚葉細胞,ES細胞,試験管内分化,個体発生,マウス,single cell RNA-seq,胚性幹細胞,,,,,,,,,,,,,,,,,,,,,,,,,,,,,,,,,,,,,,,,,,,,,,
18K06261,九州大学,永松 剛,卵母細胞の発生過程における品質管理機構の解析,ライブイメージングの手法によって卵母細胞のシストブレイクダウンは徐々に進行していることを明らかとし、この際に失われていく細胞は大きく移動していることを見出した。さらにミトコンドリア状態を観察する独自のES細胞（TREloxMtGR）の解析から卵母細胞のシスト間でミトコンドリアが移動していることを示唆する結果を得ている。,基盤研究(C),小区分44020:発生生物学関連,生殖細胞,卵母細胞,イメージング,圧力,,,,,,,,,,,,,,,,,,,,,,,,,,,,,,,,,,,,,,,,,,,,,,,,,,,,
18K06260,九州大学,今村 寿子,実験－理論相互連動による肺の階層構造形成メカニズムの解明,肺気管支が、長さと太さに関して階層的な構造を形成するメカニズムについて、実験観察と数理モデルを組み合わせた研究を行った。その結果、発生が進むにつれて上皮組織のシグナル分子応答性が変化することを見出し、これが分岐枝の長さを調節するという予測を得た。さらに分岐枝径と分岐枝長の調節機構として、細胞変形の重要性を示した。,基盤研究(C),小区分44020:発生生物学関連,形態形成,肺,分岐形成,計算機シミュレーション,数理モデル,発生生物学,血管,細胞運動,分岐,FGF,Wnt,,,,,,,,,,,,,,,,,,,,,,,,,,,,,,,,,,,,,,,,,,,,,
18K06259,高知大学,砂長 毅,群体ホヤの有性化において生殖系列幹細胞の分化を調節する分子メカニズム,本研究では，ミダレキクイタボヤの有性化に伴って発現量が上昇する遺伝子群の詳細な発現解析と機能解析を行い，生殖系列幹細胞の分化および生殖細胞の形成を制御する分子メカニズムを解析した。その結果，SSNA1遺伝子が生殖系列幹細胞の維持あるいは分化制御に重要な役割を担っていることが明らかになった。また，SSNA1，SoxB2，SoxF，FoxLが卵母細胞で発現し，卵形成における細胞成長に必要である可能性が示された。その他，生殖系列幹細胞で発現する遺伝子を1つ，生殖系列特異的な発現を示す8つの遺伝子を同定した。これらの遺伝学的解析の基盤となる網羅的トランスクリプトームデータベースを整備した。,基盤研究(C),小区分44020:発生生物学関連,Sox,SSNA1,生殖系列幹細胞,配偶子形成,トランスクリプトーム,卵形成関連遺伝子,sox,TDRD,Tudor,卵母細胞,生殖細胞,トランスクリプトーム解析,幹細胞,ホヤ,,,,,,,,,,,,,,,,,,,,,,,,,,,,,,,,,,,,,,,,,,
18K06258,山口大学,村上 柳太郎,原腸形成期の内胚葉は分泌性因子によって内臓中胚葉を誘引する,本研究計画は内胚葉と内臓中胚葉が原腸陥入時に合体するメカニズムの解明が主なテーマだったが、陥入時の中腸原基で発現する遺伝子を探索し、その突然変異および強制発現を行う過程で、ParaHOX 遺伝子 caudal (cad)が中腸の前後性の確立に必須であることが判明したことから、cad の機能解析に研究の中心を移した。cadはbicoid支配下で後方内胚葉で発現しその分化を誘導する。 cad の系統進化的意義を検討したところ、cadオーソログは前後性を示す管状の消化管を持つ左右相称動物のみに見られた。cadは放射相称の消化器官から前後性を示す消化管への進化で決定的な役割を担ったと考えられる。,基盤研究(C),小区分44020:発生生物学関連,ショウジョウバエ,中腸,内胚葉,ParaHOX,caudal,前後性,左右相称動物,ParaHox,cad,bicoid,部域分化,原腸形成,内臓中胚葉,形態形成,hkb,srp,Ance,,,,,,,,,,,,,,,,,,,,,,,,,,,,,,,,,,,,,,,
18K06257,広島大学,鈴木 賢一,器官再生を惹起するROSシグナルの解明,本研究の最終目的は、器官再生におけるROSシグナルの重要性と一連の分子機構を解明することである。高い器官再生能力を持ち、超高効率のゲノム編集が可能なイベリアトゲイモリをモデル動物として研究を行なった。まず四肢再生芽におけるトランスクリプトミクス解析を行い、ROSシグナルの下流において四肢再生の鍵となる候補因子の同定を試みた。次にこれら候補遺伝子群の一部に対してはノックアウト解析を行い、器官再生における機能を評価した。さらに、ROSシグナリングを細胞レベルで時空間的に誘導可能なトランスジェニックイモリの作出も行なった。,基盤研究(C),小区分44020:発生生物学関連,イベリアトゲイモリ,器官再生,ROS,ゲノム編集,トランスジェニック,両生類,トランスクリプトーム解析,プロテオミクス,トランスクリプトミクス,エピジェネティクス,,,,,,,,,,,,,,,,,,,,,,,,,,,,,,,,,,,,,,,,,,,,,,
18K06256,大阪大学,小沼 健,動植軸と左右軸の決定機構を単純な脊索動物を使って理解する,胚発生の重要なイベントに、胚軸 (動植軸、それに直行する軸、左右軸)の決定がある。本研究では、脊索動物ワカレオタマボヤの特質に着眼して、(1)動植軸と (2) 左右軸ができるしくみを調べた。その結果、,基盤研究(C),小区分44020:発生生物学関連,オタマボヤ,脊索動物,動植軸,左右軸,Nodal,Bmp,母性mRNA,進化,左右,左右非対称性,背腹,Ca2+,母性因子,局在mRNA,左右性,イメージング,,,,,,,,,,,,,,,,,,,,,,,,,,,,,,,,,,,,,,,,
18K06255,大阪大学,稲木 美紀子,細胞キラリティが左右非対称な内臓捻転を誘導する力学的機構の解明,多くの生物は、外形、内臓や脳などに左右非対称な形態や機能をもち、左右非対称性の形成は生物の正常発生に必須である。申請者は、ショウジョウバエ胚の後腸をモデル系として生体内で細胞キラリティ（細胞の左右非対称性）が内臓器官の左右非対称な形態を誘導する仕組みを研究してきた。これまで、細胞キラリティが、左右非対称な「細胞スライド」と名付けた細胞のキラルな変形により、左右非対称な内臓捻転を引き起こすことを示してきた。本研究では、RNA干渉スクリーニング、ex vivo組織培養、超解像度ライブイメージングにより、細胞キラリティおよび細胞スライドを誘発する力学的機構を明らかにした。,基盤研究(C),小区分44020:発生生物学関連,細胞キラリティ,左右非対称性,器官形成,アクチン細胞骨格,細胞スライド,細胞移動,,,,,,,,,,,,,,,,,,,,,,,,,,,,,,,,,,,,,,,,,,,,,,,,,,
18K06254,京都大学,下條 博美,細胞運命決定のタイミングを制御する分子タイマーの実体と時間制御機構,細胞分化は幹細胞が刻々と性質を変化させ厳密に制御されたタイミングで誘導されるが、その分子機構の多くは不明である。神経幹細胞ではHes1とその標的遺伝子Neurog2が発現振動し幹細胞の未分化性を維持しているが、本研究ではライブイメージングと光遺伝学を用いて、Neurog2の発現振動によって下流遺伝子Tbr2が幹細胞において蓄積することを見出した。さらにTbr2はHes1の発現を抑制し、幹細胞の性質を徐々に変化させ細胞分化を引き起こした。以上のことからHes1-Neurog2-Tbr2の発現動態によって、幹細胞における連続的な性質変化が制御され、細胞分化が引き起こされることが明らかとなった。,基盤研究(C),小区分44020:発生生物学関連,神経幹細胞,細胞分化,遺伝子発現動態,ライブイメージング,光遺伝学,Notchシグナル,神経発生,神経分化,Neurogenin,細胞運命決定,分子タイマー,,,,,,,,,,,,,,,,,,,,,,,,,,,,,,,,,,,,,,,,,,,,,
18K06253,京都大学,大塚 俊之,哺乳動物の脳発生・脳進化メカニズムの解明,神経幹細胞・前駆細胞でShhまたは活性型Smoothenedを高発現するトランスジェニックマウスにおいて、神経幹細胞の増殖促進、脳室・脳室周囲帯の拡大、脳表面積の顕著な拡大、脳表の皺状構造を認めた。更にHes遺伝子を共発現させることにより表現型の増強を認めた。また、TransthyretinプロモーターおよびF3FuguOtx2プロモーターを用いて、脈絡叢特異的に遺伝子発現するマウスを作製し、脈絡叢上皮細胞から任意の液性因子を分泌可能であることを示した。脈絡叢特異的にShhを強制発現するマウスでは、脈絡叢上皮細胞の増殖促進による脈絡叢サイズの増大と、大脳皮質神経幹細胞の増殖促進効果を認めた。,基盤研究(C),小区分44020:発生生物学関連,脳発生,脳進化,神経発生,神経幹細胞,脳形態形成,脈絡叢,Sonic hedgehog,Hes,Shh,,,,,,,,,,,,,,,,,,,,,,,,,,,,,,,,,,,,,,,,,,,,,,,
18K06252,京都大学,田所 竜介,体表呈色の濃淡を制御するメガ小胞の形成メカニズムを解明する,我々の肌や毛はメラニン色素により彩られる。このメラニン色素は皮膚にあるメラノサイトの中のメラノソーム（色素産生オルガネラ）により産生されたのち、周囲の表皮細胞へと輸送される。この現象は色素輸送と呼ばれ、体表の呈色に不可欠なプロセスである。本研究では、研究代表者がニワトリ胚表皮をモデルとした解析により、これまでに見出した３通りの輸送法のうち、細胞膜からできた大型の輸送小胞（メガ小胞）の形成メカニズムを、独自の視点で調査した。皮膚内及び培養系などを用いて、形成過程のイメージングや表皮構造及びメラノソームなどに関して調査を行い、形成メカニズムの解析の糸口となる多くの情報を得ることができた。,基盤研究(C),小区分44020:発生生物学関連,メラニン色素,オルガネラ,メラノソーム,色素沈着,メラノサイト,表皮細胞,色素細胞,呈色,表皮,細胞間輸送,メラニン,,,,,,,,,,,,,,,,,,,,,,,,,,,,,,,,,,,,,,,,,,,,,
18K06251,金沢大学,林 貴史,ショウジョウバエ複眼におけるタイリングメカニズム,同じ形状が隙間無く敷き詰められたタイリングパターンは様々な動物の表皮や昆虫の複眼において観察されます。通常、昆虫の複眼は六角形パターンを構成しますが、エビの複眼やハエのある種の変異体においては四角形タイルが安定的に形成されます。表皮細胞において観察される六角形パターンは物理的に安定ですが、四角形タイルは物理的に安定では無いため、複眼の四角形・六角形パターンの自己組織化機構は不明でした。本研究において、複眼のタイリングパターンは物理的な安定性により形成されるのではなく、複眼の初期配置とその後の同心円状的な成長を基本とした幾何学的な空間分割機構により決定されていことが明らかになりました。,基盤研究(C),小区分44020:発生生物学関連,ショウジョウバエ,タイリング,ボロノイ分割,四角形パターニング,複眼,バーテックスモデル,６角形パターン,４角形パターン,シミュレーション,,,,,,,,,,,,,,,,,,,,,,,,,,,,,,,,,,,,,,,,,,,,,,,
18K06250,東京工業大学,羽毛田 聡子,視神経軸索の固有の層への投射を決定する分子コードとシナプス形成メカニズム,ショウジョウバエの視神経回路は蛹期中期に軸索を標的層まで伸ばし、シナプス形成を始める。視神経が正しい層に投射するために膜タンパク質と接着分子は特定の層に固着するコードを生み出していると予想した。そこで、脱リン酸化酵素LAR、Ptp69Dと接着分子N-Cadherin (CadN)、Capricious（Caps）の4分子に注目し、R7視神経軸索投射における役割を解析したところCadNとCapsはLarと相互作用し、標的層に安定化させる機能を持つことがわかった。また、ショウジョウバエのNueroligin2とNeurexin1が視神経でのシナプス形成に関わっていることが分かった。,基盤研究(C),小区分44020:発生生物学関連,軸索投射,シナプス形成,ショウジョウバエ,視神経,視神経系,,,,,,,,,,,,,,,,,,,,,,,,,,,,,,,,,,,,,,,,,,,,,,,,,,,
