awardnumber,organization,name,title,abstract,section,review_section,keyword1,keyword2,keyword3,keyword4,keyword5,keyword6,keyword7,keyword8,keyword9,keyword10,keyword11,keyword12,keyword13,keyword14,keyword15,keyword16,keyword17,keyword18,keyword19,keyword20,keyword21,keyword22,keyword23,keyword24,keyword25,keyword26,keyword27,keyword28,keyword29,keyword30,keyword31,keyword32,keyword33,keyword34,keyword35,keyword36,keyword37,keyword38,keyword39,keyword40,keyword41,keyword42,keyword43,keyword44,keyword45,keyword46,keyword47,keyword48,keyword49,keyword50,keyword51,keyword52,keyword53,keyword54,keyword55,keyword56
18KK0187,高知大学,佐藤 周之,ベトナムの農業水利施設へのストックマネジメント導入の可能性について,本研究では、ベトナムにおいて建造される農業水利を目的としたコンクリート構造物のコンクリートの品質を明らかにすること、健全な維持管理のためのストックマネジメント体制の導入の可否を検討することを目的とした。ODA等の支援によるプロジェクトの場合、日本の技術者が施工管理を担っているため、建造当初は一定の品質が担保されていた。また、全体としてコンクリートの品質は低いものが多い傾向にあった。現状で、維持管理体制はほとんど構築されていなかった。また、維持管理のための性能評価を的確に実施する体制が構築できておらず、理論に基づく体系的な検査・管理体制構築の必要性があった。,国際共同研究加速基金(国際共同研究強化(B)),中区分41:社会経済農学、農業工学およびその関連分野,農業水利施設,コンクリート構造物,ストックマネジメント,コンクリートの品質,調査診断技術,ベトナム社会主義共和国,コンクリート品質,非破壊試験,初期欠陥,,,,,,,,,,,,,,,,,,,,,,,,,,,,,,,,,,,,,,,,,,,,,,,
18KK0186,島根大学,若月 利之,農民の自力水田開発によるナイジェリアケッビ州の稲作革命に関する学術調査,ケッビ州のニジェール川本支流氾濫原50万haで、アフリカ水田農法(Sawah Technology)が普及・進化し、農民の自力(内発的)携帯ポンプ灌漑水田稲作が2011年以降、持続的に拡大している。乾雨期稲作が2021年までの10年間で年間20万ha以上に拡大し、年間籾生産100万トン以上を実現したことを、ナイジェリア国立農業機械化センター（NCAM)のSawah teamとの共同現地調査、Google earth衛星画像、文献調査等により確認した。ナ国連邦農業省は世銀のAPPEALSやJICAのAFICATプログラム等の支援を得てSawah Technologyの全国普及活動を本格化した。,国際共同研究加速基金(国際共同研究強化(B)),中区分41:社会経済農学、農業工学およびその関連分野,Sawah Technology,アフリカ水田農法,内発的水田開発,Kebbi Rice Revolution,水田稲作の在地化,水田プラットフォームの進化,サバンナ帯の氾濫原と内陸デルタの水田稲作,内陸小低地の水田稲作,水田platformの進化,Kebbi rice revolution,農民組織,Sawah technology,Yield  Gap,微生物 群集構造,微生物群集,Sawah system evolution,Paddy yield gap,アフリカの水田進化,水田仮説,水田農業とアフリカの緑の革命,Sawah hypothesis,Sawah Hypothesis,Kebbi稲作革命,水田仮説１,水田仮説２,,,,,,,,,,,,,,,,,,,,,,,,,,,,,,,
18KK0185,東京農工大学,杉原 創,半乾燥熱帯アフリカ畑作地における持続可能な集約化のための混作技術革新,本研究では、土壌リン欠乏を改善し持続的に増産するために、当地で伝統的に行われてきたマメ科と主作物との混作技術革新に必要な知見を獲得することを目的に、国際共同研究を実施した。,国際共同研究加速基金(国際共同研究強化(B)),中区分41:社会経済農学、農業工学およびその関連分野,混作,リン循環,持続可能性,根粒菌,アフリカ,,,,,,,,,,,,,,,,,,,,,,,,,,,,,,,,,,,,,,,,,,,,,,,,,,,
18KK0184,帯広畜産大学,耕野 拓一,顧みられない人獣共通感染症の経済疫学研究：社会に埋め込まれた行動と外部性への対応,途上国における畜産物への需要・生産の拡大が続く一方で、畜産分野では先進国においてすでに制圧されてしまった風土病的人獣共通感染症（Zoonosis）の広がりが大きな問題となっている。,国際共同研究加速基金(国際共同研究強化(B)),中区分41:社会経済農学、農業工学およびその関連分野,ミャンマー,マダガスカル,スリランカ,経済疫学,牛結核,ブルセラ病,人獣共通感染症,社会実験,外部不経済,ブルセラ症,隠匿行動,感染症,顧みられない人獣共通感染症,外部性,途上国,,,,,,,,,,,,,,,,,,,,,,,,,,,,,,,,,,,,,,,,,
18KK0183,北海道大学,内田 義崇,Consequences of intensive maize cultivation on soil microbiome and efficient nitrogen cycling in sub-Saharan Africa,本研究では、サブサハラ・アフリカ地域における土壌劣化の深刻性を、窒素循環に関わる土壌微生物の機能と多様性によって評価し、有機物施用によるそれらの回復力を明らかにすることを目的としている。そのために、現地調査により土壌劣化の現,国際共同研究加速基金(国際共同研究強化(B)),中区分41:社会経済農学、農業工学およびその関連分野,サブサハラ,窒素循環,土壌微生物,硝化,機能遺伝子,炭素循環,炭素欠乏,独立栄養細菌,無機態炭素固定,硝化菌,土壌劣化,サブサヘルアフリカ,トウモロコシ,,,,,,,,,,,,,,,,,,,,,,,,,,,,,,,,,,,,,,,,,,,
19KK0171,秋田県立大学,増本 隆夫,トンレサップ湖の消長に関わる水田主体流域管理技術の開発と農村インフラ輸出への展開,トンレサップ湖や周辺農地の水循環に焦点をあて、カンボジア国水資源気象省と展開してきた共同研究を進展させ、分布型水循環モデルと領域気候モデルを組み合わせた「カップリングモデル」を開発することで、未解明の湖内の熱収支や水循環機構、人為的で複雑な農業水利用の過程、湖と農業水利用の関係、さらに将来の湖の周辺農業開発の影響等を解明する。また、新たな結合モデルを利用して、極端現象（洪水や渇水）に適応する水田地帯の持つ洪水防止・地下水涵養機能を積極的に利活用した水田主体流域管理技術の開発や極端に観測データの少ない地域における新たな流域灌漑方策の提案へと展開する。,国際共同研究加速基金(国際共同研究強化(B)),中区分41:社会経済農学、農業工学およびその関連分野,分布型水循環モデル,領域気候モデル,湖内熱収支,同位体分析,流域灌漑方策,リモートセンシング,流域灌漑方式,,,,,,,,,,,,,,,,,,,,,,,,,,,,,,,,,,,,,,,,,,,,,,,,,
19KK0170,佐賀大学,辻 一成,ベトナム・メコンデルタにおける農業構造変化と農業生産力の保全に関する国際共同研究,本研究では、1996年から断続的に実施されてきたベトナムの二大デルタにおける農家経済調査を継続して行う。また、2000年以降に加速されてきた農業の新たな担い手形成の進展による影響を分析・検討するための調査研究を新規に追加する。加えて、農業そのものの近代化の側面に関して、二大デルタ地域における農業生産力の長期的な持続的発展に向けて、作物選択や作付体系（計画）、農地基盤（土壌）及び水資源保全の観点から実態分析と改善方向を探る。,国際共同研究加速基金(国際共同研究強化(B)),中区分41:社会経済農学、農業工学およびその関連分野,ベトナム,メコンデルタ,農業構造,農業生産力,国際共同研究,農業構造変化,,,,,,,,,,,,,,,,,,,,,,,,,,,,,,,,,,,,,,,,,,,,,,,,,,
19KK0169,九州大学,田中 史彦,生物材料FINEST空間における形態・諸現象の観察と３次元シミュレーション解析,FINEST計画は、青果物やこれに由来する材料を対象に、最新のイメージングや画像分析・解析、モデル化技術を駆使することによって、これら材料のFINESTが、より大きなスケール場における力学特性や熱物性にどのような影響を与えるかを知るための新たなフレームワークを構築するものである。生物材料の微細構造とその機能・特性を関連付けるための、先駆的かつ理論的研究をともに推進する相互補完可能な国際共同研究チームを組み立て、特に、若手の研究者が受入機関で最新のイメージング技術を学び、本学で遂行中の機能モデル化技術と融合させることで、新たな研究領域を発展させるものである。,国際共同研究加速基金(国際共同研究強化(B)),中区分41:社会経済農学、農業工学およびその関連分野,農業工学,マルチスケール,イメージング,バイオマテリアル,シミュレーション,FINEST,ポストハーベスト工学,,,,,,,,,,,,,,,,,,,,,,,,,,,,,,,,,,,,,,,,,,,,,,,,,
19KK0168,鳥取大学,藤巻 晴行,土壌塩分輸送シミュレーションモデルを用いた除塩用水量の最適化,灌漑に伴う塩類集積に対し、FAO のガイドラインに代わる塩分管理法として、土壌中の塩分輸送シミュレーションモデルを用いて最適な除塩用水量を決定する手法を提示し、その予測精度と効果を圃場実験により検証する。また、もう一つの改善策として、土壌水分塩分センサーにより、収量に大きな影響の生じる限界塩濃度に達した時点で一定水量のリーチングを行う方法も提示し、その効果も検証する。FAOガイドラインに基づく対照区も含め4年連作で収量を測定し、従量制水費用を考慮した純収入を比較する。さらに、供試作物の塩ストレス応答関数もポット実験により測定し、新しい耐塩性リストを世界中の改良普及員や灌漑技術者に提供する。,国際共同研究加速基金(国際共同研究強化(B)),中区分41:社会経済農学、農業工学およびその関連分野,灌漑,塩ストレス,塩害,リーチング,塩類集積,除塩,,,,,,,,,,,,,,,,,,,,,,,,,,,,,,,,,,,,,,,,,,,,,,,,,,
19KK0167,京都大学,宇波 耕一,肥沃な三日月地帯の脆弱性を克服する雨水ハーベスティング,雨水ハーベスティングは，比較的小規模なスケールにおいて自然の降水を生物生産に変換する過程である。これまでの研究で，過酷な塩性乾燥環境下にあるヨルダン地溝帯に，砂漠の洪水を灌漑用水に変換する自律分散型灌漑スキームを構築した。また，冷涼なヨルダン高地，高温乾燥と寒冷湿潤の対極が著しいイラク北部でも，農業気象を自動観測している。本研究では，ヨルダン高地にマイクロ集水域での水分捕捉を行う実験圃場を新設しつつ，実験科学上の知見を数理科学の方法論にもとづいて記述，普遍化することにより，雨水ハーベスティングが，肥沃な三日月地帯全域における水と農業の脆弱性を克服するために有効であることを明らかにする。,国際共同研究加速基金(国際共同研究強化(B)),中区分41:社会経済農学、農業工学およびその関連分野,雨水ハーベスティング,肥沃な三日月地帯,脆弱性,ヨルダン,イラク,,,,,,,,,,,,,,,,,,,,,,,,,,,,,,,,,,,,,,,,,,,,,,,,,,,
19KK0166,東京大学,荒木 徹也,東南アジア諸国の食塩摂取量およびコールドチェーンが国民健康改善に及ぼす影響の評価,日本型コールドチェーン流通が東南アジア諸国で普及した場合に、コールドチェーンの導入が食生活の減塩効果や高血圧に代表される生活習慣病の予防といった健康改善効果をどの程度もたらす可能性があるのかを、人類生態学的手法により得られたデータに基づき定量的に評価する。具体的には、インドネシアで調査対象者の食塩摂取量を尿測定および食事調査を通して明らかにする。また、コールドチェーンの普及が消費パターンの変化に及ぼす影響を類型化した上で、食事調査を通して得られた個人の食塩摂取量および医療機関へのアクセスから健康の水準への定量的な効果推計をもとに、コールドチェーンの導入による生活習慣病の予防効果を評価する。,国際共同研究加速基金(国際共同研究強化(B)),中区分41:社会経済農学、農業工学およびその関連分野,国民健康・栄養調査,日本,インドネシア,米国,栄養調査,大学生,食塩摂取量,中国,ブータン,国民皆保険,青果物市場,廃棄物管理,野生果実,塩分量,タイ,Covid-19,薬用植物,東南アジア,コールドチェーン,国民健康改善,食事調査,生活習慣病,消費パターン,,,,,,,,,,,,,,,,,,,,,,,,,,,,,,,,,
19KK0165,東京大学,山路 永司,東南アジアの都市外縁における農地利用秩序形成に関する比較研究,国家の繁栄は都市の発展に牽引されることが多い。都市への人口集積・産業集積・知的集積が高度経済成長を起こし、それが地方に波及してゆく。都市内および都市外縁において農地は常に開発のターゲットであり、都市計画法・農振法によるゾーニング制度にもかかわらず、無秩序に転用されることが多かった。その結果、農地としても住宅地としても不適切な配置状態となった。これは各国に共通する課題であるが、とくに拡大を続けている開発途上国の都市外縁部において顕著である。この現象および対策はわが国が既に経験してきたことであり、その経験をもとに、各国での土地利用の実態および関連する法制度の調査・研究を行い、分析・提言を加える。,国際共同研究加速基金(国際共同研究強化(B)),中区分41:社会経済農学、農業工学およびその関連分野,土地利用秩序,都市農地,圃場整備,農地利用,マスタープラン,屋上緑化,市民農園,農村ツーリズム,都市農業,農的活動,国土利用計画,ストラクチャプラン,農家民泊,マレーシア,農地利用秩序,東南アジア,都市外縁,,,,,,,,,,,,,,,,,,,,,,,,,,,,,,,,,,,,,,,
20KK0150,国立研究開発法人国際農林水産業研究センター,鬼木 俊次,市場経済がモンゴル遊牧民の草原保全の規範意識に及ぼす影響に関する計量分析,途上国の遊牧地域では市場経済の進展とともに都市周辺に遊牧民が集まり、その地域では家畜の過放牧による草原の砂漠化が起こりつつある。本研究は、モンゴル生命科学大学を研究拠点として、市場経済が遊牧民のモラル意識に及ぼす影響やコミュニティーの草原保全的な社会規範に及ぼす影響を計量的に推定する。また分析結果を用いて、モラル意識の向上と社会規範形成のための介入の効果について検討する。本研究により、市場経済化の著しい途上国の農牧業開発において、モラルや規範への影響を考慮した援助プログラムの立案に資する知見が得られる。,国際共同研究加速基金(国際共同研究強化(B)),中区分41:社会経済農学、農業工学およびその関連分野,牧畜,規範,行動経済学,文化人類学,社会心理学,乾燥地,道徳,草地,社会規範,計量経済モデル,倫理,牧畜民,開発経済学,計量経済学,心理学,,,,,,,,,,,,,,,,,,,,,,,,,,,,,,,,,,,,,,,,,
20KK0149,愛知大学,小崎 隆,不耕起農法はアジアにおいても土壌炭素貯留機能を高めるのか？,気候変動に適応し、土壌の炭素貯留機能を高める農法として、不耕起栽培が乾燥地を中心に普及しているが、湿潤アジア地域の火山灰土壌、水田土壌における効果は未解明である。その理由は、当該地域における気候や栽培作物、土壌タイプが特異的であること、ならびに土壌への長期的な炭素貯留効果を予測する土壌炭素動態モデルが転耕や埋没、湛水などのかく乱を伴う土壌には対応できていないことによる。,国際共同研究加速基金(国際共同研究強化(B)),中区分41:社会経済農学、農業工学およびその関連分野,土壌炭素貯留,不耕起農法,湿潤アジア,火山灰土壌,水田土壌,,,,,,,,,,,,,,,,,,,,,,,,,,,,,,,,,,,,,,,,,,,,,,,,,,,
20KK0148,九州大学,安武 大輔,Liquid Air Coolingを核とした国際共創による複合環境調節の躍進,施設農業の生産性の制限要因群を解消するため，次世代の冷熱エネルギーLiquid Air Coolingを核とした複合環境調節に関する以下3目標に取り組む：,国際共同研究加速基金(国際共同研究強化(B)),中区分41:社会経済農学、農業工学およびその関連分野,Liquid Air,局所冷却,複合環境調節,ヒートポンプ冷房,温室,CO2施用,超節水,施設農業,高温ストレス回避,CO2漏出抑制,水蒸気回収,,,,,,,,,,,,,,,,,,,,,,,,,,,,,,,,,,,,,,,,,,,,,
20KK0147,岡山大学,前田 守弘,ベトナム在来知の科学的評価に基づく高機能・低環境負荷バイオマス活用堆肥の新提案,ベトナムでは家畜ふんの堆肥化に嫌気発酵が用いられており，日本の好気性堆肥と性質が全く異なる．これには窒素成分の確保等の在来知が働いたと思われるが，残留病原菌，作物生育，環境負荷等に関する研究はみあたらない．現地では家畜飼養頭数が増大するとともに，廃棄物系バイオマスが多量に発生しており，堆肥化方式を現在の視点で見直す必要がある．本研究の目的は，嫌気性堆肥と好気性堆肥の機能性および環境負荷を比較することで，嫌気性堆肥の利点と欠点を明らかにし，両堆肥の特性を活かしたバイオマス活用堆肥を提案することである．日越研究者が，在来知を最新技術で多面的に評価し，堆肥の高付加価値化を目指す．,国際共同研究加速基金(国際共同研究強化(B)),中区分41:社会経済農学、農業工学およびその関連分野,嫌気性堆肥,窒素循環,温室効果ガス,微生物群集,衛生細菌,嫌気発酵堆肥,拮抗作用,,,,,,,,,,,,,,,,,,,,,,,,,,,,,,,,,,,,,,,,,,,,,,,,,
20KK0146,山梨大学,片岡 良太,塩生植物-微生物共生系を用いた高機能なファイトレメディエーションの創出,土壌の塩類化が急速に拡大しているトルコ共和国において、塩生植物に内生する微生物の植物生長・吸塩促進効果を明らかにし、ファイトレメディエーションが抱える問題点を全て克服した、これまでにない新たなファイトレメディエーション技術の構築を目的としている。目的を達成するために、トルコで食用として利用できるMesembryanthemum edule （塩生植物）のマイクロバイオームと内生微生物の高塩環境適応戦略を解明し、植物－微生物複合系を利用した新たな浄化技術を創出する。また、塩浄化能を様々な環境下でシミュレーションし、ファイトレメディエーション適応可能範囲を明らかにする。,国際共同研究加速基金(国際共同研究強化(B)),中区分41:社会経済農学、農業工学およびその関連分野,塩類集積土壌,Mesembryanthemum属,植物内生細菌,植物成長促進効果,ファイトレメディエーション,Brevundimonas diminuta,植物生育促進細菌,M. chilensis,Mesembryanthemum edule,吸塩性,耐塩性,植物生育促進微生物,内生細菌,塩生植物,Mesembryanthemum spp.,内生微生物,耐塩性微生物,,,,,,,,,,,,,,,,,,,,,,,,,,,,,,,,,,,,,,,
20KK0145,筑波大学,佐藤 政良,ベトナムにおける農民参加型水管理システムの基本デザインの研究,ベトナム農業が社会主義的集団農場制から市場経済へ転換したことで、灌漑用水の管理体制も、農民を基礎とする参加型制度への転換が求められている。本研究は、日本のムラを基礎にする伝統的参加型灌漑管理の経験を、類似の農村構造をもつベトナムに導入しようとする。その際、ベトナム農村における近年の急速な工業化と農業労働力不足という環境条件も考慮し、担い手農業の進展への対応という日本の経験も動員しながら、ベトナムの参加型灌漑管理分野の研究者と共同で、今後あるべき灌漑管理体制の基本デザインの構築を目ざす。,国際共同研究加速基金(国際共同研究強化(B)),中区分41:社会経済農学、農業工学およびその関連分野,灌漑管理,ベトナム,農民参加,参加型調整,都市化,土地利用,圃場整備,日本の農業構造変化,国家目標,参加型灌漑管理,水管理組織,国と農民の役割分担,集落機能,,,,,,,,,,,,,,,,,,,,,,,,,,,,,,,,,,,,,,,,,,,
21KK0119,京都大学,三谷 羊平,零細漁村の貧困削減と持続的資源管理手法の開発：タイを事例としたフィールド実験研究,開発途上国における地域生態系の保全と地域住民の経済発展の両立は、人類社会の持続可能な発展の実現に不可欠な重要課題である。本研究では、タイの海洋生態系の保全と現地零細漁民の貧困削減の両立を事例として、日本とタイの経済学者と環境学者が、国際的かつ学際的な共同研究を実施することで、途上国における持続可能な水産資源管理手法の開発と実践を試みる。本研究は「クラブバンク」という参加型資源管理手法に着目し、その導入と制度設計が、タイ沿岸地域の零細漁村における水産資源保全と経済発展に与える効果を、フィールド実験を用いて明らかにする。,国際共同研究加速基金(国際共同研究強化(B)),中区分41:社会経済農学、農業工学およびその関連分野,持続的資源管理,貧困削減,零細漁民,クラブバンク,フィールド実験,共有資源,開発経済学,環境ガバナンス,,,,,,,,,,,,,,,,,,,,,,,,,,,,,,,,,,,,,,,,,,,,,,,,
21KK0118,新潟大学,鈴木 哲也,地震頻発国の相互協力によるパイプラインの非破壊損傷度評価法の開発,農業用水に代表される水インフラは人類の生存に不可欠な社会基盤である。COVID-19が世界的に流行する今日において，地震災害が発生した場合，水インフラの被災に伴う生産・生活環境の更なる劣化は避けることができない。本研究では，農業用パイプラインを対象に地震被害最小化に向けた非破壊損傷度評価法の構築を目的とする。その際，開発手法は，構造が類似する上下水道施設への応用を試みる。研究期間は2021年度から4ヶ年である。国際共同研究では，代表的な地震頻発国である日本とトルコ共和国の研究機関に在籍する農業農村工学と土木工学を専門とする研究者により，農学と工学の枠を超えた分野横断型国際共同研究を推進する。,国際共同研究加速基金(国際共同研究強化(B)),中区分41:社会経済農学、農業工学およびその関連分野,構造材料,パイプライン,非破壊検査,シミュレーション,モニタリング,機械学習,,,,,,,,,,,,,,,,,,,,,,,,,,,,,,,,,,,,,,,,,,,,,,,,,,
21KK0117,東京農工大学,橋本 洋平,台湾の大規模水田汚染地帯における重金属の溶出機構の解明とコメを介した摂取量の推計,台湾北部の関渡平野の水田地帯では、重金属濃度の高い場所が点在している。ヒトへの健康リスクの低減には、コメへのヒ素や重金属の移行を抑制するための抜本的な汚染対策が必要とされている。台湾大学との共同研究を通じ、現地観測を継続することによって大規模汚染水田の地域実態を把握し、ヒ素を中心とする重金属類の溶出に関与する汚染発生の機構を解明する。年間を通じた重金属類の溶出の変動と、イネへの移行が多い地域と時期を明らかにし、ならびにコメを介した重金属摂取量の推算値を提示する。,国際共同研究加速基金(国際共同研究強化(B)),中区分41:社会経済農学、農業工学およびその関連分野,重金属類,水田,土壌汚染,重金属,,,,,,,,,,,,,,,,,,,,,,,,,,,,,,,,,,,,,,,,,,,,,,,,,,,,
