awardnumber,organization,name,title,abstract,section,review_section,keyword1,keyword2,keyword3,keyword4,keyword5,keyword6,keyword7,keyword8,keyword9,keyword10,keyword11,keyword12,keyword13,keyword14,keyword15,keyword16,keyword17,keyword18,keyword19,keyword20,keyword21,keyword22,keyword23,keyword24,keyword25,keyword26,keyword27,keyword28,keyword29,keyword30,keyword31,keyword32,keyword33,keyword34,keyword35,keyword36,keyword37,keyword38,keyword39,keyword40,keyword41,keyword42,keyword43,keyword44,keyword45,keyword46,keyword47,keyword48,keyword49,keyword50,keyword51,keyword52,keyword53,keyword54,keyword55,keyword56
21KK0116,筑波大学,中野 優子,肥料の小分け販売が少量施肥技術の採用と稲作生産性に与える影響：マダガスカルの事例,化学肥料の投入量が少ないことが、アフリカの作物生産の大きな阻害要因となっている。少量のリン肥料を加えた泥にイネの苗を浸してから移植するリン浸漬処理（P-dipping）は肥料購買力の限られた小規模農家でも実践できることから、イネ収量改善の打開策として有望視されている。しかし、アフリカでは肥料市場が未発達であり、特に肥料を少量のみ購入できないことが、同技術の普及の制約になる可能性がある。そこで本研究では、マダガスカルにおいてP-dippingの技術研修と肥料の小売り販売実験を行い、これらの介入が農家の技術採用と水稲生産性に及ぼす影響を明らかにする。,国際共同研究加速基金(国際共同研究強化(B)),中区分41:社会経済農学、農業工学およびその関連分野,少量施肥技術,農業生産性,アフリカ,マダガスカル,稲作生産性,ランダム化比較実験,リン浸漬処理技術,農業,農業開発,肥料市場拡大,,,,,,,,,,,,,,,,,,,,,,,,,,,,,,,,,,,,,,,,,,,,,,
22KK0093,岡山大学,宗村 広昭,保護林コーヒー栽培による流域内炭素流亡量の評価と流域保全シナリオの提案,社会林業政策による熱帯保護林内の開発・プランテーション化が流域内の炭素流亡量に与える影響については研究例が少ない．この政策は地元農民の生活基盤の安定化と環境保全との両立を目標に東南アジアで拡大している．しかし実際は保護林内での不適切な営農が圃場斜面からの土壌流亡を加速させ炭素の域内貯留能を低下させることで，水環境悪化やCO2放出を引き起こし生態系に負の影響を与えている．本研究は現地観測によってその実態を解明すると共に，現地農民の斜面保全対策評価と未利用農業廃棄物の活用を通した保全対策の提案を行う．そして環境保全性と経済性効果の可視化から経済と環境との調和に向けた行動シナリオを作成・提案する．,国際共同研究加速基金(国際共同研究強化(B)),中区分41:社会経済農学、農業工学およびその関連分野,保護林,炭素流亡,コーヒー栽培,バイオ炭,炭素流出,社会林業政策,流域水環境,,,,,,,,,,,,,,,,,,,,,,,,,,,,,,,,,,,,,,,,,,,,,,,,,
22KK0092,神戸大学,高田 晋史,伝統的農業システムの動的保全に向けた進化メカニズムに関する日中比較分析,世界農業遺産地域などに現存する伝統的農業システムは、新たな技術を取り入れながら未来に継承する動的保全の考え方に基づいた保全が求められている。しかし、伝統的農業システムにおける過去から現在にかけての変遷メカニズムは解明されておらず、この視点は動的保全においても重要である。,国際共同研究加速基金(国際共同研究強化(B)),中区分41:社会経済農学、農業工学およびその関連分野,GIAHS,世界農業遺産,伝統的農業システム,伝統文化,動的保全,農泊,在来品種,伝統農法,GIASH,中国重要農業文化遺産,進化メカニズム,,,,,,,,,,,,,,,,,,,,,,,,,,,,,,,,,,,,,,,,,,,,,
22KK0091,京都大学,藤原 正幸,2050年に向けた世界最大紅茶産地インド・アッサム州の持続的な水環境管理の提案,インド・アッサム州は，世界最大の紅茶生産地となっている．インドの茶園では灌漑が導入されてきたが，水源の大部分が地下水に依存することから持続可能ではない．また，気候変動の見通しによると2050年には乾季が長期化すると予測されているため，十分な灌漑水確保，効率的な灌漑手法など，水資源・水環境管理手法の確立は焦眉の課題である．本研究ではアッサム州の茶園を対象として，水と栄養塩の循環・気候変動の影響を明らかにすることにより，茶の品質向上も目指した最適な灌漑を明らかにして，多様な水源を活用する“水ハーベストシステム”の最適な導入と運用計画を提示することで，持続可能な灌漑・水環境管理手法を提案する．,国際共同研究加速基金(国際共同研究強化(B)),中区分41:社会経済農学、農業工学およびその関連分野,茶樹,灌漑,インド・アッサム,気候変動,水質,茶,水環境,,,,,,,,,,,,,,,,,,,,,,,,,,,,,,,,,,,,,,,,,,,,,,,,,
22KK0090,京都大学,本田 与一,東アジア域における食用担子菌栽培が引き起こす遺伝子汚染の拡大と対応技術の確立,東アジアにおける代表的な栽培きのこであるシイタケとキクラゲをモデルとし、農業活動による遺伝子汚染の実態について調査することで、越境汚染や各々の国・地域に固有の遺伝的多様性の残存具合を明確にし、遺伝資源の保護立案に役立てることが可能となる。また、農業による遺伝子汚染の侵攻をくい止めるため、異型担子菌類に属するキクラゲを材料として、形質転換系の開発、ゲノム編集系の導入を行い、最終的に胞子を作らない栽培株の育種を目指す。,国際共同研究加速基金(国際共同研究強化(B)),中区分41:社会経済農学、農業工学およびその関連分野,きのこ,食用担子菌,胞子,遺伝子汚染,ゲノム編集,胞子形成,,,,,,,,,,,,,,,,,,,,,,,,,,,,,,,,,,,,,,,,,,,,,,,,,,
22KK0089,千葉大学,本郷 千春,洪水氾濫情報を用いた東南アジア穀倉地にみられる病虫害拡散メカニズムの解明,洪水常襲地域の稲作において、洪水被害発生後の迅速な対応は極めて重要である。インドネシアは豪雨頻度が高いことに加えて、穀倉地帯では河川堤防が十分に整備されていないことから、洪水氾濫による病虫害の拡散による水稲の減収回避の観点から早期防除の徹底が重要である。そこで本研究では、インドネシアの穀倉域であるチタルム川流域において、空間情報とモデルを駆使して、洪水氾濫に伴う物質輸送と病虫害の関係解明、洪水と病虫害の発生状況についての2次元分布のモニタリング、検出した洪水と病虫害の2次元分布から病虫害の拡散メカニズムを解明に取り組む。,国際共同研究加速基金(国際共同研究強化(B)),中区分41:社会経済農学、農業工学およびその関連分野,氾濫シミュレーション,水稲病害,UAVデータ,衛星データ,浸水域,越水地点,洪水氾濫,水稲病虫害,拡散メカニズム,リモートセンシング,,,,,,,,,,,,,,,,,,,,,,,,,,,,,,,,,,,,,,,,,,,,,,
