awardnumber,organization,name,title,abstract,section,review_section,keyword1,keyword2,keyword3,keyword4,keyword5,keyword6,keyword7,keyword8,keyword9,keyword10,keyword11,keyword12,keyword13,keyword14,keyword15,keyword16,keyword17,keyword18,keyword19,keyword20,keyword21,keyword22,keyword23,keyword24,keyword25,keyword26,keyword27,keyword28,keyword29,keyword30,keyword31,keyword32,keyword33,keyword34,keyword35,keyword36,keyword37,keyword38,keyword39,keyword40,keyword41,keyword42,keyword43,keyword44,keyword45,keyword46,keyword47,keyword48,keyword49,keyword50,keyword51,keyword52,keyword53,keyword54,keyword55,keyword56
21K04774,福島県立医科大学,田邊 真,三元素ハイブリッド機能触媒を基盤とした高効率酸化変換の開発,本研究では，酸化還元活性を示す「銅」，C-H結合活性化に優位な「貴金属」，低原子価の化学種が安定な「典型金属」で構成される三元素「ハイブリッド触媒」を用いて，分子状酸素で酸化反応を達成するグリーンケミストリーを指向した酸化変換触媒の開発を目的とする．ハイブリッド触媒を構成する「原子組成比」に応じて，幾何構造および電子状態が顕著に異なるため，触媒機能が顕著に変動するだけでなく，特定の組成比をもつハイブリッド触媒は飛躍的に触媒活性が向上する「黄金原子比」の存在も充分に期待される．,基盤研究(C),小区分27030:触媒プロセスおよび資源化学プロセス関連,ナノ粒子,還元反応,合金,デンドリマー,銅,ハイブリッド触媒,酸化反応,酸化変換,,,,,,,,,,,,,,,,,,,,,,,,,,,,,,,,,,,,,,,,,,,,,,,,
21K04773,千葉大学,山田 泰弘,活性点が構造制御されたナノ炭素材料の合成法と解析法の確立,グラフェンなどの炭素材料の性能を飛躍的に向上するためには、炭素材料中に存在するエッジやヘテロ元素、5員環等の種々の欠陥の内、高活性を示す欠陥を選択的に導入する必要がある。本研究では、活性点を選択的に導入したナノ炭素材料を合成し、さらに類を見ない高精度構造解析法を確立する。活性点を選択的に導入した炭素材料の合成においては、原料の反応性を生かし、原料を減圧下で加熱するシンプルな方法で、高活性が期待できる1種類の欠陥を選択的に導入したナノ炭素材料を数多く合成する。,基盤研究(C),小区分27030:触媒プロセスおよび資源化学プロセス関連,炭素材料,構造制御,含窒素官能基,5-7員環,5員環,第3級窒素,ピローリック窒素,ピリジニック窒素,Pyrrolic窒素,スクリーニング,反応分子動力学計算,XPS,グラフェン,構造解析,ピロール窒素,活性点,窒素,,,,,,,,,,,,,,,,,,,,,,,,,,,,,,,,,,,,,,,
22K04834,名城大学,才田 隆広,単分子層モデル電極を用いた酸素還元反応に対する活性サイトおよび活性支配因子の特定,固体高分子形燃料電池における非白金系酸化物触媒は，安価かつ高耐久性を有することが期待されるため次々世代の電極触媒として注目されている．しかし，遷移金属酸化物上での酸素還元反応に対する活性サイトや活性支配因子は，未だ特定されていない．そこで本研究では，高活性な非白金系酸化物触媒に対する触媒設計指針を得ることを目標として，遷移金属酸化物上における活性サイトと活性支配因子の特定を行う．,基盤研究(C),小区分27030:触媒プロセスおよび資源化学プロセス関連,燃料電池用非白金系触媒,酸化チタン,酸素還元反応,Nbドープ,非白金触媒,燃料電池,モデル触媒,,,,,,,,,,,,,,,,,,,,,,,,,,,,,,,,,,,,,,,,,,,,,,,,,
22K04833,工学院大学,奥村 和,自己分散を利用した担持金属触媒の再生技術の確立,均一な粒子径分布を有するポリマー保護金属ナノ粒子をゼオライトおよび酸化物担体に担持し，酸素中で熱処理することで生成する酸化物が分散する過程を追跡し，金属酸化物が分散する過程を時間分解XAFS-XRDを使った速度論に基づいて解析する．また計算科学を併用して分散メカニズムを解明し，Pd/ゼオライトについてはクロロベンゼン誘導体を基質とした鈴木カップリング反応，およびメタンを還元剤としたNOx還元反応を実施しシンタリングおよび溶媒への溶出・再析出によって凝集した触媒を熱処理によって再生できることを実証する．,基盤研究(C),小区分27030:触媒プロセスおよび資源化学プロセス関連,ルテニウム,白金,酸化ジルコニウム,酸化セリウム,ベンズアルデヒド,ヒドロシリル化反応,固溶体,酸化マグネシウム,貴金属,担持金属触媒,XAFS,,,,,,,,,,,,,,,,,,,,,,,,,,,,,,,,,,,,,,,,,,,,,
22K04832,北九州市立大学,今井 裕之,ゼオライト酸点と金属の相互作用による微粒子金属複合体の創製,本研究では、ゼオライトが持つ酸性質と金属との相互作用を利用して金属複合体を形成し、酸性質が金属に及ぼす効果や複合により発現する触媒機能の解明を目指す。特に、ゼオライト中に高分散した金属種に由来する特性に着目し、様々な構造や複数の金属を導入したゼオライトを開発して酸性質を制御することで、様々な性質を持つ金属複合体を合成する。そして、複数の機能が必要となるアルカンから芳香族化合物の合成において触媒性能を解明することで、酸性質に基づいて物性・触媒機能を制御した新たな金属材料の開発へと繋げる。,基盤研究(C),小区分27030:触媒プロセスおよび資源化学プロセス関連,ゼオライト,脱水素,脱水素環化,アルカン,金属複合体,遷移金属元素,貴金属,ルイス酸,,,,,,,,,,,,,,,,,,,,,,,,,,,,,,,,,,,,,,,,,,,,,,,,
22K04831,愛媛大学,八尋 秀典,複合金属酸化物触媒の活性向上を目指すシアノ錯体分解法を活用した微量成分添加の検討,本研究ではペロブスカイト型金属酸化物に結晶性多核金属シアノ錯体熱分解法の特徴を活かした第３の成分添加を試み，新規機能を有する修飾ペロブスカイト型複合金属酸化物触媒の設計指針を得ることを目的とする．具体的には，①ペロブスカイト型複合金属酸化物の３価サイトの他価イオンの部分置換による添加（バルク添加）方法の検討，②ペロブスカイト型複合金属酸化物への金属担持（表面添加）法の検討，③上記①，②で調製された触媒の環境触媒への応用について検討する．,基盤研究(C),小区分27030:触媒プロセスおよび資源化学プロセス関連,シアノ錯体,ペロブスカイト型酸化物,環境触媒,セリウムイオン,鉄イオン,コバルトイオン,第３成分,,,,,,,,,,,,,,,,,,,,,,,,,,,,,,,,,,,,,,,,,,,,,,,,,
22K04830,愛媛大学,佐藤 文哉,水溶液流通系での律速段階の原因を解明する：ペンタン酸へのレブリン酸気相一段階変換,トウモロコシの軸、草本など非可食バイオマス由来のセルロースを加水分解することで合成できるレブリン酸を固体触媒により化成品、燃料などの原料となるペンタン酸に変換するルートについて、触媒開発につなげるため次の実験を行う。,基盤研究(C),小区分27030:触媒プロセスおよび資源化学プロセス関連,触媒の長寿命化,非晶質シリカ,レブリン酸,細孔サイズ制御,反応ルートの解明,バイオマス由来化合物の変換,二元機能触媒,高圧流通反応,反応機構の解明,バイオマス変換,,,,,,,,,,,,,,,,,,,,,,,,,,,,,,,,,,,,,,,,,,,,,,
22K04829,広島大学,後藤 健彦,ヘテロポリ酸を内部に固定化した機能性高分子ゲルの開発,本研究では、ヘテロポリ酸を高分子ゲルに水素結合を利用して固定化した新たな固体酸触媒の固定機構の解明と性能向上方法について検討する。これまでに、ヘテロポリ酸のプロトンと相互作用できるエーテル系高分子を用いることで、水中で安定に使えるヘテロポリ酸/高分子ゲル酸性複合体不均一酸触媒の調製に成功した。この成果を発展させ、高分子ゲルの官能基を変えることで親・疎水性、膨潤特性およびヘテロポリ酸の含有率、ヘテロポリ酸の種類を変えることで酸点量や酸触媒活性を変化させた様々な種類のヘテロポリ酸/高分子ゲル複合材料を創成する。加えて安定な複合体形成を担うヘテロポリ酸とエーテルとの詳細な相互作用の解明に取り組む。,基盤研究(C),小区分27030:触媒プロセスおよび資源化学プロセス関連,高分子ゲル,ヘテロポリ酸,不均一系触媒,不均一触媒,固体酸触媒,水素結合,固定化,,,,,,,,,,,,,,,,,,,,,,,,,,,,,,,,,,,,,,,,,,,,,,,,,
22K04828,岡山大学,亀島 欣一,原油からの直接分離に対応した新規多孔体材料の創製,本研究では，多孔性を制御したZSM-5型ゼオライトで構成される多孔体を作製し，原油の膜・多孔体分離を目的とする．申請者が見出したマクロ多孔体による分離現象を適用し，模擬原油中の重質部が積極的に排出され，軽質部が分離される．造孔材を用いた直管型の細孔をもつ多孔体を作製する．模擬原油を用いた分離性能を所定の温度条件で行う．多孔性と分離の関係，分離に対する組成の影響，およびゼオライトの分解触媒性能の影響を詳細に調査し，重質部と軽質部の分離性能が高い多孔体を開発する．最終的に得られる原油分離技術は，低環境負荷の新しい分離精製技術に向けたコア技術であり，二酸化炭素排出量の削減に大きく貢献できる．,基盤研究(C),小区分27030:触媒プロセスおよび資源化学プロセス関連,ゼオライト多孔体,原油分離,分解触媒,模擬原油,,,,,,,,,,,,,,,,,,,,,,,,,,,,,,,,,,,,,,,,,,,,,,,,,,,,
22K04827,神戸大学,市橋 祐一,新規可視光応答型有機半導体光触媒の開発とその抗菌・抗ウィルス活性評価,本提案では、可視光応答型有機半導体を光触媒として新規に合成し、それら光触媒による可視光照射下での水と酸素による過酸化水素生成反応活性について評価し、さらにその抗菌・抗ウィルス性能についても検討を行う。これら有機半導体光触媒の開発には量子化学シミュレーションを用い、得られた結果から最適な有機半導体光触媒を合成し、その有効性を検証する。,基盤研究(C),小区分27030:触媒プロセスおよび資源化学プロセス関連,光触媒,有機半導体,過酸化水素生成,抗菌作用,抗ウィルス作用,可視光応答性,有機半導体光触媒,過酸化水素生成反応,量子化学シミュレーション,,,,,,,,,,,,,,,,,,,,,,,,,,,,,,,,,,,,,,,,,,,,,,,
22K04826,岐阜大学,小村 賢一,リン酸アルミニウムの水熱転換による多孔質結晶の創製とその触媒機能,本研究では、「アルミノリン酸塩系ゼオライト水熱転換法」（izcMAP法）による新規多孔質結晶の更なる探索、およびそれらの材料としての機能をゼオライトで最も期待される触媒反応を通して示し、本合成手法のステイタス確立を試みる。また原料とするゼオライトの三次元的な骨格分子構造を正確に捉えることで、これまでの結果から見出した仮説をもとに我々が開発した新規ゼオライト（GAM-3）に固体酸性を付与させ、その固体酸および触媒としての機能を検討する。,基盤研究(C),小区分27030:触媒プロセスおよび資源化学プロセス関連,ゼオライト,水熱転換法,リン酸アルミニウム,水熱転換,構造解析,触媒反応,,,,,,,,,,,,,,,,,,,,,,,,,,,,,,,,,,,,,,,,,,,,,,,,,,
22K04825,横浜国立大学,窪田 好浩,新規ゼオライトの特異な細孔構造を活かした高性能触媒の創製,新規ゼオライトYNU-5を軸として，骨格アルミニウム（Al）をチタン（Ti）に変換することによる新規なチタノシリケート触媒を開発し，特徴のある部分酸化触媒性能を発現させる。MCM-68および類縁体YNU-2ですでに得られている知見を活かし，YNU-5に適切なポスト処理を施すことで，完全に新規なチタノシリケート系触媒材料であるTi-YNU-5を調製する。その過程で，触媒活性点の分布を各種分光学的手法により緻密に調べ，計算機化学を併用して骨格内での活性点分布の違いによるエネルギー差を検討する。これらの要素を統合することで，活性点分布と触媒性能の相関を明らかにし，高選択的な新規固体触媒を創製する。,基盤研究(C),小区分27030:触媒プロセスおよび資源化学プロセス関連,チタノシリケート,アルミノシリケート,触媒,フェノール酸化,ヒドロキノン,形状選択性,YNU-5,カテコール,新規ゼオライト,細孔構造,,,,,,,,,,,,,,,,,,,,,,,,,,,,,,,,,,,,,,,,,,,,,,
22K04824,奈良先端科学技術大学院大学,高山 大鑑,Ni系金属間化合物触媒の新規合成法の開発とその触媒特性の解明,本研究では、Ni系金属間化合物触媒の新規な合成法として、溶融亜鉛合金中におけるNi系金属間化合物の合成法を確立する。本手法は、金属原料の高温での融解を経るアーク熔解法や発火の危険を伴う溶融金属ナトリウム法などの従来法とは全く異なる原理に基づく新規なNi系金属間化合物の合成法である。そして、その合成経路の設計には、第一原理計算（密度汎関数法；DFT）による生成エンタルピーの算出が鍵を握る。本研究によって、DFT計算による材料設計分野の裾野の拡大、冶金学および触媒学の深化がもたらされる。,基盤研究(C),小区分27030:触媒プロセスおよび資源化学プロセス関連,金属間化合物,溶融固溶体合金,低温合成,金属フラックス,合金触媒,触媒,合成法,溶融金属,,,,,,,,,,,,,,,,,,,,,,,,,,,,,,,,,,,,,,,,,,,,,,,,
22K04823,東京工業大学,原田 琢也,溶融イオン循環型カーボンフリー水素合成法の開発,本研究では，天然ガスから水素を合成するメタン水蒸気改質法において，その反応副生成物であるCO2を改質器から直接そして連続的に分離回収することを特徴とする新しい溶融イオン循環型カーボンフリー水素合成プロセスの開発を行う。特に，高温で流動性を有する新しい溶融イオン系CO2吸収剤を用い，それをメタン改質触媒粒子が充填された改質反応器内を液体循環させることにより，メタン改質反応系からのCO2の直接除去を行う。このCO2除去にともなう化学平衡シフト効果により，水素生成効率の向上，プロセス工程数の削減，そしてCO2排出レス化を実現し、社会実装化へ向けたスケールアップと反応性向上へのの技術課題を整理する。,基盤研究(C),小区分27030:触媒プロセスおよび資源化学プロセス関連,カーボンフリー水素合成,ブルー水素,CO2分離回収,メタン水蒸気改質,水素合成,カーボンフリー,CO2吸収剤,溶融イオン,固液セパレーター,多孔質ナノポーラス,,,,,,,,,,,,,,,,,,,,,,,,,,,,,,,,,,,,,,,,,,,,,,
22K04822,千葉大学,一國 伸之,複合構造化による卑金属酸化物ナノクラスターの機能拡張,高効率な触媒の開発により物質変換プロセスにおけるSDGs達成の一翼を担う。中でも，資源制約のある貴金属元素から脱却し，マンガン，鉄などの卑金属元素種による高活性な触媒開発を目指す。これらの化学種をナノメートルサイズに作りあげるだけでなく，副元素の精緻な導入および担体と一体化した構造を組み入れた，新規卑金属元素ナノクラスターとすることで貴金属を凌駕する触媒作用の創出を図る。,基盤研究(C),小区分27030:触媒プロセスおよび資源化学プロセス関連,酸化物ナノクラスター,触媒,XAFS,コバルト酸化物,銅酸化物,アルコール酸化反応,ニッケル酸化物,マンガン添加,ナノクラスター,,,,,,,,,,,,,,,,,,,,,,,,,,,,,,,,,,,,,,,,,,,,,,,
22K04821,北海道大学,Shrotri Abhijit,,Direct hydrogenation of carbon dioxide to methanol is highly attractive to reduce the use of fossil derived fuels and chemicals. However selective synthesis of　methanol is challenging due to simultaneous formation of carbon monoxide. This study aims to develop multi component mixed oxide catalysts for methanol synthesis. Catalysts with oxygen vacancies will be synthesized by doping metals into metal oxide supports. Surface properties of mixed oxide will be tuned to favor the methanol formation.,基盤研究(C),小区分27030:触媒プロセスおよび資源化学プロセス関連,Carbon Dioxde,Hydrogenation,methanol,Carbon dioxide,hydrogenation,mixed oxide catalyst,CO2 hydrogenation,Methanol,Oxide catalyst,,,,,,,,,,,,,,,,,,,,,,,,,,,,,,,,,,,,,,,,,,,,,,,
23K04501,防衛大学校(総合教育学群、人文社会科学群、応用科学群、電気情報学群及びシステム工学群),田邉 豊和,可視光応答性酸化物ナノシートによる太陽光水分解,光触媒を用いた太陽光水分解による水素製造は，エネルギー問題を解決する太陽エネルギー変換技術の代表例である．近年，原子層レベルのナノシート光触媒が注目される中で，本研究では，Sn3O4ナノシートを基本構造とした新規可視光応答性ナノシートの創出を目的とした．一部のSnサイトを他の金属元素と置換することで，高効率での太陽光水分解が期待できる．さらに，酸化物の利点である組成や結晶構造の自由度を生かしたバンド構造制御を行うことで，ドーピングによるバンド制御に頼らない，新しい可視光応答性ナノシートに発展できると着想した．,基盤研究(C),小区分27030:触媒プロセスおよび資源化学プロセス関連,半導体型光触媒,水分解,可視光応答性酸化物,ナノシート,,,,,,,,,,,,,,,,,,,,,,,,,,,,,,,,,,,,,,,,,,,,,,,,,,,,
23K04500,山梨大学,小俣 香織,直方晶・三方晶W系複合酸化物触媒で実現するバイオマス由来アクリル酸の高効率合成,バイオディーゼル燃料の連産品であるグリセロールから、超吸水性ポリマー等の原料となるアクリル酸を、ワンステップで高効率に合成可能な新規結晶性W-V-Nb系複合酸化物触媒を開発することが本研究の目的である。目的を達成するために「①結晶性W-V-Nb-Oの合成方法を確立」し、結晶構造が「②アクロレインをアクリル酸に転化するための酸化機能」および「③グリセロールをアクロレインに転化するための酸機能」に及ぼす影響を解明する。さらに「④触媒上で酸機能と酸化機能とが調和する最適反応条件」を明らかにする。得られた知見に基づき、結晶性W-V-Nb-O触媒による高効率アクリル酸ワンステップ合成技術を確立する。,基盤研究(C),小区分27030:触媒プロセスおよび資源化学プロセス関連,アクリル酸,グリセロール,アクロレイン,バイオマス,固体酸,ニオブ,バナジウム,タングステン,,,,,,,,,,,,,,,,,,,,,,,,,,,,,,,,,,,,,,,,,,,,,,,,
23K04499,山陽小野田市立山口東京理科大学,池上 啓太,塩基性金属酸化物からの可逆的金属微粒子析出を利用した新規CO2水素化触媒の創製,地球温暖化抑制のため、多様なCO2排出源に対応したCO2回収・有効利用技術の開発が求められている。これに対して申請者はK-Al-Fe系酸化物が低温領域(200～400 ℃)でのCO2吸着剤として優れた機能を示すことを見い出してきた。本研究では、有効利用技術(再資源化技術)へと発展させるため、この吸着剤に触媒活性点を構築して、回収したCO2を低温で変換することのできる複合型触媒の創製を目指す。,基盤研究(C),小区分27030:触媒プロセスおよび資源化学プロセス関連,二酸化炭素,水素化,金属酸化物触媒,塩基性酸化物,吸着剤,触媒,,,,,,,,,,,,,,,,,,,,,,,,,,,,,,,,,,,,,,,,,,,,,,,,,,
23K04498,横浜国立大学,高垣 敦,メタンの低温活性化と窒素酸化物の同時資源化,炭素および窒素の資源循環は今世紀の人類がなすべき課題であり、触媒がその解決に大きく貢献できる。メタン(CH4)の低温活性化は学術的にも重要であり、また窒素酸化物(NOx)からアンモニア(NH3)への変換も注目されている。本研究では不均一系触媒を用いたCH4とNOxの低温同時有用化を目指す。250℃程度の低温で、CH4とNOxから化学的に有用なシアン化水素(HCN)やNH3を、その目的に応じて連続的かつ高選択的に得られる触媒および反応系の開発を行う。,基盤研究(C),小区分27030:触媒プロセスおよび資源化学プロセス関連,メタン,,,,,,,,,,,,,,,,,,,,,,,,,,,,,,,,,,,,,,,,,,,,,,,,,,,,,,,
23K04497,高知大学,今村 和也,バイオマスを高選択的にギ酸へと変換するシステム構築に向けた新規光触媒の開発,持続可能な社会を実現する上で，動植物由来の化合物（バイオマス）を活用したギ酸を製造する技術の開発が必要とされている。ギ酸は用途の多い基幹物質であり，石炭や天然ガスなどの化石資源から合成される。これに対し，近年，バイオマス資源としてのグルコー スの利用が注目されており，グルコースをギ酸へ変換できる触媒が精力的に研究されている。 本研究では，酸化セリウムがギ酸を生成するメカニズムを解明し，新たな触媒設計指針を構築 する。さらに，設計指針に基づいて新規光触媒を開発し，さまざまなバイオマスを活用しギ 酸を選択的に生成するための高効率な光触媒システムを開発する。,基盤研究(C),小区分27030:触媒プロセスおよび資源化学プロセス関連,ギ酸,バイオマス,糖類,光触媒,グルコース,酸化セリウム,,,,,,,,,,,,,,,,,,,,,,,,,,,,,,,,,,,,,,,,,,,,,,,,,,
23K04496,徳島大学,杉山 茂,アルミナ担持酸化ニッケル触媒のシンタリングを利用した触媒再生技術の確立,固体触媒による有機化合物の気相反応を行うと、触媒活性種が有機化合物由来の炭素で覆われ、活性が激減する。このため、一般的には酸素酸化して炭素を除去するが、この際活性種が凝集し、触媒活性を再生できない。本研究では、研究代表者が基盤研究(C)で実施したアルミナ担持NiO触媒による各種アルカンの気相脱水素の研究成果を発展させ、活性種の凝集が起こっても、触媒活性が再生できることを明らかにする。,基盤研究(C),小区分27030:触媒プロセスおよび資源化学プロセス関連,触媒再生技術,シンタリング,脱水素,酸化ニッケル触媒,アルミナ担体,,,,,,,,,,,,,,,,,,,,,,,,,,,,,,,,,,,,,,,,,,,,,,,,,,,
23K04495,山口大学,酒多 喜久,H2O分解反応に実用レベルで作用できる光触媒開発に関する基礎的研究,太陽光照射下でH2O分解反応を高い効率で進行出来る光触媒の開発を念頭に、H2O分解反応を効率よく進行させられる光触媒の活性向上機構の解明とそれに基づいた高活性光触媒の開発、更に、この反応に高い活性を示す可視光応答性光触媒の開発に関する基礎的知見を得る事を目的とする。ここでは、活性向上が達成された光触媒について、定量的な光触媒反応の解析と光触媒表面制御が光触媒反応に与える影響を検討し、高い光触媒活性を発現させる要因を解明する。得られた光触媒活性向上要件を可視光応答性の窒化物・酸窒化物光触媒の調製や修飾の検討に応用して太陽光照射下で実用化レベルの活性を示す光触媒開発に関する基礎的な知見を得る。,基盤研究(C),小区分27030:触媒プロセスおよび資源化学プロセス関連,光触媒,H2O分解反応,光触媒活性向上,混合酸化物,調製条件制御,形態制御,助触媒,La2Ti2O7,活性の向上,可視光応答,太陽エネルギー変換,,,,,,,,,,,,,,,,,,,,,,,,,,,,,,,,,,,,,,,,,,,,,
