awardnumber,organization,name,title,abstract,section,review_section,keyword1,keyword2,keyword3,keyword4,keyword5,keyword6,keyword7,keyword8,keyword9,keyword10,keyword11,keyword12,keyword13,keyword14,keyword15,keyword16,keyword17,keyword18,keyword19,keyword20,keyword21,keyword22,keyword23,keyword24,keyword25,keyword26,keyword27,keyword28,keyword29,keyword30,keyword31,keyword32,keyword33,keyword34,keyword35,keyword36,keyword37,keyword38,keyword39,keyword40,keyword41,keyword42,keyword43,keyword44,keyword45,keyword46,keyword47,keyword48,keyword49,keyword50,keyword51,keyword52,keyword53,keyword54,keyword55,keyword56
18K04841,地方独立行政法人神奈川県立産業技術総合研究所,黒木 秀記,高電流密度運転を指向した燃料電池用カーボンフリー触媒層の構造設計・開発,本研究は、高活性・高耐久なカーボンフリーナノ粒子連結触媒を用いて、固体高分子形燃料電池(PEFC)の高出力化に必要な電極構造の設計指針獲得を目的とした。本研究では、カーボンフリー触媒層から水を効率よく移動させるために、マイクロポーラス層の構造制御を行い、高電流密度領域での発電性能に与える影響を明らかにした。さらに、ラテックス粒子をテンプレートに用いる新たな手法によるカーボンフリー触媒層の構造制御を実証した。この様に、本研究は、系統的な電極構造の制御に成功し、PEFCの高出力化のための有用な知見が得られた。,基盤研究(C),小区分27030:触媒プロセスおよび資源化学プロセス関連,燃料電池,カーボンフリー,触媒層,カソード,マイクロポーラス層,水移動,物質移動抵抗,高電流密度,固体高分子形燃料電池,カーボンフリー触媒層,高電流密度運転,物質移動,水管理,,,,,,,,,,,,,,,,,,,,,,,,,,,,,,,,,,,,,,,,,,,
18K04840,防衛大学校(総合教育学群、人文社会科学群、応用科学群、電気情報学群及びシステム工学群),田邉 豊和,サブナノ空間における混合原子価を用いた新規太陽光水分解用光触媒の創出,光触媒を用いた太陽光水分解研究分野において異種元素ドープや助触媒に頼らない新規の可視光駆動型光触媒の開発は大きな課題である。本研究では、酸化物の混合原子価を利用した新規可視光応答性光触媒であるBi系、Sb系混合原子価酸化物の作製を試みた。種々の合成条件を検討したところ、NaBiO3を用いた水熱合成により可視光応答性Bi2O4、SbCl3を用いた水熱合成により可視光応答性Sb2O4の作製に成功した。さらに、混合原子価Sn3O4の超薄膜化法を検討し、構造規定剤PVPを用いた水熱合成により2nm厚さの超薄膜Sn3O4が得られ、可視光照射下における犠牲剤溶液からの水素発生に高活性であることを見出した。,基盤研究(C),小区分27030:触媒プロセスおよび資源化学プロセス関連,光触媒,水分解,混合原子価,水素,太陽光水分解,水素生成,混合原子価酸化物,可視光応答性光触媒,可視光応答性酸化物,,,,,,,,,,,,,,,,,,,,,,,,,,,,,,,,,,,,,,,,,,,,,,,
18K04839,早稲田大学,小河 脩平,電場アシストとストレインエフェクトを活用した水からの高効率水素製造プロセス,構造歪みを導入（ストレインエフェクト）した固体酸化物触媒への電場アシストにより，固体酸化物触媒の表面格子酸素の放出および水蒸気による格子酸素の再生と水素の生成が，350℃でもそれぞれ十分な反応速度で進行することを見出した。また，炭化水素やアルコールを還元剤とする水素製造（水蒸気改質）や，水蒸気共存下の炭化水素の脱水素反応においても，ストレインエフェクトや電場アシストの適用が反応温度の低温化に有効であることを示した。この際，低温でも酸化物触媒の表面格子酸素を介した酸化還元反応が促進されており，これにより低温で高い活性が得られることを見出し，本研究コンセプトの有効性を実証した。,基盤研究(C),小区分27030:触媒プロセスおよび資源化学プロセス関連,資源・エネルギー有効利用技術,水素製造,水分解,低温電場触媒反応,ストレインエフェクト,電場触媒反応,低温触媒反応,酸化還元,,,,,,,,,,,,,,,,,,,,,,,,,,,,,,,,,,,,,,,,,,,,,,,,
18K04838,東京大学,多田 昌平,実用化を志向した燃焼合成法によるCO2からのメタノール合成に特化した触媒の創製,本研究課題において、CO2と再生可能エネルギー由来のH2から、効率よくメタノールを製造することが可能な触媒の開発を行ってきた。我々はメタノール合成に適した触媒としてCu/ZrO2をみいだしており、活性点がCu-非晶質ZrO2界面であった。そこで、Cu-ZrO2界面を増大させるために、（１）Cuの高担持化、（２）Cuの微粒子化、（３）ZrO2の非晶質化を行った。火炎噴霧熱分解法によってCu/ZrO2触媒を連続合成することで、上記の課題を達成することができた。特筆すべき点は、市販のメタノール合成触媒よりも高い活性を有する触媒を開発できたことにある。,基盤研究(C),小区分27030:触媒プロセスおよび資源化学プロセス関連,火炎噴霧熱分解法,銅触媒,ジルコニア,二酸化炭素,メタノール,水素化,高担持,非晶質,ナノ粒子,CO2水素化,メタノール合成,噴霧熱分解法,触媒,,,,,,,,,,,,,,,,,,,,,,,,,,,,,,,,,,,,,,,,,,,
18K04837,工学院大学,飯田 肇,メカノケミカルを利用したフルオロペロブスカイト固体塩基触媒の調製と触媒作用の解明,これまで触媒としての報告がないフルオロペロブスカイトの一つであるKMgF3をメカノケミカルにより調製した．遊星型ボールミルを用いて，高回転速度で調製したKMgF3は，クネフェナーゲル縮合において，いくつかの固体塩基触媒よりもすぐれた活性を示し，再利用も可能であった．さらに，調製過程においてFeを添加すると，強磁性を付与することができ，磁石による反応溶液からの分離が容易な固体塩基触媒が調製できた．,基盤研究(C),小区分27030:触媒プロセスおよび資源化学プロセス関連,フルオロペロブスカイト,メカノケミカル,固体塩基触媒,強磁性,,,,,,,,,,,,,,,,,,,,,,,,,,,,,,,,,,,,,,,,,,,,,,,,,,,,
18K04836,大阪大学,渡邊 浩,時間分解テラヘルツ全反射分光法を用いた光触媒反応における励起電子のダイナミクス,我々は光触媒[Re(CO)2(bpy){P(OEt)3}2](PF6)における時間分解テラヘルツ全反射分光測定を行い、光照射後の還元剤であるTEOAからRe錯体への電荷移動ダイナミクスを観測した。1.35THzにあるTEOAとRe錯体との間の分子間振動モードが光照射後9ps経過後に1.7ＴＨｚへとシフトすることが観測された。このことはTEOAからRe錯体への電荷移動の前駆現象としてTEOAがRe錯体へと近づいて行っていることを示していると考えられ、時間分解テラヘルツ全反射分光という新しい手法を用いることで電荷移動反応だけでなくその前駆現象である分子移動の観測に成功したといえる。,基盤研究(C),小区分27030:触媒プロセスおよび資源化学プロセス関連,光触媒,時間分解分光,THz分光,光触媒反応,時間分解テラヘルツ分光,時間分解測定,光物性,,,,,,,,,,,,,,,,,,,,,,,,,,,,,,,,,,,,,,,,,,,,,,,,,
18K04835,京都大学,佐藤 勝俊,高いCO2メタン化活性を有する低結晶ルテニウム金属ナノレイヤー触媒の創成,本研究では，CO2の資源化を志向したメタン化反応に注目し，当研究グループで開発した「低結晶性Ruナノレイヤー」を基軸とした新規高活性触媒の開発に取り組んだ．Ruナノレイヤーの形成メカニズムを明らかにすると共に、これを利用した希土類酸化物担持触媒を開発した．さらに低温調製プロセスを利用することで金属および酸化物の過度な結晶化を抑制し，触媒活性を更に向上させることに成功した．,基盤研究(C),小区分27030:触媒プロセスおよび資源化学プロセス関連,CO2資源化,貴金属触媒,希土類酸化物,複合酸化物,水素化,カーボンニュートラル,再生可能エネルギー,ルテニウム,二酸化炭素,資源化,希土類,貴金属ナノレイヤー,メタン化,サバティエ反応,メタン,水素,,,,,,,,,,,,,,,,,,,,,,,,,,,,,,,,,,,,,,,,
18K04834,山梨大学,宮尾 敏広,水素を選択的に活性化し低温でアンモニアを生成するナノ反応場分離触媒の研究,担持金属触媒表面への規則的メソポーラスシリカ（MS）層の構築手法を確立した。,基盤研究(C),小区分27030:触媒プロセスおよび資源化学プロセス関連,アンモニア合成触媒,水素選択活性化,低温低圧アンモニア合成,モリブデン触媒,メソポーラスシリカ被覆,反応場分離,担持金属触媒,アンモニア合成反応,メソポーラスシリカ被覆触媒,水素活性化,昇温反応,水素利用,水素キャリア,タングステン触媒,レニウム触媒,ルテニウム触媒,シリカ被覆触媒,アンモニア合成,,,,,,,,,,,,,,,,,,,,,,,,,,,,,,,,,,,,,,
18K04833,千葉大学,山田 泰弘,ナノ炭素材料のエッジ構造制御,グラフェンなどの炭素材料材料の特性の飛躍的向上には、エッジやヘテロ元素などの種々の欠陥導入が必要不可欠である。しかし既存の導入法では、複数種の欠陥が導入され構造が複雑化してしまい、構造と特性の関係が不明確であった。本研究では、エッジ構造の異なるナノ炭素材料やヘテロ元素、5員環を選択的に導入したナノ炭素材料の合成を目指し、炭素材料のエッジやその他の欠陥の構造解析法や反応機構の詳細な解析手法を確立した。本研究により7報の論文、22件の学会発表、4件の特許出願を行った。,基盤研究(C),小区分27030:触媒プロセスおよび資源化学プロセス関連,炭素材料,構造制御,エッジ,ヘテロ元素,5員環,反応分子動力学計算,X線光電子分光分析,赤外分光分析,ピリジニック窒素,ベーサルアミン,分光分析,計算化学,構造解析,窒素,酸素,Ｘ線光電子分光分析,ラマン分光分析,密度汎関数法,ナノ炭素,,,,,,,,,,,,,,,,,,,,,,,,,,,,,,,,,,,,,
18K04832,埼玉大学,荻原 仁志,液相での原子層堆積（ALD）技術による固体触媒の界面機能制御,液相での原子層堆積法技術を用いた機能性材料の開発を行った。金属前駆体を含む溶液にナノカーボンを浸漬し，溶媒を除去すると，金属前駆体がナノカーボン表面にナノスケールで堆積した。例えば，オルトケイ酸エチルを前駆体に用いると数 nm程度のシリカ層が得られた。,基盤研究(C),小区分27030:触媒プロセスおよび資源化学プロセス関連,酸化物ナノレイヤー,複合酸化物ナノ粒子,ナノカーボン,金属前駆体,電極触媒,複合酸化物ナノ材料,水電解,LaCoo3,触媒,触媒調製,原子層堆積法,酸化物層,不均一系触媒,,,,,,,,,,,,,,,,,,,,,,,,,,,,,,,,,,,,,,,,,,,
18K04831,北海道教育大学,松橋 博美,金属アルコキシドによる金属水酸化物脱水法を用いた固体塩基合成,"金属酸化物を合成する方法として，含水水酸化物から酸化物に変化する際に生成するH2Oを，金属アルコキシドの加水分解反応で除去する方法を検討した。この反応は，固相のSr(OH)2・8H2O，Ba(OH)2・8H2Oなどの含水水酸化物と，溶媒に溶解した液相のAl(OCH(CH3)2)3, Ti(OCH(CH3)2)4, Zr(OC3H7)4, Si(OC2H5)4との反応（固ー液界面反応）で，良く混合した複合酸化物前駆体を沈殿として得た。得られた固体を773 K以下で活性化した触媒は，塩基触媒反応である逆アルドール反応（ジアセトンアルコールの分解）に高活性を示した。",基盤研究(C),小区分27030:触媒プロセスおよび資源化学プロセス関連,固体塩基,アルカリ土類金属酸化物,金属アルコキシド,脱水,水和金属水酸化物,固ー液界面反応,固溶体,固体酸,固ー液界面,複合金属酸化物,固体超強酸,固体塩基触媒,アルカリ土類金属水酸化物,加水分解,,,,,,,,,,,,,,,,,,,,,,,,,,,,,,,,,,,,,,,,,,
19K05159,国立研究開発法人産業技術総合研究所,冨田 衷子,水を利用した自己組織化による貴金属ナノ粒子触媒の構造制御,貴金属ナノ粒子触媒の構造制御は活性向上や反応選択性向上に重要であり、簡便かつ低環境負荷で高度に構造制御可能な技術が求められている。本研究では、水を使用した熱処理を行うことで、貴金属が移動する「自己組織化」を利用し、貴金属ナノ粒子触媒の構造制御を行う。本研究の手法は、比較的低温で貴金属を移動させることによる粒子径の均一制御や、貴金属と酸化物との界面形成の可能性がある。この現象の機構解明と、処理条件の最適化を行う。,基盤研究(C),小区分27030:触媒プロセスおよび資源化学プロセス関連,貴金属触媒,ナノ粒子,構造制御,界面形成,水処理,貴金属担持触媒,貴金属ナノ粒子,貴金属,酸化触媒,ナノ界面制御,自己組織化,,,,,,,,,,,,,,,,,,,,,,,,,,,,,,,,,,,,,,,,,,,,,
19K05158,神戸市立工業高等専門学校,久貝 潤一郎,保護剤と炭素担体表面の官能基を活用した白金系触媒の微粒子化と酸素還元性能への応用,炭素表面に存在する官能基とその上に担持される白金系ナノ粒子の構造と電子状態の相関を調べる。白金と炭素表面の相互作用を利用し、高担持量の白金を高分散化させるとともに酸素還元活性を高める。具体的には、ポリマーを熱処理することにより炭素担体を合成し、ポリマーの構造が熱処理後の炭素の構造や表面特性に与える影響を調べる。炭素担体の表面官能基が、その上に担持される白金の構造や電子状態、酸素還元活性に与える影響を調べ、触媒の高活性化に繋げる。白金上の特定の結晶面やサイトを一酸化炭素やカルボン酸等の吸着分子で被覆し、残ったサイトの酸素還元活性を測定する方法で、酸素の四電子還元に有効な白金サイトを明らかにする。,基盤研究(C),小区分27030:触媒プロセスおよび資源化学プロセス関連,窒素ドープ炭素,ナノ粒子,酸素還元,メタノール酸化,金属－有機構造体,一酸化炭素酸化,官能基,保護剤,表面官能基,白金触媒,,,,,,,,,,,,,,,,,,,,,,,,,,,,,,,,,,,,,,,,,,,,,,
19K05157,東京農業大学,尾中 篤,金属イオン交換性多孔質窒化炭素の創製とその特性の解明,本研究は，水に溶出しないほどメレム骨格に強固に固定されたアルカリ金属イオンに基づく固体塩基性の強度を厳密に評価する手法を確立し，高比表面積の特徴を活かした，nanoC3N4が示す水中での固体塩基触媒反応への優位性を明らかにする．また，乱雑化でメレム骨格窒素原子が空間表面に露出する割合が高まることによる，単核金属イオンに対する固体多座配位子としての有用性を触媒反応で明らかにする．,基盤研究(C),小区分27030:触媒プロセスおよび資源化学プロセス関連,ナノ多孔質窒化炭素,多孔質固体塩基,水中固体塩基触媒作用,ニトロアルドール反応,重水素化反応,ニトロメタン,高比表面積,層状窒化炭素,熱濃硫酸,熱希硫酸,２-ナフトアルデヒド,メタノール,ジメチルアセタール化,固体酸触媒作用,硫黄分元素分析,多孔質窒化炭素,熱濃硫酸処理,アルカリ処理,固体塩基触媒作用,水中ニトロアルドール反応,多孔質ナノ窒化炭素,固体塩基性,ハイドロタルサイト,水に不溶,Knoevenagel反応,メレム連結集積体,多孔質化,固体多座配位子,,,,,,,,,,,,,,,,,,,,,,,,,,,,
19K05156,工学院大学,奥村 和,炭素-炭素結合生成のための分子の柔軟性を利用したゼオライト固定化錯体触媒の創生,容易に調製できる再利用可能な固体触媒を用いた高難度な炭素-炭素結合生成反応を実現するために，ゼオライトを担体とする新たな金属錯体固定化触媒を開発する．すなわち，ゼオライトの細孔内部で形成した金属錯体を活性点とし，物質濃縮を生かした触媒反応をおこなう．さらにクロロベンゼン誘導体を基質とした鈴木-宮浦カップリング反応，およびアリルアルコールを基質とした辻・トロスト反応に高い活性・再利用性を示す，ゼオライトの外表面に固定化した金属錯体触媒を創生する．,基盤研究(C),小区分27030:触媒プロセスおよび資源化学プロセス関連,ゼオライト,パラジウム,カップリング反応,錯体,鈴木カップリング反応,配位子,ホスフィン,辻-トロスト反応,金属錯体,炭素-炭素結合形成反応,,,,,,,,,,,,,,,,,,,,,,,,,,,,,,,,,,,,,,,,,,,,,,
19K05155,埼玉工業大学,有谷 博文,高活性・高耐久化メタン脱水素芳香族化触媒のための二元活性種複合制御,天然ガスの直接石油資源化を目的とした，Mo修飾H-MFIを基盤とするメタン脱水素芳香族化触媒の設計において，高活性化と高耐久化を同時に達成させることを主眼とする。H-MFI系担体構造中の細孔内と外表面の各活性点を各々に制御し、細孔内活性種を生かしつつ細孔外酸点での失活抑制を行う。同時に，Mo活性種の反応経時過炭化からの活性低下を抑制するため第二成分微量添加による構造制御により，外表面炭化Mo複合体種と近傍の強酸点を部分メタロシリケート化により失活抑制を図る。これらにより，MFIのへ部分格子置換・Mo活性種の二元機能制御による高活性・高耐久化触媒の設計とその活性因子の解明を進める。,基盤研究(C),小区分27030:触媒プロセスおよび資源化学プロセス関連,メタン脱水素芳香族化,Mo/H-MFI触媒,炭化モリブデン活性種,Mo L殻XANES,メタン芳香族化,V共修飾,失活抑制,Mo/H-MFI,メタン芳香族化触媒,二元機能,,,,,,,,,,,,,,,,,,,,,,,,,,,,,,,,,,,,,,,,,,,,,,
19K05154,北九州市立大学,今井 裕之,遷移金属類の単核サイトに基づく新奇な触媒機能を有するゼオライト触媒の創製,"ゼオライト骨格に導入した金属は、通常の金属化合物と異なる機能を示すと考えられる。本研究では、様々な酸化数を示す遷移金属類で単核サイトをゼオライト骨格中に構築し、さらに、単核サイトの特異な反応性を利用して、単核サイトと異種金属の複合体を合成する。そして、複数の機能が必要となる1,3-ブタジエン合成に応用して触媒機能を解明することで、電荷や酸塩基性を制御した新奇な複合機能を持つゼオライト触媒の開発を行う。",基盤研究(C),小区分27030:触媒プロセスおよび資源化学プロセス関連,ゼオライト,単核サイト,脱水素反応,脱水素環化,金属複合体,アルカン,遷移金属元素,貴金属,ブタン,貴金属元素,金属サイト,,,,,,,,,,,,,,,,,,,,,,,,,,,,,,,,,,,,,,,,,,,,,
19K05153,大阪府立大学,亀川 孝,金属シリサイドのナノ構造制御と触媒機能の創出,安全無害で地殻中に豊富に存在する元素より合成可能な無機材料として金属シリサイドに着目し、化学処理によるナノ構造制御方法および新しい用途の確立を目指す。特に、環境関連分野への応用を志向し、構造変化に伴い新たに発現する表面・空間・構造の巧みな利用を通し、省エネルギー・省資源・低環境負荷に貢献可能なスマートで高機能な触媒・触媒担体材料としての金属シリサイドの可能性を検討する。,基盤研究(C),小区分27030:触媒プロセスおよび資源化学プロセス関連,金属シリサイド,ナノ構造触媒,化学処理,吸着材,触媒担体,シリサイド,花弁状構造,環境浄化,触媒プロセス,ナノ材料,,,,,,,,,,,,,,,,,,,,,,,,,,,,,,,,,,,,,,,,,,,,,,
19K05152,首都大学東京,石田 玉青,カチオン性サイトを持つ金ナノ粒子触媒の構築と有用化合物変換反応への展開,"酸化物担体もしくはハイドロキシアパタイト(HAP)上に強い金属―担体相互作用(strong metal-supoprt interaction, SMSI)を利用して、金ナノ粒子表面に金属酸化物層もしくはHAP層を形成させることで、金ナノ粒子の電子的な性質を制御し、従来の担持金ナノ粒子触媒よりもカチオン性の高い金触媒を開発する。酸化亜鉛やHAPに担持した金ナノ粒子触媒は、酸化的雰囲気で熱処理するとSMSIを形成し金ナノ粒子のカチオン性が高くなることに着目し、カチオン性の金サイトが反応点となるアルケンの異性化や芳香族C-H結合の直接官能基化を固体金触媒で行う。",基盤研究(C),小区分27030:触媒プロセスおよび資源化学プロセス関連,金ナノ粒子,強い金属ー担体相互作用,ソフトルイス酸,金ナノ粒子触媒,SMSI,ハイドロキシアパタイト,層状複水酸化物,アルケンの異性化,触媒・化学プロセス,ナノ材料,合成化学,,,,,,,,,,,,,,,,,,,,,,,,,,,,,,,,,,,,,,,,,,,,,
19K05151,愛媛大学,八尋 秀典,金属シアノ錯体前駆体から調製したペロブスカイト型酸化物触媒の機能強化,申請者らは結晶性多核金属シアノ錯体の熱焼成による結晶性ペロブスカイト型複合金属酸化物触媒の調製およびその触媒作用を検討してきた．本調製法は結晶から結晶への直接変換を行うことに特徴があり，結晶性多核金属シアノ錯体はヘテロな金属イオンが原子状で混合された究極の複合金属酸化物の前駆体として注目される．本研究ではペロブスカイト型酸化物触媒の性能を向上させるため前駆体修飾による調製法の指針を得ることを目的とする．具体的には，①Aサイトへのアルカリ土類金属イオン添加方法の検討，②金属を高分散担持したペロブスカイト型酸化物の調製法の検討，③調製した触媒の環境触媒への応用について検討する．,基盤研究(C),小区分27030:触媒プロセスおよび資源化学プロセス関連,ペロブスカイト型酸化物,金属シアノ錯体,ブラウンミレライト型酸化物,PM酸化反応,シアノ錯体,ブラウンミラライト型酸化物,銀イオン,,,,,,,,,,,,,,,,,,,,,,,,,,,,,,,,,,,,,,,,,,,,,,,,,
19K05150,徳島大学,山本 孝,構造制御された前周期金属複合酸化物および固溶体酸塩基触媒の開発と活性制御因子,本申請課題はジルコニウムを中心とした３－５族金属酸化結晶相に添加された他種元素に起因するバルク層および原子レベルの局所構造に着目した固体強酸，酸塩基触媒研究に関するものである．無機化学的アプローチ，精密構造解析および活性試験を通じて「１：固体超強酸に匹敵する強酸性質発現のためにジルコニウム系酸化物触媒が兼ね備える条件と活性種の解明」，「２：ジルコニウムを軸とした前周期遷移金属を含む新規複合酸化物固体強酸触媒の開発と原子レベル構造制御」「３：ジルコニア系複合酸化物触媒によるエタノール転換反応による含酸素化合物の合成」を行う．,基盤研究(C),小区分27030:触媒プロセスおよび資源化学プロセス関連,酸化ジルコニウム,第四周期元素,複合酸化物,酸塩基,アルキル化,エタノール転換反応,銅,結晶相,酸化ガリウム,固溶体触媒,反応機構,酸塩基性,脱水素,固溶体,アルコール脱水素反応,XAFS,固体酸塩基,バイオマス利用,,,,,,,,,,,,,,,,,,,,,,,,,,,,,,,,,,,,,,
