awardnumber,organization,name,title,abstract,section,review_section,keyword1,keyword2,keyword3,keyword4,keyword5,keyword6,keyword7,keyword8,keyword9,keyword10,keyword11,keyword12,keyword13,keyword14,keyword15,keyword16,keyword17,keyword18,keyword19,keyword20,keyword21,keyword22,keyword23,keyword24,keyword25,keyword26,keyword27,keyword28,keyword29,keyword30,keyword31,keyword32,keyword33,keyword34,keyword35,keyword36,keyword37,keyword38,keyword39,keyword40,keyword41,keyword42,keyword43,keyword44,keyword45,keyword46,keyword47,keyword48,keyword49,keyword50,keyword51,keyword52,keyword53,keyword54,keyword55,keyword56
19K05149,北陸先端科学技術大学院大学,谷池 俊明,高分子鎖のランダムコイル構造を反応場とした協奏的触媒作用の創出と機能集積,本研究の狙いは、固体触媒の多機能性と分子触媒の精密設計を併せ持つ新しい触媒系の提案にある。精密合成された高分子鎖に同種ないしは異種の活性金属中心を集積させる。この高分子鎖担持型触媒は、溶液中でナノサイズのランダムコイル状態を取るため、その中に束縛された活性金属中心間に協奏作用が働くものと期待される。活性金属中心の集積度や高分子鎖の分子設計を通して機能集積と協奏的触媒作用の制御を実現する。,基盤研究(C),小区分27030:触媒プロセスおよび資源化学プロセス関連,協奏的触媒作用,機能集積,高分子鎖担持型触媒,精密設計,オレフィン重合,エチレン重合,,,,,,,,,,,,,,,,,,,,,,,,,,,,,,,,,,,,,,,,,,,,,,,,,,
19K05148,東京工業大学,大柴 雄平,極低白金・自己加湿型酸－アルカリハイブリッド燃料電池のシステム設計と水移動解析,固体高分子形燃料電池の更なる普及のためには、触媒である白金の使用量低減が課題である。また、反応ガスは加湿して電池に供給しているが、電池内で発生する水を有効に利用した自己加湿が可能となれば、システムの小型化が実現できる。本研究では、燃料電池システムの極低白金化、自己加湿を目指して、酸－アルカリハイブリッド燃料電池のシステム設計を行う。酸環境のアノードで白金量を減らし、アルカリ環境のカソードでは非白金系のカーボンアロイ触媒の利用により、システム全体の効果的な白金使用量低減を目指す。また、ハイブリッド燃料電池における電解質膜内の水移動モデルを構築し、自己加湿を実現する電解質膜の設計指針獲得を目指す。,基盤研究(C),小区分27030:触媒プロセスおよび資源化学プロセス関連,酸－アルカリハイブリッド燃料電池,低白金,カーボンアロイ触媒,水挙動,細孔フィリング薄膜,,,,,,,,,,,,,,,,,,,,,,,,,,,,,,,,,,,,,,,,,,,,,,,,,,,
19K05147,秋田大学,小笠原 正剛,層状ペロブスカイト型化合物を用いた酸塩基触媒活性を有する有機無機複合体の創製,"本研究では，ホスト化合物の化学特性とホスト-ゲスト間の相互作用による機能発現を組み合わせることで新規な酸塩基触媒を創製する．Nb系層状化合物は固体酸として機能することが数多く報告されている．また，第四級アンモニウムイオンを含む有機無機複合体が塩基触媒活性を示すことが明らかにされている．本研究ではこれらの機能発現に着目し，""酸と塩基""を独立に持ち多段階反応を進行させることが可能な触媒の調製を行う．",基盤研究(C),小区分27030:触媒プロセスおよび資源化学プロセス関連,Dion-Jacobson型層状ペロブスカイト,有機無機複合体,層間架橋体,インターカレート,酸塩基両特性,one-pot反応,Knoevenagel反応,脱アセタール化反応,臨界ミセル濃度,塩基触媒,層状ペロブスカイト型化合物,塩基触媒活性,インターカレーション,固体酸,固体塩基,,,,,,,,,,,,,,,,,,,,,,,,,,,,,,,,,,,,,,,,,
19K05146,弘前大学,吉田 曉弘,有機-無機ハイブリット材料からなる新規な貴金属フリーアンモニア合成触媒の開発,本研究では、地球人口を支える極めて重要な物質であるアンモニアの省エネルギー・小型設備での合成に適した新たな触媒材料の開発を行う。申請者らは水素化リチウムと共役系高分子材料からなる有機-無機複合体が本反応に活性を示すことを見いだしているが、その活性は未だに実用化には遠く及ばない。そこで、初年度はi)本材料によるアンモニア合成の最適反応条件の検討を行い、続く2年間でii)金属水素化物と共役系高分子材料の材料探索を行う。具体的には、今まで検討されてこなかった元素添加や様々なポリマーの適用による活性の向上を目指す。,基盤研究(C),小区分27030:触媒プロセスおよび資源化学プロセス関連,アンモニア合成,有機―無機複合材料,貴金属フリー触媒,共役系高分子材料,有機ー無機ハイブリット触媒,金属水素化物,共役系高分子,,,,,,,,,,,,,,,,,,,,,,,,,,,,,,,,,,,,,,,,,,,,,,,,,
20K05224,国立研究開発法人産業技術総合研究所,日吉 範人,ヘテロポリ酸分子の集積制御による触媒膜の開発,本研究では、触媒活性を有するケギン型ヘテロポリ酸分子を薄膜状に集積させた多孔質膜を開発し、それを用いた触媒膜反応システムの構築を目指す。多孔質膜を作成するために、気液界面における二次元的な結晶成長や、層状ヘテロポリ酸塩の層剥離と再構築などの手法を開発する。また、多孔質膜の構造および生成過程を主に収差補正電子顕微鏡を用いて明らかにし、その知見を基に多孔質膜の作成手法を最適化する。さらに、得られた多孔質膜の触媒特性を明らかにする。,基盤研究(C),小区分27030:触媒プロセスおよび資源化学プロセス関連,ヘテロポリ酸,電子顕微鏡,触媒膜,,,,,,,,,,,,,,,,,,,,,,,,,,,,,,,,,,,,,,,,,,,,,,,,,,,,,
20K05223,愛媛大学,太田 英俊,新規Niナノ粒子触媒によるフェノールからシクロヘキサノンへの高効率直接変換,シクロヘキサノンは、ナイロン合成に必要なカプロラクタムやアジピン酸の原料になる化学工業における重要化合物である。その製法の一つであるフェノールの直接水素化は他の製法よりも高効率（短工程・高収率）であるが、高価なPd触媒を必要とすることが本法の低コスト化の妨げとなっている。これまでに、より安価なNi触媒を用いた検討がいくつか報告されているが、過酷な反応条件を必要とし、シクロヘキサノンの選択率も中程度であるなど、実用化には程遠い状況にある。本研究ではフェノールをシクロヘキサノンに高効率で変換する新規Ni触媒を設計・開発する。さらに、その反応機構を解明し、より高性能な触媒を開発するための指針を得る。,基盤研究(C),小区分27030:触媒プロセスおよび資源化学プロセス関連,フェノール,シクロヘキサノン,水素化,ニッケル,触媒,,,,,,,,,,,,,,,,,,,,,,,,,,,,,,,,,,,,,,,,,,,,,,,,,,,
20K05222,愛媛大学,山口 修平,ベンゼンの直接水酸化を指向した活性中心周辺を制御した遷移金属錯体固定化触媒の開発,本研究では、「炭化水素類の選択水酸化反応に対する固体担体の細孔中で発生する遷移金,基盤研究(C),小区分27030:触媒プロセスおよび資源化学プロセス関連,フェノール合成,ベンゼン酸化,固体触媒,遷移金属錯体,ゼオライト,過酸化水素,1段階反応,担体効果,選択的水酸化反応,不均一系触媒,,,,,,,,,,,,,,,,,,,,,,,,,,,,,,,,,,,,,,,,,,,,,,
20K05221,徳島大学,杉山 茂,イソブタンの直接脱水素反応におけるコーキングの顕著な触媒活性増大効果の解明,NiO/γ-Al2O3を触媒として、二酸化炭素共存下、イソブタンの脱水素によるイソブテンの合成を行ったところ、コーキングが確認されたにもかかわらず、活性が通塔時間に伴い著しく向上するという、触媒科学の分野では非常識であるが、克服を期待されていた現象が現れた。この現象を解明するために、①NiO/γ-Al2O3の特異な活性改善挙動の詳細な検証、②コーキングの性状の検討、③二酸化炭素の影響、④触媒活性種のシンタリングおよび還元状況、⑤他の接触反応系への展開を通じて明らかにする。,基盤研究(C),小区分27030:触媒プロセスおよび資源化学プロセス関連,アルカン,アルケン,脱水素,炭素析出,酸化ニッケル触媒,アルミナ担体,触媒劣化耐性,繊維状炭素,カーボンナノチューブ,イソブタン,イソブテン,コーキング,接触脱水素,活性増大,,,,,,,,,,,,,,,,,,,,,,,,,,,,,,,,,,,,,,,,,,
20K05220,静岡大学,武石 薫,触媒前処理温度の高温化による二酸化炭素からのジメチルエーテル直接合成の飛躍的向上,マルチソース・マルチユースなクリーン燃料であり、水素の有効な貯蔵体・キャリアでもあるジメチルエーテル（DME）を二酸化炭素から一段で効率よく製造できる触媒に関する研究・開発を行う。研究代表者は、CO水素化によるDME直接合成において、一般的な混合型のDME直接合成触媒よりも高活性・高選択的なゾル－ゲル法で調製した銅系アルミナ触媒を高温処理することによって、DME合成活性が格段に向上することを発見した。そこで、この知見をCO2からのDME直接合成に応用するとともに、触媒の改良および前処理法の最適化などで、CO2からのDME生成の選択性およびDME生成速度のさらなる向上を目指す。,基盤研究(C),小区分27030:触媒プロセスおよび資源化学プロセス関連,ジメチルエーテル,DME,二酸化炭素,触媒,ゾル-ゲル法,銅,メタノール,アルミナ,ジメチルエーテル (DME),水素,焼成,還元,銅系触媒,アルミナ触媒,ゾルーゲル調製法,水素化反応,微小化,スピネル構造,ゾルーゲル法,直接合成,ゾル－ゲル法,,,,,,,,,,,,,,,,,,,,,,,,,,,,,,,,,,,
20K05219,富山大学,楊 國輝,二酸化炭素から新規エタノール合成ルートの創成,本研究では二酸化炭素（CO2）をC1化学的な原料として、新規エタノール合成ルートを実現するために、その触媒および反応ステップの探索を目的とする。斬新な二酸化炭素と水素からエタノールまでというタンデムな反応ルートを提案し、厳密な触媒化学に規定されたエタノールの生産ルートをCO2から実施し、大量にCO2を化学転換できる新規ルートの開発を目指す。これに合わせて、触媒設計、触媒性能テスト、触媒構造解析と反応メカニズム分析、触媒反応器の改良を行う。,基盤研究(C),小区分27030:触媒プロセスおよび資源化学プロセス関連,二酸化炭素,水素化,カルボニル化,エタノール,ゼオライト,タンデム反応,ジメチルエーテル,,,,,,,,,,,,,,,,,,,,,,,,,,,,,,,,,,,,,,,,,,,,,,,,,
20K05218,北見工業大学,岡崎 文保,バイオメタン直接改質を利用した大気中二酸化炭素固定化プロセスの開発,現在，大気中の二酸化炭素低減には大規模発生源を対象とする濃縮・貯留，還元資源化等が主流であるが，大気中の希薄なCO2を固定化する技術開発は進んでいない．一方，バイオマスを燃焼した場合はカーボンニュートラルが成り立つ．それゆえバイオメタンを利用したメタン直接改質は，CO2を排出せずに水素製造が可能であるため，大気中の希薄なCO2を固定化する事が出来る先進的な技術と言える．本研究では，バイオメタン中の不純物に耐性のあるメタン直接改質触媒・反応器，水素の分離法，反応後にメタン分解炭素中に分散した触媒の処理・利用法等を新たに開発し，研究期間内に実証プラント用の基礎技術を確立する．,基盤研究(C),小区分27030:触媒プロセスおよび資源化学プロセス関連,メタン直接改質,バイオメタン,二酸化炭素共存,水素製造,ナノカーボン製造,二酸化炭素固定化,酸化鉄,酸化ニッケル,ナノカーボン,ナノカーボン直径,ニッケル,アルミナ,ターコイズ水素,二酸化炭素削減,クリーン水素,,,,,,,,,,,,,,,,,,,,,,,,,,,,,,,,,,,,,,,,,
20K05217,北海道大学,高 敏,金属ナノ粒子の触媒活性見た目判別に向けた遷移状態の情報化学的研究,金属ナノ粒子触媒は各種の化学工業において極めて重要な役割を担っている。近年、量子化学に基づいて得られた反応機構によって、触媒活性の評価が可能になっており、新規触媒の理論設計に対する試みもある。実在系に用いられる金属ナノ粒子粒径（数nm）に対して、量子化学で反応機構を詳細に検討できる系のサイズは、実験系に用いられる金属ナノ粒子にかけ離れた十数原子小規模金属クラスター（~ 1.0 nm）であり、実際に起こる現象と乖離がする恐れがある。本研究では、小規模金属ナノ粒子の触媒活性の本質を量子化学計算を用いて明らかにし、実在する金属ナノ粒子(実在系)の触媒活性を予測する方法を開発する。,基盤研究(C),小区分27030:触媒プロセスおよび資源化学プロセス関連,理論計算,金属ナノ粒子,網羅探索,触媒活性,構造依存性,構造活性相関,金属クラスター,遷移状態,,,,,,,,,,,,,,,,,,,,,,,,,,,,,,,,,,,,,,,,,,,,,,,,
21K04783,東京工業大学,黒木 秀記,コアシェル型ナノネットワークを基盤とした燃料電池用ギ酸塩酸化触媒の設計開発,現在、再生可能エネルギーを大規模利用する社会へのシフトが推進されている。その中で、輸送・貯蔵に適し、電気化学的に再生可能なギ酸塩を燃料としたギ酸塩水溶液直接型固体アルカリ燃料電池(DF-SAFC)が着目されている。しかしながら、DF-SAFCの高性能化を実現するためには、革新的なギ酸塩酸化触媒が必要不可欠である。本研究は、触媒材料からデバイスまで考慮した設計を基に、高いギ酸塩酸化活性と低い物質移動抵抗を両立する新規Pd系コアシェル型ナノネットワーク触媒・触媒層の設計開発を行う。,基盤研究(C),小区分27030:触媒プロセスおよび資源化学プロセス関連,ギ酸塩酸化触媒,コアシェル,ナノネットワーク,触媒層,アニオン交換膜形燃料電池,液体燃料,担体フリー,アニオン交換膜型燃料電池,固体アルカリ燃料電池,パラジウム(Pd),膜電極接合体,,,,,,,,,,,,,,,,,,,,,,,,,,,,,,,,,,,,,,,,,,,,,
21K04782,国立研究開発法人物質・材料研究機構,押切 光丈,複素環式化合物とその遷移金属錯体による光触媒系の炭酸ガス還元反応機構の解明と検証,本研究は、異なる環数の多環式炭化水素の組合せで集光アンテナを形成することを特徴とする光触媒に金属錯体を助触媒として吸着させたシステムを用いた、可視光による二酸化炭素還元（一酸化炭素生成）不均一光触媒システムに関するものである。ここではシステムの高効率化を目指し、当該不均一光触媒システムにおける全原子分子のダイナミクスや全電子構造を第一原理手法で調査し、その反応メカニズムを追究する。光触媒物質のみを取り扱う理論研究ではなく、光触媒、助触媒、反応物質すべてを含むリアルな全系を丸ごとシミュレーションする研究であり、得られる情報はシステム最適化設計に直結し見通しの良い設計手法が得られると期待できる。,基盤研究(C),小区分27030:触媒プロセスおよび資源化学プロセス関連,二酸化炭素還元,不均一光触媒システム,多環式炭化水素,遷移金属,複素環式化合物,第一原理,量子分子動力学,電子構造,錯体,光触媒,二酸化炭素,還元,,,,,,,,,,,,,,,,,,,,,,,,,,,,,,,,,,,,,,,,,,,,
21K04781,豊橋技術科学大学,藤井 知,複素誘電率解析によるマイクロ波誘起非平衡反応場における化学反応機構解明,酸化物触媒を用いた化学反応や酸化物還元反応を行う際にマイクロ波を照射すると、反応速度向上・還元反応温度低下などの現象が発現する。そこで、本研究では、マイクロ波工学の視点から、触媒や金属酸化物の高温・高電場下やその構造の違いをマイクロ波に対する物性変化である複素誘電率として捉え、その数学モデル構築を行う。さらに、そのモデルをシミュレーションに組み込み、実際の化学反応と比較検証を行い、マイクロ波照射下触媒反応や酸化物還元反応におけるマイクロ波特殊効果を解明する。,基盤研究(C),小区分27030:触媒プロセスおよび資源化学プロセス関連,マイクロ波化学,複素誘電率測定,誘電損失,共振器,複素誘電率,空洞共振器法,金属プラズマ,,,,,,,,,,,,,,,,,,,,,,,,,,,,,,,,,,,,,,,,,,,,,,,,,
21K04780,近畿大学,岡 伸人,バナジン酸塩ガラスによる金属空気二次電池用の新規触媒の開発,導電性バナジン酸塩ガラスにより、金属空気二次電池用の空気極 (正極) 触媒を開発する。これまで触媒材料として、ランタンなどの希土類元素を含むペロブスカイト型酸化物などが報告されてきた。本研究では、希少金属である希土類元素を使用せず、さらに特定の結晶構造を必要としない「ガラス」により新しい触媒材料を創出する。開発するバナジン酸塩ガラスは電気伝導性を有し、ガラス骨格中に適切な触媒元素 [3dブロック元素 (NiやMnなど)] を均一に配置できるため、電極反応をスムーズに進行させることができると考えられる。この研究を通して、金属空気電池用の新規ガラス触媒に関する系統的な知見を得る。,基盤研究(C),小区分27030:触媒プロセスおよび資源化学プロセス関連,空気極触媒,バナジン酸塩ガラス,金属空気電池,,,,,,,,,,,,,,,,,,,,,,,,,,,,,,,,,,,,,,,,,,,,,,,,,,,,,
21K04779,大阪府立大学,陶山 寛志,加熱で組み換え可能な共有結合から成る架橋樹脂の使用後光分解,本研究では加熱で組み換え可能な共有結合から成る架橋樹脂の光分解を検討する。架橋樹脂に光反応性分子を共存させておき，使用中は加熱により共有結合を組み換えて架橋構造が再構成できる状態を保ち，使用後は光照射で発生する低分子が組み換えに割り込んで架橋構造が分解されるような材料系を考える。光反応性分子としては単官能低分子アミンやアルコールが生成するものを選び，必要に応じて分解できる架橋樹脂材料系を提案する。,基盤研究(C),小区分27030:触媒プロセスおよび資源化学プロセス関連,架橋樹脂,ポリウレタン,オキシムエステル,光照射,ビニロガスウレタン,リサイクル,光塩基発生剤,高分子分解,光分解,,,,,,,,,,,,,,,,,,,,,,,,,,,,,,,,,,,,,,,,,,,,,,,
21K04778,大阪府立大学,竹内 雅人,固体塩基触媒上でのアンモニアによる二酸化炭素固定化反応,固体塩基触媒である酸化マグネシウム表面でCO2とNH3からシアナミドまたはイソシアン酸が300℃以上で生成する現象を見いだした。ところが、酸化マグネシウム表面におけるNH3の化学的動態、反応機構などの詳細は不明なままである。本研究では、酸化マグネシウム表面において特異的なNH3吸着種が存在する可能性に着目し、NH3吸着種の化学的動態、特にCO2固定化反応におよぼす役割を明らかにする。これらの知見によりRuなどの貴金属を必要としない新奇なCO2固定化反応を提案する。,基盤研究(C),小区分27030:触媒プロセスおよび資源化学プロセス関連,固体塩基触媒,酸化マグネシウム,酸化カルシウム,酸化ジルコニウム,アンモニア,二酸化炭素,イソシアン酸,熱分解,水酸化マグネシウム,シアナミド,二酸化炭素固定化,赤外分光法,,,,,,,,,,,,,,,,,,,,,,,,,,,,,,,,,,,,,,,,,,,,
21K04777,高知大学,小河 脩平,電場触媒反応場における脱水素反応の低温駆動とその学理,本研究課題では，低級炭化水素のC-H結合活性化能を有し，外部電場印加によりプロトンを表面で伝導しうる「イオニクス担持金属触媒」の創製に取り組む。イオニクス担持金属触媒とのシナジー効果によって，「吸熱反応を低温で進めうる電場触媒反応」として，プロパンやブタンの単純脱水素反応をターゲットとし，従来に比して画期的な低温かつ炭素析出なく反応を進行させることを目指す。,基盤研究(C),小区分27030:触媒プロセスおよび資源化学プロセス関連,資源・エネルギー有効利用技術,脱水素反応,担持金属触媒,低温電場触媒反応,低級オレフィン製造,,,,,,,,,,,,,,,,,,,,,,,,,,,,,,,,,,,,,,,,,,,,,,,,,,,
21K04776,大阪大学,山口 渉,金属－非金属合金ナノ粒子触媒の開発とリグノセルロース高効率水素化分解への応用,本研究の目的は、「リン化金属ナノ合金を用いた、バイオマス由来リグノセルロースの高効率水素化分解による有用化合物の合成」を行うものである。Raney触媒を基盤とした従来のリグノセルロース水素化分解は、高温・高水素圧下で実施されており、より温和な条件下での水素化分解法の確立が望まれる。本研究では、独自のナノ合金化技術を駆使し、精密に形状制御された様々なリン化金属ナノ合金を創成する。さらにリン化金属ナノ合金の優れた水素化能を利用し、既存のセルロース・リグニン水素化分解法を置き換える画期的な環境低負荷型水素化プロセスを構築する。,基盤研究(C),小区分27030:触媒プロセスおよび資源化学プロセス関連,金属ナノ粒子,リン化ニッケル,水素化反応,協奏的触媒作用,グルコース,糖,リグノセルロース,水素化,協同触媒作用,リン化ニッケルナノ合金,ハイドロタルサイト,合金,ナノ粒子,界面,,,,,,,,,,,,,,,,,,,,,,,,,,,,,,,,,,,,,,,,,,
21K04775,名古屋大学,佐藤 勝俊,孤立貴金属の特異な局所状態を利用した窒素酸化物還元サイトの創出,自動車の低燃費化による排ガス組成の変化に伴って、酸化雰囲気下でも高い窒素酸化物（NOx）還元活性を示す触媒が必要とされており、新たな学理に基づく触媒・活性点の開発が求められている。本研究では、申請者らが見出した「孤立貴金属サイト」を基盤概念とし、酸化雰囲気下でのNOxの吸着・活性化を効率的に進める新規な活性点を創出することを目的とする。具体的には微量貴金属-汎用金属からなる貴金属サイトを構築し触媒特性を把握するとともに、in-situ、operando分光等を駆使することで、孤立貴金属サイトの微細構造と作用機構を明らかにする。これによって、画期的な機能を発現する新規触媒の設計、開発指針を得る。,基盤研究(C),小区分27030:触媒プロセスおよび資源化学プロセス関連,合金触媒,省貴金属化,局所構造,電子状態,窒素酸化物,孤立貴金属,合金,タンデム配置,NOx還元,自動車触媒,排ガス浄化,,,,,,,,,,,,,,,,,,,,,,,,,,,,,,,,,,,,,,,,,,,,,
