awardnumber,organization,name,title,abstract,section,review_section,keyword1,keyword2,keyword3,keyword4,keyword5,keyword6,keyword7,keyword8,keyword9,keyword10,keyword11,keyword12,keyword13,keyword14,keyword15,keyword16,keyword17,keyword18,keyword19,keyword20,keyword21,keyword22,keyword23,keyword24,keyword25,keyword26,keyword27,keyword28,keyword29,keyword30,keyword31,keyword32,keyword33,keyword34,keyword35,keyword36,keyword37,keyword38,keyword39,keyword40,keyword41,keyword42,keyword43,keyword44,keyword45,keyword46,keyword47,keyword48,keyword49,keyword50,keyword51,keyword52,keyword53,keyword54,keyword55,keyword56
24K03141,摂南大学,松尾 康光,光合成の水素生成を用いた新規光合成燃料電池の最適動作条件決定と建材への応用,本研究は、枯渇燃料を使用せず、植物の光合成初期過程（光化学系Ⅱ）を利用して水素を取り出し、これを燃料とする光合成燃料電池（PSⅡ-FC）の最適発電条件を決定し、CO2をも排出せず、環境負荷を著しく低減した新規次世代クリーンエネルギーを創出する研究である。また、本研究は建築への応用を視野に入れた生物・物理化学・建築の学際研究であり、PSⅡ-FCと一体化した建築「光合成建築」がエネルギーと酸素を生む循環型社会の新しい住宅へと応用・発展できることを提示し、市場導入の基盤構築もめざす。,基盤研究(B),小区分64050:循環型社会システム関連,燃料電池,光合成,水素生成,建材,光合成建築,,,,,,,,,,,,,,,,,,,,,,,,,,,,,,,,,,,,,,,,,,,,,,,,,,,
24K03140,東京農工大学,加用 千裕,日本と世界における建築物の寿命関数を考慮した木材の炭素貯蔵量の実態解明,木材は森林から伐採後も炭素を貯蔵し続けるため、気候変動対策として世界的に注目されており、木材の炭素貯蔵量の大きさや将来動向の把握が重要課題となっている。しかし、これまで世界全体および各国における木材の炭素貯蔵量の実態は解明されてこなかった。本研究では、木材として最も大きい炭素貯蔵庫である建築物を対象として、1)日本および世界の主要国の建築物の寿命関数を推定するモデルを構築し、2)実態に最も適した寿命関数と平均寿命を解明し、3)この知見に基づいて日本および各国の木材の炭素貯蔵量の実態を解明する。,基盤研究(B),小区分64050:循環型社会システム関連,木材,建築物,寿命,炭素貯蔵,世界,,,,,,,,,,,,,,,,,,,,,,,,,,,,,,,,,,,,,,,,,,,,,,,,,,,
24K03139,東北大学,福島 康裕,異分野設計基盤の統合化で実現する炭素循環技術新結合の開発促進,炭素循環の構築には、異分野に属するシステムの統合的設計基盤が必要だが、設計技術が分野ごとに独自で接続がうまくいかず、技術導入の検討が十分に進んでいない。例えば 下水処理(年間400万トンCO2当量の排出@日本)では最先端の嫌気処理法でエネルギーや化学原料の創出、さらにはCCU技術の排水や汚泥焼却プロセスへの適用、熱統合や副生物の相互利用も可能だが体系的な検討例は僅少である。本研究では、化学工学分野と環境工学分野の分断された設計基盤の接続、統合化を行うために、炭素循環に資するシステムを統合的に設計し、CN社会に適合する水処理プロセスの姿を提案可能な設計基盤を構築することを目指す。,基盤研究(B),小区分64050:循環型社会システム関連,Simulation environment,Integration,Wastewater treatment,CCU,AnMBR,,,,,,,,,,,,,,,,,,,,,,,,,,,,,,,,,,,,,,,,,,,,,,,,,,,
24K03138,弘前大学,井岡 聖一郎,硫黄の飽和指数解析と微生物硫酸還元反応活性を結び付けた新規地熱資源探査法の構築,地熱発電は再生可能エネルギーの中で唯一地下資源を利用するため気象に依存しない安定電源という利点がある。その地熱発電開発のための有望地を見つける探査法には，地質学的，地球化学的，地球物理学的探査があるが，これら一つだけで十分な探査法はない。数多くの既存探査法を組み合わせて実施した場合でも有望地発見に失敗する事例がある。したがって，新たな探査法の提案が必要であり，高温湧水に含まれる硫化水素の起源を判別する新しい指標に基づく新たな探査法を提案する。,基盤研究(B),小区分64050:循環型社会システム関連,地熱,硫黄,硫酸還元,微生物,資源探査法,,,,,,,,,,,,,,,,,,,,,,,,,,,,,,,,,,,,,,,,,,,,,,,,,,,
25K03322,九州大学,キーリー アレクサンダー・竜太,ネイチャーポジティブへ向けた社会・環境配慮型再エネ拡大と市場影響評価手法の開発,本研究は、衛星画像と機械学習を活用した高精度な再エネ分布データの構築と、自家消費量の詳細把握を基盤に、生態系・景観への影響や社会的受容性を多基準意思決定（MCDM）手法で定量化した複数シナリオを策定し、それぞれが電力市場の価格形成や需給調整に与える効果を総合的に評価するものである。再エネの急速な導入に伴う環境保全や地域経済への影響を踏まえ、ネイチャーポジティブとカーボンニュートラルを両立できる具体的方策を提示し、持続可能なエネルギー転換を加速させることを目指す。さらに、分析結果をもとに政策提言書を作成し、国内外のステークホルダーと連携して社会実装を促進し、科学的根拠に基づく意思決定を支援する。,基盤研究(B),小区分64050:循環型社会システム関連,カーボンニュートラル,ネイチャーポジティブ,再生可能エネルギー,社会的受容性,電力市場,,,,,,,,,,,,,,,,,,,,,,,,,,,,,,,,,,,,,,,,,,,,,,,,,,,
25K03321,京都大学,由里本 博也,C1サーキュラーバイオエコノミーで活用するC1微生物代謝生理の分子基盤と新技術,本研究では、C1-サーキュラーバイオエコノミーで多いに活用されるべきC1微生物について、その代謝生理機能の分子基盤の解明と活用技術の開発を行い、低炭素・循環型社会形成に資するバイオプロセスの新技術を開発する。具体的には、①メタンからの有用物質生産のための新規メタン酸化酵素の代謝生理機能解明、②酵母メタノール誘導制御機構の分子基盤解明と異種タンパク質高生産宿主の構築、③葉面C1微生物による作物増収メカニズムの解析と実用化技術開発に関する研究を行う。,基盤研究(B),小区分64050:循環型社会システム関連,環境技術,応用微生物,バイオテクノロジー,発現制御,生体機能利用,,,,,,,,,,,,,,,,,,,,,,,,,,,,,,,,,,,,,,,,,,,,,,,,,,,
25K03320,京都大学,日高 平,太陽光を活用する微生物反応による廃水・廃棄物からの資源・エネルギー循環の促進,メタン発酵技術を核として、その前後に太陽光を活用する微生物を組み合わせることで、廃水・廃棄物からの資源・エネルギー循環を促進する技術の開発を試みる。メタン発酵の前段である廃水処理施設に自己造粒藻類を導入することで、省エネルギー化および二酸化炭素の固定化を試みる。メタン発酵の後段に光合成細菌の培養を適用することで、肥料としての価値を高め肥料成分の循環促進を試みる。それぞれの微生物について増殖特性を表すモデルを構築し、脱炭素社会構築に貢献するシステムとして、全体を評価しながら最適条件を提案する。,基盤研究(B),小区分64050:循環型社会システム関連,嫌気性消化,メタン発酵,造粒藻類,光合成細菌,肥料,,,,,,,,,,,,,,,,,,,,,,,,,,,,,,,,,,,,,,,,,,,,,,,,,,,
25K03319,岐阜大学,義家 亮,水素製造副生酸素の有効利用とBECCSを実現する分散型バイオマスガス化システム,本研究は再生可能エネルギー由来の水素製造プラントにおける副生酸素をバイオマスガス化プロセスの酸素富化条件に有効利用することで，里山・山林地域における小規模分散型の高効率複合エネルギー製造プロセスを構築し，さらには二酸化炭素を分離回収してBECCS（Bio-Energy with Carbon Capture and Storage）を実現することを目標とする．従来のバイオマスガス化では利用困難な低発熱量のバイオマス資源を処理することを想定し，熱入力数十kW未満の排ガス循環オキシバイオマスガス化炉に，固体酸化物型電気分解を水素製造，固体酸化物型燃料電池を発電に利用するシステムを提案する．,基盤研究(B),小区分64050:循環型社会システム関連,バイオマス,ガス化,SOFC,副生酸素,,,,,,,,,,,,,,,,,,,,,,,,,,,,,,,,,,,,,,,,,,,,,,,,,,,,
25K03318,東北大学,横山 幸司,スズ系ペロブスカイトと電解液の組成・構造設計による高性能・長寿命光蓄電池の創製,スズ系ペロブスカイト材料の組成・構造と光応答性・溶液耐久性の相関性を網羅的に明らかにし、光応答性と溶液耐久性を両立する材料を得る。これと並行して、ペロブスカイト材料の溶解性を司る電解液のドナー性を溶液構造および溶媒分子構造の設計により制御する新規技術を確立する。これらの知見を融合して開発した、新規スズ系ペロブスカイト光電極が新規電解液中で高い耐久性を示すことを、In-Situでの構造・光学・化学状態分析手法により実験的に評価する。これらの光電極と電解液を組み込んだ光蓄電池の光非照射・照射下での電気化学測定により、光電極の基礎的な電気化学挙動や光充電挙動、その動作安定性を評価する。,基盤研究(B),小区分64050:循環型社会システム関連,スズ系ペロブスカイト,光蓄電池,,,,,,,,,,,,,,,,,,,,,,,,,,,,,,,,,,,,,,,,,,,,,,,,,,,,,,
