awardnumber,organization,name,title,abstract,section,review_section,keyword1,keyword2,keyword3,keyword4,keyword5,keyword6,keyword7,keyword8,keyword9,keyword10,keyword11,keyword12,keyword13,keyword14,keyword15,keyword16,keyword17,keyword18,keyword19,keyword20,keyword21,keyword22,keyword23,keyword24,keyword25,keyword26,keyword27,keyword28,keyword29,keyword30,keyword31,keyword32,keyword33,keyword34,keyword35,keyword36,keyword37,keyword38,keyword39,keyword40,keyword41,keyword42,keyword43,keyword44,keyword45,keyword46,keyword47,keyword48,keyword49,keyword50,keyword51,keyword52,keyword53,keyword54,keyword55,keyword56
18H03421,国立研究開発法人産業技術総合研究所,佐藤 修,新規バイオマスカスケード利用技術開発による統合的プロセスモデルの構築,環境調和型の新規変換プロセスの開発を目的とした固体酸と水-二酸化炭素二相反応系を組み合わせたフルフラール合成反応の検討を行い、触媒としてイオン交換樹脂（Amberlyst 70）を用いることで、キシロースから収率55％でフルフラールを得ることに成功した。本反応系は、実バイオマスモデルとなるヘミセルロース（キシラン）からのフルフラール合成にも有効で、170℃、20MPa、4時間処理によるフルフラール収率は47.2％であった。更に杉粉末の前処理に適用したところ、ほぼミセルロース成分だけを分解、収率40.7％、48.5％でキシロース、フルフラールを回収できた。,基盤研究(B),小区分64050:循環型社会システム関連,バイオマス利用,環境調和型プロセス,循環型社会システム,高温水,超臨界二酸化炭素,固体触媒,アルコリシス,低環境負荷技術,環型社会システム,低炭素社会,環境負荷低減,フルフラール合成,固体酸触媒,持続可能発展,,,,,,,,,,,,,,,,,,,,,,,,,,,,,,,,,,,,,,,,,,
18H03420,国立研究開発法人国立環境研究所,小口 正弘,消費者が製品に期待する使用年数の実態と決定要因の分析：製品長期使用の実現に向けて,消費者による製品の期待使用年数の実態を明らかにし、実使用年数とのかい離とその要因を考察した。消費者アンケート調査から耐久消費財の期待使用年数を推定し、実使用年数が消費者の期待を満たしていないこと、そのかい離の解消によって使用年数を最大30%-70%程度延長できる可能性があることを示した。製品の実使用年数を買替理由別に解析した結果、故障による買替と上位品目への買替で使用年数の違いが見られず、期待使用年数と実使用年数のかい離には製品の物理的な劣化と機能・性能の相対的な陳腐化が同程度に寄与していると考えられた。タイ国において同様の調査、推定を行い、期待使用年数が日本のそれよりも短いことを示した。,基盤研究(B),小区分64050:循環型社会システム関連,期待使用年数,耐久消費財,要因分析,長期使用,循環経済,製品使用年数,,,,,,,,,,,,,,,,,,,,,,,,,,,,,,,,,,,,,,,,,,,,,,,,,,
18H03419,岐阜大学,上宮 成之,膜反応器を用いた複合化反応システムによる二酸化炭素資源化反応の高効率化,再生可能エネルギー由来のアンモニアを水素に再転換しCO2と反応させてメタンを製造する複合化反応プロセスに、物質移動と熱移動を効果的に実施できるメンブレンリアクターを適用することを試みた。メンブレンリアクターでの反応条件に適した触媒開発を行い、NH3分解にはRu/Ba/γ-Al2O3が、CO2メタン化にはRu/ZrO2が高活性を示すことを見いだした。実験と並行して反応モデルを作成しシミュレーション解析を実施したところ、高活性なNH3分解触媒および水素透過膜の開発が、このシステムの効率化を目指す上で重要な課題であることを示すことができた。,基盤研究(B),小区分64050:循環型社会システム関連,メンブレンリアクター,プロセス強化,二酸化炭素,アンモニア,水素,メタン化,反応シミュレーション,カーボンサイクル,複合化,化学反応シミュレーション,資源化,触媒活性,,,,,,,,,,,,,,,,,,,,,,,,,,,,,,,,,,,,,,,,,,,,
18H03418,長岡技術科学大学,姫野 修司,紙ゴミ類の可溶化による都市ゴミ有機成分と下水汚泥の一括バイオガス化システムの開発,一般可燃ごみ中の厨芥類のエネルギー利用技術が求められている。本研究では，廃棄物の機械的・生物的処理(Mechanical-Biological Treatment: MBT)として機械選別とメタン発酵システムについて実ごみによる機械選別試験とメタン発酵試験を実施した。,基盤研究(B),小区分64050:循環型社会システム関連,メタン発酵,MBT,再生可能エネルギー,バイオマス,,,,,,,,,,,,,,,,,,,,,,,,,,,,,,,,,,,,,,,,,,,,,,,,,,,,
18H03417,東京大学,中谷 隼,地域の将来リスク管理を志向した持続可能性評価,地球規模の将来シナリオのもとで，島嶼などの閉鎖性地域の持続可能性を評価するフレームワークを構築した。沖縄県を対象として，地域内の需要に伴う耕地利用の誘発構造を分析した。地球規模での気候変動の予測情報を地域スケールの分析に適用し，地域の水資源の持続可能性を評価した。土砂流出モデルに基づいて，地域における食料生産の環境制約の指標として土地資源利用効率を提案した。パラオを事例に，沿岸部での洪水と渇水時の水不足という気候リスクに対する都市化の影響を明らかにした。パラオの集落を対象に，伝統的・国産食材と輸入食材の割合を推計した。石垣島における観光者の料理の選好を明らかにし，その安定供給の課題を考察した。,基盤研究(B),小区分64050:循環型社会システム関連,島嶼,観光,消費パターン,洪水・渇水リスク,食料安定供給,全球気候モデル,土砂流出モデル,フットプリント分析,将来シナリオ,水資源利用可能性,食生活,パラオ,石垣島,生活の質,多地域間産業連関表,,,,,,,,,,,,,,,,,,,,,,,,,,,,,,,,,,,,,,,,,
18H03416,東北大学,高橋 英志,化合物太陽電池をプリンテッドエレクトロニクス法で形成する手法の開発,人類が平等に、国格差や企業規模格差なく太陽光をエネルギー源として享受するためには、誰でも、何処でも、後進国であっても、簡単に、簡易的な設備のみを用いて、太陽電池を作製できるプロセスを開発することが必要である。そこで本研究では、光吸収層となる化合物半導体を低環境負荷で簡単に常温の水溶液中で合成する手法を確立し、インクジェット法や塗布という簡単な方法で化合物太陽電池を形成する技術を開発することを試み、光吸収層材料を用いたインクを作成し、塗膜を形成することに成功した。,基盤研究(B),小区分64050:循環型社会システム関連,化合物太陽電池材料,錯体濃度計算,硫化反応速度,インク化,化合物太陽電池,水溶液中合成,錯体構造制御,プリンテッドエレクトロニクス,CIGS,ナノ材料,,,,,,,,,,,,,,,,,,,,,,,,,,,,,,,,,,,,,,,,,,,,,,
19H04331,国立研究開発法人産業技術総合研究所,藤原 正浩,太陽光をエネルギー源とした光熱変換膜による海水淡水化の研究,世界規模での水不足問題に対処するため、本研究では、太陽光エネルギーを用いて海水を淡水化する技術を創出する。太陽光から熱を発生できる光熱変換材料と、液体の水は透過しないが気体の水蒸気は透過させる膜とを組み合わせた材料を作製する。この膜材料上に海水を敷き太陽光にさらすことで、水を膜透過させて淡水を得る。また、植物の水汲み上げ機構（蒸散流）を応用した海水の自動供給法も研究し、太陽光を利用した高効率な海水淡水化技術を創出する。,基盤研究(B),小区分64050:循環型社会システム関連,海水淡水化,太陽光,光熱変換材料,エネルギー変換,淡水製造,微細構造,太陽熱蒸留,太陽光エネルギー,光熱変換,膜分離,色素,窒化チタン,,,,,,,,,,,,,,,,,,,,,,,,,,,,,,,,,,,,,,,,,,,,
19H04330,木更津工業高等専門学校,大久保 努,耐性菌パンデミック回避を目指す下水処理システムの最適化,世界的に使用量が増大している抗生物質はヒト用医薬品や畜産養殖用として投与され，病気の拡散や細菌の増殖・機能を阻害するために使用されている。しかしながら近年，抗生物質が効かない抗生物質耐性大腸菌が出現し，2050年には年間1千万人が耐性大腸菌が原因で死亡すると予測され，現在も耐性菌を原因とする死亡事例が国内外で相次いで報告されており喫緊な対応が必要である。本研究では，耐性大腸菌を対象に下水処理システムでの消長や耐性遺伝子の伝播メカニズム解明，更に処理水の消毒法を最適化することで，全世界に適用可能な耐性菌封じ込め・消毒技術を確立し，安全が担保された水循環社会システムを提供する。,基盤研究(B),小区分64050:循環型社会システム関連,薬剤耐性菌,下水処理,消毒システム,耐性大腸菌,耐性遺伝子,,,,,,,,,,,,,,,,,,,,,,,,,,,,,,,,,,,,,,,,,,,,,,,,,,,
19H04329,立命館大学,橋本 征二,天然資源利用の価値・効率・環境影響に着目した循環経済の計測手法の開発,従来のリサイクル率等の指標では計測できないシェアリング・マニュファクチャリング等を含む循環経済の新たな概念・取り組みに対する新たな指標の開発を目的として、a) 天然資源が採取され最終処分されるまでに生み出す価値の計測手法、b) 資源効率を高める様々なアプローチの個別計測手法、c) 天然資源利用の削減による環境影響の削減効果の計測手法、を開発する。supply-driven型のモデルを援用して天然資源の「生涯」にわたって生み出される価値を推計する手法を開発する点、資源効率の構造分解にもとづいて資源効率を高める様々なアプローチの個別計測手法を開発する点に独創性・新規性がある。,基盤研究(B),小区分64050:循環型社会システム関連,資源効率,環境効率,シェアリング,リマニュファクチャリング,関与物質総量,,,,,,,,,,,,,,,,,,,,,,,,,,,,,,,,,,,,,,,,,,,,,,,,,,,
19H04328,早稲田大学,近藤 康之,希少合金元素の高効率リサイクルを目指した多元物質ストック・フロー解析モデルの開発,持続可能社会の実現手段として循環経済（サーキュラーエコノミー）の実現が求められている。循環経済をめぐる議論は多岐に渡るが、その定量的基礎として欠かせない全経済的な物質ストック・フローの長期的な挙動を統一的、一般的かつ定量的に捉えた手法は開発されていない。本研究の目的は、多物質・多元素を考慮した動的物質ストック・フロー解析モデルを世界に先駆けて開発し、その実証性をとくに国家備蓄対象となっている鉄鋼合金元素について検証することである。これにより、リサイクルの質、部品リユース、リマニュファクチャリング可能性等を定量的情報に基づいて検討し、循環経済に係る政策立案の支援に資することが期待される。,基盤研究(B),小区分64050:循環型社会システム関連,循環経済,サーキュラーエコノミー,廃棄物産業連関,オープンループリサイクル,循環型社会,,,,,,,,,,,,,,,,,,,,,,,,,,,,,,,,,,,,,,,,,,,,,,,,,,,
19H04327,九州大学,中山 裕文,産業用資材からのマイクロプラスチック発生量推定と対策に関する研究,本研究は、農業用途、漁業用途、建設用途等のために屋外に設置されている産業用プラスチック資材に着目し、それらが紫外線、風雨による劣化、摩耗等の影響を受けて細片化し、マイクロプラスチックとなるプロセスを明らかにする。産業用プラスチック資材のフロー、ストック把握とともに、マイクロプラスチック発生量を推定する。さらに、各種資材の用途、使用期間に応じたプラスチック材料の耐候性基準を検討するとともに、基準が導入された場合に発生する追加的費用と、それが産業連関を通じて経済全体へ波及するインパクト推定を行う。,基盤研究(B),小区分64050:循環型社会システム関連,産業用プラスチック,マイクロプラスチック,農業,漁業,建設業,廃棄物処理,最終処分場,産業連関分析,プラスチックフロー,排出構造,マイクロファイバー,廃棄物処理施設,マテリアルフロー,産業用資材,耐久性,経済評価,耐久性評価,プラスチック,マイクロプラスチック・ファイバー,不織布,促進劣化,摩耗強さ,引張強さ,,,,,,,,,,,,,,,,,,,,,,,,,,,,,,,,,
19H04326,京都大学,由里本 博也,低炭素循環型社会形成に資するメタノール変換バイオプロセスの新技術開発と分子基盤,メタノールを低炭素・資源循環型物質生産体系の基幹物質として利用する工業体系「メタノールエコノミー」が提唱されている。本研究では、メタンやメタノールなどのC1化合物を利用するC1微生物を、メタノールエコノミーにおけるバイオプロセスにおいて高度活用することを目的とし、C1微生物の代謝生理機能の分子基盤を解明するとともに、「メタノールから有用物質への変換プロセス」と「様々な炭素資源からメタノールへの変換プロセス」に関する新技術開発を行う。,基盤研究(B),小区分64050:循環型社会システム関連,遺伝子発現制御,転写因子,シグナル伝達,異種タンパク質生産,メタン,メタノール,メタノール酵母,メタノール誘導性,メタノール誘導,メタノール変換,天然ガス,バイオマス,環境技術,応用微生物,バイオテクノロジー,発現制御,生体機能利用,,,,,,,,,,,,,,,,,,,,,,,,,,,,,,,,,,,,,,,
19H04325,東京大学,村上 進亮,忌避物質のマテリアルフロー分析と資源循環高効率化の余地の定量化,素材製造プロセスには忌避物質と呼ばれ、含有されていても回収されないばかりかそれを阻害する物質がある。しかし、こうした物質も他のプロセスに投入されれば回収され資源となる場合もある。昨今、リサイクルも含め、素材産業への投入物は複雑化しており、投入物と処理プロセスの組み合わせは必ずしも最適化されていない。そこで、本研究では、こうしたプロセスにおける忌避物質のフローを定量化し、またプロセス側の技術情報を整理することで、投入物と処理プロセスの組み合わせ最適化を目指す。その結果追加的に回収される資源は、我が国の素材産業の持つ資源利用効率化の余地を定量的に示すことになる。,基盤研究(B),小区分64050:循環型社会システム関連,マテリアルフロー分析,大域的感度分析,忌避元素,社会制度,評価手法開発,マテリアルフロー,中間処理技術,製錬技術,製錬,中間処理,資源効率,忌避物質,鉱物資源,資源利用の環境影響指標,クロム,組み合わせ最適化,資源の重み付け指標,未利用資源の最小化,,,,,,,,,,,,,,,,,,,,,,,,,,,,,,,,,,,,,,
19H04324,東北大学,横山 俊,Cuナノワイヤを基軸にした高性能・高耐久な透明導電膜の創製と太陽電池応用,酸化インジウムスズは、太陽電池の透明導電膜として使用されているが、Inの希少性や毒性の観点から、Cuナノワイヤへの代替が検討されている。しかし、Cuナノワイヤは酸化により、安定性が低く、従来法で合成されたCuナノワイヤは実用化に耐えうる特性を発現できていない。代表者はこれまで低環境負荷な手法を基礎として、Cuナノ材料の合成・表面制御法を開発している。そこで、本技術をナノワイヤへ応用、展開し、高性能・高耐久なCuナノワイヤ透明導電膜を低コストに創出し、太陽電池の低コスト・高効率化を試みる。,基盤研究(B),小区分64050:循環型社会システム関連,銅,ナノワイヤ,太陽電池,透明導電膜,アスペクト,酸化,被覆,酸化亜鉛,アンモニア,耐久性,銅ナノワイヤ,表面制御,ZnO被覆,クエン酸,ガルバニック置換反応,銀,透過率,シート抵抗,ガルバニック置換,ヒドロキシ酸,酸化インジウムスズ,アスペクト比,還元反応速度,液相還元,Cuナノワイヤ,液相還元法,,,,,,,,,,,,,,,,,,,,,,,,,,,,,,
20H04386,京都大学,日高 平,乳酸発酵および光合成微生物による小規模地域内の資源・エネルギー循環の促進,地方の小規模施設を対象に生活排水および廃棄物（生ごみなど）の個別処理の仕組みを抜本的に見直し、「集約メタン発酵を核としたバイオガス回収・直接肥料利用などを組み合わせた地域内の資源・エネルギー循環システム」の実現を目指す。新たな微生物活用手法として、乳酸発酵による浄化槽汚泥と生ごみの回収一体化、および光合成微生物によるメタン発酵汚泥の肥料価値向上に取り組み、導入効果を評価する。,基盤研究(B),小区分64050:循環型社会システム関連,メタン発酵,バイオマス,浄化槽汚泥,生ごみ,光照射培養,栽培試験,バイオガス,下水汚泥,模擬生ごみ,浄化槽,液肥,太陽光,,,,,,,,,,,,,,,,,,,,,,,,,,,,,,,,,,,,,,,,,,,,
20H04385,静岡大学,木村 浩之,付加体の深部帯水層の地下温水と微生物群集を活用したメタン・水素生成リアクター,研究代表者は西南日本の太平洋側の地域に分布する付加体を研究し、その深部帯水層に嫌気性地下水とメタンが蓄えられていること、地下水に高い活性を持つ水素発生型発酵細菌と水素資化性メタン生成菌が含まれること、その深部帯水層では水素発生型発酵細菌と水素資化性メタン生成菌が共生し、有機化合物を分解して、メタンを生成していることを明らかにしてきた。本研究では、付加体の深部帯水層に由来するメタン、嫌気性の地下温水、微生物群集を用いた分散型エネルギー生成システムを創成する。特に、地下温水に含まれる水素発生型発酵細菌と水素資化性メタン生成菌を活用したメタン生成リアクターおよび水素ガス生成リアクターを構築する。,基盤研究(B),小区分64050:循環型社会システム関連,地下圏微生物,バイオリアクター,温泉,水素製造,分散型エネルギー,災害対策,メタン,水素,メタン生成,水素ガス生成,分散型エネルギー生産,未利用エネルギー,微生物,水素生成,,,,,,,,,,,,,,,,,,,,,,,,,,,,,,,,,,,,,,,,,,
20H04384,東京農工大学,加用 千裕,木材利用による炭素排出削減効果の世界モデルの開発と将来予測,地球温暖化問題において、木材の炭素貯蔵、材料代替、燃料代替による炭素排出削減の可能性が世界的に注目されている。本研究では、世界各国の木材のフロー・ストックに関わる炭素貯蔵、材料代替、燃料代替による総合的な炭素排出削減効果を推計できるモデルを世界に先駆けて開発する。この世界モデルにおいて、木材利用に関わる複数の政策シナリオを検討し、世界各国・世界全体の炭素排出削減効果の将来予測を行い、効果的な温暖化対策とその削減ポテンシャルを提示する。本モデルの開発により、各国の木材利用に関わる政策案に応じて、温暖化対策への貢献ポテンシャルの定量予測が可能となり、効果的な政策の決定を支援するツールを提供できる。,基盤研究(B),小区分64050:循環型社会システム関連,木材,世界モデル,炭素貯蔵効果,材料代替効果,燃料代替効果,マテリアルフロー・ストック分析,ライフサイクルアセスメント,気候変動対策,,,,,,,,,,,,,,,,,,,,,,,,,,,,,,,,,,,,,,,,,,,,,,,,
20H04383,東北大学,琵琶 哲志,低温・低エネルギー密度の熱源で動作する音波エンジンの開発,バイオマスエネルギー，太陽光，産業炉からの各種排熱など多くの未利用熱源の利用を促進するために，従来型技術に比べて著しく簡単な構造を持つ音波エンジンの研究を推進する．本研究では，液体ピストンとフライホイールを組み込むことで音波エンジンの単純構造を維持したままその出力を取り出す機構の検討を行う．,基盤研究(B),小区分64050:循環型社会システム関連,熱音響現象,音波エンジン,スターリングエンジン,エネルギー変換,外燃機関,液体ピストンエンジン,熱音響自励振動,熱音響デバイス,低動作温度差,音響振動,,,,,,,,,,,,,,,,,,,,,,,,,,,,,,,,,,,,,,,,,,,,,,
20H04382,弘前大学,杉山 修一,無肥料水田で起こる炭素・窒素循環の微生物プロセスの解明とメタン放出抑制,CO2に比べ強力な温室効果をもつメタンは水田が主要な放出源の一つとなっており，その削減は温暖化防止のための有効な手段である。申請者はこれまでの無肥料栽培で生じる窒素欠乏水田では，メタンをエネルギー源として利用する窒素固定細菌が活性化し，土壌からのメタン放出量の低下をもたらす結果を得た。水田からのメタン放出には炭素・窒素循環に関わる多数の微生物が関与しているため，この結果の普遍性を検証するには，現地水田でのメタンフラックスの測定と同時にそれに関わる微生物プロセスの解明が不可欠である。本研究では，現地での実証データにより，無肥料栽培水田からのメタン放出削減の科学的基盤を確立することを目指している。,基盤研究(B),小区分64050:循環型社会システム関連,温室効果ガス排出抑制,水田,メタン生成菌,窒素固定菌,生物地球化学,窒素固定細菌,無肥料,メタン分解菌,鉄還元菌,硫酸還元菌,メタン,温暖化抑制,嫌気的分解,自然栽培,温暖化対策,メタン放出,メタンガス,地球温暖化,水田土壌,生物的窒素固定,微生物プロセス,,,,,,,,,,,,,,,,,,,,,,,,,,,,,,,,,,,
23K21780,東京大学,菊池 康紀,資源循環最適化のためのスーパーストラクチャ構築と先制的ライフサイクル設計,再生可能資源由来エネルギー(再エネ)を主力化するための蓄電池や太陽電池などの技術は、レアメタルや貴金属といった鉱物資源を基幹的な部品に含み、温室効果ガス(GHG)排出による気候変動リスクとは異なる資源消費リスクを引き起こしうるため、リサイクルによる循環が不可欠である。本研究では、適用可能な資源リサイクル技術オプションの全組み合わせを記したスーパーストラクチャを構築し、ライフサイクル評価(LCA)による技術評価結果を用いて、気候変動や資源消費といった環境影響を最小化するリサイクルシステムを設計する手法を開発する。,基盤研究(B),小区分64050:循環型社会システム関連,ライフサイクルアセスメント（LCA）,マテリアルフロー分析（MFA）,金属資源リサイクル,蓄電池,太陽光パネル,マテリアルフロー分析,ライフサイクルアセスメント(LCA),,,,,,,,,,,,,,,,,,,,,,,,,,,,,,,,,,,,,,,,,,,,,,,,,
