awardnumber,organization,name,title,abstract,section,review_section,keyword1,keyword2,keyword3,keyword4,keyword5,keyword6,keyword7,keyword8,keyword9,keyword10,keyword11,keyword12,keyword13,keyword14,keyword15,keyword16,keyword17,keyword18,keyword19,keyword20,keyword21,keyword22,keyword23,keyword24,keyword25,keyword26,keyword27,keyword28,keyword29,keyword30,keyword31,keyword32,keyword33,keyword34,keyword35,keyword36,keyword37,keyword38,keyword39,keyword40,keyword41,keyword42,keyword43,keyword44,keyword45,keyword46,keyword47,keyword48,keyword49,keyword50,keyword51,keyword52,keyword53,keyword54,keyword55,keyword56
21H03665,創価大学,秋月 真一,月レゴリス浸漬－微細藻類・凝集態硝化菌共存系システムによる月面尿処理技術の開発,宇宙は人類に残された最大のフロンティアであり、今後、その開拓競争は激化の一途を辿る。特に次の30年間は、他の惑星探査の足掛かりとして、月開拓に焦点を当てることが共通認識となっている。本研究では、月面という資源が限られた閉鎖系環境で長期有人活動を可能にする技術として、尿中の栄養塩を利用する「月レゴリス浸漬－微細藻類・凝集態硝化菌共存系システム」の開発を目指す。本技術は、尿中に不足するとされるマグネシウムを月の土壌（レゴリス）から得ること、アンモニアによる微細藻類の生育阻害を緩和するために凝集態硝化菌を利用すること、の二つを特徴とする。微小重力環境下で実験を行うことで月面での利用可能性を検証する。,基盤研究(B),小区分64050:循環型社会システム関連,微小重力環境,資源循環,尿処理,微細藻類,硝化,低重力環境,硝化活性,浮力駆動型対流,グラニュール形成,共生系,共生系プロセス,汚水処理,,,,,,,,,,,,,,,,,,,,,,,,,,,,,,,,,,,,,,,,,,,,
21H03664,山口大学,田之上 健一郎,高強度な材料創製を伴った竹バイオマス粒子からの石炭に匹敵する高位発熱量の燃料創製,研究課題１：微粒子化された竹粒子と廃プラスチックとの半炭化を200℃～400℃程度における温度で行う．高位発熱量を測定しその値から固体燃料中のプラスチック含有量を推定する．また，小さいサイズの半炭化竹粒子に，フェノール樹脂とシリカ微粒子を添加して混練し，1500℃ 以上で焼成し，SiCセラミックスを創製する．,基盤研究(B),小区分64050:循環型社会システム関連,半炭化,クリンカー,シナジー効果,バイオマス/廃プラ,バンブーマテリアル,竹粒子燃焼,バンブーセラミックス,竹,,,,,,,,,,,,,,,,,,,,,,,,,,,,,,,,,,,,,,,,,,,,,,,,
21H03663,京都大学,大土井 克明,生ごみ自然乳酸発酵制御による効率的なメタン発酵原料収集手法の確立,本研究では、生ごみを開放乳酸発酵させることで数日間衛生的に保管し、乳酸発酵生ごみを安定的にメタン発酵に利用するための技術開発を目的としている。具体的には、,基盤研究(B),小区分64050:循環型社会システム関連,メタン発酵,乳酸発酵,前処理,ハブアンドスポーク回収,自然乳酸発酵,生ごみ回収,資源循環,,,,,,,,,,,,,,,,,,,,,,,,,,,,,,,,,,,,,,,,,,,,,,,,,
21H03662,豊橋技術科学大学,大門 裕之,可搬式メタン発酵システムの再起動を目的としたアクセラレータの相乗効果と原理の探求,バイオマスから得られるバイオガスで発電を行うメタン発酵システムは、災害時の非常用電源としても期待されている。研究代表者らは、災害時に適した可搬式メタン発酵システムを開発した。このシステムでは、災害時に必要とする場所へ移送した際、メタン発酵の迅速な再起動が重要となる。本研究では可搬式メタン発酵システムの再起動期間を短縮するアクセラレータの開発を目的とする。アクセラレータは2つの要素からなる。1つは食品廃棄物から作製する発酵助剤、もう1つは導電性素材を担体として用いることである。これらの相乗効果により再起動期間の短縮が期待できる。加えて平常時においてもメタン発酵システムの効率の向上が見込める。,基盤研究(B),小区分64050:循環型社会システム関連,メタン発酵,減災対策,再生可能エネルギー,発酵助剤,粒状活性炭,可搬式メタン発酵システム,活性炭,例廉価システム,低廉化システム,電圧印加効果,,,,,,,,,,,,,,,,,,,,,,,,,,,,,,,,,,,,,,,,,,,,,,
21H03661,名古屋大学,日比野 高士,都市廃棄物発電の高効率化を図るダイレクト廃棄物燃料電池の開発,都市固形廃棄物（MSW）は現在、再使用・リサイクル、生物学的処理、熱処理および埋立によって管理されている。本研究では、MSWを燃料に使用した高効率なwaste-to-energy発電を目指して、新たにダイレクトMSW燃料電池を提案する。原理的には、MSWが電解質からの酸化物イオンによって酸化と改質反応を繰り返し、持続的且つ効率的に発電が継続され、燃料が処理される。これを実現するためには、固体燃料に対して触媒活性、電極構造、イオン伝導が協奏的に作用する必要がある。このような技術が確立すれば、従来法よりも高い発電効率が実現され、廃棄物、エネルギーさらには温暖化問題の解決に貢献し、持続可能な循環型社会の実現に寄与できる。,基盤研究(B),小区分64050:循環型社会システム関連,都市固体廃棄物,燃料電池,高効率発電,電極触媒,バイオマス,発電,都市ゴミ,エネルギー回収,再資源化,エネルギー,触媒,脱炭素,,,,,,,,,,,,,,,,,,,,,,,,,,,,,,,,,,,,,,,,,,,,
21H03659,弘前大学,井岡 聖一郎,湧水の微生物硫酸還元反応有効エネルギー解析とそれに基づく新規地熱探査法の構築,地熱発電の有望地を見つけるためには，地下の熱水・蒸気が賦存している断層，割れ目からなる断裂構造の評価のために様々な探査を行う。熱水は火山活動により発生するため，熱水に含まれる火山活動由来の硫化水素が深部断裂の存在を示唆する指標と考えられるが，低温湧水に含まれる硫化水素は，微生物硫酸還元反応の生成物である可能性もある。したがって，低温湧水中に含まれる硫化水素が火山活動起源か微生物活動起源か判定させる新しい指標作りが急務である。,基盤研究(B),小区分64050:循環型社会システム関連,地熱探査,湧水,硫酸還元,微生物,地熱,北八甲田火山群,硫黄,硫酸還元反応,有効エネルギー,探査法,硫化水素,火山,水質,,,,,,,,,,,,,,,,,,,,,,,,,,,,,,,,,,,,,,,,,,,
23K25060,国立研究開発法人産業技術総合研究所,佐藤 修,新規層間剥離技術による複合プラスチックフィルムリサイクルシステムの構築,本研究では、①超臨界二酸化炭素処理による低温条件下での各ポリマー層分離、②超臨界二酸化炭素／水処理による無機素材剥離、③マテリアルリサイクルに向けた分離処理済の基盤プラスチックの物性評価、④ケミカルリサイクルに向けた基盤プラスチック（PET、ナイロン）の加水分解を行い、分離および剥離効果の検証を行う。更に、⑤得られた知見を基に、プロセスシミュレーターによる各モデル工程のエネルギー収支計算を行い、環境調和型の複合プラスチックフィルムリサイクルシステムとしての提案を行う。,基盤研究(B),小区分64050:循環型社会システム関連,物質循環システム,プラスチックリサイクル,水熱処理,超臨界二酸化炭素利用,層剥離,低環境負荷技術,,,,,,,,,,,,,,,,,,,,,,,,,,,,,,,,,,,,,,,,,,,,,,,,,,
23K25059,立命館大学,橋本 征二,脱炭素化に向けた資源効率・循環経済戦略：その評価手法と将来シナリオ,脱温暖化と資源効率・循環経済の2つの取組を統合していくことが求められているなかで、資源効率・循環経済に向けた各種取組の脱炭素化への貢献を評価するとともに、資源効率・循環経済と脱炭素化に関わるマクロな将来シナリオを構築する。また、シェアリングやサブスクリプション等の資源効率・循環経済に向けた「新しい」取組のライフサイクル的な評価手法が十分確立していないことから、その評価手法(比較対象の設定や評価範囲等に関する標準的な考え方)を確立する。,基盤研究(B),小区分64050:循環型社会システム関連,ライフサイクル評価,シェアリング,サブスクリプション,カーボンニュートラル,,,,,,,,,,,,,,,,,,,,,,,,,,,,,,,,,,,,,,,,,,,,,,,,,,,,
23K25058,日本大学,中野 和典,下水処理の脱炭素化と高度化に資する人工湿地技術の開発とパイロットスケールでの検証,"本研究では、下水処理場に設置したパイロットスケールの人工湿地に機能性ろ材や機能性微生物を活用した最先端技術を適用し、実規模で達成可能な下水処理原単位やカーボンフットプリントを定量化する。その成果により、更新時期を迎えつつある全国5,100ヵ所の農業集落排水施設に人工湿地を導入した場合に達成可能な脱炭素効果と必要面積の試算が可能となるだけでなく、資源循環の改善、下水処理の高度化、汚泥処理の簡易化、維持管理費用の低減化への新たな道筋が切り開かれるため、農業集落排水施設の持続可能な開発目標（SDGs）に貢献することができる。",基盤研究(B),小区分64050:循環型社会システム関連,人工湿地,脱炭素化,アナモックス細菌,ライフサイクルアセスメント,干満流,下水処理原単位,干満流人工湿地,アナモックス菌,下水処理,農業集落排水,機能性微生物,,,,,,,,,,,,,,,,,,,,,,,,,,,,,,,,,,,,,,,,,,,,,
23K25057,大阪公立大学,山田 亮祐,微細藻共培養系による高度排水処理および細胞残渣のカスケード利用,化学肥料に代わり、環境負荷の低い微生物肥料が高い注目を集めている。微生物肥料の中でも特に微細藻は、その増殖過程で、大気中の二酸化炭素を固定することから、温室効果ガス削減の観点からも注目されている。また、微細藻の培養に排水を用いることで、一般的な活性汚泥法では除去困難なリンや窒素を除去する高度排水処理の検討も進められている。,基盤研究(B),小区分64050:循環型社会システム関連,水処理,有用物質生産,微細藻,酵母,バクテリア,光合成,共培養,アスタキサンチン,,,,,,,,,,,,,,,,,,,,,,,,,,,,,,,,,,,,,,,,,,,,,,,,
23K25056,京都大学,由里本 博也,C1微生物代謝生理を活用した炭素循環型メタノールバイオエコノミーの構築と分子基盤,2050年脱炭素社会に向けて、炭素資源を循環的に利用する持続可能な社会経済システムの構築が喫緊の課題となっている。本研究では、メタンやメタノールなどのC1化合物や、これらを利用するC1微生物を炭素循環型メタノールバイオエコノミーで最大限活用するために、「メタンからメタノールへの変換プロセス」と「メタン・メタノールからの有用物質生産」に関する新技術開発を行い、その開発の基盤となるC1微生物の代謝生理機能の分子基盤を解明する。,基盤研究(B),小区分64050:循環型社会システム関連,環境技術,応用微生物,バイオテクノロジー,発現制御,生体機能利用,メタン酸化,メタノール誘導,メタノール酵母,,,,,,,,,,,,,,,,,,,,,,,,,,,,,,,,,,,,,,,,,,,,,,,,
23K25055,東京大学,中谷 隼,物質間ネクサスの統合的分析・評価モデルの開発と食品・プラスチックネクサスへの適用,食品廃棄と使い捨てプラスチックの削減は，いずれも喫緊の課題である。物質の消費から廃棄に至る環境影響の評価には物質フロー分析（MFA）およびライフサイクル評価（LCA）が有用であるが，食品とプラスチックのような性質の異なる物質間の関わり（ネクサス）を統合的に分析・評価するためのフレームワークは確立されていない。,基盤研究(B),小区分64050:循環型社会システム関連,食品廃棄,使い捨てプラスチック,ごみ組成調査,物質フロー分析,ライフサイクル評価,容器包装,カトラリー,樹脂別組成,,,,,,,,,,,,,,,,,,,,,,,,,,,,,,,,,,,,,,,,,,,,,,,,
23K25054,宇都宮大学,有賀 一広,日本全国の長期的な森林バイオマス利用可能量算定モデルの構築と環境影響評価,本研究では最新の収穫・更新費用、路網整備費用や森林成長量、木材価格、災害対策費用などを考慮して、各林分に適した50～100年程度の伐期や間伐などの施業体系を明らかにし、これらの施業体系を基に日本全国の長期的な森林バイオマス利用可能量算定モデルを構築する。さらに、経済性のみならず、林業機械や発電所等の更新状況に関して調査し、長期的なエネルギー収支分析やライフサイクル環境影響評価を行う。,基盤研究(B),小区分64050:循環型社会システム関連,未利用木材,収穫・更新費用,路網整備費用,災害対策費用,環境影響評価,,,,,,,,,,,,,,,,,,,,,,,,,,,,,,,,,,,,,,,,,,,,,,,,,,,
23K25053,東北大学,横山 俊,酸化物フリーCuナノワイヤが実現する完全塗布型太陽電池,塗布型ペロブスカイト太陽電池に関して、電池構成材料である透明導電膜、裏面電極に関しては塗布による形成が行われていない。そこで、これらの電極を代表者が開発している銅ナノワイヤなどのナノ材料を基礎に塗布によって形成することで、安価かつ高性能な完全塗布型太陽電池形成を目指す。また、太陽電池として長時間動作させる上で、銅のナノ材料は既存の安定な金属酸化物透明導電膜に対して、酸化やペロブスカイト結晶中のハロゲンの微量な拡散によっても劣化することから、安定性向上が必須であり、貴金属や金属酸化物による銅ナノ材料の被覆による安定性向上についても同時に研究開発を行う。,基盤研究(B),小区分64050:循環型社会システム関連,Cuナノワイヤ,ペロブスカイト,太陽電池,透明電極,裏面電極,銅ナノワイヤ,銀,酸化亜鉛,表面被覆,酸化物,透明導電膜,耐久性,導電性,接触,接合,ヒドロキシ酸,酸化・還元,室温接合,ネットワーク膜,電気伝導率,,,,,,,,,,,,,,,,,,,,,,,,,,,,,,,,,,,,
23K28287,東邦大学,今野 大輝,廃棄物由来多孔性錯体結晶の合成と性能革新に基づく新規水質浄化システムの構築,"多孔性錯体結晶である金属有機構造体 (Metal-Organic Frameworks, MOFs) は従来の多孔性材料に比べて材料設計が容易であり、様々な特性を制御できることから、次世代の分子分離材料として大きな注目を集めている。本研究ではこのMOFs合成の低コスト化・多様化を目指し、廃棄物や低品位資源を出発原料とする合成法を確立する。これらの多孔性錯体結晶の物理化学的特性を汚染物質の特性に応じて選択・制御することで、高速・高容量・高選択性を有する新規吸着剤の実現に挑む。そしてそれらを吸着・分解プロセスとして組み込んだ新たな水質浄化システムを構築し、材料・プロセスの両面で設計指針を獲得する。",基盤研究(B),小区分64050:循環型社会システム関連,多孔性錯体結晶,金属有機構造体,MOF,水質浄化,吸着除去,PETボトル,アルミニウムドロス,,,,,,,,,,,,,,,,,,,,,,,,,,,,,,,,,,,,,,,,,,,,,,,,,
23K28286,滋賀県立大学,吉川 直樹,里山広葉樹林の管理を考慮した持続可能な農林業連携モデルの実証研究,本研究では里山資源の適切な管理のために、里山でのバイオマス生産と環境保全型農業との高度な連携を構築することを提案する。森林管理や施肥管理手法等を、土壌や圃場のモニタリングおよび森林計画手法により最適化するとともに、温室効果ガス削減等の環境価値を活用することにより、環境的・経済的に持続可能なモデルを実証・提示することを目的とする。里山広葉樹林における炭素吸収・バイオマス生産の予測と評価、森林資源を活用した環境保全型農業の土壌肥沃度指標や圃場モニタリングによる高度化と評価、提案モデル全体での物的フロー・経済フローの推計などを総合して、農林業連携モデルの持続可能性を検証する。,基盤研究(B),小区分64050:循環型社会システム関連,森林バイオマス,農林業連携,資源循環,ライフサイクルアセスメント,土壌肥沃度,,,,,,,,,,,,,,,,,,,,,,,,,,,,,,,,,,,,,,,,,,,,,,,,,,,
23K28285,九州大学,田代 幸寛,SDGsに資するメタ発酵基盤技術・理論の構築と複合微生物工学への体系化,複合微生物系によるメタ発酵法；『複合微生物系による有価物生産のための発酵法』は、従来の純粋微生物系よりも優れたメリット（複数基質の利用、雑菌汚染の耐性、殺菌設備の省略等）により、環境保全、未利用資源の循環利用などSDGsに資する技術として期待されている。以前は、微生物叢解析の複雑性・難易度などにより、研究遂行の障壁となっていたが、近年の網羅的微生物叢解析技術の発達により、メタ発酵研究で新たな発見がなされつつある。本研究では、光学活性L-乳酸のメタ発酵生産をモデル系としてその制御方法や最適化とともに、遺伝子発現解析・代謝解析による微生物機能を理解するとともに、『複合微生物工学』の体系化を図る。,基盤研究(B),小区分64050:循環型社会システム関連,複合微生物工学,メタ発酵,微生物叢,微生物機能,微生物代謝,複合微生物系,有機酸生産,バイオプロセス,,,,,,,,,,,,,,,,,,,,,,,,,,,,,,,,,,,,,,,,,,,,,,,,
23K28284,大阪大学,井上 大介,捕食性細菌による可溶化処理を核とした下水汚泥嫌気性消化の高度化,本研究では、捕食性細菌を活用した汚泥可溶化処理により、余剰汚泥からの高効率かつ高収率なメタン回収が可能な嫌気性消化システムを確立することを目指し、①余剰汚泥の可溶化に有望な捕食性細菌を探索し、②ゲノム解析及び溶菌作用のキーファクターの特定等により、それらの溶菌特性を詳細に解析するとともに、好適な培養条件を明らかにする。その上で、③有望な捕食性細菌を用いた汚泥可溶化処理を最適化し、④嫌気性膜分離バイオリアクターと連結した新規嫌気性消化システムを構築して、余剰汚泥からのメタン回収の高効率化及び高収率化を達成し得ることを検証する。,基盤研究(B),小区分64050:循環型社会システム関連,捕食性細菌,余剰汚泥,可溶化,嫌気性消化,,,,,,,,,,,,,,,,,,,,,,,,,,,,,,,,,,,,,,,,,,,,,,,,,,,,
23K28283,東北大学,琵琶 哲志,液体ピストンエンジンと往復流型タービンを用いた単純構造の発電システムの開発,液体ピストンエンジンは温度差によって作動流体の自励振動を発生し，往復流型タービンは往復振動流のエネルギーを機械的回転運動のエネルギーに変換する．,基盤研究(B),小区分64050:循環型社会システム関連,熱音響デバイス,往復流型タービン,エネルギー変換,低動作温度差,液体ピストンエンジン,熱音響自励振動,スターリングエンジン,外燃機関,,,,,,,,,,,,,,,,,,,,,,,,,,,,,,,,,,,,,,,,,,,,,,,,
23K28282,東北大学,石本 淳,Peer to Peer多相水素エネルギーシステムに関する連成科学的アプローチ,本研究では，CO2 フリーのクリーンなエネルギーである水素の高密度多相化に着目し，Peer to Peer (P2P) 型多相水素エネルギーサプライチェーンの構築，エネルギーキャリアとして化石燃料と同等のエネルギー密度を得るための水素高密度化ならびにレジリエントな水素安全管理技術の開発を目的とした，混相流体力学，破壊力学，材料力学，燃焼工学を基盤とした異分野融合型研究を推進する．具体的に新型水素供給・貯蔵法に関してはグラフ理論を用いたカーボンニュートラルP2Pマルチグリッド型の相互補償を可能にする多相水素サプライチェーンの構築を検討する．,基盤研究(B),小区分64050:循環型社会システム関連,混相流,水素エネルギー,極低温,リスク科学,数値解析,,,,,,,,,,,,,,,,,,,,,,,,,,,,,,,,,,,,,,,,,,,,,,,,,,,
23K28281,北海道教育大学,松浦 俊彦,異種の海洋バイオマス複合化による広域波長色素増感太陽電池の創製,循環型社会および低炭素社会の構築が求められているなか、バイオマスの高度利用は大きな柱の一つであるが、異種のバイオマスの特性を生かして高度利用する要素技術は十分に確立されていない。本研究では、異種の海洋バイオマス「イカ墨」と「キトサン」を複合化させることで、電気的性質を利用した高い選択吸着能を有する黒色系色素粒子を創製し、広域波長吸収能を利用することで色素増感太陽電池を高効率化することを目的とする。本研究は異種の海洋バイオマスそれぞれの特性を有機的に組み合わせて再生可能エネルギーを生み出す新しい手法を開発するもので、環境問題に真に貢献するイカ資源ゼロエミッション化を先導するアプローチとなる。,基盤研究(B),小区分64050:循環型社会システム関連,海洋バイオマス,色素増感太陽電池,イカ墨,ゼロエミッション,キトサン,,,,,,,,,,,,,,,,,,,,,,,,,,,,,,,,,,,,,,,,,,,,,,,,,,,
24K03143,国立研究開発法人海洋研究開発機構,斉藤 和之,氷室・風穴（自然冷熱エネルギー）の機能を地域環境保全へ還元する再エネ利用研究,地域環境に根ざした自然冷熱利用の営みは国内で千年以上の歴史を持ち、国内外に様々な目的・形態の施設が存在するが、その再エネ可能性に比して利用事例は減少している。,基盤研究(B),小区分64050:循環型社会システム関連,再生可能エネルギー利用,雪氷・凍土（自然冷熱エネルギー）,地域環境保全,学際研究・超学際研究,,,,,,,,,,,,,,,,,,,,,,,,,,,,,,,,,,,,,,,,,,,,,,,,,,,,
24K03142,国立研究開発法人国立環境研究所,渡 卓磨,全世界における物質フロー構造と脱炭素経路の解明,素材生産に伴う温室効果ガス排出は年々増加の一途を辿っており、脱炭素化が急務である。しかし「脱炭素社会の実現において世界各国は素材をどのように加工・利用・循環させる必要があるのか」は科学的に明らかになっておらず、関係主体の一体的取り組みを支援できていない。本研究は、脱炭素社会の必須素材である鉄鋼・コンクリート・木材・希少金属を対象に、全世界における物質フロー構造と脱炭素化経路を解明することを目的とする。研究成果は、関係主体の責任と機会を具体化すると共に、世界的な物質フロー構造の転換に向けた国際的議論を喚起する。,基盤研究(B),小区分64050:循環型社会システム関連,脱炭素,鉄鋼,コンクリート,木材,,,,,,,,,,,,,,,,,,,,,,,,,,,,,,,,,,,,,,,,,,,,,,,,,,,,
