awardnumber,organization,name,title,abstract,section,review_section,keyword1,keyword2,keyword3,keyword4,keyword5,keyword6,keyword7,keyword8,keyword9,keyword10,keyword11,keyword12,keyword13,keyword14,keyword15,keyword16,keyword17,keyword18,keyword19,keyword20,keyword21,keyword22,keyword23,keyword24,keyword25,keyword26,keyword27,keyword28,keyword29,keyword30,keyword31,keyword32,keyword33,keyword34,keyword35,keyword36,keyword37,keyword38,keyword39,keyword40,keyword41,keyword42,keyword43,keyword44,keyword45,keyword46,keyword47,keyword48,keyword49,keyword50,keyword51,keyword52,keyword53,keyword54,keyword55,keyword56
23KJ0849,國學院大學,野池 優太,近世の中部山岳地帯における馬方稼ぎの歴史地理学的研究ー生業としての視点から,本研究は、信州で行われた馬方稼ぎの特質を検討することを通じて、交換経済に基づく生業が人びとの生活を維持する手段としてどのように位置づけられてきたのかを明らかにする。このために①農民の生業における馬方稼ぎの位置付け②農民の馬方稼ぎに対応した交易拠点の特質③馬方稼ぎにかんする諸制度の形成とその特質、この三点を明らかにする。生産活動による自給経済的な生業のみならず、消費活動による交換経済的な生業によっても人びとの生活が維持されてきた事実を明らかにすることで、近世の農民の再生産構造の再検討を行う。,特別研究員奨励費,小区分04020:人文地理学関連,中馬,役畜,馬背運搬,駄賃稼ぎ,,,,,,,,,,,,,,,,,,,,,,,,,,,,,,,,,,,,,,,,,,,,,,,,,,,,
23KJ0380,東京大学,住吉 康大,日本における移動生活者が有する場所感覚の地理学的研究,近年、COVID-19の流行でリモートワークが普及したこともあり、働く場所の制約は小さくなっている。さらに、地方創生などの動きとも関係し、都市を離れて暮らしたいと考える人々も多い。これらの背景から、「アドレスホッパー」などと呼ばれる、各地を移動しながら暮らすという生活に注目が集まっている。本研究では、そのような生活の中で様々な地域がどのように認識され相互に影響を与えるのか、実際に移動しながら暮らす人々の日記などを参考に考察する。,特別研究員奨励費,小区分04020:人文地理学関連,定額住み放題サービス,移動生活,地方創生,ライフスタイル,日記調査,場所感覚,,,,,,,,,,,,,,,,,,,,,,,,,,,,,,,,,,,,,,,,,,,,,,,,,,
23KJ0370,東京大学,宮澤 美恵子,自然保全と自然利用が両立するメカニズムの解明：コモンズの悲劇を乗り越えて,本研究はキリマンジャロ山を事例に「自然保護(守る)」と「資源利用(使う)」が両立できる仕組みを検討する。GISで可視化された緩衝林地の森林増加の要因を分析するため、地域社会の営みと役割を地上から観測する。事前調査から現地の営みは言語や産業等が多様であり、植林活動の実施戦略（不参加者への罰金有無）や、外来種または在来種の樹種選択についても、地域ごとに違いがあることが示唆された。この多様性の出現の原因を捉えるため、大規模なクロスセクションデータを収集するフィールド調査を実施する。結果、持続的なコモンズ管理の条件となる外生的要素（水資源量、地形等）と内生的要素（主要産業、信条等）の解明が期待される。,特別研究員奨励費,小区分04020:人文地理学関連,コモンズ,緩衝林地,森林保護区,GIS,家計調査,価値観調査,先住民,30by30,,,,,,,,,,,,,,,,,,,,,,,,,,,,,,,,,,,,,,,,,,,,,,,,
23KJ0114,東北大学,木戸口 智明,東北地方における農家の世代交代と水田農業の再編方向,本研究の目的は、東北地方を事例に大規模水田農業経営の組織形態の地域性が生じる要因を明らかにすることを通じて、農家の世代交代期における水田農業の再編方向を提示することである。具体的には、各地域における農業労働力の残存状況に着目しながら、離農して農地を貸付に至る農地供給層と、離農者の農地を集積する農地需要層との双方の視点から、大規模経営体が形成されるプロセスについて実証的に明らかにする。,特別研究員奨励費,小区分04020:人文地理学関連,水田農業,構造再編,規模拡大,農地集積,経営形態,法人化,東北地方,,,,,,,,,,,,,,,,,,,,,,,,,,,,,,,,,,,,,,,,,,,,,,,,,
23KJ0095,東北大学,小坪 将輝,出生コホートとライフコースに着目した日本の国内人口移動の時空間分析,人口移動は地域の人口規模や構成を変化させる主たる要因の1つである。日本においては総人口の減少を背景として、移動の結果への関心が高まっているものの、移動の意思決定や移動先の決定に影響を及ぼす要因、時代による変化など、現象としての人口移動のメカニズムは十分に検証されていない。本研究では、ライフコースの視点からみた人口移動のメカニズムの解明とこれまでの日本の国内人口移動に関する包括的なフレームワークの構築を目指す。,特別研究員奨励費,小区分04020:人文地理学関連,国内人口移動,ライフコース,出生コホート,,,,,,,,,,,,,,,,,,,,,,,,,,,,,,,,,,,,,,,,,,,,,,,,,,,,,
24KF0178,筑波大学,森本 健弘,世界の大都市における湿地生態系サービスのシナリオモデリングと潜在的解決策,"This study aims to create a method to measure the benefits of wetland ecosystem services (WES) under current and future land use/cover (LULC) change scenarios for 2030 and 2050. Using GIS and remote sensing, it will analyze LULC changes, develop wetland protection scenarios, and assess their economic and social benefits. The approach will be applied to five megacities in the Global South to recommend sustainable WES strategies.",特別研究員奨励費,小区分04020:人文地理学関連,,,,,,,,,,,,,,,,,,,,,,,,,,,,,,,,,,,,,,,,,,,,,,,,,,,,,,,,
25KJ1542,京都大学,吉田 彬人,16・17世紀日本における工業の歴史地理学的研究,本研究は、技術革新や量産化などによる飛躍的な発展が指摘される16・17世紀の日本における工業の構造を、空間的な視点から明らかにすることを目的とする。地理学の視点と方法論を導入し、個々の担い手から都市・村落、領国・藩領、列島まで重層的に展開するスケールを射程に複数の地域を対象に分析を行うことで、複雑化・高度化を遂げつつあった当該期の日本における工業の構造の解明を目指す。,特別研究員奨励費,小区分04020:人文地理学関連,,,,,,,,,,,,,,,,,,,,,,,,,,,,,,,,,,,,,,,,,,,,,,,,,,,,,,,,
25KJ1484,京都大学,小林 夕莉,バングラデシュ農村社会における「病い」と医療,本研究では、バングラデシュの農村社会における人々の「病い」の経験と治療のあり方を明らかにする。「病い」は医師によって診断される「疾病」よりも幅広く、不定愁訴や社会的な病いを含んだ幅広い概念である。また、本研究では「病い」経験の背景にある、自然環境，文化的規範，宗教などの観点にも着目する。人々の視点から医療の変化を通時的に検討することを通じて，今後の医療体制の改善に有用な示唆を得る。,特別研究員奨励費,小区分04020:人文地理学関連,,,,,,,,,,,,,,,,,,,,,,,,,,,,,,,,,,,,,,,,,,,,,,,,,,,,,,,,
25KJ1159,東京大学,柴田 卓巳,戦後における幹線鉄道の役割変化と交通体系の再編に関する国際比較研究,車社会化（モータリゼーション）によって陸上交通における鉄道の地位が低下すると共に、自家用車の役割が増大するという現象は、日本だけでなく多くの国で共通している。しかし、それに応じた公共交通側の再編過程は国によって異なっていた。本研究では、日本、韓国、ドイツを事例として、車社会化による鉄道の地位低下への対応過程とその要因を明らかにし、当時の選択が現在の公共交通にも大きな影響を与えていることを示す。その上で、今後の公共交通のあり方について検討する。,特別研究員奨励費,小区分04020:人文地理学関連,,,,,,,,,,,,,,,,,,,,,,,,,,,,,,,,,,,,,,,,,,,,,,,,,,,,,,,,
25KJ0575,東北大学,XIAN ZHENG,近隣の緑地と社会的不利な集団のメンタルヘルスに関する系統的診断,日本社会においては、社会経済的に脆弱な集団が一般集団と比較してより深刻な精神健康問題に直面している現状がある。緑地空間は精神健康の改善に寄与することが示唆されているものの、その効果は個人差により異なる。本研究では大規模調査データ（出生コホートデータを含む）を活用し、系統的な緑地空間暴露評価方法を用いて、日本の社会経済的弱者における居住地域の緑地空間と精神健康の関連性を検証する。さらに、関連する生理学的メカニズムと作用経路を解明し、包括的な緑地空間暴露評価フレームワークの開発を目指す。これにより、多様なニーズに対応した効果的かつ包括的な緑地政策の形成に科学的根拠を提供する。,特別研究員奨励費,小区分04020:人文地理学関連,,,,,,,,,,,,,,,,,,,,,,,,,,,,,,,,,,,,,,,,,,,,,,,,,,,,,,,,
