awardnumber,organization,name,title,abstract,section,review_section,keyword1,keyword2,keyword3,keyword4,keyword5,keyword6,keyword7,keyword8,keyword9,keyword10,keyword11,keyword12,keyword13,keyword14,keyword15,keyword16,keyword17,keyword18,keyword19,keyword20,keyword21,keyword22,keyword23,keyword24,keyword25,keyword26,keyword27,keyword28,keyword29,keyword30,keyword31,keyword32,keyword33,keyword34,keyword35,keyword36,keyword37,keyword38,keyword39,keyword40,keyword41,keyword42,keyword43,keyword44,keyword45,keyword46,keyword47,keyword48,keyword49,keyword50,keyword51,keyword52,keyword53,keyword54,keyword55,keyword56
19J22325,京都大学,藏田 典子,福島原発事故による避難者の「故郷喪失」プロセスの解明ー移動と支援に着目してー,"福島原発事故による避難者の「故郷喪失」に至るプロセスを、移動過程と各自治体の支援格差という点に着目し、明らかにすることである。原発事故による避難者は、全国47都道府県1,040の市区町村に所在しているものの、避難者への支援内容は各自治体に一任されたため、支援格差が生じた。各自治体の支援内容を比較し、支援が縮小された時期と支援格差の実態を把握する。自治体による支援内容がどのように避難者に影響を与え、支援内容が避難者の移動選択そして、故郷喪失にどう関わっているのか明らかにする。",特別研究員奨励費,小区分04020:人文地理学関連,故郷,故郷喪失,移動,強制的な移動,ディアスポラ,震災,行政支援,東日本大震災,福島原発事故,,,,,,,,,,,,,,,,,,,,,,,,,,,,,,,,,,,,,,,,,,,,,,,
19J20678,筑波大学,岩井 優祈,巨大津波による社会リスクの地域的差異と最適な避難行動,本研究では地域住民の避難行動特性について，巨大地震・津波災害の時空間変化との関係性および理論的に最適な避難行動との差異を明らかにする．,特別研究員奨励費,小区分04020:人文地理学関連,津波,避難,認知と行動,空間分析,地理情報システム,GIS,東日本大震災,南海トラフ巨大地震,都市構造,フィールドワーク,,,,,,,,,,,,,,,,,,,,,,,,,,,,,,,,,,,,,,,,,,,,,,
19J20374,筑波大学,川添 航,東アジア地域社会における宗教共同体の変容過程と要因に関する地理学的研究,経済成長や産業化により変容が進むアジア地域において，宗教のグローバル化や宗教組織によ,特別研究員奨励費,小区分04020:人文地理学関連,宗教活動,国際移住,東アジア,キリスト教会,社会関係,国際結婚,宗教地理学,在留フィリピン人,カトリック教会,韓国のキリスト教,在韓日本人,,,,,,,,,,,,,,,,,,,,,,,,,,,,,,,,,,,,,,,,,,,,,
19J14588,京都大学,谷口 晴彦,空間スケールから捉えた農業用水管理に関する農村地理学研究,現代日本の農業水利は，管理地域の大規模化や非農業主体と深く関係する。農業水利に関わる主体の増加，それらの関係性の複雑化を背景として，地域的な事象や課題の把握が進んでいない。これらの把握には，大小様々な空間的広がりをもつ主体・事象の相互関連性に着目する必要がある。本研究の目的は，空間スケールの視点から，集落から農業水利管理地区全体，流域全体や国家スケールに至る多様な主体・事象の相互関連性に着目し，農村における地域的な課題の明確化とその課題の解決策を示すことである。,特別研究員奨励費,小区分04020:人文地理学関連,農業水利,維持管理,スケール,行政領域,水利研究,農村地理学,,,,,,,,,,,,,,,,,,,,,,,,,,,,,,,,,,,,,,,,,,,,,,,,,,
19J13558,京都大学,岡田 眞太郎,公共サービスにおけるガバナンスから解明する非営利組織の地理的不均等分布,地方分権化と民営化が推進される日本において、多元的なアクターによるガバナンス型の公共サービス供給のあり方が模索されている。その参加アクターの一つである非営利組織は、先駆性・柔軟性の特徴を持つ一方、地理的に不均等に分布しているため、地域で異なるサービス供給体制を理解する上で重要な存在である。そこで、非営利組織の地理的不均等分布を明らかにするためにも、複数アクターの関係性に着目して、公共サービスにおける供給体制の地域差を比較検討することを本研究の目的とする。具体的には、特定の公共サービスの事例として生活困窮者支援を取り上げ、そこで現出するガバナンスの形態と形成過程を比較検討する。,特別研究員奨励費,小区分04020:人文地理学関連,,,,,,,,,,,,,,,,,,,,,,,,,,,,,,,,,,,,,,,,,,,,,,,,,,,,,,,,
19J12163,首都大学東京,BETTAIEB BOCHRA,外国旅行者のための案内情報の提供と利用に関する都市間比較,本研究は，日本を訪れる外国人旅行者向け案内情報の実態を明らかにし，その問題点と対策を検討することを目的とする。そのために，下記の3点に焦点を当てる．,特別研究員奨励費,小区分04020:人文地理学関連,観光行動,機械学習,ソーシャルメディア,地理情報システム,ナビゲーション,サインシステム,,,,,,,,,,,,,,,,,,,,,,,,,,,,,,,,,,,,,,,,,,,,,,,,,,
19J11409,筑波大学,王 汝慈,東京大都市圏における土地利用変化のシナリオ分析と将来予測モデルリング,"This study examines the changes of land use/cover in the Tokyo metropolitan area (TMA) from 2007 to 2017. I plan to predict the patterns of spatial change in 2027 and 2037 by employing cellular automata and the Markov model under three scenarios:spontaneous, sub-region development, and green space improvement.",特別研究員奨励費,小区分04020:人文地理学関連,Scenario simulation,Land surface temperature,Land use and land cover,Remote sensing,GIS,Land use/cover,Tokyo metropolitan area,Spatiotemporal analysis,,,,,,,,,,,,,,,,,,,,,,,,,,,,,,,,,,,,,,,,,,,,,,,,
19J10769,京都大学,夏目 宗幸,地理情報科学的接近による近世武蔵野の地誌学研究,本研究は、地理情報システム（GIS）による空間解析の手法を用いながら江戸圏に内包される近世武蔵野の村落構造の理解に新たな知見を加えることを目的としている。主たる分析対象地として明暦大火後に開拓された千町野（杉並区、武蔵野市、三鷹市周辺）を選択し、地割復原、風況シミュレーション、水文分析を通じて、近世新田集落の自然景観及び文化景観を復原する。この研究により、既存の史料分析によって明かされなかった近世の人々の生活の工夫及び江戸圏の実態を解明する。,特別研究員奨励費,小区分04020:人文地理学関連,歴史GIS,歴史地理,新田開発,幕領支配,武蔵野,江戸,鷹場,検地,,,,,,,,,,,,,,,,,,,,,,,,,,,,,,,,,,,,,,,,,,,,,,,,
19J01824,国立民族学博物館,崎田 誠志郎,東地中海域における小規模漁業の漁場利用生態と漁場管理制度の統合的解明,沿岸域で営まれる小規模漁業は、地域の社会経済の安定や文化の継承において重要な役割を担っている。日本のみならず、世界各地における小規模漁業の実態を明らかにし、そこで生じている諸現象を地域の文脈に即して検証することで、小規模漁業を通じた自然と人間の関係性についてより広く深い知見が得られると期待される。,特別研究員奨励費,小区分04020:人文地理学関連,小規模漁業,地中海,ギリシャ,漁業管理,,,,,,,,,,,,,,,,,,,,,,,,,,,,,,,,,,,,,,,,,,,,,,,,,,,,
19F19773,京都大学,秋津 元輝,地域ブランド化による日本農業の活性化：多様なステークホルダーの関わりに注目して,日本における農産物の地理的表示制度が地域社会・経済の振興とどのように関連するのかについて、具体的なフィールド調査を基礎として、経済的な効果だけでなく、地域の誇りや移住者も含めた地域の存続という観点から明らかにする。とくに、地鶏に代表される地理的表示とつながった特産物に集中して研究をおこなう。まず、地域特産物と地域振興との関連についての研究枠組みを精緻化する。それに基づき対象地と対象品目を設定してフィールド調査を実施し、地域の誇りの再生という観点も含めて地域振興との連関を明らかにする。それらの成果は、国際的な研究動向と接合しながら内外に公表し、日本における地方振興策を世界水準で提案する。,特別研究員奨励費,小区分04020:人文地理学関連,新型コロナウイルス感染拡大,特産畜産物,畜産物消費行動,オルタナティブ食システム,ローカル食システム,地域活性化,地理的表示,食料・農業遺産,食文化,,,,,,,,,,,,,,,,,,,,,,,,,,,,,,,,,,,,,,,,,,,,,,,
19F19306,立命館大学,矢野 桂司,RSとGISを用いたアレクサンドリアの持続的発展のための考古学的水路システム復原,本共同研究の目的は、最先端のRSとGISの技術を活用して、アレクサンドリアの考古学的価値の高い水路システムをはじめとする考古資源のデジタル・アーカイブを作成し、2030年以降のアレクサンドリアの持続的な都市発展の将来計画に資するシステムをジオデザインの枠組を用いながら構築しようとするものである。,特別研究員奨励費,小区分04020:人文地理学関連,GIS,リモートセンシング,文化資源,ジオデザイン,アレクサンドリア,考古学的水路システム,,,,,,,,,,,,,,,,,,,,,,,,,,,,,,,,,,,,,,,,,,,,,,,,,,
19F19305,筑波大学,森本 健弘,急速に都市化する南アジア大都市における都市域拡大とそれが都市災害に与える影響,急激に都市化が進む南アジアの大都市では洪水や都市内部の気温上昇といった「都市災害」により居住環境が悪化している。この研究では都市化と都市災害の関係を時間的・地理的に解明する。都市災害の顕著な大都市からムンバイ、カラチ、コロンボ、ダッカを選び、そこで都市化の進展パターン、都市化の牽引力とその分布、都市災害の時間的・空間的な分布を把握し、それらの相互関係を分析する。同時に都市災害が都市の持続可能な発展に与える悪影響を定量化する。研究成果とデータをWebを用いて公開し、都市計画関係者の利用に提供することにより、この研究は持続的な都市の発展に貢献する。,特別研究員奨励費,小区分04020:人文地理学関連,都市化,都市災害,土地利用・土地被覆,洪水,ヒートアイランド,南アジア,持続的な都市開発,urbanization,urban disaster,land use and land cover,landscape change,flood,South Asian Countries,sustainable urban planning,,,,,,,,,,,,,,,,,,,,,,,,,,,,,,,,,,,,,,,,,,
20J14952,京都大学,三好 志尚,中近世における港町の空間構造研究,本研究は日本の中近世の港町に関して、港の機能とそれに付随する町の関係を景観を通して明らかにすることを目的とする。港町景観の変化の実態として着船・荷揚げ・取引などの経済活動に関わる港湾施設の配置と町の形成・整備という2点を跡付け、さらに背景にある地域構造を把握し、景観変化の構造的な理解を目指す。中近世は城下町の形成や藩の成立などにより地域構造が変化する時代である。その変化の中で港町景観を捉えることによって、地域経済の要地として発達する都市の特徴を明らかにすることに繋がることが期待できる。,特別研究員奨励費,小区分04020:人文地理学関連,歴史地理学,港町,景観復原,景観変遷,中世都市,近世都市,,,,,,,,,,,,,,,,,,,,,,,,,,,,,,,,,,,,,,,,,,,,,,,,,,
20J00837,大阪市立大学,小泉 佑介,インドネシア・パーム油産業における巨大フードシステムの再編と小農社会の構造変化,本研究では、インドネシアの経済成長を支える基幹産業が、ジャワ島の製造業だけでなく外島（スマトラ島やカリマンタン島など）の資源産業にも分散しつつある中で、外島において急速に拡大するアブラヤシ生産が、ローカルな社会経済構造をいかに規定し、また地域住民はいかなる適応的な反応を見せているのかを明らかにする。特に本研究では、小規模なアブラヤシ生産主体である小農に注目し、彼らの生産を支える流通様々なアクター間関係をフードシステムの視点から分析することで、パーム油産業の川中・川下に位置する加工・消費の新たな動きが、川上に位置する小農社会にどのような構造変化をもたらしているかの解明を主たる目的に据える。,特別研究員奨励費,小区分04020:人文地理学関連,アブラヤシ,ポリティカル・エコロジー,スマトラ,インドネシア,人口センサス,,,,,,,,,,,,,,,,,,,,,,,,,,,,,,,,,,,,,,,,,,,,,,,,,,,
20J00161,東北大学,谷本 涼,都市機能アクセシビリティの地理的マルチレベル分析,現代日本において生活の質を揺るがすアクセシビリティ関連の社会問題（待機児童やフードデザートなど）の影響の差異やその原因を、地域特性と個人属性の両面から捕捉し、個人の幸福度や生活の質の向上のために真に必要な施策の解明を目指す。,特別研究員奨励費,小区分04020:人文地理学関連,アクセシビリティ,ウォーカビリティ,インターネット調査,地理情報,交通地理,モビリティ,オンラインサーベイ,,,,,,,,,,,,,,,,,,,,,,,,,,,,,,,,,,,,,,,,,,,,,,,,,
21J13380,京都大学,桑林 賢治,近現代日本におけるアイヌの「場所と過去の表象」に関する地理学的研究,本研究は、近現代の（ポスト）コロニアルな日本社会において、アイヌによる場所と過去を結びつける様々な表象、すなわち「場所と過去の表象」が、空間的アイデンティティの多様化の中でどのように展開したのかを解明し、その意義を考察するものである。,特別研究員奨励費,小区分04020:人文地理学関連,記憶の場所,アイヌ,先住民性,地理的想像力,慰霊行為,コミュニティ,北海道,北海道外,先住民,非先住地,,,,,,,,,,,,,,,,,,,,,,,,,,,,,,,,,,,,,,,,,,,,,,
21J10840,筑波大学,鈴木 修斗,現代日本におけるライフスタイル・マイグレーションの進展による地域再編のメカニズム,本研究は，現代日本におけるライフスタイル・マイグレーションの進展による地域再編のメカニズムをフィールドワークを通じて実証的に明らかにする．とくに，移住者のライフスタイルが地域再編に果たす役割に着目する．その際，欧米圏のライフスタイル・マイグレーション研究の方法論を導入し，移住者自身の「実践」という観点から分析を行う．さらに地域再編の状況を統計資料の分析や現地調査の総合的な検討から解明し，移住者のライフスタイルとの係わりから検討する．これらの分析を複数事例で行い，その一般性と特殊性を考察することから，現代日本におけるライフスタイル・マイグレーションの進展による地域再編のメカニズムを議論する．,特別研究員奨励費,小区分04020:人文地理学関連,ライフスタイル・マイグレーション,移住,地域再編,アメニティ・マイグレーション,現役世代,移住者,実践,人文地理学,,,,,,,,,,,,,,,,,,,,,,,,,,,,,,,,,,,,,,,,,,,,,,,,
21F21003,筑波大学,森本 健弘,東京大都市圏における都市ボリュームのSDGsを考慮したシナリオシミュレーション,本研究は，東京大都市圏の持続可能な都市開発の道筋を探ることを目的とする．それは都市のヒートアイランド現象を緩和し，持続可能な生活環境を確立することができるものでなければならない．このため本研究は2020年から2050年までの東京大都市圏の都市ボリュームの時空間的変動を，持続可能な開発目標（SDGs）に基づくシナリオによりシミュレーションする．,特別研究員奨励費,小区分04020:人文地理学関連,Building density,Land use and land cover,Urban planning,Urban heat island,,,,,,,,,,,,,,,,,,,,,,,,,,,,,,,,,,,,,,,,,,,,,,,,,,,,
22KJ2828,日本大学,岩井 優祈,ポストコロナ社会における生活環境の量的・質的変化に関する地理学的研究,新型コロナウイルスの流行によって，日常生活における様々な活動がオンライン上で行われるようになり，人々の時間や空間に対する制約は大きく変化した．それらを踏まえて本研究では，新型コロナウイルスの流行によって人々の生活の質がいかに変化したのかを明らかにすることを目的としている．本研究の特徴は，日常生活における活動の場所・活動頻度の変化が，生活の質に対する価値観の変化といかに関わるのかについて検討している点である．本研究ではこの関係性を捉えるために，質的GIS（地理情報システム）の援用を試みている．,特別研究員奨励費,小区分04020:人文地理学関連,地理情報システム,GIS,新型コロナウイルス感染症,スケッチマップ,手書き地図,空間認知,質的GIS,新型コロナウイルス,COVID-19,生活の質,QoL,量的研究,質的研究,,,,,,,,,,,,,,,,,,,,,,,,,,,,,,,,,,,,,,,,,,,
22KJ2599,京都府立大学,阿部 美香,近世後期の日本における風景観についての歴史地理学的研究,本研究の大きなテーマは、近世から近代への移行期における人々の風景観の解明であり、具体的には以下の2点を探究する。(１) 近世後期から明治初期の大都市大坂における人々の風景観を，当時の名所案内記や浮世絵版画における風景表現の分析から提示する。左記のような出版物の中で、絵と文章により風景がいかに描出されているかを検討する。(２) 近世後期の日本での，地方（殊に長野や東北地方）における人々の風景観を，名所案内記や紀行文、和歌における風景表現の分析から提示する。風景がどのように記されているかを分析し，著者がそれらの風景へ持った見方を考察する。,特別研究員奨励費,小区分04020:人文地理学関連,風景観,近世後期,近代前期,名所案内記,文章,比較,出版物,浮世絵版画,大坂,風景,,,,,,,,,,,,,,,,,,,,,,,,,,,,,,,,,,,,,,,,,,,,,,
22KJ1856,京都大学,Estacio Ian,人間の意思決定がもたらす土地利用の変化を正確に予測するためのモデリング手法,The outline of the research revolves around the utilization of agent-based modeling to propose a modeling framework for simulating the feedback between land cover change and human actions. Research synthesis based on gathered results will also be utilized to propose the framework.,特別研究員奨励費,小区分04020:人文地理学関連,Agricultural abandonment,Socio-ecological systems,Regression modeling,Agent-based modeling,World heritage site,GIS,Land cover change,Land-use simulation,Social-ecological system,Agent-based model,Statistical model,Logistic regression,,,,,,,,,,,,,,,,,,,,,,,,,,,,,,,,,,,,,,,,,,,,
22KJ1460,金沢大学,近藤 祐磨,近現代日本におけるマツをめぐる思想と環境運動に関する地理学的研究,1980年代以降，現在に至るまでの日本において，マツに国家的な価値を見出した国や経済界の団体・機関，あるいはこれらに類する団体によって展開されてきたマツの保護・育成・啓発運動について，その契機と展開の過程を，各地方で受容された過程とともに明らかにする。,特別研究員奨励費,小区分04020:人文地理学関連,生態系サービス,利活用,里山林,生態系減災,グリーンインフラ,海岸マツ林,環境運動,マツ枯れ,マツタケ,環境保全活動,,,,,,,,,,,,,,,,,,,,,,,,,,,,,,,,,,,,,,,,,,,,,,
22KJ0629,東京大学,佐藤 洋,大都市圏における地方税の低徴収率地域の空間パターンと行財政運営に関する研究,本研究は，日本の大都市圏自治体が抱える地方税の低徴収率などの行財政問題を分析する．最終年度（2023年度）は以下の調査と成果報告を実施する．,特別研究員奨励費,小区分04020:人文地理学関連,地方税,大都市圏,人口減少,高齢化,地方分権,広域連携,地理情報システム（GIS）,空間分析,,,,,,,,,,,,,,,,,,,,,,,,,,,,,,,,,,,,,,,,,,,,,,,,
22KJ0433,筑波大学,三宅 彦大,帝国日本における地域振興策の再構築過程―日本海側地域の港湾修築運動を事例に―,本研究の目的は、近代日本海側地域における港湾修築運動の展開に着目して、その過程で地元関係者の地域振興策がいかに再構築されていっ,特別研究員奨励費,小区分04020:人文地理学関連,近代日本海側地域,「裏日本」,朝鮮,満洲,港湾都市,地域振興策,地域間ネットワーク,帝国日本,,,,,,,,,,,,,,,,,,,,,,,,,,,,,,,,,,,,,,,,,,,,,,,,
22KF0054,筑波大学,森本 健弘,自然による都市の課題解決：SDG11へ向けた便益と公平のシナリオベース空間評価,"This research will develop a method to evaluate the benefits of urban nature-based solutions (NBS) based on current and future land use/cover (LULC). Firstly, we extract past, current, and future LULC using GIS and RS techniques; secondly, we define scenarios to implement NBSs and extract potential ecosystem services (ES); thirdly, we spatially assess the benefits of implemented NBSs in terms of economy, health, and equity by each scenario; and fourthly, we apply the method to ten cities in the world. The results will contribute to make NBSs scenarios to enhance sustainability in cities.",特別研究員奨励費,小区分04020:人文地理学関連,Nature-Based Solutions,Spatial Access Equity,Ecosystem Services,GIS,Remote Sensing,Urban Sustainability,Scenario-based Planning,SDG11,,,,,,,,,,,,,,,,,,,,,,,,,,,,,,,,,,,,,,,,,,,,,,,,
23KJ1986,日本大学,遠藤 有悟,時間的変動を考慮したPTALによる公共交通への近接性研究,多数の公共交通事業者が営業している大都市では，法律の改正や競合問題の発生により公共交通サービスの水準の低下が発生している．本研究の目的は，多数の公共交通事業者が営業している大都市における公共交通への近接性をPTAL(Public transport accessibility level)を援用して明らかにすることである．本研究の特徴は，公共交通機関の駅やバス停の立地，運行本数などの「物質的環境」と研究地域の居住者の公共交通へのニーズや利用しやすさの基準などといった価値観などの「心理的環境」を統計資料やアンケート調査，現地調査を複合的に用いて地理学的視点からとらえようとしている点にある．,特別研究員奨励費,小区分04020:人文地理学関連,近接性,PTAL,公共交通,時間的変動,運行頻度,地理情報科学,交通地理学,都市地理学,,,,,,,,,,,,,,,,,,,,,,,,,,,,,,,,,,,,,,,,,,,,,,,,
23KJ1847,大阪公立大学,松木 駿也,災害経験の文化資源化と相伝の時空間的展開──災害をめぐる人－自然関係の「物語化」,本研究は、「災害文化」を「災害・被災経験を文化資源化する過程」と捉え、観光や学習の場面を含め、災害文化が誰により創出され地域や時代によってどう変化するのか、そこに人々の自然観や災害観、あるいは人ー自然関係の履歴がどのように反映されているかを明らかにする。具体的には、①ジオパークを事例に地元住民や被災者がどのような人ー自然関係に関する「語り」を構築してきたか、②災害経験・災害文化をインターローカルなものにするための高校「地理総合」における授業実践やスタディーツアーの開発、③現在も稼働する近代以降の防災インフラなど大規模な環境改変事業が地域の「文化資源」となった経緯の歴史的な側面からの考察を行う。,特別研究員奨励費,小区分04020:人文地理学関連,災害文化,ジオパーク,インタープリテーション,防災学習,流域,インターローカリティ,歴史的砂防施設,人文地理学,,,,,,,,,,,,,,,,,,,,,,,,,,,,,,,,,,,,,,,,,,,,,,,,
