awardnumber,organization,name,title,abstract,section,review_section,keyword1,keyword2,keyword3,keyword4,keyword5,keyword6,keyword7,keyword8,keyword9,keyword10,keyword11,keyword12,keyword13,keyword14,keyword15,keyword16,keyword17,keyword18,keyword19,keyword20,keyword21,keyword22,keyword23,keyword24,keyword25,keyword26,keyword27,keyword28,keyword29,keyword30,keyword31,keyword32,keyword33,keyword34,keyword35,keyword36,keyword37,keyword38,keyword39,keyword40,keyword41,keyword42,keyword43,keyword44,keyword45,keyword46,keyword47,keyword48,keyword49,keyword50,keyword51,keyword52,keyword53,keyword54,keyword55,keyword56
18K16249,国立研究開発法人国立成育医療研究センター,鈴木 江莉奈,性成熟疾患におけるエピジェネティック異常の検証,中枢性思春期早発症 (CPP)を対象に遺伝子変異解析、エピジェネティック解析を行い、下記に挙げる成果を得た。インプリンティング遺伝子であるMKRN3は、近年同定されたCPPの原因遺伝子である。アジア諸国CPP患者24例を対象にMKRN3遺伝子の解析を行った。24例中1例にMKRN3遺伝子変異を同定した。エピジェネティック異常は同定されなかった。変異陽性例は、5歳時、乳房発達と陰毛発生が見られた日本人女児である。これらの結果より、アジア諸国CPP患者におけるMKRN3遺伝子変異・エピジェネティック異常の頻度と臨床像が明らかとなった。,若手研究,小区分54040:代謝および内分泌学関連,エピジェネティック,エピジェネティクス,MKRN3遺伝子,,,,,,,,,,,,,,,,,,,,,,,,,,,,,,,,,,,,,,,,,,,,,,,,,,,,,
18K16248,兵庫医科大学,小西 康輔,RAGEによる視床下部の炎症調節機構とそれに伴う摂食、代謝への影響の解明,"終末糖化産物 (advanced glycation end-products, AGE)受容体であるRAGE(receptor for AGE)は炎症のメディエーターとして働き、血管内皮炎症、糖尿病、肥満、脳内炎症との関与が報告されている。今回、我々が報告した、血管内皮細胞におけるRAGEおよび可溶性RAGE(sRAGE)と炎症シグナルの制御機構の研究成果は『RAGEおよびその切断機序が視床下部の炎症を調節することにより、摂食行動、基礎代謝バランスの撹乱に関与し、肥満・糖尿病の発症に関与する』という仮説を支持する結果と考える。",若手研究,小区分54040:代謝および内分泌学関連,RAGE,esRAGE,脳内炎症,肥満,視床下部炎症,sRAGE,TNF-α,ADAM10,MMP9,AGEs,視床下部,,,,,,,,,,,,,,,,,,,,,,,,,,,,,,,,,,,,,,,,,,,,,
18K16247,愛知医科大学,姫野 龍仁,糖尿病性多発神経障害におけるinsulin-Notch連関を介した再生機構の意義,糖尿病性多発神経障害(DPN)の機序は十分に解明されていない。本研究では、糖尿病におけるインスリンシグナル異常と神経幹細胞/前駆細胞(NSC/NPC)の維持経路であるNotchシグナルの相互作用に注目して、再生・恒常性維持機構がDPNの病態形成に関与するかを検証した。,若手研究,小区分54040:代謝および内分泌学関連,糖尿病性神経障害,Diabetic polyneuropathy,Notch signaling,糖尿病性多発神経障害,糖尿病性合併症,糖尿病神経障害,Notch,神経幹細胞,,,,,,,,,,,,,,,,,,,,,,,,,,,,,,,,,,,,,,,,,,,,,,,,
18K16246,順天堂大学,李 賢哲,後期エンドソーム特異的リン脂質BMPの脂肪酸分子種の生理的意義の解明,本研究は後期エンドソームに存在するリン脂質であるBMPが、高度不飽和脂肪酸を豊富に含む生理的意義を明らかにすることを目的とした研究である。BMPへの高度不飽和脂肪酸の導入を担う酵素の欠損マウスを調べたところ、欠損マウス由来の臓器で酸化ストレスマーカーが増加していることがわかった。そこで、酸化ストレスを引き起こす試薬を投与し、それに対する感受性を調べたところ、このマウスでは酸化ストレスに対して脆弱である傾向があることがわかった。このことから、BMPは酸化されやすい性質を持つ高度不飽和脂肪酸を効率よく取り込み酸化ストレスから守る防御機構の一つである可能性が示唆された。,若手研究,小区分54040:代謝および内分泌学関連,BMP,DHA,DPA,PUFA,後期エンドソーム,脂肪酸組成,高度不飽和脂肪酸,ドコサヘキサエン酸,,,,,,,,,,,,,,,,,,,,,,,,,,,,,,,,,,,,,,,,,,,,,,,,
18K16245,慶應義塾大学,稲石 淳,日本人の耐糖能およびβ細胞機能と膵組織学的特徴との関連について久山町研究での検討,福岡県久山町における剖検例の成績を用いて、生前に75g経口糖負荷試験により評価された耐糖能レベル及び糖代謝指標とβ細胞量の関連について検討した。生前の耐糖能レベルは正常耐糖能（40名）、境界型（空腹時血糖異常または耐糖能異常、31名）、糖尿病（32名）に分類した。β細胞量の指標として評価したβ細胞面積は正常耐糖能、境界型、糖尿病となるに従って段階的に減少し、糖代謝指標と関連していた。,若手研究,小区分54040:代謝および内分泌学関連,糖尿病,β細胞,β細胞量,膵臓,,,,,,,,,,,,,,,,,,,,,,,,,,,,,,,,,,,,,,,,,,,,,,,,,,,,
18K16244,杏林大学,牧山 智彦,代償性インスリン分泌能亢進におけるP2X7受容体の役割,妊娠期の母体ではインスリン抵抗性が引き起こされ、その代償として膵β細胞はインスリン分泌を亢進させる。代償性インスリン分泌亢進機構は、膵β細胞量増加と共に、個々のβ細胞からのインスリン分泌が重要であると考えられているが、代償性インスリン分泌亢進機構には不明な点が多い。本研究ではP2X7ノックアウトマウスを用いて、膵β細胞より分泌されたATPがP2X7受容体シグナリングを介して代償性インスリン分泌を制御していることを見出した。,若手研究,小区分54040:代謝および内分泌学関連,インスリン分泌,インスリン抵抗性,膵β細胞,ATP,,,,,,,,,,,,,,,,,,,,,,,,,,,,,,,,,,,,,,,,,,,,,,,,,,,,
18K16243,和歌山県立医科大学,浦木 進丞,下垂体腺腫におけるミスマッチ修復遺伝子異常による腫瘍増殖メカニズムの解明,下垂体腫瘍において、ミスマッチ修復遺伝子MSH6・MSH2遺伝子発現量の低下は、間接的な遺伝子変異の蓄積を増加させるだけでなく、協調的に細胞周期調節機構ATR-Chk1経路の機能低下を引き起こし、直接的に下垂体腫瘍増殖を促進することを示した。その分子機構として、ATR-Chk1経路の機能低下によって細胞周期停止やapoptosis誘導が十分に機能しないことが推定される。また、下垂体腫瘍組織型別において、腫瘍増殖が異なることが報告されているが、その分子機構にMSH6・MSH2遺伝子発現ならびに腫瘍免疫に関与するPD-L1遺伝子発現の相違が関与している可能性を示した。,若手研究,小区分54040:代謝および内分泌学関連,下垂体腺腫,ミスマッチ修復遺伝子,MSH6・MSH2,腫瘍免疫,PD-L1,下垂体腫瘍,MSH6,MSH2,"ミスマッチ修復遺伝子MSH6,MSH2",腫瘍増殖,細胞周期調節機構ATR-Chk1経路,DNAミスマッチ修復遺伝子,,,,,,,,,,,,,,,,,,,,,,,,,,,,,,,,,,,,,,,,,,,,
18K16242,和歌山県立医科大学,森田 修平,IRE1αを新規標的とした1型糖尿病治療薬-KIRA8-の有効性,IRE1α阻害薬KIRA8を1型糖尿病モデルマウスであるNODマウスに投与し、糖尿病病態が改善したマウス全てで、優位な高血糖の再発、体重変化、健康状態への影響はなく経過し、一定の長期効果が認められた。また、KIRA8の有効性に影響する因子の一つとしてとして、nAChRシグナリングがIRE1α活性化や過剰な小胞体ストレスに対して膵β細胞保護的に働くことを示した。,若手研究,小区分54040:代謝および内分泌学関連,小胞体ストレス,小胞体ストレス応答,膵β細胞,糖尿病,,,,,,,,,,,,,,,,,,,,,,,,,,,,,,,,,,,,,,,,,,,,,,,,,,,,
18K16241,横浜市立大学,奥山 朋子,細胞外マトリックスタンパクを介したインスリン感受性制御機構の解析,Fibulin-5（Fbln5)は細胞外弾性線維形成に必須の分泌蛋白である。本研究ではFbln5欠損マウスを用いた解析により、細胞外マトリックス分子による糖代謝制御機構について検討した。Fbln5欠損マウスは体重非依存性のインスリン感受性亢進を呈し、高脂肪食誘導性の肥満および脂肪肝の改善を認めた。各種代謝臓器特異的（肝細胞、脂肪細胞、皮膚）なFbln5欠損マウスを樹立したが、いずれもインスリン感受性の変化は来たさなかった。以上より、Fbln5によるインスリン感受性制御機構として、細胞接着因子としての作用および血管弾性線維を介した機構等が想定された。,若手研究,小区分54040:代謝および内分泌学関連,インスリン感受性,糖尿病,細胞外マトリックス,,,,,,,,,,,,,,,,,,,,,,,,,,,,,,,,,,,,,,,,,,,,,,,,,,,,,
18K16240,横浜市立大学,白川 純,膵島の不均一性に基づく膵島機能制御機構の解析,膵β細胞などにより構成されている膵島には、インスリン分泌能や膵β細胞増殖能の異なる複数のサブタイプが存在し、それらが膵臓内の解剖学的な空間的位置により規定されていることを見出した。さらに、空間的位置に伴う膵島の不均一性（ヘテロジェネイティー）を、構造、機能、増殖・分化転換・生存等の可塑性の観点から解析し、その分子機構が明らかになりつつある。これより、各膵島のサブタイプの病態における特性を解析することが可能となり、特定の膵島サブタイプを標的とした、効率的な機能的膵β細胞量の維持ならびに増加の達成に向けた糖尿病治療研究へと展開できる。,若手研究,小区分54040:代謝および内分泌学関連,糖尿病,膵β細胞量,膵島,不均一性,分化転換,脱分化,膵β細胞,インスリン,,,,,,,,,,,,,,,,,,,,,,,,,,,,,,,,,,,,,,,,,,,,,,,,
18K16239,大分大学,山岡 真美,ARNO結合分子の同定とインスリン分泌後のエンドサイトーシスを制御する機構,インスリンは、それを取り囲む小胞膜が細胞膜に融合することで細胞外に放出される。私たちは、これまで未開拓であったインスリン分泌後の過程であるエンドサイトーシスに着目して研究を行い、グルコースがインスリンを放出させるだけでなくエンドサイトーシスを開始させることを明らかにした。さらに、グルコースによって細胞膜に集積したARNOがエンドサイトーシスを制御することを見出した。しかしながら、グルコースとARNOの間のシグナルは不明である。私は最近、ARNOに相互作用する分子として3量体Gタンパク質を同定し、両者が特異的に直接結合することを明らかにした。本研究では、3量体Gタンパク質がエンドサイトーシスを制御するメカニズムを解明する。私たちは本研究が、エンドサイトーシスをターゲットとした新しい糖尿病治療薬の開発の基盤や、糖尿病の病因解明の一助になりうると考えている。,若手研究,小区分54040:代謝および内分泌学関連,シグナル伝達,糖尿病,生体分子,タンパク質,蛋白質,エンドサイトーシス,インスリン,膵B細胞,膜輸送,,,,,,,,,,,,,,,,,,,,,,,,,,,,,,,,,,,,,,,,,,,,,,,
18K16238,熊本大学,花谷 聡子,新規NASH誘導モデルマウスを用いたGPR43によるNASH発症抑制の検討,C57BL/6マウスにGTG（gold-thioglucose）0.2mg/kgを腹腔内投与して過食を誘発し、高脂肪高ショ糖食（HF/HSD）による飼育を行うことによって新規NASH誘導モデルマウスを作成することが出来た。また、短鎖脂肪酸の肝臓への作用を検討した。過食肥満モデルマウスとしてKK-Ayを、NAFLDのin vitroモデルとしてパルミチン酸とオレイン酸を投与したHepG2細胞を用いて酢酸の効果を検討したが、脂質代謝マーカーなどに明らかな変化は認めなかった。,若手研究,小区分54040:代謝および内分泌学関連,短鎖脂肪酸,脂肪肝,NASH,,,,,,,,,,,,,,,,,,,,,,,,,,,,,,,,,,,,,,,,,,,,,,,,,,,,,
18K16237,九州大学,木村 真一郎,C型レクチンを介した肥満脂肪組織慢性炎症の機序の解明および治療応用についての検討,C型レクチンの1つである、macrophage-inducible C-type lectin（Mincle）は、主にマクロファージ発現を誘導するC型レクチンであるが、Mincleをノックアウトしたマウスでは、高脂肪食負荷により肥満となっても、野生型マウスと比較して脂肪組織のcrown-like structure形成とそれに伴う組織の線維化が少なく、脂肪蓄積能が保たれるとともに、肝臓への脂肪の蓄積や糖代謝異常が軽減されることが研究協力者の小川らより報告されている。しかし、C型レクチンと肥満脂肪組織慢性炎症の関連については未だ不明な点が多く包括的な理解が必要であった。,若手研究,小区分54040:代謝および内分泌学関連,C型レクチン,肥満,脂肪組織,慢性炎症,NASH,メラノコルチン4型受容体,Mincle,DAMPs,,,,,,,,,,,,,,,,,,,,,,,,,,,,,,,,,,,,,,,,,,,,,,,,
18K16236,国立研究開発法人国立精神・神経医療研究センター,MARIA TSOUMPRA,,"1,25-水酸化ビタミンD3(VD3)は、核内受容体のビタミンD受容体(VDR)に結合し、標的遺伝子のvitamin D response element: VDREに結合することにより遺伝子発現を調節する。",若手研究,小区分54040:代謝および内分泌学関連,vitamin D,vitamin D receptor,dystrobrevin,dystrophin,muscular dystrophy,muscle,vitamin D3,dystrobrevin alpha,myogenic differentiation,,,,,,,,,,,,,,,,,,,,,,,,,,,,,,,,,,,,,,,,,,,,,,,
18K16235,徳島大学,吉田 守美子,アンドロゲンの糖代謝制御機構の解明と治療への応用,本研究では、骨格筋特異的アンドロゲン受容体欠損マウスを用いて、骨格筋におけるアンドロゲンの糖代謝制御メカニズムの詳細を検討した。骨格筋でのアンドロゲン受容体欠損は、体重増加や内臓脂肪蓄積を来たすことなく、骨格筋量も形態も維持されていたが、骨格筋へのグルコース取り込み能の低下やインスリン下流シグナルの減弱、さらに骨格筋への異所性脂肪蓄積の増加を介して、耐糖能異常とインスリン抵抗性を引き起こすことを明らかにした。,若手研究,小区分54040:代謝および内分泌学関連,アンドロゲン,骨格筋,インスリン抵抗性,アンドロゲン受容体,耐糖能異常,,,,,,,,,,,,,,,,,,,,,,,,,,,,,,,,,,,,,,,,,,,,,,,,,,,
18K16234,徳島大学,倉橋 清衛,カルシウム感知受容体が膵β細胞および腸管上皮細胞機能の調節に果たす役割の解明,ヒト活性型変異CaSRノックインマウス（ADH-KI）はインスリン分泌低下を伴う耐糖能異常が認められたが、膵島1個当たりのインスリン含量や膵島の数は野生型マウスと差がなく、CaSRシグナルの恒常的活性化によるインスリン分泌低下の機序は膵β細胞量の減少ではなく、インスリン分泌機構の障害によるものと考えられた。ADH-KIにCaSRの阻害薬の投与したところ耐糖能の改善の傾向が認められ、CaSRが糖尿病の新たな薬物治療の標的になり得ることが示唆された。,若手研究,小区分54040:代謝および内分泌学関連,糖尿病,膵β細胞,カルシウム感知受容体,Calcilytic,インスリン,ミトコンドリア,Ca感知受容体,CaSR,インスリン分泌,インクレチン分泌,,,,,,,,,,,,,,,,,,,,,,,,,,,,,,,,,,,,,,,,,,,,,,
18K16233,島根大学,田中 小百合,骨格筋におけるNa依存性glucose transporterの役割の解明,糖尿病治療薬であるSGLT2阻害薬の有害事象として筋肉量減少が懸念される。,若手研究,小区分54040:代謝および内分泌学関連,Phlorizin,C2C12,SGLT2阻害薬,サルコペニア,SGLT2,SGLT1,C2C12細胞,SGLT-2阻害薬,筋委縮,Na依存性グルコース輸送体（SGLT）阻害薬,Phlorhizin,糖尿病,,,,,,,,,,,,,,,,,,,,,,,,,,,,,,,,,,,,,,,,,,,,
18K16232,神戸大学,松本 隆作,視床下部下垂体相互作用におけるFGFシグナルの病態生理学的意義の解明,iPS細胞から視床下部-下垂体オルガノイドを誘導する技術を用いて、発生期の視床下部に発現するFGFシグナルの下垂体発生における役割を検討した。ノックアウトiPS細胞を用いた検討から、FGF8は隣接する口腔外胚葉の維持に関わっており、FGF10はLHX3陽性の下垂体前駆細胞分化に重要であった。FGF受容体阻害薬を用いて下垂体発生の時期におけるFGFシグナルの役割を検討したところ、FGFシグナルは発生初期には口腔外胚葉の維持に関わっているが、下垂体ホルモン産生細胞への分化には明らかな影響はなかった。しかし後期にはホルモン産生細胞の分泌能獲得といった機能的成熟に重要であることが示唆された。,若手研究,小区分54040:代謝および内分泌学関連,下垂体,視床下部,線維芽細胞増殖因子 (FGF),口腔外胚葉,iPS細胞,下垂体発生,FGF,線維芽細胞増殖因子,FGFシグナル,発生学,,,,,,,,,,,,,,,,,,,,,,,,,,,,,,,,,,,,,,,,,,,,,,
18K16231,大阪大学,下 直樹,糖尿病下膵β細胞機能回復のための標的因子の探求,2型糖尿病患者の血糖管理は経過とともに悪化することがよく経験され、その背景には慢性的な高血糖がインスリン分泌細胞である膵β細胞の機能障害をもたらすという「高血糖毒性」が関与している。我々は、高血糖毒性の有無により発現が変動する「高血糖毒性感受性遺伝子」は膵β細胞機能において重要な役割を果たすと考え、新規因子を探索し、Tmem163およびCox6a2を同定した。そしてそれぞれ、インスリン分泌顆粒の成熟および、酸化反応によりもたらされる生体への有害作用である酸化ストレスを介して、膵β細胞機能に関与していることが示唆された。,若手研究,小区分54040:代謝および内分泌学関連,膵β細胞,高血糖毒性,2型糖尿病,インスリン分泌顆粒,酸化ストレス,糖尿病,,,,,,,,,,,,,,,,,,,,,,,,,,,,,,,,,,,,,,,,,,,,,,,,,,
18K16230,大阪大学,細川 吉弥,膵β細胞のCh25h発現低下による劇症1型糖尿病発症メカニズムの解明,劇症1型糖尿病患者由来iPS細胞から分化誘導して得られたインスリン陽性細胞を含む細胞においてサイトカイン刺激にて上昇したCaspase3活性が25HCを投与することで有意に低下することを、また免疫染色において劇症1型糖尿病患者iPS 細胞由来インスリン陽性細胞に占める活性型Caspase3陽性細胞の割合は25HCを投与した場合には有意に低下することを見出した。,若手研究,小区分54040:代謝および内分泌学関連,MIN6,iPS細胞,25HC,ch25h,劇症1型糖尿病,Ch25h,β細胞,,,,,,,,,,,,,,,,,,,,,,,,,,,,,,,,,,,,,,,,,,,,,,,,,
18K16229,大阪大学,藤島 裕也,GPIアンカー特異的切断酵素；GPI-PLDの生理病態学的意義の解明,GPI-PLD遺伝子は肝臓で高発現しており、脂肪肝や糖尿病状態では肝臓での遺伝子発現と血中濃度が有意に上昇することが分かった。また、初代培養肝細胞を用いた細胞実験やGPI-PLD欠損マウスを用いた検討により、GPI-PLDは生理活性脂質である肝ジアシルグリセロール（DAG）量を直接的に変化させることで、脂肪肝進展やインスリン抵抗性に関与している可能性があることを初めて明らかとした。,若手研究,小区分54040:代謝および内分泌学関連,GPI-PLD,脂肪肝,肥満症,2型糖尿病,メタボリックシンドローム,XOR,動脈硬化症,糖尿病,肥満,２型糖尿病,インスリン抵抗性,ジアシルグリセロール,,,,,,,,,,,,,,,,,,,,,,,,,,,,,,,,,,,,,,,,,,,,
18K16228,名古屋市立大学,青谷 大介,食物中脂質組成とホルモンの相互作用によるエネルギー代謝調節の新規メカニズムの解明,本研究は、胃由来ホルモングレリンの摂食促進作用に対する中鎖脂肪酸(MCT)の阻害作用を検討し、肥満症治療への応用を目指すための基盤研究である。グレリンの合成にはMCTによる修飾が必須であり、実際にマウスにMCTを与えると血中グレリン濃度は約2倍に上昇する。しかし摂食量は増加しないことから、MCTがグレリンの摂食促進作用を阻害している可能性が示唆された。またMCTを摂取させたマウスでは、外因性グレリンによる摂食促進反応も減弱していた。これらの結果から、経口摂取されたMCTはグレリンの摂食促進作用に関して抵抗性を惹起すると考えられ、肥満症のあらたな治療法としてMCTが有用である可能性が示唆された。,若手研究,小区分54040:代謝および内分泌学関連,肥満,グレリン,中鎖脂肪酸,食欲,肥満症,摂食,脂質,,,,,,,,,,,,,,,,,,,,,,,,,,,,,,,,,,,,,,,,,,,,,,,,,
18K16227,京都大学,金井 有吾,Osteocrinの筋骨格系における展開研究,Osteocrinトランスジェニックマウスを用いて、OsteocrinがNPR-C受容体によるC型ナトリウム利尿ペプチド（CNP）のクリアランスを阻害することにより、骨伸長促進作用を発揮することを明らかにした。同じくCNPのクリアランスに関わるNeutral endopeptidaseに着目し、野生型マウスにおいてその阻害剤の投与により骨伸長促進作用が得られることを見出した。CNPは成長障害を呈する疾患の治療薬として開発が進んでいるが、本研究の成果から、そのクリアランスに関わる分子が新たな創薬標的となる可能性が示された。,若手研究,小区分54040:代謝および内分泌学関連,Osteocrin,CNP,NPR-C,骨伸長,osteocrin,cnp,内軟骨性骨化,骨伸長障害,,,,,,,,,,,,,,,,,,,,,,,,,,,,,,,,,,,,,,,,,,,,,,,,
18K16226,滋賀医科大学,大橋 夏子,褐色脂肪組織におけるO-GlcNAc修飾の生理学的役割の解明と新規治療標的の探索,肥満症や糖尿病において、翻訳後修飾を介した蛋白の機能異常が病態の発症や進展に深く関与しており、その翻訳後修飾の一つにO-GlcNAc修飾がある。,若手研究,小区分54040:代謝および内分泌学関連,褐色脂肪細胞,白色脂肪細胞,エネルギー代謝,糖代謝,O-GlcNAc修飾,褐色脂肪組織,,,,,,,,,,,,,,,,,,,,,,,,,,,,,,,,,,,,,,,,,,,,,,,,,,
18K16225,名古屋大学,伊藤 禎浩,レプチンシグナルを介する新たなメカニズムを持つインスリン依存性糖尿病治療薬の開発,（1）IDDM PTP1B KOはWTと比較をして有意に血糖値の低下及び糖代謝の改善を認めた。（2）末梢に高用量のレプチンを投与したIDDM　KOはWTと比較をして有意に糖代謝の改善を認めた。（3）中枢に末梢では糖代謝の改善を認めない少量のレプチンを投与したIDDM　KOはWTと比較をして有意に糖代謝を改善した。（4）末梢にレプチンとPTP1B阻害薬を投与したIDDM　WTは正常マウスと同程度に糖代謝を改善した。このメカニズムには中枢でのSTAT3シグナルの増強が末梢の筋肉や褐色細胞組織での糖の取り込みを増強したことが示唆された。,若手研究,小区分54040:代謝および内分泌学関連,レプチン,1型糖尿病,PTP1B,IDDM,インスリン依存性糖尿病,,,,,,,,,,,,,,,,,,,,,,,,,,,,,,,,,,,,,,,,,,,,,,,,,,,
18K16224,金沢大学,高山 浩昭,ヘパトカインセレノプロテインPによる適応熱産生障害機構の解明,セレノプロテインPが褐色脂肪組織での適応熱産生に与える影響を検討し、以下のことを明らかにした。,若手研究,小区分54040:代謝および内分泌学関連,セレノプロテインP,適応熱産生,還元ストレス,褐色脂肪細胞,ノルアドレナリン,活性酸素,褐色脂肪組織,活性酸素種,,,,,,,,,,,,,,,,,,,,,,,,,,,,,,,,,,,,,,,,,,,,,,,,
18K16223,東京医科歯科大学,宮地 康高,マクロファージに着目した脂肪組織の拡張機能に関する検討,,若手研究,小区分54040:代謝および内分泌学関連,,,,,,,,,,,,,,,,,,,,,,,,,,,,,,,,,,,,,,,,,,,,,,,,,,,,,,,,
