awardnumber,organization,name,title,abstract,section,review_section,keyword1,keyword2,keyword3,keyword4,keyword5,keyword6,keyword7,keyword8,keyword9,keyword10,keyword11,keyword12,keyword13,keyword14,keyword15,keyword16,keyword17,keyword18,keyword19,keyword20,keyword21,keyword22,keyword23,keyword24,keyword25,keyword26,keyword27,keyword28,keyword29,keyword30,keyword31,keyword32,keyword33,keyword34,keyword35,keyword36,keyword37,keyword38,keyword39,keyword40,keyword41,keyword42,keyword43,keyword44,keyword45,keyword46,keyword47,keyword48,keyword49,keyword50,keyword51,keyword52,keyword53,keyword54,keyword55,keyword56
22K16393,滋賀医科大学,井田 昌吾,ヒト多能性幹細胞由来膵β細胞に血管内皮細胞、血管組織ならびに神経細胞が与える影響,ヒト多能性幹細胞を用いた膵β細胞補充療法は膵β細胞を失った１型糖尿病患者にとって極めて有用な治療になりうるが、ヒト膵島に比肩する機能を持つヒト多能性幹細胞由来の膵β細胞はまだ作成されておらず、その分化メカニズムを含め明らかになっていないことが多い。本研究は膵島を構成する血管や神経に着目しそれらが膵β細胞への分化に与える影響について検討を行うものである。これらのメカニズムが解明されることで、今後より機能的に成熟した膵β細胞の作成が可能になる。,若手研究,小区分54040:代謝および内分泌学関連,膵β細胞補充療法,膵島移植,多能性幹細胞,血管内皮細胞,膵β細胞,再生医療,,,,,,,,,,,,,,,,,,,,,,,,,,,,,,,,,,,,,,,,,,,,,,,,,,
22K16392,名古屋大学,吉岡 直輝,免疫シグナル分子DAP12の代謝性組織リモデリングにおける意義の解明,肥満の脂肪組織と非アルコール性脂肪肝炎の肝臓において、細胞死を核としてマクロファージが集積した微小環境（CLS: crown-like structure）が、慢性炎症の起点となることが明らかになってきた。しかし、CLS形成の分子メカニズムは、未だ不明の点が多い。研究代表者は、免疫シグナル分子DAP12が、脂肪組織と肝臓の両方においてCLS形成に関わることを見出した。そこで本研究では、CLS形成おけるDAP12の意義を明確化するとともに、マクロファージの遊走能や貪食・処理能におけるDAP12の意義を明らかにする。さらに、本研究で明らかになった分子メカニズムについて臨床サンプルを用いて検証する。,若手研究,小区分54040:代謝および内分泌学関連,慢性炎症,マクロファージ,メタボリックシンドローム,肥満,脂肪肝,MASH,非アルコール性脂肪肝炎,,,,,,,,,,,,,,,,,,,,,,,,,,,,,,,,,,,,,,,,,,,,,,,,,
22K16391,岐阜大学,大塚 博樹,モデルマウスを用いたミトコンドリアチオラーゼ欠損症の病態解明,ケトン体は糖質が枯渇する状況における重要なエネルギー源である。ケトン食療法は代謝異常症だけでなく難治性てんかんにも行われているが、ケトン体の役割にはまだ不明点も多い。本研究ではケトン体代謝酵素であるミトコンドリアアセトアセチル-CoAチオラーゼ(T2)と、ミトコンドリア中鎖3-ケトアシル-CoAチオラーゼ(T1)の解析を行う。T1はT2と基質特異性に重なりがあるため、T2欠損マウス、T1欠損マウス、そしてダブルノックアウトマウスを作成する。これらのマウスに食餌負荷、空腹負荷など比較検討を行い、T2、T1の生理的な役割について明らかにする。そしてケトン体代謝の治療につなげることを目的とする。,若手研究,小区分54040:代謝および内分泌学関連,絶食負荷試験,ノックアウトマウス作成,ケトン体代謝,基底核病変,胎生致死,,,,,,,,,,,,,,,,,,,,,,,,,,,,,,,,,,,,,,,,,,,,,,,,,,,
22K16390,金沢大学,青野 大輔,アルドステロン産生腺腫の副腎静脈採血中循環腫瘍DNAにおける遺伝子変異の検出,原発性アルドステロン症（PA）の病因の7割を占めるアルドステロン産生腺腫（APA）は、手術で治癒しうるため、臓器障害をきたす前に早期診断を要する。PA診療では術前に組織診が実施されないため、術前にAPAの遺伝子変異情報を知ることができない。近年新たな遺伝子変異解析法としてリキッドバイオプシーが注目されている。本研究の目的は、副腎静脈血中におけるAPA由来の循環腫瘍DNAの遺伝子変異を検出することである。リキッドバイオプシーによるAPAの遺伝子解析法の確立によって、PA術前の新たな病型分類や手術による治療効果予測等が期待できる。,若手研究,小区分54040:代謝および内分泌学関連,アルドステロン産生腺腫,リキッドバイオプシー,副腎静脈採血,循環腫瘍DNA,,,,,,,,,,,,,,,,,,,,,,,,,,,,,,,,,,,,,,,,,,,,,,,,,,,,
22K16389,弘前大学,村澤 真吾,ウロコルチン遺伝子ターゲティングマウスを用いた脳内ストレス防御反応の解明,Corticotropin-releasing factor（CRF）はストレス下で副腎皮質ホルモン分泌を促進する神経内分泌ホルモンであるが，自律神経系，摂食行動，情動応答などの調節にも重要な役割を演ずる．CRF 受容体に結合するCRF ファミリーペプチドとしてウロコルチン（Ucn）が発見された．Ucn はCRF と同様に摂食抑制や不安修飾作用・血圧低下作用が知られる．,若手研究,小区分54040:代謝および内分泌学関連,ウロコルチン,視床下部,CRFファミリーペプチド,urocortin,CRF,交感神経,摂食,情動,,,,,,,,,,,,,,,,,,,,,,,,,,,,,,,,,,,,,,,,,,,,,,,,
23K15423,産業医科大学,黒住 旭,末梢血リンパ球フェノタイプ解析による難治性バセドウ病の病態解明と治療応用,近年バセドウ病や橋本病などの自己免疫性甲状腺疾患において、病態規定因子として自己反応性リンパ球が重要な役割を担うことが明らかとなりつつあり、特に薬剤抵抗性のバセドウ病ではヘTh17細胞が高発現し、制御性T細胞が抑制されることが報告されている。今回、新規発症したバセドウ病患者において、薬剤抵抗性および難治性病態の解明を目指して、8カラーフローサイトメーターを用いて、特にリンパ球をはじめとした免疫細胞における細胞表面マーカーに着目し、治療前後における発現状態の変化をみる。,若手研究,小区分54040:代謝および内分泌学関連,バセドウ病,難治性病態,末梢血リンパ球フェノタイプ,B細胞,T細胞,,,,,,,,,,,,,,,,,,,,,,,,,,,,,,,,,,,,,,,,,,,,,,,,,,,
23K15422,愛知医科大学,三浦 絵美梨,クローン性造血と糖尿病性神経障害,本研究では、糖尿病性多発神経障害(DPN)の新たな発症・進展機序解明のためにクローン性造血(CH)に注目した。疫学研究および動物実験より、CHは心血管死亡の新たなリスクファクターであること、その機序として免疫細胞が炎症性サイトカインを過剰に分泌し組織を障害することが報告されている。一方、TNFαやIL-6といった血中の炎症性サイトカイン濃度と糖尿病性多発神経障害の発症に相関があることが報告され、DPN発症に慢性炎症が関与している可能性が指摘されている。このような背景からDPNの発症・進展にCHが関与すると考え、DPNにおける炎症・免疫系の関与を明らかにすると共に病態解明と治療法開発に繋げる。,若手研究,小区分54040:代謝および内分泌学関連,炎症,糖尿病性神経障害,クローン性造血,,,,,,,,,,,,,,,,,,,,,,,,,,,,,,,,,,,,,,,,,,,,,,,,,,,,,
23K15421,日本大学,高野 智圭,羊膜上皮細胞のWnt経路におけるスイッチング機構の解明,ヒト羊膜上皮細胞は胎盤を覆う羊膜から分離できる多能性幹細胞である。代表者はこれまでこの細胞の多能性と分化の制御機構に着目し、in vitroにおける細胞分化にはTGF-β経路に依存する上皮間葉転換が関与することを示した。また一連のプロセスにはWnt/β-catenin経路の介在がある可能性を見出し、TGF-β経路が幹細胞の運命決定に関わるWnt経路のスイッチング機構をも制御していると考えた。本研究はこのスイッチング機構に関する新たな仮説の検証を通して、羊膜上皮細胞における自己複製の運命決定機構の解明を目指すものである。,若手研究,小区分54040:代謝および内分泌学関連,ヒト羊膜上皮細胞,Wnt経路,多能性と分化,先天性代謝異常症,TNIK,,,,,,,,,,,,,,,,,,,,,,,,,,,,,,,,,,,,,,,,,,,,,,,,,,,
23K15420,北里大学,正木 嗣人,GLP-1分泌細胞の分化成熟機構解明に向けた時空間解析,近年、GLP-1受容体シグナル活性化を介して糖代謝改善を目指すインクレチン療法が広く臨床応用されており、糖尿病に対する新たな治療標的として注目されている。GLP-1産生細胞であるL細胞は腸管内分泌前駆細胞より分化することが明らかとなっているが、発生・分化機構の詳細は未解明である。本研究では新生L細胞および成熟L細胞を高時間分解能で標識するレポーターマウス”GLP1-Timer”および”GLP1-TRACER”を用いて、L細胞の位置情報を得る。 さらに新生L細胞の遺伝子発現プロファイルを1細胞レベルで解析しながら、「L細胞がいつ、 どこで生まれ、どのようにして成熟化するのか?」を明らかにする。,若手研究,小区分54040:代謝および内分泌学関連,糖尿病,GLP-1,L細胞,腸管内分泌細胞,インクレチン,,,,,,,,,,,,,,,,,,,,,,,,,,,,,,,,,,,,,,,,,,,,,,,,,,,
23K15419,北里大学,田口 朋,血漿中に存在するβ細胞特異的ペプチドの網羅的探索 - β細胞破壊の定量化に向けて -,１型糖尿病はβ細胞破壊による絶対的なインスリン分泌不全に起因する持続的な高血糖が様々な合併症を引き起こす疾患である。本研究では１型糖尿病におけるβ細胞破壊を非侵襲的、かつ正確に定量化するため、β細胞破壊に伴い血漿中に放出されるβ細胞特異的ペプチドを同定し、β細胞破壊の非侵襲的定量化を目的とする。β細胞特異的かつ任意の時期にβ細胞破壊を誘導できる誘導できる遺伝子改変マウスと、発症後早期の１型糖尿病患者より血漿を採取し、ペプチドーム解析を行い、β細胞特異的ペプチドライブラリを作成する。その中からELISA定量系への応用可能な新規ペプチドを抽出し、実臨床におけるβ細胞破壊の経時的定量化を目指す。,若手研究,小区分54040:代謝および内分泌学関連,1型糖尿病,β細胞,質量分析,ペプチド,ペプチドーム,ペプチドーム解析,,,,,,,,,,,,,,,,,,,,,,,,,,,,,,,,,,,,,,,,,,,,,,,,,,
23K15418,和歌山県立医科大学,中尾 友美,変異コルチコステロイド結合グロブリン蛋白の機能解析と副腎皮質機能低下症への影響,コルチコステロイド結合グロブリン（CBG）は、糖質コルチコイドのキャリア蛋白で、末梢臓器へのコルチゾール輸送に関わる。我々は、CBG低下を伴う副腎皮質機能低下症症例を経験し、新規 CBG遺伝子(SERPINA6)変異を同定するに至った。本研究では、我々が同定した①新規変異CBG蛋白の機能解析を行うとともに、②副腎皮質機能低下症疑い患者を前向きに検討し、低CBG血症の頻度やCBG遺伝子異常の有無、CBG異常患者の臨床的特徴を明らかにしたい。,若手研究,小区分54040:代謝および内分泌学関連,コルチコステロイド結合グロブリン,副腎皮質機能低下症,CBG,,,,,,,,,,,,,,,,,,,,,,,,,,,,,,,,,,,,,,,,,,,,,,,,,,,,,
23K15417,京都府立医科大学,河辺 泰宏,DIZEによるACE2活性化の機序を利用した小児の新規肥満薬の開発を目指して,熱産生によってエネルギー消費亢進をもたらす褐色脂肪組織（BAT：brown adipose tissue）は、肥満の治標標的臓器として注目を受けている。レニン-アンジオテンシン系に属するACE2/Ang 1-7は、BATの機能亢進、抗肥満作用を示す。抗原虫薬であるDIZEは、オフターゲット効果として抗肥満作用の報告があるが、機序は未解明である。また、別のオフターゲット効果としてACE2活性化を導くことが示されている。本研究は、DIZEのACE2/Ang1-7経路を介したBAT活性化によって媒介される機序を基盤とした安全かつ有効な新規の小児抗肥満薬の開発につなげることを目指している。,若手研究,小区分54040:代謝および内分泌学関連,小児肥満,ACE2,Angiotensin1-7,褐色脂肪組織,,,,,,,,,,,,,,,,,,,,,,,,,,,,,,,,,,,,,,,,,,,,,,,,,,,,
23K15416,名古屋市立大学,竹田 勝志,禁煙後の体重増加における視床下部炎症の意義,禁煙後に体重増加を来す症例にしばしば遭遇するが、その詳細なメカニズムや予防法は未解明である。申請者のグループは禁煙後の体重増加を模倣するモデルマウスを既に樹立しており(Takeda et. al. BBRC 2022)、そのマウスを用いて視床下部炎症が体重増加にどのように関与しているかを検討する。さらにはミクログリア細胞株を用いたニコチン添加/除去時の炎症性サイトカインの発現変化の検討、頭部MRIを用いたヒト禁煙者における視床下部グリオーシスの評価を行う。以上により、禁煙後の体重増加における視床下部炎症の意義を詳細に検証する。,若手研究,小区分54040:代謝および内分泌学関連,視床下部炎症,禁煙,ニコチン,体重,視床下部,炎症,,,,,,,,,,,,,,,,,,,,,,,,,,,,,,,,,,,,,,,,,,,,,,,,,,
23K15415,鹿児島大学,松田 恵理子,1型糖尿病の残存β細胞を保護・増殖するin vivo遺伝子治療の開発,1 型糖尿病（T1D）は、自己免疫反応によりβ 細胞が破壊されるため、インスリンが絶対的に不足する。主な治療法は強化インスリン療法であるが、生理的なインスリン分泌を再現することが出来ず、血糖値の正常化は困難である。そのため、急性合併症として重症低血糖の頻度が非常に高く、腎症や網膜症などの慢性合併症の併発リスクも依然として高い。このように、現在のT1D に対する治療は強化インスリン療法による対症療法であり、T1D そのものを治療するものではない。本研究では、T1D のβ細胞の保護・再生作用を誘導する新規増殖因子と、革新的な新薬モダリティである遺伝子治療によるT1D の画期的な治療戦略の開発を試みる。,若手研究,小区分54040:代謝および内分泌学関連,残存β細胞,in vivo遺伝子治療,1型糖尿病,,,,,,,,,,,,,,,,,,,,,,,,,,,,,,,,,,,,,,,,,,,,,,,,,,,,,
23K15414,熊本大学,小野 薫,miR-222のβ細胞増殖制御機序の解析と糖尿病病態マーカーとしての意義,糖尿病の主因はインスリン抵抗性とインスリン分泌機能低下であり、1型、2型糖尿病とも程度の違いはあるが、膵β細胞の減少によるインスリン分泌低下を伴っている。申請者らは、肝臓におけるインスリン作用伝達及びインスリン抵抗性を制御するmicroRNA としてmiR-222を同定したが、膵臓におけるmiR-222の役割は不明である。本研究では、miR-222遺伝子改変マウス、培養細胞を用いた実験を行い、膵臓におけるmiR-222とインスリンシグナル経路との関係を解明し、インスリン分泌能低下の発生機序を明らかにする。,若手研究,小区分54040:代謝および内分泌学関連,microRNA,糖尿病,膵β細胞,,,,,,,,,,,,,,,,,,,,,,,,,,,,,,,,,,,,,,,,,,,,,,,,,,,,,
23K15413,九州大学,武市 幸奈,炎症性マクロファージの形質転換におけるミトコンドリアダイナミクス制御機構の解明,肥満、糖尿病、脂肪肝等の生活習慣病の発症・進展には慢性炎症が深く関わる。ストレスに対する生体防御反応として生じた軽度な炎症が適切に収束されず様々な組織へ不可逆的な障害を生じることが慢性炎症の基盤である。慢性炎症の形成にはマクロファージの形質転換やメタボリックリプログラミングが重要な役割を担い、ミトコンドリア分裂がマクロファージの機能変化に関与することが示唆されているが詳細は明らかでない。本研究では、ミトコンドリア分裂によるマクロファージの形質転換とメタボリックリプログラミング制御機構を解明し、慢性炎症を基盤とした病態においてミトコンドリアダイナミクスを標的とした治療法の確立を目指している。,若手研究,小区分54040:代謝および内分泌学関連,マクロファージ,ミトコンドリア,慢性炎症,,,,,,,,,,,,,,,,,,,,,,,,,,,,,,,,,,,,,,,,,,,,,,,,,,,,,
23K15412,神戸大学,志智 大城,下垂体神経内分泌腫瘍に対するソマトスタチン抵抗性機序の解明,本研究ではヒトPitNET術後スフェロイドアッセイ系を用いてSRL抵抗性が生じる分子学的機序を明らかにする。術前SRL投与によりその反応性（ホルモン抑制、腫瘍縮小）を確定したGH産生PitNETに対して、術後スフェロイドを作成して培養し、SRL処理を行う。培養液中のGH濃度、細胞の増殖能を定量化し、臨床、スフェロイドアッセイの共にSRLに対する反応を認めた群をSRL反応群、共に認めなかった群をSRL抵抗群とし、この二つの術後組織のゲノム遺伝子解析、スフェロイドからRNAを抽出し、RNA-seq解析を行う。得られたパスウェイ解析を用い、SRL抵抗性に中心的な役割を担う分子を同定する。,若手研究,小区分54040:代謝および内分泌学関連,3Dスフェロイド,下垂体神経内分泌腫瘍,,,,,,,,,,,,,,,,,,,,,,,,,,,,,,,,,,,,,,,,,,,,,,,,,,,,,,
23K15411,京都大学,植田 洋平,骨伸長の調節機構解明による新規低身長治療法の探索,低身長症に対してはGH製剤が唯一の治療薬であるが、効果が十分でない病態が多く存在する。近年CNPが新規治療薬として注目されているが、十分な治療効果は得られていない。GH、CNPはともに骨伸長作用を持ち、異なる機序で働くことが示唆されているが、両者の特徴や相互作用は明らかではなく、併用に関する研究も行われていない。本研究では、GH、CNPの生体内での時間的空間的な機能、相互作用の解析のため、両者の欠損ラットの表現型比較や投与実験により両者の併用効果について検討を行う。本研究は、低身長症に対するGHとCNPの併用療法の基礎となり、表現型や年齢に応じた製剤選択および治療法開発につながるものである。,若手研究,小区分54040:代謝および内分泌学関連,成長因子,CNP,,,,,,,,,,,,,,,,,,,,,,,,,,,,,,,,,,,,,,,,,,,,,,,,,,,,,,
23K15410,京都大学,坂根 依利子,甲状腺における脱ヨード酵素の意義と病態生理学的役割の解明,脱ヨード酵素は、末梢組織において甲状腺ホルモン作用を調節する分子として認知されているが、我々の先行研究において甲状腺における分泌調節にも寄与することが示唆された。本研究では「甲状腺における」脱ヨード酵素の意義解明を目的とする。D2制御作用を既に見出しているリトドリンの投与、独自に開発した甲状腺機能亢進症マウスや成長ホルモン過剰発現マウスなど、多種多様なモデルを検証し、普遍的な現象であることを示す。さらに甲状腺特異的脱ヨード酵素ノックアウトマウスを作成・解析することで、生理的意義の解明に加え、各種モデル作成時に用いた処置を施した際の変化の観察を通じて、病態における位置付けをも明らかにする。,若手研究,小区分54040:代謝および内分泌学関連,甲状腺ホルモン脱ヨード酵素,甲状腺機能亢進症,成長ホルモン,甲状腺ホルモン,脱ヨード酵素,グルココルチコイド,,,,,,,,,,,,,,,,,,,,,,,,,,,,,,,,,,,,,,,,,,,,,,,,,,
23K15409,滋賀医科大学,村田 幸一郎,肝臓におけるO-GlcNAc修飾の役割の解明と新規糖尿病治療標的の探索,糖尿病は高血糖を呈する代謝性疾患で、インスリン分泌低下やインスリン抵抗性増大に起因する。糖尿病と蛋白の糖鎖修飾の関与が示唆され、細胞外蛋白への修飾だけでなく、核・細胞質蛋白への酵素学的な糖鎖修飾が注目されている。細胞内蛋白の糖鎖修飾はO-GlcNAc修飾と呼ばれUDP-GlcNAcを蛋白に修飾するO-GlcNAc転移酵素によって制御されるが、哺乳類での生理学的役割や糖代謝への関与は十分に解明されていない。本研究ではインスリン標的臓器であり糖代謝の中心的役割を担う肝臓におけるO-GlcNAc修飾と糖尿病との関わりを検討することで、O-GlcNAc修飾を標的とした新規糖尿病治療の可能性を探索する。,若手研究,小区分54040:代謝および内分泌学関連,O-GlcNAc修飾,肝細胞,グリコーゲン蓄積,Phkg2遺伝子,糖代謝,肝臓,,,,,,,,,,,,,,,,,,,,,,,,,,,,,,,,,,,,,,,,,,,,,,,,,,
23K15408,名古屋大学,安田 康紀,抗PD-1抗体誘発破壊性甲状腺炎マウスモデルを用いた甲状腺irAE非再発機序の解明,免疫チェックポイント阻害薬による免疫関連有害事象（irAE）の中で、抗PD-1抗体による甲状腺irAEの発症頻度が高いことが知られているが、一方で抗PD-1抗体の再投与では甲状腺irAEが再発しにくいことが報告されている。そこで本研究課題では甲状腺irAEの非再発機序の解明のため、申請者らが開発した抗PD-1抗体による破壊性甲状腺炎マウスモデルを用いて、抗PD-1抗体再投与後のT細胞の疲弊及び制御性T細胞やマクロファージによる抗炎症作用についての検討を行う。本研究により甲状腺irAEの非再発機序が解明されることによって、他のirAEの再発予防につながることが期待される。,若手研究,小区分54040:代謝および内分泌学関連,PD-1,甲状腺,免疫関連有害事象（irAE）,,,,,,,,,,,,,,,,,,,,,,,,,,,,,,,,,,,,,,,,,,,,,,,,,,,,,
23K15407,東京医科歯科大学,上船 史弥,ドーパミン受容体と会合するGPCRの探索と膵臓β細胞のインスリン分泌調節機構の解明,ドーパミンは膵臓β細胞のインスリン分泌を抑制する負の調節因子である。β細胞ではドーパミン受容体D1とD2が発現しインスリン分泌の抑制に関与するが、その詳細な分子機序は未解明である。本研究ではD1およびD2がインスリン分泌を制御する機序を、「Gタンパク質共役型受容体(GPCR)が他のGPCRと会合した多量体を形成することで下流シグナルを調節する」という考えに基づき解明することを目的とする。本研究によってドーパミンによるβ細胞の分泌能制御への理解が深まり、その成果は糖尿病治療に対する新たな標的の創出に貢献すると期待される。,若手研究,小区分54040:代謝および内分泌学関連,糖尿病,インスリン,GPCR,ドーパミン,膵臓ベータ細胞,膵臓,,,,,,,,,,,,,,,,,,,,,,,,,,,,,,,,,,,,,,,,,,,,,,,,,,
23K15406,群馬大学,井上 亮太,糖尿病におけるアルドラーゼBを介した新たなインスリン分泌障害機構の解明,糖尿病では糖毒性が膵β細胞機能を障害し、糖尿病病態形成に関わるがその分子機構は不明である。申請者はこれまで、2型糖尿病患者の膵島で発現上昇するミトコンドリア蛋白のUCP2が、解糖系酵素のアルドラーゼB（AldoB）の発現誘導を介して膵β細胞機能を障害することを報告してきた。本研究ではAldoBによる膵β細胞障害機構を、膵島活動電位測定、蛋白翻訳解析およびシングルセル蛋白解析により明らかにする。また、AldoBの発現抑制による膵β細胞保護効果を動物モデルおよびヒト膵島を用いて検証する。以上により、糖尿病下においてAldoBが膵β細胞機能を障害する新たな分子基盤を解明し、治療応用への知見を得る。,若手研究,小区分54040:代謝および内分泌学関連,2型糖尿病,アルドラーゼB,膵β細胞,インスリン分泌,糖尿病,,,,,,,,,,,,,,,,,,,,,,,,,,,,,,,,,,,,,,,,,,,,,,,,,,,
