awardnumber,organization,name,title,abstract,section,review_section,keyword1,keyword2,keyword3,keyword4,keyword5,keyword6,keyword7,keyword8,keyword9,keyword10,keyword11,keyword12,keyword13,keyword14,keyword15,keyword16,keyword17,keyword18,keyword19,keyword20,keyword21,keyword22,keyword23,keyword24,keyword25,keyword26,keyword27,keyword28,keyword29,keyword30,keyword31,keyword32,keyword33,keyword34,keyword35,keyword36,keyword37,keyword38,keyword39,keyword40,keyword41,keyword42,keyword43,keyword44,keyword45,keyword46,keyword47,keyword48,keyword49,keyword50,keyword51,keyword52,keyword53,keyword54,keyword55,keyword56
21K16367,山梨大学,石井 俊史,膵β細胞プロスタシンによるインスリン分泌制御機構と増殖維持効果の解明,膵β細胞において、上皮様成長因子受容体（EGFR）はインスリン分泌と細胞増殖に関与する。プロスタシン（PRSS8）はGPIアンカ-型及び分泌型のセリンプロテアーゼで，上皮型NaチャネルやToll-like receptor 4を切断・活性化する（本研究室員ら、）ことが知られている。同様にEGFRを活性化することが報告されている。PRSS8は膵臓をはじめ全身の内分泌臓器に幅広く発現しているが、その役割の多くが未解明である。本研究では、PRSS8によるEGFRシグナル調節を介したインスリン分泌制御機構とβ細胞増殖維持効果を解明することで、これらの効果を両立した新規糖尿病治療の分子基盤構築を目指す。,若手研究,小区分54040:代謝および内分泌学関連,膵β細胞,インスリン分泌,プロスタシン,インスリン,増殖,,,,,,,,,,,,,,,,,,,,,,,,,,,,,,,,,,,,,,,,,,,,,,,,,,,
21K16366,富山大学,岡部 圭介,肥満症に対するα-ケトグルタル酸のエピゲノム創薬への応用,"α-ケトグルタル酸（αKG, 2-オキソグルタル酸）はヒストン・DNA脱メチル化反応のコファクターとして機能し、エピジェネティックな遺伝子発現調節に大きな影響を及ぼすことが知られている。本研究課題では、αKG投与による各組織での代謝への影響およびその機序についてマウスを用いた動物実験により明らかにする。さらに健常成人を対象とした臨床研究によりαKG投与の安全性の確認、代謝への影響を検討し、最終的に肥満症・糖尿病治療への応用に発展させていく。",若手研究,小区分54040:代謝および内分泌学関連,αケトグルタル酸,肥満,糖尿病,メタボローム,エピゲノム,メタボロミクス,肥満症,耐糖能異常,メチル化,,,,,,,,,,,,,,,,,,,,,,,,,,,,,,,,,,,,,,,,,,,,,,,
21K16365,東京医科歯科大学,小宮 力,脂肪組織に由来するエクソソームmiRNAを介した肝細胞増殖機構の解明,肥満人口の急増から非アルコール性脂肪肝炎（NASH）の増加が必至であるが、肝硬変に至ったNASHに対する根本的な薬物治療は存在せず、重大な臨床課題となっている。近年、間葉系幹細胞を用いた再生医療が注目されており、肝硬変に対する有効性も示唆されているが、その分子機構は十分に解明されていない。本研究では、間葉系幹細胞の分泌するエクソソームが含有するmiRNAに着目し、脂肪組織間葉系幹細胞に由来し肝細胞の増殖作用を有するエクソソーム miRNAを同定し、肝硬変モデルマウスなどに対する治療効果を解析することで、miRNAによる肝臓の再生医療の可能性を検討する。,若手研究,小区分54040:代謝および内分泌学関連,miRNA,エクソソーム,脂肪組織,間葉系幹細胞,NASH,Txnip,EV,肝硬変,,,,,,,,,,,,,,,,,,,,,,,,,,,,,,,,,,,,,,,,,,,,,,,,
21K16364,東京大学,田中 督記,妊娠時高中性脂肪血症のマウスモデル確立とin vivo分子機構解明,妊娠時の重度高中性脂肪血症は重症膵炎・胎児死亡などの重篤な合併症を生じる。,若手研究,小区分54040:代謝および内分泌学関連,高中性脂肪血症,妊娠合併症,apoA-V,治療法開発,動物モデル,アポリポ蛋白,,,,,,,,,,,,,,,,,,,,,,,,,,,,,,,,,,,,,,,,,,,,,,,,,,
21K16363,千葉大学,牛木 晶子,AKAP13を用いたグルココルチコイドの新たな骨代謝調節機構の解明,世界に先駆けて作成したAKAP13を骨特異的にノックアウトしたマウスを用いてPSL投与による骨塩減少誘導マウスの解析を行う。大腿骨、脛骨からBMSCsを分離した分化培養と、頭蓋骨から骨細胞を分離し培養する方法を用いて、コンディショナルノックアウトマウスのプライマリーカルチャーを用いて、GC投与・非投与下での、遺伝子発現解析を行う。前骨芽細胞細胞株ではCRISPR/CAS9システムでノックアウト細胞を作製、RNA-seqを用いて遺伝子発現変化を網羅的に解析する。,若手研究,小区分54040:代謝および内分泌学関連,骨粗鬆症,グルココルチコイド,骨リモデリング,骨形成,AKAP13,時計遺伝子,骨代謝,Rhoシグナル,骨分化,,,,,,,,,,,,,,,,,,,,,,,,,,,,,,,,,,,,,,,,,,,,,,,
21K16362,群馬大学,須賀 孝慶,新規グルカゴン分泌制御機構に着目した生活習慣病治療法の開発,グルカゴンは膵α細胞から分泌されるが、その分泌機構は十分に解明されていない。申請者は既にグルコーストランスポーターSGLT-1が膵α細胞に発現していることを報告した。本研究は膵α細胞SGLT-1によるグルカゴン分泌制御に着目した臨床応用を目的とする。,若手研究,小区分54040:代謝および内分泌学関連,グルカゴン,脂肪肝,肥満,糖尿病,生活習慣病,,,,,,,,,,,,,,,,,,,,,,,,,,,,,,,,,,,,,,,,,,,,,,,,,,,
21K16361,旭川医科大学,滝山 貴央,新規HIF-1標的遺伝子HORMAD1のNASH/HCC発生における役割,,若手研究,小区分54040:代謝および内分泌学関連,,,,,,,,,,,,,,,,,,,,,,,,,,,,,,,,,,,,,,,,,,,,,,,,,,,,,,,,
21K16360,川崎医科大学,木村 友彦,膵島血流に着目したGLP-1の新規作用機序の解明：In vivo画像による検討,β細胞特異的にEGFPでラベリングしたB6.Cg-Tg（Ins1-EGFP）1Hara/J マウスの膵ラ氏島における血行動態とGLP-1 受容体作動薬の影響を、Nikon A1R-MP multiphoton confocal microscopy 下にて評価する。すなわち、GLP-1 受容体作動薬の膵島周囲血流への急性・慢性効果を検証し、一方で、GLP-1受容体作動薬慢性投与によるβ細胞機能への効果を膵島虚血に注目し評価する。また、糖尿病病態進展期では、膵β細胞だけでなく、血管GLP-1 受容体発現も低下おり、病態早期、進展期におけるGLP-1 受容体作動薬の効果の違いについても検討する。,若手研究,小区分54040:代謝および内分泌学関連,膵島血流,GLP-1,虚血,糖尿病,膵島,血流,GLP-1受容体作動薬,SGLT2阻害薬,,,,,,,,,,,,,,,,,,,,,,,,,,,,,,,,,,,,,,,,,,,,,,,,
21K16359,星薬科大学,米持 奈央美,栄養不良による体重減少の改善を目的とした摂食調節機構の解明,加齢に伴う身体機能の低下、抗がん薬による食欲不振や進行がんに合併するがん悪液質では、いずれも体重減少や低栄養、消耗状態が認められる。体重減少が著しく進行すると全身状態の悪化をひき起こす。体重減少は主に食欲不振に起因することから、食事量を増やすことが全身状態を改善させるために重要である。近年、申請者はκオピオイド受容体が摂食行動を促進的に調節することを明らかにしたことから、κオピオイド受容体作動薬が体重減少の改善薬になる可能性がある。そこで本研究では、これらの知見を基にκオピオイド受容体による摂食促進作用の作用機序と食欲不振や体重減少に対する改善効果について明らかにする。,若手研究,小区分54040:代謝および内分泌学関連,摂食調節,オピオイド,側坐核,食欲不振,中枢,体重減少,,,,,,,,,,,,,,,,,,,,,,,,,,,,,,,,,,,,,,,,,,,,,,,,,,
21K16358,自治医科大学,礒田 雅代,外因性ケトン体生成物によるレプチン抵抗性改善メカニズムの解明,"レプチンは抗肥満ホルモンとして知られているが、一般の肥満者では「レプチン抵抗性」の状態にあり、その分子基盤の解明は、新しい肥満治療法の開発に結びつくことが期待される。視床下部における小胞体(ER)ストレスがレプチン抵抗性の一因として報告されており申請者らは外因性ケトン体生成物である1,3-ブタンジオール(BD)投与により食事誘導性肥満（DIO）マウスにおいて摂食量および体重増加が抑制されることを確認した。BDは血中β-ヒドロキシ酪酸濃度および視床下部ATP濃度を上昇させる。本研究では、ケトン体のレプチン抵抗性改善メカニズムを明らかにし、視床下部ATPを標的とした肥満治療法の臨床応用の可能性を探索する。",若手研究,小区分54040:代謝および内分泌学関連,レプチン抵抗性,視床下部,小胞体ストレス,ATP,ケトン体,MCTオイル,肥満,"1,3-ブタンジオール",中鎖脂肪酸オイル,,,,,,,,,,,,,,,,,,,,,,,,,,,,,,,,,,,,,,,,,,,,,,,
21K16357,和歌山県立医科大学,浦木 進丞,膵β細胞特異的Cox6a2発現抑制による糖尿病発症機序の解明,2型糖尿病において慢性的高血糖が膵β細胞機能障害を引き起こす現象は、膵β細胞高血糖毒性として知られる。一方、糖尿病治療により膵β細胞機能が改善する分子メカニズムは明白ではない。過食肥満2型糖尿病モデルマウスdb/dbに対し、SGLT2阻害薬を投与し高血糖を軽減すると、膵β細胞に重要な遺伝子の発現が有意に改善する。この改善に関わる未知の因子を同定すべく、無治療群と高血糖軽減群の膵島内遺伝子発現を解析・比較した所、後者で膵β細胞障害を惹起する活性酸素増大に関わるCox6a2の発現低下を認めた。本研究では、Cox6a2の膵β細胞特異的欠損マウスを作成し、糖代謝に与える影響を明らかにする。,若手研究,小区分54040:代謝および内分泌学関連,膵β細胞,Cox6a2,糖尿病,糖毒性,酸化ストレス,活性酸素,ミトコンドリア呼吸鎖複合体Ⅳ,2型糖尿病,,,,,,,,,,,,,,,,,,,,,,,,,,,,,,,,,,,,,,,,,,,,,,,,
21K16356,熊本大学,花谷 聡子,マクロファージ増殖抑制を介したGPR43による糖尿病心筋症発症抑制の検討,糖尿病心筋症は糖尿病患者の生命予後に影響することからその病態解明が求められている。当教室では組織増殖マクロファージが炎症を介して動脈硬化進展に関与していることを報告し、短鎖脂肪酸である酢酸がマクロファージの増殖抑制効果をもつことを見いだしている。短鎖脂肪酸の受容体GPR43は免疫応答の保全に寄与しており、本研究ではGPR43を介した免疫応答の制御が糖尿病心筋症の発症・進展を抑制するという仮説を証明するため、マクロファージ特異的増殖抑制マウスとGPR43遺伝子改変マウスを用いた実験を行い、GPR43活性化による免疫応答制御が糖尿病心筋症の新規治療法となり得ることの証明を目指す。,若手研究,小区分54040:代謝および内分泌学関連,短鎖脂肪酸,糖尿病心筋症,動脈硬化,マクロファージ増殖,,,,,,,,,,,,,,,,,,,,,,,,,,,,,,,,,,,,,,,,,,,,,,,,,,,,
21K16355,神戸大学,細川 友誠,脂肪組織の健康的増大機構の解析,過剰なエネルギー摂取下においても、脂肪組織が機能を保持しながら増大することによって、全身の代謝異常の発症が抑制される「脂肪組織の健康的増大」という現象が知られているが、その詳細な機序は未だ明らかではない。申請者は脂肪細胞特異的に炎症制御関連酵素遺伝子を強制発現したマウスを作成し、本マウスが高脂肪食飼育下で「脂肪組織の健康的増大」を呈することを確認した。本計画は、「脂肪組織の健康的増大」が生じた遺伝子改変マウスおよび減量外科手術時に採取したヒト脂肪組織生検試料について詳細な代謝表現型の解析を行い、「脂肪組織の健康的増大」の機構を明らかにすることを目指す。,若手研究,小区分54040:代謝および内分泌学関連,肥満,脂肪組織,インスリン感受性,脂質メディエーター,,,,,,,,,,,,,,,,,,,,,,,,,,,,,,,,,,,,,,,,,,,,,,,,,,,,
21K16354,大阪大学,藤原 誠,軟骨無形成症における特異的肥満の耐糖能機序の解明,2型糖尿罹患の病態と肥満は密接に関連する。先天性骨疾患である軟骨無形成症では高頻度に肥満を合併するが、単純型肥満と比して耐糖能異常を来し難いとされる。本研究では、軟骨無形成症に特異的な肥満と耐糖能の関連メカニズムの解明を目的とする。軟骨無形成症患者由来iPS細胞から誘導した脂肪細胞を用いて、本症が脂肪細胞の分化や耐糖能に及ぼす影響を解析する。また、軟骨無形成症モデルマウスを用いて同様の検討を行う。更に、そのメカニズムへの関与が予想される代謝産物などの同定も目指す。本研究の成果は、特に肥満と関連した2型糖尿病に対する新たな治療戦略に寄与することが期待できる。,若手研究,小区分54040:代謝および内分泌学関連,軟骨無形成症,2型糖尿病,肥満,脂肪細胞,,,,,,,,,,,,,,,,,,,,,,,,,,,,,,,,,,,,,,,,,,,,,,,,,,,,
21K16353,大阪大学,藤島 裕也,代謝性血管障害における肝由来XORと脂肪由来アディポネクチンの意義の解明,メタボリックシンドロームを背景とした糖尿病や非アルコール性脂肪性肝疾患(NAFLD)は、それぞれ血管障害と強く関連することが知られているが、その分子メカニズムは十分に解明されていない。本研究では、NAFLD患者で血中での活性が上昇するキサンチン酸化還元酵素（XOR）と、内臓脂肪蓄積に伴い血中濃度が減少するアディポネクチンに注目し、これらの因子が血管障害に及ぼす影響を明らかとすることで、心血管疾患に対する治療応用を目指す。,若手研究,小区分54040:代謝および内分泌学関連,キサンチン酸化還元酵素,アディポネクチン,T-cadherin,糖尿病,非アルコール性脂肪性肝疾患,動脈硬化症,,,,,,,,,,,,,,,,,,,,,,,,,,,,,,,,,,,,,,,,,,,,,,,,,,
21K16352,名古屋大学,小林 朋子,免疫チェックポイント阻害薬による下垂体障害のバイオマーカーの同定,免疫チェックポイント阻害薬（ICIs）はその有効性の一方で免疫関連有害事象（irAEs）の発生が問題となっている。中でも下垂体障害は重篤なirAEsであるがその発症機序は未だ不明である。一方で申請者は下垂体障害発症例ではICIsによる抗腫瘍効果が高い可能性を報告しており、ICIs治療前に下垂体障害の高リスク者を判別できるバイオマーカーは、副作用予防法の開発や治療法の選択において臨床的に極めて有用でありその同定が待たれている。本研究では、治療開始前の患者血液検体を用い、ICIsによる下垂体障害の発症を治療開始前に予測するバイオマーカーを確立し、より精密な個別化医療の実現へ繋げることを目的とする。,若手研究,小区分54040:代謝および内分泌学関連,pituitary irAEs,biomarker,thyroid irAEs,irAE,バイオマーカー,下垂体,甲状腺,,,,,,,,,,,,,,,,,,,,,,,,,,,,,,,,,,,,,,,,,,,,,,,,,
21K16351,福井大学,佐藤 さつき,脂肪滴が洞房結節細胞のぺースメーカー機能を障害するメカニズムの解析,糖尿病やメタボリックシンドローム（Mets）では心筋細胞内に脂肪滴が蓄積し（脂肪心筋）、心機能障害の原因となる。糖尿病やMetsは不整脈の有病率が高く、心房細動や徐脈をきたす洞結節機能不全（SND）を合併しやすいが、その詳細なメカニズムは明らかではない。,若手研究,小区分54040:代謝および内分泌学関連,洞結節細胞,徐脈,脂肪滴,洞機能不全,ペリリピン２,ペリリピン2,脂肪心筋,洞結節機能不全,,,,,,,,,,,,,,,,,,,,,,,,,,,,,,,,,,,,,,,,,,,,,,,,
21K16350,東京医科歯科大学,辻本 和峰,摂食時間制限が糖脂質代謝を改善する分子メカニズムの解明,1日の中で一定の絶食時間を設けることで、総エネルギー摂取量が同等であっても、肥満や糖・脂質代謝が改善することが知られているが、その詳細な分子メカニズムは不明である。本研究では、摂食時間制限によってもたらされる糖・脂質代謝改善のメカニズムについて、長寿遺伝子SIRT1を介したエピジェネティクスの観点から解明することを目指す。,若手研究,小区分54040:代謝および内分泌学関連,エネルギー代謝,時間栄養学,エピジェネティクス,遺伝子,発現制御,,,,,,,,,,,,,,,,,,,,,,,,,,,,,,,,,,,,,,,,,,,,,,,,,,,
21K16349,奈良先端科学技術大学院大学,小鍛治 俊也,肝臓筋肉連関による糖投与後代謝制御及び肥満による制御障害のトランスオミクス解析,肥満は、複数の臓器の適切な代謝制御とそれらの臓器間代謝サイクルを乱し、高血糖、高脂血症、２型糖尿病など代謝疾患を引き起こす。臓器代謝及び臓器間代謝サイクルはDNA・RNA・タンパク質・代謝物の各オミクス階層にまたがるトランスオミクスネットワークにより制御されており、未だその制御の全貌は明らかではない。本研究では、糖投与後の野生型マウスとレプチン欠損肥満マウスそれぞれについて、肝臓と骨格筋の代謝制御ネットワークを統合した肝臓筋肉連関トランスオミクスネットワークの構築を試みる。これにより肥満による肝臓筋肉間代謝サイクル異常およびそれらの原因となる上流因子の大規模な同定を目指す。,若手研究,小区分54040:代謝および内分泌学関連,トランスオミクス,臓器連関,肥満,インスリン,マルチオミクス,,,,,,,,,,,,,,,,,,,,,,,,,,,,,,,,,,,,,,,,,,,,,,,,,,,
21K16348,東北大学,宗像 佑一郎,ヒト膵島における嗅覚受容体を介したインスリン分泌機構の解明,研究代表者は、嗅覚受容体の一つであるOLFR15がマウス膵β細胞に発現しグルコース応答性インスリン分泌(GSIS)の促進に重要な役割を果たしていること、その相同遺伝子であるOC2C1がヒト膵島に発現していること、を明らかにしてきた。その知見に基づき、ヒトにおいて嗅覚受容体という化学受容器を用いて、膵β細胞がインスリン分泌を調節する仕組みや個体間の背景の違いによる変容、インクレチンシグナルとの相互作用を明らかとし、化合物制御でのGSIS促進による治療に向けた検討を行う。,若手研究,小区分54040:代謝および内分泌学関連,インスリン分泌,糖尿病,嗅覚受容体,膵β細胞,,,,,,,,,,,,,,,,,,,,,,,,,,,,,,,,,,,,,,,,,,,,,,,,,,,,
21K16347,国立研究開発法人医薬基盤・健康・栄養研究所,林 高則,中枢を介した成長や老化、糖代謝制御の分子機構の解明,我々はこれまでに、これらのシグナルにおける主要な細胞内基質の1つであるインスリン受容体基質(Irs)1が成長や糖代謝に関与する重要な分子であることを見出したが、その責任臓器など詳細な機序は分かっていない。,若手研究,小区分54040:代謝および内分泌学関連,インスリン受容体基質-1,成長,中枢神経,インスリン受容体基質（Irs）1,成長障害,インスリン受容体基質,インスリン,IGF-1,成長ホルモン,,,,,,,,,,,,,,,,,,,,,,,,,,,,,,,,,,,,,,,,,,,,,,,
21K16346,東京女子医科大学,山下 薫,新型コロナウィルス感染症の病態におけるACE2の役割,新型コロナウィルス(SARS-CoV2)感染においては、アンジオテンシン変換酵素(ACE) 2がウィルス感染の侵入経路となると同時に、感染後は呼吸器官における保護作用を有するとの動物実験結果もあり、ヒトでのSARS-CoV2感染症(COVID-19)の病態におけるACE2の役割の善悪については未だ明らかとなっていない。,若手研究,小区分54040:代謝および内分泌学関連,COVID-19,ACE2,新型コロナウィルス感染症,SARS-CoV2,高血圧,,,,,,,,,,,,,,,,,,,,,,,,,,,,,,,,,,,,,,,,,,,,,,,,,,,
21K16345,順天堂大学,氷室 美和,新規レポーターマウスを用いたα細胞容量制御機構の解明,以前我々は蛍光特性を経時的に変化させα細胞を時間軸に沿って解析するためのレポーターマウス“Gcg-Timer”マウスを作製し、様々な分化段階のα細胞を高時間分解能で単離することに成功した。最近申請者はグルカゴン遺伝子を欠失させたGcg-Timerマウスでは、胎生期のみならず成体でもα細胞新生が誘導されることを見出した。グルカゴンシグナル抑制によりα細胞の増殖が亢進することが知られていたが、この結果はα細胞新生もまた誘導されることを示している。本研究では、グルカゴンシグナルを抑制したGcg-Timerマウスより新生α細胞を単離し、グルカゴンシグナル抑制がα細胞新生を誘導する分子機構を解明する。,若手研究,小区分54040:代謝および内分泌学関連,α細胞,グルカゴンシグナル,細胞容量,膵α細胞,内分泌細胞,糖尿病,,,,,,,,,,,,,,,,,,,,,,,,,,,,,,,,,,,,,,,,,,,,,,,,,,
21K16344,奈良県立医科大学,正畠 良悟,間歇的低酸素が筋細胞においてインスリン抵抗性関連遺伝子発現に与える影響,睡眠時無呼吸症候群 (Sleep apnea syndrome; SAS) 患者は睡眠中に繰り返す無呼吸により、全身の組織、細胞は間歇的低酸素 (Intermittent hypoxia; IH)に曝露される。SASの重症化はインスリン抵抗性との関連が指摘されている。骨格筋はグルコースの取り込みにとって重要な代謝組織である。今回、マウスC2C12細胞とヒトRD細胞を用いてIHがグルコースの取り込みや利用に関わる遺伝子と筋細胞で発現・分泌されるインスリン抵抗性に関わる生理活性因子の遺伝子発現に与える影響とその分子機序について検討する。,若手研究,小区分54040:代謝および内分泌学関連,間歇的低酸素,インスリン抵抗性,ミオカイン,睡眠時無呼吸症候群,2型糖尿病,糖尿病,Intermittent hypoxia,myokines,IL-8,osteonectin,myonectin,OCT1,NRF2,骨格筋,,,,,,,,,,,,,,,,,,,,,,,,,,,,,,,,,,,,,,,,,,
21K16343,熊本大学,下田 真唯子,鉄代謝の変容が血球系譜に及ぼす影響とその制御機構の解明,鉄は生命活動に必須の微量金属で、全身への酸素運搬や広範な酵素の補因子として重要な役割を担う。免疫細胞においても鉄がその細胞機能に影響を及ぼすと考えられるが、鉄代謝と血球分化の関係性についてはほとんど解明されていない。本研究では鉄代謝の中心的制御分子FBXL5を血球系の全ての細胞において鉄代謝を変容させたマウスを用い、鉄代謝による造血発生の制御機構について解析する。血球系譜における鉄代謝の役割を明らかにすることにより、造血・免疫システムと代謝経路のクロストークの理解を深め、原発性免疫不全症候群の病態解明が期待できる。,若手研究,小区分54040:代謝および内分泌学関連,鉄代謝,血球系譜,造血発生,B細胞分化,抗体産生,血球分化,,,,,,,,,,,,,,,,,,,,,,,,,,,,,,,,,,,,,,,,,,,,,,,,,,
