awardnumber,organization,name,title,abstract,section,review_section,keyword1,keyword2,keyword3,keyword4,keyword5,keyword6,keyword7,keyword8,keyword9,keyword10,keyword11,keyword12,keyword13,keyword14,keyword15,keyword16,keyword17,keyword18,keyword19,keyword20,keyword21,keyword22,keyword23,keyword24,keyword25,keyword26,keyword27,keyword28,keyword29,keyword30,keyword31,keyword32,keyword33,keyword34,keyword35,keyword36,keyword37,keyword38,keyword39,keyword40,keyword41,keyword42,keyword43,keyword44,keyword45,keyword46,keyword47,keyword48,keyword49,keyword50,keyword51,keyword52,keyword53,keyword54,keyword55,keyword56
19K17979,金沢大学,金森 岳広,糖尿病関連ヘパトカイン発現のマスターレギュレーターの同定とその機能解析,肥満・2型糖尿病状態の肝臓で過剰産生・分泌されるセレノプロテインP（SeP）およびLeukocyte cell-derived chemotaxin 2（LECT2）は、全身にインスリン抵抗性を含む多様な病態を惹起する“ヘパトカイン”である。SeP・LECT2の分泌異常は、2型糖尿病を代表する過栄養関連疾患の有力な治療標的と考えられるが、それらの分泌異常が起きる分子機序は不明であった。申請者は、その候補鍵分子として新規転写因子KLF16を同定した。本研究では、培養肝細胞・マウスを用いて、KLF16が肝細胞のSeP・LECT2両遺伝子発現を介して全身の代謝を制御することを明らかにする。,若手研究,小区分54040:代謝および内分泌学関連,肝臓,2型糖尿病,ヘパトカイン,転写因子,インスリン抵抗性,脂肪肝,糖尿病,糖代謝異常,,,,,,,,,,,,,,,,,,,,,,,,,,,,,,,,,,,,,,,,,,,,,,,,
19K17978,富山大学,角 朝信,マクロファージによる癌幹細胞数制御に着目した肥満誘発性発癌機構の解析,肥満で癌発症リスクが増加する。肥満者が世界的に増加し、肥満関連癌も増加傾向である。しかしながら、肥満がどのように癌発症・進展に関与するのか機序は未だ充分に解明されていない。マクロファージは血管新生、免疫抑制などの多様な機能をもっており、癌微小環境を構築する主要な細胞である。本研究では1)CD206+M2マクロファージが癌幹細胞数の制御を介して癌発症・進展を促進していないか。2)肥満によるCD206+M2マクロファージの表現型や細胞数の変化が癌幹細胞数に影響を与え、癌の発症・進展を促進していないかを明確にする。,若手研究,小区分54040:代謝および内分泌学関連,マクロファージ,癌,肥満,癌幹細胞,M2マクロファージ,,,,,,,,,,,,,,,,,,,,,,,,,,,,,,,,,,,,,,,,,,,,,,,,,,,
19K17977,東京大学,桜井 賛孝,新規糖尿病関連遺伝子UBE2E2の膵β細胞における役割の解明,近年のヒトゲノムワイド関連解析の結果、様々な人種・地域における2 型糖尿病の疾患感受性遺伝子が同定されている。そのような中で2010年に当科のグループにより日本人や東アジア人でのみ有意な2型糖尿病遺伝子としてUBE2E2が報告された。UBE2E2はユビキチン修飾系においてユビキチンのキャリアー蛋白として機能する種々のE2の中の一つであるが、その機能に関しては明らかでない点が多く、特に膵β細胞における役割は不明である。そこで我々は、発生工学的手法を用いて膵β細胞特異的UBE2E2トランスジェニックマウスを作製し、その表現型を解析することで膵β細胞でのUBE2E2の役割を解明する。,若手研究,小区分54040:代謝および内分泌学関連,インスリン分泌,膵β細胞,ユビキチン,糖尿病,インスリン,,,,,,,,,,,,,,,,,,,,,,,,,,,,,,,,,,,,,,,,,,,,,,,,,,,
19K17975,群馬大学,大津 義晃,甘味受容体を介するGLP-1分泌促進薬の開発にむけた検討,甘味受容体は舌の表面に発現して味覚を感知するだけでなく、視床下部、膵β細胞、消化管上皮や気道上皮など身体の多くの部位に発現している。消化管内分泌細胞においては、甘味受容体を介してglucagon-like peptide-1（GLP-1）分泌が促されることが分かっている。このGLP-1はインスリン分泌を促すホルモンであり、糖尿病治療薬として臨床応用もされているが、これまでGLP-1そのものの分泌を促す薬剤の開発には至っていない。そこで本研究では、消化管内分泌細胞を用いて、甘味受容体を介するGLP-1分泌促進機構の詳細な解析を行い、薬剤の開発に繋がる検討を行うこととする。,若手研究,小区分54040:代謝および内分泌学関連,甘味受容体,ATP,GLP-1,糖尿病,消化管,,,,,,,,,,,,,,,,,,,,,,,,,,,,,,,,,,,,,,,,,,,,,,,,,,,
19K17974,東北大学,山崎 有人,アルドステロン関連高血圧とカルシウム代謝との新たなクロストーク,本研究では、PA患者より外科的切除された副腎手術検体を用いて、Ca代謝を調節する因,若手研究,小区分54040:代謝および内分泌学関連,Ca チャネル,アルドステロン,高血圧,副腎,Ca チャネル拮抗薬,カルシウム代謝,原発性アルドステロン症,病理,,,,,,,,,,,,,,,,,,,,,,,,,,,,,,,,,,,,,,,,,,,,,,,,
19K17973,弘前大学,綿貫 裕,中枢、末梢組織におけるHPA系ネガティブフィードバック機構の分子学的機序の検討,"現段階で申請者らはHPA系のNFに関与すると思われるタンパク群の発現ベクターを構築済みである。今後その一つであるGDF15については肝HepG2細胞とHuH7細胞で、Rasd1, HDAC6, FKBP5/4の蛋白発現を下垂体AtT20細胞或いは視床下部4B細胞において、その発現の有無によるHPA軸の構成要素の変化や動態を確認する予定である。本研究では、申請者らはCRH-POMC/ACTH-グルココルチコイド軸のNFシステムを対象として、中枢或いは末梢組織におけるその分子機序を明らかにしたいと考えている。",若手研究,小区分54040:代謝および内分泌学関連,視床下部,下垂体,副腎,ストレス応答,ストレス,ネガティブフィードバック,,,,,,,,,,,,,,,,,,,,,,,,,,,,,,,,,,,,,,,,,,,,,,,,,,
19K17972,独立行政法人国立病院機構(呉医療センター臨床研究部),吉井 陽子,エピゲノム調節を基盤にしたRXRを介したアルドステロン産生腺腫増殖機構の解明,申請者はアルドステロン産生腺腫（APA）におけるDNAメチル化を基盤にしたアルドステロン合成制御機構の解明から創薬基盤因子の探索行ってきた．これまでの研究結果から，レチノイドX受容体（RXR）共役因子Xは，プロモーター領域の脱メチル化により転写が促進され，APAに発現するATPase体細胞変異がその脱メチル化を誘導することをている．本研究ではRXRを介したAPAの腫瘍増殖機構およびアルドステロン合成制御における合成機構を解明することを目的とする．,若手研究,小区分54040:代謝および内分泌学関連,原発性アルドステロン症,内分泌,高血圧,primary aldosteronism,hypertension,aldosterone,vitamin D receptor,腫瘍増殖,アルドステロン,RXR,エピゲノム,アルドステロン合成,DNAメチル化,,,,,,,,,,,,,,,,,,,,,,,,,,,,,,,,,,,,,,,,,,,
19K17971,国立研究開発法人理化学研究所,小塚 智沙代,胎盤を介した肥満体質の遺伝機構の解明,肥満による二型糖尿病に罹患した母親から生まれた子供において生活習慣病の発症率が高いことが明らかになっているが、その成因における遺伝素因の寄与は僅か5%未満とされている。実験動物を用いた研究から卵子におけるエピジェネティックな変化が次世代のエネルギー代謝を変化させる可能性が示唆されているが、そのメカニズムは全くわかっていない。肥満女性の妊娠時には胎盤異常が高頻度で認められること、動物実験により胎盤異常を伴う出産では産仔が糖尿病を発症することが示されていることから、本研究ではその遺伝機序として胎盤機能に着目し、代謝疾患の母子間遺伝のメカニズムを明らかにする。,若手研究,小区分54040:代謝および内分泌学関連,糖尿病,肥満,胎盤,次世代,エピゲノム,,,,,,,,,,,,,,,,,,,,,,,,,,,,,,,,,,,,,,,,,,,,,,,,,,,
19K17970,愛知医科大学,成定 明彦,隠れマルコフモデルによる糖尿病発症モデル構築と糖尿病発症予防への展開,糖尿病発症予防のための生活習慣改善介入は有効だが、介入ターゲットとなる「ハイリスク者」の選定で、例えばHbA1cのみの方法などの限界が示されている。様々な糖尿病リスク因子もわかっているが、一時点のみの状態であり、毎年健康診断を行い、結果データが蓄積していくわが国の特性をふまえた糖尿病ハイリスク者選定方法の構築が望まれる。,若手研究,小区分54040:代謝および内分泌学関連,糖尿病予防,健康診断,機械学習,前糖尿病,空腹時血糖異常（IFG）,スクリーニング,隠れマルコフモデル,特定保健指導,境界型糖尿病,脂肪肝,糖尿病,マルコフモデル,産業保健,予防医学,健康診断データ,,,,,,,,,,,,,,,,,,,,,,,,,,,,,,,,,,,,,,,,,
19K17969,金沢医科大学,平井 太郎,糖尿病性心筋症の発症機序に基づく新たな治療法の確立,糖尿病症例では心不全の合併頻度が高く、その成因として糖尿病性心筋症（DMCMP）が重要である。DMCMPでは線維化と心筋細胞の脱落が重要な病理学的特徴であるが、申請者は予備的検討でDPP-4阻害により1型糖尿病マウスの心臓線維化が抑制されることを見出した。ただし、臨床試験ではDPP-4阻害薬の心血管イベント発症抑制の報告はない。この基礎実験と臨床結果の乖離に関して、申請者はマウス系統、1型糖尿病と2型糖尿病モデルの違いに着目した。また、心筋細胞の脱落機序に関しては『ネクロプトーシス』という新たな細胞死プログラムに着目し、DMCMPの病態解明を試みる。,若手研究,小区分54040:代謝および内分泌学関連,糖尿病性心筋障害,necroptosis,DPP4,End-MT,ネクロトーシス,糖尿病性心筋症,,,,,,,,,,,,,,,,,,,,,,,,,,,,,,,,,,,,,,,,,,,,,,,,,,
19K17968,東京女子医科大学,望月 翔太,ヒトiPS由来膵β細胞シートを用いた1型糖尿病治療法の開発,インスリン依存糖尿病の根本治療として、近年多能性幹細胞からのβ細胞の再生医療が注目されている。本学では、独自の細胞シート技術により細胞のみから成る組織の形成と移植によって再生医療を実現し、また近年独自の大量培養技術によりヒトiPS細胞由来膵β細胞の量産化も可能となっている。世界的には膵β細胞のみを移植する手法が多用されているが、膵臓の成熟化には組織内間質細胞の存在が不可欠であり、本研究では分化誘導後の膵β細胞を間葉系幹細胞等の間質細胞上で培養した細胞シートを作製し、機能的なiPS細胞由来膵β細胞シート移植方法の確立を目指す。,若手研究,小区分54040:代謝および内分泌学関連,iPS細胞,再生医療,p53,増殖能,膵島,脂肪由来間質細胞,iPS,膵β細胞,膵前駆細胞,細胞シート,脂肪由来幹細胞,成熟,iPS cell,β cell,ASC,cell sheet,,,,,,,,,,,,,,,,,,,,,,,,,,,,,,,,,,,,,,,,
19K17967,順天堂大学,三浦 正樹,糖尿病再生医療に向けたα-to-β reprogrammingの効率化,糖尿病の根治を実現するには失われたβ細胞を補充する必要がある。申請者はSTAT3が膵外分泌細胞からβ細胞へのリプログラミングを制御する重要な転写因子であることを見出し、STAT3シグナルを抑制することによりβ細胞新生効率を亢進させ、糖尿病モデルマウスの血糖値を是正することに成功した。 β細胞再生医療の標的組織として膵外分泌細胞とともに注目されているのが膵α細胞であり、 申請者はα細胞からβ細胞を作製することに成功している。本研究ではα細胞からβ細胞へのリプログラミングにおけるSTAT3の重要性を明らかにし、STAT3シグナルを修飾することによりβ 細胞新生の効率化を目指す。,若手研究,小区分54040:代謝および内分泌学関連,糖尿病,再生医療,Pdx1,Stat3,リプログラミング,α細胞,β細胞,糖尿病再生医療,α-to-β reprogramming,STAT3,β細胞新生,α to β reprogramming,,,,,,,,,,,,,,,,,,,,,,,,,,,,,,,,,,,,,,,,,,,,
19K17966,京都府立医科大学,岡田 博史,microRNA/let-7の骨格筋萎縮・糖代謝における機能解析,糖尿病において骨格筋の萎縮は糖代謝を障害し、血糖コントロール悪化の原因となるばかりでなく、糖尿病患者の予後、日常生活動作(ADL)・生活の質(QOL)も低下させる。私たちは先行研究で、骨格筋萎縮ではmicroRNA/let7の発現が障害されていること、let7の発現低下により筋管細胞の糖取り込みが障害されている先行知見を得た。これらを踏まえ、本申請ではlet7の導入による遺伝子干渉により、筋管細胞での糖取り込みが改善し、糖代謝が改善する可能性及びその分子生物学的機序をin vitro/in vivoで検証する。もってlet-7が2型糖尿病に対する核酸医薬品となりうることを明らかにする。,若手研究,小区分54040:代謝および内分泌学関連,サルコペニア,micro RNA,let-7e,microRNA,骨格筋,糖取り込み能,糖代謝,,,,,,,,,,,,,,,,,,,,,,,,,,,,,,,,,,,,,,,,,,,,,,,,,
19K17965,徳島大学,西庄 俊彦,PET-CTを用いたビスホスホネートの薬物動態解析と新規輸送システムの開発,ビスホスホネート（以下、BP）は破骨細胞に働き骨吸収を抑制するが、抗腫瘍効果の報告も散見される。我々は骨巨細胞腫症例に対してBPを局所投与すると極めて高い抗腫瘍効果を示すことを報告したが、効果が安定せず、標準治療として確立出来ていない。BPの薬物動態は不明な点も多い。そこで我々は新規イメージングシステムを用いてBPの薬物動態の解明を試みることとした。まずBPを放射線同位元素でラベル化してPET-CTで検出できる技術を確立したのち、動物モデルを用いて解析を行い、抗腫瘍効果を発揮できるような局所投与BPのためのDrug Delivery System（薬物輸送システム）を開発する。,若手研究,小区分54040:代謝および内分泌学関連,ビスホスホネート,PET-CT,骨巨細胞腫,骨転移,薬物動態,薬物輸送システム,,,,,,,,,,,,,,,,,,,,,,,,,,,,,,,,,,,,,,,,,,,,,,,,,,
19K17964,広島大学,一町 澄宜,単一細胞解析を基盤にしたアルドステロン合成機構の解明と創薬標的因子の同定,本研究では，シングルセル解析を基盤に細胞間情報伝達を介したアルドステロン合成制御機構を解明し，原発性アルドステロン症や高血圧に対する新しい診断・治療戦略の基盤を構築することを目的とするため，下記の3つの主要課題に取り組む．,若手研究,小区分54040:代謝および内分泌学関連,原発性アルドステロン症,高血圧,,,,,,,,,,,,,,,,,,,,,,,,,,,,,,,,,,,,,,,,,,,,,,,,,,,,,,
19K17963,神戸大学,高井 智子,膵β細胞におけるCK2βの役割,2型糖尿病において、膵β細胞ではインスリン合成の負荷により小胞体ストレスが強く、膵β細胞量は減少している。CK2は小胞体ストレスに対して保護作用を持つことが以前より報告されていたが、詳しい機序は不明である。今回の研究では、膵β細胞でCK2を活性化することにより小胞体ストレスに耐性となることを見出し、その機序について検討している。また、CK2活性化により膵β細胞量の維持、耐糖能の改善につながると考えられる。,若手研究,小区分54040:代謝および内分泌学関連,2型糖尿病,小胞体ストレス,CK2,,,,,,,,,,,,,,,,,,,,,,,,,,,,,,,,,,,,,,,,,,,,,,,,,,,,,
19K17962,大阪大学,鈴木 顕,機械学習による疾患ゲノムからの2型糖尿病リスク層別化・サブタイプ分類,本研究では「遺伝情報により2型糖尿病発症リスクおよびその表現型はどのように規定されるか」という医学的に重要な問いに対して、以下の3つの方法で取り組む。,若手研究,小区分54040:代謝および内分泌学関連,２型糖尿病,病型分類,2型糖尿病,ゲノム,ポリジェニック・リスク・スコア,機械学習,遺伝統計学,,,,,,,,,,,,,,,,,,,,,,,,,,,,,,,,,,,,,,,,,,,,,,,,,
19K17961,大阪大学,SHIN JIHOON,全身及び脂肪組織SDF-1の代謝調節作用の解明,申請者はSDF-1が脂肪細胞に最も多く発現するケモカインであり、脂肪細胞が産生するSDF-1は脂肪細胞自身にautocrineに作用し、インスリンシグナル伝達に重要なIRS-1タンパクの分解を誘導することで、インスリン感受性を低下させ、糖取り込みを抑制する因子であることを明らかにした（Shin et al. Diabetes 2018）。本研究では全身及び前駆脂肪細胞におけるSDF-1の作用と肥満病態におけるSDF-1の作用を明らかにし、SDF-1がどのように代謝調節に関与しているのかを解明する。,若手研究,小区分54040:代謝および内分泌学関連,Adipocytes,SDF-1,TGFb1,Adipose tissue,TGFβ,Insulin sensitivity,Lipid homeostasis,Metabolism,Obese diabetes,,,,,,,,,,,,,,,,,,,,,,,,,,,,,,,,,,,,,,,,,,,,,,,
19K17960,三重大学,安間 太郎,β細胞保護を目指した新規糖尿病治療法の開発,これまでの研究によりトロンボモジュリンは抗凝固作用と共に抗炎症作用、抗アポトーシス作用を有していることが示されており、膵β細胞保護効果を介して糖尿病の進展を抑制する可能性がある。しかし糖尿病治療薬としての効果は未だに検討されていない。,若手研究,小区分54040:代謝および内分泌学関連,β細胞,糖尿病,トロンボモジュリン,アポトーシス,膵β細胞,膵Β細胞,,,,,,,,,,,,,,,,,,,,,,,,,,,,,,,,,,,,,,,,,,,,,,,,,,
19K17959,岐阜大学,笹井 英雄,HSD10病における分子生物学的機能解析法の確立,HSD10病は稀なX連鎖劣性遺伝形式の先天代謝異常症であり、重症例では神経退行をきたし予後不良である。これまで、本邦での3症例全例を当教室で診断した。同じHSD10病でも遺伝子変異の種類によって臨床像に非常に大きな差異があり、その差がどの機能の異常によるのかまだ明らかでないことが多い。今回、本邦症例で同定されたHSD10病の変異タンパクの機能を解析することで、臨床的重症度と変異タンパクの機能障害にどのような関連があるのかを明らかにする。,若手研究,小区分54040:代謝および内分泌学関連,HSD10病,先天代謝異常症,ケトン体,17β-hydroxysteroid,ケトン体代謝異常症,,,,,,,,,,,,,,,,,,,,,,,,,,,,,,,,,,,,,,,,,,,,,,,,,,,
19K17958,山梨大学,石井 俊史,プロスタシンによる膵β細胞インスリン分泌制御機構の解明,GPIアンカー型および分泌型セリンプロテアーゼであるプロスタシンは様々な臓器に発現するが、ENaCやTLR4を切断することが報告されている以外は、その多くが謎に包まれている。膵臓におけるプロスタシンの発現局在やその意義は知られていない。本研究は膵内分泌機能の主幹をなすβ細胞のプロスタシンに着目した。,若手研究,小区分54040:代謝および内分泌学関連,プロスタシン,インスリン分泌,膵β細胞,インスリン,,,,,,,,,,,,,,,,,,,,,,,,,,,,,,,,,,,,,,,,,,,,,,,,,,,,
19K17957,名古屋市立大学,大岩 加奈,がん化学療法時の高尿酸血症に関する新提案-細胞死メカニズムに基づく核酸放出量測定,がん化学療法に伴い、がん細胞が崩壊することで血中の尿酸が上昇する。高尿酸血症により急激に腎機能障害を起こし致死的となりうる（腫瘍崩壊症候群）。現在はがん種、大きさ、腎機能から高尿酸血症の発症リスクが分類されており、がん化学療法開始時に尿酸降下療法を併用する。しかし従来のリスク分類は臨床経験に基づき設定されたものであるため、新規抗がん薬が多数導入される最新のがん治療においては、もはや発症リスクを正確に予測できない。この事実を基礎的に解明することが、本研究の課題である。抗がん薬が奏功し細胞が崩壊する際に放出される尿酸量を測定する手法を確立する。,若手研究,小区分54040:代謝および内分泌学関連,腫瘍崩壊症候群,逸脱尿酸量,抗腫瘍効果,高尿酸血症,がん化学療法,,,,,,,,,,,,,,,,,,,,,,,,,,,,,,,,,,,,,,,,,,,,,,,,,,,
19K17956,金沢大学,唐島 成宙,ステロイドメタボロミクス解析による生活習慣病発症バイオマーカーの探索的研究,志賀町研究で保存されている一般住民の検体を用い、約20種のステロイドホルモンを網羅的に測定し、高血圧、糖尿病、脂質異常症といった生活習慣病の発症に関与する疾患特異的バイオマーカーステロイドの探索を行う。バイオマーカーステロイドの合成酵素や酵素阻害の機序は新たな創薬のターゲットとなる。未病段階で高リスク対象を発見し治療や指導介入を行う先制医療モデルを形成するための疫学研究である。,若手研究,小区分54040:代謝および内分泌学関連,ステロイド,生活習慣病,メタボロミクス,,,,,,,,,,,,,,,,,,,,,,,,,,,,,,,,,,,,,,,,,,,,,,,,,,,,,
19K17955,東京医科歯科大学,小宮 力,非アルコール性脂肪肝炎におけるエクソソームを介した脂肪組織－肝臓連関機構の解明,肥満による脂肪組織炎症を起点とした脂肪組織－肝臓連関が非アルコール性脂肪肝炎（NASH）の病態形成に重要とされているが、その分子機構は不明な点が多い。エクソソームは、低酸素などの細胞環境に応じて放出される細胞外小胞で、放出細胞に由来するmiRNAなどが受容細胞に送達され、細胞間の情報伝達を担うことが明らかになってきた。本研究は、肥満による脂肪組織炎症の要因である低酸素応答に着目し、脂肪組織から放出されるエクソソームmiRNAがNASHの発症に関与する可能性についてマウスを用いて検討し、液性因子や神経による既存の機序では捉え切れなかった未知の脂肪組織－肝臓連関を見出す。,若手研究,小区分54040:代謝および内分泌学関連,エクソソーム,miRNA,肥満,NASH,非アルコール性脂肪肝炎,臓器連関,,,,,,,,,,,,,,,,,,,,,,,,,,,,,,,,,,,,,,,,,,,,,,,,,,
19K17954,東京大学,戸田 郷太郎,摂食に応答する代謝調節因子による糖代謝調節機構の解明と新規肥満糖尿病治療への応用,食べ物を口にするという私たちが日常生活で行うことは、体内で大きな変化を引き起こす。私たちはこれらの現象の中でも、食べることにより腸の中の細菌が大幅に変化することに注目し、特に免疫がいかにその変化に反応するかということを研究してきた。本研究では食べることに対する正常の反応、また肥満・糖尿病などの異常な状態でその反応がいかに不調となるかを明らかにすることにより、新たな肥満・糖尿病の治療につなげたいと考えている。,若手研究,小区分54040:代謝および内分泌学関連,肥満,腸内細菌,免疫細胞,サイトカイン,インスリン,肥満症,マクロファージ,腸内細菌叢,糖尿病,食後糖代謝調節,免疫,,,,,,,,,,,,,,,,,,,,,,,,,,,,,,,,,,,,,,,,,,,,,
