awardnumber,organization,name,title,abstract,section,review_section,keyword1,keyword2,keyword3,keyword4,keyword5,keyword6,keyword7,keyword8,keyword9,keyword10,keyword11,keyword12,keyword13,keyword14,keyword15,keyword16,keyword17,keyword18,keyword19,keyword20,keyword21,keyword22,keyword23,keyword24,keyword25,keyword26,keyword27,keyword28,keyword29,keyword30,keyword31,keyword32,keyword33,keyword34,keyword35,keyword36,keyword37,keyword38,keyword39,keyword40,keyword41,keyword42,keyword43,keyword44,keyword45,keyword46,keyword47,keyword48,keyword49,keyword50,keyword51,keyword52,keyword53,keyword54,keyword55,keyword56
18K06356,国立研究開発法人国立成育医療研究センター,鏡 雅代,14番染色体miRNAsクラスターの機能の解明：胎盤発育、肝芽腫発症に注目して,"正常肝組織および14症例の肝芽腫組織を用いた発現解析、メチル化解析、染色体構造解析を行った。9症例の腫瘍組織でDLK1, MEG3の著しい発現増加を認めた。過剰発現していたMEG3遺伝子のプロモーター領域のメチル化解析は正常メチル化もしくは過剰メチル化を示した。14番染色体における構造異常症例は同定されなかった。",基盤研究(C),小区分45010:遺伝学関連,インプリンティング,miRNA,14番染色体,肝芽腫,胎盤,14q32,マイクロRNA,,,,,,,,,,,,,,,,,,,,,,,,,,,,,,,,,,,,,,,,,,,,,,,,,
18K06355,公益財団法人がん研究会,牧野 茂,翻訳開始コドンの選択機構：ゲノム編集による変異マウスを利用した定型外翻訳の解析,独自に発見した「定型外翻訳」は、KOZAK配列などとは異なる未知の翻訳制御機構の存在を強く示唆した。本研究では、定型外翻訳解析をさらに個体レベルにおいて進め、mRNA上の複数のAUG配列から、適切な翻訳開始コドンを選択する機構を明らかにすると共に、定型外翻訳が関連するヒト疾患の分子基盤の解明も目指す。,基盤研究(C),小区分45010:遺伝学関連,定型外翻訳,開始コドン,フレームシフト変異,マウス遺伝学,形態形成,疾患モデル,ヘッジホグシグナル,mRNAの翻訳,翻訳開始コドン,ゲノム編集,突然変異マウス,,,,,,,,,,,,,,,,,,,,,,,,,,,,,,,,,,,,,,,,,,,,,
18K06354,国立遺伝学研究所,木曽 彩子,シス調節配列と転写因子のドブジャンスキー・マラー型不和合による生殖隔離,ドメスティカス亜種由来のマウスC57BL/6J系統の遺伝的背景において、X染色体をモロシヌス亜種由来のMSM系統のものに置き換えた亜種間染色体置換系統（コンソミック系統）は、精子形成の異常が原因で生殖能力が欠失する。これまでの研究では、X染色体コンソミック系統の精巣で、MSM系統由来のX染色体上の遺伝子の発現が異常になることが分かっていた。そこで、この発現異常は、X染色体連鎖遺伝子の発現調節におけるMSM系統アリルのシス調節領域とC57BL/6J系統アリルの転写調節因子の間の何らかの不適合が原因で生じている、との仮説をたてた。本課題においては、精子形成に重要な転写因子であり、X染色体コンソミック系統の精巣で発現低下しているTaf7l遺伝子に注目し、転写調節におけるシス調節領域と転写調節因子の間の不適合を、ES細胞を用いたレポーターアッセイを用いて解析した。解析の結果、Taf7l遺伝子周辺に、C57BL/6J系統アリルでのみ高い活性を持つエンハンサーを発見した。興味深いことに、このエンハンサーの活性はドメスティカス亜種由来の野生系統では保存され、モロシヌス亜種・ムスクルス亜種・キャスタネウス亜種に由来する野生系統では活性がみられなかった。このことは、異なる亜種のゲノムが交配によって混ざるときに、亜種ごとに独自に進化したエンハンサーが、遺伝子の発現調節に影響を与える可能性を示している。また、この系統のX染色体連鎖遺伝子の発現異常は、精巣の生殖細胞で特異的に起きており、体細胞では認められなかった。このことから、生殖細胞においては、遺伝子の転写調節に関わるシス・トランス調節因子が速く進化しており、不適合を発生しやすい傾向があると考えられた。このことは、生殖隔離に伴う表現型が、雑種動物の精巣や卵巣などの生殖器官に集中して発生していることと関係していると考えられた。,基盤研究(C),小区分45010:遺伝学関連,生殖隔離,精子形成,コンソミック系統,モロシヌス亜種,X染色体,種分化,ドブジャンスキー・マラー不和合,エンハンサー,,,,,,,,,,,,,,,,,,,,,,,,,,,,,,,,,,,,,,,,,,,,,,,,
18K06353,中央大学,山田 貴富,染色体構造中での減数分裂期相同組換えの開始機構,配偶子（精子や卵子など）の形成に重要な減数分裂期相同組換えの仕組みを理解するため、分裂酵母を用いて、種を超えて保存されている染色体関連因子群（ヒストンやその就職酵素）と組換え制御因子群（組換え開始因子）に注目して研究を行なった。染色体制御因子の作用機構や組換え産物制御における機能や組換え制御因子の染色体上の局在位置などが明らかになり、他のモデル生物（特に出芽酵母やマウスなど）との相違点や共通点の一端が明らかになった。,基盤研究(C),小区分45010:遺伝学関連,減数分裂期組換え,染色体構造,クロマチン,ヒストン,,,,,,,,,,,,,,,,,,,,,,,,,,,,,,,,,,,,,,,,,,,,,,,,,,,,
18K06352,慶應義塾大学,松本 緑,３倍体プラナリアの有性生殖を可能にする減数分裂における染色体削減の雌雄差,有性生殖プラナリアでは体細胞性全能性幹細胞ネオブラストから生殖細胞が形成される。有性生殖が可能な３倍体プラナリアでは、精子が１倍体であるのに対して、雌性生殖細胞系列は減数第一分裂中期まで３倍体が維持されている。,基盤研究(C),小区分45010:遺伝学関連,有性生殖,減数分裂,３倍体,プラナリア,染色体削減,染色体分配,中心体,シナプトネマ複合体,SYCP1,倍数性,性差,,,,,,,,,,,,,,,,,,,,,,,,,,,,,,,,,,,,,,,,,,,,,
18K06351,岡山大学,中越 英樹,過剰栄養 (肥満) による妊性低下機構の解明,ショウジョウバエのオス生殖器官である附属腺は精液をつくる．過剰栄養ストレスは，転写制御因子 Dve の分解阻害を介した遺伝子発現の変化を誘導し，妊性を低下させる．分解阻害によって安定化した Dve の標的遺伝子候補をマイクロアレイ解析によって同定した．また，Dve の安定化を誘導する強いストレスは，初期ストレス応答遺伝子群 (分子シャペロン，小胞体ストレスセンサー Xbp1) の発現を抑制するフィードバック機構によって，ストレス応答モードを切り替えている可能性が示唆された．,基盤研究(C),小区分45010:遺伝学関連,ショウジョウバエ,妊性,精液,栄養シグナル,ストレス応答,ステロイドホルモン,,,,,,,,,,,,,,,,,,,,,,,,,,,,,,,,,,,,,,,,,,,,,,,,,,
18K06350,岡山大学,阿保 達彦,オルガネラ翻訳系の品質管理,大腸菌のリボソームレスキュー因子ArfBのホモログをシロイヌナズナ，ゼニゴケ葉緑体に見出し，AtArfB，MpARFBと命名した。両者は大腸菌翻訳系でリボソームレスキュー活性を示し，また，植物細胞内では葉緑体に局在した。AtArfBを欠損するシロイヌナズナは葉のサイズが少し小さくなるものの，それ以外に特に顕著な表現型を示さなかったのに対し，MpARFBを欠損するゼニゴケが生殖器形成不全の表現型を示す予備的結果を得た。,基盤研究(C),小区分45010:遺伝学関連,リボソームレスキュー,翻訳,オルガネラ,葉緑体,ArfB,バクテリア,リボソーム,,,,,,,,,,,,,,,,,,,,,,,,,,,,,,,,,,,,,,,,,,,,,,,,,
18K06349,岡山大学,宮地 まり,ニューロエピジェネティカルな制御による高次脳機能の発現機構,本研究では，モデル脊椎動物であるメダカを用いて遺伝学と行動学的解析を組合せることにより，トポIIβが神経機能に重要な遺伝子の発現を制御する機構と，その破綻が高次脳機能に及ぼす影響を明らかにすることを目的として行った．ゲノム編集法によりトポIIβ遺伝子に変異の導入された3系統を樹立した．トポIIβホモ接合変異体は孵化後1週間以内に致死となることを明らかにした．孵化直後のホモ，ヘテロ，野生体頭部を用いてmRNA-seqを行った結果，多数の神経特異的遺伝子の発現が減少することが明らかとなった．現在社会性行動に着目し，行動評価実験を行なっている．,基盤研究(C),小区分45010:遺伝学関連,Nerobiology,Epigenetics,Social behavior,Nuclear structure,神経細胞,終末分化,核内構造,遺伝子発現制御,神経特異的遺伝子,神経細胞分化,エピジェネティック,ニューロン,,,,,,,,,,,,,,,,,,,,,,,,,,,,,,,,,,,,,,,,,,,,
18K06348,東京大学,佐々木 卓,抗抑制因子VanC21によるトランスポゾン活性化機構の遺伝学的解析,シロイヌナズナのトランスポゾンVANDAL21は、脱抑制因子VANC21をコードしており、VANC21が標的トランスポゾンに結合し、配列特異的なDNA脱メチル化、転写活性化を引き起こす脱抑制機構を持つ。脱抑制機構は宿主のエピゲノムに対するダメージを最小限に抑えつつ、VANDAL21の転移を可能にする機構と考えられるが、その分子機構は不明である。,基盤研究(C),小区分45010:遺伝学関連,トランスポゾン,DNAメチル化,脱抑制機構,脱抑制,エピジェネティクス,遺伝学,,,,,,,,,,,,,,,,,,,,,,,,,,,,,,,,,,,,,,,,,,,,,,,,,,
19K06785,大学共同利用機関法人自然科学研究機構(新分野創成センター、アストロバイオロジーセンター、生命創成探究,大竹 愛,硬骨魚類メダカの種内変異を利用した季節繁殖停止の制御機構の解明,メダカは日長の季節変化に対して明瞭な応答を示す。日本各地に由来する系統について短日暴露による繁殖停止の誘導を解析した結果、低緯度の系統において短日応答性が喪失していることが明らかとなった。本研究では、短日応答の種内変異を利用して、次世代シーケンサーを利用した遺伝学的解析およびトランスクリプトーム解析、遺伝子編集技術を応用した機能解析を行い、秋（短日）の感知に関わる遺伝子、繁殖停止を制御する遺伝子を明らかにすることを目的とする。本研究により脊椎動物の日長感知と繁殖停止の分子メカニズムの理解を目指す。,基盤研究(C),小区分45010:遺伝学関連,光周性,季節繁殖,QTL解析,種内変異,メダカ,地理的変異,次世代シーケンス,生殖腺指数,QTL-seq,RNA-seq,卵巣,,,,,,,,,,,,,,,,,,,,,,,,,,,,,,,,,,,,,,,,,,,,,
19K06784,近畿大学,齋藤 貴宗,多重ヌクレエース複合体による新規なゲノム統合性維持機構,本研究では申請者らが発見したHIM-18/SLX4 多重ヌクレエース複合体について、体細胞と生殖細胞でのDNA修復機能を解析し、ファンコニ貧血や癌などの染色体異常疾患や不妊症への治療へと役立てる事を目的とする。HIM-18はDNA修復異常を呈するファンコニ貧血の原因遺伝子の一つである。申請者は線虫を用いてhim-18変異のDNA修復異常を抑制するサプレッサー変異体の単離に成功しており、その原因遺伝子の遺伝学的、生化学的な機能解析を行うことでファンコニ貧血の治療薬開発に貢献する。また生殖細胞研究の新展開として、各ヌクレエースの染色体部位特異的な減数分裂組換えの制御機構について開拓する。,基盤研究(C),小区分45010:遺伝学関連,減数分裂,線虫,ファンコニ貧血,交差型組換え,減数分裂組換え,多重ヌクレエース複合体,エピジェネティクス,ホリデイジャンクションリゾルベース,不妊症,DNA修復,ファンコニアネミア,,,,,,,,,,,,,,,,,,,,,,,,,,,,,,,,,,,,,,,,,,,,,
19K06783,東邦大学,久保田 宗一郎,ヌタウナギにおける染色体放出ではDNA鎖内部領域欠失・再結合はおこなわれているか,全ゲノム解析でID（Internal DNA deletion）領域と考えられる幾つかの配列を抽出し、その領域が本当にEゲノムに相当するのかを、SゲノムDNAとGゲノムDNAを鋳型としたPCRで検証、かつその領域の染色体上の位置をFISH解析で特定する。また複数の領域の塩基配列を詳細に解析し、遺伝子等の分布や既知の転位因子との相同性、piRNAとの関係等を解析する。さらに個体によるID領域に差の有無を、必要に応じて、NGSによる再シーケンシングを行い、データの信憑性を検証する。これの結果を基に、ヌタウナギにおける染色体放出時のID様式の解明並びにEゲノムの起源と進化について考察する。,基盤研究(C),小区分45010:遺伝学関連,ヌタウナギ,ゲノム再編成,染色体放出,DNA鎖内部欠失,染色体末端切除,染色体レベルゲノム配列構築,Hi-C解析,NGSデータ,リシーケンス,リシークエンス,内部領域欠失,次世代シーケンシング,,,,,,,,,,,,,,,,,,,,,,,,,,,,,,,,,,,,,,,,,,,,
19K06782,九州大学,手島 康介,連続的に分布する生物の集団遺伝学,本研究は連続的に分布している生物集団の遺伝的多様性の解析を行う。現実の生物は、侵入や環境変動による分布域の拡大縮小など、空間構造が連続的に時々刻々と変化する。そのため従来の任意交配集団を用いた方法では十分に解析できていないと思われる。本研究では大規模なシミュレーションシステムを構築し、従来の近似的方法に基づく解析では把握できない問題に対し、新たな解析方法の提案を行う。,基盤研究(C),小区分45010:遺伝学関連,集団遺伝,集団構造,シミュレーション,バイアス,SNP,集団遺伝学,遺伝的変異,空間構造,遺伝的多様性,連続分布,,,,,,,,,,,,,,,,,,,,,,,,,,,,,,,,,,,,,,,,,,,,,,
19K06781,奈良先端科学技術大学院大学,和田 七夕子,アブラナ科植物における優劣性制御機構および起源の解明,有性生殖においては、しばしばどちらかの親の形質のみが子供に現れる。この現象は優劣性と呼ばれる。子供は両親に由来する対立遺伝子を持ち、劣性遺伝子が機能を欠失することで、表現型として現れない機構が知られる。アブラナ科在来ナタネ(Brassica rapa)には、劣性遺伝子の機能欠失によらない優劣性現象がある。自己の花粉を拒絶するという自家不和合性を決定するSP11には、複対立遺伝子間にエピジェネティックな優劣性機構が存在する。本研究においては、SP11における階層的な優劣関係について、分子機構を明らかにしその起源および進化を考察する。,基盤研究(C),小区分45010:遺伝学関連,生殖,アブラナ科植物,自家不和合性,優劣性制御,エピジェネティクス,遺伝子発現,優劣性,植物,自己認識,,,,,,,,,,,,,,,,,,,,,,,,,,,,,,,,,,,,,,,,,,,,,,,
19K06780,京都工芸繊維大学,高野 敏行,ショウジョウバエを用いた，オミクス解析でみつかるヒト男性不妊候補遺伝子の検証,今、不妊は世界共通の大きな公衆衛生課題となっている．そのうち半数は男性側の障害によるが，原因不明なケースが３割を超える．一方で、データベースには865の遺伝子が男性の不妊候補遺伝子として登録されている．しかし、これらは男性不妊との関連が予想されるということに過ぎず、モデル生物をつかった実験検証が待たれている．実際，候補遺伝子のうちマウス、ショウジョウバエのいずれでもオス不妊遺伝子として同定されていない遺伝子は600を超える．そこで、これらの候補遺伝子が実際にオスの妊性へ関与するのか、ショウジョウバエをモデルに検証する．これによりオス不妊遺伝子リストを充実させ、ヒト男性の不妊の理解を深める．,基盤研究(C),小区分45010:遺伝学関連,男性不妊,オス不妊,精子形成,精子成熟,ショウジョウバエ,生物種間横断研究,精子―メスの相互作用,精子とメスとの相互作用,データベース,父性効果遺伝子,オス不妊遺伝子,生物種横断研究,,,,,,,,,,,,,,,,,,,,,,,,,,,,,,,,,,,,,,,,,,,,
19K06779,名古屋大学,青木 摂之,酸素依存的な新規の植物二成分制御系の研究ー進化の観点からー,蘚類ヒメツリガネゴケのヒスチジンキナーゼ、PAS-Histidine Kinase1(PHK1)とそのパラログPHK2は酸素濃度依存的に茎葉体の発生を制御する。PHK1/2は、植物では起源の古い系統のみがホモログを持つため、植物進化解明の手掛りとして有望である。本研究ではPHK1/2によるシグナル伝達を次のように解明する：１)リン酸転移の相棒因子と、出力担当の下流因子群を同定し；２)植物ホルモン信号伝達系との相互作用を解明し；３)PHK1/2が酸素を受容する可能性を検証する。これらの成果を植物関連のゲノム／機能情報と対照させ、植物進化におけるPHK1/2と関連因子の役割に迫る。,基盤研究(C),小区分45010:遺伝学関連,多段階リン酸リレー,概日時計,低酸素応答,ヒスチジンキナーゼ,PASドメイン,ヒメツリガネゴケ,時計タンパク質,糖代謝,植物の進化,シグナル伝達系,二分子蛍光補完法,Per-Arnt-Sim（PAS）ドメイン,二成分制御系,ヒスチジン含有リン酸転移因子,進化,,,,,,,,,,,,,,,,,,,,,,,,,,,,,,,,,,,,,,,,,
19K06778,北海道大学,蛭田 千鶴江,ミジンコの単為発生を可能にする卵形成機構の解明,本研究は、ミジンコを材料に、受精することなく卵が単独で発生する単為生殖という生殖様式の詳細を明らかにしようとするものです。本研究を通して、生殖細胞を形成する機構である減数分裂がどのように改変されることによって単為発生が可能になるのかを明らかにし、動物界でみられる単為生殖の獲得と進化に関する理解を深めることを目指しています。,基盤研究(C),小区分45010:遺伝学関連,ミジンコ,単為生殖,減数分裂,生殖細胞形成,ゲノム編集,,,,,,,,,,,,,,,,,,,,,,,,,,,,,,,,,,,,,,,,,,,,,,,,,,,
20K06762,公益財団法人東京都医学総合研究所,田中 卓,グアニン四重鎖による染色体DNA複製開始の制御,"染色体DNA複製機構は、複製起点（origin）と開始因子の結合から始まる一連の反応で構成される。真核生物は、環境変化に応答して、originの選択と開始のタイミングを変動させるが、この制御機構は不明である。最近グアニン四重鎖（G4）が、転写やDNA複製に関わることが報告され、DNAの""かたち""による新たな制御機構の存在が強く示唆される。原核生物のoriC-DnaA非依存性複製は、multi-replicon様式のモデルとなるが、申請者が同定した新たなoriginには、G4配列が含まれていた。本申請研究では、G4による複製開始モデルを構築し、真核生物の新たな複製開始制御機構を確立する。",基盤研究(C),小区分45010:遺伝学関連,DNA複製,RecA,PriA,転写,SDR,G4,multi-replicon,transcription,replication origin,R-loop,RNase H,DNA replication,G-quadruplex,,,,,,,,,,,,,,,,,,,,,,,,,,,,,,,,,,,,,,,,,,,
20K06761,国立研究開発法人理化学研究所,FAWCETT JEFFREY,,"We will test the role of non-allelic gene conversion between Transposable Elements (TEs) in the evolution of TEs, and in the evolution of regulatory networks using computer simulation and genomic data analyses.",基盤研究(C),小区分45010:遺伝学関連,Transposable Elements,gene conversion,genome evolution,Transposable Element,Gene conversion,evolution,,,,,,,,,,,,,,,,,,,,,,,,,,,,,,,,,,,,,,,,,,,,,,,,,,
20K06760,東京都立大学,阿部 拓也,遺伝学によるBLM-TOP3alpha-RMI1-RMI2複合体の作用機序の解明,BLMはこのブルーム症候群の原因遺伝子産物で、BTR複合体を形成し、相同組み換えの過程で、組み換え中間体を解消する役割を担っている。このBTR複合体の個々の構成因子の機能はある程度解明されているが、複合体構成因子間の機能的関係については不明な点が多く残されている。本研究は、申請者が世界で初めて作製に成功したRMI1条件欠損株を元にBTR複合体を構成する因子の多重遺伝子欠損株を作製・解析することで、これまで動物細胞において未解明であったBTR複合体構成因子間の機能的関係を遺伝学的に明らかにし、BTR複合体がどのような作用機序で組み換え中間体の解消を行うのかを解明することを目的とする。,基盤研究(C),小区分45010:遺伝学関連,染色体安定性,DT40,BLM,RMI1,RMI2,ブルーム症候群,DT40 cells,TOP3a,TOP3alpha,,,,,,,,,,,,,,,,,,,,,,,,,,,,,,,,,,,,,,,,,,,,,,,
20K06759,山口大学,妻鹿 良亮,バイオマーカーを利用した耐乾性コムギ育種法の確立および代謝物QTL解析,本研究では、節水型耐乾性形質のモデル系統であるアブシシン酸受容体過剰発現コムギで見出した生理学的特徴および乾燥ストレス環境下での生産力データを基に、スーダンの圃場にて湿潤区と乾燥区で栽培したコムギ160系統から節水型耐乾性候補系統を選抜する。選抜系統から作出した交配系統群のゲノム解析を行い、候補系統から同定した節水型耐乾性系統で蓄積する代謝物の情報とを組合せて原因遺伝子座の同定を目指す。,基盤研究(C),小区分45010:遺伝学関連,節水型耐乾性,バイオマーカー,代謝物,QTL,コムギ,光合成関連形質,QTL解析,メタボローム,メタボロミクス,代謝物QTL解析,,,,,,,,,,,,,,,,,,,,,,,,,,,,,,,,,,,,,,,,,,,,,,
20K06758,三重大学,脇田 幸子,エクソソームを利用した後天的トリソミックレスキュー法の構築,エクソソームドラッグデリバリーシステムを利用した後天的トリソミックレスキュー法を構築する。ダウン症候群（DS）における知的障害を改善させることが最終目的であるが、本課題では申請者らが作製中である21番染色体消去プラスミドにおいてトリソミックレスキュー効率を上げるための改良ならびにエクソソーム内封入方法の確立を行う。また、そのプラスミドを搭載したエクソソームがin vitroおよびin vivoの系においてDS由来iPS細胞のトリソミックレスキューを誘導出来るか否かを検証する。,基盤研究(C),小区分45010:遺伝学関連,エクソソーム,遺伝子編集,iPS,iPS細胞,小核,トリソミックレスキュー,ダウン症,,,,,,,,,,,,,,,,,,,,,,,,,,,,,,,,,,,,,,,,,,,,,,,,,
20K06757,名古屋大学,橋本 寿史,新奇細胞種の発生を制御する進化遺伝基盤の解明,メダカにおいて新奇細胞種である白色素胞を分化させるためには、白色特異的に働く運命決定因子が必要である。本研究では、その同定のため、白色前駆細胞の網羅的発現解析（RNAseq）による候補因子の絞り込みと、遺伝解析（ゲノム編集など）による候補因子の機能検証を行う。さらに、他の魚種での白色素胞分化経路の比較遺伝解析によって、魚類において白色素胞の進化をもたらした遺伝基盤を解明する。,基盤研究(C),小区分45010:遺伝学関連,色素細胞,転写因子,白色素胞,真骨魚類,進化的新奇性,分化制御,細胞多様性,細胞分画,細胞分化,運命決定,セルソーター,多様性,,,,,,,,,,,,,,,,,,,,,,,,,,,,,,,,,,,,,,,,,,,,
