awardnumber,organization,name,title,abstract,section,review_section,keyword1,keyword2,keyword3,keyword4,keyword5,keyword6,keyword7,keyword8,keyword9,keyword10,keyword11,keyword12,keyword13,keyword14,keyword15,keyword16,keyword17,keyword18,keyword19,keyword20,keyword21,keyword22,keyword23,keyword24,keyword25,keyword26,keyword27,keyword28,keyword29,keyword30,keyword31,keyword32,keyword33,keyword34,keyword35,keyword36,keyword37,keyword38,keyword39,keyword40,keyword41,keyword42,keyword43,keyword44,keyword45,keyword46,keyword47,keyword48,keyword49,keyword50,keyword51,keyword52,keyword53,keyword54,keyword55,keyword56
20K06756,東京大学,田辺 真彦,H2A.ZとH2A.Xに着目したエピゲノム変化と乳癌発生分子機構の解明,本研究では、乳癌のエストロゲン依存性に着目し環境要因依存的な乳癌発生分子機構の解明を目指す。環境要因の多くは、紫外線、毒性の強い薬剤、発癌性物質などでない限り、遺伝子変異の直接の原因となるほどの力はない。しかしながら、環境要因は、生体内のホルモン環境に影響を及ぼし、標的遺伝子群の発現を変動させることが可能である。このような標的遺伝子群の発現は、遺伝子発現制御領域で制御されている。従って、環境要因の影響を直接受けた遺伝子群では、「その証拠」が遺伝子発現制御領域上に書き記されているはずである。そこで本研究では、遺伝子発現制御領域上に「上書きされた」エピゲノム変化に着目し、これを発見したいと考えた。,基盤研究(C),小区分45010:遺伝学関連,乳癌,エストロゲン,H2A.Z,H2A.X,エストロゲン受容体,エピゲノム,相同組み換え修復,,,,,,,,,,,,,,,,,,,,,,,,,,,,,,,,,,,,,,,,,,,,,,,,,
20K06755,筑波大学,澤村 京一,核膜孔複合体のコンポーネント間相互作用とその不和合による生殖的隔離,本研究の概要は、キイロショウジョウバエとオナジショウジョウバエの間にみられる雑種致死が核膜孔複合体コンポーネント間の遺伝的不和合によるものだとする仮説を検証することである。ELYSタンパク質は核膜孔複合体を構築する上で重要であり、有糸分裂終期に特定のヌクレオポリンをリクルートして、複合体の基盤を形成する。タンパク質の相互作用に基づいた生殖的隔離の進化について、実験的な証明を行う研究である。,基盤研究(C),小区分45010:遺伝学関連,ショウジョウバエ,核膜孔複合体,種間雑種,遺伝的不和合,生殖的隔離,,,,,,,,,,,,,,,,,,,,,,,,,,,,,,,,,,,,,,,,,,,,,,,,,,,
21K06284,京都産業大学,河邊 昭,LTR型レトロトランスポゾンの配列特異型転移特性の進化機構の解明,動原体周辺へのトランスポゾンの局在は、ヘテロクロマチンや動原体をターゲットする転移特異性という能動的な機構と、自然選択の結果動原体周辺などの遺伝子密度が低い領域ではトランスポゾンの除去が起こらないという受動的な可能性の二つの仮説が考えられてきた。COPIA93ファミリーは植物で初めて同定された動原体への転移特異性を持つトランスポゾンであり、トランスポゾンの局在を理解する研究材料となりうる。本研究ではゲノム情報を用いた比較ゲノム解析的アプローチと、転移能を持つコピーの転移特性の分子生物学的アプローチの両面から研究をおこない、特異的な転移特性の成立とその分子的な機構の両面の解明を目指す。,基盤研究(C),小区分45010:遺伝学関連,トランスポゾン,動原体,アブラナ科,シロイヌナズナ,,,,,,,,,,,,,,,,,,,,,,,,,,,,,,,,,,,,,,,,,,,,,,,,,,,,
21K06283,藤田医科大学,加藤 武馬,初期胚における染色体不安定性を起こす要因の探索,精子と卵子が受精して受精卵ができたあと、受精卵は卵割と呼ばれる体細胞分裂を開始します。卵割は通常の体細胞分裂と異なり、母親由来のmRNAのみが発現していることや、間期核がほとんどない、細胞サイズが大きく分裂回数を経て次第に小さくなるという特徴があります。また近年では卵割時期は非常に染色体異常を起こしやすい不安定な時期であることが知られてきました。しかしながら、何故、正常な体細胞分裂ができないのかは未解明なままです。そこで本研究では、染色体不安定を惹起させう要因を分子遺伝学アプローチにより解明することを目的としました。,基盤研究(C),小区分45010:遺伝学関連,Single cell RNA sequence,受精卵,機械学習,niPGT,染色体,初期胚,染色体不安定性,,,,,,,,,,,,,,,,,,,,,,,,,,,,,,,,,,,,,,,,,,,,,,,,,
21K06282,日本医科大学,稲垣 恭子,新規ヒストン修飾解析手法を用いた白色脂肪細胞分化過程のエピゲノム変化の解析,肥満症は治癒が困難であり、脂肪が蓄積するメカニズムの解明は重要である。遺伝子の塩基配列に依存せず、遺伝子発現を調節する「エピゲノム」が細胞分化に関与していることが知られている。本研究ではエピゲノムに関与するヒストン修飾が白色脂肪細胞が分化し脂肪を蓄積する過程で生じる変化を網羅的に解析する。これまでの脂肪細胞分化に関するエピゲノム研究はヒストン修飾部位に対する抗体を用いており抗体に依存する制約があった。本研究では抗体を必要としない質量分析法を改良して網羅的にヒストン修飾を解析する手法を確立し、白色脂肪細胞分化過程におけるヒストン修飾の組み合わせの変化を明らかにし、ヒストン修飾の意義を解明する。,基盤研究(C),小区分45010:遺伝学関連,白色脂肪細胞,エピゲノム,質量分析,ヒストン修飾,,,,,,,,,,,,,,,,,,,,,,,,,,,,,,,,,,,,,,,,,,,,,,,,,,,,
21K06281,東京女子医科大学,岩崎 直子,システマチックアプローチによるMonogenic diabetes発症機序の解明,MODY(maturity onset diabetes of the young) は常染色体優性遺伝の若年発症糖尿病で、原因遺伝子は15種類知られ、糖尿病の成因研究において重要である。全エクソーム解析で原因遺伝子不明定の例が存在する一方で、我々は複数MODY遺伝子にlikely-pathogenic variant (rare variant)を重複保有し、各々が独立して連鎖する家系を認めている。重複variantによる疾患発症の可能性は重要な未解決課題で、CRISPR /Cas9ゲノム編集技術により複数variantを導入したINS-1 cell lineを樹立し、詳細に検討する。,基盤研究(C),小区分45010:遺伝学関連,monogenic diabetes,若年発症糖尿病,機能解析,発症機序,網羅的,MODY,WES,,,,,,,,,,,,,,,,,,,,,,,,,,,,,,,,,,,,,,,,,,,,,,,,,
21K06280,学習院大学,菱田 卓,相同DNA鎖間の空間制御によるDNA相同組換え修復の促進機構,DNA二本鎖切断(DSB)の修復には、切断部位周辺の染色体構造を安定に維持し無傷の姉妹染色体との相互作用を促進する染色体レベルの空間的な制御が重要である。しかしながら、大腸菌には姉妹染色体をつなぎとめるコヒーシンに相当するSMCタンパク質が存在しないため、その分子機構は未だ不明である。本研究は、DNA損傷依存的に発現するSMCタンパク質であるRecNのDSB修復における役割を詳細に解析し、DNA鎖間の空間的制御とDSB修復促進のメカニズムを明らかにする。,基盤研究(C),小区分45010:遺伝学関連,DNA相同組換え,DNA二本鎖切断,染色体構造,大腸菌,SMCファミリー,,,,,,,,,,,,,,,,,,,,,,,,,,,,,,,,,,,,,,,,,,,,,,,,,,,
21K06279,名古屋市立大学,田上 英明,ヒストンH3-H4の解離制御と生理機能,クロマチン構造は、様々な細胞機能と関連してダイナミックに変化するとともに、ゲノム・エピゲノム情報として安定に維持される性質を持つ。このクロマチン動的制御の破綻は、ゲノム不安定化を誘引し、がんなどの多くの疾患との関連性も示唆されている。本研究では、安定と考えられているヒストンH3-H4解離制御に焦点を当て、クロマチン動的制御とクロマチン品質管理ネットワークを明らかにすることにより細胞機能との連携システムを解明する。,基盤研究(C),小区分45010:遺伝学関連,ヒストンH3-H4,Mlo2,二量体形成,ヒストンH3結合,ヒストンH3,複合体解析,ヒストン過剰発現,ヒストン,クロマチン構造,,,,,,,,,,,,,,,,,,,,,,,,,,,,,,,,,,,,,,,,,,,,,,,
21K06278,静岡県立大学,明正 大純,内在性レトロウイルスが牽引する同一個体群内における第２・３の性決定遺伝子進化機構,脊椎動物の多くは性決定遺伝子によって雌雄を決めており、多数の性決定遺伝子が同定されている。本研究では、性決定遺伝子が特に頻繁に交代するメダカ属において、3つの性決定遺伝子が共存すると想定される稀有なミナミメダカの長崎県野生個体群を用いる。本個体群にはミナミメダカに共通の性決定遺伝子Dmyに加えて、内在性レトロウイルスの挿入によって誕生した第2のGsdfneoY、それに加えて、GsdfneoYを特異的に抑制する第3の存在が推定されている。これらの同定とその誕生機構の解明によって、遺伝性決定の多様化の大きな要因であると考えられる、新規性決定遺伝子を連鎖的に生み出す新たな分子機構を明らかにする。,基盤研究(C),小区分45010:遺伝学関連,Oryzias latipes,sex-determining gene,gsdf,gain-of-function,whole genome analysis,gene expression,sex-linkage analysis,LTR retrotransposon,Gsdf,Sushi-ichi,,,,,,,,,,,,,,,,,,,,,,,,,,,,,,,,,,,,,,,,,,,,,,
21K06277,京都工芸繊維大学,井上 喜博,ショウジョウバエモデルを用いた自然免疫系による癌抑制機構の遺伝学的解明,ショウジョウバエmxc変異体では造血組織内にある未分化細胞が異常増殖し、他の組織に浸潤、転移する。本研究では、自然免疫系しか持たないショウジョウバエを材料として、同モデル生物で確立された優れた発生遺伝学的手法を駆使しながら、このmxc変異体の癌化メカニズムを解析する。さらに造血組織が発生，悪性化する機構および自然免疫系が癌を認識、排除する機構を明らかにする。ヒト相同ペプチドにも同様な抗腫瘍効果があるか，まで明らかにする。本研究により，昆虫の血球細胞の増殖、分化を制御する機構の理解が進むことが期待できる。,基盤研究(C),小区分45010:遺伝学関連,ショウジョウバエ,造血組織腫瘍,自然免疫,抗癌ペプチド,血球細胞,癌化突然変異体,自然免疫系,抗腫瘍ペプチド,抗菌ペプチド,MAPキナーゼ,metalloproteinase,Anti microbial peptides,造血組織,腫瘍,抗癌作用,,,,,,,,,,,,,,,,,,,,,,,,,,,,,,,,,,,,,,,,,
22K06336,高知工科大学,田中 誠司,ゲノム「改編」とゲノム「安定維持」を両立可能とさせる分子メカニズム,生命体の全遺伝情報を担うゲノムDNAは、その生物の同一性を守るため、世代を超えて安定に維持されてゆく。そのため、生物は、ゲノム安定性の脅威となるようなDNA情報の変化を起こしやすい領域・配列の活性を抑制するような仕組みを持ち、ゲノム改編を防止している。一方、出芽酵母の銅耐性因子をコードするCUP1遺伝子領域のように、そのゲノム情報を積極的に改編（コピー数変化）することで、環境（高濃度銅イオン）適応能を高め、生存に貢献する領域も存在する。そこで、本領域をモデルとし、ゲノム「改編」と「安定維持」を両立させることを可能にしている分子機構の解明を目指す。,基盤研究(C),小区分45010:遺伝学関連,ゲノム安定性,ゲノム改変,DNA複製,ゲノム安定維持,ゲノム維持,ゲノム改編,Rループ,,,,,,,,,,,,,,,,,,,,,,,,,,,,,,,,,,,,,,,,,,,,,,,,,
22K06335,公益財団法人東京都医学総合研究所,柴田 武彦,相同的組換えでの相同並行三重鎖DNAの働き,相同的組換えがDNA二本鎖切断を正確に修復してゲノムを維持する。相同的組換えの要は、切断端からできる単鎖(ss)DNA域が二重鎖(ds)DNAの中から互いに相同な配列を見つけハイブリッドds (Hyb-ds) を作る反応である。この反応の仕組みは未だに定説がない。ある酵素がdsDNAの塩基対を開き、できたss域で相手のssDNAとアニールしてHyb-dsをつくる「二重鎖開裂が先」モデルと、逆に、ds構造が開く前にssDNAとの相同配列が見つけ出される「二重鎖開裂が後」モデルとがある。本研究では「二重鎖開裂が後」モデルにだけ想定される「相同並行三重鎖」の存在を示すことで、このモデルの確証を得る。,基盤研究(C),小区分45010:遺伝学関連,相同DNA組換え,相同DNA対合,RecA/Rad51族組換え酵素,ハイブリッド二本鎖,相同三重鎖,組換え中間体,ヘテロ二重鎖DNA,ハイブリッド二重鎖DNA,相同対合反応,RecA,Rad51,相同組換え修復,相同並行三重鎖,ハイブリッド二重鎖,Ｄループ,,,,,,,,,,,,,,,,,,,,,,,,,,,,,,,,,,,,,,,,,
22K06334,岡山大学,中越 英樹,過剰栄養シグナルが精子運動性低下を招くメカニズムの解明,肥満は多くの生活習慣病の発症リスクを高めるだけでなく，妊性も低下させることが報告されている．,基盤研究(C),小区分45010:遺伝学関連,ショウジョウバエ,妊性,精液,栄養シグナル,ステロイドホルモン,ストレス応答,分子シャペロン,糖鎖,,,,,,,,,,,,,,,,,,,,,,,,,,,,,,,,,,,,,,,,,,,,,,,,
22K06333,岡山大学,長岐 清孝,植物組織内位置情報を伴う１細胞レベルの核内クロマチン構造大量解析系の開発,「核内クロマチン構造は、植物種間および細胞種間において、どの様な特異性および多様性をもつのか？」を本研究の学術的な問いとし、本研究ではこれらを解明するために申請者らが開発した「植物組織標本を用いたクロマチン解析法」を高感度化し、「AIによる染色体画像の高速解析法」と組み合わせ高速化することにより、植物組織内の異なる細胞種の核内クロマチン構造の大量高速解析系を構築する。得られた情報をもとに、核内クロマチン構造の特異性および多様性を解明する。,基盤研究(C),小区分45010:遺伝学関連,クロマチン,画像機械学習,核内構造,組織標本,人工知能,,,,,,,,,,,,,,,,,,,,,,,,,,,,,,,,,,,,,,,,,,,,,,,,,,,
22K06332,奈良先端科学技術大学院大学,和田 七夕子,胚乳発達を制御する父母ゲノムのコンフリクトの解析,被子植物の胚乳は、食糧源として重要である。複数の種に共通して、父ゲノムは胚乳発達に促進的に、母ゲノムは抑制的に作用する。このような父母ゲノムの拮抗的作用は、コンフリクト理論として良く知られ、関わる因子も一部同定されているが、父母のコンフリクトの実態および分子機構は不明である。本研究では、アブラナ科モデル植物であるシロイヌナズナを用いて、父母のコンフリクトの分子機構の解明と、その普遍性の検証、人為的操作による胚乳発達の制御基盤の創出をめざす。,基盤研究(C),小区分45010:遺伝学関連,シロイヌナズナ,胚乳,ゲノム刷り込み,種子発達,生殖,発生,受精,,,,,,,,,,,,,,,,,,,,,,,,,,,,,,,,,,,,,,,,,,,,,,,,,
22K06331,名古屋大学,JANG MOONSUN,学習に応じた組織間コミュニケーションにおける分子のメカニズム解明,生物の組織間のコミュニケーションは免疫、成長、あるいは恒常性の維持など、生命システムを維持するのに重要である事が分かっている。その知見に加え、最近では記憶・学習を担う神経系が非神経系と多様なコミュニケーションする事で、脳機能が機能するという新しい知見が報告されて来た。しかし、その実体となる分子や分子メカニズムに関してはほとんど分かっていない。本研究では既に全神経ネットワーク構造が明らかとなっている線虫を用いて、非神経系で機能し、神経機能に影響を与える分子同定及びその分子メカニズムを明らかにする。これらの研究により、動物の全身性情報処理による行動制御機の仕組みが明らかになると期待される。,基盤研究(C),小区分45010:遺伝学関連,温度学習行動,糖転移酵素GLY-12,EGL-3,皮膚細胞,組織間コミュニケーション,温度走性学習,N-結合型糖鎖修飾,GLY-12,C. elegans,Thermotaxis,Tissue communication,neural plasticity,,,,,,,,,,,,,,,,,,,,,,,,,,,,,,,,,,,,,,,,,,,,
22K06330,北海道大学,小柳 香奈子,細胞分化にともなうエピゲノム変遷過程の単一細胞解像度での推定,生命の設計図といわれるゲノムは、どのようにして多様な細胞を作り出しているのか。ゲノムの作動原理を理解することは、生物学の目標の一つである。この細胞分化過程の理解には、ゲノムの発現状態やエピジェネティック修飾（エピゲノム）の変遷過程の理解が不可欠である。しかしながら変遷過程の全種類の細胞を網羅的に実験的に取得することは困難な場合が多い。そこで本研究では、得ることが比較的容易な成体の分化した体細胞のエピゲノム情報に系統解析を応用することで、問題の解決を目指す。特に近年データが蓄積している単一細胞由来のエピゲノム情報を用いることで、単一細胞の解像度で細胞分化過程におけるエピゲノム変遷過程を推定する。,基盤研究(C),小区分45010:遺伝学関連,細胞分化,細胞系譜,エピジェネティクス,シングルセル,系統解析,祖先推定,遺伝子発現制御,多細胞動物,,,,,,,,,,,,,,,,,,,,,,,,,,,,,,,,,,,,,,,,,,,,,,,,
23K05872,公益財団法人東京都医学総合研究所,田中 卓,転写依存性DNA複製開始制御機構におけるグアニン四重鎖（G4）形成の役割,"最近、グアニン四重鎖（G4）が、染色体DNA複製に関わることが報告され、DNAの""かたち""が持つ新たな機能が強く示唆される。これまでDNA複製の分子機構は、複製因子とDNAとの相互作用解析によって解明されてきたが、複製起点（origin）の選択と開始タイミングの変動を制御するしくみの全体像を把握することは難しい。G4の機能はこれを解決する可能性を持つ。原核生物のmulti-replicon様式である安定DNA複製（SDR）を高等生物のモデルと想定し、転写依存性複製最小単位の解析により、G4による複製制御機構を明らかにする。結果は、DNAの""かたち""による新たな細胞機能制御機構解明の嚆矢となる。",基盤研究(C),小区分45010:遺伝学関連,SDR,RNA-DNA hybrid,G4,transcription,DNA replication,PriA,RecA,RNaseHI,DNA複製,RNA-DNAハイブリッド,転写,グアニン四重鎖,,,,,,,,,,,,,,,,,,,,,,,,,,,,,,,,,,,,,,,,,,,,
23K05871,国立研究開発法人国立がん研究センター,西野 穣,ハーディ・ワインベルク不平衡を利用したがん原因遺伝子の探索,本研究では従来のGWASでは特定できなかったがん原因遺伝子を同定するためにハーディ・ワインベルク不平衡(HWD)を利用した新しいアプローチを開発する。HWDを利用したリスク変異同定は、コントロールが不要、劣性変異を検出し易いなどの利点があるが、検出力や結果の解釈上の難点からゲノム全体を対象とするゲノムスキャン研究はなかった。そこで、本研究では、遺伝子内の多点のHWDシグナルをひとつの統計量に集約した遺伝子ベースのHWE検定（GHWT）を開発する。GHWTは検出力の増加が見込まれ、また結果の解釈が容易で他の結果との併合も可能となる。この手法により多くのがん原因遺伝子が同定されることが期待される。,基盤研究(C),小区分45010:遺伝学関連,ハーディ・ワインベルク不平衡,GWAS;ゲノムワイド関連解析,Allelic heterogeneity,がん原因遺伝子,GWAS,,,,,,,,,,,,,,,,,,,,,,,,,,,,,,,,,,,,,,,,,,,,,,,,,,,
23K05870,国立遺伝学研究所,藤戸 尚子,平衡選択の痕跡から探る出アフリカ移住の要因と適応進化,現生人類は約6-7万年前にアフリカを出て、その後中東での滞留を経て急速に世界に拡散したと言われている。本研究ではヒトゲノムに残された自然選択、特に平衡選択の痕跡を網羅的に探索し、出アフリカ移住当時に自然選択を引き起こした環境の変化が何であったのかに焦点を合わせ解析を行う。移住の引き金となった出来事を明らかにすることを目標とする。,基盤研究(C),小区分45010:遺伝学関連,適応進化,免疫,平衡選択,自然選択,人類進化,,,,,,,,,,,,,,,,,,,,,,,,,,,,,,,,,,,,,,,,,,,,,,,,,,,
23K05869,大妻女子大学短期大学部,竹内 知子,大規模スクリーニングで得た出芽酵母局在化RNA、MSA1 mRNA及びEGD1 mRNAの解析,遺伝情報は、遺伝子の本体であるDNAからRNAに写し取られて発現する。したがって、RNAの細胞内局在化は、遺伝情報を空間的に制御するための重要な現象である。RNAの局在化により、細胞内では情報の偏りが生じ、細胞の極性形成や分化が誘導される。我々は、真核生物のモデル系である出芽酵母を用いて、細胞内で特異的な局在を示す新規の局在化RNAを多数発見した。本研究では、これらの新規局在化RNAのうち、細胞周期に関わるMSA1 mRNAとタンパク質の安定性に関わるEGD1 mRNAについて解析する。将来、RNAの局在化制御が可能となれば、医療分野や農業分野等への幅広い応用が期待できる。,基盤研究(C),小区分45010:遺伝学関連,出芽酵母,RNA局在,細胞周期,増殖静止期,シャペロン,RNA,局在化,酵母,,,,,,,,,,,,,,,,,,,,,,,,,,,,,,,,,,,,,,,,,,,,,,,,
23K05868,近畿大学,齋藤 貴宗,多重ヌクレエース複合体の新規な細胞制御機構,"本研究では、HIM-18/SLX4多重ヌクレエース複合体の新規な機能を解析し、早期老化症、ファンコニ貧血などの指定難病や不妊症の病態解明、治療に役立てる事を目的とする。HIM-18は、DNAの構造選択的に切断するヌクレエースであるSLX-1, MUS-81, ERCC-1, XPF-1などと結合し、それらの活性を調節する。線虫のmus-81 ercc-1二重変異体は生育停止し、早期老化症モデルとして期待される。him-18のサプレッサー変異体の解析、SLX-1の染色体部位特異的な減数分裂組換え抑制機構をリアルタイムPCRで解析し、多重ヌクレエース複合体の新規な細胞機能を探索する。",基盤研究(C),小区分45010:遺伝学関連,減数分裂,線虫,HIM-18/SLX4多重ヌクレエース複合体,早期老化症,ファンコニ貧血,不妊症,減数分裂組換え,多重ヌクレエース複合体,DNA修復,染色体異常疾患,,,,,,,,,,,,,,,,,,,,,,,,,,,,,,,,,,,,,,,,,,,,,,
23K05867,東京薬科大学,宇野 愛海,21番染色体部分モノソミー疾患iPS細胞ライブラリーの構築と分子病態解明基盤の開発,本研究目的は、（１）21部分モノソミー症候群の多様な染色体欠失症例を再現するヒトiPS細胞疾患ライブラリーを作出する。（２）神経幹細胞における21部分モノソミー、21トリソミー、正常細胞間での網羅的遺伝子発現解析を行い、病態のコア因子となる遺伝子、特にハプロ不全遺伝子を探索する。（３）候補となるハプロ不全遺伝子について、in vitro実験により発現正常化を行い、疾患関連遺伝子であることを同定する,基盤研究(C),小区分45010:遺伝学関連,ゲノム編集,21番染色体,モノソミー症候群,,,,,,,,,,,,,,,,,,,,,,,,,,,,,,,,,,,,,,,,,,,,,,,,,,,,,
