awardnumber,organization,name,title,abstract,section,review_section,keyword1,keyword2,keyword3,keyword4,keyword5,keyword6,keyword7,keyword8,keyword9,keyword10,keyword11,keyword12,keyword13,keyword14,keyword15,keyword16,keyword17,keyword18,keyword19,keyword20,keyword21,keyword22,keyword23,keyword24,keyword25,keyword26,keyword27,keyword28,keyword29,keyword30,keyword31,keyword32,keyword33,keyword34,keyword35,keyword36,keyword37,keyword38,keyword39,keyword40,keyword41,keyword42,keyword43,keyword44,keyword45,keyword46,keyword47,keyword48,keyword49,keyword50,keyword51,keyword52,keyword53,keyword54,keyword55,keyword56
23K05866,九州大学,手島 康介,ゲノムデータから適応進化領域を網羅的に探索する方法の開発,昨今のゲノムデータの蓄積にともない適応検出事例の報告は行われている。しかし個別の候補領域のリストアップにとどまっているケースがほとんどであり、適応メカニズム全貌の理解に至っているとまでは言えない。本研究はこのような現状に対し、ゲノム多様性データの解析を通じて、適応の有無ならびに適応過程の詳細に関する情報を抽出することを目指す。個別適応候補領域の検出に留まっている現状に対し、適応過程の詳細まで網羅的に議論する方法を提供し、現在の生命システムを作り上げてきたメカニズムの理解を深めることを目的とする。,基盤研究(C),小区分45010:遺伝学関連,適応進化,シミュレーション,検出,ゲノム,網羅的探索,,,,,,,,,,,,,,,,,,,,,,,,,,,,,,,,,,,,,,,,,,,,,,,,,,,
23K05865,広島大学,上野 勝,がん転移阻止を目指したブロッコリー由来成分DIMによる核膜損傷機構の解明,我々はブロッコリー由来ジインドリルメタン(以降DIMと呼ぶ)に分裂酵母における核膜損傷作用があることなどを発見している。DIMによる核膜損傷機構を理 解・活用できれば、“斬新な作用”すなわち、“血管内侵入により損傷したがん細胞の核膜 修復能を上回る更なる核膜損傷を与えること”によって、転移過程のがん細胞を選択的に死 滅させ、転移を阻止できると考えられる。そこで、本課題では、DIMによる分 裂酵母の核膜損傷の作用機序解明を目指し、DIMの核膜損傷作用に関与する遺伝子、DIM が及ぼす核膜形態変化とタンパク質局在変化、DIMが及ぼす核膜への化学的・物理的変化 を明らかにする。,基盤研究(C),小区分45010:遺伝学関連,ブロッコリー,核膜,抗がん剤,ジインドリルメタン,分裂酵母,ガン転移,,,,,,,,,,,,,,,,,,,,,,,,,,,,,,,,,,,,,,,,,,,,,,,,,,
23K05864,名古屋大学,青木 摂之,二種のモデル緑色植物を用いた概日リン酸リレー系の研究―進化の観点から―,概日時計が環境周期に同調するために環境光の情報を受容・伝達する仕組みを光入力系と呼び、植物では、モデル被子植物シロイヌナズナで研究が進んでいる。近年、被子植物以外の多様な植物の系統群が、多様な光入力系を進化させてきた事実が見えつつある。これは植物の光環境の多彩さを反映しており、環境応答機構の多様化の重要な例である。研究代表者は最近、蘚類ヒメツリガネゴケと緑藻クラミドモナスの両方で、His-Aspリン酸リレーのヒスチジンキナーゼ(HK)が光入力系で機能する証拠を得た。これらのHKに始まる「概日リン酸リレー」の機能と仕組みを解明し、その進化について知見を得る。,基盤研究(C),小区分45010:遺伝学関連,概日時計,ヒメツリガネゴケ,クラミドモナス,基部植物,光入力系,リン酸リレー系,ヒスチジンキナーゼ,多段階リン酸リレー,PASドメイン,植物の進化,,,,,,,,,,,,,,,,,,,,,,,,,,,,,,,,,,,,,,,,,,,,,,
24K09552,国立研究開発法人国立成育医療研究センター,福井 由宇子,生殖腺形成・性決定開始の分子機序,本研究課題では、モデル動物マウスを用いたキー遺伝子周辺のクロマチン構造解析を通じて、キー遺伝子の発現制御の分子機序を明らかにする。生殖腺形成ならびに雄性決定に必須であることが知られている唯一のポリコーム群 (PcG) 遺伝子 Cbx2/M33 に注目する。生殖腺発生分化において Cbx2 が集積する発生キー遺伝子のクロマチン構造、メチル化 DNA の継時的変化に焦点をあて、生殖腺分化ならびに性決定の分子機序を明らかにする。,基盤研究(C),小区分45010:遺伝学関連,性分化,クロマチン,生殖腺,,,,,,,,,,,,,,,,,,,,,,,,,,,,,,,,,,,,,,,,,,,,,,,,,,,,,
24K09551,国立遺伝学研究所,白木 知也,ゼブラフィッシュGAL4リソースを活用した神経機能の網羅的遺伝学的解析,ゼブラフィッシュは、透明でイメージングが容易であり、かつ、ハイスループット解析が可能であるという特徴をもち、脊椎動物の生命現象を解析するためのモデル動物として世界中で研究に用いられている。本研究では、特定の組織・細胞を標識するゼブラフィッシュリソースのデータベース整備を行う。また、このデータベースの情報をもとにゼブラフィッシュの基礎的な行動を制御する神経細胞タイプ・神経ネットワークの網羅的な解析を行う。,基盤研究(C),小区分45010:遺伝学関連,ゼブラフィッシュ,トランスジェニック,データベース,神経,GAL4/UAS,,,,,,,,,,,,,,,,,,,,,,,,,,,,,,,,,,,,,,,,,,,,,,,,,,,
24K09550,近畿大学,仲間 美奈,スプライシングにおけるAlu配列の役割の解明,Alu配列は、ヒトゲノムに約10％存在する非コードDNAで、相同組換えにより遺伝子変異を起こし先天性疾患の原因となりうる。またAlu配列によって、近傍の遺伝子のRNA異常が誘導されることが報告されている。しかしながら、Alu配列がどのようなメカニズムで遺伝子発現に関与しているのかは不明である。本研究は独自に開発したミニ遺伝子モデルを用いて、Alu配列がどのような分子メカニズムでスプライシングに関与しているのかを明らかにする。そのために、Alu配列が転写後に二本鎖を形成しRNA編集を受けるかどうかの検証、Alu配列へのスプライシング因子の結合可能性、新たな遺伝子モデルの取得を目指す。,基盤研究(C),小区分45010:遺伝学関連,Alu配列,スプライシング,,,,,,,,,,,,,,,,,,,,,,,,,,,,,,,,,,,,,,,,,,,,,,,,,,,,,,
24K09549,慶應義塾大学,佐々木 貴史,健康寿命遺伝指標Cent.PGSを用いた認知機能レジリエンス機構関連パスウェイの同定,日本人百寿者GWAS解析結果から計算されるpolygenic score (CentPGS)は認知症を含む加齢性疾患遺伝リスクと逆相関し高齢者で健康寿命と相関する遺伝指標である。本研究では①神経系細胞種特異的CentPGS計算方法確立・評価、②百寿者・高齢者のデータ・サンプル収集、③誘導神経系細胞での発現比較による認知機能レジリエンス遺伝子候補抽出④候補遺伝子の認知機能レジリエンス評価を行い、認知機能レジリエンス機構関連パスウェイ同定を目指す。,基盤研究(C),小区分45010:遺伝学関連,認知機能レジリエンス,polygenic score,,,,,,,,,,,,,,,,,,,,,,,,,,,,,,,,,,,,,,,,,,,,,,,,,,,,,,
24K09548,杏林大学,粟崎 健,ショウジョウバエ近縁種における温度選好行動の多様性と温度受容遺伝子の関係,生物は多様な温度環境に生息しているが、どのようにして温度環境へ適応したのかについては、ほとんど分かっていない。申請者は、温度受容分子の組合せや働きの違いが、「好む温度」の違いを生み出していると考えた。これを確かめるために、本研究では、多様な温度環境に生息するショウジョウバエ近縁種を用いて解析を行う。具体的には、ゲノム編集によりショウジョウバエ各種において各温度受容分子の変異体を作出し、その影響を比較解析することで温度受容分子と種特異的な温度応答との関係を明らかにする。本研究により、遺伝子レベルで温度環境適応の多様性を理解するための重要な手掛かりとなる成果を得ることが期待できる。,基盤研究(C),小区分45010:遺伝学関連,温度環境,ショウジョウバエ,温度受容分子,近縁種,,,,,,,,,,,,,,,,,,,,,,,,,,,,,,,,,,,,,,,,,,,,,,,,,,,,
24K09547,埼玉医科大学,嶋崎 晴雄,小家系検体を用いた、多系統に渡る神経変性疾患の原因遺伝子変異検索,臨床症状のみからは変異のある候補遺伝子の決定が困難な，多系統に渡る遺伝性神経変性疾患の原因遺伝子変異の同定を試みる。一名のみの候補遺伝子解析や全エクソーム解析で原因遺伝子変異が同定できなかった家系にて、家系内の複数の検体を用いた連鎖解析を行う。また、患者検体を用いて全ゲノム解析、RNAシーケンス解析、マイクロアレイ解析など行い，エクソン内の非同義置換や，スプライス変異などを検索する。同定された場合、それらが真の病的変異かどうか、家系内共分離の確認，コンピュータープログラムを用いた機能変化予測や構造変化予測，各種培養細胞などを用いて機能解析を行い病原性の確定を行い，病原遺伝子変異の同定を試みる．,基盤研究(C),小区分45010:遺伝学関連,神経変性疾患,連鎖解析,全エクソーム解析,全ゲノム解析,,,,,,,,,,,,,,,,,,,,,,,,,,,,,,,,,,,,,,,,,,,,,,,,,,,,
24K09546,熊本大学,井手上 賢,mRNAの関わる染色体運搬メカニズムの解析,分裂期染色体に結合する複数のmRNA種の中に、染色体の動態制御に関与するものがあること、そのメカニズムを明らかにする。,基盤研究(C),小区分45010:遺伝学関連,染色体分離,RNA,モータータンパク質,細胞分裂,抗がん戦略,,,,,,,,,,,,,,,,,,,,,,,,,,,,,,,,,,,,,,,,,,,,,,,,,,,
24K09545,大阪大学,伊藤 将,ex vivo/in vitro卵母細胞培養系を用いた減数分裂組換え制御機構の解析,減数分裂組換えは、配偶子の遺伝的多様性をもたらすと共に、正常な染色体分配を保証している。プログラムされたDNA二本鎖切断によって開始される減数分裂組換えは、厳密に制御された連続反応によりDNA修復を完了するが、中でもDNA合成反応を検出する系が確立されておらず、制御に関与するタンパク質が同定されていない。本申請研究では、ex vivo/in vitroでマウス卵母細胞を培養する系を利用することで、申請者が確立したDNA合成検出系によりその制御因子の同定を行う。減数分裂組換え制御メカニズムの解明を通じて、哺乳類がゲノムを安定的に維持・継承する仕組みの理解を深める。,基盤研究(C),小区分45010:遺伝学関連,減数分裂組換え,DNA修復,DNA合成,,,,,,,,,,,,,,,,,,,,,,,,,,,,,,,,,,,,,,,,,,,,,,,,,,,,,
24K09544,京都工芸繊維大学,高野 敏行,ショウジョウバエのメスによる精子の選別・保存のメカニズムと精子Ca[2+]ストアの働き,ショウジョウバエのメスは一度の交尾で数百の子孫を産むため１か月以上にわたり貯精器官（受精嚢）に精子を保存する。しかし、Nep4変異体の精子は一旦は正常にメス貯精器官に入るが、24時間後にはほとんどが受精嚢から失われる。まれに残った精子も卵に進入できても、その後の反応を誘起できず受精を完了できない。すなわち不良精子であり、これを“捨てる”ことはメスにとって有益な行動となる。不良精子が“消失”する分子メカニズムを解明する。,基盤研究(C),小区分45010:遺伝学関連,精子,貯精,精子選択,Ca2+ストア,ショウジョウバエ,,,,,,,,,,,,,,,,,,,,,,,,,,,,,,,,,,,,,,,,,,,,,,,,,,,
24K09543,公益財団法人東京都医学総合研究所,多羽田 哲也,cAMPが連合学習記憶の同時検出の指標であるという定説の再検証とcAMPコード仮説の提唱,Eric Kandelらはアメフラシの連合学習からカルシウムカルモジュリン依存性Type Iアデニル酸シクラーゼ（AC）が同時検出器として働くことを提唱した。このことは記憶を分子レベルで記述する研究の嚆矢として神経科学の歴史に記憶されている。この仮説は、同時期の、ショウジョウバエの学習記憶にもACであるRutabagaが必要であることを示した行動遺伝学により補強された。しかし、現在に至るまで、ショウジョウバエの系において細胞レベルでcAMPが同時検出の物質基盤であり、Rutabagaが同時検出器として働くことを直接示した報告はない。本研究は初めてそれを検証するものである。,基盤研究(C),小区分45010:遺伝学関連,cAMP,同時検出器,連合学習,ショウジョウバエ,Rutabaga アデニル酸シクラーゼ,,,,,,,,,,,,,,,,,,,,,,,,,,,,,,,,,,,,,,,,,,,,,,,,,,,
24K09542,千葉大学,松浦 彰,単細胞微生物集団の定常期細胞機能分化の分子機構と生理機能,単細胞微生物である出芽酵母の細胞は、定常期において代謝的に異なる2種の細胞に機能分化する。この機能分化は長期飢餓下での集団の生存戦略に関わる。本研究は、孤立細胞の集団で生じる機能分化の機序とその意義を1.遺伝基盤と環境因子、2.細胞間情報伝達分子、3. 集団としての環境適応特性、に注目して解析する。本研究は代謝状態を検知するマーカー発現株を利用して定常期における個々の細胞内状態を長期間追跡するという手法が特徴的かつ独自であり、多細胞生物を構成する細胞集団の特徴である細胞の機能分化への最初のステップを解く手がかりを与えるものとなる。,基盤研究(C),小区分45010:遺伝学関連,定常期,細胞集団,酵母,細胞分化,環境適応,,,,,,,,,,,,,,,,,,,,,,,,,,,,,,,,,,,,,,,,,,,,,,,,,,,
25K09721,公益財団法人東京都医学総合研究所,夏目 豊彰,転写調節シスエレメントが形成する動的ネットワークの解析：迅速CRISPR摂動を用いて,ヒトβグロビン遺伝子座の異常は、遺伝性血液疾患に深い関連がある。本遺伝子座では、5つの転写調節配列が、5つの発生段階特異的に機能するβグロビン遺伝子の発現を調節する。しかし現存の技術では、このような複雑な転写調節ネットワークを理解することが難しい。本研究では、自ら開発した転写調節配列の活性を短時間に操作する「迅速CRISPR摂動」を駆使し、本遺伝子座の統合的理解や治療法の手がかりの獲得を実現する。,基盤研究(C),小区分45010:遺伝学関連,迅速CRISPR摂動,シスエレメント,転写調節ネットワーク,アンチクリスパー,デグロン,,,,,,,,,,,,,,,,,,,,,,,,,,,,,,,,,,,,,,,,,,,,,,,,,,,
25K09720,国立研究開発法人量子科学技術研究開発機構,安田 武嗣,アポトーシス関連因子によるDNA二重鎖切断修復の制御機構,本研究では、アポトーシス関連因が、RAD52の構造変換を起こすことにより、修復経路選択を制御している仮説を調べる。この目的のために、精製タンパク質を用いた生化学的活性の解析、細胞染色を用いた細胞内動体解析、精製タンパク質を用いた構造解析、レポーターアッセイシステムを用いたTC-HR修復機構の解析などを行う。これらの実験により、アポトーシス関連因によるDNA修復制御機構を解き明かす。,基盤研究(C),小区分45010:遺伝学関連,RAD52,DNA二重鎖切断修復,DNA相同組換え,アポトーシス関連因子,１本鎖アニーリング修復,,,,,,,,,,,,,,,,,,,,,,,,,,,,,,,,,,,,,,,,,,,,,,,,,,,
25K09719,国立研究開発法人農業・食品産業技術総合研究機構,孫 建強,コムギの環境耐性に寄与するホメオログの時系列変動を検出するアルゴリズムの開発,異なる種の交雑で生まれた異質倍数体は、環境の変化に強く、品種改良に役立つと期待されている。その強さは、異なる親から受け継いだ重複遺伝子（ホメオログ）が異なる働きをすることに由来すると考えられており、仕組みの解明が求められている。従来の手法では、たとえば処理群と対照群など2時点での違いは捉えられるが、偽陽性が多く、時間に伴う変化を正確に見るのが難しかった。本研究では、偽陽性を抑えながら、環境の変化に応じてホメオログの発現比が時間とともにどう変わるかを捉える新しい手法を開発し、コムギの環境耐性の仕組みを明らかにすることを目指す。,基盤研究(C),小区分45010:遺伝学関連,発現量解析,異質倍数体,小麦,ホメオログ,,,,,,,,,,,,,,,,,,,,,,,,,,,,,,,,,,,,,,,,,,,,,,,,,,,,
25K09718,日本医科大学,吉田 圭介,環境ストレス後の精子エピゲノムの経時的変化を介した次世代の多様性,マウスをモデル生物として、炎症誘発物質LPSの投与によって、ヒトの急性炎症を模倣する。投与の一定期間ごとに精子細胞をサンプリングし、エピゲノム・トランスクリプトーム変化を解析すると共に、次世代個体の免疫学的表現型を解析する。父親の生殖細胞と子供の免疫細胞のオミックス解析から、分子的因果関係を解析する,基盤研究(C),小区分45010:遺伝学関連,継世代遺伝,精子エピゲノム,環境ストレス,疾患表現型,継世代効果,,,,,,,,,,,,,,,,,,,,,,,,,,,,,,,,,,,,,,,,,,,,,,,,,,,
25K09717,東京女子医科大学,岩崎 直子,全ゲノム解析を用いたMonogenic diabetesの網羅的解析,MODY(maturity onset diabetes of the young) は若年で糖尿病を発症する単一遺伝子疾患で原因遺伝子は14種類報告されているが、原因不明のMODYが存在する。我々は、全エキソームシーケンス⇒MLPA⇒細胞機能解析、を統合したシステマティックアプローチにより世界的にも極めて高いMODY遺伝子同定率(57%)を達成した。しかし、他にも原因不明の典型的なMODY家系を複数保有しており、以下の検討を行う。①新規MODY遺伝子の同定、②MODYの成因解明を通じたprecision medicineの推進、③新規糖尿病キー分子の同定と創薬シーズへの応用。,基盤研究(C),小区分45010:遺伝学関連,monogenic diabetes,若年発症糖尿病,全ゲノム解析,機能解析,網羅的,,,,,,,,,,,,,,,,,,,,,,,,,,,,,,,,,,,,,,,,,,,,,,,,,,,
25K09716,静岡県立大学,明正 大純,雌雄の不妊をもたらす甲状腺ホルモン欠失メダカを用いた網羅的な生殖腺分化機構の解明,甲状腺ホルモン（TH）は脊椎動物に共通する重要なホルモンであり、多様な表現型を制御する。申請者は、tshbaノックアウト（KO）メダカが未成熟な生殖腺を持ち、第二次性徴を示さない不妊であることを発見し、THが性成熟に不可欠であることを示した。さらに、稚魚期からその影響が現れ、性ホルモンと協調して生殖腺分化に関与する可能性を見出した。本課題では、tshba、TH合成酵素、3つのTHレセプターのHPT軸の5遺伝子のKOメダカを作出し、THシグナリングを低下から欠損までの段階的に低下させた状態を解析することで、生殖腺分化の開始から性成熟までのTHの機能を分子レベルで解明することを目的とする。,基盤研究(C),小区分45010:遺伝学関連,甲状腺ホルモン,tshba,tpo,thyroid hormone receptor,ゲノム編集,,,,,,,,,,,,,,,,,,,,,,,,,,,,,,,,,,,,,,,,,,,,,,,,,,,
25K09715,熊本大学,荒木 喜美,転移因子を抑制する哺乳類最大の遺伝子ファミリーKZFP遺伝子群欠損マウスの解析,ヒトやマウスのゲノムの中には、多数の転移因子（トランスポゾン、TEs）が存在し、ゲノムの中を動き回る活性は、もともと存在する遺伝子に悪影響を及ぼす。そのため、通常TEsは抑制されており、その中心的役割を果たすのが、KZFPs遺伝子群である。多数、多種類存在するTEsに対応するため、KZFPs遺伝子群は重複と組換えにより、その数を増やし、巨大なクラスターを形成している。我々は、ゲノム編集技術を使って、染色体2、4、7、12、13番の大きなKZFPsクラスターを欠損したマウス系統の作出に成功した。これらのマウスにおいて、TEsの活性変化が発生や分化にどう影響するのか明らかにする。,基盤研究(C),小区分45010:遺伝学関連,遺伝子改変マウス,KZFPクラスター,トランスポゾン,,,,,,,,,,,,,,,,,,,,,,,,,,,,,,,,,,,,,,,,,,,,,,,,,,,,,
25K09714,東京大学,塚原 小百合,リボソームDNA領域に特異的に転移するレトロトランスポゾンの転移機構,転移因子には、特定の染色体領域を標的として挿入する「ターゲティング機能」を持つもの が存在する。本研究ではシロイヌナズナのレトロトランスポゾンATGP2が、リボソームDNA (rDNA)領域へ特異的に転移するメカニズムを明らかにする。実際に転移することが可能なATGP2を用いて新規の転移を誘導し、その相互作用分子を同定することにより、ATGP2の rDNA領域へのターゲティング機構を明らかにし、進化の過程において転移因子によって生物のゲノムがどのようにして形作られてきたのかという問いの解明を目指す。,基盤研究(C),小区分45010:遺伝学関連,レトロトランスポゾン,植物,rDNA,,,,,,,,,,,,,,,,,,,,,,,,,,,,,,,,,,,,,,,,,,,,,,,,,,,,,
25K00278,東北大学,京坂 朋来,Helicobacter pylori感染の大規模遺伝統計解析および他疾患発症との関連調査,H. pylori（ヘリコバクター・ピロリ）は、全人口の約半数が感染し、胃がんの発症リスクを大幅に高めることで知られている。この感染症の遺伝的要因や消化器疾患以外との関連については、未だに解明されていない部分が多いが、私たちは、ゲノムワイド関連解析やメンデル無作為化解析を通じて、H. pylori感染が6番染色体のヒト白血球抗原領域と関連していることと、この感染症が1型糖尿病や橋本病に対して正の因果関係を、アトピー性皮膚炎に対して負の因果関係を示すことを明らかにした。本研究では、より大規模な遺伝統計解析を通じ、H. pylori感染がさまざまな健康問題にどのように影響を与えるのかを解明したい。,基盤研究(C),小区分45010:遺伝学関連,Helicobacter pylori,ゲノムワイド関連解析,メンデル無作為化,遺伝統計,ヘリコバクター・ピロリ,,,,,,,,,,,,,,,,,,,,,,,,,,,,,,,,,,,,,,,,,,,,,,,,,,,
