awardnumber,organization,name,title,abstract,section,review_section,keyword1,keyword2,keyword3,keyword4,keyword5,keyword6,keyword7,keyword8,keyword9,keyword10,keyword11,keyword12,keyword13,keyword14,keyword15,keyword16,keyword17,keyword18,keyword19,keyword20,keyword21,keyword22,keyword23,keyword24,keyword25,keyword26,keyword27,keyword28,keyword29,keyword30,keyword31,keyword32,keyword33,keyword34,keyword35,keyword36,keyword37,keyword38,keyword39,keyword40,keyword41,keyword42,keyword43,keyword44,keyword45,keyword46,keyword47,keyword48,keyword49,keyword50,keyword51,keyword52,keyword53,keyword54,keyword55,keyword56
18K06374,株式会社生命誌研究館,尾崎 克久,植食性昆虫が進化に至る、最初の変化は何か,味覚受容体と産卵行動には密接な関係があることが知られている。クロアゲハとミヤマカラスアゲハのメス成虫前脚で働いている遺伝子を網羅的に調べた結果、この2種間でよく似ている味覚受容体遺伝子を発見した。2種が共通に認識する化合物としてフェラムリンが知られており、重要なフェラムリン受容体候補であると考えた。,基盤研究(C),小区分45020:進化生物学関連,アゲハチョウ,クロアゲハ,ミヤマカラスアゲハ,味覚受容体,産卵行動,食草選択,種分化,進化,ゲノム解読,電気生理実験,産卵刺激物質,RNAi,味覚受容体遺伝子,RNA-seq,次世代型シークエンサー,生物間相互作用,化学感覚,,,,,,,,,,,,,,,,,,,,,,,,,,,,,,,,,,,,,,,
18K06373,国立研究開発法人産業技術総合研究所,沓掛 磨也子,兵隊アブラムシのゴール修復行動に伴い進化したチロシン合成・蓄積メカニズムの解明,社会性昆虫に見られる高度かつ巧妙な社会システムがどのように成立し、維持され、また進化してきたのかを知ることは、進化生物学において重要な課題である。本研究では、この問題にアプローチするため、社会性アブラムシに着目した。モンゼンイスアブラムシの兵隊は、「ゴール修復」という興味深い社会行動を示す。しかし、その分子基盤については、体液メラニン化が重要な役割を果たしていること以外はほとんど解明されていなかった。本研究課題では、兵隊で特殊化したチロシン合成・蓄積に関わる分子基盤について解明するとともに、ゴール修復の分子基盤の進化や巨大顆粒細胞の発生起源について明らかにした。,基盤研究(C),小区分45020:進化生物学関連,社会性アブラムシ,ゴール修復,フェノール酸化酵素,チロシン,巨大顆粒細胞,菌細胞,,,,,,,,,,,,,,,,,,,,,,,,,,,,,,,,,,,,,,,,,,,,,,,,,,
18K06372,国立研究開発法人理化学研究所,横山 ちひろ,パーソナリティと脳進化：異種間脳機能イメージング比較研究,本研究の目的は、非ヒト霊長類であるコモンマーモセットのパーソナリティ評価を社会行動に関わるとされている遺伝子多型および脳画像の各パラメータと関連付けることにある。飼育者の質問紙を用いた評定によって5因子の性格特性および2つの上位因子を抽出し、各性格因子得点とセロトニン1a受容体のSNP多型との関連性を調査した。セロトニンおよびドーパミン神経系を標的にしたPET画像、高解像度の脳構造および安静時機能MRI画像を撮像し、ヒト脳画像処理パイプラインのコモンマーモセット脳画像への最適化を進めた。,基盤研究(C),小区分45020:進化生物学関連,パーソナリティ,非ヒト霊長類,fMRI,PET,,,,,,,,,,,,,,,,,,,,,,,,,,,,,,,,,,,,,,,,,,,,,,,,,,,,
18K06371,国立研究開発法人農業・食品産業技術総合研究機構,鈴木 誉保,蝶蛾の翅模様のモジュール構造とその性質を利用した多様性・複雑性進化の解明,枯葉に似せた模様、樹皮にまぎれる模様など、多様な色・模様はどのような設計原理が備わっているのだろうか？本研究では、蝶や蛾の色・模様に注目し、遺伝子と表現型がそなえるモジュール構造の解明に取り組んだ。まず、カイコの黒色形成遺伝子yellowのエンハンサーを調べ、遺伝子組換え技術を利用してシス調節制御のモジュール構造を明らかにした。次に、蝶の擬態（枯葉、岩、地衣類、ミューラー、ベーツ）を調べ、多様な模様が要素の組み合わせを変えてできているモジュール設計であることを明らかにした。さらに、色・模様を含む様々な表現型についてシステム論的な研究を可能にする「表現型システム生物学」を理論化し提唱した。,基盤研究(C),小区分45020:進化生物学関連,進化生物学,進化発生学,比較形態学,発生生物学,昆虫生物学,蝶・蛾の翅模様,グラウンドプラン,モジュール構造,,,,,,,,,,,,,,,,,,,,,,,,,,,,,,,,,,,,,,,,,,,,,,,,
18K06370,基礎生物学研究所,高橋 弘樹,脊索形質獲得の分子基盤：脊索動物の誕生・起源・進化,脊索は脊索動物体制における中軸器官であると同時に、脊索動物を特徴付ける最も重要な形質である。したがって、脊索形成の分子メカニズムを明らかにすることは脊索動物の体制構築の解明につながると同時に、脊索動物進化のメカニズムの理解にも直結する。また、脊索を持たない共通祖先の動物がどのように、この新規形質を獲得したかをひも解くことは、我々ヒトを含めた脊索動物誕生の分子的基盤を明らかにする事につながる。そこで、まず脊索動物の祖先に近い頭索動物・尾索動物の脊索形質の分子基盤を明らかにした。次に、脊索形成の分子メカニズムを解析し、さらに、脊索形成遺伝子ネットワーク進化の解明を目指した。,基盤研究(C),小区分45020:進化生物学関連,脊索動物,脊索,ホヤ,ナメクジウオ,ギボシムシ,ヒトデ,,,,,,,,,,,,,,,,,,,,,,,,,,,,,,,,,,,,,,,,,,,,,,,,,,
18K06369,甲南大学,島井 光太郎,脊索動物はどのようにサカナ型遊泳運動能を獲得したか,,基盤研究(C),小区分45020:進化生物学関連,,,,,,,,,,,,,,,,,,,,,,,,,,,,,,,,,,,,,,,,,,,,,,,,,,,,,,,,
18K06368,大阪医科大学,橋口 康之,フェロモン認識・受容機構の進化的変遷から探る魚類の繁殖行動の多様性と進化,"プロスタグランジンF2a (PGF2a)は、多くの魚類で共通のフェロモンであり、異性の誘引に関与している。フェロモンとしてのPGF2a受容体であるOR114-1, OR114-2について魚類のゲノム配列を網羅的に調べたところ、OR114の起源、OR114-1とOR114-2の分岐時期（コイ目・カラシン目・ナマズ目の共通祖先）およびOR114-1, OR114-2の系統特異的な重複・消失などが明らかになった。またアブラボテ及びドジョウのドラフトゲノムを決定してOR114の多様性を調べた。アブラボテではin situ hybridizationによりOR114遺伝子の嗅上皮での発現を確認した。",基盤研究(C),小区分45020:進化生物学関連,分子進化,ゲノム,嗅覚,フェロモン,魚類,遺伝子発現,行動解析,繁殖行動,,,,,,,,,,,,,,,,,,,,,,,,,,,,,,,,,,,,,,,,,,,,,,,,
18K06367,立教大学,榊原 恵子,植物の世代交代制御因子の進化機構の解明,陸上植物はその生活環の中で単相と複相の両方に多細胞体制を構築する世代交代を行う。陸上植物ヒメツリガネゴケにおいて同定されたホメオボックス型転写因子KNOX2遺伝子は陸上植物とストレプト藻類の共通祖先において既に存在していた。ストレプト藻類ヒメミカヅキモを用いて変異体を単離した。別の陸上植物であるツノゴケゲノムを解読したところ、ツノゴケはKNOX2遺伝子を持つが、姉妹遺伝子であるKNOX1遺伝子は持たないことがわかった。,基盤研究(C),小区分45020:進化生物学関連,世代交代,転写因子,KNOX遺伝子,ストレプト藻類,陸上植物,進化,KNOX2遺伝子,KNOX2,,,,,,,,,,,,,,,,,,,,,,,,,,,,,,,,,,,,,,,,,,,,,,,,
18K06366,京都府立大学,武田 征士,複雑な花弁形態が作られるメカニズムを探る：至近要因と究極要因の統合的解析,"複雑な形態をもつサギソウ唇弁について、①遺伝子・細胞レベルの形態形成メカニズム（至近要因）と、②ポリネーターとの共進化という究極要因の観点から研究を進めた。①では、花器官で発現する遺伝子の網羅的解析から、唇弁で発現する転写因子群（MADS, TCP）を同定した。また、唇弁の鋸歯形成時には、初期の細胞分裂と後期の極性をもった細胞伸長が重要であることが分かった。②では、スズメガがホバリングしながら吸蜜を行うことや、鋸歯切除による結実や種子重量への影響が示唆された。",基盤研究(C),小区分45020:進化生物学関連,サギソウ,MADS転写因子,鋸歯,訪花昆虫,スズメガ,唇弁,TCP,結実,トランスクリプトーム,花弁,ラン,ポリネーター,共進化,,,,,,,,,,,,,,,,,,,,,,,,,,,,,,,,,,,,,,,,,,,
18K06365,広島大学,井川 武,温泉ガエルゲノムから探る高温耐性の獲得メカニズム,本研究は温泉において生育できるほどの高温耐性を獲得したリュウキュウカジカガエルについて、高温耐性の原因遺伝子を単離し、適応進化における遺伝的基盤を解明することを目的として、主に遺伝子発現解析とゲノムシークエンスを行った。遺伝子発現解析の結果、高温下において持続的に生育させた場合、遺伝子発現調節に関わる重要な遺伝子が高発現することが明らかとなった。また、近縁種であるカジカガエルとのゲノム比較解析の結果、温度感受性受容体や熱ショック応答タンパク質などの配列が顕著に異なることが明らかとなり、高温耐性下における遺伝子機能が変化していることが予想された。,基盤研究(C),小区分45020:進化生物学関連,適応進化,ゲノム解読,極限環境,生物多様性,遺伝子発現調節,両生類,分布拡大,ゲノム進化,温度適応,分子進化,環境適応,温度耐性,遺伝子発現,ゲノム,高温耐性,ゲノム編集,,,,,,,,,,,,,,,,,,,,,,,,,,,,,,,,,,,,,,,,
18K06364,岡山大学,濱田 麻友子,ヒドラ属の比較ゲノミクスによる栄養獲得戦略の進化と種分化の解明,本研究では動物における適応と種分化のメカニズムを明らかにするため、種によって異なる栄養獲得戦略を取るヒドラを用いて、刺胞動物間および近縁種間の比較ゲノム解析を行った。ヒドラ属には、共生クロレラと栄養面で相利関係にあるグリーンヒドラと、捕食性で比較的大型のブラウンヒドラが存在し、これらのゲノムにはそれぞれ別の生存戦略が反映されていると考えられる。本研究ではグリーンヒドラとブラウンヒドラのゲノムにおけるレトロトランスポゾンの分布の差、自然免疫系遺伝子の増加・複雑化、Homeobox遺伝子など体制に関する遺伝子の段階的縮小を示し、ゲノムから見た系統進化・種分化の実態を明らかにした。,基盤研究(C),小区分45020:進化生物学関連,共生,進化,ゲノム,刺胞動物,ヒドラ,クロレラ,種分化,,,,,,,,,,,,,,,,,,,,,,,,,,,,,,,,,,,,,,,,,,,,,,,,,
18K06363,島根大学,吉田 真明,タコブネの殻にみる進化的形質の喪失と再獲得の遺伝的基盤,タコブネ類(Argonauta)は、軟体動物がもつ外殻(貝殻)を失ったタコ類の１種であるが、腕からカルシ,基盤研究(C),小区分45020:進化生物学関連,バイオミネラリゼーション,プロテオーム,分子進化,軟体動物,比較ゲノム,ゲノム解析,次世代シーケンス,トランスクリプトーム,頭足類,,,,,,,,,,,,,,,,,,,,,,,,,,,,,,,,,,,,,,,,,,,,,,,
18K06362,名古屋大学,松田 洋一,ソメワケササクレヤモリを用いた爬虫類初の性決定遺伝子の同定,"ソメワケササクレヤモリ(Paroedura picta)はZZ/ZW型の性染色体構成を持つと考えられていることから、C-ヘテロクロマチン、テロメア配列、マイクロサテライトDNA配列のコピー数を指標に性染色体の同定を試みたが、これらに違いがみられる染色体対は同定できなかった。そこで、過去の我々の研究（Kawai et al. Chromosoma 118, 43-51, 2009）でZW型の性染色体の遺伝連鎖群が同定され、さらにはZ-W染色体間で構造変化が生じた領域が明らかにされているミナミヤモリ(Gekko hokouensis)との比較ゲノム解析を行うことによって、ソメワケササクレヤモリの性分化関連候補遺伝子の検出を試みることにした。ソメワケササクレヤモリの全ゲノム配列はすでに読まれていることから、本研究ではPacBio RSIIシステムを用いてミナミヤモリのZW型雌個体の全ゲノム配列解析を実施し、X30の長鎖リード情報を得て、そのアセンブリングを終了した。さらに、ミナミヤモリの雌雄の生殖腺から、Z-W染色体間で構造変化がみられるゲノム領域に存在するDMRT1とAco1遺伝子について、雌雄間で構造の違いがみられるcDNAクローンを得た。そして、ソメワケササクレヤモリでもこれらの遺伝子のZWホモログの単離を行うとともに、既存のソメワケササクレヤモリの全ゲノム配列と本研究で得られたミナミヤモリの情報をもとに、ソメワケササクレヤモリのZ-W間染色体間で分化が生じたゲノム領域を特定し、性分化に関わる候補領域の塩基配列を比較する。",基盤研究(C),小区分45020:進化生物学関連,ヤモリ,性染色体,遺伝連鎖群,性決定遺伝子,DNAマーカー,ゲノム配列解析,gametolog,爬虫類,生殖腺,遺伝子導入,ソメワケササクレヤモリ,大規模ゲノム解析,,,,,,,,,,,,,,,,,,,,,,,,,,,,,,,,,,,,,,,,,,,,
18K06361,総合研究大学院大学,寺井 洋平,適応の副産物としての種分化: 環境適応が引き起こす生殖的隔離,本研究では全ゲノムを集団遺伝学的に解析により、種間で分化したゲノム領域から種の適応と種分化に関与する遺伝子を単離し、適応の副産物としての生殖的隔離を解明することを目的とした。ヴィクトリア湖のシクリッドでは、種分化の初期には２種間の違いに関わるゲノム領域だけが分化し、そこに存在する遺伝子の機能が複合的に関与して適応と種分化が起きて来たことが明らかになった。スラウェシマカクでは食性に関与する遺伝子が適応的に分化し、使われない遺伝子が偽遺伝子化していることを示した。ウミヘビでは視覚が採食する生息環境に適応していることを明らかにした。,基盤研究(C),小区分45020:進化生物学関連,適応,種分化,視覚関連遺伝子,解毒関連遺伝子,シクリッド,スラウェシマカク,マカク,,,,,,,,,,,,,,,,,,,,,,,,,,,,,,,,,,,,,,,,,,,,,,,,,
18K06360,総合研究大学院大学,宅野 将平,エピゲノム状態と遺伝子進化様式の関連性の解明,ゲノム-エピゲノム間の進化的インタラクションを解明するために、遺伝子領域にDNAメチル化を持つ遺伝子の進化パターンを調べた。このタイプのDNAメチル化は遺伝子ボディメチル化と呼び、発現抑制に関与せず、むしろ発現量の高い遺伝子で観察される。私の先行研究で、遺伝子ボディメチル化を持つ遺伝子のDNA配列には負の自然選択が働いていることを発見した。しかし、なぜ自然選択が働いているかは明らかにできなかった。そこで、DNAメチル化とヌクレオソームの分布に相関があることに着目し、ヒストンタンパク質のDNAの結合の維持のために自然選択が働いているという仮説を検証した。,基盤研究(C),小区分45020:進化生物学関連,ゲノム進化,集団遺伝学,エピジェネティクス,エピゲノム進化,,,,,,,,,,,,,,,,,,,,,,,,,,,,,,,,,,,,,,,,,,,,,,,,,,,,
18K06359,東京大学,新村 芳人,オーソログ遺伝子群を用いた嗅覚受容体遺伝子のゲノム進化解析と環境要因との相関,多くの動物にとって、嗅覚は生存に必須の感覚である。嗅覚受容は環境中の匂い分子が嗅覚受容体（OR）に結合することにより始まる。OR遺伝子は哺乳類最大の遺伝子ファミリーを形成している。本課題では、環境変化に対してゲノムがどのように応答するかを明らかにすることを目的として、多様な哺乳類のゲノムデータを用いて解析を行った。オーソログ遺伝子群を同定することで、特定の環境要因に応答するOR遺伝子を明らかにした。,基盤研究(C),小区分45020:進化生物学関連,嗅覚受容体,遺伝子ファミリー,ゲノム進化,嗅覚,フェロモン,哺乳類,霊長類,分子進化,多型,苦味受容体,哺乳類の進化,,,,,,,,,,,,,,,,,,,,,,,,,,,,,,,,,,,,,,,,,,,,,
18K06358,筑波大学,平川 泰久,真核藻類のピレノイド構築メカニズムの進化,水圏に生息する藻類は葉緑体の中に、炭素固定酵素が集積したピレノイドと呼ばれる構造をもつ。ピレノイドは光合成による二酸化炭素の固定反応を行う重要な器官である。本研究では、真核藻類のピレノイドの構築メカニズムとその進化を明らかにすることを目的とした。海産の単細胞藻類であるクロララクニオン藻を用いて、ピレノイドの単離法を確立し、ピレノイドの含まれるタンパク質を明らかにした。これにより、ピレノイドは藻類グループごとに独自に進化している可能性が示唆された。,基盤研究(C),小区分45020:進化生物学関連,藻類,進化,ピレノイド,葉緑体,炭素固定,二酸化炭素,オルガネラ進化,光合成,プロテオーム,遺伝子導入,,,,,,,,,,,,,,,,,,,,,,,,,,,,,,,,,,,,,,,,,,,,,,
18K06357,東北大学,矢野 大和,有性生殖を介した抗酸菌進化モデルの実験と集団ゲノミクスによる検証,データベースに登録済みのMAH世界分離株125株分の染色体配列データを対象として遺伝的集団構造解析や連鎖検出解析などを行い、組換えを頻繁に行う系統と組換えをあまり行わない系統の２系統が同じ地域に生息し、それらが“交配”していることをゲノム情報学的に明らかにした。さらに組換えのコールドスポットに注目することで、環境分離株の迅速な系統予測に利用可能なマーカー遺伝子を発見した。M. aviumがプラスミドDNAを保有している証拠を得、臨床株5株の完全ゲノム配列をエラー補正したのち公開した。プラスミドを基本骨格とするベクター作成方法に関するアイデアを記載した総説を発表した。,基盤研究(C),小区分45020:進化生物学関連,抗酸菌,プラスミド,集団ゲノミクス,ゲノム,系統進化,非結核性抗酸菌,遺伝的集団構造,地域適応,接合,,,,,,,,,,,,,,,,,,,,,,,,,,,,,,,,,,,,,,,,,,,,,,,
19K06799,国立研究開発法人海洋研究開発機構,生田 哲朗,シンカイヒバリガイ類で共生細菌が水平伝達される際、細胞では何が起きているのか？,本研究では、化学合成細菌を環境から鰓細胞内に取り込み共生させるシンカイヒバリガイ類を用いて、「共生菌の水平伝達が起こる際、細胞では何が起きているのか？」を知るために有効なモデル種を設定し、実験生物学的手法で得た試料から網羅的遺伝子発現解析や組織科学的解析を展開する。それらの結果を統合し、シンカイヒバリガイ類における菌獲得の細胞プロセスや分子メカニズムを明らかにする。,基盤研究(C),小区分45020:進化生物学関連,化学合成,共生細菌,シンカイヒバリガイ,水平伝達,細胞形態,共生進化,水平感染,電子顕微鏡,細胞内共生,水平伝播,,,,,,,,,,,,,,,,,,,,,,,,,,,,,,,,,,,,,,,,,,,,,,
19K06798,国立研究開発法人理化学研究所,PASCUAL JUAN,,"Vertebrates consists of two major groups: jawed vertebrates (mammals, reptiles, fish, etc) and jawless vertebrates (lampreys and hagfishes). While much is known about the formation of blood cells in mammals and fish, how these are formed in more distant vertebrates - both jawless and jawed- is unkown.",基盤研究(C),小区分45020:進化生物学関連,hematopoiesis,vertebrates,evolution,evo-devo,Evo-Devo,lamprey,,,,,,,,,,,,,,,,,,,,,,,,,,,,,,,,,,,,,,,,,,,,,,,,,,
19K06797,生理学研究所,齋藤 茂,両生類の時空間的なニッチの多様化に連動した温度感覚の進化機構,生息環境に応じた温度感覚の進化な変化とその分子メカニズムを解明するために、異なる温度環境に適応した両生類（カエル）を対象にした研究を行う。幼生（オタマジャクシ）が冷涼な環境で生育する種、温暖な環境で生育する種、また、高い温度でも生育できる種を用いた比較解析を行う。,基盤研究(C),小区分45020:進化生物学関連,環境適応,温度感覚,高温耐性,忌避行動,温度センサー,温度感受性TRPチャネル,両生類,幼生,温度適応,高温忌避,適応進化,温度応答行動,,,,,,,,,,,,,,,,,,,,,,,,,,,,,,,,,,,,,,,,,,,,
19K06796,沖縄科学技術大学院大学,早川 英介,横断的クロスリンクプロテオミクスによるシナプスタンパク複合体の進化的起源の解明,シナプスでは多彩なタンパクが複合体を形成することで高度な神経伝達制御が成り立っているが、多細胞動物の進化の過程でどのように発達したのか今だ未知のままである。,基盤研究(C),小区分45020:進化生物学関連,生化学,進化生物学,質量分析,神経,タンパク質,進化,神経伝達物質,タンパク,タンパク複合体,プロテオミクス,生物進化,シナプス,,,,,,,,,,,,,,,,,,,,,,,,,,,,,,,,,,,,,,,,,,,,
19K06795,沖縄科学技術大学院大学,Denton Jai,Understanding How The Environment Shapes Mutualism,Which ecosystem changes (environmental factors or the behavior or abundance of resident organisms) disrupt the delicate balance? Are there clear thresholds at which these changes have a strong detrimental effect on an ecosystem?,基盤研究(C),小区分45020:進化生物学関連,Symbiosis,Yeast,Drosophila,Gene regulation,Evolution,Outreach,Mutualism,Synthetic Biology,Population Dynamics,,,,,,,,,,,,,,,,,,,,,,,,,,,,,,,,,,,,,,,,,,,,,,,
19K06794,兵庫医科大学,菅原 文昭,円口類を用いた「第3の半規管」水平半規管獲得の進化発生学的な解明,脊椎動物の内耳は、回転の受容のために３つの半規管をもつが、５億年以上前に分岐した顎のない円口類ヌタウナギ、ヤツメウナギは、半規管をそれぞれ１つ、２つしかもたない。このことから半規管は１→２→３と段階的に獲得されたと考えられてきた。ところが、ヌタウナギの内耳は前後の半規管が二次的に融合してできたと判明し、脊椎動物の共通祖先の段階で既に前後に分かれた二半規管をもっていたことが推定された。,基盤研究(C),小区分45020:進化生物学関連,円口類,半規管,ヤツメウナギ,ヌタウナギ,進化,発生,内耳,,,,,,,,,,,,,,,,,,,,,,,,,,,,,,,,,,,,,,,,,,,,,,,,,
19K06793,上智大学,川口 眞理,タツノオトシゴの育児嚢特異的な遺伝子の探査,動物の子育ては一般的にはメスが行っているが、タツノオトシゴはオスの育児嚢内で卵を保護し、その後、出産する。育児嚢は、どのような遺伝的な変化によって生じたものなのだろうか？進化過程で育児嚢という新奇な器官がどのように生じたのかを考察するために、本研究では以下の3点を明らかにする。第一に、タツノオトシゴの育児嚢の形成開始に関わる遺伝子を同定する。第二に、育児嚢を構成する組織のマーカー遺伝子を同定する。第三に、タツノオトシゴが属するヨウジウオ科魚種の育児嚢の組織観察をとおして、タツノオトシゴの育児嚢に特徴的な組織が種間で共通しているのかを明らかにする。,基盤研究(C),小区分45020:進化生物学関連,brood pouch,trasnposon,retroposon,seahorse,transposon,digestive enzyme,タツノオトシゴ,育児嚢,ヨウジウオ科,,,,,,,,,,,,,,,,,,,,,,,,,,,,,,,,,,,,,,,,,,,,,,,
