awardnumber,organization,name,title,abstract,section,review_section,keyword1,keyword2,keyword3,keyword4,keyword5,keyword6,keyword7,keyword8,keyword9,keyword10,keyword11,keyword12,keyword13,keyword14,keyword15,keyword16,keyword17,keyword18,keyword19,keyword20,keyword21,keyword22,keyword23,keyword24,keyword25,keyword26,keyword27,keyword28,keyword29,keyword30,keyword31,keyword32,keyword33,keyword34,keyword35,keyword36,keyword37,keyword38,keyword39,keyword40,keyword41,keyword42,keyword43,keyword44,keyword45,keyword46,keyword47,keyword48,keyword49,keyword50,keyword51,keyword52,keyword53,keyword54,keyword55,keyword56
20K06763,山形大学,渡辺 絵理子,精子貯蔵に関する輸精管の機能進化におけるCRISP2の役割,アカハライモリ等の有尾両生類では、精子は形成されてから雌に受け渡されるまでの数カ月間にわたって、雄の輸精管内で受精能を維持した状態のまま貯蔵が可能であることから、貯精後に受精能獲得を必要とする哺乳類等とは異なる貯精機構の存在が示唆される。本研究では、Ca2+透過性チャネルを抑制的に制御するCysteine-rich secretory protein 2 (CRISP2)遺伝子をゲノム編集により欠損させた動物の精子の受精に関わる表現型の変化の解析と、抗体を用いたCRISP2の発現様式を解析することにより、有尾両生類の輸精管の機能進化に果たしたCRISP2の役割を検証する。,基盤研究(C),小区分45020:進化生物学関連,Crisp,sperm storage,newt,Crisp2,アカハライモリ,貯精,CRISP2,CRISP,輸精管,両生類,ゲノム編集,,,,,,,,,,,,,,,,,,,,,,,,,,,,,,,,,,,,,,,,,,,,,
21K06298,公益財団法人東京都医学総合研究所,守屋 敬子,進化的感覚器喪失に起因する神経回路変化を実験的に再現する,脳を見れば、その動物がどの感覚器に依存して生活しているかわかるほど、感覚器からの入力が脳形態に及ぼす影響は大きい。,基盤研究(C),小区分45020:進化生物学関連,鋤鼻系,コモンマーモセット,鋤鼻器,副嗅球,扁桃体皮質核,扁桃体内側核,神経トレーサー,霊長類,マーモセット,内側扁桃体,進化,鋤鼻感覚,霊長目,,,,,,,,,,,,,,,,,,,,,,,,,,,,,,,,,,,,,,,,,,,
21K06297,国立研究開発法人農業・食品産業技術総合研究機構,光永 貴之,ナケルクロアブラバチの次世代性比を決定する至近要因の解明,"寄生蜂の産卵戦略において、産卵時の寄主の状態と雌蜂が産み分ける子の性の関係については古くから進化生態学的な命題である。しかし、現在まで寄主の状態に適応的に反応していることは知られているが、""どうやって""寄主の状態を判断しているのか、という至近要因についてはほとんど解明されていない。そこで、アブラムシ類に広く寄生するナケルクロアブラバチが""寄主に産卵管を刺した時に感じる硬さ""によって寄主の最終的な資源量を予測するという仮説を検証する。寄主の体表の硬さを計測し、これと次世代性比の回帰モデルの説明力を評価する。また、寄主の種間比較や体表面の硬さを変える操作実験により回帰モデルの妥当性を検証する。",基盤研究(C),小区分45020:進化生物学関連,アブラバチ,性配分戦略,アブラムシ,意思決定要因,進化生態学,寄生蜂,性決定様式,寄主認識,,,,,,,,,,,,,,,,,,,,,,,,,,,,,,,,,,,,,,,,,,,,,,,,
21K06296,沖縄科学技術大学院大学,前田 健,回遊パタンの進化の過程を探る：初期生活史と内分泌系からのアプローチ,ヨシノボリ属魚類の回遊パタンは種によって異なり、例えば発育段階に応じて川と海の間を回遊する種や一生川に留まる種などがある。それらは異なる回遊パタンを持つ種から生活史を変化させて進化してきたと考えられるが、回遊パタンの進化を引き起こす生理機構の変化や適応上の理由はほとんど分かっていない。本研究では、初期の発育を制御する甲状腺ホルモンの作用および発現遺伝子を回遊パタンの異なるヨシノボリ属の姉妹種間で比較する。また異なる環境間において回遊パタンや卵サイズを比較することにより、回遊パタン進化の適応的意義を解明する。,基盤研究(C),小区分45020:進化生物学関連,回遊,初期生活史,遺伝子発現,トランスクリプトーム,甲状腺ホルモン,卵サイズ,耳石,魚類,,,,,,,,,,,,,,,,,,,,,,,,,,,,,,,,,,,,,,,,,,,,,,,,
21K06295,法政大学,植木 紀子,多細胞生物が統制のとれた環境応答行動を獲得するまでの進化過程,緑藻ボルボックスは数千細胞から成り、各細胞から生える鞭毛を一斉に打ちながら遊泳し、顕著な走光性を示す。走光性の方向転換は、細胞間の情報伝達ではなく、個々の細胞に予め備わっている性質が総合して実現する。個体に調和のとれた動きを生み出すこの自律分散システムは、単細胞性の祖先生物が少しずつ細胞数を増やし、進化する過程で完成したと考えられる。本研究では、鞭毛の光反応に着目してボルボックス目の種の光行動を比較・解析することで、多細胞化進化における光環境応答機構変遷の全体像の解明を目指す。,基盤研究(C),小区分45020:進化生物学関連,多細胞化,レイノルズ数,ボルボックス目,ボルボックス,光反応,走光性,鞭毛,繊毛,大型化,環境応答,,,,,,,,,,,,,,,,,,,,,,,,,,,,,,,,,,,,,,,,,,,,,,
21K06294,法政大学,豊岡 博子,ボルボックス系列緑藻で探る性フェロモンの進化プロセス,多くの真核生物は有性生殖の際、性フェロモン等の生理活性物質を介した細胞間コミュニケーションシステムを採用している。しかし、これらのシステムが獲得された過程についての分子進化学的知見は乏しい。本研究は、有性生殖の誘発の要因が、「環境要因（窒素飢餓）」から「性フェロモンを介した細胞間コミュニケーション」に転換した系統群・ボルボックス系列緑藻を用い、その中間段階にあるユードリナを中心とした比較生物学的解析を展開することで、真核生物における生理活性物質を活用した細胞間コミュニケーションシステムの獲得と進化のプロセスを分子レベルで解き明かす。,基盤研究(C),小区分45020:進化生物学関連,性フェロモン,ボルボックス系列,細胞間コミュニケーション,,,,,,,,,,,,,,,,,,,,,,,,,,,,,,,,,,,,,,,,,,,,,,,,,,,,,
21K06293,東京理科大学,田村 浩二,ナノ古細菌アラニルtRNA合成酵素と遺伝暗号の進化の解明,最小のゲノムサイズを有する古細菌・Nanoarchaeum equitans(ナノアーキア)のアラニルtRNA合成酵素(AlaRS)は、α鎖のみではG3:U70塩基対に依存しないアミノアシル化活性があり、β鎖が加わると初めてG3:U70塩基対に依存した活性を生み出すことが明らかになった。しかしながら、これらの過程で、α鎖やβ鎖がtRNAやAlaを認識する分子機構には多くの謎が残されている。 本研究では、ナノアーキアAlaRS-αによるtRNA認識およびAla活性化の分子機構や、ナノアーキアAlaRS-αとAlaRS-βによるG3:U70塩基対認識の分子機構の解明し、遺伝暗号の起源と進化に迫る。,基盤研究(C),小区分45020:進化生物学関連,tRNA,遺伝暗号,,,,,,,,,,,,,,,,,,,,,,,,,,,,,,,,,,,,,,,,,,,,,,,,,,,,,,
21K06292,東京都立大学,クロニン アダム,Elucidating the coevolutionary relationship between sociality and social immunity: a study using facultatively social bees,"Elucidating the drivers behind the evolution of societies from solitary living organisms is one of the enduring questions in evolutionary biology. Recent studies have highlighted how the evolution of social immunity may be linked with the evolution of social systems, fuelled by the growing global interest in social immunity studies. Using a cutting-edge approach which combines transcriptomics and standard immune assays, we will be able to elucidate the relationship between immune efficacy, expression of social and individual immune traits, and social living.",基盤研究(C),小区分45020:進化生物学関連,climate change,bees,thermal tolerance,latitudinal gradient,social evolution,social immunity,eusociality,social behaviour,immunity,social insects,evolutionary biology,,,,,,,,,,,,,,,,,,,,,,,,,,,,,,,,,,,,,,,,,,,,,
21K06291,琉球大学,柿岡 諒,メダカ科魚類における同所的種分化の遺伝基盤と浸透交雑による促進,インドネシアのスラウェシ島にある古代湖（ポソ湖）で同所的に種分化したメダカ科魚類3種を対象に，3種間の資源分割と同類交配に関わる形質がどのような遺伝的基盤を持っているのかを明らかにする．また，ポソ湖の3種に加え，過去にポソ湖の集団への遺伝子流動があったことが示唆されている近隣の湖に生息する別のメダカ属魚類の計4種のゲノム配列を取得し，系外から浸透してきたゲノム領域の網羅的探索を行う．,基盤研究(C),小区分45020:進化生物学関連,進化,種分化,適応,交雑,遺伝子流動,ゲノム,魚類,,,,,,,,,,,,,,,,,,,,,,,,,,,,,,,,,,,,,,,,,,,,,,,,,
21K06290,広島大学,彦坂 暁,広塩性の無腸動物を用いて始原的左右相称動物の浸透圧適応機構に迫る,浸透圧変化への適応は、生物にとって最も重要な環境適応の一つである。無腸動物はきわめて単純な体制の海産無脊椎動物で、浸透圧調節に関わる腎臓や鰓などの器官を持たず、環境変化から体を守る殻や外骨格も持たないため、一見すると外界の浸透圧変化に対して脆弱であるかにみえる。ところが我々は無腸動物の一種ナイカイムチョウウズムシがきわめて広い塩濃度変化に耐えうることを発見した。無腸動物は動物進化の初期段階の形質を色濃く残す動物だと考えられている。本研究では、ナイカイムチョウウズムシの浸透圧適応機構を明らかにすることを通して、動物の祖先が浸透圧適応という課題にいかに対処していたのかを理解することを目指す。,基盤研究(C),小区分45020:進化生物学関連,無腸動物,左右相称動物,浸透圧適応,広塩性,ナイカイムチョウウズムシ,共生藻,Symsagittifera,瀬戸内海,進化,トランスクリプトーム,共生,,,,,,,,,,,,,,,,,,,,,,,,,,,,,,,,,,,,,,,,,,,,,
21K06289,岡山大学,濱田 麻友子,ヒドラ属の生存戦略の差を生み出した種分化メカニズムの解明,刺胞動物ヒドラ属には、クロレラを細胞内に共生させ栄養面で相利共生の関係にあるグリーンヒドラと、非共生性で捕食によって栄養を獲得する比較的大型のブラウンヒドラが存在する。本研究では、このような種間での生存戦略の差を生み出すメカニズムと進化を明らかにすることを目指す。特に、ブラウンヒドラ系統でのみレトロトランスポゾンの大規模な挿入が起こっていることに注目し、その遺伝子発現調節メカニズムへの影響とエピジェネティクス制御から種分化の分子メカニズムを解明する。,基盤研究(C),小区分45020:進化生物学関連,共生,ゲノム,刺胞動物,ヒドラ,進化,,,,,,,,,,,,,,,,,,,,,,,,,,,,,,,,,,,,,,,,,,,,,,,,,,,
21K06288,大阪大学,岡田 和久,コレラ菌における突然変異バイアスとビルレンス変調に関する研究,細菌の進化において非ランダム突然変異及び適応的突然変異の関与はよく理解されていない。申請者は特殊環境下で培養したコレラ菌において、ゲノムに非ランダム的な変異が生じている現象を見出した。,基盤研究(C),小区分45020:進化生物学関連,コレラ菌,変異,環境適応,鞭毛運動,VNC,変異バイアス,病原性,進化,分子進化,,,,,,,,,,,,,,,,,,,,,,,,,,,,,,,,,,,,,,,,,,,,,,,
21K06287,お茶の水女子大学,佐藤 敦子,発生緩衝と進化可能性における、生態系解析法を活用した新規システム的解釈,近年、遺伝子診断が個人レベルでも普及してきたが、仮に病気と関わる変異をゲノム中に持っていたとしても、発病するとは限らない。その主要な原因のひとつが、生物の発生をゲノムの変異や環境ストレスに関わらず一定に保つ「発生緩衝」である。発生緩衝は、種を一定に保つはたらきを担う一方で、発生緩衝度合いの変化によって、ゲノムに潜在する変異が表現型となり、進化的変化を方向付ける。本研究では、環境が発生に及ぼす影響について、トランスクリプトームの継代的変化における数学的パターンやシステム的特性を明らかにすることにより、進化の数学的予測を目指す。,基盤研究(C),小区分45020:進化生物学関連,発生緩衝,進化可能性,カタユウレイボヤ,母性効果,ゆらぎ,ネットワーク解析,,,,,,,,,,,,,,,,,,,,,,,,,,,,,,,,,,,,,,,,,,,,,,,,,,
21K06286,東京大学,宇野 好宣,4億年間保持されている脊椎動物のマイクロ染色体における進化的意義の解明,最近の脊椎動物における比較ゲノム解析によって、マイクロ染色体と呼ばれる微小な染色体を多数含む、爬虫類と鳥類現存種に類似した核型が、実は4.5億年前の脊椎動物の共通祖先から保持されてきたことが強く示唆されている。本研究では、多数のマイクロ染色体を保持する脊椎動物種において、核内の染色体高次構造を明らかにするとともに、新たに単離したマイクロ染色体特異的に増幅する反復配列における詳細な比較解析を行う。そして得られた結果に基づき、4.5億年前から保持されているマイクロ染色体の進化的意義を考察する。,基盤研究(C),小区分45020:進化生物学関連,脊椎動物,染色体進化,マイクロ染色体,反復配列,両生類,ツメガエル,核内高次構造,,,,,,,,,,,,,,,,,,,,,,,,,,,,,,,,,,,,,,,,,,,,,,,,,
21K06285,筑波大学,平川 泰久,クロララクニオン藻のピレノイドで働く分子機構の進化,ピレノイドは炭素固定酵素であるルビスコが集合した構造で、水中に生息する様々な藻類の葉緑体内で観察される（一般的に陸上植物には存在しない）。藻類はルビスコと二酸化炭素をピレノイドに集めることで、効率的に炭素固定を行っている。本研究では、海産の単細胞藻類を用いて、ピレノイドにルビスコが集まるメカニズムや二酸化炭素の濃縮機構を明らかにし、ピレノイドで機能する分子機構とその進化を解明する。,基盤研究(C),小区分45020:進化生物学関連,藻類,光合成,葉緑体,二酸化炭素,ピレノイド,収斂進化,二酸化炭素濃縮機構,液-液相分離,オルガネラ進化,微細藻類,,,,,,,,,,,,,,,,,,,,,,,,,,,,,,,,,,,,,,,,,,,,,,
22K06351,国立研究開発法人海洋研究開発機構,生田 哲朗,深海性二枚貝の鰓細胞が共生細菌を取り込む際の３次元的形態プロセスの実証,化学合成独立栄養細菌との共生は、動物の深海環境への適応進化を可能にした生命現象であり、共生細菌の獲得はその核となる機構である。本研究では、共生細菌を環境から鰓細胞に取り込むシンカイヒバリガイ類を用いて、先進的な分子・組織学的解析手法を駆使しながら、共生細菌取り込みの初期過程を詳細に観察することによって、シンカイヒバリガイ類と化学合成細菌の共生が成立する際の細胞レベルの形態的プロセスを３次元的に明らかにする。,基盤研究(C),小区分45020:進化生物学関連,化学合成,共生細菌,シンカイヒバリガイ,水平感染,トモグラフィー,化学合成細菌,共生進化,水平伝播,細胞形態,,,,,,,,,,,,,,,,,,,,,,,,,,,,,,,,,,,,,,,,,,,,,,,
22K06350,国立研究開発法人産業技術総合研究所,山本 京祐,多栄養段階に渡る被食－捕食関係における群集・進化動態の実験的解析,「食う－食われる」の二者関係においては捕食者と被食者がお互いに相手を出し抜きあうように進化する「進化的軍拡競争」がみられるが、実際の生物群集のようにさらに上位の「捕食者を食うもの」が存在する複雑な関係において生じる進化動態とそれが群集動態に与える影響については知見が極めて少ない。本研究では、モデル微生物実験進化系を利用し、被食－捕食－上位捕食系に特徴的な群集・進化動態とそれを駆動するメカニズムを解明することを目的とする。,基盤研究(C),小区分45020:進化生物学関連,生態ー進化フィードバック,捕食性細菌,食物連鎖,進化的軍拡競争,ウイルス,生態－進化フィードバック,ミクロコズム,モデル系,進化動態,,,,,,,,,,,,,,,,,,,,,,,,,,,,,,,,,,,,,,,,,,,,,,,
22K06349,国立研究開発法人理化学研究所,武石 明佳,線虫におけるゲノム、エピゲノム変化を介した温度適応機構の解明,温度は生き物にとって特に重要な環境因子であり、生息域や種の生存を大きく左右する。各生物種の適生温度の範囲は、生息域の環境温度に合致する。しかし、生き物が進化の過程において、どのような分子メカニズムで環境温度の変化に適応してきたのかについては不明な点が多い。本研究では、C. elegansを生存極限温度で継世代的に飼育して高温に適応した株を作製する。得られた株のゲノムやエピゲノム状態を解析し、高温適応の責任分子を同定する。実験的に進化の過程を再現することで、温度適応の過程を遺伝学、分子生物学、比較進化学的に解析することを可能とし、生き物に普遍的な温度適応メカニズムを解明することを目指す。,基盤研究(C),小区分45020:進化生物学関連,線虫,高温,適応,進化,温度,ゲノム,エピゲノム,,,,,,,,,,,,,,,,,,,,,,,,,,,,,,,,,,,,,,,,,,,,,,,,,
22K06348,国立研究開発法人理化学研究所,安岡 有理,シロアゴガエルatp8遺伝子から紐解くミトコンドリアゲノム進化の機能的背景,動物のミトコンドリアゲノムは遺伝子レパートリーが非常によく保存されており、分子系統解析に頻繁に用いられているが、有効な機能解析手法はまだない。そこで本研究では、これまで報告された脊椎動物ミトコンドリアゲノムの中で唯一atp8遺伝子に欠損があるシロアゴガエル属に着目し、ネッタイツメガエル胚を用いてatp8の機能阻害実験を行う。本研究の成果は、動物胚を用いたミトコンドリアゲノムの機能解析モデルを確立することで、進化や疾患を再現する新しい方法論を創出する。,基盤研究(C),小区分45020:進化生物学関連,ミトコンドリア,ゲノム編集,進化,シロアゴガエル,ツメガエル,ナノカプセル,ロングリードシークエンス,,,,,,,,,,,,,,,,,,,,,,,,,,,,,,,,,,,,,,,,,,,,,,,,,
22K06347,京都大学,岡田 崇,適応度進行波モデルと集団遺伝学に基づくクローン干渉を伴う適応進化の解明,進化速度の速いウイルスや細菌の適応進化は、集団遺伝学においてよく知られる選択的スイープの描像とは質的に異なり、複数の有益変異が同時に存在する状況（クローン干渉)にあることが示唆されつつある。有益変異間の競合という複雑さのため、{クローン干渉の理論的理解は未だ不十分である。また、クローン干渉のダイナミクスは大きな確率的揺らぎを示すために、集団遺伝学の標準的な手法を適用できない。本研究では、数理物理学的手法により、クローン干渉の理論を発展させるとともに、集団遺伝学の統計手法を拡張する。さらに、それらを実際の遺伝子配列のデータに応用することで、クローン干渉の実証し、その詳細なダイナミクスを解明する。,基盤研究(C),小区分45020:進化生物学関連,集団遺伝学,ウイルス進化,クローン干渉,領域拡大,進化,コロナウイルス,子孫数分布,季節性インフルエンザ,,,,,,,,,,,,,,,,,,,,,,,,,,,,,,,,,,,,,,,,,,,,,,,,
22K06346,沖縄科学技術大学院大学,中島 啓介,脊椎動物はいつキチンを失い、粘液層定着型の腸内細菌との共生関係を成立させたか？,哺乳類の腸管表面をおおう粘液層には、固有の腸内細菌が定着している。この「腸内細菌による粘液層への定着」は、動物に祖先的な特徴と考えられてきた。しかし、真に祖先的な特徴である「多糖キチンのナノ繊維を骨組みとするバリア免疫機構」を失うことで成立した、新しい特徴であることを見出した。この「キチンバリア」は魚類に認められるが哺乳類には存在しないため、両者をつなぐ脊椎動物の系統のどこかで失われたと考えられる。本研究は、それらの系統（肺魚・両生類・爬虫類など）の腸管を調べ、キチンバリアがいつ失われたかを明らかにする。,基盤研究(C),小区分45020:進化生物学関連,腸内細菌,キチン,粘液層,共生関係,動物進化,脊椎動物,,,,,,,,,,,,,,,,,,,,,,,,,,,,,,,,,,,,,,,,,,,,,,,,,,
22K06345,慶應義塾大学,前田 太郎,盗葉緑体現象における遺伝子伝搬に依らない形質伝搬機構をタンパク質解析から解明する,軟体動物ウミウシは、生来的には光合成能力を持たないが、摂食した藻類の葉緑体を細胞内に取り込むことで光合成能を獲得する。我々は、本現象には藻類の遺伝子の取り込みが無いことを示し、藻類中で作られた光合成タンパク質をそのまま流用していると予測した。本研究では、このタンパク質流用の有無を検証し、それに関わるウミウシ側タンパク質を明らかにする目的で、ウミウシ葉緑体のプロテオーム解析を行う。,基盤研究(C),小区分45020:進化生物学関連,葉緑体,軟体動物,光合成,種間相互作用,盗葉緑体現象,プロテオーム,盗葉緑体,盗タンパク質,進化,,,,,,,,,,,,,,,,,,,,,,,,,,,,,,,,,,,,,,,,,,,,,,,
22K06344,上智大学,川口 眞理,タツノオトシゴの育児嚢における胎盤様構造とその機能,地球上に多様な種が生息しているのは、進化の過程で環境に適応しつつ様々な形質を獲得したからである。魚類の中でも、タツノオトシゴが属するヨウジウオ科魚類は、進化過程でオスが子育て器官である育児嚢を獲得した。オスはメスから受け取った卵を保護し、その後出産する。タツノオトシゴの育児嚢は胎盤と真皮層で構成されている。胎盤は、抱卵中に卵を包み込むように保護するので、子育てにおいて重要な役割を担うと考えられる。本研究では、胎盤に着目して、(1)形成メカニズム、(2)抱卵中の役割、(3)進化過程の3つの視点で、タツノオトシゴの胎盤がどのような機能を持つのかを解明する。,基盤研究(C),小区分45020:進化生物学関連,seahorse,brood pouch,placenta,タツノオトシゴ,胎盤,育児嚢,進化,,,,,,,,,,,,,,,,,,,,,,,,,,,,,,,,,,,,,,,,,,,,,,,,,
22K06343,県立広島大学,菅 裕,細胞間コミュニケーションの起源―動物はどうやって多細胞化したか,動物の多細胞性は、細胞間のコミュニケーションによって成り立っている。単細胞の祖先からそのような複雑な仕組みがどうやって進化したのか？この問いに答えることは、動物の多細胞性の起源という「大進化」の分子メカニズムに迫ることである。驚くべきことに、典型的な接触型の細胞間連絡機構、Notchシグナリングと、非接触型の細胞間連絡機構、受容体チロシンキナーゼ（RTK）シグナリングの原型が、動物に近縁な原生生物（単細胞ホロゾア）にも存在する。本研究では、独自のモデル生物と遺伝子操作技術を使ってこれらの遺伝子の機能を明らかにし、動物多細胞化メカニズムの一端を明らかにする。,基盤研究(C),小区分45020:進化生物学関連,動物多細胞性の進化,単細胞ホロゾア,Notch,ラミニン,受容体型チロシンキナーゼ,多細胞性,進化,,,,,,,,,,,,,,,,,,,,,,,,,,,,,,,,,,,,,,,,,,,,,,,,,
