awardnumber,organization,name,title,abstract,section,review_section,keyword1,keyword2,keyword3,keyword4,keyword5,keyword6,keyword7,keyword8,keyword9,keyword10,keyword11,keyword12,keyword13,keyword14,keyword15,keyword16,keyword17,keyword18,keyword19,keyword20,keyword21,keyword22,keyword23,keyword24,keyword25,keyword26,keyword27,keyword28,keyword29,keyword30,keyword31,keyword32,keyword33,keyword34,keyword35,keyword36,keyword37,keyword38,keyword39,keyword40,keyword41,keyword42,keyword43,keyword44,keyword45,keyword46,keyword47,keyword48,keyword49,keyword50,keyword51,keyword52,keyword53,keyword54,keyword55,keyword56
19K06792,県立広島大学,菅 裕,単細胞生物の危機避難機構が準備した動物多細胞性の進化,我々動物は多数の細胞からなる多細胞生物であるが、その多細胞体制はどのように進化してきたのか？その分子レベルのメカニズムを探るため、独自に確立したモデル生物2種（カプサスポラ及びクレオリマックス）を使用し、動物特有とされてきた3つのシステム、受容体チロシンキナーゼ、Notch、細胞外マトリクスが、単細胞の時代にはどのような目的に使われていたのかを調べる。我々の仮説は、「単細胞体制において危機的状況に対応するために進化したメカニズムが、動物の祖先において転用され、多細胞体制の構築に使われた」というものである。この仮説が正しいかどうか、分子生物学的手法を用いて確かめる。,基盤研究(C),小区分45020:進化生物学関連,多細胞性の進化,単細胞ホロゾア,多細胞性,進化,ゲノム編集,危機と進化,細胞接着,細胞連絡,危機,,,,,,,,,,,,,,,,,,,,,,,,,,,,,,,,,,,,,,,,,,,,,,,
19K06791,首都大学東京,新津 修平,チョウ目昆虫における翅形質の退行的な進化を制約する発生・分子機構の解明,チョウ目昆虫では、メスのみで翅を退化させる進化が広範囲に観察されている。そのような種でも、発生の過程で蛹期に一旦“小さい翅”が形成され、その翅を変態時に退縮させている。我々は、この“小さい翅”が、進化の際に、発生システムが持つ拘束と制約によって維持されたと考えた。,基盤研究(C),小区分45020:進化生物学関連,チョウ目昆虫,翅の退化,性的二型,進化的制約,プログラム細胞死,アポトーシス,翅退縮,発生拘束,フチグロトゲエダシャク,次世代シーケンサー,遺伝子発現解析,翅原基形成過程,スクリーニング,チョウ目,フユシャクガ,遺伝子発現,分子メカニズム,翅原基,,,,,,,,,,,,,,,,,,,,,,,,,,,,,,,,,,,,,,
19K06790,九州大学,松林 圭,海浜性ゾウムシにおける複合的な形質置換の実態解明と”波及的隔離強化仮説”の検証,飛翔能力を欠く日本の海浜性ゾウムシの近縁な2種では、オス交尾器内袋骨片の形状と鞘翅色彩について形質置換が示唆されている。この2種間では他にも複数の形質が形質置換を示す可能性があるため、その様相を集団間比較によって明らかにする。さらに、このような種間での形質置換が波及的に種内異所的集団間の生殖隔離を発達させる “波及的隔離強化”について検証する目的で、これらのゾウムシを用いた形態計測、飼育交配実験、分子集団遺伝学的解析、野外観察などを通して、形質置換の生態的要因および進化的背景を調査する。,基盤研究(C),小区分45020:進化生物学関連,形質置換,波及的隔離強化,種間競争,交尾器,海浜性昆虫,色彩多型,種分化,種間相互作用,繁殖干渉,雄交尾器内袋骨片,海浜性ゾウムシ,系統地理,移動分散,,,,,,,,,,,,,,,,,,,,,,,,,,,,,,,,,,,,,,,,,,,
19K06789,九州大学,楠見 淳子,microRNAとそのターゲット遺伝子間に生じる補償的進化の検証,microRNA(miRNA)分子内の相補配列は構造上重要であるだけでなく、ターゲット遺伝子に直接作用する配列でもあり、miRNA分子内、miRNAとターゲット遺伝子の相補配列は共進化していると考えられる。本研究ではmiRNAの作用機序に基づいた分子進化モデルを構築し、シミュレーションによる解析を行うとともに、データ解析による観察値との比較を行い、miRNA遺伝子に働く進化要因について検証する。,基盤研究(C),小区分45020:進化生物学関連,補償的進化,miRNA,microRNA,分子進化,,,,,,,,,,,,,,,,,,,,,,,,,,,,,,,,,,,,,,,,,,,,,,,,,,,,
19K06788,広島大学,三浦 郁夫,主要な性決定遺伝子３種類をつなぐ複合型性染色体の性決定と進化,脊椎動物では、これまで少なくとも３種類の主要な性決定遺伝子が同定されている。私たちは、染色体の相互転座によってこれら３つの遺伝子をつなぐ複合型性染色体をカエルに見出した。さらに、同種内で未だ相互転座が生じていない元祖集団も発見した。本研究では、３つの性決定遺伝子で構成される複合型性染色体の性決定様式と元祖型を起点としたその進化機構の解明に臨む。,基盤研究(C),小区分45020:進化生物学関連,性染色体,性決定,XY,ZW,ターンオーバー,カエル,複合型性染色体,転座,オスヘテロ,,,,,,,,,,,,,,,,,,,,,,,,,,,,,,,,,,,,,,,,,,,,,,,
19K06787,福井大学,尾内 隆行,円口類胚を用いた脊椎動物頭部骨格筋の進化的起源の解明,脊椎動物の進化的起源は過去二百年に渡り研究されているがいまだにわかっていない。本研究では、もっとも古くに分岐した脊椎動物の一種であるヤツメウナギを用い、その形態を観察することで脊椎動物の頭部の進化の歴史を明らかにする。特に電子顕微鏡による細胞型の観察を行うことで微細な構造の差異を明らかにする。,基盤研究(C),小区分45020:進化生物学関連,脊椎動物,中胚葉,分節性,ナメクジウオ,ギボシムシ,ロゼッタ,体節,頭部分節性,脊索動物,頭部形態進化,電子顕微鏡,円口類,頭部骨格筋,,,,,,,,,,,,,,,,,,,,,,,,,,,,,,,,,,,,,,,,,,,
19K06786,東北大学,丸山 真一朗,サンゴ共生藻による環境応答機構と共生能力との関係,サンゴ共生藻として知られる褐虫藻は、サンゴやイソギンチャクなどの宿主刺胞動物に細胞内共生し、特に熱帯海域において重要な生態学的ニッチを構築している。この細胞内共生の成立には、褐虫藻と宿主との間で様々な代謝物質がやりとりされることが重要であると考えられているが、どのような物質の輸送がどれくらい起こり、どのように制御されているのかについては、良く分かっていない。本研究では、褐虫藻から宿主刺胞動物へと受け渡される代謝物質に着目し、物質輸送に関わる細胞内の経路と、それを制御するメカニズムについて解析する。,基盤研究(C),小区分45020:進化生物学関連,細胞内共生,刺胞動物,褐虫藻,サンゴ,環境応答,サンゴ共生生態系,代謝,,,,,,,,,,,,,,,,,,,,,,,,,,,,,,,,,,,,,,,,,,,,,,,,,
20K06779,国立研究開発法人海洋研究開発機構,吉田 尊雄,深海性二枚貝の細胞内共生系の共生者の獲得と維持メカニズムの基盤解明,深海の熱水域や湧水域の化学合成生態系に優先する動物の多くは、自身の細胞内に化学合成細菌(以後、共生菌と呼ぶ)を共生させ、共生菌が合成する物質を得ていると考えられている。共生菌は、どのようにして宿主となる動物の細胞内に入り込み、維持されるのか、そのメカニズムは解っていない。本研究では、深海性の二枚貝シンカイヒバリガイを用いて、共生菌の獲得と維持に関わるメカニズムについて解析する。,基盤研究(C),小区分45020:進化生物学関連,細胞内共生,共生者の獲得,共生の維持,共生,細胞内,相互作用,,,,,,,,,,,,,,,,,,,,,,,,,,,,,,,,,,,,,,,,,,,,,,,,,,
20K06778,国立遺伝学研究所,廣岡 俊亮,原始紅藻類からみた性の獲得・進化機構の解明,有性生殖は真核生物に普遍的に存在する現象である。性決定機構はそれぞれの系統で独自に獲得されており、さらに異形配偶および卵生殖を行う多細胞生物では複雑化している。一方、同形配偶を行う単細胞真核生物は比較的単純な性決定領域をそのゲノム上に持つため、性決定機構の研究を進めやすいという利点がある。申請者はごく最近、これまでに単細胞紅藻類では見つかっていなかった有性生殖過程を発見した。本研究では、同形配偶を行う単細胞紅藻類を有性生殖研究におけるモデル生物系統群として開発し解析を行うことで、その性決定機構、起源及び進化過程の解明を目指す。,基盤研究(C),小区分45020:進化生物学関連,単細胞藻類,有性生殖,ゲノム解析,藻類,ゲノム,遺伝的改変,比較ゲノム,遺伝子改変,,,,,,,,,,,,,,,,,,,,,,,,,,,,,,,,,,,,,,,,,,,,,,,,
20K06777,早稲田大学,大山 隆,食虫植物の消化酵素の起源と進化：遺伝子発現様式の変更による新規形質獲得の普遍性,我々は、これまでにツルギバモウセンゴケ（オーストラリア産の大型モウセンゴケ）を用いて、消化液に含まれるタンパク質の解析を行ってきた。そして、消化液を構成する主要なタンパク質は自己防御遺伝子産物であり、それらをコードする遺伝子は腺毛（当該植物の捕虫・消化器官）特異的に発現し、一部の遺伝子に関してはエピジェネティックな発現制御を受けていることを解明した。本研究は、これらの特徴が、食虫植物という生物全般に共通したものか否かを明らかにすることを目的とし、他の捕虫様式をもつ食虫植物を用いて、各植物の消化液中の主要なタンパク質の同定、ならびにそれらをコードする遺伝子の同定と発現制御機構の解析を行う。,基盤研究(C),小区分45020:進化生物学関連,食虫植物,消化酵素,遺伝子発現,エピジェネティクス,モウセンゴケ,捕虫葉,S1型ヌクレアーゼ,トランスクリプトーム,エピジェネテュクス,植物ゲノム,環境応答,新規形質獲得,自己防御遺伝子産物,エピジェネティック制御,,,,,,,,,,,,,,,,,,,,,,,,,,,,,,,,,,,,,,,,,,
20K06776,東京慈恵会医科大学,庄野 孝範,哺乳類の胎盤絨毛の起源を原始的条鰭類魚類ポリプテルスの胚に探す,本研究は、四肢動物が上陸を果たす大進化以前の姿を残す“原始的条鰭類魚類ポリプテル,基盤研究(C),小区分45020:進化生物学関連,Gcm1,胎盤,魚類,ポリプテルス,進化,Gcm,外鰓,,,,,,,,,,,,,,,,,,,,,,,,,,,,,,,,,,,,,,,,,,,,,,,,,
20K06775,東海大学,中川 草,哺乳類ゲノムに内在化したレトロウイルス由来の遺伝子の進化メカニズムの解明,ウイルスゲノムが宿主ゲノムに水平伝播した配列（EVE）が、宿主で機能遺伝子となった場合の進化モデルを構築する。EVE由来の遺伝子は、類似の機能をもっていても、動物の系統ごとに由来となるウイルスが異なることが多い。宿主で新規機能を獲得しているEVE由来の遺伝子が、進化の過程で別のEVE由来の配列に置き換わるためである（バトンパス仮説）。その要因は、EVE由来の遺伝子と宿主の感染受容体の関係が重要であると考えた。本仮説を検証するために、哺乳類の胎盤形成に関与するEVE由来の遺伝子と相互作用する宿主受容体について、ウイルス学実験により同定し、大規模に分子進化解析を行う。,基盤研究(C),小区分45020:進化生物学関連,内在性レトロウイルス,分子進化,比較ゲノム,新規遺伝子,哺乳類,ゲノム進化,レトロトランスポゾン,膜タンパク質,膜融合,進化モデル,受容体,細胞融合,レトロウイルス,新規機能遺伝子,胎盤,,,,,,,,,,,,,,,,,,,,,,,,,,,,,,,,,,,,,,,,,
20K06774,上智大学,安増 茂樹,魚類孵化酵素の卵膜分解系の進化：進化過程における新システムの誕生機構の解明,"真骨魚類の孵化酵素は、分岐の早い魚では単一酵素の卵膜分解系であるのに対し、分岐の遅い正真骨魚では2種類の酵素（HCEとLCE）による効率の良い分解系に進化した。正真骨魚類で初期に分岐するキュウリウオ目は3つの酵素 (HCE, LCE, HE)の分解系で、2種の酵素系（HCE/LCE系）が成立する以前の移行段階の分解系を維持していると考えられる。HEは卵膜分解を担保することにより、HCEとLCEの進化圧を軽減して、2種類の酵素による分解システムの確立を補助しているように見える。本研究は、卵膜分解系をモデルに、進化過程で生物機能の新システムがどのように誕生するのか、その分子メカニズムを提唱する。",基盤研究(C),小区分45020:進化生物学関連,機能進化,生物システムの創生,孵化酵素,卵膜,ZPタンパク質,正真骨魚類,遺伝子重複,硬骨魚類,卵膜分解機構,新規機能遺伝子,卵膜分解,新規機能獲得,新規システム構築,,,,,,,,,,,,,,,,,,,,,,,,,,,,,,,,,,,,,,,,,,,
20K06773,青山学院大学,守山 裕大,心臓進化に着目した前適応の分子メカニズムの解析,地球上に存在する全ての生物は生息する環境に適応するようにその形態や生理機能を変化させてきた。なかでも特徴的なものは、鳥類にみられる羽毛や植物にみられる花弁といった、進化的に新規な形質(以下、進化的新規形質と記す)の獲得である。進化的新規形質の獲得メカニズムについては、その多くが単一事象の変化ではなく、複数の形質の変化や転用によってもたらされると考えられているが、その詳細な分子メカニズムについては不明な点が多く残されている。本研究課題では、真骨魚類心臓にみられる動脈球という器官の進化と発生に着目することで、進化的新規形質獲得の詳細な分子メカニズムの解明に迫る。,基盤研究(C),小区分45020:進化生物学関連,心臓,進化,前適応,elastin,動脈球,elastin b,硬さ,細胞外環境,細胞運命決定,流出路,エラスチン,心臓流出路,,,,,,,,,,,,,,,,,,,,,,,,,,,,,,,,,,,,,,,,,,,,
20K06772,摂南大学,松尾 充啓,真核生物の加速度的進化は巨大ウイルスがもたらした-状況証拠から実態解明へ,バクテリア並みの容積とゲノムサイズを持つ巨大ウイルスは、生命進化研究の新たな役者として注目されている。この巨大ウイルスが細胞内共生進化に関わることが、申請者らによる有殻アメーバのゲノム解析から明らかになってきた。本研究では、この有殻アメーバに感染する巨大ウイルスのゲノムを解読して、その性状を明らかにすることで、遺伝子転移現象等の細胞内共生進化プロセスにおける巨大DNAウイルスの役割を解明する。,基盤研究(C),小区分45020:進化生物学関連,巨大ウイルス,有殻アメーバ,細胞内共生進化,巨大DNAウイルス,細胞内共進化,ゲノム,遺伝子水平転移,,,,,,,,,,,,,,,,,,,,,,,,,,,,,,,,,,,,,,,,,,,,,,,,,
20K06771,東京都立大学,田中 健太郎,種間交雑時に交尾器不適合を引き起こす遺伝的実体の解明,種と種を隔てる生殖的隔離機構の一つに交尾器形態の不適合による隔離機構がある。これは，同種間では適合する雌雄の交尾器が，異種間では適合しないために生じる隔離機構であり，物理的に交尾器のカップリングが成立しない機械的不適合，カップリングが成立しても性的刺激が不十分なために生じる感覚的不適合の二つがある。本研究ではショウジョウバエ近縁種をモデルに交尾器形態進化に寄与した遺伝子がどのように種間交雑時の交尾器不適合を引き起こしているのか明らかにし、種分化プロセス解明の一端を担うものである。,基盤研究(C),小区分45020:進化生物学関連,形態進化,ショウジョウバエ,交尾器,種分化,交尾器進化,,,,,,,,,,,,,,,,,,,,,,,,,,,,,,,,,,,,,,,,,,,,,,,,,,,
20K06770,熊本大学,古水 千尋,植物の陸上進出とペプチド性シグナル分子の進化～植物ペプチドホルモンの起源～,陸上植物が藻類から進化し、多様化した過程には、「ペプチドホルモン」を介した細胞間コミュニケーションの成立と進化が寄与したと考えられるが、植物ペプチドホルモン情報伝達系がどのように誕生したのかは未解決のままである。そこで本研究では、① 基部陸上植物のペプチドホルモンを網羅的に探索して機能を明らかにし、② 陸上植物と近縁藻類の間に共通するペプチドホルモンの有無を検証することにより、植物ペプチドホルモンの起源を解明することを目的とする。本研究を行うことで、植物ペプチドホルモン情報伝達系の起源と進化の理解が深まることが期待され、新奇植物ペプチドホルモンの発見につながる可能性もある。,基盤研究(C),小区分45020:進化生物学関連,植物ペプチド情報伝達系,植物ペプチドホルモン,ゼニゴケ,陸上植物の進化,分子進化,共進化,遺伝子重複,生物間相互作用,植物ホルモン,異種生物間相互作用,植物ペプチド性情報因子の進化,植物ペプチド性情報因子受容体の進化,植物―動物間相互作用,ペプチドホルモン,藻類,コケ植物,,,,,,,,,,,,,,,,,,,,,,,,,,,,,,,,,,,,,,,,
20K06769,愛媛大学,中島 敏幸,インビトロ合成生態系を用いた共生の起源と進化の解明,本研究では，生態系の相互作用と化学量論的制約が構成種に選択圧を及ぼす進化過程を観察し解析するために，生産者や分解者を含む生態系レベルの培養系（マイクロコズム）を用いる．これは光照射のみで構成種が存続するフラスコ内の生態系である．構成種はクロレラ，大腸菌およびテトラヒメナであり，それらの間の共生関係の進化を形質レベル，DNAレベル，エピゲノムレベルで解析し，メンバー間の共生が出現（起源）し進化する機構を解明する．その結果に基づいて，光独立栄養生物と従属栄養生物間の共生の起源と進化についての検証可能な仮説と一般理論を提案する．さらに，共生を進化させる工学的技術の方法論も提示したい．,基盤研究(C),小区分45020:進化生物学関連,共生,実験進化,生態系,ゲノム,クロレラ,大腸菌,テトラヒメナ,細胞内共生,藻類,,,,,,,,,,,,,,,,,,,,,,,,,,,,,,,,,,,,,,,,,,,,,,,
20K06768,島根大学,児玉 有紀,ミドリゾウリムシと共生クロレラを用いた細胞内共生の成立機構と維持機構の解明,研究代表者は、繊毛虫の「ミドリゾウリムシ」とその細胞内に共生する緑藻の「クロレラ」を用いて、真核細胞同士の細胞内共生の成立のプロセスを初めて明らかにした。本研究では、トランスクリプトーム解析や免疫化学的な手法を用いて、上記のプロセスの分子機構を解明する。さらにラマン分光法を用いて、食胞膜からPV膜の分化に伴う分子構造の変化を明らかにする。本研究の発展は、細胞内共生成立に普遍的な現象の分子機構の解明、細胞内共生関係の維持を通した生態系の維持と環境保全、細胞内共生による真核細胞の進化と多様化のメカニズムの解明等に繋がると期待される。,基盤研究(C),小区分45020:進化生物学関連,ミドリゾウリムシ,クロレラ,細胞内共生,ミトコンドリア,モノクローナル抗体,トリコシスト,進化,原生生物,,,,,,,,,,,,,,,,,,,,,,,,,,,,,,,,,,,,,,,,,,,,,,,,
20K06767,大阪大学,加藤 和貴,MAFFT多重配列アラインメントプログラムの機能拡張,DNAやタンパク質の一次配列上で由来を同じくする部分を推定することを配列アラインメントという。多数本の配列アライメントを多重配列アラインメントという。これは進化解析や機能解析の基礎となる技術であり、申請者の開発したMAFFTプログラムが現在広く普及している。実際に役立っている例として、ヒトに感染する新型コロナウイルスがどの動物に由来したかを調べる時にもMAFFTプログラムが用いられている。本研究ではこのプログラムを継続的に開発する。,基盤研究(C),小区分45020:進化生物学関連,ゲノムアラインメント,行動分析,T細胞受容体,配列アラインメント,ゲノム比較,文字列の比較,データベース,正の淘汰,多重配列アラインメント,分子進化,ロングリードシークエンサ,巨大アラインメント,新型シークエンサー,ウイルスゲノム,,,,,,,,,,,,,,,,,,,,,,,,,,,,,,,,,,,,,,,,,,
20K06766,中央大学,浜地 貴志,卵生殖出現をボルボックス系列緑藻で解明する性分化機構の進化発生学,雌雄二極化の鍵である「ボルボックス系列緑藻性決定因子MIDの有無がどのように、どの遺伝子を発現誘導／抑制することで性分化を生じるのか」というコア分子基盤動態は、未だ未解明である。同型配偶クラミドモナスの性分化制御機構と被制御遺伝子群全体を包括する性分化分子機構を明らかにし、同型配偶・異型配偶・卵生殖がすべて近縁な系統群に現存するすべてボルボックス系列緑藻全体で既に得られている比較ゲノム学的資源を直ちに応用して機能実証を試みることにより、ついに精子と卵の二極化をもたらした分子基盤が解明できると考えた。,基盤研究(C),小区分45020:進化生物学関連,性分化,クラミドモナス,ボルボックス,転写因子,RWP-RKドメイン,有性生殖,性決定,進化発生学,緑藻,雌雄性,ゲノム編集,,,,,,,,,,,,,,,,,,,,,,,,,,,,,,,,,,,,,,,,,,,,,
20K06765,総合研究大学院大学,植松 圭吾,集団ゲノミクスを用いた社会性進化の解析,社会性の進化に関わるゲノム領域を特定することは、その進化の法則を探る上で重要である。昆虫を始めとした社会性生物では、多様な種におけるゲノム解読が進んでいるものの、集団間にはたらくゲノムレベルでの自然選択の検出に関しては、集団の進化的歴史を考慮していないなど、解析が不十分である。本研究課題では、社会性アブラムシにおいて複数集団・複数個体の全ゲノム配列を取得し、集団の歴史を考慮した集団ゲノミクス解析を行うことで、社会性進化に関与したとされるゲノム領域を特定する。,基盤研究(C),小区分45020:進化生物学関連,社会性昆虫,進化,比較ゲノム,集団ゲノミクス,アブラムシ,血縁選択,社会性アブラムシ,,,,,,,,,,,,,,,,,,,,,,,,,,,,,,,,,,,,,,,,,,,,,,,,,
20K06764,千葉大学,菊池 真司,非組換え領域S遺伝子座における組換えと非自己認識システムの分子進化,自家不和合性の常識に自他認識因子の完全連鎖がある。自他認識因子があるS遺伝子座内での組換えは自家受精への変換をもたらすため、自他認識と組換え抑制が一緒に進化したわけである。実際、交雑集団を調べると組換え体は出現しない。ところがリンゴのS遺伝子座において、減数分裂細胞を直接観察すると高率で組換えが生じていた。さらに、花粉からも組換え型のSハプロタイプが見つかった。本研究では、解析規模を拡大して、減数分裂での組換えの可視化、花粉・後代植物の遺伝子型の決定から、この“潜在的な”組換えの実態を調査し、受精過程で組換え型Sが排除される可能性やSハプロタイプの多様化に関与した可能性を考察する。,基盤研究(C),小区分45020:進化生物学関連,自家不和合性,遺伝的組換え,減数分裂,FISH,花粉,ASP-PCR,遺伝的組み換え,S遺伝子座,F-box,自他認識,組換え,,,,,,,,,,,,,,,,,,,,,,,,,,,,,,,,,,,,,,,,,,,,,
