awardnumber,organization,name,title,abstract,section,review_section,keyword1,keyword2,keyword3,keyword4,keyword5,keyword6,keyword7,keyword8,keyword9,keyword10,keyword11,keyword12,keyword13,keyword14,keyword15,keyword16,keyword17,keyword18,keyword19,keyword20,keyword21,keyword22,keyword23,keyword24,keyword25,keyword26,keyword27,keyword28,keyword29,keyword30,keyword31,keyword32,keyword33,keyword34,keyword35,keyword36,keyword37,keyword38,keyword39,keyword40,keyword41,keyword42,keyword43,keyword44,keyword45,keyword46,keyword47,keyword48,keyword49,keyword50,keyword51,keyword52,keyword53,keyword54,keyword55,keyword56
20H00280,東京大学,岩崎 晃,大型地球観測センサを可能とする光学計測と構造制御の融合,自然災害の増加に伴い、静止軌道からの常時高分解能地球観測に期待が高まっている。しかしながら、通常の地球観測衛星と比較して60倍ほど軌道高度が高くなるため、観測機器が大型化し、高品質の画像を取得するためには、高度な構造制御が必要となる。本研究では、観測機器側に安定した光学計測の仕組みを作るとともに、構造側に高精度な制御手法を導入することで、両者の技術を融合させる、上記の課題を解決する。ミッションを行う観測の研究者およびミッションを提供する構造の研究者が、数学モデルを媒介とすることで、観測をもモデル化し、大型望遠鏡を用いた実験を通じて実証する。,基盤研究(A),中区分24:航空宇宙工学、船舶海洋工学およびその関連分野,大型望遠鏡,構造制御,光学測定,ストラット,静止光学,リモートセンシング,地球観測,構造,光学計測,宇宙望遠鏡,,,,,,,,,,,,,,,,,,,,,,,,,,,,,,,,,,,,,,,,,,,,,,
20H00279,東北大学,大西 直文,表面電荷制御による革新的流体制御技術の確立,大気圧放電プラズマによって流体機械表面の流れを制御するプラズマアクチュエータ (PA) の性能向上に向け，表面電荷特性という観点から検討し，表面電荷の堆積に伴う電界遮蔽によって十分な電気流体力が得られていない現状の PA が持つ課題を克服する．そして，プリンテッドエレクトロニクス技術を利用した高集積化とそれに伴う低電圧化により，電源を含めたシステムの小型化・軽量化を実現する．さらに得られた低電圧・高集積 PA の大面積化と，放電特性を利用したセンシングのインテグレーションによって，特定の場所だけでなく広い範囲で柔軟に動作する PA を実証し，流体機械全面で境界層を制御する手法の確立を目指す．,基盤研究(A),中区分24:航空宇宙工学、船舶海洋工学およびその関連分野,流体制御,プラズマアクチュエータ,誘電体バリア放電,大気圧プラズマ,プリンテッドエレクトロニクス,,,,,,,,,,,,,,,,,,,,,,,,,,,,,,,,,,,,,,,,,,,,,,,,,,,
20H00278,東北大学,野々村 拓,データ駆動科学による超音速乱流大規模構造の超時空間解像計測,超音速乱流の大規模構造に対して「時間解像度は高いが空間解像度の低い計測」および「空間解像度は高いが時間解像度の低い計測」を低次元モデルで結びつけて時間解像度および空間解像度の双方が高い「超時空間解像計測」結果を再構築する．これにより大規模構造のダイナミクスを捉えたパラメトリックスタディを「超時空間解像」を用いた実験で実現し，モデル化につなげる．このために以下の3つの研究項目を順に行う．,基盤研究(A),中区分24:航空宇宙工学、船舶海洋工学およびその関連分野,データ駆動科学,超音速流,超時空間解像計測,粒子画像速度計測法,空力音響,超時空感解像計測,,,,,,,,,,,,,,,,,,,,,,,,,,,,,,,,,,,,,,,,,,,,,,,,,,
21H04591,国立研究開発法人宇宙航空研究開発機構,宮崎 康行,高精度ゴッサマー宇宙構造物システムの実現に向けた解析・設計理論構築と実験検証,本研究は，膜・ケーブルなどの張力構造（ゴッサマー構造）と，それを支持する軽量で剛な圧縮構造により自己平衡多体系を成す展開宇宙構造物（ゴッサマー多体宇宙構造物）について，膜面の折り癖の影響や配線等も考慮しながら，軌道上での展開後形状を予測する理論とそれに基づく数値解析コードを開発する．そして，それに基づき，高精度に所望の形状に展開する方法（例えば10m級の構造物で誤差1mm以下程度）を明らかにする．,基盤研究(A),中区分24:航空宇宙工学、船舶海洋工学およびその関連分野,ゴッサマー構造,宇宙構造物システム,展開構造,高精度構造,自己展開構造,構造設計理論,,,,,,,,,,,,,,,,,,,,,,,,,,,,,,,,,,,,,,,,,,,,,,,,,,
21H04590,国立研究開発法人海上・港湾・航空技術研究所,正信 聡太郎,海底鉱物資源開発のためのフローアシュアランス分析及び圧力損失最小化技術の開発,本研究では超音波計測技術を独自開発し、傾斜管を用いた移送実験を通じて、管内を脈動する固液二相流の流動状況と圧力損失の周波数スペクトル空間での因果関係を解明してフローアシュアランス（流路保全）分析に適用可能な圧力損失推定手法を構築する。また、圧力損失を低減可能な制御デバイスを考案し、実験を通じて本デバイスの効果の範囲を明らかにする。さらに、内部流との相互作用が分析できる水中線状構造物の応答予測手法を構築して、縮尺模型を用いた水槽実験で検証する。,基盤研究(A),中区分24:航空宇宙工学、船舶海洋工学およびその関連分野,海洋鉱物資源開発,フローアシュアランス分析,超音波計測技術,圧力損失最小化技術,水中線状構造物挙動,超音波計測,圧力損失最小化,水中線状構造物,,,,,,,,,,,,,,,,,,,,,,,,,,,,,,,,,,,,,,,,,,,,,,,,
21H04589,名古屋大学,佐宗 章弘,前方流速場nudgeによる衝撃波変調～波面消失原理実証と応用展開,本研究では、衝撃波面前方に僅かな流速場を誘起すること（流速場nudge）によって波面を消失させるくらい積極的に背後圧力の増加を抑制する方法を原理実証し、ソニックブームなどの衝撃波被害緩和に応用することを目的とする。主要実験装置として「流動衝撃波管」を開発し、既設の屋内自由空間も活用して実験サイトを整備し、数値解析と光学可視化計測と密接にタイアップして研究を推進する。流速変化領域の有限長さや多次元性の影響等も含めて、関連する流体力学現象を解明し、衝撃波緩和・消失デバイスを原理実証、機能評価し、応用展開につなげる。,基盤研究(A),中区分24:航空宇宙工学、船舶海洋工学およびその関連分野,衝撃波,ソニックブーム,衝撃波管,圧縮性流体力学,光学可視化,リーマン問題,,,,,,,,,,,,,,,,,,,,,,,,,,,,,,,,,,,,,,,,,,,,,,,,,,
21H04588,東京工業大学,松永 三郎,可変形状機能を用いた姿勢軌道制御技術の体系化研究による宇宙システムの革新,従来の宇宙システムに対して、構造的な可変機能を積極的に付与して制御・管理することにより、従来では達成できなかった姿勢と軌道の同時制御ができる可能性が判明してきた。本研究では、早期実証を目指す衛星の開発、打上、軌道上運用を実施し、その過程で得られる知見を継承活用しながら、具体的な科学ミッションを定義した上で、その要求仕様を満たす可変形状制御法の理論・実装研究や可変形状機構システムのフライトモデルを指向した試作研究を総合的に実施して、可変形状制御を体系化する。制御管理された「可変形状機能」を今後の宇宙システムのための姿勢軌道制御の基本標準技術へと昇華させることを目指す。,基盤研究(A),中区分24:航空宇宙工学、船舶海洋工学およびその関連分野,可変形状宇宙システム,姿勢軌道同時制御,軌道上実証,軽量高剛性収納展開構造機構,先端宇宙科学ミッション,,,,,,,,,,,,,,,,,,,,,,,,,,,,,,,,,,,,,,,,,,,,,,,,,,,
21H04587,東京大学,姫野 武洋,極低温ロケット高度化と軌道上再補給に関わる熱流動現象解明と予測技術の総合的研究,数週間以上の長期間運用が可能な極低温再使用型ロケットや軌道上推進薬再補給設備などから成る軌道間輸送システムの設計と実現のために、ロケット推進系や再補給設備の内部(タンク・供給配管・ターボポンプ)における、沸騰凝縮を伴う自由表面流を対象とし、地上とは異なる様々な加速度環境における熱流動現象の解明と予測技術の確立を目指す。 具体的には、(1)極低温スロッシング実験、(2)大型液体水素タンクでの減圧沸騰実験、(3)低重力環境における沸騰二相流実験、ならびに、(4)自由表面流数値解法の構築に取り組む。研究成果を統合し、液体水素運搬船や水素燃料航空機も含め、各種機器の設計基盤技術として提案する。,基盤研究(A),中区分24:航空宇宙工学、船舶海洋工学およびその関連分野,推進薬マネジメント,液体ロケット,自由表面流,極低温流体,スロッシング,相変化,ロケット,液体水素,極低温,管内沸騰,気液二相流,軌道間輸送,水素,,,,,,,,,,,,,,,,,,,,,,,,,,,,,,,,,,,,,,,,,,,
21H04586,東北大学,大林 茂,データ同化による風洞実験デジタルツイン,本研究では、風洞実験における画像計測と数値流体力学(CFD)に基づくシミュレーションをデータ同化で融合することで不確かさを減らす、リアルとヴァーチャルを融合した新しい実験法「風洞実験デジタルツイン」を研究する。この「風洞実験デジタルツイン」は、計測上の物理的制約で拘束された画像計測から、必要とするすべてのデータをデジタルツイン上で取得することを可能にする。デジタルツインの構築に必要なデータ量を明らかにし、十分な精度を保証するための指針を得て、デジタルツインを介した風洞実験データの自由な取得を可能にし、ポストコロナの時代に求められる風洞実験の省力化、遠隔化、自動化に資する。,基盤研究(A),中区分24:航空宇宙工学、船舶海洋工学およびその関連分野,デジタルツイン,風洞実験,データ同化,粒子画像流速計測法,感圧塗料計測法,,,,,,,,,,,,,,,,,,,,,,,,,,,,,,,,,,,,,,,,,,,,,,,,,,,
22H00243,九州大学,山本 直嗣,ホールスラスタにおけるプラズマ乱流の理解と制御,オール電化衛星の成功により、宇宙の推進装置にも電気エネルギーを推進力に変換する電気推進を採用する流れが加速している。オール電化衛星の推進系には、推力電力比が大きいホールスラスタが有力候補であり、ホールスラスタ開発の鍵となるのが、推力電力比向上を阻害する電子の異常輸送の抑制である。この異常輸送を引き起こす要因として、プラズマ乱流の寄与を示唆する結果が得られた。しかしながら、このプラズマ乱流が「どのような」乱流で、「なぜ」異常輸送に寄与するのか、ブラックボックスのままである。そこで、本研究では、先に確立した計測技術を拡張し、揺動の時空間構造を計測して、プラズマ乱流の物理機構を解明する。,基盤研究(A),中区分24:航空宇宙工学、船舶海洋工学およびその関連分野,異常輸送,ホールスラスタ,プラズマ乱流,プラズマ計測,原動機・推進,電気推進,,,,,,,,,,,,,,,,,,,,,,,,,,,,,,,,,,,,,,,,,,,,,,,,,,
22H00242,東京大学,柴沼 一樹,革新的亀裂伝播制御を実現する脆性亀裂アレスト設計戦略,本研究では、「革新的亀裂伝播制御を実現する脆性亀裂アレスト設計戦略」により、構造体としてのアレスト性能を最大化する手段を示し、材料特性のみに特化した従来の脆性亀裂アレスト設計のあり方を根本的に革新する。具体には、「破壊シミュレータ」、「材料破壊抵抗同定手法」および「最適構造設計手法」を統合することで「脆性亀裂アレスト構造設計システム」を構築し、「実証実験」によりその有効性を実証する。,基盤研究(A),中区分24:航空宇宙工学、船舶海洋工学およびその関連分野,破壊力学,有限要素法,高速亀裂伝播,構造最適化,脆性破壊,アレスト,重合メッシュ法,モデル化,亀裂伝播解析,,,,,,,,,,,,,,,,,,,,,,,,,,,,,,,,,,,,,,,,,,,,,,,
22H00241,東京大学,早稲田 卓爾,南極定着氷の変動機構解明と砕氷船航路選択,昭和基地極域観測の成否は、物資を運搬する砕氷艦「しらせ」が握る。リュツォ・ホルム湾定着氷の状況次第でしらせは数多くのラミング航行を強いられ、時には接岸断念に至る。しかし、定着氷の準周期的な成長・崩壊周期の解明がしらせの気候学的・戦略的・戦術的航路選択を可能にする。本研究では定着氷変動の鍵は外洋から侵入する波浪であるという仮説に基づき、定着氷のうねりによる崩壊機構、波浪緩衝帯である氷縁域流氷帯おける波浪海氷相互作用、氷海船舶推進性能の関係を明らかにする。氷海造波風洞水槽と数値水槽での基礎実験、南極海でのIoT観測機器による多点広域観測、海中ドローン計測、レーダー観測、航行性能モニタリングを行う。,基盤研究(A),中区分24:航空宇宙工学、船舶海洋工学およびその関連分野,砕氷艦しらせ航行性能,波浪海氷相互作用,IoT観測機器,氷海造波風洞水槽,定着氷成長・崩壊周期,海氷波浪相互作用,氷海水槽実験,マージナルアイスゾーン,氷盤フラクタル,波浪方向スペクトル,,,,,,,,,,,,,,,,,,,,,,,,,,,,,,,,,,,,,,,,,,,,,,
22H00240,北海道大学,永田 晴紀,液体酸素を用いる端面燃焼式ハイブリッドロケットの実証研究,革新的ハイブリッドロケット技術を利用して、非常停止が可能な大推力ロケットを実現す,基盤研究(A),中区分24:航空宇宙工学、船舶海洋工学およびその関連分野,ハイブリッドロケット,端面燃焼式,宇宙推進,ロケット,固体燃焼,端面燃焼,3D印刷,光造形,,,,,,,,,,,,,,,,,,,,,,,,,,,,,,,,,,,,,,,,,,,,,,,,
23H00212,国立研究開発法人宇宙航空研究開発機構,山田 和彦,展開型柔軟エアロシェル投棄による抗力変調エアロキャプチャ技術の研究と実飛行試験,世界中で超小型衛星技術の惑星探査への応用の期待が高まっている。我々は、この超小型探査機を惑星周回軌道に投入する手段として、大気圏突入中に大型軽量の展開型柔軟エアロシェルを切り離し、探査機の空気抵抗を大きく変化させるという簡単な制御のみで狙った減速量を得て周回軌道に投入する、つまり、エアロシェル投棄による抗力変調型エアロキャプチャを提案している。この実現の鍵である、大気圏内を高速で飛行する探査機から柔軟なエアロシェルを切り離す技術に関して、風洞試験や数値解析により、その現象を理解した上で、観測ロケット実験での再突入飛行環境を利用したエアロシェル分離実験を行い、安全な分離の実証を目指す。,基盤研究(A),中区分24:航空宇宙工学、船舶海洋工学およびその関連分野,エアロキャプチャ,展開型エアロシェル,大気圏突入技術,流体構造連成解析,観測ロケット実験,展開型柔軟エアロシェル,,,,,,,,,,,,,,,,,,,,,,,,,,,,,,,,,,,,,,,,,,,,,,,,,,
23H00211,名古屋大学,長野 方星,月面熱環境の特異性発現メカニズムの理解が拓く月面長期滞在法,本研究では，これまで有効な手段がなかった「月面長期間滞在方法」に対して，月表面を覆う堆積層（レゴリス）の特異な熱特性を活用した新しい月面長期滞在方法を提案する。そのためレゴリスの超断熱性・蓄熱性発現メカニズムの解明，詳細月面熱環境モデルの確立，熱流体スイッチによる越夜方法の検証を行い，従来の熱制御の延長上にはない新たな周囲環境共生型熱制御法を確立し，宇宙熱制御工学分野の新たな学理創出を目指す。,基盤研究(A),中区分24:航空宇宙工学、船舶海洋工学およびその関連分野,熱物性,月面長期滞在,宇宙機熱制御,レゴリス,ロックインサーモグラフィ,,,,,,,,,,,,,,,,,,,,,,,,,,,,,,,,,,,,,,,,,,,,,,,,,,,
23H00210,名古屋大学,杵淵 紀世志,磁化イオン－中性粒子連成スワール加速の創成と液体水素プラズマ宇宙推進への展開,宇宙用電気推進の性能向上が求められている．本研究では超伝導強磁場によりイオンと電子が共に磁力線に巻き付きながら回転する新たな現象「磁化スワール」を創成し解決を図る．磁化スワールを積極利用し，イオン－中性粒子の運動量連成により中性粒子の回転も誘起する．回転が軸流速（推力）へ変換される加速過程を応募者らが確立したレーザ分光及び粒子法数値解析により把握する．独自のコイル給電方式にて1Tを得て磁化スワールを発現させる．更に液体水素冷却により3Tを得て超伝導特性を解明する．新たな加速機構はプラズマ科学に新たな側面を付け加えると共に，液体水素を推進剤及びコイル冷媒とする小型・高性能な推進機の実現に繋がる．,基盤研究(A),中区分24:航空宇宙工学、船舶海洋工学およびその関連分野,電気推進,超伝導,液体水素,レーザー分光,プラズマシミュレーション,,,,,,,,,,,,,,,,,,,,,,,,,,,,,,,,,,,,,,,,,,,,,,,,,,,
24H00359,国立研究開発法人宇宙航空研究開発機構,森田 泰弘,革新的固体ロケット燃料の研究,学術研究目的に由来する日本の固体ロケット開発における今までの学術の潮流は、高性能化が至上の命題であった。次の課題は、低コスト化にあるが、現時点での国の取り組みは、民生部品の活用やIT/AI技術の応用程度の表層レベルで、大幅な低コスト化に至っていない。,基盤研究(A),中区分24:航空宇宙工学、船舶海洋工学およびその関連分野,固体燃料ロケット,宇宙輸送,低コスト,,,,,,,,,,,,,,,,,,,,,,,,,,,,,,,,,,,,,,,,,,,,,,,,,,,,,
24H00358,東京工業大学,坂本 啓,マルチフィジックス適応する革新的宇宙折り紙構造の設計手法構築と宇宙実証,展開アレーアンテナに代表される折り紙式宇宙展開構造物において衛星運用中の特性変化に適応するという新しいアプローチにより、これまでになく軽量・高収納率な宇宙展開構造物を実現する。これまで宇宙展開構造の軽量化・高収納率化（大型化）に限界があった最大の原因は「構造部材に厚さを与える」ことで剛性を高めて形状精度を維持し、原子状酸素等による材料劣化の影響を抑制し、熱制御を容易化し、半導体への宇宙放射線照射を遮蔽していたことにある。これらに新たな解を導く「マルチフィジックス適応宇宙展開構造システム設計」について、本研究では設計手法を知識化し、同時に超小型衛星を自ら開発し宇宙実証実験を行う。,基盤研究(A),中区分24:航空宇宙工学、船舶海洋工学およびその関連分野,宇宙構造物,展開構造,膜構造,小型衛星,,,,,,,,,,,,,,,,,,,,,,,,,,,,,,,,,,,,,,,,,,,,,,,,,,,,
24H00356,東京大学,川畑 友弥,低炭素エネルギーキャリア輸貯槽用材料に対する要求値明確化のための破壊力学研究,脱炭素社会への移行には、水素やアンモニアの液化貯輸送インフラに耐性を持つ材料が必要。研究では、応力や微小塑性変形を考慮し、溶接構造物の設計に欠陥や残留応力を含めた新たなアプローチを提案。特に液化水素貯槽では、SUS材の水素脆化特性に関する研究が行われ、将来の汎用材料開発の指針となる低温材料学理基盤の開発が期待される。メカニズム研究進めるため、材料科学、破壊力学、溶接力学の融合知識を活用し、材料の適用可否についての定量的判断を可能にする。,基盤研究(A),中区分24:航空宇宙工学、船舶海洋工学およびその関連分野,欠陥評価,溶接力学,SCC,局所破壊理論,水素脆化,,,,,,,,,,,,,,,,,,,,,,,,,,,,,,,,,,,,,,,,,,,,,,,,,,,
25H00775,国立研究開発法人海上・港湾・航空技術研究所,高木 正英,多種石油代替液体燃料の混合利用促進のための着火評価および壁面熱損失低減手法の提案,脱炭素化に向けた燃料として，化学合成された液体燃料（e-fuel）が注目されている。しかし，e-fuelとなる燃料には様々あり，その特性には統一的なものはなく，重油，軽油に比べて燃料性状の幅も広い。そのため既存の知見の範囲外となり，着火性指標が適用できない。物性の違いによるノズル内流動の変化から，燃料噴霧特性が異なる可能性も高い。一方，熱損失は，物性の違いにより既存燃料の壁面への衝突形態とは異なると予想される。,基盤研究(A),中区分24:航空宇宙工学、船舶海洋工学およびその関連分野,石油代替燃料,混合燃料着火性評価,ノズル内流動,燃料モデリング,壁面熱伝達,,,,,,,,,,,,,,,,,,,,,,,,,,,,,,,,,,,,,,,,,,,,,,,,,,,
25H00773,鳥取大学,葛山 浩,電磁力エアロブレーキング実証に向けた低軌道突入カプセルの要素技術研究と実飛行試験,宇宙利用の需要爆増や超高速大気圏突入を伴う探査計画を受け、「機体の再使用性」や「極限加熱環境での高安全性」を実現する突入技術が求められている。その候補として、電磁力により機体サイズを実質的に大きくして加熱を減らす「電磁力エアロブレーキング」が提案されている。その基礎研究は完了しつつあり、低軌道フライト試験によって、その性能を実証すべき段階にある。本研究では、そのために必須な「突入条件によらず電磁力を発動できる電離剤供給法」と「磁場強度と搭載機器スペースを両立できる磁石配置法」を開発する。さらに、この技術を搭載した実証機を開発し、観測ロケットからのフライト試験を行って、その性能を証明する。,基盤研究(A),中区分24:航空宇宙工学、船舶海洋工学およびその関連分野,大気圏突入,電磁力エアロブレーキング,観測ロケット実験,アーク風洞,衝撃風洞,,,,,,,,,,,,,,,,,,,,,,,,,,,,,,,,,,,,,,,,,,,,,,,,,,,
25H00772,神戸大学,大澤 輝夫,洋上風力発電のEEZ展開を見据えた沖合風況調査手法の検討,洋上風力発電のEEZへの展開においては，洋上の高高度の風況を正確に計測できない点が課題となっている．本研究では，沖合風況の真値の取得を目的として，むつ小川原洋上風況観測試験サイト沖合に設置される予定の大型浮体上に，動揺低減装置と鉛直ライダー(VL)を搭載し，浮体式洋上プラットフォーム(FOP)を構築する．同試験サイト内の陸上マスト下において，FOPの運動を模擬した動揺試験を行い，動揺VLの観測値をマスト及び固定VLの観測値と比較することで，その有用性を検証する．またFOP観測値をデュアルスキャニングライダー観測及び衛星リモートセンシングの精度検証に用いることで，両観測技術の高度化を試みる．,基盤研究(A),中区分24:航空宇宙工学、船舶海洋工学およびその関連分野,洋上風力発電,風況観測,浮体式洋上プラットフォーム,スキャニングライダー,衛星リモートセンシング,,,,,,,,,,,,,,,,,,,,,,,,,,,,,,,,,,,,,,,,,,,,,,,,,,,
