awardnumber,organization,name,title,abstract,section,review_section,keyword1,keyword2,keyword3,keyword4,keyword5,keyword6,keyword7,keyword8,keyword9,keyword10,keyword11,keyword12,keyword13,keyword14,keyword15,keyword16,keyword17,keyword18,keyword19,keyword20,keyword21,keyword22,keyword23,keyword24,keyword25,keyword26,keyword27,keyword28,keyword29,keyword30,keyword31,keyword32,keyword33,keyword34,keyword35,keyword36,keyword37,keyword38,keyword39,keyword40,keyword41,keyword42,keyword43,keyword44,keyword45,keyword46,keyword47,keyword48,keyword49,keyword50,keyword51,keyword52,keyword53,keyword54,keyword55,keyword56
21H02608,千葉大学,石川 勇人,セコロガニン関連天然物の樹形図型集団的全合成,植物イリドイド配糖体であるセコロガニンは3000種以上の天然物へと樹形図的に導かれる生合成重要中間体として知られている非常に有名な分子である。申請者らは、この分子を起点とし、独自に提案する生合成フローを参考に樹形図型集団的天然物全合成を行う。具体的にはスイカズラ科植物から見出される高極性中分子に属するディプサクスイリドイド配糖体6種、およびアカネ科、マチン科、キョウチクトウ科から見出される生合成上流および下流のモノテルペノイドインドールアルカロイド18種の天然物を樹形図的に、市販品から20段階以下で全合成する。合成した天然物は多面的な生物活性評価を行い、医薬品シード化合物へと昇華する。,基盤研究(B),小区分47010:薬系化学および創薬科学関連,集団的全合成,バイオインスパイアード反応,モノテルペノイドインドールアルカロイド,イリドイド配糖体,セコロガニン,不斉合成,全合成,アルカロイド,イリドイド,有機分子触媒反応,集団的合成,中分子天然物,ストリクトシジン,樹形図型集団的全合成,生合成模倣反応,,,,,,,,,,,,,,,,,,,,,,,,,,,,,,,,,,,,,,,,,
21H02607,九州大学,大嶋 孝志,"α,β-連続四置換型非天然アミノ酸含有ペプチドを基軸とした新規創薬基盤構築","蛋白質間相互作用の阻害剤が新たな創薬ターゲットとして注目され、主に抗体の利用が検討されているが、膜透過性などに問題がある。本研究では、極度の立体効果を有するα,β-連続四置換型非天然アミノ酸の効率的かつ網羅的な合成法を開発する。また、合成した非天然アミノ酸の極度の立体障害に打ち勝つペプチドカップリング法を確立し、α,β-連続四置換型非天然アミノ酸含有ペプチドのライブラリーを構築することで、膜透過性に優れ、広いPPI接触面をカバーできる十分な大きさを持つα,β-連続四置換型非天然アミノ酸含有ペプチドを創薬ニューモダリティーとして開発し、中分子PPI阻害剤への道を切り開く。",基盤研究(B),小区分47010:薬系化学および創薬科学関連,非天然アミノ酸,"α,β-連続四置換炭素",中分子ペプチド,N-無保護ケチミン,ラジカルクロスカップリング,連続四置換型非天然アミノ酸,PPI阻害剤,不斉記憶型,,,,,,,,,,,,,,,,,,,,,,,,,,,,,,,,,,,,,,,,,,,,,,,,
21H02606,徳島大学,南川 典昭,4'-チオ核酸に係る技術を基盤としたRNAウイルス感染症の治療と予防,中国湖北省、武漢を発生源とするSARS-CoV-2は、RNAウイルス感染症によるパンデミックの恐ろしさを全世界に知らしめた。このウイルスによる感染症 (COVID-19) が社会不安を煽っている最大の要因は、未だ有効で安全な治療薬がなく、さらにワクチン接種も遅れている点にある。,基盤研究(B),小区分47010:薬系化学および創薬科学関連,RNAウイルス感染症,治療薬,ヌクレオシド,予防薬,mRNAワクチン,新型コロナウイルス,4'-チオ核酸,,,,,,,,,,,,,,,,,,,,,,,,,,,,,,,,,,,,,,,,,,,,,,,,,
21H02605,大阪大学,赤井 周司,持続可能な不斉合成：酵素と金属触媒の協働,本研究では、医農薬の開発研究に不可欠な、光学活性（キラル）な有機化合物の実践的な合成法を開発する。本法は、入手容易な加水分解酵素リパーゼと，地殻に豊富に存在する遷移金属を同時に利用することが特徴である。常温常圧で極めて高い選択性と触媒効率を示す酵素と、多彩な機能を創出できる人工の金属触媒という異質な領域の融合によって、安全で、簡便・高効率的な物質変換を可能にする。これは、持続可能な社会構築に資する、 環境にやさしい「次世代型ものづくり化学」の基盤構築を推進する研究である。,基盤研究(B),小区分47010:薬系化学および創薬科学関連,リパーゼ,バナジウム,不斉合成,軸不斉ビアリール化合物,動的速度論的光学分割,プロパルギルアルコール,第３級アルコール,環境低負荷,オキソバナジウム,第２級アルコール,触媒的不斉合成,遷移金属触媒,遷移金属,光学分割,クロスカップリング,,,,,,,,,,,,,,,,,,,,,,,,,,,,,,,,,,,,,,,,,
21H02604,国際医療福祉大学,川端 猛夫,遠隔位不斉誘導に基づくインターロック分子の不斉構築,インターロック分子はその特異な構造から、分子マシンやデバイスへの応用が期待され、盛んに研究が行われている。一方で、これほど構造的な特徴を持つ分子にもかかわらず、創薬に向けた利用はほとんど行われていない。その主な理由として、これらのインターロック分子の創薬関係者への認知が充分でないことと、不斉合成法が欠如しているため、創薬テンプレートとして要求される光学活性体での供給が困難な点が挙げられる。このような状況に鑑み、本研究では未開拓領域であるロタキサン及びカテナンなどのインターロック分子の不斉合成法を開発する。,基盤研究(B),小区分47010:薬系化学および創薬科学関連,遠隔位不斉誘導,インターロック分子,ロタキサン,アシル化,臭素化,カテナン,速度論的分割,不斉非対称化,C-Hアミノ化,C-H アミノ化,[3]ロタキサン,swelling,end-capping,controlled release,不斉合成,,,,,,,,,,,,,,,,,,,,,,,,,,,,,,,,,,,,,,,,,
21H02603,金沢大学,国嶋 崇隆,カルボカチオンの制御に関する方法論の確立と求核置換反応への展開,本申請課題では、広くカルボカチオン種に対し可逆的で弱い配位能を有する化合物をテーラーメードに設計・合成し、これを用いて不安定なカルボカチオン種を擬似的な８電子状態の安定種（カルボカチオノイド）に一時的に変換することにより、その分解と発生を制御する。定量的に発生保存したカルボカチオノイドを用いて、不活性種を始めとする様々な求核剤との反応や不斉誘起など、従来の一分子求核置換反応では達成困難な反応を開発する。,基盤研究(B),小区分47010:薬系化学および創薬科学関連,カルボカチオン,カルボカチオノイド,一分子求核置換反応,アルキル化反応,求核反応,官能基変換,求核置換反応,,,,,,,,,,,,,,,,,,,,,,,,,,,,,,,,,,,,,,,,,,,,,,,,,
21H02602,和歌山県立医科大学,相馬 洋平,神経変性疾患の原因アミロイドタンパク質に対する革新的凝集阻害戦略の開発,本研究は、タンパク質の凝集が原因で引き起こされる神経変性疾患（アルツハイマー病など）に対する根本的な治療法の開発を目指し、タンパク質が凝集する機能を抑制するための、革新的、多面的な方法論の開発を行うものである。具体的には、人工的な化学反応の促進によりタンパク質凝集体を無毒化する触媒を開発し、疾患治療効果を実証する。さらに、立体構造に基づく凝集阻害分子の設計を促進すべく、アミロイドオリゴマーの高次構造を明らかにする。,基盤研究(B),小区分47010:薬系化学および創薬科学関連,アミロイド,タンパク質,神経変性疾患,凝集,阻害,触媒,酸素化,立体構造,タンパク,,,,,,,,,,,,,,,,,,,,,,,,,,,,,,,,,,,,,,,,,,,,,,,
21H02601,東北大学,徳山 英利,新規高難度酸化反応の開発を基盤とする高次構造天然物の合成研究,近年、複雑な天然物の創薬における重要性が再認識されているが、合成の困難さのためその応用は進んでいない。それに対し、終盤に酸化的修飾を行う合成戦略: Late Stage Oxidative Functionalization (LSOF戦略)の有効性が提唱されている。しかし酸化に敏感なアルカロイドへの適用は未開拓である。本研究では、独自の酸化反応を含むLSOF戦略に基づいた、ディスコハブディン類の網羅的全合成、C-H酸化カスケード反応を鍵とするアトカミンの全合成、生体酵素模倣型鉄触媒を用いた天然・非天然二量体型アルカロイドの網羅的全合成、ユズリハアルカロイドの網羅的全合成、に取り組む。,基盤研究(B),小区分47010:薬系化学および創薬科学関連,全合成,天然物,アルカロイド,酸化反応,触媒反応,二量体,カスケード反応,フェノール,鉄触媒,酸化,二量化,,,,,,,,,,,,,,,,,,,,,,,,,,,,,,,,,,,,,,,,,,,,,
23K24011,京都薬科大学,小林 祐輔,次世代ペプチド創薬の基盤となる分子技術の開発,ハロゲン結合およびカルコゲン結合が反応剤の構造・機能にもたらす効果を検証する。下記の項目①～④により、反応剤分子設計の新概念を確立し、未踏の水中分子変換を達成する。,基盤研究(B),小区分47010:薬系化学および創薬科学関連,ハロゲン結合,カルコゲン結合,ニクトゲン結合,糖鎖修飾,ペプチド,グリコシル化,水中反応,中分子創薬,糖鎖,,,,,,,,,,,,,,,,,,,,,,,,,,,,,,,,,,,,,,,,,,,,,,,
23K24010,京都薬科大学,大石 真也,鏡像型タンパク質の特性を活かした創薬スキャフォールドの創製と応用,本研究では、ペプチド・タンパク質の化学合成技術を駆使して、抗がん剤の医薬シーズとなりうる『鏡像抗体様分子』を創製するための探索基盤技術を確立する。従前の研究課題で確立した「天然物・天然資源の鏡像体からの医薬シーズ探索技術」の適用範囲を抗体様分子に拡張することにより、鏡像抗体様分子の創薬スキャフォールド（モダリティ）としての価値を明らかにする。複数の鏡像型標的タンパク質と鏡像抗体様分子の化学合成を実現するとともに、さまざまな疾患に関わる標的タンパク質に対するスクリーニングによる抗がん剤候補化合物の探索を通して、鏡映変換の概念による新しい創薬研究の領域を開拓する。,基盤研究(B),小区分47010:薬系化学および創薬科学関連,鏡像型タンパク質,抗体様分子,医薬品探索,スクリーニング,モダリティ,,,,,,,,,,,,,,,,,,,,,,,,,,,,,,,,,,,,,,,,,,,,,,,,,,,
23K24009,京都府立大学,椿 一典,新たな蛍光色素の開発と応用,本研究は、①オリジナリティーの高い蛍光色素の開発、②既存の蛍光色素の理論的見直しに基づく新たな機能の付与、③これまでの呈色応答性の分子から蛍光応答性の分子への機能変換、④蛍光応答性小分子の連結による、積層化に伴う新たな機能の開発を目指すものである。これらの研究を通じて、新たな方法論の開発や、学理の解明を目指すとともに、実用化も視野に入れた研究を展開する。,基盤研究(B),小区分47010:薬系化学および創薬科学関連,CPL,積層化,蛍光色素,ビナフチル,ポリアミン,励起状態,硫化水素,,,,,,,,,,,,,,,,,,,,,,,,,,,,,,,,,,,,,,,,,,,,,,,,,
23K24008,静岡県立大学,濱島 義隆,チオカルボニル化合物の光触媒特性の解明と環境調和型分子変換法の開発,持続可能な社会の実現に向け、クリーンな太陽光を利用する化学合成が注目されています。従来は高価な金属錯体を光触媒としていましたが、毒性がなく安価な有機分子による代替が望ましいです。また、有機分子は構造修飾が容易なため光触媒の多機能化も期待できます。本研究ではチオカルボニル構造の光化学特性に着目し、選択的反応が困難とされてきたC-H結合を省エネ・省資源で直接修飾する分子改良技術の開発を目指しています。,基盤研究(B),小区分47010:薬系化学および創薬科学関連,光反応,有機触媒,グリーンケミストリー,C-H変換,分子編集技術,有機硫黄化合物,有機光触媒,C-H変換反応,還元,有機分子触媒,還元反応,光化学反応,硫黄化合物,CH活性化,水素原子引き抜き,アミン化合物,ピリジル化,水素引き抜き反応,,,,,,,,,,,,,,,,,,,,,,,,,,,,,,,,,,,,,,
23K24007,九州大学,新藤 充,３次元座標分子の創製とその特性を利用した機能性分子の構築,"座標の定まったトリプチセンもしくはイプチセンの上にリンカーユニットを立て任意の作用部位が配置された分子の合成法の構築とその機能開拓を行う。トリプル環化反応に基づくイノラート法、アントロン法およびアンビデントアントラセン法を詳細に検討し、土台となる機能化トリプチセンの合成法を確立する。それを基盤にトリプチセンの1,8,13位から成る面に対して直立する「支柱」ユニットを構築することで、座標が定まった三次元空間に任意の作用部位を配置する方法論を開発する。また、水平展開を目指しオリゴイプチセンの合成を行う。近接効果を利用した新規連続反応の開発、カプセル分子等の大環状分子の効率合成を検討する。",基盤研究(B),小区分47010:薬系化学および創薬科学関連,トリプチセン,イノラート,イプチセン,機能性分子,大環状分子,ベンザイン,カプセル分子,檜山カップリング,,,,,,,,,,,,,,,,,,,,,,,,,,,,,,,,,,,,,,,,,,,,,,,,
23K24006,京都大学,南條 毅,アミドのN-ハロゲン化を基盤としたペプチド化学修飾技術の創成,非タンパク質構成アミノ酸や大環状骨格等を含有する特殊ペプチドは低分子と抗体医薬の利点を併せ持つ第三の医薬品候補として注目を集めている。その中で、N-メチルアミノ酸のようにアミド窒素上に置換基が導入された誘導体は代表的な特異構造であるが、ペプチド鎖に対して直接置換基導入できる実用的手法はこれまで皆無であった。筆者はペプチド主鎖を構成するアミドの N-ハロゲン化を駆使したペプチドの化学修飾技術の実現を目指すとともに、N-ハロペプチドという合成例の無い未知の化学種の性質を精査し、医薬品としての応用可能性も模索する。,基盤研究(B),小区分47010:薬系化学および創薬科学関連,N-クロロアミド,ペプチド,Late-Stage官能基化,縮合,N-ハロゲン化,化学修飾,有機触媒,,,,,,,,,,,,,,,,,,,,,,,,,,,,,,,,,,,,,,,,,,,,,,,,,
23K24005,金沢大学,平野 圭一,元素の特性を活かした新反応開発と元素創薬への展開,低分子医薬品やバイオイメージング試薬をはじめとする機能性分子は、炭素(C)、水素 (H)、窒素(N)、酸素(O)の有機化学によって構築されてきました。本研究では、これらの代表的な元素と様々なヘテロ元素を組み合わせた全く新しい分子を設計・創出するための新しい化学反応の開発に取り組み、新しい薬や材料を生み出すことを目指します。,基盤研究(B),小区分47010:薬系化学および創薬科学関連,ホウ素,含ホウ素芳香環,ジボリル化,ヒドロホウ素化,含ホウ素環状化合物,ボラート,ケイ素,反応開発,物性創発,ヘテロ環,創薬,治療,,,,,,,,,,,,,,,,,,,,,,,,,,,,,,,,,,,,,,,,,,,,
23K24004,千葉大学,根本 哲宏,安定分子構造の直接的な変換・官能基化を活用した革新的有機合成法の開発と展開,芳香族分子の脱芳香化反応や、不活性C-H結合をはじめとした安定結合の直接官能基化を基盤とする「安定分子構造の直接的な変換・官能基化を実現する合成手法」の開発は、医薬有用分子の合成に極めて有用である。本研究では、フェノール類、インドール類をはじめとした芳香族系分子の新しい分子変換反応の開発を中心に検討を進め、現在の技術レベルでは合成が困難な複雑分子や生物活性天然物等の合成に独自の手法を展開していくことで、その有用性を示す。,基盤研究(B),小区分47010:薬系化学および創薬科学関連,脱芳香化,安定結合活性化,遷移金属触媒,天然物合成,ラジカル,ラジカル反応,,,,,,,,,,,,,,,,,,,,,,,,,,,,,,,,,,,,,,,,,,,,,,,,,,
23K24003,東北大学,土井 隆行,中分子ペプチド系天然物の全合成創薬研究,中分子ペプチド系天然化合物は、なぜ細胞内の標的分子に作用できるのか。天然型のアミノ酸からなるペプチド化合物は、大きな極性表面積をもち、またペプチダーゼにより容易に分解される。一方、非天然型の構成成分を有するペプチド系天然物は、高い細胞膜透過性をもち、加水分解を受けにくいため細胞内の標的に作用し、強力な生物活性を示す。高活性を示すためには、非天然型構成成分のどのような特性が重要なのか、合成化学―三次元構造解析―物性―生物活性の関係について、多面的な視点を有機的に結びつけることにより明らかにし、新たな創薬モダリティとして期待される中分子ペプチド系医薬品開発に不可欠な情報を入手する。,基盤研究(B),小区分47010:薬系化学および創薬科学関連,ペプチド,中分子,天然物合成,環状デプシペプチド,全合成,細胞毒性,環状デプチペプチド,,,,,,,,,,,,,,,,,,,,,,,,,,,,,,,,,,,,,,,,,,,,,,,,,
23K24002,東北大学,岩渕 好治,有機ニトロキシルラジカルー遷移金属協奏触媒の機能創成を機軸とする精密有機分子構築,本研究は、申請者らが独自に発展させてきた有機ニトロキシルラジカルの化学と遷移金属のレドックス特性の統合を鍵として、穏和な条件下、空気中の分子状酸素を触媒的に活性化して、有機分子の高選択的酸化反応を進行させ得る精密電子伝達系を構築することを目的とする。本研究の推進により、多官能性複雑分子の効率的構築を可能とする革新的方法論が誕生するとともに有機ニトロキシルラジカルと遷移金属のレドックス特性を統合する学術フロンティアを開拓する。,基盤研究(B),小区分47010:薬系化学および創薬科学関連,ハイブリッド触媒,酸化触媒,不斉合成,フェノールカップリング,ペプチド合成,,,,,,,,,,,,,,,,,,,,,,,,,,,,,,,,,,,,,,,,,,,,,,,,,,,
23K24001,北海道大学,市川 聡,ビルドアップライブラリー構築法を用いた薬剤耐性菌リードの創出研究,天然物は人智を超えた活性・構造を有する重要な創薬シード分子である。申請者はこれまで、迅速かつ網羅的な中分子天然物ライブラリーの合成を可能とする「ビルドアップライブラリー構築」とその直接生物活性評価スキームを開発してきた。本申請研究では、本法を更に創薬リード創出に資する強力な中分子天然物創薬プラットホームとすべく、さらに①標的とする天然物とアクセサリーの拡充と、②様々な生物学的等価体に変換と構造最適化を行う事で、創薬リード創出を図る。薬剤耐性菌感染症を対象疾患として設定し、最終的にはこれらに対する創薬リードの創製を目指す。,基盤研究(B),小区分47010:薬系化学および創薬科学関連,天然物,ライブラリー,抗菌剤,抗菌薬,,,,,,,,,,,,,,,,,,,,,,,,,,,,,,,,,,,,,,,,,,,,,,,,,,,,
23K27308,公益財団法人微生物化学研究会,柴崎 正勝,協奏機能型不斉触媒による化学合成の深化,ごく少量の不斉源により大量の目的化合物の分子骨格を化学的かつ光学的に純粋に構築できる触媒的不斉炭素－炭素結合形成反応は，立体制御が必須な医薬品合成において理想的かつ強力なテクノロジーである。本研究では，これまで得られた多点認識概念による協奏機能型不斉触媒の特徴を最大限に活用した新たな触媒の創製を行う。また触媒の反応促進機構および立体選択性発現機構を包括的なメカニズム解析により明らかとし，新たな触媒概念の礎となる新知見を積極的に見出す。難易度が高く敬遠されやすい反応を積極的に選定し，協奏機能型触媒による強力な反応促進機構を立証する。,基盤研究(B),小区分47010:薬系化学および創薬科学関連,触媒的不斉合成,ピンサー型錯体,アルキルニトリル,協奏機能型触媒,アルドール反応,アミド,,,,,,,,,,,,,,,,,,,,,,,,,,,,,,,,,,,,,,,,,,,,,,,,,,
23K27307,星薬科大学,叶 直樹,ポリエンマクロラクタム型人工多能性幹分子の概念拡大と新規分子創製,自然から得られる有機化合物には、光や熱などの刺激を受けて、かたちと生物活性を大きく変える化合物が存在します。私たちはこのような化合物の特徴を模倣した、新しい人工分子の創製を目指しています。研究期間内に、天然由来の化合物が構造変化する仕組みを理解し、その仕組みを組み込んだ化合物を設計し、合成します。このような化合物は、将来の人工生理活性物質、新しい医薬品として応用可能だと考えています。,基盤研究(B),小区分47010:薬系化学および創薬科学関連,人工多能性幹分子,ポリエンマクロラクタム,人工生理活性物質,モジュール型合成,,,,,,,,,,,,,,,,,,,,,,,,,,,,,,,,,,,,,,,,,,,,,,,,,,,,
23K27306,東京薬科大学,冨塚 一磨,ゲノム編集誘導性分子多様化による、機能抗体・ペプチド表現型スクリーニングシステム,本研究では、表現型スクリーニングが困難という抗体・ペプチド創薬のボトルネックを解消するため、細胞種の限定なく、10の7乗種を越える多様なバリアント抗体・ペプチドを発現する培養細胞ライブラリの構築と、それを用いた表現型スクリーニングを可能とする「ゲノム編集誘導性分子多様化による、機能抗体・ペプチド表現型スクリーニングシステム」の開発に取り組む。多様な分子フォーマットや様々なシグナル系への適用が可能な汎用性を有する本技術は、広く抗体・ペプチド創薬プロセスに変革をもたらし得る。,基盤研究(B),小区分47010:薬系化学および創薬科学関連,ゲノム編集,表現型スクリーニング,機能抗体,分子進化,,,,,,,,,,,,,,,,,,,,,,,,,,,,,,,,,,,,,,,,,,,,,,,,,,,,
23K27305,東京薬科大学,林 良雄,SARS-CoV-2 3CLプロテアーゼ阻害剤YH-53を基盤とする革新的創薬の展開,独自に開発したアリールケトン型3CLプロテアーゼ阻害剤 YH-53 から新規不可逆的阻害剤を誘導し、これを基に新型コロナウイルス感染症（COVID-19）治療薬の創製を目指す研究である。具体的には、3CLプロテアーゼを駆逐できる新規阻害分子の創製を実施する。そのため、先ず可逆的阻害剤YH-53から不可逆的阻害剤への変換を行う。3CLプロテアーゼの活性中心に特異的に反応し、当該酵素を完全に失活させるが、一方で生体分子との反応性を極力抑えることができる安定な構造を見出す。さらに得られた阻害剤をPROTACなど複数のデグレーダーと架橋することで、ハイブリッド型阻害剤に導く。,基盤研究(B),小区分47010:薬系化学および創薬科学関連,プロテアーゼ阻害剤,抗ウイルス剤,ペプチドー薬物架橋体,創薬,ケミカルバイオロジー,,,,,,,,,,,,,,,,,,,,,,,,,,,,,,,,,,,,,,,,,,,,,,,,,,,
