awardnumber,organization,name,title,abstract,section,review_section,keyword1,keyword2,keyword3,keyword4,keyword5,keyword6,keyword7,keyword8,keyword9,keyword10,keyword11,keyword12,keyword13,keyword14,keyword15,keyword16,keyword17,keyword18,keyword19,keyword20,keyword21,keyword22,keyword23,keyword24,keyword25,keyword26,keyword27,keyword28,keyword29,keyword30,keyword31,keyword32,keyword33,keyword34,keyword35,keyword36,keyword37,keyword38,keyword39,keyword40,keyword41,keyword42,keyword43,keyword44,keyword45,keyword46,keyword47,keyword48,keyword49,keyword50,keyword51,keyword52,keyword53,keyword54,keyword55,keyword56
19H03348,東京大学,山次 健三,タンパク質化学合成を革新するペプチド連結触媒の開発,タンパク質の機能解析、あるいはその機能を生化学的・治療的用途（タンパク質医薬など）に用いることは、重要である。その目的のために各種タンパク質合成法が開発されており、中でも短いペプチド同士を連結することで大きなタンパク質を合成する化学合成的手法が現在最も頻繁に用いられている。しかしその成熟度は充分ではなく、特に連結位置がシステインに限定されるという問題点を有する。本研究では、既存法とは全く異なるアプローチとして、いかなるアミノ酸位置でのペプチド連結反応を可能にする革新的な「触媒」を開発し、タンパク質の化学合成が抱える課題を根本的に解決することを目指す。,基盤研究(B),小区分47010:薬系化学および創薬科学関連,タンパク質,ペプチド,ライゲーション,触媒,化学合成,ピリジン,,,,,,,,,,,,,,,,,,,,,,,,,,,,,,,,,,,,,,,,,,,,,,,,,,
19H03347,東北大学,岩渕 好治,有機ニトロキシルラジカル－遷移金属ハイブリッド触媒に基づく精密有機分子構築,本研究は、「有機ニトロキシルラジカルー遷移金属ハイブリッドシステム」に潜在する合成化学的機能性の開発を機軸として、常温・常圧の大気中の分子状酸素を触媒的に活性化して、世界でも前例のない高度な官能基選択性を発現する酸化的分子変換法の創出を目指すものである。,基盤研究(B),小区分47010:薬系化学および創薬科学関連,合成化学,酸化反応,化学選択性,ニトロキシルラジカル,協奏触媒,不斉合成,ハイブリッド触媒,,,,,,,,,,,,,,,,,,,,,,,,,,,,,,,,,,,,,,,,,,,,,,,,,
19H03346,東北大学,根東 義則,超活性アミド塩基触媒が拓く不活性結合の直截的分子変換,本研究ではアミド塩基の触媒系を用いて、不活性な炭素－水素結合、炭素－酸素結合、炭素－フッ素結合の効率的な分子変換反応を開発することを目的とする。ここ20数年間に遷移金属触媒を用いる不活性結合の分子変換反応に関する研究分野が進歩したが、医薬品合成では遷移金属の痕跡量の混入が問題となるため、遷移金属フリーの触媒システムは重要とされるが、未開拓である。本研究では、アミド塩基の触媒系の特徴である、(１) 嵩高いカチオンによる反応の速度論的安定性向上および(２) 酸素－ケイ素結合あるいはフッ素－ケイ素結合の強固な化学結合の形成による生成系の熱力学的安定性向上を基にして不活性結合の分子変換反応を実現する。,基盤研究(B),小区分47010:薬系化学および創薬科学関連,アミド塩基,不活性結合,C-H修飾反応,脱プロトン化修飾,C-O修飾反応,有機超強塩基,フォスファゼン塩基,求核置換反応,脱プロトン化,芳香族化合物,芳香複素環,芳香族求核置換,有機触媒,芳香族複素環,脱プロトン化反応,,,,,,,,,,,,,,,,,,,,,,,,,,,,,,,,,,,,,,,,,
19H03345,北海道大学,市川 聡,天然物創薬を加速するリード創製プラットホーム構築研究,天然物を基盤とする創薬研究における、必要な天然物の誘導体を「いかにして迅速かつ網羅的に合成するか？」という至上命題に対して、迅速かつ網羅的なライブラリー供給と生物活性評価と、活性化合物のテーラーメード合成の２つの柱からなる新たな天然物創薬プラットホームの構築を行う。同定された誘導体について、さらなるドラッグデザインによる積極的な構造の単純化や機能化を行うことで、高活性化、代謝安定化能を付与するような化学修飾を施し、真の創薬リードへと変換する。最終的には、薬剤耐性菌感染症とがんを対象疾患として設定し、これらに対する天然物創薬リードの創製を目指す。,基盤研究(B),小区分47010:薬系化学および創薬科学関連,抗がん剤,抗菌剤,天然物,ライブラリー,創薬化学,有機合成,,,,,,,,,,,,,,,,,,,,,,,,,,,,,,,,,,,,,,,,,,,,,,,,,,
23K20311,静岡県立大学,眞鍋 敬,安全・簡便・短工程有機合成を実現する遷移金属触媒反応の開発,本応募研究は、安全・簡便・短工程有機合成を実現することを目指し、以下の①～③を可能にする新規遷移金属触媒反応の開発を目的とするものである。①毒性ガス代替化合物を用いる汎用性の高い安全・簡便触媒反応。②空気下・開放系での簡便触媒反応。③入手容易な基質を用いる触媒的位置選択的アリール化。これらの反応の実現により、化学合成に携わる実験者・作業者の安全性の向上に大いに貢献することができ、さらに、安全・簡便・短工程有機合成という化学合成の潮流を創り出すことができる。,基盤研究(B),小区分47010:薬系化学および創薬科学関連,有機化学,触媒反応,有機合成化学,,,,,,,,,,,,,,,,,,,,,,,,,,,,,,,,,,,,,,,,,,,,,,,,,,,,,
23K20310,熊本大学,中島 誠,アルドール関連反応を基軸とする新規な連続的不斉触媒反応の開拓,シクロプロペノンやトロポン（シクロヘプタトリエノン）は、6π電子系の芳香族性を獲得するために、カルボニル酸素が負に分極することにより、ルイス塩基性を示す。そこで、シクロプロペノンやトロポンを母核とする新規不斉触媒の開発を行う。また、われわれは、ビナフトラートを触媒とする不斉アルドール-Michael反応を拡張することにより、シス選択的なシクロプロパン化を実現する新たな不斉触媒反応を実現することを目標とする。これらの連続反応を組み合わせることにより、複数の不斉中心を一挙に制御した骨格を構築する合成手法を提示したい。,基盤研究(B),小区分47010:薬系化学および創薬科学関連,アルドール反応,有機分子触媒,不斉合成反応,連続反応,オキシド化合物,不斉触媒,エナンチオ選択性,不斉触媒反応,ホスフィンオキシド,立体選択的反応,有機オキシド化合物,不斉反応,有機分子触媒反応,,,,,,,,,,,,,,,,,,,,,,,,,,,,,,,,,,,,,,,,,,,
20H03372,国立研究開発法人産業技術総合研究所,小松 康雄,RNA分解酵素・アンチセンスの細胞内分子複合体化と長鎖RNA機能制御への応用,近年、長鎖非タンパクコードRNA（lncRNA）が複数発見され、このlncRNAの機能制御にはsiRNAやアンチセンスオリゴ（ASO）が有力な手法となる。siRNAは核酸・酵素複合体として細胞内で酵素的に作用するが、核内における効果が低い。一方ASOは核および細胞質いずれにも分布可能であるが、RNA切断酵素と結合せず酵素的に作用しないため、多くの投与量と化学修飾が必要になる。そこで本研究では、RNA分解酵素に結合する核酸構造をはじめに構築し、同構造を介してASOと酵素を複合体化させる技術を開発する。これにより酵素的にRNAを切断することが可能な新規なASOの構築を目指す。,基盤研究(B),小区分47010:薬系化学および創薬科学関連,アンチセンス,RNA,オリゴヌクレオチド,クロスリンク,miRNA,核酸,核酸医薬,遺伝子,,,,,,,,,,,,,,,,,,,,,,,,,,,,,,,,,,,,,,,,,,,,,,,,
20H03371,公益財団法人微生物化学研究会,柴崎 正勝,協奏機能型不斉触媒による効率的有用物質生産,ごく少量の不斉源により大量の目的化合物の分子骨格を化学的かつ光学的に純粋に構築できる触媒的不斉炭素-炭素結合形成反応は、立体制御が必須な医薬品合成において理想的かつ強力なテクノロジーである。20年以上に亘る協奏機能型不斉触媒の開発研究により、適切な触媒デザインが強力な反応推進機構を発動し、21世紀に必要とされる環境調和型有機合成を強力に推進する原動力となることが明らかになっている。本研究は複数の触媒機能を同時発現する協奏機能型触媒により完全原子効率で高付加価値光学活性化合物群を生み出す知的挑戦である。,基盤研究(B),小区分47010:薬系化学および創薬科学関連,不斉触媒,ニトリル,アルドール反応,天然物合成,触媒的不斉合成,協奏機能型触媒,環境調和性,不斉合成,医薬品合成,,,,,,,,,,,,,,,,,,,,,,,,,,,,,,,,,,,,,,,,,,,,,,,
20H03370,神戸学院大学,稲垣 冬彦,異常高酸化数を志向した新規Z型配位子含有金属錯体の合成とその触媒反応,申請者は、電子受容性を持つZ型配位子が隣接金属の電子密度を低下し、その触媒反応の活性を高める働きがあることを見出した。今回、高酸化数を持つ金属にZ型配位子を導入すれば、その金属がさらに”酸化”され、擬似的な異常高酸化数をもつ金属錯体が合成可能となり、新しい反応場の構築が可能なのではないかと考え、新規錯体の合成と触媒反応開発を行う。,基盤研究(B),小区分47010:薬系化学および創薬科学関連,Z型配位子,塩化銅,塩化金,触媒,環化反応,分子間反応,銀塩,向山アルドール反応,触媒反応,金属,異常高酸化数,金属錯体,金触媒,銅触媒,光学活性,金属触媒,C-C結合形成反応,,,,,,,,,,,,,,,,,,,,,,,,,,,,,,,,,,,,,,,
20H03369,名古屋市立大学,樋口 恒彦,ポルフィリン関連分子の医薬科学への多様な応用に関する研究,バクテリオクロリン(BC)は、近赤外光励起が可能なため、深部への光線力学療法(PDT)を可能とする色素である。多様な修飾が容易な構造の新規BCの合成および、それに新しい手法でがん選択性を付与した分子の開発を行い、そのPDTへの応用を展開することを主な目的とする。,基盤研究(B),小区分47010:薬系化学および創薬科学関連,bacteriochlorin,near-infrared light,photodynamic therapy,phototoxicity,heme thiolate,prostaglandin,12-HHT,in-cell catalyst,ポルフィリン,バクテリオクロリン,光線力学療法,プロスタグランジン,酵素モデル,がん細胞選択性,チオラート配位ヘム,プロスタグランジンH2,がん,金属ポルフィリン,,,,,,,,,,,,,,,,,,,,,,,,,,,,,,,,,,,,,,
20H03367,岐阜薬科大学,佐治木 弘尚,マイクロ波エネルギー集積効果を利用した効率的連続フロー合成法の開発,カーボンビーズ（CB）担持Pt触媒カートリッジにMWを照射すると、微弱のMWがCBに集約され、IPAやMCHからの脱水素が安全かつ容易に進行する。すなわちMWを選択的に吸収する素材をエネルギー集約材料として局所反応場を構築することができる。この知見を応用して以下①～③を遂行する。①非環状飽和炭化水素からのエネルギー効率の高い水素取り出し法の確立と芳香族化合物合成法の開発、②MW連続フロー装置を水素発源とした連続フロー精密合成法の確立、③Pt/CBの新規触媒活性探索・触媒金属種と担体を変えた新触媒や反応の開発・MW吸収型担体にMWを集積させた連続フロー式熱的反応システムの構築。,基盤研究(B),小区分47010:薬系化学および創薬科学関連,マイクロ波,エネルギー集積,連続フロー反応,局所高温反応場,活性炭,C-C結合形成反応,多環芳香族化合物,官能基変換,C-H活性化,,,,,,,,,,,,,,,,,,,,,,,,,,,,,,,,,,,,,,,,,,,,,,,
20H03366,富山県立大学,占部 大介,希少ポリケチドを構造基盤とした合理的簡略化プロセスの構築と新機能性分子の創出,ポリケチドは合成低分子が再現できない特異な構造と生物活性を有する魅力的な医薬品リードである。その重要性の一方で、創薬研究へ展開可能な構造修飾体や簡略体の合理的設計・供給プロセスは十分に確立されていない。本研究では、3つの構造未決定ポリケチドの構造決定を起点とした合理的構造簡略化と天然物模倣機能性分子の創出を目的とする。構造解析、立体多様性全合成、生物活性評価の3つのプラットフォームを設定し、それぞれの研究段階で得られる結果を逐次的に次の段階へとステップアップさせる。このプロセスを複数回サイクルさせ、ポリケチド様の新機能性分子を設計・供給する。,基盤研究(B),小区分47010:薬系化学および創薬科学関連,有機合成化学,天然物化学,NMR計算,分子設計,全合成,計算化学,DFT計算,NMR値予測,ポリケチド,天然物,生物活性物質,,,,,,,,,,,,,,,,,,,,,,,,,,,,,,,,,,,,,,,,,,,,,
20H03365,熊本大学,藤田 美歌子,感染細胞にHIVを閉じ込めアポトーシスを誘導する化合物の医薬品に向けた構造最適化,1980年代にエイズの世界的流行が始まった頃、これは死の病であった。その後に原因ウイルスHIVに対する薬が多数開発され、エイズ発症抑制が可能となった。しかし体内に潜むHIVを完全に除去することはできない。この完全治癒が、現在のエイズ治療における最大の目標である。研究代表者らは、L-HIPPOと名付けた非天然型イノシトールリン脂質がHIV放出を抑制し、感染細胞にHIVを閉じ込めアポトーシスを誘導するユニークな現象を報告した。HIV感染細胞の除去を目指してこの現象を臨床応用まで発展させるため、本研究では細胞膜に透過しやすく改変したL-HIPPO誘導体の構造を最適化し、医薬品候補を創出する。,基盤研究(B),小区分47010:薬系化学および創薬科学関連,HIV,エイズ根絶,イノシトールリン脂質,アポトーシス,Gag,プロドラッグ,IP6,X線結晶解析,HIV根絶,プロドラッグ体,エイズ完全治癒,HIV潜伏感染細胞,HIV Gagタンパク質,Gag MAドメイン,タンパク質発現,,,,,,,,,,,,,,,,,,,,,,,,,,,,,,,,,,,,,,,,,
20H03363,静岡大学,鳴海 哲夫,アルケン型ペプチド結合等価体の分子特性の解明と創薬応用,本研究は、アルケン型ペプチド結合等価体をペプチド創薬の実践的問題に適用し、既知のアルケン型ペプチド結合等価体と併せて詳細な機能解析や構造機能相関に関する研究を行うことにより、アルケン型ペプチド結合等価体の分子特性を解明し、これら等価体の特性を活かして、テロメア領域のグアニン四重鎖構造を安定化させるがん化学療法のための短鎖ペプチド性シード化合物を創出する研究課題である。,基盤研究(B),小区分47010:薬系化学および創薬科学関連,中分子ペプチド,生物学的等価体,アルケン,非共有結合性相互作用,β-ターン構造,グアニン四重鎖構造,α-ヘリックス構造,グアニン四重鎖,ペプチド,ペプチド結合,生物化学等価体,立体選択的合成,アジリジン,等価体,,,,,,,,,,,,,,,,,,,,,,,,,,,,,,,,,,,,,,,,,,
20H03362,東京医科歯科大学,玉村 啓和,環状ペプチド誘導体を用いた標的選択的な中分子医薬品の創製研究,これまでに申請者らは、環状ペプチド誘導体を基盤として、がんやHIV感染症・エイズをターゲットとした創薬リードを多数創出し、その中でもケモカイン受容体CXCR4のアンタゴニストは、がん、白血病の治療薬候補品として臨床試験第III相に進行している。さらに、最近、上皮成長因子受容体(EGFR)結合リガンド(がん細胞内送達分子)を創出し、2社の新聞や本学プレスリリースで取り上げられた。また、申請者らは、以前からペプチド性化合物やペプチドミメティックの新規合成法を開発しており、本研究では、上述の創薬リードや薬物送達分子に応用し、新たな治療薬の創出を目指し、他の医薬品とのコンジュゲート分子等の創製を行う。,基盤研究(B),小区分47010:薬系化学および創薬科学関連,環状ペプチド,ペプチドミメティック,ケモカイン受容体CXCR4,上皮成長因子受容体EGFR,コンジュゲート,中分子,創薬リード,上皮成長因子受容体,コンジュゲート分子,,,,,,,,,,,,,,,,,,,,,,,,,,,,,,,,,,,,,,,,,,,,,,,
20H03361,筑波大学,長瀬 博,オレキシン1受容体選択的作動薬の創出と薬理作用の解明,神経ペプチド「オレキシン」を産生するニューロンの後天的欠損は、睡眠覚醒障害であるナルコレプシーの病因である。オレキシン受容体に対する選択的な低分子作動薬の欠如は、疾患に関わるオレキシン受容体の機能解明において大きな足枷となっているだけで無く、ナルコレプシー治療に真に有効な薬物開発を見誤らせる可能性がある。研究代表者らは、世界初のオレキシン１受容体作動薬の創製から薬理学研究までを一貫して実施し、オレキシンがナルコレプシーに及ぼす影響、治療標的としてのオレキシン受容体の有効性を検証する。,基盤研究(B),小区分47010:薬系化学および創薬科学関連,オレキシン1受容体,作動薬,オレキシン,分子設計,アゴニスト,創薬化学,オレキシン受容体,GPCR,オレキシン１受容体,薬理評価,機能解明,,,,,,,,,,,,,,,,,,,,,,,,,,,,,,,,,,,,,,,,,,,,,
20H03360,北海道大学,佐藤 美洋,光学活性多置換シクロブタン及びラダラン化合物の立体選択的合成法の確立と応用,シクロブタンは４つの炭素からなる四角形の化合物で，立体的な自由度が制限された特徴ある三次元構造を持っています。このシクロブタン骨格は天然物などにも含まれ，また創薬においてもその構造的な特徴を利用できると期待される骨格です。また最近，シクロブタン環が連結し「はしご状」となったラダランという化合物も自然界の細菌（アナモックス菌）の膜脂質から発見され，その機能にも興味が持たれています。本研究課題では，この多置換シクロブタンやラダラン化合物の立体選択的合成法の確立を目指しています。,基盤研究(B),小区分47010:薬系化学および創薬科学関連,シクロブタン,ラダラン,ロジウム,ルテニウム,コバルト,メタラサイクル,環化反応,シクロオクタジエン,不斉合成,遷移金属触媒,,,,,,,,,,,,,,,,,,,,,,,,,,,,,,,,,,,,,,,,,,,,,,
23K21354,長崎国際大学,佐々木 茂貴,CGGリピートに協奏的に集積する分子を基盤とする脆弱X症候群に対する低分子創薬,本研究では、DNA中のCGGリピート配列に協奏的に自己集積する低分子を基盤に、リピート数増加に伴い発症する脆弱X症候群(FXS)に対する低分子創薬を目指している。CGGリピート領域のシトシン５位メチル化の阻害が、FMR1遺伝子転写を活性化し、症状を軽減させることがわかり、新しい創薬戦略として注目されている。本研究で我々はCGGリピート配列に自己集積する低分子を基盤に、細胞内でリピート数402の疾患モデル細胞のFMR1遺伝子の転写を活性化する分子GW283を見出した。しかし、翻訳は活性化しなかったため、翻訳の障害となっているRNAグアニン４本鎖を解離させる分子の配発を検討する。,基盤研究(B),小区分47010:薬系化学および創薬科学関連,脆弱X症候群,リピート病,FMR1遺伝子,CGGリピート,低分子創薬,転写活性化,翻訳活性化,CGGリピー,低分子リガンド,分子集積薬,遺伝子発現促進,FMR1,,,,,,,,,,,,,,,,,,,,,,,,,,,,,,,,,,,,,,,,,,,,
23K21353,東京理科大学,和田 猛,高活性・低毒性を両立する立体制御ボラノホスフェート核酸医薬の開発,本研究では、リン原子の立体化学が制御されたPB-DNAの合成法を開発する。PB-DNAの合成では、天然型のDNAやホスホロチオエートDNA合成で用いられるアシル型の塩基部保護基を用いることができない。塩基部アミノ基をアシル基で保護すると、合成中間体の亜リン酸誘導体をボラノ化する際にアミドが非可逆的に還元されてアルキルアミノ基に変換されてしまうからである。そこで本研究では、塩基部無保護のオキサザホスホリジンモノマーの構造を最適化し、リン原子の立体化学が厳密に制御されたPB-DNAを合成し、その性質を明らかにする。,基盤研究(B),小区分47010:薬系化学および創薬科学関連,核酸医薬,ボラノホスフェート核酸,アンチセンス核酸,立体選択的合成,リン原子修飾核酸,立体制御,不斉合成,,,,,,,,,,,,,,,,,,,,,,,,,,,,,,,,,,,,,,,,,,,,,,,,,
21H02611,京都薬科大学,古田 巧,カルコゲン結合で構造制御する分子認識型触媒の創製,カルコゲン結合は、カルコゲン元素とヘテロ原子との間に働く非共有結合性の相互作用である。水素結合に匹敵する分子間力を持ち、有機分子の構造を制御する要因となることは知られていたが、触媒構造の制御には活用されてこなかった。本研究は、このカルコゲン結合を触媒構造を制御する分子間力として活用する新たな触媒設計指針の確立を目的に実施する。さらに、カルコゲン結合を駆動力とする基質認識部を配した分子認識型触媒の創製も行う。,基盤研究(B),小区分47010:薬系化学および創薬科学関連,カルコゲン結合,触媒,構造制御,ウレア,配座制御,有機分子触媒,遷移金属触媒,ロジウム二核錯体,分子認識,ロジウム,C-H 挿入反応,軸性不斉,テトレル結合,,,,,,,,,,,,,,,,,,,,,,,,,,,,,,,,,,,,,,,,,,,
21H02609,静岡県立大学,浅井 章良,新規複合がん免疫療法の開発を指向した創薬基盤研究,免疫チェックポイント分子を標的としたがん治療法は、これまでに幅広いがん種でその有効性が実証されてきた。しかしその効果は一部の患者集団に限定されており依然として未充足ニーズが存在していため、併用療法をベースとした複合がん免疫療法の開発に期待がかかっている。本研究課題では、低分子をベースとした複合がん免疫療法のための堅牢な創薬基盤を築くことを目的として以下の研究を計画している。１）フローサイトメトリー法による免疫チェックポイント分子結合アッセイパネルの確立、２）複合的機能を有する新規PD-L1阻害化合物のインシリコデザインと創製、３）細胞およびマウスモデルにおける化合物評価と免疫学的解析。,基盤研究(B),小区分47010:薬系化学および創薬科学関連,がん免疫療法,免疫チェックポイント,スクリーニング,ドラッグデザイン,ドッキングシミュレーション,ハイブリッド化合物,PD-L1,併用効果,,,,,,,,,,,,,,,,,,,,,,,,,,,,,,,,,,,,,,,,,,,,,,,,
