awardnumber,organization,name,title,abstract,section,review_section,keyword1,keyword2,keyword3,keyword4,keyword5,keyword6,keyword7,keyword8,keyword9,keyword10,keyword11,keyword12,keyword13,keyword14,keyword15,keyword16,keyword17,keyword18,keyword19,keyword20,keyword21,keyword22,keyword23,keyword24,keyword25,keyword26,keyword27,keyword28,keyword29,keyword30,keyword31,keyword32,keyword33,keyword34,keyword35,keyword36,keyword37,keyword38,keyword39,keyword40,keyword41,keyword42,keyword43,keyword44,keyword45,keyword46,keyword47,keyword48,keyword49,keyword50,keyword51,keyword52,keyword53,keyword54,keyword55,keyword56
18K18495,崇城大学,古賀 元也,熊本地震に学ぶ災害時における身障者支援の在り方の提案と持続可能な実践的アプローチ,本研究では，災害時に要援護者，福祉避難所，行政の三者の連携を深め，多くの要援護者が福祉避難所を利用できるような支援手法の提案を目的とする。初年度は，調査を通じて熊本地震時の福祉避難所の対応，要援護者の状況などにおける問題点・課題を明らかにし，三者の災害に備える防災活動，災害時の避難行動に対し，支援の在り方を提案した。,挑戦的研究(萌芽),中区分1:思想、芸術およびその関連分野,防災,支援システム,福祉避難所,要援護者,熊本地震,行政,防災活動・災害時避難行動支援システム,熊本j地震,車いす使用者,ヒアリング調査,交通弱者,身障者支援,支援手法の提案,,,,,,,,,,,,,,,,,,,,,,,,,,,,,,,,,,,,,,,,,,,
18K18494,筑紫女学園大学,宇治 和貴,クイア仏教学の構築,LGBTAと呼ばれるセクシュアルマイノリティの人々を、仏教における救いの対象としてどのように位置づけるかといった問題意識から出発した研究だった。しかし研究途中に、クィアスタディーズで指摘された「寛容」という差別を知り、当事者を救いの対象として位置づけようとする意識そのものが差別的であるという結論に至った。そうした反省に立ったうえで、クィアスタディーズが論理構築と実践的運動の二側面をもって展開されてきたことを踏まえ、平等を原理として教学が構築されている現実の仏教教団において、なぜ差別があるのかといった具体的な問題を取り上げる必要があるといった、クィア仏教学における課題を明らかにすることができた。,挑戦的研究(萌芽),中区分1:思想、芸術およびその関連分野,クィア仏教学,クィアスタディーズ,LGBTQ,仏教,真宗,親鸞,セクシュアルマイノリティ,ジェンダー,同性婚,実践,同性婚儀礼,仏前結婚式,仏教学,セクシュアリティ,寛容という差別,救済,施しという差別,仏教における救い,クィア,LGBT,真宗学,セクシュアリティ・スタディーズ,仏教思想,クイア,セクシュアル・マイノリティ,ダイバーシティ,クイアスタディーズ,,,,,,,,,,,,,,,,,,,,,,,,,,,,,
18K18493,九州産業大学,山下 三平,伝統的な枯山水庭園の雨水管理機能の評価に基づく都市型雨庭のデザイン,本研究はグリーンインフラの一つである雨庭のデザインに役立つ知見を得るために、伝統的な枯山水庭園である京都の相国寺裏方丈庭園を対象とした雨水収支の実測評価を試みた。また新しい雨庭のデザインと維持管理に寄与する提案を行った。主な知見は以下のとおりである：1)本庭園は京都の100年確率日降雨推定値を上回る307.5mmの雨水を貯留だけで流出抑制できる。2)増水時に平均82.7％、減水時は平均32.7mm/hで浸透できる。3)短期の集中的強雨と長期の分散的弱雨のいずれの降雨パターンにも対応する高い浸透機能がある。4)砂礫地質で10-15cmの径を含む構成が高い浸透機能の持続に寄与すると推察される。,挑戦的研究(萌芽),中区分1:思想、芸術およびその関連分野,雨庭,禅寺,枯山水,都市型水害,流出抑制,グリーンインフラ,流域治水,分散型水管理,環境デザイン,日本庭園,社会実装,都市型水害対策,直接流出抑制,枯山水庭園,雨水流出抑制,デザイン,雨水貯留,雨水浸透,,,,,,,,,,,,,,,,,,,,,,,,,,,,,,,,,,,,,,
18K18492,神戸学院大学,上田 学,新派映画と「新派的なるもの」の系譜学,共同研究では、まずThe Twenty-Second Asian Studies Conference Japan（国際基督教大学、2018年7月）のパネルで、谷口紀枝、上田学、小川佐和子、スザンネ・シェアマンが発表者を、木下千花がディスカッサントを務め、新派映画に関する研究の現状や、同時代の演劇や文学との生成関係、観客の受容空間などを議論した。さらに計四回の研究会を開催し、上田、谷口、小川、シェアマンの発表にもとづき、児玉竜一、木下、土田牧子に加え、オブザーバーに斉藤綾子（明治学院大学）、河野真理江（立教大学）他が参加し、新派映画に関する広汎な議論がおこなわれた。,挑戦的研究(萌芽),中区分1:思想、芸術およびその関連分野,映画学,映像学,演劇学,芸能史,日本文学,映画史,,,,,,,,,,,,,,,,,,,,,,,,,,,,,,,,,,,,,,,,,,,,,,,,,,
18K18491,相愛大学,橋田 光代,ピアノ演奏におけるフレージングの意図伝達と個性表出に関する研究,本研究は、ピアノ演奏におけるフレージングの意図伝達と個性表出を探求するものである。主としてベートーヴェンの「悲愴」等を題材に、演奏者の意図と聴衆の解釈の関係性を明らかにする調査を進めた。演奏者の意図したフレーズ構造が、演奏を通じて聴衆にどの程度伝わるかを探るため、演奏者・聴取者双方に共通のフレーズ構造の記述法を定め、階層レベルの正規化を経て比較できるようにする手法を考案した。また、聴取時に演奏の映像を含めるかどうかでも伝達度合いが変わるかどうかを調査した。新型コロナウイルスの影響で未着手となった分析もあるが、これらの成果は、音楽表現の理解を深め、演奏教育に有益な示唆を提供するものである。,挑戦的研究(萌芽),中区分1:思想、芸術およびその関連分野,ピアノ演奏,フレージング,意図伝達,個性表出,フレーズ構造,意図の伝達,演奏表情,聴取スキル,演奏表現,,,,,,,,,,,,,,,,,,,,,,,,,,,,,,,,,,,,,,,,,,,,,,,
18K18490,慶應義塾大学,後藤 文子,クロス・ディシプリナリー学としての「庭園芸術学」の構築,20世紀初頭のドイツで「自然庭園」を主導した多年生植物栽培家・造園家カール・フェルスター（1874-1970)と、彼と親密な交流のあった建築家ペーター・ベーレンス（1868-1940）の活動を中核とし、庭園芸術研究の新たな領域たる「庭園芸術学 Gartenkunstwissenschaft」の基礎づけに成功した。具体的には、第一にフェルスターによるゲーテ荘園の庭修復（1948/49年）における植栽デザイン特性、第二にベーレンスの造園活動と庭園芸術理論が19世紀末の近代芸術学を基盤とする事実、第三に「自然庭園」を介して庭園芸術学が20世紀モダニズムに接続する事態、以上三つのアスペクトを解明した。,挑戦的研究(萌芽),中区分1:思想、芸術およびその関連分野,庭園芸術学,芸術学,近代建築論における空間概念論,空間-時間的空間形成,改革庭園,ドイツ近代園芸と造園,庭園の植物利用,建築空間論,空間-時間的空間形成論,制作論,近代造園,近代園芸,近代的空間形成概念,自然環境デザイン,地景（ランドスケープ）,近代庭園,近代建築,植物利用,有機的色彩,近代造形芸術と動態性,空間形成作用,近代芸術における動態性,自然庭園,,,,,,,,,,,,,,,,,,,,,,,,,,,,,,,,,
18K18489,桜美林大学,中生 勝美,現代中国のキリスト教徒に対する国外からの宣教支援,コロナの影響で、初年度と最終年度のみ出張調査できた。そこで計画を変更し、日本国内での資料収集、キリスト教弾圧というテーマでの五島、島原、天草の調査、モンゴルから北海道に移住した宣教師調査、上海の図書館でのキリスト教関係の資料調査、上海のプロテスタント教会礼拝など活動に出席し、中国のキリスト教の現状を調査した。,挑戦的研究(萌芽),中区分1:思想、芸術およびその関連分野,キリスト教弾圧,クリスチャンの民俗調査,キリスト教の宣教モデル,キリスト教の土着化,輔仁大学,西洋ミッションの宣教戦略,西洋ミッショの宣教戦略,中国,キリスト教,宣教活動,教会組織,布教史,宗教弾圧,キリスト教倫理,内地会,スウェーデン宣教師,モンゴル,写真資料,台湾,香港,海外宣教支援,宗教の多元化,スウェーデン,海外の宣教支援,香港の神学院,宗教規制,宣教支援,宗教的関心の多元化,,,,,,,,,,,,,,,,,,,,,,,,,,,,
18K18488,大阪市立大学,中川 眞,サウンドアート学確立による20世紀アート史の書き換え,サウンドアートという1970年代から顕著に現れてきた現代アートを理解するために２つの作業を重点的に行なった。第１は、アーティストの全作業の記録のアーカイブ化（データベース化）、第２は、日本におけるサウンドアートの通史の作成作業である。アーカイブ化の対象となったのは我が国におけるサウンドアートの草分けといえる鈴木昭男（1941年生）の営為であり、1006項目のデータベースができあがった。通史研究としては、〈音楽ではない音への意識が出現してくる歴史〉と〈音楽が美術として受容されていく歴史〉というふたつの歴史が重複し交錯する歴史として叙述した。,挑戦的研究(萌芽),中区分1:思想、芸術およびその関連分野,サウンドアート,鈴木昭男,王福瑞,データベース,アーカイブ,アンビエント,身体性,サウンド・インスタレーション,サウンドスケープ,20世紀アート史,知覚,環境,,,,,,,,,,,,,,,,,,,,,,,,,,,,,,,,,,,,,,,,,,,,
18K18487,情報科学芸術大学院大学,古澤 龍,鑑賞環境による影響を考慮したヴァルール評価の確立とそれを応用した視覚表現,,挑戦的研究(萌芽),中区分1:思想、芸術およびその関連分野,,,,,,,,,,,,,,,,,,,,,,,,,,,,,,,,,,,,,,,,,,,,,,,,,,,,,,,,
18K18486,都留文科大学,大平 栄子,英語テクストから見直す近代日本仏教像,明治維新以降海外諸国との交流が活発化すると、仏教者や仏教研究者による日本紹介の英文著作が多数刊行され、それが欧米の日本理解に大きな影響を与えた。だが、従来の研究ではかかる大量の英文著の著作の刊行の意義が問われることはなかった。本研究ではこの研究の空白に挑戦し、以下のような成果を得るに至った。①明治維新から戦前までの期間に刊行された150点に及ぶ仏教者による英語のテクストを網羅的に収集し、その全体像を明らかにし英語テクスト大量刊行の歴史的意義を解明した。②その成果を既存の近代仏教研究とすり合わせることで、通説的な近代仏教像の書き換えと新たな視点からのアジア仏教への日本仏教の位置付けを試みた。,挑戦的研究(萌芽),中区分1:思想、芸術およびその関連分野,英語テクスト,近代仏教像,岡倉天心,タゴール,大乗仏教,日本近代仏教,日印国際交流,日本英語文学,近代仏教,近代日本仏教,,,,,,,,,,,,,,,,,,,,,,,,,,,,,,,,,,,,,,,,,,,,,,
18K18485,九州大学,藍谷 鋼一郎,都市再生における編集型アーバンデザイン「アーバンカタリスト」に関する研究,世界中に蔓延した未曽有のCOVID-19により2020年3月から2年以上に渡り厳しい渡航制限を行った。調査期間を1年間延長したが計画していた海外調査（ノルウェー、ドイツ、ブラジル）を中止せざるを得なくなり研究対象地や目的を縮小化することで対応した。,挑戦的研究(萌芽),中区分1:思想、芸術およびその関連分野,アーバン・カタリスト,都市再生,都市改造,オリンピック,インテグレーテッドリゾート,波及効果,都市の記憶,都市の文脈,,,,,,,,,,,,,,,,,,,,,,,,,,,,,,,,,,,,,,,,,,,,,,,,
18K18484,九州大学,脇山 真治,デジタル展示映像の総合アーカイブの方法に関する研究,本研究の対象は、博覧会や博物館等のために制作された「展示映像」である。特に近年の主流となっているデジタル展示映像に着目し、アーカイブされない根拠を明らかにしてその保存指針を提起することが目的である。,挑戦的研究(萌芽),中区分1:思想、芸術およびその関連分野,展示映像,映像アーカイブ,マルチ映像,大型映像,博覧会,博物館,デジタル映像,国際博覧会,アーカイブ,全天球ドーム映像,,,,,,,,,,,,,,,,,,,,,,,,,,,,,,,,,,,,,,,,,,,,,,
18K18483,徳島大学,吉田 敦也,歴史的価値の創造的復元に寄与する浄瑠璃人形立体アーカイブの実現,人形浄瑠璃は日本全国で江戸時代から続く伝統芸能である．しかし，近年，この文化をいかに継承するかが課題となっている．本研究では人形浄瑠璃のデジタルアーカイブスとそれを活用した新たな人形デザインシステムの構築を目的とし人形浄瑠璃の保存と継承を目指す．ここではデジタルアーカイブの一つとして，人形の頭のＣＴ画像から頭の形状および内部にあるからくりの部品の形状復元方法について検討し，実際に部品の抽出が可能であることを示した．また，人間と人形の顔を融合した人形の頭の３Ｄモデルを生成する方法を検討し，そのモデルを用いた調査で融合割合が２０～５０％であれば人間らしさを持つ人形の顔になることが明らかになった．,挑戦的研究(萌芽),中区分1:思想、芸術およびその関連分野,人形浄瑠璃,デジタルアーカイブ,形状計測,顔,CT画像,伝統文化,形状復元,3Dスキャナ,3Dプリンタ,メーキャップ,３Ｄスキャナ,３Ｄプリンタ,美の表現,創造的復元,,,,,,,,,,,,,,,,,,,,,,,,,,,,,,,,,,,,,,,,,,
18K18482,神戸大学,板倉 史明,映画学と認知心理学を融合した映像表現と視覚的注意に関する研究,本研究は映画学と認知心理学の議論を融合し、映画視聴時における観客の視線と注意の特徴を実証的かつ理論的に考察した。アイトラッカーを使い、映画におけるさまざまな演出や編集技法が実際の観客の視線移動とどのように関わっているのかを、アイトラッカーを使って考察した。また、映画研究における近年のアイトラッキングを活用した研究を、映画研究の歴史の中に位置づけ直す作業も行った。映画研究における注意の研究は1916年のミュンスターバーグによる研究にはじまり、1980年代のボードウェルによる認知主義的映画研究を経て、2000年代以降のアイトラッキング研究へとつながっていることを歴史的に位置づけた。,挑戦的研究(萌芽),中区分1:思想、芸術およびその関連分野,映画,注意,アイトラッキング,映像,メディア,認知心理学,視線,眼球運動,視覚,,,,,,,,,,,,,,,,,,,,,,,,,,,,,,,,,,,,,,,,,,,,,,,
18K18480,京都大学,出口 康夫,軍事研究を哲学する：デュアルユースの観点から,本研究は、イデオロギー問題として回収されがちな軍事研究問題を、多様な専門領域や多岐にわたる観点から考察を加えることで、タブーなき議論を可能にする足場を提供することを目指した。加えて本研究は、軍事研究問題を、軍事研究は是か非かという単純な問題に回収するではなく、学術研究が生み出しするより一般的な負の側面をも視野に入れる一方、善悪の置換可能性まで含めたデュアルユース問題への転換、多岐にわたる学術領域が現に抱えているデュアルユース問題の可視化といった論点にも挑んだ。,挑戦的研究(萌芽),中区分1:思想、芸術およびその関連分野,軍事研究,デュアルユース,先端科学技術,ELSI,軍民両用,,,,,,,,,,,,,,,,,,,,,,,,,,,,,,,,,,,,,,,,,,,,,,,,,,,
18K18479,東京藝術大学,山田 健二,ポスト・スノーデン時代に於ける映像表現に関する日米事例の基礎研究,2013年にエドワード・スノーデン氏が米国の市民のデジタルデバイスを通した情報傍受活動の現状を暴露して以降、活動家や芸術家による大量監視社会に抗する表現活動の日米事例を調査し、国や地域差、文化圏の違いによる体系化や個々の詳細な分析を試みた。そこから考えられる時代的潮流や個々の活動の有効性、社会的影響力等を分析し映像論、身体表現論として纏めた。尚時系列の比較は60年代に日米で行われたビデオアートの潮流との接続を視野に入れ、2001-2006（アメリカ同時多発テロ事件以降）2007-2012（Wikileaks発足以降）2013-2022（スノーデン事件からCOVID-19パンデミック迄）とした。,挑戦的研究(萌芽),中区分1:思想、芸術およびその関連分野,ポスト・スノーデン時代,大量監視社会,社会運動における芸術表現,ソーシャリー・エンゲイジド・アート,ビデオ・アート,映像論,パフォーミング・アーツ,身体表現論,映像芸術,現代美術,メディア論,,,,,,,,,,,,,,,,,,,,,,,,,,,,,,,,,,,,,,,,,,,,,
18K18478,東京外国語大学,中村 恭子,芸術係数の論理的進化と実装,「芸術係数」を基盤とした芸術行為における創造性の理論的探求と実装を通して、芸術とはなにか、創造性とはなにかを明らかにした。芸術係数の持つマクロなエンタングルメントの様相をとして、日本美術に見られる「書き割り」と呼び得る空間概念を見出した。「書き割り」の視点は、現代哲学において議論される「脱創造」や「潜勢力」を実現する具体的方法として捉えることができる。本研究ではその論理構造を明かにするとともに、制作作品として実装することで、具体化した。,挑戦的研究(萌芽),中区分1:思想、芸術およびその関連分野,芸術係数,書き割り,脱創造,外部,受動性,エンタングルメント,トリレンマ,潜勢力,藝術係数,不在,天然知能,意味の蒸発,御柱,フーリエの無限小,少女,日本画,創造性,,,,,,,,,,,,,,,,,,,,,,,,,,,,,,,,,,,,,,,
18K18477,東京大学,秋山 聰,造形作品の記述についての文化史的観点からの萌芽的研究,造形物についての即物的な記述は、近代的美術史学における基本的方法論だが、歴史的にみると決して普遍的なものではなく、むしろ一般的には主観的印象や文学的修辞とは不可分なものであることが多い。また、文化や時代等によって、記述概念にはかなりの相異が認められる。記述を、言語によるものに留まらず、数や寸法、距離、あるいは図等にまで拡大して理解することにより、記述についての広い視野からの学際的文化的研究が可能となる。また、社会教育における記述の実践的活用が、グローバル化する世界において、客観的な相互理解を促進せしめうる。,挑戦的研究(萌芽),中区分1:思想、芸術およびその関連分野,美術史,比較美術史,記述,造形,聖地風景,建築史,文化史,宗教美術史,作品記述,目録,,,,,,,,,,,,,,,,,,,,,,,,,,,,,,,,,,,,,,,,,,,,,,
18K18476,東京大学,今橋 映子,明治大正期の美術界と建築界の相互交渉に関する新知見と歴史記述転換の追究,本研究は、従来日本近代美術史と日本近代建築史を統合して、全く新しい近代芸術史を記述しようとする試みである。3年間の研究は順調に推移し、その成果を刊行本の一章として公刊することができた。今橋映子（単著）『近代日本の美術思想――美術批評家・岩村透とその時代』（白水社、2021年5月刊行）は上・下巻で1504頁（120万文字）に及ぶ大著であるが、その第16章（下巻所収）が「美術と建築、技芸家と社会」と題する本科研費の成果である。ここでは、明治大正期に活躍した美術批評家・岩村透を中心に据え、いかに建築界と美術界が人脈的にも、思想的にも近接していたのかを、未知の具体的事例から描き尽くした。,挑戦的研究(萌芽),中区分1:思想、芸術およびその関連分野,近代日本美術,近代日本建築,美術批評,建築批評,岩村透,黒田鵬心,中條精一郎,建築と美術,雑誌研究,近代芸術史,明治大正期美術史,明治大正期建築史,美術新報,美術・建築批評,明治大正期,美術と建築,国民美術協会,日本近代美術史,日本近代建築史,芸術と社会,,,,,,,,,,,,,,,,,,,,,,,,,,,,,,,,,,,,
18K18475,埼玉大学,井口 壽乃,東欧移民芸術家の戦時下のアメリカ社会におけるデザイン活動,本研究において、移民の文化史的視点から東欧移民芸術家が社会システムの異なるアメリカ社会で摩擦と軋轢を伴いつつ、いかに活動を展開したかを実証した。デザイン活動の一つの拠点であったシカゴのニュー・バウハウスを中心にラースロー・モホイ＝ナジ、ジェルジ・ケペシュ、ネイサン・ラーナーの戦時中に考案されたデザインと教育方法について、ウィル・バーティンが空軍とアメリカ情報局のために行なったデザインについて検討した。彼らのデザイン活動は戦後のアメリカのデザインの基盤を形成した。戦後から冷戦期にかけての科学技術に基づく芸術へと発展する過程には、アメリカ政府の圧力と産業界からの要求が関連していることが判明した。,挑戦的研究(萌芽),中区分1:思想、芸術およびその関連分野,ニュー・バウハウス,東欧移民,科学技術,メディアアート,戦時下,ラースロー・モホイ＝ナジ,ジェルジ・ケペシュ,ネイサン・ラーナー,ウィル・バーティン,インスティテュート・オブ・デザイン,冷戦,1930年代,マックスウェル・ストリート,第２次世界大戦,高等視覚研究所,ニュー・ランドスケープ,光学技術,光工房,メディア・アート,ヴィジョン・イン・モーション,ハンガリー人芸術家,シカゴ産業芸術協会,戦時下のデザイン教育,カムフラージュ,セラピー,カラー映画,トランスナショナル,シカゴ芸術産業協会,デザイン,,,,,,,,,,,,,,,,,,,,,,,,,,,
18K18474,東北大学,直江 清隆,技術における集団志向性に関する研究,本研究は、技術をめぐる営みを集団という観点から哲学的・倫理学的に分析した本研究では、人工物を介した人間関係についての理論的検討作業と現実に集団志向性が問題となる現場調査を行い、両者を照合して(1)人工物を介した集団志向性に関する理論的確立、(2)技術に関する責任構造（集団責任、役割責任や共同責任など）の解明、(3)日本型の技術、設計の特有性と一般性の提示、の３点を解明を行った。本研究により、認知者・使用者・設計者間の共同性の成立機制が解明され、組織における責任に関する研究の足がかりを得ることがができた。,挑戦的研究(萌芽),中区分1:思想、芸術およびその関連分野,集団志向性,集団責任,技術哲学,設計の倫理,事物の共同体,デザインと意図,正統的周辺参加,Many-Hands問題,人工物の誤使用,オープンイノベーション,参加型デザイン,イノベーション,組織の倫理,技術的媒介,,,,,,,,,,,,,,,,,,,,,,,,,,,,,,,,,,,,,,,,,,
