awardnumber,organization,name,title,abstract,section,review_section,keyword1,keyword2,keyword3,keyword4,keyword5,keyword6,keyword7,keyword8,keyword9,keyword10,keyword11,keyword12,keyword13,keyword14,keyword15,keyword16,keyword17,keyword18,keyword19,keyword20,keyword21,keyword22,keyword23,keyword24,keyword25,keyword26,keyword27,keyword28,keyword29,keyword30,keyword31,keyword32,keyword33,keyword34,keyword35,keyword36,keyword37,keyword38,keyword39,keyword40,keyword41,keyword42,keyword43,keyword44,keyword45,keyword46,keyword47,keyword48,keyword49,keyword50,keyword51,keyword52,keyword53,keyword54,keyword55,keyword56
21K18347,立命館大学,鷲巣 力,身振り言語に見る戦後日本の知識人ーー加藤周一、丸山眞男、鶴見俊輔を例にして,研究対象となる加藤周一、丸山眞男、鶴見俊輔は戦後日本を代表する知識人である。三氏の言動は同時代の多くの人びとに大きな影響を与えた。三氏は著作活動を中心に知識人の活動を続けたが、同時に「おしゃべり」によっても活動した。おしゃべりは身振りを伴う。おしゃべりを聴く人は、話の内容もさることながら、話し手の身振りや表情によって、共感したり、反発したり、説得されたりする。,挑戦的研究(萌芽),中区分1:思想、芸術およびその関連分野,戦後日本思想,知識人,身振り言語,加藤周一,丸山眞男,鶴見俊輔,マルチモーダル,マルチモーダル法,書き言葉と話し言葉,マルチモダール法,映像作品,,,,,,,,,,,,,,,,,,,,,,,,,,,,,,,,,,,,,,,,,,,,,
21K18346,立命館大学,野崎 泰伸,障害学と倫理学の架橋――障害者の生存から倫理学を構築する基礎的研究,現代における倫理学は、障害というテーマをも扱うが、その多くは障害という事象を捉え,挑戦的研究(萌芽),中区分1:思想、芸術およびその関連分野,倫理,障害者,動物,インターセクショナリティ,新型コロナウイルス,生存,障害者の個人史,反出生主義,生の価値,障害学,倫理学,社会運動,生の肯定,,,,,,,,,,,,,,,,,,,,,,,,,,,,,,,,,,,,,,,,,,,
21K18345,富山国際大学,佐部利 典彦,アート思考を活かす社会システムの構築 ~日英のアーティストインレジデンス研究~,【目的】アーティストが持つ思考力およびアートを社会便益に活用するための社会システムモデルの探索と提案。１）アーティストと社会の関連性の再検討→双方がWin-Winとなる社会システムの探索、２）アート思考のモデル化→組織（ビジネス、教育、行政）への実装方法の提案、を達成するための新規理論産出。【方法】日英のアーティスト・イン・レジデンスを研究対象とし、両国のアートを司る行政機関と社会システムとの関係性と併せ、文献調査とフィールドワークを主としたケーススタディ。【意義】１）学術領域として未発展な我が国の美術・芸術分野における科学的方法論の発展、２）体系的情報が少ないAiRに関する知識の開拓。,挑戦的研究(萌芽),中区分1:思想、芸術およびその関連分野,アーティスト・イン・レジデンス,アート,産業,文化,教育,アーツカウンシル,滞在,クリエイティヴィティー,人と人の関わり,アート思考,イノベーション,美術教育（アート教育）,社会システムデザイン,,,,,,,,,,,,,,,,,,,,,,,,,,,,,,,,,,,,,,,,,,,
21K18344,早稲田大学,CHEN DOMINIQUE,東アジアにおけるモアザンヒューマン文化の研究調査とそのデザイン理論への接続,本研究は，アジア的な自然観，宗教的価値観，そして文化背景をモアザンヒューマン（環境哲学の議論で生まれた，人間以外の自然存在を「人間以上の存在」と捉える概念）の議論と接続するために，研究年度ごとに日本，韓国，台湾において現地調査を行い，得られた知見を情報技術のデザイン方法論と接続し，理論的な枠組みを確立することを目的とする.本研究提案は，工学研究の経験と多様なアジア文化を背景に持つ研究チームが，東アジアの発酵醸造文化における自然存在に対するケアの作法をデザインの対象として捉え，人新世時代において人間と自然存在がより調和的に共生するためのデザインと芸術表現の糸口をさぐるものである．,挑戦的研究(萌芽),中区分1:思想、芸術およびその関連分野,speculative ethics,more-than-human,biological HCI,発酵,微生物,ACI,モアザンヒューマン,東アジア,デザイン理論,,,,,,,,,,,,,,,,,,,,,,,,,,,,,,,,,,,,,,,,,,,,,,,
21K18343,立教大学,河野 哲也,アフリカ哲学の導入から世界哲学への発展,本研究は以下のような計画に基づいている。第一に、日本ではこれまでほとんど知られていなかったアフリカの現代哲学を、日本の哲学思想界に導入することである。この空白を埋めることが第一の意義である。第二に、アフリカ哲学の導入により、現在の日本の哲学思想界の枠組を変えられることである。西洋でも東洋でも中東でもない場所からの哲学的問いかけは、それらの研究に対照すべき第三項をもたらす。第三に、世界的に見れば、アフリカ哲学は、アフリカ人か、あるいは欧米の少数の白人による研究に限られている。そこで、日本からの比較研究は、アフリカ哲学研究に新しい視座を与え、研究に世界的な広がりを与えられるだろう。,挑戦的研究(萌芽),中区分1:思想、芸術およびその関連分野,アフリカ哲学,世界哲学,比較現象学,反植民地主義,エナクティビズム,汎アフリカ主義,環境哲学,SDGs,比較文化,体育・スポーツ教育,人種差別,エスノフィロソフィー,反アフリカ主義,ウブントゥ,アフリカ現象学,知の三点測量,,,,,,,,,,,,,,,,,,,,,,,,,,,,,,,,,,,,,,,,
21K18342,多摩美術大学,金沢 百枝,エトルリアを基軸とした文化的連続性とその研究領域の確立,ローマに先立つ先進的な文明をイタリア半島中部に築いたエトルリアは、地中海交易で主要な役割を担い、南部のギリシア諸都市との交流によって、文字や神話、建築など文化的要素を吸収、独自の文化を築いた。その後、エトルリア文化圏を支配したローマは、 エトルリアの社会制度や宗教儀礼、都市設計などを吸収したとされる。ローマ帝国がキリスト教化されると、中世をとおしてローマ文化はゆるやかに変容していったが、古代世界への憧憬は続き、ロマネスク美術を開花させた。本研究では、エトルリア、ローマ、ロマネスクという文化的連続性に着目し、その受容と変遷を検証して、従来とは異なる視座をもって新しい研究分野の礎を構築する。,挑戦的研究(萌芽),中区分1:思想、芸術およびその関連分野,エトルリア,ローマ,ロマネスク,神話,美術,ランゴバルド,文学,ギリシア,,,,,,,,,,,,,,,,,,,,,,,,,,,,,,,,,,,,,,,,,,,,,,,,
21K18341,成城大学,松岡 秀明,ハンセン病療養施設神山復生病院の設立から終戦までの変遷,現在の御殿場市に1889年に設立された神山復生病院は、第二次世界大戦の終戦までの日本のハンセン病療養施設のなかにあって、(1)カトリック教徒によって運営されていた、(2)他の療養施設は厳格な隔離体制をとるようになっていったが、患者は比較的に自由に行動することができた、という特徴を有していたが、これまで研究はほとんど行なわれていない。,挑戦的研究(萌芽),中区分1:思想、芸術およびその関連分野,キリスト教,カトリシズム,ハンセン病,神山復生病院,岩下壮一,,,,,,,,,,,,,,,,,,,,,,,,,,,,,,,,,,,,,,,,,,,,,,,,,,,
21K18340,昭和女子大学,田中 眞奈子,近現代アートの保存・継承に向けた収蔵品情報管理・共有システムの構築,近現代アートは、素材の脆弱性や複雑性、表現形態の多様性などから、保存・継承において多くの深刻な問題をはらんでいる。海外では、修復に用いる材料・技術、作家の修復についての考え方等、将来的に必要となる情報を作品購入時に調査・記録すると共に、それらの情報の消失や改竄を防ぐ新しい収蔵品情報管理・共有システムの構築が進んでいる。本研究は、対応が急務なこの問題に学際的なメンバーで多角的に取り組み、ブロックチェーン・テクノロジーの活用も検討しながら日本における理想的な近現代アートの収蔵品情報管理・共有システムを構築する。成果をシンポジウムで広く公開すると共に学術研究拠点INCCA JAPANの設立も目指す。,挑戦的研究(萌芽),中区分1:思想、芸術およびその関連分野,近現代アート,収蔵品情報管理・共有システム,保存,収蔵品情報管理システム,ブロックチェーン・テクノロジー,,,,,,,,,,,,,,,,,,,,,,,,,,,,,,,,,,,,,,,,,,,,,,,,,,,
21K18339,慶應義塾大学,岡田 光弘,我々の情報環境に求められる「意思決定しやすい情報提示法」-多属性意思決定を中心に,公平・中立な情報提示のための学際的調査・研究を論理的理論方法、消費者行動・行動経済学などの行動科学的調査、情報倫理などの情報環境倫理学的観点を組み合わせて進める。特に、合理的意思決定や合理的・論理的判断・推論の場面で表形式を含むグラフィック形式の情報提示が重要であるという立場から、多属性意思決定や論理推論におけるグラフィック情報提示の基礎研究を行う。主体的な意思決定や合理的判断・推論をしやすくする情報提示の在り方について、理論と調査で明らかにする。さらに、このことを通じて、主体的意思決定や論理的判断のために求められる情報提示の在り方について提案する。,挑戦的研究(萌芽),中区分1:思想、芸術およびその関連分野,意思決定,多属性意思決定,グラフィック表現・推論,深層学習と多属性意思決定,情報提示デザイン,アイトラッカー,論理と意思決定,公平性と説明可能性を備えた情報提示,情報社会と公平性,論理,情報提示,デジタル環境,図的情報提示・グラフィック情報提示,図的推論,多属性表,,,,,,,,,,,,,,,,,,,,,,,,,,,,,,,,,,,,,,,,,
21K18338,名古屋市立大学,吉田 一彦,疑偽経典の受容・作成・浸透から見た日本仏教の歴史と思想に関する研究,本研究は、「偽」というマイナスのイメージから研究上の価値が低いと誤認されてきた「疑偽経典」を、豊かな思想を伝えるテキストととらえ直し、その思想作品としての価値を解明するとともに、それらが日本および東アジアの社会、文化に果たした役割を明らかにしようと企図するものである。本研究では、日本に仏教が土着していった様相を、疑偽経典の受容、作成、浸透に着目して考察し、そこから日本仏教の歴史と思想の特質を考究する。,挑戦的研究(萌芽),中区分1:思想、芸術およびその関連分野,偽経,疑経,中国撰述経典,日本撰述経典,十往生経,血盆経,盂蘭盆,彼岸,甘露図,七寺,文化交流,仏教史,東洋・日本思想史,美術史,文化変容,民衆宗教,疑偽経典,仏教土着,日本思想史,日本宗教史,日本文化,,,,,,,,,,,,,,,,,,,,,,,,,,,,,,,,,,,
21K18337,長崎大学,葉柳 和則,「よそもの過剰」の心性史－スイスにおける「異他的なもの」の意味変容,Ueberfremdungという言葉の意味内容の変遷を指標として、20世紀以降のドイツ語圏、特にスイスにおける他者排除の心性を通時的に明らかにする。資料・データは、マックス・フリッシュ、フィリップ・エッターといった政治家・知識人の演説と書簡、および「新チューリヒ新聞」、「スイス月報」といった新聞・雑誌の記事である。定性的な手法による解釈と、テクストマイニングを用いた定量的分析とを組み合わせて、資料・データにおけるキーワードの意味内容と意味連関の変容を明らかにする。,挑戦的研究(萌芽),中区分1:思想、芸術およびその関連分野,近現代ヨーロッパ史,近現代ヨーロッパ文化,近現代ヨーロッパ政治,文化政策,スイス史,心性史,移民・難民,よそ者過剰,スイス,移民,外国人労働者,他者,メディア,テキストマイニング,,,,,,,,,,,,,,,,,,,,,,,,,,,,,,,,,,,,,,,,,,
21K18335,名古屋大学,横山 悦生,産業遺産の価値変遷と保存・利活用のあり方、持続可能なマネジメントの国際比較,過去に創出された産業技術の成果である産業遺産、近代化遺産は、歴史的、技術的、社会的に価値ある文化遺産であるが、その概念、保存・継承、利活用のあり方は法規や文化的習慣を背景に国によって大きく異なる。これらを比較し学問的に検討、評価するためには、学際的な研究 再構成が必要である。本研究では、これまで個別に議論されてきた産業遺産を取り巻く諸要素、すなわち所有者、地域住民、行政、保存のための科学技術などを多面的に捉え、それらの相互作用として産業遺産を再評価し、持続可能な保存と利活用のためのマネジメンの解を探索しようとするものである。,挑戦的研究(萌芽),中区分1:思想、芸術およびその関連分野,産業遺産,ルール工業地帯,工場,鉄道遺産,産業遺産ルート（ERIH）,保存と利活用,ドイツ,宇治発電所,鉄道,ノルトライン・ヴェストファーレン州,鉱山,産業遺産ルート,工場建築,炭酸水工場,紡績工場,酒造,製鉄,,,,,,,,,,,,,,,,,,,,,,,,,,,,,,,,,,,,,,,
21K18334,信州大学,北村 明子,土地の文化の継承と発展~デザイン経営の視点による国際協働芸術創造の創発~,"本研究は,人類学的なフィールドワークから現地の生活や共同体をしっかりととらえる視点と,デザイン経営のデータ・情報から知識を生み出し,各プラットフォームを連携させていくマネジメント方法論と,感性, 感覚・知覚的な非言語領域を含む芸術研究の視点を融合させた,「生きた」学術的芸術研究の試みである。国際協同芸術の創発を加速させ，過疎化・高齢化する土地の消えゆく芸術文化の継承・発展といった課題にも，後世に伝承していく方法として新たな視座を投げかけていく。",挑戦的研究(萌芽),中区分1:思想、芸術およびその関連分野,国際協働舞台創造,伝統芸能,デザイン経営,コンテンポラリーダンス,,,,,,,,,,,,,,,,,,,,,,,,,,,,,,,,,,,,,,,,,,,,,,,,,,,,
21K18333,金沢大学,森 雅秀,仁和寺蔵御室版両部曼荼羅の版木と版本に関する総合的研究,本研究は京都の仁和寺に伝わる「御室版両部曼荼羅」の版木と版本に関する学際的・文理融合的な調査・研究である。御室版両部曼荼羅は、明治2年から3年にかけて京都の御室仁和寺で開版・刊行された両部曼荼羅の白描図である。空海によって日本に請来された正統な曼荼羅の仏たちの姿を伝える最重要資料のひとつに位置づけられる。本課題は、これらの版木、およびそれにもとづく版本を対象に、密教学や仏教美術史にとどまらず、書誌学、出版史、寺院史、文化財学、さらに物質科学、文化財修復学、保存科学などからの多角的・総合的な分析と考察、さらに保全と活用という将来まで見据えた研究を行う。,挑戦的研究(萌芽),中区分1:思想、芸術およびその関連分野,御室版,版木,印刷技術,仁和寺,階明寺,曼荼羅,密教図像,皆明寺,両部曼荼羅,版本,,,,,,,,,,,,,,,,,,,,,,,,,,,,,,,,,,,,,,,,,,,,,,
21K18332,東京大学,大河内 直之,バリアフリー映画・演劇製作に関するアクションリサーチに基づく当事者研究,本研究は，映像製作におけるバリアフリーに関するアクションリサーチを用いた当事者研究である．視覚障害当事者研究者である研究代表者が，ドキュメンタリー映画を製作し，その過程で生じるバリアを明らかにし，そのバリアを解決する．そして，本研究での製作者側のバリアフリーとこれまでに研究されてきた鑑賞者側のバリアフリーを合わせて，真のバリアフリー作品とは何かについて考察する．,挑戦的研究(萌芽),中区分1:思想、芸術およびその関連分野,バリアフリー,映画,演劇,アクションリサーチ,当事者研究,,,,,,,,,,,,,,,,,,,,,,,,,,,,,,,,,,,,,,,,,,,,,,,,,,,
21K18331,千葉大学,原 寛道,都市公園における移動式遊具のデザイン開発,都市公園の固定遊具は、導入の際に住民説明などで利用者の意向が反映する試みはあるが、利用開始後は、そららの遊具を受け入れるしかない受動的な関わりとなっていた。,挑戦的研究(萌芽),中区分1:思想、芸術およびその関連分野,遊び環境,公園遊具,移動式遊び場,移動式遊具,プレーパーク,プレーリーダー,小学校放課後,居場所,利用者参加型遊具,,,,,,,,,,,,,,,,,,,,,,,,,,,,,,,,,,,,,,,,,,,,,,,
21K18330,埼玉大学,加藤 有希子,黒とその倫理の研究――ラ・トゥール（1640）からBLM（2020）まで,本研究は、黒色とそれをめぐる倫理が、前近代から近代以降にかけて、神聖で静謐なものから、邪悪で歪んだものであるという認識に変化してきた理由を探究する。黒人差別や喪における黒の使用など、光度の低い色が蔑まれたり、疎まれたりする例は多々ある。日本人の白人崇拝や美白願望なども、そうした事例の一つである。そういった我々に内面化された倫理が何なのかを突き止めることは、我々がオートマティックに行う差別やヘイトや禁忌の原因を探ることである。それは歴史的起源なのか、もしくは黒や闇を避ける生物学的起源をもつのかを明らかにすることにより、我々の「悪」に対する認識を客体化し、それを乗り越えることができる。,挑戦的研究(萌芽),中区分1:思想、芸術およびその関連分野,黒,毒,忘却,中動態,色盲,黒白色覚,アド・ラインハート,メランコリー,中之島美術館,闇,暗黒啓蒙,BLM,倫理,,,,,,,,,,,,,,,,,,,,,,,,,,,,,,,,,,,,,,,,,,,
21K18329,筑波大学,尾川 明穂,古典書跡に注目した手指書字運動の解析とアーカイブ化,本研究は、書字運動の解析により、一世代にしか現れないような優れた書芸術が身体構造に起因する手指運動の制限で生じたこと―すなわち身体性に強く依拠することを明らかにしようとするものである。従来の学習法である古典書跡の拡大臨模（まねて書いたり敷き写すこと）では習得困難な部分に注目することで、書の教育・歴史の研究に繋げるとともに、運動解析の結果をアーカイブ化することで、書以外の身体技能の解明に資することを目指す。,挑戦的研究(萌芽),中区分1:思想、芸術およびその関連分野,書字運動,手指構造,運動解析,字径,大字,筆管の回転,筆順,アーカイブ,顔真卿,断筆,身体性,,,,,,,,,,,,,,,,,,,,,,,,,,,,,,,,,,,,,,,,,,,,,
21K18328,弘前大学,出 佳奈子,美術作品と「嗅覚」ーイメージ受容における香りの作用をめぐって,美術作品の受容における「嗅覚」のはたらきは、美術史研究においても、現代の美術作品においても、また美術館における作品体験の面でもこれまでほぼ看過されてきた。対して、人工知能の開発分野においては、嗅覚センサやシステムの開発が進み、それらをアニメーションやゲームに導入する試みもなされている。記憶や情操に作用する嗅覚のはたらきは、イメージ受容のあり方にも大きな変化をもたらすであろう。以上の学術的背景から、本研究は、「美術作品の受容における香りの効果と嗅覚のはたらき」・「現代アートにおける嗅覚システムの応用可能性」・「美術館等展示施設における嗅覚システム利用の効果」を明らかにしようとするものである。,挑戦的研究(萌芽),中区分1:思想、芸術およびその関連分野,現代美術,匂い,記憶,参加型アート,美術作品,香り,嗅覚,脳,檀像,ニオイセンサ,香りと脳波,美術作品の受容,嗅覚システム,美術館展示,,,,,,,,,,,,,,,,,,,,,,,,,,,,,,,,,,,,,,,,,,
22K18463,大阪芸術大学,五十嵐 公一,日本中近世におけるアート・ロー（芸術法）の研究,芸術活動の場では、しばしばトラブルが生じる。それを解決する場合、問題となるのは取引慣習や法律判断を含めた法体系である。この法体系がアート・ロー（Art Law：芸術法）である。,挑戦的研究(萌芽),中区分1:思想、芸術およびその関連分野,アート・ロー,慣習法,手付,誂物,狩野永徳,注文制作,注文主,契約,裁判,,,,,,,,,,,,,,,,,,,,,,,,,,,,,,,,,,,,,,,,,,,,,,,
22K18462,立命館大学,日高 勝之,「恐怖」「情動」からの統治と民主主義へのアプローチ：コロナ禍などを事例に,コロナ禍での各国の感染対策における私権の制限のあり方には差異がある。私権の制限、個人の自由などは統治と民主主義と関わるテーマであり、巨大災害、国家的危機、重要な社会的出来事が起きた際に、それらに関わる問題は表面化する。本研究は、戦前、戦後、そして２１世紀の巨大災害、国家危機、社会的な出来事をめぐって、政治やメディア、文化などの側面から検証から行い、統治や民主主義のありようを情動的側面から考える。,挑戦的研究(萌芽),中区分1:思想、芸術およびその関連分野,コロナ禍,感染対策,世論調査,政治,民主主義,巨大災害,メディア,,,,,,,,,,,,,,,,,,,,,,,,,,,,,,,,,,,,,,,,,,,,,,,,,
22K18461,国際基督教大学,水田 洋子,哲学と言語学の有機的結合の試み：言語哲学を超える研究モデル,言語は人間の概念形成や思考と密接な関わりを持ち、言語の意味についての研究は本質的に哲学と言語学の両方に関わっている。しかし現状では哲学と言語学の交流は限定的である。本研究は、言語表現の意味と人間の知の構造について多角的・相補的に理解を深めることを目指し、哲学と言語学の有機的な結合（特に、両分野の知識や方法論の双方向的な活用）を提案し、事例研究を通してその意義と可能性を具体的に示すことを図る。,挑戦的研究(萌芽),中区分1:思想、芸術およびその関連分野,コーパス分析,自分,幸せ,現象と本質,固有名,直接指示,スペースと世界,空名問題,本質,批判的思考,言語知識,世界知識,論理関係,談話構造,言語表現の意味構造,知の構造,論理と思考,,,,,,,,,,,,,,,,,,,,,,,,,,,,,,,,,,,,,,,
22K18460,大阪公立大学,土屋 貴志,性愛をめぐる人間学の試み,性行動の実証的調査および文献テクスト分析を踏まえ「性愛および『性的倒錯』とはそもそも何なのか」という問題について考察する。「性的倒錯」とは (i)「本来の性愛」からの逸脱、(ii)性愛に関する社会・文化的規範に対する違反、を含むが、両者は必ずしも重ならない。また、「本来の性愛」なるものを疑う立場もあれば、「本来の性愛」の普遍性から社会・文化的規範の恣意性を批判する立場もある。本研究では、従来のセクシュアリティ／ジェンダー研究の成果も踏まえつつ、性愛をとりまく社会・文化的背景について深く考察すると同時に、性愛および「性的倒錯」それ自体を問題とする根柢的な探究を行う。,挑戦的研究(萌芽),中区分1:思想、芸術およびその関連分野,性愛,セックス,性的倒錯,性的逸脱,性規範,倒錯,逸脱,,,,,,,,,,,,,,,,,,,,,,,,,,,,,,,,,,,,,,,,,,,,,,,,,
