awardnumber,organization,name,title,abstract,section,review_section,keyword1,keyword2,keyword3,keyword4,keyword5,keyword6,keyword7,keyword8,keyword9,keyword10,keyword11,keyword12,keyword13,keyword14,keyword15,keyword16,keyword17,keyword18,keyword19,keyword20,keyword21,keyword22,keyword23,keyword24,keyword25,keyword26,keyword27,keyword28,keyword29,keyword30,keyword31,keyword32,keyword33,keyword34,keyword35,keyword36,keyword37,keyword38,keyword39,keyword40,keyword41,keyword42,keyword43,keyword44,keyword45,keyword46,keyword47,keyword48,keyword49,keyword50,keyword51,keyword52,keyword53,keyword54,keyword55,keyword56
20K20691,立命館アジア太平洋大学,MANTELLO Peter・A,,This project examines the emerging world of pre-crime and the various ways in which predictive policing technologies are reshaping the post-hoc traditions of the criminal justice system. The focus of preemptive law enforcement shifts from visual evidence taken directly from individuals to algorithmic projections of crimes yet to happen based on real time data streams & archival criminal meta-data of what others have done in the past.,挑戦的研究(萌芽),中区分1:思想、芸術およびその関連分野,surveillance,technology,criminality,policing,algorithm,computation,prediction,analytics,security,Terror,Predictive,Policing,Algorithm,Bias,Security,Computation,Big Data,predictive policing,precrime,posthoc,,,,,,,,,,,,,,,,,,,,,,,,,,,,,,,,,,,,
20K20690,崇城大学,古賀 元也,熊本地震の経験に基づいた身障者のための防災活動・災害時避難行動支援システムの開発,福祉避難所とは，要援護者（高齢者や障がい者など）に配慮した避難施設で，自治体職員の指示で要援護者は，一般避難所から移ることができる。しかし，熊本地震では多くの要援護者が福祉避難所を利用できず，十分な設備が整っていない場所で避難生活を過ごした。その原因として，三者間の情報共有不足による連携ミスなどが挙げられる。本研究課題では，三者に対し，災害に備える防災活動，災害時の避難行動の在り方を提案し，それを支援する「防災活動・災害時避難行動支援システム」を開発する。そして支援システムを運用した防災訓練を実施し，三者間の連携を深め，意識啓発を図ることで持続可能なアプローチに繋げていくことを目的とする。,挑戦的研究(萌芽),中区分1:思想、芸術およびその関連分野,防災,福祉のまちづくり,要援護者,熊本市,福祉避難所,避難行動支援システム,支援ツール,防災訓練,ワークショップ,行政,地域防災,防災活動・災害時避難行動支援システム,熊本地震,住民参加ワークショップ,避難行動支援,,,,,,,,,,,,,,,,,,,,,,,,,,,,,,,,,,,,,,,,,
20K20689,大阪電気通信大学,高見 友幸,古代日本の大型将棋に関する研究,将棋は平安時代から存在した伝統的遊戯であるが、その起源については全く不明である。従来の仮説では、将棋の起源は小将棋であるという大前提があったが、最近の研究からは、原初の将棋は大型将棋であり、そこから次第に小型化して小将棋が生まれたという仮説が提起されている。また、この仮説は原初の将棋が呪術であったという仮説とも連動する。,挑戦的研究(萌芽),中区分1:思想、芸術およびその関連分野,摩訶大将棋,平安大将棋,室町中将棋,中国象棋,チェスの起源,初期平安京正方形仮説,日本書紀の紀年復原,チェス,日本書紀の紀年,天円地方の思想,平安京,陰陽五行思想,大型将棋,周礼の都城モデル,将棋史,天円地方,,,,,,,,,,,,,,,,,,,,,,,,,,,,,,,,,,,,,,,,
20K20688,立命館大学,渡辺 修司,ゲーム芸術とアニメ芸術の倫理　社会的義務の記録と実装,アニメーションとゲームは、すでに社会に浸透し、文化・芸術と捉えられつつある。一方でこれらは巨大な消費者層に支えられた大衆芸術であり、消費者主導で産業としては大きな成功を収めている。,挑戦的研究(萌芽),中区分1:思想、芸術およびその関連分野,伝統玩具,ゲーム,遊び,デジタルゲーム,ZOOM,コロナ禍,ファミリーコンピュータ,TVゲーム,作家,倫理,アニメーション,芸術,アーカイブ,難易度工学,,,,,,,,,,,,,,,,,,,,,,,,,,,,,,,,,,,,,,,,,,
20K20687,京都先端科学大学,阿野 晃秀,雨庭の主流化モデルの提案に資する雨庭の植栽デザイン手法の開発,気候変動に伴い、治水機能を高めた緑化「雨庭」の普及が急がれている。現代都市の課題に対し、雨庭は自然と文化の保全、美観、洪水緩和、緑地福祉、地域活性化などに貢献する包括的な解決策となる。本研究は、多様なステークホルダーの参加による推進モデルの提案に向けて、実現に必須となる生態的文化的に保全意義の高い緑化植物の選定と、審美性と省維持管理を両立する植栽デザインモデルを開発することを目的とする。本成果は、黎明期にある我が国のG.I.の発展と普及に大きく寄与するに違いない。,挑戦的研究(萌芽),中区分1:思想、芸術およびその関連分野,雨庭,Rain Gardens,グリーンインフラ,Planting Design,Plant selection,Xeric rain garden,多年生草本,Ecological Planting,植栽,Plant Selection,雨庭に適した緑化植物の選定,空隙貯留型雨庭に適した緑化植物の選定,社会実装,雑草防除,緑化植物候補の選別,植栽基盤等の検討と決定,植栽モニタリング調査,水収支モニタリング調査,緑化植物,維持管理,生物多様性緑化,デザイン,,,,,,,,,,,,,,,,,,,,,,,,,,,,,,,,,,
20K20686,南山大学,佐々木 陽子,芸術との対話を経た公共圏の形成過程に関する実証研究,「歴史の和解」は往々にして国家主体の課題とされ、個々人の内面における記憶の継承や、対話、内的ダイアローグの生起や影響が軽視される傾向にあった。本研究は国家の枠組みでとらえられがちな歴史和解を、「人の和解」という点から問い直すものである。「他者」の声が立ち現れ、感情や記憶に訴えかける多声（ポリフォニー）が形成され、対話（ダイアローグ）が生まれる場として複数の「芸術」の現場をフィールドと定め、そこでの多声と公共圏形成の過程を分析する。インタビュー調査やPAC分析法など複数の調査手法を用い、芸術の現場で起こる対話と和解を探り、それによって「国家の和解」に対峙する「人の和解」のダイナミズムを模索する。,挑戦的研究(萌芽),中区分1:思想、芸術およびその関連分野,公共圏,他者,対話,芸術,パレスチナ,在日朝鮮人,コミュニティ,まちづくり,和解,,,,,,,,,,,,,,,,,,,,,,,,,,,,,,,,,,,,,,,,,,,,,,,
20K20685,沖縄県立芸術大学,三島 わかな,現代日本の田植歌の継承・断絶・復活の諸相：集合的記憶と個人的記憶の溝を埋める試み,本研究は、田植歌や田植踊などの継承の基盤となる日本各地で実施されている御田植祭や御田植式に注目する。その理由は、現代におけるそれらの主催者が寺社や地方行政（農水課、観光課等）、農業協同組合、芸能保護団体等と多様化し、そこには旧来の意味が変質し、現代的意義が新たに付与されているケースも見られ、実施状況も開催ごとに多様であるからだ。,挑戦的研究(萌芽),中区分1:思想、芸術およびその関連分野,御田植芸能,風俗舞・舞楽,創作バレエ,学校芸能・地域芸能,近世芸能の再編,文脈転換・エリア再編,働き方改革,過疎,断絶・復活,現代的継承,読み替え・文脈転換,表象,奉納芸能の舞台芸能化,俗謡の神事化,地域芸能と学校,伝承のありかた,復活と断絶,自意識のもちよう,様式の変化,様式の無変化,御田植祭,文化の復興,伝統の継承,次世代への継承,地域間交流,地域おこし,現代社会における変質,総合的学習の時間,既成の価値観,伝統の創造,現代社会,,,,,,,,,,,,,,,,,,,,,,,,,
20K20684,九州大学,長谷 千代子,現代アジアにおける菜食の実践と新たな道徳についての研究,現代アジアに広まる菜食実践の実態を調査し、その背後にある多様な思想の系譜を明らかにし、現在進行形で人々が編み出しつつある新たな道徳がなにを目指しているかについて考察する。本研究では、現代アジアにおける菜食実践の広がり、その背景にある仏教や動物愛護、アニミズムなどの思想状況、菜食実践者の動機や思想、それらの動向が社会に与える影響について調査・考察する。具体的には、文献研究によって基本的情報を収集しながら、菜食実践者らのライフヒストリーを収集・分析する。その調査結果をもとに、菜食産業の経済学・農学・生態学との学際研究の可能性を探りつつ、実践的な道徳研究の方向性を確立する。,挑戦的研究(萌芽),中区分1:思想、芸術およびその関連分野,菜食主義,仏教,中国,日本,台湾,倫理,環境主義,宗教文化,アニミズム,健康,積徳,道徳,宗教,,,,,,,,,,,,,,,,,,,,,,,,,,,,,,,,,,,,,,,,,,,
20K20683,山口大学,Alam Djumali,キャラクターの実体化に見る「擬人化」と「記号化」の相克性に関する研究,本研究は、“キャラ活”（キャラクターの実体化・二次創作活動または２・５次元化）を、擬人化と記号化の視点から分析して図式化を試みる。対象とするキャラクターは、現代日本における主なメディアやスポーツ、文化的なイベント・催しなどから、精神的影響力がもっとも大きいキャラクターを複数選択する。キャラ活は現代日本におけるきわめて顕著な精神的事象であるにもかかわらず、これを宗教学・スピリチュアリティの視点から考察する研究は皆無に等しい。「日本は創唱宗教よりも自然宗教が重要な宗教的機能を果たしている」という見方が正しいのであれば、現代におけるキャラ活にこそ、その精神が脈々と受け継がれているものと見る。,挑戦的研究(萌芽),中区分1:思想、芸術およびその関連分野,キャラクター,偶像,カリスマ,サブカルチャー,擬人化,眼差し,声,象徴界,現実界,生命化,生命ネットワーク,転移,模倣,イノベーション,イメージ,記号,精神分析,実体化,二次創作,キャラ活,,,,,,,,,,,,,,,,,,,,,,,,,,,,,,,,,,,,
20K20682,鳥取大学,野田 邦弘,「近代的僻地」におけるクリエイティビティに注目した脱領域的地域研究の構築,脆弱な産業基盤や若者の流出のため地方の衰退が止まらないが、創造的人材が移住することにより、地域が活性化する地方の事例が増えてきた。本研究は、そのような地域を「クリエイティブ・リージョン」と位置づけ、そこではどのようなメカニズムが働き、地域が変容するのかを明らかにする。そのため、国内外の事例を調査し、その結果を地域創生政策パッケージとしてまとめ、出版するとともに社会実装を目指す。,挑戦的研究(萌芽),中区分1:思想、芸術およびその関連分野,創造性,地域づくり,知的財産,創造都市,創造農村,過疎地,現代アート,地域活性,トリエンナーレ,地域再生,移住者,内発的発展,文化,人口減少,クリエイティブ,僻地,イノベーション,地域,,,,,,,,,,,,,,,,,,,,,,,,,,,,,,,,,,,,,,
20K20681,京都大学,元木 環,「客観」と「表現」の境界を探る医学コンテンツデザイン指標の創出,本研究は、研究者と制作者が専門家同士で実際の発生学コンテンツを共創するデザインプロセスを記録・分析し，学術コンテンツ制作におけるデザイン、およびデザインプロセスの評価観点や指標の創出を目指すものである。科学では演出改変が許されないが生データのまま表示しても特徴が伝わらず、客観的なデータで提示すべき科学情報の正確性と伝達したい特徴などを提示する表現の間で制作・評価の方向性が相反する。このジレンマに折り合いをつけるために創出されているデザイン観点と指標をデザインプロセスのコミュニケーションの記録から見出し、研究者と共創できるデザイン人材育成や制作環境構築につなげる。,挑戦的研究(萌芽),中区分1:思想、芸術およびその関連分野,3DCGモデル作成,学術資料,医学教育コンテンツ,共創デザイン,アカデミック・ビジュアリゼーション,ナラティブ,デザインプロセスの視覚化,デザイン評価,,,,,,,,,,,,,,,,,,,,,,,,,,,,,,,,,,,,,,,,,,,,,,,,
20K20680,金沢大学,菅原 裕文,デジタル・ドキュメンテーションによるカッパドキア岩窟聖堂の壁画制作と編年の再検討,西洋中世以前の壁画制作の実態は、それを記した文字史料を欠くため謎であった。ゆえに壁画の編年は、これまで絵画様式による年代比定に基づき、その精度には限界があった。,挑戦的研究(萌芽),中区分1:思想、芸術およびその関連分野,西洋美術史,ビザンティン美術史,カッパドキア,岩窟聖堂,写真測量法,3D,RTI,編年構築,西洋中世美術史,ビザンティン建築史,デジタル・ドキュメンテーション,キリスト教図像学,ゲームエンジン,キリスト教美術,,,,,,,,,,,,,,,,,,,,,,,,,,,,,,,,,,,,,,,,,,
20K20679,金沢大学,神谷 嘉美,中世以降の漆黒と平蒔絵材料を識別する自然科学的手法の確立,漆芸分野における「黒漆」や「平蒔絵」に関する研究は時代を問わず、自然科学的な分析による痕跡の抽出と確認がきわめて低調だった。識別は目視レベルで行われるため、平蒔絵技法に用いる金属材料は微小すぎて形状の把握は困難で、実際に使用した平蒔絵材料そのものの識別研究は少ない。しかし美術史で平蒔絵と同一視されていても、実際には「鑢粉」と「消粉」が混在することを見出している。そこで材料の再現復元の検討と自然科学的な分析手法を組み合わせた研究を行い、漆塗膜の黒色化技術ならびに異なる微粉金属を利用した平蒔絵技術の実態解明に資する検証法の確立を目標に取り組む。,挑戦的研究(萌芽),中区分1:思想、芸術およびその関連分野,黒色塗膜,平蒔絵,走査型電子顕微鏡,X線吸収微細構造解析,漆文化財,金属形状,漆工技術,鉄分添加,漆黒,黒色膜,金属粉,鉄イオン,XAFS,黒漆,漆着色,加速劣化試験,ウルシオール,桃山文化期,東南アジア交易,漆液,文化財分析,漆器,,,,,,,,,,,,,,,,,,,,,,,,,,,,,,,,,,
20K20678,新潟大学,栗原 隆,「嘘」の実験心理学的分析を援用して倫理原則を「正義」から「善」へと組み替える試み,時には対立を招きかねない「正義」に代えて、善をもって完全義務とする理路を模索することを通して、倫理原則として明らかにする研究である。,挑戦的研究(萌芽),中区分1:思想、芸術およびその関連分野,解釈,善,慈善,不完全義務,正義,嘘,虚構,創作,不完全義務の相互性,正しい解釈,倫理学の革新,正しさの虚構性,意志,解釈学,正義論,完全義務,世代間倫理,,,,,,,,,,,,,,,,,,,,,,,,,,,,,,,,,,,,,,,
20K20677,東京藝術大学,前島 美保,歌舞伎独自の音楽表現の生成と展開に関する研究,歌舞伎の音楽は、多種多様な楽器を用いるなど、能や人形浄瑠璃等先行・周辺芸能に比べてリアルで写実的な音楽（音）表現に特徴がある。ところが従来の歌舞伎音楽研究では、歴史的にどのような過程を経てこうした歌舞伎らしい音楽表現を獲得していったのかということへの明確な説明が十分になされてこなかった。そこで本研究では、江戸中後期から近代にかけての歌舞伎関係諸史料を総合的かつ丹念に精読・分析しながら、写実的な音楽表現の生成と展開について実証的に明らかにすることを目的とする。,挑戦的研究(萌芽),中区分1:思想、芸術およびその関連分野,歌舞伎音楽,音楽演出,囃子方,台帳,附帳,人形浄瑠璃,歌舞伎囃子,黒御簾音楽,付帳,,,,,,,,,,,,,,,,,,,,,,,,,,,,,,,,,,,,,,,,,,,,,,,
20K20676,埼玉大学,井上 智勝,東アジアにおける影幀を用いた人霊祭祀研究に対する学際的方法論の構築,本研究は、,挑戦的研究(萌芽),中区分1:思想、芸術およびその関連分野,肖像画,帝王,天皇,御後絵,泉涌寺,琉球国王,釈奠,天神,肖像,文廟,三季天神像,釈奠（釈典）（釈菜）,儒教祭祀,影供,人麻呂,菅原道真,祖先祭祀,琉球,ベトナム,朝鮮,中華,彫像,御真,,,,,,,,,,,,,,,,,,,,,,,,,,,,,,,,,
20K20675,北海道教育大学,閔 鎭京,在留外国人との共生を目指した文化政策-日韓星比較を通して-,本研究は、日本、韓国、シンガポールにおける芸術文化による在留外国人との共生を目指した政策やアートプロジェクトを比較調査し、日韓星各国の特徴と課題を整理し、日本の文化政策への応用点や改善点を提示するものである。アジアにおける文化政策の先進事例は日韓星であるが、それらの在留外国人問題に関する文化政策に対して横断的に分析した研究は管見の限りはない。,挑戦的研究(萌芽),中区分1:思想、芸術およびその関連分野,文化政策,多文化共生,在留外国人,文化芸術,アートマネジメント,社会包摂,アート,多様性,文化多様性,共生社会,日本・韓国・シンガポール,,,,,,,,,,,,,,,,,,,,,,,,,,,,,,,,,,,,,,,,,,,,,
21K18355,国立研究開発法人理化学研究所,上田 彩子,マンガの感覚拡張効果の検討とその神経基盤の解明,近年，日本特有の文化のひとつである「マンガ」の世界における影響の強さに注目が集まっているが，なぜ世界の読者にそれほど強い影響を与えるのかという問題は未解明である 。本研究では，その背景に共通する神経メカニズムとして，視覚刺激であるマンガの拡張的性質を仮定し，神経科学的アプローチを用いて実験的に検討することを目的とする。そのため，本研究では，心理行動実験でターゲットとするマンガの表現様式とその心理的効果を決定し，fMRI実験でその神経基盤を特定する。本研究は，これまで神経科学的な研究の対象として注目されてこなかったマンガが持つ影響力を実験的に解明しようとする極めて挑戦的な研究である。,挑戦的研究(萌芽),中区分1:思想、芸術およびその関連分野,漫画,感覚拡張,fMRI,マンガ,,,,,,,,,,,,,,,,,,,,,,,,,,,,,,,,,,,,,,,,,,,,,,,,,,,,
21K18354,総合地球環境学研究所,三村 豊,超高齢化する集落における文化芸術の創出と表現の高度化,本研究は、超高齢化する集落で、超学際的アプローチによる文化芸術の創出とその方法論を明らかにすることである。この研究蓄積が価値観の転換および社会変革を促す芸術存在の構造契機を明らかにできると考えている。具体的には、１）地域固有の知の把握と文化資源の収集、２）文化資源の分析とそれを活用した芸術への展開、３）聞き書きやアンケートによるエンゲージメント（つながり、絆、愛着）調査を通じて価値変化のプロセスを明らかにする。本研究では、文理融合による研究の蓄積と文化芸術を手掛かりに、超高齢化する集落の知の記録と継承、その過程のなかで新たな価値創造に働きかけるものである。,挑戦的研究(萌芽),中区分1:思想、芸術およびその関連分野,アート,地域研究,アンケート調査,コンジョイント分析,文化芸術,超高齢化,表現の高度化,超学際的アプローチ,文化資源,中山間地域,,,,,,,,,,,,,,,,,,,,,,,,,,,,,,,,,,,,,,,,,,,,,,
21K18352,倉敷芸術科学大学,川上 幸之介,移入民労働者をテーマとした芸術作品シリーズの制作研究,本研究は、戦前から現在にかけての日本における移入民労働者の受容のあり方とその背景を明らかにし、それをテーマとした映像作品を制作する。そして作品を国内外で発表することを通じて、実態解明と問題点についてアカデミックワールドと共に、一般社会への認知を広く目指している。それにより移入民労働者の環境改善といった問題解決への進展に貢献をする。,挑戦的研究(萌芽),中区分1:思想、芸術およびその関連分野,技能実習生,移民,労働組合,芸術表現,移民労働者,労働,現代アート,芸術表現　移民労働者,,,,,,,,,,,,,,,,,,,,,,,,,,,,,,,,,,,,,,,,,,,,,,,,
21K18351,関西大学,宗岡 徹,コンピュータ化によるパラダイム変化とその対応,我が国のみならず、世界の様々な社会制度等のコンピュータ化は「手書きのシステム」をそのままコンピュータに移設するものであった。そのパラダイムは強固なものがあり、コンピュータ上に移設されても、その考え方に本質的変化はない。一方、「コンピュータを前提としたシステム」が構築された分野で、パラダイム変換と呼ぶべき大きな変化をもたらしている例がある。そこで、「コンピュータを前提としたシステム」が構築されることでパラダイム変換が起こるとの仮説のもと、このような変化が、社会のパラダイムにどのように影響を与えているのか、社会は全体として、またそれぞれの分野において、どのように対処していくべきかを研究する。,挑戦的研究(萌芽),中区分1:思想、芸術およびその関連分野,パラダイム変化,コンピュータを前提としたシステム,手書きシステムのコンピュータ化,社会制度の変化,AI（人工知能）,ブロックチェーン,VR（仮想現実）,コンピュータ化,コーパス,デジタルプラットフォーム取引,医用画像診断,コロナ禍,コンピュータ,手書きのシステム,,,,,,,,,,,,,,,,,,,,,,,,,,,,,,,,,,,,,,,,,,
21K18350,大阪体育大学,中村 健,古代ギリシア・ローマにおける徳理論に基づく動物倫理,研究は以下の方法と進度で進める予定である。,挑戦的研究(萌芽),中区分1:思想、芸術およびその関連分野,ポルピュリオス,『肉食の禁忌について』,プルタルコス,Richard Sorabji,動物倫理,アリストテレス,ピーター・シンガー,,,,,,,,,,,,,,,,,,,,,,,,,,,,,,,,,,,,,,,,,,,,,,,,,
21K18349,京都文教大学,井上 嘉孝,異界と怪物の表象を巡る現代意識論―心理学的境界と社会化の現在と未来,本研究は，異界と怪物を巡る表象の歴史的・現代的変化，およびそこに反映される青年心性の分析（イメージマップ作成，フィールド・面接調査，心理臨床事例検討）を基盤として，こころの歴史性とコスモロジカルな境界／心理学的な境界（の消滅）という観点から現代意識のもつ特徴を本質的に捉えなおし，現代日本の青年たちが直面する社会化の多様性と困難さ，あるいは非社会化という心理‐社会的課題を理論的・実践的に見直すものである。そしてこの試みは，世界的なフラット化／ポストヒューマニズムの潮流を先取りする日本文化の根幹に，心理学的かつ学際的な視点から切り込み，その可能性と未来像を探索する取り組みである。,挑戦的研究(萌芽),中区分1:思想、芸術およびその関連分野,異界と怪物の表象,心の歴史性,現代意識,社会化と非社会化,心理学的境界,こころの歴史性,,,,,,,,,,,,,,,,,,,,,,,,,,,,,,,,,,,,,,,,,,,,,,,,,,
