awardnumber,organization,name,title,abstract,section,review_section,keyword1,keyword2,keyword3,keyword4,keyword5,keyword6,keyword7,keyword8,keyword9,keyword10,keyword11,keyword12,keyword13,keyword14,keyword15,keyword16,keyword17,keyword18,keyword19,keyword20,keyword21,keyword22,keyword23,keyword24,keyword25,keyword26,keyword27,keyword28,keyword29,keyword30,keyword31,keyword32,keyword33,keyword34,keyword35,keyword36,keyword37,keyword38,keyword39,keyword40,keyword41,keyword42,keyword43,keyword44,keyword45,keyword46,keyword47,keyword48,keyword49,keyword50,keyword51,keyword52,keyword53,keyword54,keyword55,keyword56
22K18459,名古屋市立大学,山本 明代,日常生活から生まれる女性たちの共生の思想と社会運動―東海地域の外国人支援の事例,本研究は、日常生活から生まれる共生の思想とそれを実現するための社会運動について、外国人・難民支援を行っている女性たちのライフヒストリーと彼女たちの多元的なネットワークを分析することによって明らかにすることを目的とする。本研究では女性たちの共生の思想と社会運動の形成要因・プロセスおよびその実態を解明するために、女性たちのライフヒストリーと日常生活の実態、その多元的なネットワークの内実を調査・分析する。,挑戦的研究(萌芽),中区分1:思想、芸術およびその関連分野,共生の思想,女性運動,外国人・難民支援,ライフヒストリー,ネットワーク,,,,,,,,,,,,,,,,,,,,,,,,,,,,,,,,,,,,,,,,,,,,,,,,,,,
22K18458,秋田公立美術大学,唐澤 太輔,粘菌と人間とのシンクロの可能性の探求,本研究の特色は、粘菌への視座から粘菌の視座への転回にある。本研究では、粘菌という原初的生命体を、いかにして「内側」から知る（直観する）ことができるかに挑戦する。そこで、本研究では、人間と粘菌との同期（シンクロ）について考察を深めていく。そして、人間の基本リズムである心拍と粘菌の基本リズムである原形質流動のシンクロによって生まれる感覚をアートとして表現し、さらにそれを言語化していく。,挑戦的研究(萌芽),中区分1:思想、芸術およびその関連分野,粘菌,変形菌,原形質流動,心臓音,リズム,渦,同期,環世界,心拍,,,,,,,,,,,,,,,,,,,,,,,,,,,,,,,,,,,,,,,,,,,,,,,
22K18457,九州大学,須長 正治,ゼンマイ式「からくりピクトグラム 社会包摂仕様」のデザイン,本研究では，ピクトグラムの構成要素を動かすことで，認知的な障害等を持つ方でも理解しやすいピクトグラムをデザインすることを目的とし，さらに，,挑戦的研究(萌芽),中区分1:思想、芸術およびその関連分野,ピクトグラム,からくり機構,社会包摂,認知症,知的障害,遊び心,,,,,,,,,,,,,,,,,,,,,,,,,,,,,,,,,,,,,,,,,,,,,,,,,,
22K18456,九州大学,中村 美亜,芸術活動をめぐる文化と福祉の間の障壁,文化と他分野との連携は、今日の文化政策において重要な課題となっている。しかし、認知症高齢者などが参加する芸術活動の現場では、文化セクター(アーティスト、文化団体、文化行政等)と福祉セクター(介護者、福祉職員、福祉行政等)の専門性の違いから、活動がうまく始められない、あるいは継続が困難というケースが数多く報告されている。本研究の目的は、両セクターの間にある障壁を構造的な問題と捉え、知識・理解、コミュニケーション、制度の3つの観点から分析することで課題を明らかにすること、また、国内外の成功事例を併せて調査することで、障壁を克服する具体的提言を行うことである。,挑戦的研究(萌芽),中区分1:思想、芸術およびその関連分野,認知症,芸術活動,文化セクター,福祉セクター,ケア観,アート,ケア,障壁,,,,,,,,,,,,,,,,,,,,,,,,,,,,,,,,,,,,,,,,,,,,,,,,
22K18455,愛媛大学,笹田 朋孝,日本におけるアーケメタラジーの国際的協働,日本には欧米のアーケオメタラジー（考古金属学。考古資料などから金属と人の歴史を総合的に明らかにする学問領域）に直接対応する研究領域が存在しておらず、複数の既存の学問領域のニッチとして存在している。そこで幕末の近代産業化遺跡（とくに反射炉）の学際的研究などを実践し、出土金属資料に対する考古学・冶金学・鉱山鉱床学・文化財科学の専門家がそれぞれの専門性を活かしながら実証的な学術研究に取り組む。また海外の研究者と共同研究を活発に実施し、人と金属の歴史に関する研究成果を国内外に積極的に発信することで、アーケオメタラジーに対応する研究領域を国際的に展開することを目的とする。,挑戦的研究(萌芽),中区分1:思想、芸術およびその関連分野,考古学,文化財科学,考古金属学,学際的研究,,,,,,,,,,,,,,,,,,,,,,,,,,,,,,,,,,,,,,,,,,,,,,,,,,,,
22K18454,東京大学,香田 啓貴,芸術・数学・文化を生物進化で繋ぐ萌芽研究:サル文化伝達に着目して,芸術と認知科学の学際交流は近年盛んである一方，生物進化の産物と捉え，動物に萌芽を見る取り組みは，これまでにあまりない．本研究では，社会心理学や比較認知科学の手法を利用して，動物に伝言ゲームをさせるような実験を実装し，それを利用した行動の変容過程を探り，その変容過程に芸術的な法則性が潜んでいるかどうかを観察する挑戦的な研究である．,挑戦的研究(萌芽),中区分1:思想、芸術およびその関連分野,図形表象,絵画,文化進化,生物進化,記憶再生課題,表象,比較認知,芸術,文化伝達実験,,,,,,,,,,,,,,,,,,,,,,,,,,,,,,,,,,,,,,,,,,,,,,,
22K18453,名古屋大学,岩崎 陽一,インド古典文献研究の基礎作業支援環境の構築─ウダヤナ文献研究における実践を通して,人工知能により人間の仕事が奪われる、という未来予測は悲観的な響きを伴って語られることが多いが、古典文献研究者としてはその未来に希望をもっている。日頃の研究において膨大な時間を割かねばならない基礎作業の多くを機会に任せ、自分自身は機械にできない高度な知的作業に注力できるようになるからである。その来るべき未来に向けて、本研究は、サンスクリット語文献の解読において必要となる作業（1）刊本の異読整理、（2）並行句・類似表現発見について、自動化または作業支援の環境を開発することを目的とする。,挑戦的研究(萌芽),中区分1:思想、芸術およびその関連分野,文献学,異読,電子化,自動化,異読検出,発見支援,,,,,,,,,,,,,,,,,,,,,,,,,,,,,,,,,,,,,,,,,,,,,,,,,,
22K18452,信州大学,小野 文子,ジャポニスム時代の消費文化ー日本の美術・工芸作品の価格に関する調査研究,本研究の目的は、消費文化という視点からジャポニスムの実態を明らかにし、芸術交流史を広く文化・経済等の社会史の中で捉え、ジャポニスム研究について、「経済」という新たな客観的指標を得ることである。そこで、本研究では、19世紀後半のロンドンのアートマーケットに着目し、アートギャラリーやオークションハウスでの展示・即売会に関わる調査、日英経済交流及びイギリス商社の美術・工芸品の売買に関わる調査を行い、日本の美術作品や工芸品がどのような位置を占め、消費されたのか、グローバルな市場における価格やシェア等について明らかにする。,挑戦的研究(萌芽),中区分1:思想、芸術およびその関連分野,ジャポニスム,消費文化,商業画廊,美術市場,アートマーケット,,,,,,,,,,,,,,,,,,,,,,,,,,,,,,,,,,,,,,,,,,,,,,,,,,,
22K18451,東京工業大学,齋藤 豪,日本のアニメ制作過程におけるデータの形式、送受信、蓄積法の革新,日本のアニメは手描きに基づき独自の発展を遂げてきた高度な映像表現からなる。,挑戦的研究(萌芽),中区分1:思想、芸術およびその関連分野,アニメ制作,データ蓄積法,手描き描画,Webシステム,ベクタライズ,手描き画像,,,,,,,,,,,,,,,,,,,,,,,,,,,,,,,,,,,,,,,,,,,,,,,,,,
22K18450,東京工業大学,塚本 由晴,里山再生を通じた事物連関型デザイン知性の開発,経済成長を前提とした20世紀型の社会の限界が明らかになり、地球環境と地域社会の持続可能な発展が喫緊の課題となる今日、身近な資源に基づく暮らしを再生するための「事物連関型デザイン知性」の開発が求められる。地域資源を活かした暮らしと伝統知が今も残る里山であり、先進的な地域社会と自然環境の再生が行われている千葉県鴨川市釜沼集落をフィールドとして、本研究は暮らしをとりまく事物のつながりを再発見・再縫合するデザイン教育の実験を行う。その成果を里山保全活用マニュアルにまとめ、里山を社会教育の資源として利活用する理論的・実践的な基礎を築くことで、本研究は脱産業的な21世紀型のデザイン教育への転回に貢献する。,挑戦的研究(萌芽),中区分1:思想、芸術およびその関連分野,事物連関,道具,伝統構法,普請,適材性適所性,不変の行程,里山,サーキュラーエコノミー,自然素材,隣接性,不変の工程,デザイン論,建築教育,伝統知,,,,,,,,,,,,,,,,,,,,,,,,,,,,,,,,,,,,,,,,,,
22K18449,東京大学,藤川 直也,言語行為工学の創出,本研究の目的は、言語行為工学(speech act engineering)という新たな研究領域を創出することにある。言語行為工学は、(i) 言語行為の評価(その欠陥・問題点の発見)、(ii) 新たな言語行為の設計、(iii) 新たに設計された言語行為の実装、の三要素からなる分野横断的な研究領域である。本研究ではこの三要素について、(A) 基礎理論研究、(B) 応用言語哲学研究、(C) 哲学史研究の三つの観点から多角的に取り組むことにより、言語行為工学という学問領域を創出する。,挑戦的研究(萌芽),中区分1:思想、芸術およびその関連分野,言語行為論,概念工学の実装,謝罪論,意味の否認可能性,言語哲学,概念工学,否認可能性,応用言語哲学,,,,,,,,,,,,,,,,,,,,,,,,,,,,,,,,,,,,,,,,,,,,,,,,
22K18448,東京大学,大向 一輝,日本におけるウェブの通時的変遷を把握するための知識ベースの構築,本研究は日本におけるウェブの普及過程の調査分析、基礎資料群の形成と公開を目的としている。具体的には各所に散逸している学術論文や書籍の他、日本のウェブの普及を担った人物による著書や、ウェブ関連の雑誌、企業や団体が作成した年表等を精査し、可能な限り網羅的な時系列情報を作成する。時系列情報には典拠となる文献やウェブ情報を紐付け、識別子を付与することで情報源としての公共性を担保するとともに、研究同士の関連性を明示化できる環境を整備する。,挑戦的研究(萌芽),中区分1:思想、芸術およびその関連分野,ウェブ情報学,技術史,知識グラフ,,,,,,,,,,,,,,,,,,,,,,,,,,,,,,,,,,,,,,,,,,,,,,,,,,,,,
22K18447,東京大学,瓜生 大輔,遠隔葬儀参列研究：事例調査とデザイン実践,本研究は、遠隔葬儀中継に取り組む事業者および実際に中継を利用した遺族などへの調査と関連技術・デザイン的動向調査を通し、独自の遠隔葬儀支援システムをデザインし検証する。研究代表者は、2020年6月に葬儀の遠隔中継支援に携わった。そこで「葬儀社や遺族が自らネット中継を執り行う難しさ」を目の当たりにしたことから、これまで全く別の文脈で行われてきた葬送儀礼研究とネット中継技術開発研究の融合必要性を認識するに至った。このような背景から、葬儀中継現場の調査による課題発見と、実際に葬儀中継に特化したシステムデザインという2つの軸に取り組む挑戦的研究を遂行する。,挑戦的研究(萌芽),中区分1:思想、芸術およびその関連分野,遠隔葬儀参列・中継,葬儀事業者,フィールドワーク,デザイン,葬送墓制研究,調査,バーチャル葬儀,韓国,テレプレゼンス,,,,,,,,,,,,,,,,,,,,,,,,,,,,,,,,,,,,,,,,,,,,,,,
22K18446,東京大学,古田 徹也,思想史研究による「内面－外面」図式の再考に基づく、「心」概念の探究枠組みの刷新,「我々人間が知覚している世界は、常に、感覚器官を通して自己の内面に立ち現れているもの＝ 表象（現れ）である。言い換えれば、知覚の直接の対象は外界の事物それ自体ではなく、表象という心的な存在者にほかならない」。本研究はまず、こうした「内面－外面」図式の内実を解明するために、古代から現代に至る西洋の思想史の展開において、この図式がどのように生まれ、変容していったのかを跡づける。そしてそのうえで、「内面－外面」図式を相対化し、この図式の本性を捉えるために、現代における懐疑論や実在論などの多様な展開を分析し、それらが古来の議論にどう応答しうるものであるのかを批判的に検討する。,挑戦的研究(萌芽),中区分1:思想、芸術およびその関連分野,心,内面,外面,懐疑論,言葉と心,内面と外面,表象,,,,,,,,,,,,,,,,,,,,,,,,,,,,,,,,,,,,,,,,,,,,,,,,,
22K18445,群馬大学,市川 寛也,「楽しく豊かな生活」の実現に向けた「創造的生活学」の理論的・実践的モデルの構築,本研究は、小学校図画工作科の教科目標に示される「楽しく豊かな生活」を出発点に、芸術学と教育学とを架橋した「創造的生活学」の構築を目的とするものである。研究の実施にあたっては、研究者・実践者・アーティストの連携に基づく実践コミュニティを形成することにより、理論と実践の両面からアプローチする。特に、地縁や血縁に基づく従来型の共同体としてではなく、興味や関心を共有する人々のゆるやかなつながり（動機縁）を基盤とする開かれた場が点在する地域社会のあり方を「創造的生活」という視点から捉え直すことを試みる。そのための手法として、体験的なアートプロジェクトやワークショップを取り入れていく。,挑戦的研究(萌芽),中区分1:思想、芸術およびその関連分野,図画工作,美術教育,アートプロジェクト,ワークショップ,民衆文化,祭礼,まちづくり,芸術化,図画工作科,工芸,社会教育,創造性,生業,生活,アートベース・リサーチ,,,,,,,,,,,,,,,,,,,,,,,,,,,,,,,,,,,,,,,,,
22K18444,東北大学,直江 清隆,人工物を介した志向性と責任概念の変容に関する研究,私たちは人工物を介して様々な仕方でつながり合っている。こうした技術と人との関係を集団や組織という点から、哲学的・倫理学的に解明することは、今日の社会的・学問的状況の中で急務になっている。例えば、人工物と人間の関係については、行動経済学のいうナッジが近年注目されているが、その倫理学的な評価については毀誉褒貶相半ばするところであって、その批判的な検討を通じて新たな責任概念を提示することが決定的に重要になっている。この研究は、技術哲学、工学倫理、機械工学、経営倫理、行動経済学といった多様な視点を交わらせながら、理論的研究と具体的・経験的研究とを組み合わせつつ学際的、国際的に探究を進めるものである。,挑戦的研究(萌芽),中区分1:思想、芸術およびその関連分野,集団志向性,責任の分散,認知バイアス,デザインの哲学,サスティナビリティ,人工物の哲学,共同責任,人工物,集団責任,インターフェイス,,,,,,,,,,,,,,,,,,,,,,,,,,,,,,,,,,,,,,,,,,,,,,
23K17497,近畿大学,高浦 佳代子,実験薬史学的手法と新規非破壊分析法による蘭方医薬学の実態解明,日本で独自の発展を遂げた漢方医学とは別に、海外から移入してきた西洋医学は「蘭方医学」と呼ばれ、使用する薬物も大きく異なっていた。本研究では特に幕末期の蘭方医学に着目し、当時使用されていた薬物類の詳細を明らかにすることを目的とする。蘭方医学では生薬そのものでなく、製剤化された薬物も多く使用されていたが、その作成方法を調査・再現するとともに、貴重な当時の資料の調査に不可欠な非破壊分析法の開発にもつなげる。,挑戦的研究(萌芽),中区分1:思想、芸術およびその関連分野,蘭方,近世,伝統医薬学,緒方洪庵,薬史学,非破壊分析,生薬,,,,,,,,,,,,,,,,,,,,,,,,,,,,,,,,,,,,,,,,,,,,,,,,,
23K17496,大阪公立大学,長屋 和哉,サウンド/メディアアートに供する音響ビッグデータアーカイブ「京都モデル」の構築,本研究では、サウンドスケープの大規模なデータベースを構築し、それをサウンドアーティストやメディアアーティストの作品制作に供する。具体的には京都市中心部（旧平安京）1216箇所の街路音響の全容を網羅する録音を立体音響の技術で実施する。いわば一つの都市を丸ごと音響資料化する試みであり、これほど巨大な規模のサウンドスケープデータベースは世界にも例がない。,挑戦的研究(萌芽),中区分1:思想、芸術およびその関連分野,サウンドスケープ,サウンドアート,メディアアート,都市環境問題,音響資料,平安京,京都,,,,,,,,,,,,,,,,,,,,,,,,,,,,,,,,,,,,,,,,,,,,,,,,,
23K17495,大阪公立大学,中川 眞,アートによるまちづくりに抗する地域住民とアートコーディネーターの協働,本研究では、アートとジェントリフィケーションという大きなテーマを視野に入れながら、歴史的に長年にわたって差別や社会的分断などに晒され、他者を受け入れることへの警戒や抵抗が強い地域コミュニティでの新たなアート実践の価値と、そこで活動する アートコーディネーターに求められる高度なスキルを解明する。基本的に、ジェントリフィケーションに抗するアート側の動きを追うものであるが、本研究の特色としては、アーティストを中心に据えない、という点がある。あるいはアーティスト不在のアート活動の質を担保するコーディネーターの働きに焦点を当てるといっても良い。研究地域は京都市東南部（下京区、南区）である。,挑戦的研究(萌芽),中区分1:思想、芸術およびその関連分野,コーディネーター,地域アートプロジェクト,ジェントリフィケーション,旧同和地区,在日,東九条マダン,アートコーディネーター,アート,ソーシャリー・エンゲイジド・アート,コミュニティ,,,,,,,,,,,,,,,,,,,,,,,,,,,,,,,,,,,,,,,,,,,,,,
23K17494,静岡県立大学,松森 奈津子,スコラ学から啓蒙、革命、独立へースペイン、ブリテン、フランス啓蒙における抵抗権,本研究は、バロック期スペインで精緻化された第二スコラ学、とりわけその抵抗権概念が啓蒙期以降の近代思想に与えた影響と意義を検討し、スコラ学と啓蒙を対置する二項対立的な通念を覆す新たな思想史解釈を切り開くことを企図する。スコラ学はこれまで、神の摂理の枠内で理論展開した点で、理性の自律を追究する啓蒙思想とは相容れないものと位置づけられてきた。このため、両者の継承関係はほとんど考察されていない。これに対して本研究は、第二スコラ学の抵抗権概念が、スペイン啓蒙とブリテン・フランス啓蒙という国内外の改革思想に重要な論理的基盤を提供したという仮説を立て、これを検証する。,挑戦的研究(萌芽),中区分1:思想、芸術およびその関連分野,アルビトリスタ,献策家,ノバトル,革新者,17世紀,危機の時代,バロック,啓蒙,スコラ学,カトリック啓蒙,抵抗権,,,,,,,,,,,,,,,,,,,,,,,,,,,,,,,,,,,,,,,,,,,,,
23K17493,札幌市立大学,山田 良,国際協奏プロジェクトによるデリバリー型ホスピタルアートモデルの開発,この研究は、ノルウェーの研究者・ナーシング・ホームとの連携による国際協奏プロジェクトを通して、空間的療養効果の高いデリバリー型ホスピタルアートモデルを開発することを目的としている。具体的には、ノルウェー国内のナーシング・ホームをフィールドとした空間Artを制作し、その評価結果をノルウェー内の病院やナーシング・ホームに配信し、設置希望を募る。次に設置を希望した施設に空間Artを配達し、デリバリー型のホスピタルアートをノルウェー国内で実現する。将来的には本研究構想をフィンランドなど北欧諸国に加えロシアへの展開も展望し、北方圏ホスピタルアートネットワークの形成を通した国際協奏社会の実現に挑戦する。,挑戦的研究(萌芽),中区分1:思想、芸術およびその関連分野,Art in Hospital,国際協奏型プロジェクト,Sratial Design,Installation Art,Nursing Home,Norway,,,,,,,,,,,,,,,,,,,,,,,,,,,,,,,,,,,,,,,,,,,,,,,,,,
23K17492,九州大学,小島 立,文化芸術活動における「媒介の場や組織」の制度設計のあり方について,文化芸術活動の成果として多様な文化的表現が生み出され（「創出」）、世の中に送り出され（「媒介」）、それらを享受できる環境（「文化多様性」）を実現するためには、「文化芸術活動が行われる場や組織」が活力に溢れていなくてはならない。本研究では、文化芸術活動の複数の領域で、文化施設、劇場・音楽堂、アートプロジェクト等の「媒介の場や組織」のあり方が問われていることに鑑み、そのような「媒介の場や組織」が自律性を確保しつつ、社会の多様な構成員の声を汲み取りながら、活力に満ち溢れた文化芸術活動を支えていくための制度設計のあり方を解明する。,挑戦的研究(萌芽),中区分1:思想、芸術およびその関連分野,文化芸術,媒介の場や組織,制度設計,文化多様性,文化専門職,自律性,,,,,,,,,,,,,,,,,,,,,,,,,,,,,,,,,,,,,,,,,,,,,,,,,,
23K17491,九州大学,長津 結一郎,聴覚障害を基盤とした音楽表現のあり方をめぐる実践研究,本研究は、聴覚障害を基盤とした音楽表現のあり方を理論構築するとともに実践を通じた社会実装を行う。障害学においては障害者の文化を「支配文化」「抵抗文化」「固有文化」と分類し理解しているが、これまでの実践は、障害者に健常者文化としての「音楽」をそのまま、もしくは変換して届けることにのみ注力し、障害があるからこその「固有文化」としての音楽を理解できていない。(1)技術を用いた既存の実践の整理・体系化　(2)音楽家や音楽教育や音楽療法等を中心に行われている具体的な音楽実践の整理・体系化　(3)「固有文化」を活かした音楽実践に関する当事者協働型アクションリサーチと検証、のアプローチを用いた研究を行う。,挑戦的研究(萌芽),中区分1:思想、芸術およびその関連分野,聴覚障害,音楽,音楽実践,実践研究,障害学,,,,,,,,,,,,,,,,,,,,,,,,,,,,,,,,,,,,,,,,,,,,,,,,,,,
23K17490,九州大学,徳久 悟,地方自治体活性化を目的としたweb3の思想にもとづくサービスデザイン手法の構築と評価,本研究は、地方自治体の活性化を目的とした、Web3の思想にもとづくサービスデザインフレームワークを構築し、連携先との実践および評価を通じて、その妥当性を検証する。 本研究の進め方は、3項目で構成される。,挑戦的研究(萌芽),中区分1:思想、芸術およびその関連分野,web3,デザイン原則,Web3,DAO,サービスデザイン,地方自治,,,,,,,,,,,,,,,,,,,,,,,,,,,,,,,,,,,,,,,,,,,,,,,,,,
