awardnumber,organization,name,title,abstract,section,review_section,keyword1,keyword2,keyword3,keyword4,keyword5,keyword6,keyword7,keyword8,keyword9,keyword10,keyword11,keyword12,keyword13,keyword14,keyword15,keyword16,keyword17,keyword18,keyword19,keyword20,keyword21,keyword22,keyword23,keyword24,keyword25,keyword26,keyword27,keyword28,keyword29,keyword30,keyword31,keyword32,keyword33,keyword34,keyword35,keyword36,keyword37,keyword38,keyword39,keyword40,keyword41,keyword42,keyword43,keyword44,keyword45,keyword46,keyword47,keyword48,keyword49,keyword50,keyword51,keyword52,keyword53,keyword54,keyword55,keyword56
23K24809,慶應義塾大学,星野 崇宏,因果効果を識別する実行可能な研究デザインの探索と推定法の開発,本研究は通常では因果効果の識別ができないが応用研究でしばしば生じるデータ状況において、どのようなデザインや補助情報が存在する場合に因果効果の推定が可能になるかの識別条件の探索、および効率的な推定量の開発、関連分野の応用を行う。具体的には「アウトカム」「介入対象ラベル」「介入とアウトカムに関連する共変量」「実際の介入遵守のラベル」などが同時ではなく、複数のデータソースから部分的にしか得られない状況での因果効果や因果効果の異質性の推定を行う。またこれらの方法論の開発と同時にマーケティング・医学・教育学での応用研究を行い提案した枠組みと方法論の妥当性、応用可能性を示す。,基盤研究(B),小区分60030:統計科学関連,因果効果,ベイズ,潜在変数,操作変数,ノンコンプライアンス,階層データ,適応的デザイン,ベイズ推定,不完全データ,政策効果,識別性,,,,,,,,,,,,,,,,,,,,,,,,,,,,,,,,,,,,,,,,,,,,,
23K28048,統計数理研究所,庄 建倉,欠測問題を含む拡張ホークスモデルの統計的推論手法の開発,本研究では、データ解析に広範に適用しているホークス型点過程を考慮し、近年登場した各種の拡張Hawkesモデルに対してベイズ型推論を展開する。,基盤研究(B),小区分60030:統計科学関連,Hawkes点過程,統計地震学,MCMC,欠測データ,EMアルゴリズム,,,,,,,,,,,,,,,,,,,,,,,,,,,,,,,,,,,,,,,,,,,,,,,,,,,
23K28047,中央大学,樋口 知之,注意機構を持つ異常値検知手法と深層確率モデルの統合と超高次元時系列データへの応用,本研究課題では、教師無し学習あるいは自己教師あり学習の枠組みで、我々が開発してきた二つの要素技術、a) 新規の学習アルゴリズムを含む逐次変分オートエンコーダをベースにした深層確率モデルと、b) 異常検知向きのAttention機構を用いた深層学習の、 a) と b)を統合することを目指す。,基盤研究(B),小区分60030:統計科学関連,時系列解析,深層確率モデル,異常検知,マルチチャンネルデータ,変分推論,,,,,,,,,,,,,,,,,,,,,,,,,,,,,,,,,,,,,,,,,,,,,,,,,,,
23K28046,九州大学,西郷 浩人,高レベル放射性廃棄物処理のための機械学習：高温多相融体の制御によるアプローチ,原子力発電は日本の主要な電源の一つであり、脱酸素化やエネルギーの安定供給といった需要から世界的な関心が高まっている。その問題点と,基盤研究(B),小区分60030:統計科学関連,機械学習,放射性廃棄物,高温多相融体,物性予測,転移学習,多相融体の粘度,電気抵抗,ロバスト推定,非線形回帰,,,,,,,,,,,,,,,,,,,,,,,,,,,,,,,,,,,,,,,,,,,,,,,
23K28045,京都大学,下平 英寿,事前分布を活用する頻度論的推論,ベイズ統計学ではデータ尤度と事前分布からベイズ推論を行うことで，対象に関する情報を無駄なく活かすことができる．しかし，仮説検定の課題においては必ずしもベイズ推論は有効に機能せず，従来から頻度論的推論が標準的に利用されている．本研究では，事前分布を頻度論的推論に矛盾なく取り込むための原理と実装の創出を目指す．通常は捨てている事前分布を頻度論的推論に活かすことで，柔軟なモデリングや恵まれた計算環境といったベイズ推論の良さも頻度論的推論へ引き継がれる．,基盤研究(B),小区分60030:統計科学関連,多変量解析,パターン認識,次元削減,分散表現,表現学習,ベイズ統計学,事前分布,仮説検定,MCMC法,サンプリング,頻度論,,,,,,,,,,,,,,,,,,,,,,,,,,,,,,,,,,,,,,,,,,,,,
23K28044,東京大学,吉田 朋広,無限次元確率解析による漸近解析の基礎理論,これまで，マルチンゲールの分布論的漸近展開，連続時間のミキシングマルコフ過程の汎関数に対する漸近展開， 非エルゴード的統計における 混合型極限を持つマルチンゲールに対する漸近展開の理論を与えたが， 漸近展開の誤差は分布の滑らかさに関係し，Malliavin解析(無限次元 確率解析)が重要な役割を演じる. さらに，Wiener汎関数の漸近展開およびSkorohod積分の漸近展開においては， Malliavin解析の作用素によ って漸近展開公式が表現される. 本研究はこの方法を発展させ，確率過程の統計学および統計計算の基礎となる， 極限定理・漸近展開の理論を 築くことを目指している.,基盤研究(B),小区分60030:統計科学関連,漸近理論,確率解析,非エルゴード統計,漸近展開,マリアバン解析,非整数ブラ ウン運動,高頻度データ,,,,,,,,,,,,,,,,,,,,,,,,,,,,,,,,,,,,,,,,,,,,,,,,,
23K28043,千葉大学,内藤 貫太,高次元統計解析に有効な関数推定法の深化・展開研究,高次元多変量統計解析において有効に機能する「関数推定」の研究に3つのサブテーマを設けて取り組む。,基盤研究(B),小区分60030:統計科学関連,関数推定,多変量解析,機械学習,高次元,ノンパラメトリック,セミパラメトリック,,,,,,,,,,,,,,,,,,,,,,,,,,,,,,,,,,,,,,,,,,,,,,,,,,
23K28042,東北大学,荒木 由布子,新たな複雑系データのための関数データ解析手法の開発と適用,近年の測定技術と社会のデジタル化の急激な発展により複雑多様化したデータの中でも特に，新たな複雑系データ「高次元（測定点数 p>> 標本数n でモデルのパラメータ推定が困難）や多層構造をもつ時空間データ」に対する分析手法の開発は不十分で，理論的な裏付けと解釈可能性を有する手法開発が学界とデータ解析現場から強く求められている. 本研究では，データを無限次元の関数の集合と捉えて解析する関数データ解析法を新たな複雑系データのために発展させ体系化する. 新たな統計モデルは，小児医用データや原爆被爆者大規模長期コホートデータなど実データに適用し，既存の手法では不可能であった新たな発見を目指す.,基盤研究(B),小区分60030:統計科学関連,新 た な 複 雑 系 デ ー タ,時 空 間 デ ー タ,関 数 デ ー タ 解 析 法,関数データ解析,複雑系データ,関数化理論,モデル評価規準,多変量解析,,,,,,,,,,,,,,,,,,,,,,,,,,,,,,,,,,,,,,,,,,,,,,,,
24K02909,明治大学,鈴木 香寿恵,衛星・地上観測を結ぶデータ駆動型物質輸送モデルの構築,本研究では大気による物質輸送過程を予測するデータ駆動型モデルを構築することを目指す。 既存の流跡線解析モデルにデータ同化手法を適用し輸送経路に確率情報を付与して生成された大気輸送経路や高解像度・高時間分解能の衛星観測画像データを機械学習の学習対象とした時間方向の輸送予測を行う。より精度の高い学習器の生成を目的とするため南極昭和基地にて降雪サンプリングを実施，分析結果をGround Truthとする。結果として衛星観測データ解析アルゴリズムのバリデーションとしても役立つ研究である。,基盤研究(B),小区分60030:統計科学関連,データ駆動,南極域,エアロゾル輸送,衛星観測,データ同化,,,,,,,,,,,,,,,,,,,,,,,,,,,,,,,,,,,,,,,,,,,,,,,,,,,
24K02908,横浜市立大学,土屋 隆裕,意識調査における回答誤差と態度変容の統合的理解,意識調査はデータ収集手段として一般的だが、回答には誤差が含まれる。この研究は、その誤差が回答者の後の意見や態度に影響を与える可能性に焦点を当て、実験を通じて態度変容を追跡する。従来は独立に扱われていた回答誤差の研究と態度変容に関する研究とが統合されることで、人の意識や行動に対する理解が深まると共に、研究で得られる知見を活用することで、調査手法の新たな改善策の提案も期待できる。,基盤研究(B),小区分60030:統計科学関連,意識調査,回答誤差,態度変容,郵送調査,,,,,,,,,,,,,,,,,,,,,,,,,,,,,,,,,,,,,,,,,,,,,,,,,,,,
24K02907,大阪大学,内田 雅之,高頻度データに基づく確率微分方程式の統計モデリング手法の開発,近年、情報通信技術および計測技術の発展により、観測幅が秒間隔や分間隔でしかも長期間観測された高頻度時系列データが比較的容易に入手できるようになり、時間の経過とともにランダムに変化する複雑な現象を統計解析する需要が高まっている。本研究では、数理科学とデータ科学を融合させ、実証分析の立場から必要不可欠な高頻度時系列データ解析の基礎となる確率微分方程式の統計モデリング手法の開発およびその数学的正当化に取り組む。,基盤研究(B),小区分60030:統計科学関連,統計的推測,データ科学,確率過程,計算統計,,,,,,,,,,,,,,,,,,,,,,,,,,,,,,,,,,,,,,,,,,,,,,,,,,,,
24K02906,東京医科歯科大学,平川 晃弘,がん早期臨床試験のデザインと統計解析法の新展開,抗悪性腫瘍薬の第3相試験の成功確率は50%未満であり，全疾患領域の中で最も低い．成功,基盤研究(B),小区分60030:統計科学関連,生物統計学,臨床試験方法論,ベイズ流アプローチ,がん,マスタープロトコル,,,,,,,,,,,,,,,,,,,,,,,,,,,,,,,,,,,,,,,,,,,,,,,,,,,
24K02905,東京大学,鈴木 大慈,大規模基盤モデルの革新的原理解明と方法論の新展開,生成基盤モデルは大きな成功をおさめ，日本政府も国家戦略としてその開発を支援する政策を進めている．本研究課題は，理論面から大規模基盤モデルの動作原理を解明し，当該分野に貢献することを目指す．特に，統計理論・最適化理論・応用への展開という三つのテーマを中心に研究を進める．,基盤研究(B),小区分60030:統計科学関連,機械学習,深層学習,統計的学習理論,基盤モデル,,,,,,,,,,,,,,,,,,,,,,,,,,,,,,,,,,,,,,,,,,,,,,,,,,,,
24K02904,東京大学,今泉 允聡,大自由度モデルの統計的理解と活用に向けた非スパース高次元統計学の理論開発,超大規模モデルを用いたデータ解析技術が、目覚ましい発展を遂げている。特に深層ニューラルネットワークは人工知能技術の一端を担い、社会に大きな影響を及ぼそうとしている。それに伴い、これらの超大規模モデルを数学的に理解・制御し、頑健性やプライバシー保護性といった適切な性質を担保することの重要性が増大している。,基盤研究(B),小区分60030:統計科学関連,大規模モデル,高次元統計学,非スパースモデル,深層モデル,統計的推定・推論,,,,,,,,,,,,,,,,,,,,,,,,,,,,,,,,,,,,,,,,,,,,,,,,,,,
25K03087,統計数理研究所,奥野 彰文,複雑な予測モデルの厳密な事後分布計算手法の確立とその応用,研究では，(A)複雑な予測モデルにおける厳密な事後分布形状の解明と，その結果を利用して(B)既存の事後分布近似手法の実用的な評価を目指す．特にニューラルネットを対象とし，恣意的な仮定や近似，および計算時間制約などを排して数週間スパンの計算にも取り組むことで，既存研究より遥かに高精度な事後分布を描写する．得られた厳密な事後分布を正解データとして既存の近似手法の定量的評価などにも利用することで，既存の不確実性評価を一新し，より現実的な視点とベンチマークを提供する．また，(C)その計算結果を一般にも広く公開する．,基盤研究(B),小区分60030:統計科学関連,ニューラルネット,事後分布,マルコフ連鎖モンテカルロ法,計算統計,,,,,,,,,,,,,,,,,,,,,,,,,,,,,,,,,,,,,,,,,,,,,,,,,,,,
25K03086,大阪大学,服部 聡,医学研究に現れる欠測データ解析に対する感度解析法,医学研究では、被験者への倫理的配慮の必要性から、データの取得に様々な制約が現れ、理想的な状態でない不完全データを対象とすることが通常である。本研究では、観察研究での交絡因子、臨床試験での中途脱落問題、メタアナリシスにおける公表バイアスなどの不完全データに対する感度解析法を開発する。観察研究、臨床試験、メタアナリシスでは、それぞれ特徴的な不完全データが生じるが、問題の特質を生かしつつも、統一的な観点からの方法論の構築を行う。我々のこれまでの研究で、推定方程式制約による数理計画法による未観測交絡因子に対する感度解析法を開発したが、この考えを他の問題に一般化し、統一的な方法論の構築を行う。,基盤研究(B),小区分60030:統計科学関連,交絡因子,操作変数,感度解析,数理計画法,メタアナリシス,,,,,,,,,,,,,,,,,,,,,,,,,,,,,,,,,,,,,,,,,,,,,,,,,,,
25K03085,京都大学,島崎 秀昭,樹状突起上の高次統計計算による集団符号化,現代のニューラルネットワークを用いた人工知能技術は，入力の高次の統計的特徴に反応する非線形ニューロン素子を持ち，高次の関係性（高次相関）を通じて高い記憶容量を実現する現代的ホップフィールドネットワークとして理解されつつある．一方で，脳の神経細胞も入力の高次の特徴量に反応し，高次相関を伴うスパースかつ多様な集団活動を示すことが知られている．本研究では，こうした特徴的な集団活動を生む神経細胞の樹状突起上の非線形演算機構を明らかにし，スパイクイベントに基づく符号化モデルを構築することで，脳と人工知能モデルの差異と共通原理を明らかにする．,基盤研究(B),小区分60030:統計科学関連,高次相関,非線形性,スパース活動,,,,,,,,,,,,,,,,,,,,,,,,,,,,,,,,,,,,,,,,,,,,,,,,,,,,,
25K03084,大阪大学,清水 昌平,デジタルツイン因果推論の研究とそれによる環境変化に頑健な機械学習実装の実現,現在のAIは、データの相関関係を使って未来を予測するが、環境が変わると正しく予測できなくなることがある。例えば、医療現場では治療の方針が変わることで、予測が外れることがある。そこで本研究では、相関だけでなく因果関係も取り入れた「因果デジタルツイン」という仕組みを作る。これは、現実世界をそっくりそのままサイバー空間に再現する仮想モデルである。環境が変わっても予測精度を保つAIを目指し、医療や経済の分野で実証実験を行う。,基盤研究(B),小区分60030:統計科学関連,因果探索,デジタルツイン,因果推論,機械学習,分布シフト,,,,,,,,,,,,,,,,,,,,,,,,,,,,,,,,,,,,,,,,,,,,,,,,,,,
25K03083,東京大学,荻原 哲平,確率過程の統計推測理論の深化と高頻度データ・機械学習への展開,ジャンプを含む確率過程のモデルはファイナンスにおいてよく用いられる。特に一日内の株価データを扱う上では、複雑な観測構造をモデル化する必要があるが、ジャンプを含む確率過程の複雑な観測構造はこれまで十分に研究されてこなかった。本研究ではこのような統計モデルに対する統計推測問題と機械学習の適用を研究する。,基盤研究(B),小区分60030:統計科学関連,確率過程,統計推測,機械学習,高頻度観測,リスク予測,,,,,,,,,,,,,,,,,,,,,,,,,,,,,,,,,,,,,,,,,,,,,,,,,,,
