awardnumber,organization,name,title,abstract,section,review_section,keyword1,keyword2,keyword3,keyword4,keyword5,keyword6,keyword7,keyword8,keyword9,keyword10,keyword11,keyword12,keyword13,keyword14,keyword15,keyword16,keyword17,keyword18,keyword19,keyword20,keyword21,keyword22,keyword23,keyword24,keyword25,keyword26,keyword27,keyword28,keyword29,keyword30,keyword31,keyword32,keyword33,keyword34,keyword35,keyword36,keyword37,keyword38,keyword39,keyword40,keyword41,keyword42,keyword43,keyword44,keyword45,keyword46,keyword47,keyword48,keyword49,keyword50,keyword51,keyword52,keyword53,keyword54,keyword55,keyword56
18H03211,統計数理研究所,江口 真透,異なるデータを統合する一般化平均による統計予測法の開発と実用化,異なるデータを統合する一般化平均による統計予測法の開発のために様々な方向から，新たな提案と実用化に貢献した．異なるデータを統合し，データの異質性を許容しながら総合理解と統一的な決定を獲得するための統計的考察を行った．一般化平均は1930年代にコルモゴロフと南雲に独立に発見された平均の一般化である．特に算術平均，幾何平均，調和平均，対数和指数を含む非常に柔軟な平均を考えることができる．この一般化平均を積極的にデータ学習アルゴリズムに組み込んで動的治療、メタアナライシス、コピュラ関数、混合効果モデル、能動学習、クラスタリング、生存解析、種の分布モデル、情報幾何において新たな提案と実用化を行った．,基盤研究(B),小区分60030:統計科学関連,メタアナライシス,動的治療計画,情報幾何,種の分布モデル,コピュラ関数,混合効果モデル,生存解析,メタアナリシス,クラスタリング,パレート分布,一般化平均,幾何平均・算術平均,ポアソン点過程,混合モデル,メタ解析,最適治療,準線形モデル,クラスター分析,混合化効果モデル,コルモゴロフ,南雲平均,マルチモーダル,オミックス データ,,,,,,,,,,,,,,,,,,,,,,,,,,,,,,,,,
18H03210,明治大学,北川 源四郎,多変量季節調整法の研究・開発,１変量季節調整法の改良に関しては，レベルと傾きの両方が独立に変化できる柔軟なモデル，定常AR成分の推定において固有根の絶対と偏角の範囲を指定できる推定法，曜日効果への制約モデル，ダミー変数を取り込む方法，複数の季節成分を取り扱う方法を開発し，従来のDecompモデルを拡張した．これらの方法はFortranおよびRによって実装した．多変量季節調整法に関しては汎用プラットフォームを開発するとともに，多変量のトレンドモデル，定常ARモデルを成分モデルとして提案し，その推定法を開発した．季節調整によって得られる多変量定常時系列の分析のための分析法や可視化の方法を考案して，実データの解析に応用した．,基盤研究(B),小区分60030:統計科学関連,季節調整法,多変量解析,状態空間モデル,統計ソフトウェア,R,時系列の分解,多変量時系列,パワー寄与率,,,,,,,,,,,,,,,,,,,,,,,,,,,,,,,,,,,,,,,,,,,,,,,,
18H03209,慶應義塾大学,星野 崇宏,異質性を考慮した因果効果の推定法の開発とその応用,本研究は近年の統計科学において最も重要かつ応用研究において利用されているルービン因果モデルの枠組みを拡張し、階層性のあるクラスターデータにおける因果効果の異質性や、同一個人でも何らかの要因により介入効果が異なる個人レベルの効果の異質性について統一的なモデル表現を行い、既存手法で生じるバイアスを回避する効率的な推定法を開発した。また、異質性の存在が複数RCT間での結果の不一致の問題につながることを明確にし、母集団情報を一部利用しながら異質性を考慮した選択バイアスの補正法を開発した。これらの方法論の開発と同時にマーケティング・医学・教育学での応用研究を行い提案した枠組みと方法論の妥当性を示した。,基盤研究(B),小区分60030:統計科学関連,因果効果推定,階層モデル,ベイズ推定,傾向スコア,選択バイアス,因果効果,階層データ,適応的デザイン,ノンコンプライアンス,,,,,,,,,,,,,,,,,,,,,,,,,,,,,,,,,,,,,,,,,,,,,,,
18H03208,大阪大学,服部 聡,多変量メタアナリシスにおける公表バイアスに対する感度解析,メタアナリシスは複数の医学研究を併合してより強固な医学的根拠を得るための方法で、臨床ガイドラインの策定などで重要な役割を果たしています。メタアナリシスは学術論文中に報告された過去の研究結果を元に行われますが、良い結果のみが論文として公表される傾向にあり、バイアスを生むこととなります。そのような公表バイアスに対処する方法は、無作為化臨床試験での治療効果のメタアナリシスでは広く研究されてきていますが、ネットワークメタアナリシスや診断法・予後因子研究などの多変量メタアナリシスではほとんど研究されてきていません。本研究では、この問題対するパラメトリック感度解析の方法を開発しました。,基盤研究(B),小区分60030:統計科学関連,メタアナリシス,公表バイアス,選択モデル,感度解析,臨床試験登録,予後因子研究,診断法研究,ネットワークメタアナリシス,要約ROC曲線,,,,,,,,,,,,,,,,,,,,,,,,,,,,,,,,,,,,,,,,,,,,,,,
18H03207,北海道大学,水田 正弘,メタ解析とシンボリックデータ解析の融合による探索的メタアナリシスの新展開,メタ解析は、複数の研究成果を統合して結論を出すものであり、根拠に基づく医療において最も高度なエビデンスと評価されている。しかし、複数の研究成果から探索的に有用な情報を見つけ出すことは容易ではない。そこで、形而上学の考え方をデータ解析に援用したシンボリックデータ解析(SDA)を利用することで、探索的メタアナリシスを構築する。また、顧客行動意向、インターネットにおける不正アクセス、各種脂肪酸データ、放射線治療などへの応用研究を実施した。,基盤研究(B),小区分60030:統計科学関連,SDA,根拠に基づく医療,コンセプト,データ統合,,,,,,,,,,,,,,,,,,,,,,,,,,,,,,,,,,,,,,,,,,,,,,,,,,,,
19H04074,統計数理研究所,野間 久史,ネットワークメタアナリシスにおける統計的推測・予測・モデリングの方法論の開発,世界規模で進む社会の高齢化による医療費の高騰から、医薬品・医療技術の有効性・有用性の比較評価は極めて重要な課題であり、ネットワークメタアナリシスはそのための重要な研究方法となっている。ネットワークメタアナリシスにおいて、統計科学の方法論は科学的な妥当性および精確性の根幹を支える中心的な役割を果たしているが、その現状のスタンダードとなっている方法には、深刻な問題・限界がある。本研究では、(A) 治療効果の推測・予測，(B) バイアスのモデル化・感度解析，(C) 大規模臨床試験データベースを用いた精密医療実現のためのエビデンス統合解析という３つの課題において、新規方法論の研究開発を行う。,基盤研究(B),小区分60030:統計科学関連,ネットワークメタアナリシス,Evidence-based medicine,高次漸近理論,モンテカルロ推測,影響力解析,多変量メタアナリシス,公表バイアス,ロバスト推測,外れ値,Evidence-Based Medicine,統計的推測,統計的予測,統計モデリング,セミパラメトリック統計理論,,,,,,,,,,,,,,,,,,,,,,,,,,,,,,,,,,,,,,,,,,
19H04073,統計数理研究所,庄 建倉,ホークス型点過程の多様な応用に向けた統計的モデリング・推論と応用の総合的研究,点過程は不規則事象発生の統計的分析と予測に広く用いられている。なかでもHawkes の自励過程は最近になって急速に多くの分野で普及が進んでいる確率モデルである。Hawkes 過程が，続発性，クラスター現象や相互誘発作用の記述と解析に威力を発揮する線形の基本的モデルであることが広く認められたからである。本研究では多分野において統計的に対処する問題，たとえば欠測（欠落）事象を含む膨大な量の不均質ビッグデータの予測・分析など，解決すべき共通ニーズに焦点を合わせ研究・開発をすすめる。さらに，高次元の点過程データに対して並列・高速計算が可能な統計的モデルの構築と解析のための統計手法を開発することである。,基盤研究(B),小区分60030:統計科学関連,Hawkes 過程,ETASモデル,フィルタリング,地震活動,確率再構築法,更新Hawkes過程,Hawkes点過程,統計地震学,水道管破損,Hawkes過程,球面ETASモデル,セミパラメトリック,臨界特性,欠測事象,セミパラメトリック推定,EMアルゴリズム algorithm,更新Hawkes点過程,地震予測,犯罪データ解析,ノンパラメトリック推定,診断解析法,欠測データ,臨界性,,,,,,,,,,,,,,,,,,,,,,,,,,,,,,,,,
19H04072,横浜市立大学,汪 金芳,Real-World-Data Inferenceの構築を目指して,保全生態学と同様に，データサイエンスはギボンズらが主張するモード２科学に分類されるべき新たな学問である。伝統的データ解析から社会における価値創造への飛躍を目指して，新たなデータ駆動型統計推測パラダイムである「Real-World-Data Inference」を構築することが本研究の目的である。特にデータ駆動型客観的ベイズ法であるReal Bayesian Inferenceや実因果モデル(Real Causal Model)の確立を焦点に当て研究を進める。,基盤研究(B),小区分60030:統計科学関連,Bayesian inference,Real-World-Data,Cell Regression,Data-Driven Prior,Machine Learning,Diabetes,Real world data,Bayesian Inference,Causal Inference,医療データ,Real World Data,Data Science,Statistics,,,,,,,,,,,,,,,,,,,,,,,,,,,,,,,,,,,,,,,,,,,
19H04071,東京工業大学,金森 敬文,高次元・大規模・多ドメインデータの特徴抽出と情報統合による統計的学習,本研究では，さまざまな形式で表現された高次元・大規模な多ドメインデータを用いて統計的学習を行うためのフレームワークを構築することを目的とします．今日のようなビッグデータ時代では，さまざまなデータドメインにおいて，サイズ，次元，表現形式の異なる複雑なデータを収集することが出来ます．これは一見すると data-rich な状態と言えます．しかし，それぞれのドメイン間の相互関係が不明なことが多く，その意味ではデータ量が増えるほどknowledge-poor な状態になってしまいかねません．このようなビッグデータ時代のパラドックスを打破するための研究を推進します．,基盤研究(B),小区分60030:統計科学関連,AI,データサイエンス,機械学習,数理統計学,数理統計,機械学修,最適化,最適輸送,多ドメインデータ,転移学習,情報転送,,,,,,,,,,,,,,,,,,,,,,,,,,,,,,,,,,,,,,,,,,,,,
19H04070,東京大学,岸野 洋久,種-集団-個体レベルの多様性の遺伝的背景を総合理解する統計モデルの開発,種内の遺伝的多様性は近現代に生じた突然変異に起因するのに対して、種間の遺伝的多様性は長期にわたる桁違いに多くの変異を反映している。そこで、多遺伝子系統樹を分散分析して突然変異率と遺伝子への淘汰圧を分離し、種、集団、個体レベルでの多様性を総合的に分析するための統計モデルを開発する。種間の比較では遺伝子の変わりやすさと表現型を関連づけ、分集団間の比較ではアレル頻度と環境の関連を分析し、個体間の比較では表現型と遺伝子型の分集団内の関連を調べる。これらを総合してグラフ表現することにより、環境が生活史へ及ぼす淘汰圧の実体を探り、遺伝的背景について包括的に理解する。,基盤研究(B),小区分60030:統計科学関連,分子進化,集団ゲノム,高次多変量解析,階層分散分析,高次元多変量解析,高次元多変量解,グラフィカルモデル,,,,,,,,,,,,,,,,,,,,,,,,,,,,,,,,,,,,,,,,,,,,,,,,,
23K20376,公益財団法人放射線影響研究所,山村 麻理子,Fused-lassoによる広島・長崎の被爆に関する時空間リスク推定モデルの開発,本研究では時空間統計解析の理論的な研究を行う．広島や長崎の原爆被爆者の寿命調査データへの応用を視野に入れ，放射線被爆による疾病罹患や死亡リスクに関する時空間の影響を明らかにする推定方法を提案する．放射線被爆に対するリスクの定量化として，過剰相対リスクと過剰絶対リスクの分析モデルが提案されており，広く利用されている．本研究ではこれらのモデルを時空間統計解析モデルに拡張し，さらに，被爆放射線の影響を従来のモデルよりも多角的に捉えることを目指す．本研究の結果から，被爆放射線の影響を時空間的に地図上で捉えることが可能になる他，多角的な影響をデータに沿った具体的な視覚化で示すことが可能となる．,基盤研究(B),小区分60030:統計科学関連,Fused-Lasso,スパース推定,時空間統計解析,情報量規準,Fused Lasso,地理情報システム,fused-lasso,時空間統計モデル,生存時間解析,放射線,,,,,,,,,,,,,,,,,,,,,,,,,,,,,,,,,,,,,,,,,,,,,,
23K20375,統計数理研究所,鎌谷 研吾,柔軟な疑似ハミルトニアンによるモンテカルロ法の展開,ベイズ統計学は，統一的な考え方が特徴である．すべての不確実性を，事後分布と呼ばれる確率分布を通して解釈する．解釈する際には積分計算が必要だから，ベイズ統計学において数値計算は不可欠である．数値計算可能な問題がすなわち，ベイズ統計学で扱える問題ということである．計算近似問題は，興味のある確率分布に対応する，ハミルトニアンと呼ばれる関数をうまく捉えることに集約される．多くの従来研究では，その近似を試みていた．本研究はそうしたアプローチとは異なる．おおざっぱな「近似」をあえてつかうことで，返って数値計算のパフォーマンスが良くなることがある．「おおざっぱ」をうまく利用するのが本研究である．,基盤研究(B),小区分60030:統計科学関連,Markov chain,Monte Carlo,Bayesian statistics,Stochastic processes,Hamiltonian,Bayesian Statistics,Scalability,ベイズ統計学,モンテカルロ法,マルコフ連鎖,確率過程,ハミルトニアン,Discretisation,Stochastic Process,Bayesian inference,Stochastic process,,,,,,,,,,,,,,,,,,,,,,,,,,,,,,,,,,,,,,,,
23K20374,京都大学,魚住 龍史,生存時間解析の新たな展開：がん免疫療法における統計的方法論の構築とその実践,臨床研究では，新規治療が標準治療に比べて有効であるか評価するために，比例ハザードモデルという生存時間解析手法がよく行われる．ここで，比例ハザードモデルに必要な仮定として，比例ハザード性というハザード比が時点に依らず一定である性質が求められる．しかし，実際の臨床研究から得られる生存時間データでは，比例ハザード性を仮定できない場合がある．がん免疫療法の開発で得られる生存時間データは，比例ハザード性が仮定できない代表例といえる．本研究では，がん免疫療法の臨床研究をはじめとした，近年の生存時間解析の諸問題への新展開となり得る，新たな統計解析手法を開発することを目的とする．,基盤研究(B),小区分60030:統計科学関連,生物統計学,生存時間解析,臨床試験,統計的推測,データサイエンス,臨床研究,がん免疫療法,,,,,,,,,,,,,,,,,,,,,,,,,,,,,,,,,,,,,,,,,,,,,,,,,
20H04150,横浜市立大学,土屋 隆裕,Total Survey Errorの枠組みによる調査データ評価手法の確立,統計調査データには様々な誤差が含まれるが、ある特定の誤差の縮小を目的とした調査の設計は、逆に他の誤差の拡大を招き、結果として総調査誤差は縮小しないおそれがある。Total Survey Errorの枠組みとは、部分的に最適化した調査設計を行うのではなく、全体として最適な統計調査の設計を行う考え方をいう。,基盤研究(B),小区分60030:統計科学関連,回答者負担,測定誤差,スケール範囲効果,調査モード,回答誤差,複数選択方式,郵送調査,Web調査,統計調査,非標本誤差,自記式調査,,,,,,,,,,,,,,,,,,,,,,,,,,,,,,,,,,,,,,,,,,,,,
20H04148,京都大学,下平 英寿,多ドメイン関連性データのグラフ埋め込みによる表現学習,画像，タグ，文書などの多様なドメインのマルチモーダルデータから関連性を考慮してニューラルネットによって情報統合し共通空間で表現する新しい柔軟な多変量解析の方法論を提案・発展させる．画像認識や自然言語処理などの大規模データに取り組み，その経験を理論にフィードバックすることによって，次元削減したベクトルの加減算など共通空間の演算による推論の枠組みの構築を目指し，高度な思考を実現するステップとする．,基盤研究(B),小区分60030:統計科学関連,多変量解析,次元削減,分散表現,表現学習,グラフ埋め込み,自然言語処理,ニューラルネットワーク,加法構成性,パターン認識,,,,,,,,,,,,,,,,,,,,,,,,,,,,,,,,,,,,,,,,,,,,,,,
23K21649,統計数理研究所,栗木 哲,確率場データ解析のための積分・位相幾何的手法と期待オイラー標数法の新展開,画像データや空間点過程（点配置）などは確率場データと総称される．これらのデータから特徴的な形態を抽出し計量するために，積分幾何・位相幾何的特徴量（オイラー数，ミンコフスキー汎関数，ベッチ数，ピーク数，臨界点数など）が用いられている．本研究は，それら特徴量の統計的性質と有用性を理論的に明らかにするとともに，新たな統計量と手法を開発することである．また得られた新たな手法を，宇宙データ（宇宙マイクロ波背景放射のシミュレーションデータなど）や遺伝学における形態解析，品質管理における変化点問題といった具体的問題に適用し，手法をより実用化することも目標である．,基盤研究(B),小区分60030:統計科学関連,ミンコフスキー汎関数,チューブ法,ボンフェロニ法,調和解析,点相関関数,ショットノイズ,球面調和関数,期待オイラー標数法,等方的キュムラント,確率幾何,宇宙データ解析,中心極限確率場,,,,,,,,,,,,,,,,,,,,,,,,,,,,,,,,,,,,,,,,,,,,
23K21648,東京医科歯科大学,高橋 邦彦,健康関連時空間データにおける複数クラスタのモデリング・検出・評価法の開発,保健・医療を含む健康関連分野において，対象となるデータの中に複数クラスタが存在する場合，解釈可能なクラスタの定義やその最適な個数の推定は大きな課題の一つとなっている。本研究では，具体的にいくつかの健康関連時空間データを想定しながら，複数クラスタが存在する場合のクラスタの定義とその統計的モデリングの検討を行う。また抽出されたクラスタに基づく統計的評価に関する問題点を明らかにし，それを解決するための適切な方法論の開発を検討する。さらに実際のデータへの適用を行った実践研究も併せて行う。,基盤研究(B),小区分60030:統計科学関連,クラスタリング,モデリング,疾病集積性,時空間データ,,,,,,,,,,,,,,,,,,,,,,,,,,,,,,,,,,,,,,,,,,,,,,,,,,,,
23K21647,東北大学,松田 安昌,大規模時空間データモデル構築と社会科学における実証研究への応用,本研究は、大規模な時空間データに現代的なデータ科学の理論と方法を積極的に応用し、社会科学への新たな知見を発見することを目的としている。近年の社会科学における大規模データは、時間の流れとともに、空間上の諸点で収集される時空間データとして観測されることが通常である。大規模時空間データ分析の理論と方法により、社会科学への豊かな応用を開くことを目指す。,基盤研究(B),小区分60030:統計科学関連,空間主成分分析,空間データ,因子モデル,深層学習,高次元時系列,時空間データ,予測,時空間回帰モデル,回帰不連続デザイン,Cox空間回帰モデル,機械学習,人流,不動産取引,関数回帰モデル,時空間モデル,空間パネルモデル,Cox比例ハザードモデル,時空間ＡＲＭAモデル,,,,,,,,,,,,,,,,,,,,,,,,,,,,,,,,,,,,,,
21H03401,東京大学,大庭 幸治,個人データメタアナリシスによる患者の価値を反映させたエビデンスの再評価,本研究課題では、過去に実施された臨床試験の個人データ(Individual Patient Data: IPD)メタアナリシスの枠組みで、リスク・ベネフィットに関連する複数のアウトカムに対して臨床的意義やエビデンスを利用する患者の選好を反映させた順位付け(Prioritized,基盤研究(B),小区分60030:統計科学関連,メタアナリシス,リスク・ベネフィット評価,個別化医療,臨床試験,因果推論,,,,,,,,,,,,,,,,,,,,,,,,,,,,,,,,,,,,,,,,,,,,,,,,,,,
23K24811,統計数理研究所,野間 久史,ネットワークメタアナリシスの統計理論・方法論の深化と革新,世界規模で進む社会の高齢化とそれに伴う医療費の高騰を受け、医薬品・医療技術の有効性・有用性の比較評価は、高水準の医療・福祉を維持するべく、極めて重要な課題となっている。ネットワークメタアナリシスは、その中心的な研究方法として、この数年で急速に普及した方法である。本研究では、その統計理論・方法論についての研究開発を行い、将来的に国際的なスタンダードとなり得る方法の開発を行う。,基盤研究(B),小区分60030:統計科学関連,ネットワークメタアナリシス,Evidence-Based Medicine,統計的推測,統計モデリング,機械学習,Evidence-based medicine,高次漸近理論,不一致性,ベイズ統計学,ブートストラップ,予測区間,ロバスト推定,モンテカルロ推測,影響力解析,多変量メタアナリシス,公表バイアス,外れ値,,,,,,,,,,,,,,,,,,,,,,,,,,,,,,,,,,,,,,,
23K24810,統計数理研究所,中野 慎也,多粒子モデルへの適用を目指した新たなデータ同化技術の開発,「データ同化」は，数値シミュレーションモデルと観測データを組み合わせて，現象を再現，予測する研究手法である．但し，既存のデータ同化手法を粒子シミュレーションやマルチエージェントシミュレーションなどの多粒子モデルにそのまま適用することはできない．本研究では，マクロスケールの観測と多粒子モデルの状態との対応づけを可能にする適切な制約を導入することにより，これまで困難であった多粒子モデルへのデータ同化の適用を実現する．さらに，粒子シミュレーションモデルやマルチエージェントモデルなどの実問題に適用し，手法の有効性を検証する．,基盤研究(B),小区分60030:統計科学関連,データ同化,粒子シミュレーション,マルチエージェントシミュレーション,,,,,,,,,,,,,,,,,,,,,,,,,,,,,,,,,,,,,,,,,,,,,,,,,,,,,
