awardnumber,organization,name,title,abstract,section,review_section,keyword1,keyword2,keyword3,keyword4,keyword5,keyword6,keyword7,keyword8,keyword9,keyword10,keyword11,keyword12,keyword13,keyword14,keyword15,keyword16,keyword17,keyword18,keyword19,keyword20,keyword21,keyword22,keyword23,keyword24,keyword25,keyword26,keyword27,keyword28,keyword29,keyword30,keyword31,keyword32,keyword33,keyword34,keyword35,keyword36,keyword37,keyword38,keyword39,keyword40,keyword41,keyword42,keyword43,keyword44,keyword45,keyword46,keyword47,keyword48,keyword49,keyword50,keyword51,keyword52,keyword53,keyword54,keyword55,keyword56
18K17367,地方独立行政法人 大阪健康安全基盤研究所,上林 大起,風疹ウイルス感染並びに風疹発症を許容する宿主免疫についての解析,近年の風しん流行の要因、感染から発症を許容する免疫の特性、胎盤を経由した垂直感染機構の解明を目的とした研究を実施し、下記の成果を得た。,若手研究,小区分58020:衛生学および公衆衛生学分野関連:実験系を含む,rubella,rubella virus,primary infection,breakthrough infection,molecular epidemiology,rubella vaccine,immunization gap,sphingomyelin synthase 1,clinical manifestation,IgG antibody,avidity,surveillance,風疹,風疹ウイルス,ウイルスRNA量,real-time RT-PCR,感染性ウイルス,ウイルス分離,感染制御,ウイルス排出期間,感染性粒子,ウイルス排泄期間,臨床検体（血清/血漿・PBMC・咽頭ぬぐい・尿）,臨床症状（発熱・発疹・リンパ節腫脹）,初感染・再感染,液性免疫,viral load,中和抗体,間接蛍光抗体法,風疹ワクチン,遺伝子型,B細胞,ヒトモノクローナル抗体,蛍光活性化セルソーティング（FACS）,エピトープ,風疹排除,輸入症例,pseudotype virus,手足口病,コクサッキーウイルスA6,抗原性変異,細胞性免疫,自然免疫,,,,,,,,,,,,,
18K17366,岐阜大学,尾之内 佐和,ダニ媒介性感染症の迅速診断法の開発―ベッドサイド診断への応用,ダニ媒介性感染症の重篤な症例においては播種性血管内凝固症候群による多臓器不全を示し、死に至る可能性もある。しかしながら、臨床症状や血液検査所見ではこれらの感染症を診断することは難しい。多くの地方衛生研究所において実施可能な検査は検査終了までには1日半から2日を要する他、P3施設を要するなどの制限がある。本研究では、解決策として、SFTSとリケッチア感染症について組換えタンパク質を用いたELISA法の開発を行う。本研究では重症熱性血小板減少症候群（SFTS）ウイルスのエンベロープタンパク質及びツツガムシ病リケッチアの外膜タンパク質の組換えタンパク質の作出を行った。,若手研究,小区分58020:衛生学および公衆衛生学分野関連:実験系を含む,ダニ媒介性感染症,組換えタンパク質,診断法,重症熱性血小板減少症候群,ツツガムシ病,日本紅斑熱,診断,ダニ媒介生感染症,SFTS,,,,,,,,,,,,,,,,,,,,,,,,,,,,,,,,,,,,,,,,,,,,,,,
18K17365,地方独立行政法人 大阪健康安全基盤研究所,坂田 淳子,ギランバレー症候群誘発リスクの高いカンピロバクター・ジェジュニの迅速診断法の開発,本研究では、ギラン・バレー症候群（GBS）誘発リスクの高い血清型O19群(HS:19)のCampylobacter jejuni (C.jejuni O19)を簡便に検出するために、本菌に対するモノクローナル抗体CampyGBS-Mab13を作出し、本抗体を用いたサンドイッチELISA法を開発した。本法は、C. jejuni O19だけでなく、C. jejuni O19と同様にGBS誘発リスクが高いと考えられるC. jejuni株（ガングリオシド様LOS合成に必要な遺伝子cgtA、cgtB、cst-IIを保有するB群、I群、R群）を検出することが可能であった。,若手研究,小区分58020:衛生学および公衆衛生学分野関連:実験系を含む,Campylobacter jejuni,ギランバレー症候群,モノクローナル抗体,ELISA,イムノクロマト法,ギラン・バレー症候群,イムノクロマト,迅速診断法,,,,,,,,,,,,,,,,,,,,,,,,,,,,,,,,,,,,,,,,,,,,,,,,
18K17364,地方独立行政法人 大阪健康安全基盤研究所,淺田 安紀子,系統的化学合成を主軸とした合成カンナビノイド系薬物の薬理活性評価および代謝研究,近年、規制薬物の構造を基に設計された『危険ドラッグ』の流通が世界的な問題となっている。本研究では合成カンナビノイド系薬物を対象に、薬物の合成を主軸に薬理活性の評価を実施した。期間内に新たに35種類の合成カンナビノイド系薬物の合成を達成した。それらの薬物についてヒトカンナビノイド受容体機能評価試験を実施し、受容体活性化能を確認した。また、加熱によって分解が進行する薬物について、分解物も含めた活性化能の評価を実施した。,若手研究,小区分58020:衛生学および公衆衛生学分野関連:実験系を含む,危険ドラッグ,,,,,,,,,,,,,,,,,,,,,,,,,,,,,,,,,,,,,,,,,,,,,,,,,,,,,,,
18K17363,国立研究開発法人国立環境研究所,岡村 和幸,ヒ素曝露による線維芽細胞の細胞老化を介した発癌機序の解明,細胞老化はSASPと呼ばれる分泌現象を介して発癌に関わることが知られている。本研究ではヒト肝臓由来の線維芽細胞であるLX-2において、Ⅲ価の無機ヒ素である亜ヒ酸ナトリウムを曝露することによって細胞老化が誘導され、それに伴うSASP因子の亢進がおこることを明らかにした。さらにSASP因子の発現増加は培地からヒ素を除いた後にも維持されることを見出し、ヒ素に曝露されなくなった後にも影響が残ることが示された。ヒト由来皮膚線維芽細胞であるHFb16dにおいても亜ヒ酸ナトリウム曝露によって同様の遺伝子発現変化が認められ、線維芽細胞におけるSASP因子の亢進が発癌に関与することが示唆された。,若手研究,小区分58020:衛生学および公衆衛生学分野関連:実験系を含む,ヒ素,細胞老化,SASP,線維芽細胞,肝臓,皮膚,DNA損傷,無機ヒ素,星細胞,有機ヒ素,発がん,癌,,,,,,,,,,,,,,,,,,,,,,,,,,,,,,,,,,,,,,,,,,,,
18K17362,京都薬科大学,阿部 温子,網羅的解析を用いたユビキチン様タンパク質の関わるKSHV溶解感染機構の解明,エイズの死因の多くはカポジ肉腫関連ヘルペスウイルス（KSHV）によって引き起こされるカポジ肉腫等の日和見感染症である。潜伏感染したKSHVの一部は溶解感染へと移行し、細胞内で孫ウイルス産生を行う。KSHVは宿主因子なしには溶解感染を行うことができず、溶解感染の際に様々な宿主因子をハイジャックして自身のDNA複製やウイルス粒子形成に役立てていることが知られているため、重要な宿主因子を発見することが必要である。今回我々はユビキチン様タンパク質であるFAT10がKSHV溶解感染の際の粒子形成に重要であることを発見し、FAT10が修飾するウイルスタンパク質を同定した。,若手研究,小区分58020:衛生学および公衆衛生学分野関連:実験系を含む,カポジ肉腫関連ヘルペスウイルス,ユビキチン様タンパク質,FAT10,ヘルペスウイルス,KSHV,ウイルス粒子形成,,,,,,,,,,,,,,,,,,,,,,,,,,,,,,,,,,,,,,,,,,,,,,,,,,
18K17361,名城大学,青木 明,理想的な抗肥満薬の開発に向けたショウガによる褐色脂肪細胞の活性化経路の解明,褐色脂肪細胞（BA）は、脂肪を燃焼し熱産生を行う。そのためBAの活性化は肥満対策に繋がると期待されている。BAはアドレナリン受容体刺激薬により活性化することが知られているものの、副作用が問題となる。本研究では、アドレナリン受容体を介さないショウガ科生薬の活性化経路の探索とその活性成分の同定を目的として検討した。結果、良姜にはアドレナリン受容体を介さずにBAを活性化する成分が存在することが明らかとなった。さらにその活性化経路は、Akt/mTORシグナルを介することが示唆された。また、良姜に含まれるいくつかの活性画分を得ることができた。今後、BAを活性化する化合物の同定を試みる。,若手研究,小区分58020:衛生学および公衆衛生学分野関連:実験系を含む,褐色脂肪細胞,Uncoupling protein 1,ショウガ,Akt/mTOR,CRISPR/Cas9,良姜,UCP1,GLUT,mTOR,β3アドレナリン受容体,3T3-L1,,,,,,,,,,,,,,,,,,,,,,,,,,,,,,,,,,,,,,,,,,,,,
18K17360,日本大学,京井 大輔,１分子DNAシーケンサーを用いた網羅性と絶対定量性を有した細菌検査法の開発,本研究では、既存の細菌検査手法が抱える時間的および人的コストを削減する新たな検査手法として1分子DNAシーケンサーを用いた検査手法の開発を行った。本研究では、当技術を用いた検査に必要なライブラリ作成について検討を行い、その作成手法を確立した。さらに、1分子DNAシーケンサーの解析能力について検討を行った。本研究により、1分子DNAシーケンサーによって定量的なDNAシーケンスが可能であることが示唆された。しかしながら、完全な定量性を得るためには更なる検討が必要である。,若手研究,小区分58020:衛生学および公衆衛生学分野関連:実験系を含む,細菌検査,1分子DNAシーケンサー,メタゲノム解析,細菌検査法,,,,,,,,,,,,,,,,,,,,,,,,,,,,,,,,,,,,,,,,,,,,,,,,,,,,
18K17359,東京慈恵会医科大学,木戸 尊將,亜鉛欠乏症のTh2リンパ球－M2マクロファージ経路を介した炎症反応増強の機序解明,亜鉛欠乏症状の炎症反応が生じる機序として、Th2細胞の転写因子GATA-3(Znフィンガータンパク)の発現が低下し、Th2リンパ球数並びにIL-4が低下することで、抗炎症型のM2マクロファージへの分化の誘導が抑制される。その結果、細菌感染や活性酸素による炎症を抑制できず、炎症反応が生じることを見出した。,若手研究,小区分58020:衛生学および公衆衛生学分野関連:実験系を含む,亜鉛,T細胞,マクロファージ,炎症反応,脾臓,亜鉛欠乏,Th2細胞,M2マクロファージ,溶血性貧血,脾腫,末梢血,好中球,interleukin (IL)-4,免疫,Tリンパ球,GATA-binding protein 3,interleukin-4,免疫毒性,,,,,,,,,,,,,,,,,,,,,,,,,,,,,,,,,,,,,,
18K17358,聖路加国際大学,小林 大輝,健常成人における長期ノロウイルス不顕性感染の大規模追跡研究,本研究は、健常者におけるノロウイルス不顕性感染を前向きに検討した研究である。288名が参加し、平均年齢は59.9歳で49.7%が男性であった。73名は過去にノロウイルス不顕性感染を確認されており、215名が過去に陰性であった。中央値599日後には14名がノロウイルス陽性であった。過去に陽性であったものは、同じ遺伝子グループが陽性となることはなかった。一方、過去に陰性であったものの中では、高齢者、血圧上昇、HbA1c高値のものが新規陽性となる傾向にあった。一方で過去に陰性であったものも、特定の特徴や生活様式を持つことで、ノロウイルス不顕性感染を新規に起こしやすいことが示唆された。,若手研究,小区分58020:衛生学および公衆衛生学分野関連:実験系を含む,ノロウイルス,不顕性感染,前向きコホート,追跡調査,,,,,,,,,,,,,,,,,,,,,,,,,,,,,,,,,,,,,,,,,,,,,,,,,,,,
18K17357,昭和大学,山内 武紀,ヒ素曝露作業者のための新規影響マーカーの確立―細胞レベルの代謝活性化を踏まえて―,わが国にはヒ素を多く含む海藻や海産物を摂取する独自の文化があることなどから、これまでヒ素を取り扱う作業者における感度・特異度の高い影響マーカーの開発は困難であった。代表者らはこれまで、培養細胞の種類によってヒ素の代謝能が異なり、それらが毒性の組織特性に関連する可能性を示唆してきた。このことを利用し、組織特異性の高い影響マーカーを確立することが本研究の目的である。ジメチルモノチオアルシン酸は3価の無機ヒ素よりも毒性が強い可能性が示唆されている有機ヒ素化合物であるが、代表者らはマクロファージ由来株化細胞がジメチルモノチオアルシン酸を産生することを見出した。前年度までにヒ素に耐性を持つ株化細胞とヒ素曝露のない細胞を利用し、次世代シークエンスにより遺伝子発現量を網羅的に解析した。腸管、膀胱、肝、乳腺、肺由来の培養細胞を用いたところ、ヒ素曝露により共通して発現の上昇した遺伝子や発現の減少した遺伝子を特定した。今年度は培養上清中に含まれるヒ素の代謝物を主に分析した。液体クロマトグラフィータンデム質量分析装置を用いた代謝物の分析法開発についても検討したが、生体試料からヒ素を抽出することが困難であり、これについては断念した。培養上清を液体クロマトグラフィー誘導結合プラズマ質量分析装置で分析したところ、由来する組織により代謝物のパターンが異なることが明らかとなった。例えば、肺由来細胞では未知の代謝物を含む少なくとも5つの代謝物が培養上清中に存在するのに対し、膀胱由来細胞では代謝物数は2つ程度であった。現在、遺伝子の発現と代謝物数や代謝物の種類との関連、未知の代謝物の同定などについて検討を進めている。,若手研究,小区分58020:衛生学および公衆衛生学分野関連:実験系を含む,ヒ素,代謝物,培養細胞,ジメチルモノチオアルシン酸,,,,,,,,,,,,,,,,,,,,,,,,,,,,,,,,,,,,,,,,,,,,,,,,,,,,
18K17356,奈良県立医科大学,勇井 克也,新規収縮物質Up4Aを介する炎症時における一過性血管収縮へのアルコールの影響,本研究は、エンドトキシンショックの初期症状であるwarm shock時に起こる循環亢進に及ぼすエタノールの作用について検討を行った。ラット上腸間膜動脈を摘出し、収縮のピーク時にIL-1β暴露したところ、一過性の収縮反応を示した。慢性エタノール摂取群の一過性収縮は、対照群より増大した。慢性エタノール摂取群と対照群において、一過性収縮はトロンボキサンA2受容体の阻害剤により抑制された。エタノールは、IL-1β暴露により、一過性の血管収縮を強化して、以降の緩和を抑制した。エタノールは、エンドトキシンショックにおいて血管への保護作用を持つ可能性がある。,若手研究,小区分58020:衛生学および公衆衛生学分野関連:実験系を含む,Inflammation,Contraction,Transient reaction,Relaxation,Shock,Alcohol,Hyperdynamic state,Thromboxane A2,Endothelial cell,血管内皮細胞,収縮,アルコール,一過性反応,一過性,endothelial cell,contraction,relaxation,alcohol,transient,,,,,,,,,,,,,,,,,,,,,,,,,,,,,,,,,,,,,
18K17355,京都府立医科大学,渡邉 元樹,ケミカルバイオロジーによるコーヒー成分の大腸癌予防メカニズムの解明,本研究では、コーヒー含有成分のカフェ酸が、複数のヒト大腸がん細胞株に対し、G1期細胞周期進行に重要なcyclin D1の発現を抑制し、コロニー形成を著明に抑制することを明らかにした。さらにケミカルバイオロジーの技術を用いて、カフェ酸の新規結合タンパク質としてPHB2とRPS5を同定した。siRNAによるPHB2及びRPS5の発現枯渇は、カフェ酸処理と同様に、cyclin D1の発現を抑制し、大腸がん細胞のコロニー形成を抑制した。以上より、カフェ酸は、大腸がん細胞内において、PHB2及びRPS5に結合し、cyclin D1の発現を減少させることで増殖抑制効果を示すと考えられた。,若手研究,小区分58020:衛生学および公衆衛生学分野関連:実験系を含む,がん予防,大腸がん,ケミカルバイオロジー,コーヒー,カフェ酸,prohibitin2,ribosomal protein S5,cyclin D1,コーヒー含有成分,RPS5,PHB2,コーヒー酸,分子標的予防,分子標的癌予防,大腸癌,,,,,,,,,,,,,,,,,,,,,,,,,,,,,,,,,,,,,,,,,
18K17354,岡山大学,長岡 憲次郎,抗アレルギー性ラクトフェリンサプリメントのアレルギー機序に関する研究,【目的と方法】機能性食品として用いられるラクトフェリン（BLF）の免疫調節機能について検討を行った。雌のBALB/cマウスにAlumを用いた腹腔内投与後、抗原の経口投与を行い、その影響について測定した。,若手研究,小区分58020:衛生学および公衆衛生学分野関連:実験系を含む,機能性食品,動物実験,食物アレルギー,免疫実験,細胞実験,ラクトフェリン,アレルギー,マウス,サプリメント,,,,,,,,,,,,,,,,,,,,,,,,,,,,,,,,,,,,,,,,,,,,,,,
18K17353,鳥取大学,徳永 朱乃,重症化予防のためのインフルエンザウイルス株の増殖能の検討,"2009年の新型インフルエンザ流行後、市中で流行するインフルエンザウイルスの増殖能とウイルス誘発性細胞死への影響については十分に調査されていない。我々は、2009年から2015年に採取された鼻咽頭拭い液からMDCK細胞でウイルスを分離した。ヒトで流行する全てのインフルエンザの型・亜型(A/H1N1, A/H3N2, B)において、MDCK細胞で幅広い増殖能を示した。増殖能はヒト肺胞上皮細胞由来A549細胞の細胞傷害程度、および、鼻汁中のウイルス量と相関していた。増殖能はインフルエンザ予後を予測する重要な因子であることが示唆された。",若手研究,小区分58020:衛生学および公衆衛生学分野関連:実験系を含む,インフルエンザウイルス,増殖能,肺胞上皮細胞傷害,鼻汁中ウイルス量,鼻汁中のウイルス量,細胞障害能,細胞傷害能,重症化予防,流行株,,,,,,,,,,,,,,,,,,,,,,,,,,,,,,,,,,,,,,,,,,,,,,,
18K17352,京都大学,瀬藤 和也,潜在的なアニオンギャップ変動に基づく高血圧・動脈硬化のリスク評価,体内環境は電解質バランスにより維持される。アニオンギャップ（AG）はそのバランスを反映し、高血圧等の疾患や総死亡との関連が報告されてきた。ゆえにAGの変化は疾患リスクの評価に有効とされる。しかしAGの算出に用いない電解質の影響は十分に考慮されていない。本研究では地域住民対象のコホート調査を母体とし、各種電解質を考慮した高精度AGが様々な循環器指標（血圧や動脈硬化指数）と性別、年齢、BMI、腎機能、服薬の有無、生活習慣によらず有意に関連することを示した。またある電解質が他の電解質と独立に循環器指標と関わることも示した。これらの結果はAGや電解質と循環器疾患との相互関係の解明に寄与する。,若手研究,小区分58020:衛生学および公衆衛生学分野関連:実験系を含む,アニオンギャップ,電解質,高血圧,動脈硬化,コホート研究,,,,,,,,,,,,,,,,,,,,,,,,,,,,,,,,,,,,,,,,,,,,,,,,,,,
18K17351,東京大学,財津 將嘉,がん罹患リスクの社会格差の解明：生活習慣因子や免疫機能異常の媒介,日本標準職業分類及び日本標準産業分類に基づく新しい職業分類を確立した。この指標を用いて、臨床データと職業背景を用いたビッグデータ分析を実施した。日本で初めて、がんや循環器疾患などの生活習慣病について、職業間の差を明らかにした。また、社会経済学的背景によって異なる生活習慣リスクを発見した。特に、少量飲酒による各種がん罹患リスクを明らかにした。また、国民皆保険制度下においても、がん予後が職業間で異なることも日本で初めて明らかにした。更に、職業間の免疫機能の違いによりがんの病理組織が異なる可能性も発見した。,若手研究,小区分58020:衛生学および公衆衛生学分野関連:実験系を含む,社会格差,職業,がん,循環器疾患,飲酒,媒介分析,病理組織,HMGB1,がん予後,加熱式タバコ,がん登録,免疫応答,最長職業,リスク,循環器,アルコール,生活習慣,がん罹患リスク,生活習慣因子,免疫機能,,,,,,,,,,,,,,,,,,,,,,,,,,,,,,,,,,,,
18K17350,東北大学,佐藤 章子,マンモグラフィ検診の石灰化に着目した検診精度の底上げと新規マネジメントの基盤構築,マンモグラフィ（MG）による乳癌検診のさらなる精度向上のために、本研究では以下の項目について検証した。（１）陽性反応的中率(PPV)が低く、低悪性度の非浸潤癌であることが多いカテゴリー３の石灰化について、比較読影の有用性を検診と精査機関の両面から検討　（２）検出感度が低下する高濃度乳房に対する検診層別化因子として乳房構成と撮影圧迫乳房厚の可能性を調査　（３）高齢化が加速している我が国における年齢や医療経済・効果を考慮したリスク層別化検診の模索として年齢階級別の対策型乳がん検診の実態調査,若手研究,小区分58020:衛生学および公衆衛生学分野関連:実験系を含む,対策型乳がん検診,マンモグラフィ,検診層別化,対策型乳癌検診,過剰診断,がん登録,PPV,高濃度乳房,偽陰性,J-START,30歳代乳癌検診,マンモグラフィ 検診,CBT,検診層別化因子,圧迫乳房厚,対策型検診,乳がん検診,マネジメント,マンモグラフィ検診,カテゴリー分類,過剰診断・過剰治療,Active screening,石灰化,検診精度,CAD,,,,,,,,,,,,,,,,,,,,,,,,,,,,,,,
18K17349,弘前大学,山内 可南子,土壌に潜む致死性アメーバ生息特性解析と新規無細胞培養法の開発,自由生活性アメーバに分類されるバラムチア・マンドリラリスは、ヒトに感染し髄膜脳炎を惹起する。本アメーバの罹患者は、ほぼ100%死に至ることから、早期診断・治療法の確立が急務であるが、既存のバラムチア培養法は非常に複雑な組成で汎用性が低く、環境バラムチアの培養には特に適していない。そこでバラムチアの生息する土壌の解析を通し、生息特性を明らかにし、新規培養法を開発することを企図した。土壌解析により環境中のバラムチアは、富栄養条件を好み、ミネラルを含んだアルカリ性土壌を好むことが明らかとなった。試作培養液では、土壌に近い電気伝導率を再現することで環境バラムチアの培養に成功した。,若手研究,小区分58020:衛生学および公衆衛生学分野関連:実験系を含む,アメーバ性髄膜脳炎,土壌解析,無細胞培養,生息特性,無菌培養,バラムチア,自由生活性アメーバ,培養,土壌,Balamuthia mandrillaris,青森,,,,,,,,,,,,,,,,,,,,,,,,,,,,,,,,,,,,,,,,,,,,,
18K17348,北海道大学,小林 澄貴,胎児期の受動喫煙と7歳までの発育：母児の遺伝環境交互作用の影響解明,"出生前向きコホートを使って、胎児期の母の受動喫煙曝露と児の7歳までの発育との関連と、発育に及ぼす遺伝環境相互作用の影響を検討した。胎児期の非喫煙者と比較して、受動喫煙者の出生時体格との関連はなかったものの、受動喫煙者の1歳半から7歳までの児の体重は小さかった。児の7歳までの発育に対して、母児の異物代謝酵素(CYP1A1,CYP1A2,GSTM1など)や肥満関連遺伝子(FTO)などの20か所の一塩基多型は、胎児期の母の受動喫煙曝露との交互作用を引き起こさない可能性が示唆された。",若手研究,小区分58020:衛生学および公衆衛生学分野関連:実験系を含む,受動喫煙,妊婦,小児,発育,遺伝子多型,異物代謝酵素,肥満遺伝子,遺伝環境交互作用,一塩基多型,疫学,公衆衛生学,,,,,,,,,,,,,,,,,,,,,,,,,,,,,,,,,,,,,,,,,,,,,
