awardnumber,organization,name,title,abstract,section,review_section,keyword1,keyword2,keyword3,keyword4,keyword5,keyword6,keyword7,keyword8,keyword9,keyword10,keyword11,keyword12,keyword13,keyword14,keyword15,keyword16,keyword17,keyword18,keyword19,keyword20,keyword21,keyword22,keyword23,keyword24,keyword25,keyword26,keyword27,keyword28,keyword29,keyword30,keyword31,keyword32,keyword33,keyword34,keyword35,keyword36,keyword37,keyword38,keyword39,keyword40,keyword41,keyword42,keyword43,keyword44,keyword45,keyword46,keyword47,keyword48,keyword49,keyword50,keyword51,keyword52,keyword53,keyword54,keyword55,keyword56
23K16317,地方独立行政法人 大阪健康安全基盤研究所,若林 友騎,Pan-RNA-Seqによる新興病原細菌-アルジェンテウス菌の遺伝子系統間の発現量比較解析,新興感染症起因菌であるStaphylococcus argenteus（アルジェンテウス菌）の遺伝子系統間での遺伝子発現量を比較する。先行研究で実施した大規模比較ゲノム解析の結果、アルジェンテウス菌は大きく8つの遺伝子系統に分類されることが明らかになったが、各遺伝子系統間における病原性の差は不明であった。本研究では、保有する各遺伝子系統のアルジェンテウス株について、次世代シーケンサーを用いたRNA-Seqを実施し、各遺伝子系統株で発現している遺伝子を網羅的に同定し、遺伝子系統間の病原因子遺伝子等の発現量比較解析を行う。,若手研究,小区分58020:衛生学および公衆衛生学分野関連:実験系を含む,Staphylococcus argenteus,全ゲノム解析,RNA-Seq,,,,,,,,,,,,,,,,,,,,,,,,,,,,,,,,,,,,,,,,,,,,,,,,,,,,,
23K16316,愛知県がんセンター(研究所),小柳 友理子,喫煙・飲酒行動関連遺伝子多型によるがんリスク：臓器横断的媒介分析,「媒介分析」は曝露因子のアウトカムへの効果を、直接効果と中間因子を介する間接効果に区別して定量化する解析手法である。申請者らは、飲酒行動を中間因子とする「媒介分析」を消化管がんの症例対照研究に適用し、ALDH2　rs671多型が、臓器特異的なアセトアルデヒド曝露量増加による発がん促進効果と、臓器横断的な飲酒行動抑制を介した保護的効果をもつことを明らかにした。本研究では、rs671多型のみを対象とした先行研究での成果を、複数の喫煙・飲酒関連遺伝子多型に応用する。がんの２大リスク因子である喫煙及び飲酒を中間因子とした「媒介分析」により、各多型の発がんへの遺伝的寄与の詳細な評価を臓器横断的に行う。,若手研究,小区分58020:衛生学および公衆衛生学分野関連:実験系を含む,喫煙,飲酒,遺伝子多型,媒介分析,がん,喫煙関連遺伝子多型,飲酒関連遺伝子多型,がんリスク,,,,,,,,,,,,,,,,,,,,,,,,,,,,,,,,,,,,,,,,,,,,,,,,
23K16315,京都府立医科大学,鱧屋 隆博,温度感受性受容体TRPVを介した乳がんにおける温度の役割解明,"サーモグラフィーを用いた体表温度測定によって乳がんを発見した例は古くから報告されているが、温度とがんの関係やその詳細な分子機構は明らかになっていない。本研究では、乳がん細胞で高発現している温度感受性受容体TRPV3, 4を介して、温度が乳がんに及ぼす分子機構を解明し、新たながん予防法や診断法の基盤を構築する。研究成果は、がんと温度の関係性を紐解き、がん予防やがん診断の新たな原理を提示することに貢献する。",若手研究,小区分58020:衛生学および公衆衛生学分野関連:実験系を含む,温度感受性受容体,TRPV4,乳がん細胞,温度,乳がん,がん予防,,,,,,,,,,,,,,,,,,,,,,,,,,,,,,,,,,,,,,,,,,,,,,,,,,
23K16314,関西学院大学,青野 裕一,疾病予防を目的としたヒノキチオールが示す抗酸化効果の作用機序の解明,酸化ストレスは、がんを含む様々な疾患の発症・病態への関与が知られているにも関わらず、抗酸化サプリメントを用いた複数の臨床研究において、期待通りの結果が得られていないのが現状である。　この問題を解決し得る化合物として、青森ヒバの精油に含有する天然化合物であるヒノキチオールに着目した。本化合物は、酸化ストレスからの細胞保護効果を有しており、その効果は上記の臨床研究にも使用されたビタミンCよりも高かった。本研究は、ヒノキチオールの持つ高い細胞保護効果の分子基盤の全貌を明らかとすることを目的としており、その成果は酸化ストレスを原因・増悪原因とする疾患の予防法・治療法の深化が期待される。,若手研究,小区分58020:衛生学および公衆衛生学分野関連:実験系を含む,ヒノキチオール,皮膚がん予防,抗酸化作用,ケモプロテオミクス,,,,,,,,,,,,,,,,,,,,,,,,,,,,,,,,,,,,,,,,,,,,,,,,,,,,
23K16313,聖マリアンナ医科大学,大神田 敬,カルバペネマーゼ産生菌感染症に対する画期的な抗菌薬併用療法の開発,カルバペネマーゼ産生菌（CPO）の蔓延は世界的な公衆衛生上の驚異であるが、有効な新規抗菌薬の開発は少なく治療の選択肢は限られている。これまでの研究で、耐性化した抗菌薬同士の併用でも十分な殺菌作用を発揮することが明らかになったが、その作用機序は解明できていない。本研究では、CPOに対する抗菌薬併用の作用機序の解明およびin vivoにおける有効性と安全性の評価に取り組む。薬剤耐性菌感染症の治療法の開発は喫緊の課題であり、本研究成果は新たな治療指針の確立に貢献することが期待される。,若手研究,小区分58020:衛生学および公衆衛生学分野関連:実験系を含む,カルバペネマーゼ,併用療法,動物実験,代替モデル,カルバペネム耐性菌,抗菌薬併用療法,感染実験,Caenorhabditis elegans,,,,,,,,,,,,,,,,,,,,,,,,,,,,,,,,,,,,,,,,,,,,,,,,
23K16312,東京理科大学,藤江 智也,血管病変部位の環境変化による重金属の内皮細胞毒性の修飾とその機構解析,カドミウムや鉛に代表される環境汚染重金属は、血管病変の発症・進展の危険因子であり、その発症・進展は、内皮細胞の障害が引き金となる。重金属による毒性をより現実的に理解するためには、重金属が標的とする生体内分子の同定とその毒性発現への影響の解明だけでなく、重金属の内皮細胞毒性に対する細胞外の微小環境変化の修飾作用に関する研究も必要である。本研究では、細胞外の増殖因子・サイトカイン、ATP・ADPなどの生理的な環境要因の変化に伴う、重金属毒性に対する内皮細胞の感受性の修飾様式、およびその責任分子を明らかにする。,若手研究,小区分58020:衛生学および公衆衛生学分野関連:実験系を含む,重金属,カドミウム,鉛,内皮細胞,細胞毒性,,,,,,,,,,,,,,,,,,,,,,,,,,,,,,,,,,,,,,,,,,,,,,,,,,,
23K16311,東京理科大学,宗 才,ナノプラスチック曝露による中枢神経損傷とその分子機構の解明及び防御戦略の検討,プラスチック廃棄物による汚染が世界的な環境問題になっている。細かくなったプラスチックは食物連鎖や大気汚染物を介して、ヒトに取り込まれており、最近ヒト血液中からプラスチック粒子が検出され、各臓器への移行及び深刻な健康影響の可能性について警鐘を鳴らした。一方、高齢化に伴い、アルツハイマー(AD)などの認知症の増加は国内外で大きな社会問題となっており、環境化学物質への曝露が神経変性疾患発症のリスク要因の一つであると考えられている。本研究では、ナノプラスチック曝露後中枢神経系への侵入、神経障害の誘導を調べ、その分子機構におけるグリア細胞活性化、神経炎症の役割を解明し、有効な防御戦略を調べる。,若手研究,小区分58020:衛生学および公衆衛生学分野関連:実験系を含む,マイクロプラスチック,ナノプラスチック,神経毒性,ミクログリア,アストロサイト,酸化ストレス,オートファジー,神経損傷,グリア活性化,神経炎症,,,,,,,,,,,,,,,,,,,,,,,,,,,,,,,,,,,,,,,,,,,,,,
23K16310,自治医科大学,ラハマン エムディー・シブルール,,"Now, it is evident that low concentration and chronic arsenic exposure induced hypertension and cardiovascular diseases. In preliminary cell culture experiments, we observed that arsenic-induced endothelial dysfunction was associated with the renin-angiotensin system. Arsenic also induces endothelial dysfunction by generating excessive reactive oxygen species and by disrupting the antioxidant defense in the biological system. The proposed study aims to clarify the regulatory role of ACE2 and its interaction with Nrf2 in arsenic-induced endothelial dysfunction using experimental studies.",若手研究,小区分58020:衛生学および公衆衛生学分野関連:実験系を含む,arsenic,renin angiotensin system,HUVECs,Nrf2,Arsenic,Endothelial dysfunction,Hypertension,,,,,,,,,,,,,,,,,,,,,,,,,,,,,,,,,,,,,,,,,,,,,,,,,
23K16309,自治医科大学,北村 祐貴,プロテオーム解析によるナノプラスチックのリスクマーカー探索と生体影響の解明,環境中のナノプラスチックは海に捨てられた海洋プラスチックの破片から発生し、食物連鎖を通じて我々の体内に取り込まれていることが、近年問題となっている。本研究では、ナノプラスチックの生体への影響を明らかにするために、炎症性腸疾患の細胞および動物モデルを作製し、ナノプラスチックの消化管炎症反応への影響および全身分布や臓器の蓄積性について検証する。また、二次元電気泳動法を用いたプロテオミクス解析によって、ナノプラスチックによる影響を評価できるバイオマーカーを開発する。,若手研究,小区分58020:衛生学および公衆衛生学分野関連:実験系を含む,ナノプラスチック,炎症性腸疾患,炎症性サイトカイン,酸化ストレス,プロテオミクス解析,バイオマーカー,,,,,,,,,,,,,,,,,,,,,,,,,,,,,,,,,,,,,,,,,,,,,,,,,,
23K16308,山陽小野田市立山口東京理科大学,今堀 大輔,抗がん剤抵抗性改善作用を有する食品中テルペノイド類の探索研究,熱ショックタンパク質は、外的なストレスから細胞を保護する機能を有するが、がん細胞においては、アポトーシス抑制機能が抗がん剤抵抗性を引き起こすと考えられている。本研究では、食品の高い安全性と天然物の構造多様性に着目し、抗がん剤抵抗性を改善する天然有機化合物の探索を行う。具体的には、食経験のある植物からエキスを作成し、抗がん剤感受性増強作用やがん幹細胞毒性作用を有した天然有機化合物の探索を行う。さらに、見出した化合物については、有効性を個体レベルで明らかにすることを目指す。,若手研究,小区分58020:衛生学および公衆衛生学分野関連:実験系を含む,天然物化学,がん予防,テルペノイド,がん,セスキテルペノイド,リモノイド,熱ショックタンパク質,食品,,,,,,,,,,,,,,,,,,,,,,,,,,,,,,,,,,,,,,,,,,,,,,,,
23K16307,大阪公立大学,高嶋 信吾,好酸球性食道炎の病態にアルコールが与える影響と分子学的機序の解明,好酸球性食道炎とは、食物や空気中に含まれる物質が抗原となって食道の消化管粘膜上皮に好酸球炎症と機能異常を起こす慢性アレルギー性疾患である。申請者は好酸球性食道炎の発症リスクがアルコールであることを臨床研究で見出したため、好酸球性食道炎のアレルギー炎症をアルコールが促進しているとの仮説を検証する目的で臨床的・基礎的検討を行う。,若手研究,小区分58020:衛生学および公衆衛生学分野関連:実験系を含む,好酸球性食道炎,アルコール,,,,,,,,,,,,,,,,,,,,,,,,,,,,,,,,,,,,,,,,,,,,,,,,,,,,,,
23K16306,静岡県立大学,紅林 佑希,細胞内酵素の可視化プローブを用いたインフルエンザウイルスシアリダーゼの新機能解明,インフルエンザウイルスのシアリダーゼは細胞内でも機能を有することが報告されているが、詳細な解析は進んでいない。本研究では、細胞内シアリダーゼの挙動を可視化する新規蛍光イメージング剤の開発を通してシアリダーゼの新機能解明を目指す。パンデミックウイルスに見られるシアリダーゼの特性の解析を中心に、蛍光イメージング剤を利用したシアリダーゼの機能解析を行い、ウイルスの新たな感染メカニズムを明らかにする。,若手研究,小区分58020:衛生学および公衆衛生学分野関連:実験系を含む,インフルエンザウイルス,シアリダーゼ,蛍光プローブ,酵素活性可視化,細胞内局在,ウイルス,インフルエンザ,,,,,,,,,,,,,,,,,,,,,,,,,,,,,,,,,,,,,,,,,,,,,,,,,
23K16305,岐阜薬科大学,石田 慶士,児の神経発達に着目した妊娠期ワクチン接種の安全性確保に関する基盤研究,本研究では、妊婦が安全にワクチンを接種するための科学的エビデンス構築を目的とし、独自に作製した神経分化トレーサーマウスを用いて、妊娠期の免疫応答を人為的にコントロールした際に児の神経発達にどのような影響が及ぶのかを明らかにする。妊娠期のどのような免疫活性化状態が神経発達影響のリスクを高めるのかを明らかにするとともに、そのメカニズム解明を試みる。さらに、獲得免疫誘導のみを残した状態で自閉スペクトラム症発症のリスク因子を抑制することが可能か否かを検証する。本研究で得られる知見は、妊婦を対象としたワクチンの安全性の担保や低リスクの接種方法の確立に多大な貢献をもたらすことが期待される。,若手研究,小区分58020:衛生学および公衆衛生学分野関連:実験系を含む,ワクチン,母体免疫,神経発達,,,,,,,,,,,,,,,,,,,,,,,,,,,,,,,,,,,,,,,,,,,,,,,,,,,,,
23K16304,大分大学,小坂 聡太郎,炎症性腸疾患におけるSLPIの新規バイオマーカーとしての可能性と有用性の検討,IBDの疾患活動性のモニタリング法として非侵襲的バイオマーカーが注目されている。本研究ではIBD診療におけるSLPIの新規非侵襲的バイオマーカーとしての可能性を見出し、その有用性を検証する。SLPIは腸炎に対し保護的に働く分子であり、腸内細菌の成分であるリポポリサッカライドの刺激により腸から分泌される。IBDの病態には腸内細菌が関与しており、SLPIはIBDのより特異的なマーカーになる可能性が考えられる。そこで、マウス腸炎モデルとIBD患者から得た血清と糞便中のSLPIをELISAで定量化し、SLPIが腸炎により高値となるかを検証するとともに、SLPI値と疾患活動性との相関性を検討する。,若手研究,小区分58020:衛生学および公衆衛生学分野関連:実験系を含む,SLPI,炎症性腸疾患,バイオマーカー,,,,,,,,,,,,,,,,,,,,,,,,,,,,,,,,,,,,,,,,,,,,,,,,,,,,,
23K16303,広島大学,KO KO,"Prevalence and Genotype Distribution of HDV using in-house developed ELISA in both serum and dried blood spots samples of pregnant women and their newborns in Siem Reap, Cambodia","We will examine anti-HDV through opportunistic test by means of commercially available ELISA kit, and in-house developed direct ELISA and Sandwich method to all HBsAg positive samples from pregnant women and their newborns in Siem Reap, Cambodia followed by molecular analysis.",若手研究,小区分58020:衛生学および公衆衛生学分野関連:実験系を含む,Hepatitis D Virus,Cambodia,ELISA,Screening,Hepatitis  D Virus,,,,,,,,,,,,,,,,,,,,,,,,,,,,,,,,,,,,,,,,,,,,,,,,,,,
23K16302,京都大学,島本 大也,PHRアプリを活用したオンライン短時間レジスタンス運動プログラムの開発,本研究では運動習慣を持たない大学生を対象に、オンラインでの短時間自重トレーニングプログラムとPHRアプリを組み合わせた介入が、各種健康指標に与える効果を検証する。プログラムは、全身に満遍なく刺激を与える内容とし、PHRアプリはトレーニングの経過を可視化することで成長を実感し、継続の一助となる内容として開発する。パイロット試験と、観察期間がそれぞれ3か月と1年の無作為化比較試験によってプログラムの効果を検証する。,若手研究,小区分58020:衛生学および公衆衛生学分野関連:実験系を含む,Personal Health Record,Resistance Training,Health Promotion,,,,,,,,,,,,,,,,,,,,,,,,,,,,,,,,,,,,,,,,,,,,,,,,,,,,,
23K16301,東京大学,Wai KyiMar,Identification of Positive Deviant Characteristics in Mitigating Biological Aging: Telomere Length as a Biomarker of Biological Aging,"Telomere length (TL) has been proposed as a biomarker of biological aging. Positive deviance (PD) concept is idealized for improving public health locally, as the whole community can adopt a healthy lifestyle from healthy peers. It is not possible to clone people; however, it could be possible to understand the unique PD characteristics and have close care on those for socio-behavioral modifications. This study will firstly identify PD characteristics that cope well with premature biological aging, and it would be beneficial to design tailor-made interventions that are applicable in community.",若手研究,小区分58020:衛生学および公衆衛生学分野関連:実験系を含む,Telomere,Positive Deviance,Ageing,,,,,,,,,,,,,,,,,,,,,,,,,,,,,,,,,,,,,,,,,,,,,,,,,,,,,
24K20211,島根県保健環境科学研究所,川瀬 遵,非チフス性サルモネラによる長期感染と再発は起こり得るのか,病原細菌の中には、感染後、宿主内で休眠状態に移行し、長期に保菌されるものがある。長期保菌のリスクとして、免疫低下によって症状が再発することがあるが、非チフス性サルモネラでは長期保菌や症状の再発に関する研究は少ない。,若手研究,小区分58020:衛生学および公衆衛生学分野関連:実験系を含む,Salmonella Oranienburg,食中毒,病原因子,ゲノム解析,長期保菌,,,,,,,,,,,,,,,,,,,,,,,,,,,,,,,,,,,,,,,,,,,,,,,,,,,
24K20210,地方独立行政法人 大阪健康安全基盤研究所,松井 啓史,物質群をターゲットにした食品中化学物質の高精度検出法の開発,食品中のターゲットとした化学物質群全体を網羅的に分析可能な手法の開発を目指す。食品中から検出された物質がターゲットとした物質群に包含されるかは、物質群から代表的な物質を選出し検出された物質とのMSスペクトルの類似度を算出して判定する。本研究の遂行により、従来の手法では検出された物質と同一物質の標準品もしくは高度に専門的な技能が必要であったために恒常的に実施することが困難であった、物質群全体を対象とした網羅的な分析をより簡便に実施できることが期待される。,若手研究,小区分58020:衛生学および公衆衛生学分野関連:実験系を含む,食品分析,質量分析,網羅的分析,,,,,,,,,,,,,,,,,,,,,,,,,,,,,,,,,,,,,,,,,,,,,,,,,,,,,
24K20209,国立感染症研究所,上野 みなみ,ターゲットキャプチャー法とロングリードシークエンスによる胃腸炎ウイルス検出法開発,急性感染性胃腸炎はウイルス感染による症例が最も多いが、従来のショートリード型次世代シークエンサー（NGS）では原因ウイルスの検出が困難な症例が多数存在する。本研究では、急性感染性胃腸炎に関連する多様なウイルスに対して、近年出現した最新技術である特定のゲノム領域を選択的に濃縮するターゲットキャプチャー法と、長いDNA断片の解読が可能なロングリード型NGSを用い、従来法では検出できなかったウイルスの検出を行う。,若手研究,小区分58020:衛生学および公衆衛生学分野関連:実験系を含む,胃腸炎ウイルス,ロングリードシークエンス,ターゲットキャプチャー法,,,,,,,,,,,,,,,,,,,,,,,,,,,,,,,,,,,,,,,,,,,,,,,,,,,,,
24K20208,国立感染症研究所,川戸 智,日本で流行するブタインフルエンザウイルスのヒト感染リスクに関する研究,IAV-Sの抗原性の多様性に着目した疫学的研究が世界各地で行われてきた。IAV-Sはしばしば抗原性がヒト季節性IAVとかけ離れており、ワクチン接種や既往感染で獲得された免疫を回避しヒトで流行する恐れが指摘されてきた。しかし、それらのIAV-Sがヒト細胞に感染した際どのような挙動を示すか実際に解析した例はほとんどない。本研究は、IAV-Sがヒト細胞で実際に効率的に増殖できるのか、そして増殖できないとすれば増殖サイクルのどの段階が障壁となっているのかを実験的に検証する。これによって、IAV-Sのパンデミックリスク評価の具体化と精緻化のための基盤情報を提供する。,若手研究,小区分58020:衛生学および公衆衛生学分野関連:実験系を含む,インフルエンザ,ブタインフルエンザ,人畜共通感染症,,,,,,,,,,,,,,,,,,,,,,,,,,,,,,,,,,,,,,,,,,,,,,,,,,,,,
24K20207,国立医薬品食品衛生研究所,新井 沙倉,astA保有細菌の病原性発現機構と汚染実態に関する研究,astA（腸管凝集付着性大腸菌耐熱性エンテロトキシン1；EAST1をコードする遺伝子）単独保有大腸菌（astA保有大腸菌）による集団食中毒事例が多発している。しかし、本菌は多様な食品から高頻度に検出されるため、真に病原性を有するためには特定の条件が必要と考えられる。そこで、EAST1毒素のアミノ酸配列の違いから、毒素活性を評価する。また、付着因子および活性型EAST1の両因子を保有するastA保有細菌の食品や環境での分布を調査することによって、真に注意を払うべき食中毒原因物質を特定する。以上より、下痢原性大腸菌としてのastA保有細菌の病原性発現機構の解明に資する基礎的知見を得る。,若手研究,小区分58020:衛生学および公衆衛生学分野関連:実験系を含む,astA保有細菌,EAST1,毒素活性,集団食中毒,病原性発現機構,,,,,,,,,,,,,,,,,,,,,,,,,,,,,,,,,,,,,,,,,,,,,,,,,,,
24K20206,国立研究開発法人理化学研究所,碓井 喜明,クローン性造血の遺伝要因の評価を通じた関連疾患の解明,クローン性造血は、内的および外的な要因によって生じる体細胞変異によって血液細胞がクローン性に拡大している状態である。クローン性造血は様々な疾患のリスクの上昇と関連するだけでなく、疾患の病態解明や治療層別化のバイオマーカーに繋がることが示されてきている。しかし、内的要因である遺伝要因や外的要因である環境要因による影響は集団において異なった影響を及ぼしうるため、それぞれの集団における評価が重要である。本研究では本邦におけるクローン性造血の遺伝要因を明らかにし、クローン性造血の関連疾患や、様々な疾患の病態を理解する上で重要な知見を得ることを目指す。,若手研究,小区分58020:衛生学および公衆衛生学分野関連:実験系を含む,クローン性造血,遺伝要因,ゲノムワイド関連解析,ゲノム解析,,,,,,,,,,,,,,,,,,,,,,,,,,,,,,,,,,,,,,,,,,,,,,,,,,,,
24K20205,国立医薬品食品衛生研究所,森 葉子,化学物質による気道感覚刺激のin chemico新規評価法の確立,"上気道の神経終末に存在する侵害受容体Transient Receptor Potential Ankyrin1（TRPA1）は、環境中に存在する刺激性物質の検出に関与している。本研究では、化学物質の気道感覚刺激性のハイスループットスクリーニング法の開発を目指し、化学物質の皮膚感作性を評価するペプチド結合性試験（Direct Peptide Reactivity Assay, DPRA）を参考に、化学物質とTRPA1の断片ペプチドとの反応性を評価する試験法（in chemico試験）の構築を行う。",若手研究,小区分58020:衛生学および公衆衛生学分野関連:実験系を含む,DPRA法,ADRA法,気道刺激,TRPA1,,,,,,,,,,,,,,,,,,,,,,,,,,,,,,,,,,,,,,,,,,,,,,,,,,,,
