awardnumber,organization,name,title,abstract,section,review_section,keyword1,keyword2,keyword3,keyword4,keyword5,keyword6,keyword7,keyword8,keyword9,keyword10,keyword11,keyword12,keyword13,keyword14,keyword15,keyword16,keyword17,keyword18,keyword19,keyword20,keyword21,keyword22,keyword23,keyword24,keyword25,keyword26,keyword27,keyword28,keyword29,keyword30,keyword31,keyword32,keyword33,keyword34,keyword35,keyword36,keyword37,keyword38,keyword39,keyword40,keyword41,keyword42,keyword43,keyword44,keyword45,keyword46,keyword47,keyword48,keyword49,keyword50,keyword51,keyword52,keyword53,keyword54,keyword55,keyword56
20J14555,広島大学,久世 雅和,化学振動子に発現する時空間パターンの制御,申請者は、化学振動反応であるBelousov-Zhabotinsky反応を用いる。この反応では、金属触媒が酸化・還元を自発的に繰り返す振動現象が観察できる。直径1 mm前後の陽イオン交換樹脂製ビーズに金属触媒を吸着させて作製した自律振動子は、反応溶液に浸すと多様な振動パターンが観察できる。本研究では、電圧印加または光照射を行い、外的刺激に応答して発現する複雑な時空間パターンを観察する。これにより、自然界に広く見られる同期や履歴などに代表される非線形現象のメカニズムの解明を目指す。,特別研究員奨励費,小区分32020:機能物性化学関連,非線形現象,化学振動反応,Belousov-Zhabotinsky反応,時空間パターン,電圧印加,光照射,,,,,,,,,,,,,,,,,,,,,,,,,,,,,,,,,,,,,,,,,,,,,,,,,,
20J13133,慶應義塾大学,中村 俊太,テトラセン分子ワイヤにおける特異な励起子輸送の発現と高次集積化への展開,本研究では、近接二分子間で一光子吸収から二励起子が生成する光物理過程である一重項分裂 (SF) と分子間を励起子が移動する現象である励起子輸送を組み合わせることによる光機能の発現を目指す。具体的には、SFを進行することができる分子であるテトラセンの一次元的な分子ワイヤを合成し、SFを介した励起子輸送を観測する。そして、分子ワイヤを集積化し、ナノシートを合成することで二次元的な励起子の輸送、最終的にはシートの積層による三次元的な励起子輸送を実現し、光エネルギー変換特性や発光特性を評価する。,特別研究員奨励費,小区分32020:機能物性化学関連,テトラセン,分子ワイヤ,一重項分裂,励起子輸送,,,,,,,,,,,,,,,,,,,,,,,,,,,,,,,,,,,,,,,,,,,,,,,,,,,,
20J12919,東京大学,横森 創,πおよびd電子と水素結合を併せ持つ新規分子性結晶の開発と物性・機能の探索,本研究では、d電子を有する遷移金属原子と硫黄原子を含むπ電子共役系配位子からなる金属ジチオレン錯体に水素結合性置換基を導入することで、固体状態におけるdおよびπ電子と水素結合が関連・相関した物性・機能の開拓を行う。申請者がこれまで合成した/新たに設計・合成する水素結合性金属ジチオレン錯体を用いて新規結晶を作成し、その詳細な結晶構造、物性およびその外場応答性を調査する。それらの実験結果と理論計算を組み合わせて、その起源と詳細なメカニズムを考察・解明することで新たな水素結合―電子相関現象の創出を目指す。,特別研究員奨励費,小区分32020:機能物性化学関連,金属ジチオレン錯体,分子間水素結合,磁性スイッチング,ベイポクロミズム,プロトン－電子相関,傾角反強磁性,水素結合,分子性結晶,電子―プロトン相関,,,,,,,,,,,,,,,,,,,,,,,,,,,,,,,,,,,,,,,,,,,,,,,
20J12125,東北大学,川崎 渉,高密度分子集合体を舞台とする多重機能性材料の創製,有機半導体は、柔軟性・軽量性に優れ、次世代電子デバイスへの応用が注目されている。有機半導体のキャリア移動度は、分子の配列様式に大きく依存するため、その制御にはπ-π相互作用などの弱い分子間力が用いられてきた。本研究では、強い分子間力である「静電相互作用」に着目し、優れたn型半導体特性を示すナフタレンジイミド (NDI) 骨格に、イオン性部位を導入した。イオン性NDI誘導体を用いて、分子同士が強く相互作用した高密度な分子集合体を設計する事で、熱および化学的な安定性の向上と同時に、新機能の付加多重機能性n型有機半導体の開発に取り組む。,特別研究員奨励費,小区分32020:機能物性化学関連,有機半導体,静電相互作用,イオン性結晶,ナフタレンイミド,ゲスト包接,熱安定性,分子集合体,カチオン－アニオン相互作用,ナフタレンジイミド,,,,,,,,,,,,,,,,,,,,,,,,,,,,,,,,,,,,,,,,,,,,,,,
20J11841,大阪大学,池下 雅広,柔軟性遷移金属錯体の異方的分子運動性制御に基づく機能性材料の創成,本研究では、三次元構造をもつ遷移金属錯体の異方的運動性を利用した動的制御可能な機能性材料の開発を行い、三次元的な分子の ”動き” と “構造” から生まれる前例のない新規機能性を追求する。具体的には、面性キラリティーを有する洗濯バサミ型・トング型・渡環型の3種類の金属錯体を用い、その三次元的分子運動に基づく円偏光発光をはじめとした種々の機能性制御を探索する。,特別研究員奨励費,小区分32020:機能物性化学関連,キラリティー,分子ローター,円偏光発光,円二色性,燐光発光,,,,,,,,,,,,,,,,,,,,,,,,,,,,,,,,,,,,,,,,,,,,,,,,,,,
20J11519,熊本大学,秋吉 亮平,動的電子状態に基づく強誘電性金属錯体液晶の創製と分子デバイスへの応用,本研究では、混合原価錯体における電子移動に基づいた強誘電性材料を開発し、分子デバイスへの応用を行う。分子内に酸化数が異なる金属イオンを複数有する混合原子価錯体は、電子が多い金属イオンがドナー、少ない金属イオンがアクセプターとして働き、電子移動の方向にダイポールが生じる。本研究では、混合原子価錯体の電子移動の方向を外部電場により制御することで、金属イオン間の電子移動に立脚した強誘電性を創出する。更に、強誘電体特有の自発分極に基づいて創発する第二次高調波発生（SHG）を介して分極を観測することで、非破壊読み出し可能な高速応答性分子デバイスの開発へと展開していく。,特別研究員奨励費,小区分32020:機能物性化学関連,混合原子価錯体,液晶特性,強誘電特性,,,,,,,,,,,,,,,,,,,,,,,,,,,,,,,,,,,,,,,,,,,,,,,,,,,,,
20J11478,東京大学,福永 健悟,筒状炭化水素と極性回転子からなる外場応答性動的超分子固体の開発,本研究は「筒状炭化水素と極性回転子からなる外場応答性動的超分子固体の開発」と題し，π-π相互作用やCH-π水素結合という弱い相互作用を用いた新たな会合様式に基づく特異な物質設計を行い，弱い相互作用であるがゆえに生じる動的挙動が可能とする新機能の開発を目指すものである．本研究で解決を試みる主要な課題は次の三点である：1.様々な極性ゲストとの会合の解明，2.固体中における動的挙動の解明，3.外場応答性と機能開発．以上の課題を検討し，外場応答性有機固体，特に強誘電性固体材料を開発することを目指す.,特別研究員奨励費,小区分32020:機能物性化学関連,大環状芳香族分子,動的挙動,筒状分子,キラリティ,ガス吸着,多孔質材料,X線回折,,,,,,,,,,,,,,,,,,,,,,,,,,,,,,,,,,,,,,,,,,,,,,,,,
20J11401,九州大学,古賀 大貴,応力感知材料を指向したポルフィセン複合化ポリマーの創成,"機械的刺激によって色の変化を示す「メカノクロミック色素」は、与えた応力を色として可視化できるユニークな材料である。しかし、色素の共有結合切断によって色を変化させるメカノクロミック色素がほとんどであり、その繰り返し利用には熱や光による色素の再結合・再生が必要である。すなわち、弱い応力で可逆的に色調変化する材料は設計が難しい。一方、有機色素""ポルフィセン""は僅かな構造歪みによって発光強度が劇的に変化する珍しい材料である。そこで本研究では、高分子ゴム中に""ポルフィセン""を共重合で導入した“メカノクロミック材料”を新たに合成し、高感度かつ可逆的なメカノクロミック材料を創出する。",特別研究員奨励費,小区分32020:機能物性化学関連,メカノクロミック発光,ポルフィセン,共重合,,,,,,,,,,,,,,,,,,,,,,,,,,,,,,,,,,,,,,,,,,,,,,,,,,,,,
21J15902,熊本大学,福田 将大,酸化グラフェンから創製する機能性ダイヤモンドの開発,ダイヤモンドは窒素やホウ素、リンをドーピングすることにより、半導体特性、超伝導特性を示すことが知られている。これら物性の発現にはドーパントの制御が必要不可欠である。本研究では、ドープダイヤモンドの炭素材料として、酸化グラフェン（GO）に着目した。添加剤を加え還元した酸化グラフェン還元体（rGO）は、酸素官能基のほとんどが脱離し、添加剤由来の原子をドープすることが可能である。また、GOは高い化学反応性を有し、ホウ素やリンをはじめハロゲンなどもドープすることができる。したがって本研究では、GO及び様々な方法で還元しをドープしたrGOナノシートを原料とした機能性ダイヤモンドの開発を目指す。,特別研究員奨励費,小区分32020:機能物性化学関連,酸化グラフェン,ダイヤモンド,,,,,,,,,,,,,,,,,,,,,,,,,,,,,,,,,,,,,,,,,,,,,,,,,,,,,,
21J14883,奈良先端科学技術大学院大学,吉田 裕斗,不斉機能点を有するAgナノクラスターの開発,本研究では、分子レベルの構造精密性を有する機能特異点を表面に提示した銀ナノクラスター(Ag NC)の創成を目的とする。具体的には、銀原子が29個から構成されるAg29 NC 外殻を構成するAg(SRS)3 ユニットを基盤とした機能点設計を行う。分子(キラル)認識、触媒、配位空間の3 つの機能化に取り組み、その多彩な機能化の可能性を実証する。,特別研究員奨励費,小区分32020:機能物性化学関連,ナノクラスター,錯体,,,,,,,,,,,,,,,,,,,,,,,,,,,,,,,,,,,,,,,,,,,,,,,,,,,,,,
21J14099,東京大学,田中 裕介,新奇円偏光発光性分子の探索と機能開発,円偏光発光(CPL)とはキラルな分子から左右円偏光どちらかに偏った発光を示す現象である。CPLを示す分子は、“見える”「発光性」と“見えない”「円偏光 」という性質を活かして、セキュリティインクや3Dディスプレイ、バイオイメージングなどの幅広い応用が期待されているが、未だ実用化に十分なものが開発されていない。本研究では、理論化学に基づき分子設計を行い、実験化学や分光学、活性評価によるフィードバックを通して分子構造とCPLの関係を明らかにすることで、新奇CPL(円偏光発光)を示す有機小分子分子探索研究のプラットフォームの確立を目指す。,特別研究員奨励費,小区分32020:機能物性化学関連,CPL,円偏光発光,共役系,キラル,らせん,,,,,,,,,,,,,,,,,,,,,,,,,,,,,,,,,,,,,,,,,,,,,,,,,,,
21J13049,九州大学,西村 亘生,光励起三重項を活用した水の超核偏極化による新規高感度NMR技術の創出,本研究では、特定の色素が光照射によって過渡的な高偏極電子スピンを生じることに着目し、この偏極を核スピンへと移行する技術（triplet-DNP）を利用して核磁気共鳴（NMR）の検出感度改善を試みる。第一に、従来は固体系でのみ実施されてきたtriplet-DNPを溶液系へと拡張し、室温での水の高偏極化を試みる。次に、この高偏極化した水を連続的にNMR分光器へ供給するシステムを構築し、プロトン交換を介して多様な分子の永続的高偏極化を達成することで、triplet-DNPによる新たな高感度NMR測定法の確立を目指す。,特別研究員奨励費,小区分32020:機能物性化学関連,動的核偏極,動的電子偏極,NMR,ESR,光励起三重項,オーバーハウザー効果,安定有機ラジカル,ナノ粒子,,,,,,,,,,,,,,,,,,,,,,,,,,,,,,,,,,,,,,,,,,,,,,,,
21J12056,神戸大学,角谷 凌,外部刺激で可逆な構造・物性転換を起こす金属錯体系イオン液体高分子の開発,本研究では、光反応によるサンドイッチ型ルテニウム錯体の配位構造転換を応用して、(1) 外場によるイオン伝導度制御、(2) 物質吸脱着、および (3) 自己修復を示すソフトマターを開発する。さらに、異種金属錯体を組み合わせることにより、(4) 発光性・色調・磁性の制御を実現する。系の基本骨格として、ルテニウム錯体を組み込んだイオン液体を用いる。このイオン液体の重合、または配位性モノマーとの共重合によって、光や熱などの外部刺激による架橋構造の可逆形成を起こすポリイオン液体を合成し、各種の機能発現をはかる。,特別研究員奨励費,小区分32020:機能物性化学関連,有機金属錯体,イオン液体,相挙動,ローテーター相,単結晶ー単結晶反応,光反応,イオン伝導度,ゲル,,,,,,,,,,,,,,,,,,,,,,,,,,,,,,,,,,,,,,,,,,,,,,,,
21J11055,九州大学,矢野 喜男,ニオイ分子を選別・視覚認知できる人工嗅覚受容体の創製,感性として表現される「ニオイ」を物理量、化学量など科学的に定量、定性できる量としてその定義法は未だ確立されていない。そこで本研究では、感性として表現されるニオイを可視化し視覚情報で識別可能とする光学ニオイセンサの開発を目指す。具体的にはニオイ分子との相互作用によって分子のコンフォメーション変化に起因した呈色・発光色変化を示す有機色素（人工嗅覚受容体）の網羅的な合成に取り組む。多種多様な人工嗅覚受容体の分子認識能・光学機能を駆使したニオイ分子の選別・視覚化を可能とするセンサを創製する。,特別研究員奨励費,小区分32020:機能物性化学関連,ニオイセンサ,固体発光材料,分子認識,ナフタレンジイミド,,,,,,,,,,,,,,,,,,,,,,,,,,,,,,,,,,,,,,,,,,,,,,,,,,,,
21J10011,慶應義塾大学,冨崎 真衣,ダイヤモンド電極による二酸化炭素の有用物質への電気化学的変換,豊富な炭素資源である二酸化炭素を電気化学的に還元することにより、資源となり得る有用物質を生成することができる。メタルフリーで、高耐久なダイヤモンド電極は魅力的な電極材料であり、これまでに多くの工業分野で使われるギ酸を効率的に生成できている。電解液の特殊化(二酸化炭素の微細気泡化)や電極材料の改質(電極への異なる元素のドープ)を行うことで、より低い印加電位で、より価値の高い化合物(一酸化炭素やエタノールなど) を生成することを目指す。,特別研究員奨励費,小区分32020:機能物性化学関連,二酸化炭素の電解還元,ダイヤモンド電極,ファインバブル,微細気泡,電気化学,,,,,,,,,,,,,,,,,,,,,,,,,,,,,,,,,,,,,,,,,,,,,,,,,,,
21F51031,九州大学,楊井 伸浩,超低励起光強度での高効率なフォトン・アップコンバージョンの実現,,特別研究員奨励費,小区分32020:機能物性化学関連,,,,,,,,,,,,,,,,,,,,,,,,,,,,,,,,,,,,,,,,,,,,,,,,,,,,,,,,
21F21764,国立研究開発法人物質・材料研究機構,Labuta Jan,生物医学及びセンシングアプリケーション向け刺激応答性ポルフィリンポリマーシステム,,特別研究員奨励費,小区分32020:機能物性化学関連,,,,,,,,,,,,,,,,,,,,,,,,,,,,,,,,,,,,,,,,,,,,,,,,,,,,,,,,
21F21031,九州大学,楊井 伸浩,超低励起光強度での高効率なフォトン・アップコンバージョンの実現,,特別研究員奨励費,小区分32020:機能物性化学関連,,,,,,,,,,,,,,,,,,,,,,,,,,,,,,,,,,,,,,,,,,,,,,,,,,,,,,,,
22KJ3238,国立研究開発法人理化学研究所,田中 慶大,対称ビスカルベンを用いた規則正しく配列するランタノイド単分子磁石の表面上での合成,単分子磁石は超高密度記録媒体としての応用が期待されているが、表面上で単分子（原子）が磁気メモリ効果を示す最高温度はマイナス２４３℃程度にとどまっており、さらに、分子の向きをそろえて表面上に単分子磁石を並べることは難しい。本研究では、表面上での化学反応により、整列した単分子磁石を構築し、報告されているよりも高い温度での磁気メモリ効果の検出を目指す。,特別研究員奨励費,小区分32020:機能物性化学関連,単分子磁石,カルベン,,,,,,,,,,,,,,,,,,,,,,,,,,,,,,,,,,,,,,,,,,,,,,,,,,,,,,
22KJ3097,分子科学研究所,水野 麻人,発光性有機ラジカルのキラル集積構造と光磁気相関,発光性有機ラジカルは、閉殻分子とは異なる特異な光物性を示すことから近年注目を集めているが、対象物質が限定的であったことから、そのキラリティ及び磁場と発光特性の関係、つまり円偏光発光の基本的性質はほとんど明らかにされていない。本研究では、発光性有機ラジカルをキラル集積化し、その集積構造が円偏光発光特性に与える影響を明らかにする。更に、集積構造に依存したスピン状態や外部磁場に依る円偏光発光特性の制御・基礎原理解明を目指す。,特別研究員奨励費,小区分32020:機能物性化学関連,ラジカル,キラリティ,発光,磁性,集積構造,,,,,,,,,,,,,,,,,,,,,,,,,,,,,,,,,,,,,,,,,,,,,,,,,,,
22KJ3058,関西学院大学,久保 直輝,量子ドット-有機分子配列構造に基づく新規光捕集系の構築,量子ドットは、優れた光捕集能を有するため、太陽電池などの光電子デバイス材料として非常に魅力的である。しかし、デバイスで重要となる固体状態では、光捕集によって生成した励起子は拡散中に消滅し、材料としての性能が低下してしまう。本研究では、量子ドットの層と有機分子集合体の層がナノメートルレベルで交互に並んだ配列構造を構築することで、量子ドット層で生成した励起子が消滅する前に、有機分子層へ高効率にエネルギー移動・電子移動させることを狙う。さらには、有機分子層に取り出した電子の移動度についても知見を得ることで、高性能な光電子デバイス材料への指針を得る。,特別研究員奨励費,小区分32020:機能物性化学関連,量子ドット,超分子集合体,自己集合,エネルギー移動,電子移動,有機無機ハイブリッド,,,,,,,,,,,,,,,,,,,,,,,,,,,,,,,,,,,,,,,,,,,,,,,,,,
22KJ3033,立命館大学,吉岡 大祐,短寿命励起状態を高活用できる有機無機ナノ複合体の創成,有機分子の高励起状態は高い還元力を有しており、可視、近赤外光の照射や低電圧の印加によって容易に生成することができるため様々な分野で注目を浴びている。しかし、このように作り出された有機分子の高励起状態の寿命は極めて短く、触媒反応などの分子間反応に用いるには効率的ではない。本研究では、高励起状態の電子を無機ナノ結晶によって効率的に取り出し長寿命化することを目指す。また、抽出した電子を積極的に用いるための材料設計を検討し、一般的な分子系へと拡張する。,特別研究員奨励費,小区分32020:機能物性化学関連,半導体ナノ結晶,配位子,時間分解分光,電子移動,ペリレンビスイミド,電荷分離,過渡吸収,配位子脱離,,,,,,,,,,,,,,,,,,,,,,,,,,,,,,,,,,,,,,,,,,,,,,,,
22KJ2723,慶應義塾大学,小島 知也,シグナル伝達に伴うベシクル型人工細胞組織の集団的な挙動発現,本研究では、実際の生物でみられる「細胞、組織、器官、個体」という階層性に対し、人工細胞を用いて模倣する。すなわち、1. 人工細胞同士を密着・組織化させる、2. 人工細胞間でシグナル伝達させる、3. 組織としての集団的な動きを発現させる、という3段階を経て、細胞が組織を形成し動きを発現するまでの過程を人工細胞によって再現し、生物における階層性について分子の観点に立った化学的視点から明らかにする。,特別研究員奨励費,小区分32020:機能物性化学関連,ベシクル,人工細胞,人工組織,,,,,,,,,,,,,,,,,,,,,,,,,,,,,,,,,,,,,,,,,,,,,,,,,,,,,
22KJ2624,大阪公立大学,濱谷 将太,6π電子系結晶高速フォトクロミック分子の基盤構築と応用開拓,本研究の目的は、6π電子系結晶高速フォトクロミック分子の基盤構築と応用開拓である。6π電子環状反応を示すフォトクロミック化合物に焦点を当てている。まず初めに、結晶中における熱戻り反応速度の制御を目指す。様々な誘導体の合成、特性評価を行い、結晶状態の熱戻り反応速度に与える因子を明らかにする。また、結晶状態における高速T型逆フォトクロミズムを示す分子設計指針を確立し、6π電子系結晶高速フォトクロミック分子の学術基盤を構築する。更なる応用展開として、単一光照射による高速なフォトメカニカル応答の実現を目指す。光照射条件・熱戻り反応性等を検討し、高速フォトメカニカル機能の設計指針を確立する。,特別研究員奨励費,小区分32020:機能物性化学関連,フォトクロミズム,ジアリールベンゼン,ジアリールエテン,量子化学計算,熱戻り反応,Woodward Hoffmann則,6π電子環状反応,,,,,,,,,,,,,,,,,,,,,,,,,,,,,,,,,,,,,,,,,,,,,,,,,
22KJ2478,九州大学,濱地 智之,高感度MRI技術の創出に向けた光励起三重項による生体分子プローブの超核偏極,動的核偏極法(DNP)は、電子スピンの偏極状態を核スピンへ移行することでNMRやMRIの感度を向上させる技術である。特に、光励起三重項電子スピンを用いた動的核偏極法(triplet-DNP)は、高温かつ低磁場でNMRやMRIの感度を向上させることができる。triplet-DNPのターゲットとして、ピルビン酸はその代謝が様々な疾患と関連しているため、その13C核スピンを偏極し、高感度な13CMRIを観測することができれば、様々な医療機関で迅速な診断を行うことができると期待されている。そこで本研究ではtriplet-DNPによってピルビン酸の13C核を高偏極化し、生体内高感度MRIの実現を目指す。,特別研究員奨励費,小区分32020:機能物性化学関連,動的核偏極(DNP),核磁気共鳴(NMR),磁気共鳴イメージング(MRI),三重項電子,電子スピン共鳴(ESR),超分子化学,,,,,,,,,,,,,,,,,,,,,,,,,,,,,,,,,,,,,,,,,,,,,,,,,,
22KJ2393,九州大学,原田 直幸,励起エネルギー準位制御と長寿命化戦略に基づく高効率アップコンバージョン材料の創出,フォトン・アップコンバージョンは光エネルギーを有効に活用するための戦略の一つであり、光触媒や太陽電池における光変換効率の向上や生体イメージング技術への応用が可能である。これまでに溶液系として高効率なアップコンバージョン材料が多く研究されてきたが、応用化には固体系材料の開発が必要である。本研究では、新規色素の探索や分子性材料の設計を行うことで、溶液系の発光特性を向上させるとともにフィルムや結晶状態においても高効率な発光を示すアップコンバージョン材料の開発を目指す。,特別研究員奨励費,小区分32020:機能物性化学関連,フォトン・アップコンバージョン,三重項状態,可視光,紫外光,低励起光強度,多孔質フィルム,ナフタレン誘導体,紫外発光体,,,,,,,,,,,,,,,,,,,,,,,,,,,,,,,,,,,,,,,,,,,,,,,,
