awardnumber,organization,name,title,abstract,section,review_section,keyword1,keyword2,keyword3,keyword4,keyword5,keyword6,keyword7,keyword8,keyword9,keyword10,keyword11,keyword12,keyword13,keyword14,keyword15,keyword16,keyword17,keyword18,keyword19,keyword20,keyword21,keyword22,keyword23,keyword24,keyword25,keyword26,keyword27,keyword28,keyword29,keyword30,keyword31,keyword32,keyword33,keyword34,keyword35,keyword36,keyword37,keyword38,keyword39,keyword40,keyword41,keyword42,keyword43,keyword44,keyword45,keyword46,keyword47,keyword48,keyword49,keyword50,keyword51,keyword52,keyword53,keyword54,keyword55,keyword56
18F18341,京都大学,若宮 淳志,ペロブスカイト光電デバイスの高性能化のための有機半導体材料開発,本研究では、優れた光電変換材料およびそれを用いたデバイスの開発を目指し、ペロブスカイト半導体材料を用いた高発光性材料の開発に取り組んだ。,特別研究員奨励費,小区分32020:機能物性化学関連,発光性材料,ペロブスカイト半導体,ホスト材料,アントラセン,,,,,,,,,,,,,,,,,,,,,,,,,,,,,,,,,,,,,,,,,,,,,,,,,,,,
19J23719,山口大学,志賀 美咲,分子単結晶における傾斜構造の実現と機能創出,物理的性質が異なる二つの化合物が、固体中で連続的にグラデーション様変化した傾斜構造は生体内や自然界では多く存在している。材料科学分野においてこれまで、傾斜構造によって興味深い機能が見出されている。いずれも、蒸着や化学気相成長で構造を傾斜制御しているが、分子結晶ではボルツマン分布で混合用が支配されるため組成や構造を固定することが困難になる。本提案では、分子性単結晶では実現できていない「傾斜構造」を実現することで、機能性分子性固体における新領域の開拓を目指す。,特別研究員奨励費,小区分32020:機能物性化学関連,分子結晶,,,,,,,,,,,,,,,,,,,,,,,,,,,,,,,,,,,,,,,,,,,,,,,,,,,,,,,
19J23143,青山学院大学,徳永 彩子,可視光駆動型非線形応答フォトクロミック分子の開発,可視光に応答するフォトクロミック分子は、有機分子や生体組織にダメージを与える紫外光を用いずに、構造、極性、スピン状態を切り替えることができる魅力的な分子である。光照射により有色ラジカルを生成するヘキサアリールビイミダゾール（HABI）を基盤とした逆フォトクロミック分子は、可視光照射によって無色に変化し、室温において数秒から数分かけて速やかに元に戻る。本研究では、HABI型逆フォトクロミック分子の赤色光感度の増大と熱戻り反応の高速化（数秒以内）の両方を同時に実現する分子設計指針の確立を目指す。また、低強度の赤色連続光照射によって非線形的に応答するバイフォトクロミック分子の創出と機能開拓を試みる。,特別研究員奨励費,小区分32020:機能物性化学関連,フォトクロミズム,三重項ー三重項消滅,レーザーフラッシュフォトリシス,ビラジカル,三重項－三重項消滅,,,,,,,,,,,,,,,,,,,,,,,,,,,,,,,,,,,,,,,,,,,,,,,,,,,
19J22034,京都大学,山角 拓也,柔軟な発光団に基づく高輝度張力プローブの開発と分子解像度の応力解析への展開,メカノフォア（力に応答して化学的な構造変化を示す分子骨格）は、高分子材料にかかる力を分子レベルで解明する新技術へ応用できると期待されている。当研究室で開発した柔軟な発光団であるFLAPは蛍光メカノフォアとして利用可能であり、ポリウレタンへ導入することで延伸に伴って蛍光色変化が観測される。本研究では、高分子鎖1本1本に掛かる力といったナノレベルでの解析を実現するため、単一分子蛍光測定に向けた耐光性FLAPの合成に取り組む。合成したFLAPを用いて高い時空間分解能での応力分布を可視化することができれば、より強靭な材料を設計するための化学構造を提案するための手掛かりとなることが期待される。,特別研究員奨励費,小区分32020:機能物性化学関連,蛍光分子,張力プローブ,ゲル,メカノフォア,高分子,ポリウレタン,レオロジー,可視化技術,二重蛍光,ピレン,光機能分子,,,,,,,,,,,,,,,,,,,,,,,,,,,,,,,,,,,,,,,,,,,,,
19J21926,東京大学,猪俣 祐貴,ペプチド-金属の自己集合に基づく絡まりを伴う機能性球殻構造の構築,ペプチド・金属の自己集合系において、ペプチド鎖同士の絡まりを伴う自己集合挙動を利用してウイルスのような巨大球殻状構造を構築し、分子の閉じ込め効果や酵素のような活性中心を有する球殻状構造の化学的構築へ発展させる。,特別研究員奨励費,小区分32020:機能物性化学関連,ペプチド,フォールディング,絡まり,自己集合,結び目,カプセル,配位結合,ゲスト包接,,,,,,,,,,,,,,,,,,,,,,,,,,,,,,,,,,,,,,,,,,,,,,,,
19J21421,九州大学,藤原 才也,生体分子の直接高偏極化を可能にする核偏極貯蔵空間の開発,triplet-DNPは、特定の有機分子を光励起し、項間交差により三重項電子に出現するスピンの偏極（向きの偏り）を核スピンへと移行することで、NMRやMRIの感度を室温で飛躍的に向上させる技術である。しかしその研究は、未だ有機結晶やガラス等の基礎的な媒体の高核偏極化に止まっており、媒体から観測したい分子への偏極移行に関しては、ごく数例しか報告が為されていない。本研究では、triplet-DNPを多孔質材料である有機金属錯体（MOF）へと新たに展開し、MRI 技術と結びつける。構成分子から内部空間の機能や性質を自在に設計可能なMOFを用い、核偏極の貯蔵と移行、そして高感度MRIへの応用を目指す。,特別研究員奨励費,小区分32020:機能物性化学関連,三重項電子,動的核偏極（DNP）,金属有機構造体（MOF）,核磁気共鳴（NMR）,磁気共鳴イメージング（MRI）,,,,,,,,,,,,,,,,,,,,,,,,,,,,,,,,,,,,,,,,,,,,,,,,,,,
19J21186,東京工業大学,一色 裕次,単分子接合の高速IV計測による吸着分子の表面ダイナミックスの解明,本研究では世界最高の時間分解能（マイクロ秒）を有する単分子接合の電子状態計測装置を新たに構築する。開発する装置では、超高真空極低温から室温大気中までの様々な環境において、単分子接合を作製し、その場でI-V 計測を行えるようにする。電極を動かした距離から金属―分子間距離、I-V から電子状態と界面構造を決定し、単分子接合の構造、電子状態を一度に全部評価し、その時間発展を決定する。実験では、単分子接合の寿命以下の短い時間以内(ミリ秒)に、同一の単分子接合の電極間距離を段階的かつ連続的に増加させ、単分子接合の形成から接合破断までの過程を調べる。,特別研究員奨励費,小区分32020:機能物性化学関連,単分子接合,電流電圧特性,表面物性,電気伝導度計測,走査型トンネル電子顕微鏡,界面,表面吸着,化学反応,システム開発,,,,,,,,,,,,,,,,,,,,,,,,,,,,,,,,,,,,,,,,,,,,,,,
19J20605,東京工業大学,原島 崇徳,光応答性を有する三端子DNAを用いた単一分子トランジスタの創案と開発,本研究では、単一分子スケールで三端子構造を実現できる3'-5'型DNA単分子接合に基づく単分子トランジスタの開発を目的とした。三端子構造を有する単分子デバイスは、二端子系では実現できない幅広い機能を有する単分子素子の開発を可能とする。電極に架橋させるDNAの構造設計により電極と独立な三端子目をDNA分子内に設置する。この三端子目を、光化学を用いて制御することによって、電界効果に基づく光ゲート機能を発現させる。本研究では、素子となるDNAの合成から、光ゲート機能の立証のための光学系の設計及び計測を行い、これまで実現不可能であった、トランジスタ機能を有する超微小分子デバイスを開発することを目指す。,特別研究員奨励費,小区分32020:機能物性化学関連,DNA,分子デバイス,単分子,ナノテクノロジー,πスタッキング,トランジスタ,単一分子,走査型トンネル顕微鏡,分子探針,,,,,,,,,,,,,,,,,,,,,,,,,,,,,,,,,,,,,,,,,,,,,,,
19J15565,名古屋大学,殿内 大輝,可塑性を有する有機導電体の構築と直交経路スイッチング機能素子及び集積回路の研究,ダイオードやトランジスタ特性を持つ能動素子の研究の中でも、本研究の系は、直交する経路のスイッチングを行える素子となっており、これまでにない素子間配線や能動素子としての働きが期待される。さらに、これをナノレベルの単一分子素子としての実現を目指し、分子設計から始まり、機能評価のための計測制御、素子電極間及び、素子間接続の開発・改良、そして協働して機能を発現するためのシステム設計などの一連の研究を横断的に行う。,特別研究員奨励費,小区分32020:機能物性化学関連,機能性材料,機能性素子,電子物性,スイッチング,相転移,,,,,,,,,,,,,,,,,,,,,,,,,,,,,,,,,,,,,,,,,,,,,,,,,,,
19J15268,京都大学,張 婉瑩,高度に配向・配列制御した共役分子骨格の一次元集積化と機能性液晶材料への展開,発光性・電気伝導性などの機能を有する材料は有機化合物を用いることで、目的に応じて分子レベルで設計することができ、望みの機能を得るための微調整が可能となる。本研究では、光・電子機能を示す有機材料、特に流動性と秩序性を兼ね備えた液晶材料を対象とし、適切な共役分子骨格に対し、大きな双極子を有する官能基や親・疎水鎖を導入する独自の設計を適用する。これにより、得られた材料中では、自己組織的に分子骨格が配列・配向することが期待され、卓越した光・電子機能が発現することを目指している。凝集誘起発光現象に着目した高効率発光性液晶の開発や、高秩序な二成分混合分子系を構築し、高効率光電変換機能へと結びつける。,特別研究員奨励費,小区分32020:機能物性化学関連,励起状態水素移動,蛍光液晶材料,増幅自然放出光,,,,,,,,,,,,,,,,,,,,,,,,,,,,,,,,,,,,,,,,,,,,,,,,,,,,,
19J14059,総合研究大学院大学,白男川 貴史,第一原理に基づく光機能性色素集合体の理論設計法の開発と応用,本研究課題では、第一原理に基づく光機能性色素集合体の理論的設計法を確立し、新奇光分子材料の開発を加速することを目的とする。具体的には、基盤となる（1）高速かつ高精度な色素集合体の光学物性の計算法を開発し、（2）非経験的な色素集合体の設計法の開発、（3）光学物性の解析法の開発と改良指針への応用に取り組む。さらに、大規模複雑分子系モデリング手法を用いてこれらの方法論の適用範囲を広げ、機能分子システムの設計を目指す。,特別研究員奨励費,小区分32020:機能物性化学関連,理論設計法,逆設計,光物性,励起状態,プラズモン,金属ナノ構造体,多孔性結晶,擬不均一触媒反応,光機能性分子系,分子集合体,励起子,光吸収,円二色性,,,,,,,,,,,,,,,,,,,,,,,,,,,,,,,,,,,,,,,,,,,
19J11523,熊本大学,首藤 雄大,極性場を利用した二次元ハイブリッドメモリ材料の研究,二次元材料はシート表面の電荷による静電的相互作用を利用することで層間に種々のイオンや機能性分子を導入した複合物質を容易に再構築できる。このようにして得られる層状物質は、シート本来の機能に加えて、層間分子の機能を取り込んだ多機能性ナノ材料や、層間分子によるシートの機能の制御など優れた利点を持つ。しかし従来のインターカレーション反応ではアルカリ金属やアルキル長鎖分子で層状体を形成している。そこで本申請では異なるナノシートを利用することで、シート由来の複数の物性を示し、界面で強い相互作用を有する新たな多機能性層状物質の合成を試みる。また界面の結合・電子状態を明らかにし、新規物性の発現を目指す。,特別研究員奨励費,小区分32020:機能物性化学関連,酸化グラフェン,水酸化ニッケル,磁性,ナノシート,,,,,,,,,,,,,,,,,,,,,,,,,,,,,,,,,,,,,,,,,,,,,,,,,,,,
19J11159,長崎大学,諸岡 哲朗,アメーバ型分子ロボットを目指した水中の金電極上における油滴の並進運動機構の開発,本研究で開発するのは、水中で自在に這動や変形するマイクロメートルサイズの分子ロボットである。その実現は、医療、環境モニタ、資源回収に革新をもたらす。アメーバ型分子ロボットのプロトタイプとして、方向性を持って長距離を這動する油滴を創出することを目標とする。具体的には、油滴が酸化還元反応によって駆動されて、電極上で繰り返し並進運動する機構の開発を目指し、油滴と水との界面に局在して自己集合膜を形成する酸化還元活性な界面活性剤を新規に合成し、自己集合膜の凝縮相の生成・消滅過程を駆動力とする研究である。,特別研究員奨励費,小区分32020:機能物性化学関連,両親媒性分子,自己集合膜,電位駆動,エレクトロウェッティング,表面増強赤外分光測定,単結晶金電極,接触角,ビオロゲン,,,,,,,,,,,,,,,,,,,,,,,,,,,,,,,,,,,,,,,,,,,,,,,,
19J01990,名古屋大学,横倉 聖也,光誘起分極電流で駆動する光電変換素子,本研究では，有機絶縁体の分極を利用した超高速光情報変換へ応用可能な光電変換素子開発を目指す．まず，2つの電極をI層で絶縁したMISIMセルを用いて，キャリア注入無しで駆動する光電変換を試みる．これによりキャリア注入が不要で，I層の分極変化により駆動する光電変換が初めて実現する．さらに，分極誘起の対象を絶縁体とし，光によって直接I層の分極変化を誘起し電流を得る機構により高速光電変換を目指す．また，近赤外光を吸収する分子及び結晶からなる誘電体を設計，開発し，それらの薄膜の配向制御を行うことで，分極変化によってのみ動作するする光電変換を実現し，光情報通信に応用を目指す,特別研究員奨励費,小区分32020:機能物性化学関連,有機エレクトロニクス,分極,光電変換,界面分極,,,,,,,,,,,,,,,,,,,,,,,,,,,,,,,,,,,,,,,,,,,,,,,,,,,,
19F19756,北海道大学,八木 一三,PEMFCにおける酸素還元反応のための白金族金属合金ナノ構造の電極触媒作用,,特別研究員奨励費,小区分32020:機能物性化学関連,,,,,,,,,,,,,,,,,,,,,,,,,,,,,,,,,,,,,,,,,,,,,,,,,,,,,,,,
19F19345,京都大学,関 修平,励起状態芳香族性反転を示す拡張ポルフィリノイド類の構築とその光物理化学過程の解明,本研究「励起状態芳香族性反転を示す拡張ポルフィリノイド類の構築とその光物理化学過程の解明」では、環拡張ポルフィノイド分子が特に光励起状態において、芳香族性の反転を引き起こすことを検証の対象とし、励起状態電子構造・電子移動過程・電荷分離状態における電荷輸送・定常－励起状態―伝電荷輸送状態の直接観察、の順に研究を進める。芳香族性反転が過渡的な電子状態だけでなく、これをもとにした巨視的電子物性に与える影響について、共役分子の構造変調と電荷輸送特性の直接観測により、すべて実験的に明らかとし、超高速応答が可能な有機固体電子素子へと展開するための基礎的な知見集約が本研究の将来像である。,特別研究員奨励費,小区分32020:機能物性化学関連,ポルフィリン,ポルフィノイド,π-πスタック,芳香族性,芳香族性反転,伝導度,ラジカル,TTF,,,,,,,,,,,,,,,,,,,,,,,,,,,,,,,,,,,,,,,,,,,,,,,,
19F19342,奈良先端科学技術大学院大学,河合 壯,重励起子間相互作用による増強TADF分子の開発と円偏光発光OLEDへの展開,Efficient materials will be explored based on synthetic organic chemistry and physico-chemical evaluation on materials properties.  Present research will be conducted to simultaneously achieve (i) high the triplet excitons EQE (External Quantum Efficiency) (ii) high CPL g-value via the supramolecular approach.,特別研究員奨励費,小区分32020:機能物性化学関連,CPL,fluorescence,oxygene,excitons,TADF,OLED,,,,,,,,,,,,,,,,,,,,,,,,,,,,,,,,,,,,,,,,,,,,,,,,,,
19F19333,慶應義塾大学,栄長 泰明,ダイヤモンド電極を利用した新規電気化学発光システムの構築,ダイヤモンド電極は活性化学種を効率的に生成できるため、新規な反応開拓が期待できる。本研究では、この特徴を生かした新規な反応系を利用した電気化学発光システムの開拓を行うとともに、そのシステムを利用した免疫測定装置等への応用展開を目指す。,特別研究員奨励費,小区分32020:機能物性化学関連,電気化学発光,ダイヤモンド電極,,,,,,,,,,,,,,,,,,,,,,,,,,,,,,,,,,,,,,,,,,,,,,,,,,,,,,
19F19042,信州大学,堂免 一成,高性能光触媒の実現を目指した反応機構の解明,酸窒化物，窒化物，酸硫化物等の非酸化物半導体粉末材料は可視光を強く吸収するため，太陽光水分解反応による水素エネルギー製造への応用に好適である．しかし，これらの材料は高温で合成されるために，性能低下の原因となる欠陥の密度が高くなりやすい．太陽エネルギーを利用してクリーンな水素を高効率に製造する粉末光触媒を開発するには，欠陥における光励起キャリアの挙動を理解し，制御していく必要がある．本研究では光触媒材料合成に取り組む一方で，時間分解分光法を用いて欠陥準位の密度や深さを明らかにし，光励起キャリアの動きに基づいて，最先端の微粒子半導体光触媒の活性化に有効な合成法や後処理法を開発する．,特別研究員奨励費,小区分32020:機能物性化学関連,粉末光触媒,過渡吸収分光,キャリアダイナミクス,助触媒,窒化物,セレン化物,Zスキーム,光触媒シート,,,,,,,,,,,,,,,,,,,,,,,,,,,,,,,,,,,,,,,,,,,,,,,,
20J23539,奈良先端科学技術大学院大学,米澤 俊平,力学機能を有する超分子システムの構築,高圧化の分子集合体は高圧縮・高エネルギー状態であり、除圧により可逆的に安定状態へと戻る。常圧でもこの高エネルギー状態を保持することで、力学的、化学的エネルギーとして利用可能となる。本研究では圧力ストレスに応答し準不可逆的に機械的強度を変化させ、さらに外部刺激により圧力エネルギーを貯蔵・放出可能な超分子システムの構築を目的とする。多様な強度・エネルギーの水素結合形成が可能な両親媒性糖誘導体を基本骨格にヒドロゲル化剤を合成し、力学応答ヒステリシスを獲得し、加圧化の分子集合状態の準安定化を図る。さらに、可逆的な共有結合形成が可能な光反応性部位を導入することで高圧縮・高エネルギー状態の開放を検討する。,特別研究員奨励費,小区分32020:機能物性化学関連,静水圧,電荷移動錯体,超分子,ハイドロゲル,圧力化学,アントラセン,キラリティー,キラル増幅,プロキラル,共集合,,,,,,,,,,,,,,,,,,,,,,,,,,,,,,,,,,,,,,,,,,,,,,
20J20968,北海道大学,林 峻大,光エネルギー集約場が織りなす異方的長距離電荷輸送系の開拓,金属ナノ粒子は可視光と共鳴し自由電子の集団振動であるプラズモンを発現する。この際、ナノ粒子近傍に配置した分子励起子とプラズモンが互いに強く相互作用しあう強結合状態下では、励起子ポラリトンと呼ばれる特異な励起状態が形成する。励起子ポラリトンは通常の励起子の数千倍に及ぶ長距離伝播を起こすため、高効率な光電変換系の創出に繋がると期待される。本研究では、金属ナノ粒子を異方的に配列した金属Lattice構造体を用いることで、励起子ポラリトンのエネルギーの伝播方向を制御する手法を確立する。その上で本系を用いた光電変換系の構築し、励起子ポラリトンのエネルギーを高効率に外部へ取り出す手法を創出する。,特別研究員奨励費,小区分32020:機能物性化学関連,励起子ポラリトン,強結合,格子プラズモン,電気化学,電気化学電位制御,,,,,,,,,,,,,,,,,,,,,,,,,,,,,,,,,,,,,,,,,,,,,,,,,,,
20J20661,東京工業大学,小林 柊司,電気伝導特性とSERSの同時計測による単分子化学反応の解明,本研究の目的は、金属間に分子1つを架橋した単分子接合を利用することによって、従来は多数分子の観測によって研究されていた化学反応の過程を単分子のスケールで明らかにすることである。本研究では、単分子接合に対し電気伝導度の計測と分光計測を同時に行い、化学反応を単分子接合上で引き起こし、化学反応の過程の途中にある単分子接合の状態を観測し続けることによって、単分子のスケールで化学反応の過程を明らかにすることを試みる。,特別研究員奨励費,小区分32020:機能物性化学関連,単分子接合,表面増強ラマン散乱,酸化還元反応,表面・界面,分光計測,電気伝導度計測,ラマン散乱,,,,,,,,,,,,,,,,,,,,,,,,,,,,,,,,,,,,,,,,,,,,,,,,,
20J15238,大阪市立大学,加藤 賢,ペンタセン－ラジカル連結系の半導体特性と電流検出磁気共鳴による素子評価,電界効果トランジスタ（FET）を用いた電界注入キャリアの伝導機構やその分子間での広がりが電子スピン共鳴（ESR）法で調べられているが、FETによって注入されるキャリア量は非常に少ないため、ラジカルを含む系においてはラジカル由来のESR信号が注入されたキャリアによる伝導電子のESR信号より圧倒的に大きくなるので伝導電子のESR信号の寄与の検出が難しくなる。ESRによる電流量の変化を測定する電気的検出磁気共鳴（EDMR）法を用いれば、電流に関与するキャリア成分のESRを抽出できると考えられる。本研究はEDMR測定によってキャリアスピンと局在電子スピンの相互作用を明らかにすることを目的としている。,特別研究員奨励費,小区分32020:機能物性化学関連,電気的検出磁気共鳴,励起状態ダイナミクス,TIPS-ペンタセン,ペンタセン－ラジカル連結系,,,,,,,,,,,,,,,,,,,,,,,,,,,,,,,,,,,,,,,,,,,,,,,,,,,,
20J14836,京都大学,木村 要二郎,遍歴電子-プロトン相関を基盤とした新奇金属錯体の創成と物性開拓,電子系と水素結合中のプロトン運動がカップルする電子-プロトン相関系では、指向性外場によるプロトン運動の制御を通じて、従来の電子系に比べ多彩かつ精密な電子物性制御が期待できる。本研究では、プロトンの脱着に伴い電子構造が変化する金属錯体を基に電子-プロトン相関系の構築を目指す。また、得られた相関系について温度や圧力、電場などの外場印加下で伝導度・静磁化率・誘電率測定等を行うことで、電子系単体では実現し得ない電子-プロトン相関に由来する新奇物性の発現を目指す。,特別研究員奨励費,小区分32020:機能物性化学関連,プロトン‐電子相関系,金属ジチオレン錯体,プロトン‐電子混合伝導,,,,,,,,,,,,,,,,,,,,,,,,,,,,,,,,,,,,,,,,,,,,,,,,,,,,,
