awardnumber,organization,name,title,abstract,section,review_section,keyword1,keyword2,keyword3,keyword4,keyword5,keyword6,keyword7,keyword8,keyword9,keyword10,keyword11,keyword12,keyword13,keyword14,keyword15,keyword16,keyword17,keyword18,keyword19,keyword20,keyword21,keyword22,keyword23,keyword24,keyword25,keyword26,keyword27,keyword28,keyword29,keyword30,keyword31,keyword32,keyword33,keyword34,keyword35,keyword36,keyword37,keyword38,keyword39,keyword40,keyword41,keyword42,keyword43,keyword44,keyword45,keyword46,keyword47,keyword48,keyword49,keyword50,keyword51,keyword52,keyword53,keyword54,keyword55,keyword56
18H02708,生理学研究所,村越 秀治,シナプス状態の光操作による記憶保存様式の理解,光遺伝学的手法を用いることで高い時空間分解能で細胞活動を操作することができる。例えば広く用いられている光遺伝学的ツールであるチャネルロドプシン-2を利用することで神経細胞の活動を細胞レベルで制御することができる。しかしながら、単一シナプスのレベルでシナプス可塑性を誘導できる光遺伝学的ツールはこれまで存在しなかった。そこで私達は単一シナプスの光操作が可能な新規光遺伝学的ツールを開発した。CaMKIIαに光感受性ドメインLOV2を融合させることで、光活性化可能なCaMKIIを開発した。これにより、海馬ニューロンの単一スパインで長期増強（LTP）を誘導することに成功した。,基盤研究(B),小区分51010:基盤脳科学関連,シナプス,光応答性分子,2光子蛍光顕微鏡,,,,,,,,,,,,,,,,,,,,,,,,,,,,,,,,,,,,,,,,,,,,,,,,,,,,,
18H02707,九州大学,松本 有樹修,脳・神経疾患に関与する新規ポリペプチド群の解析,Long non-coding RNA(lncRNA)はその定義によるとタンパク質をコードしないRNAであるが、われわれはこれまでにlncRNAから翻訳される新規ポリペプチドを同定し、それらが重要な機能を持つことを明らかにした。本研究課題では、脳特異的に発現して、自閉症や鬱病などで発現が変化しているポリペプチドの焦点を当てて解析を行なった。本研究期間中に、これら新規ポリペプチドのタグノックインマウスを作製して、内在性の発現の証明や結合タンパク質の同定などを行い、さらにノックアウトマウスを作製して様々な行動異常を示すことなどを明らかにした。,基盤研究(B),小区分51010:基盤脳科学関連,Long non-coding RNA,ポリペプチド,脳・神経疾患,脳,精神疾患,,,,,,,,,,,,,,,,,,,,,,,,,,,,,,,,,,,,,,,,,,,,,,,,,,,
18H02706,名古屋大学,小坂田 文隆,マウス大脳皮質視覚野における投射特異的なサブネットワークによる情報処理機構の解明,視知覚の形成メカニズムを明らかにする目的で、視覚情報処理機構の神経回路基盤の解明を目指した。独自に開発したウイルス遺伝子学的手法と2光子イメージング技術をマウス視覚系に適用することで、神経回路の構造と機能を詳細に解析した。その結果、大脳皮質においてサブネットワークが並列的に存在し、各サブネットワークが固有の反応特性を生み出し、各サブネットワークが特定の脳領域に特異的に投射することで、異なる情報を異なる脳領域へ伝達することが明らかになった。,基盤研究(B),小区分51010:基盤脳科学関連,視覚,神経回路,ウイルスベクター,機能イメージング,機能局在,視知覚,サブネットワーク,セルアセンブリ,予測,トップダウン,多平面同時イメージング,視床,エンベロープ,イメージング,ウイルス,領野,投射,アンサンブル,領野特異性,並列階層的情報処理,多光子励起,同期,相互相関解析,多焦点面同時イメージング,局所回路,大脳皮質,感覚情報,並列処理,,,,,,,,,,,,,,,,,,,,,,,,,,,,
19H03537,国立研究開発法人情報通信研究機構,黄田 育宏,脳循環代謝カップリング解明に向けたfMRI定量化と高解像度脳酸素代謝計測法の開発,脳機能計測法として世界的に利用されている機能的MRI（fMRI）は、タスクによる脳活動の位置情報をfMRI信号の変化量から統計的手法を用いて同定している。しかし、原理的にfMRI信号変化領域において、どの程度活動しているのかは分からない。本研究では、fMRIを用いて活動量を計測できる定量的な計測法の確立を行う。そのために、これまで実現できなかった高解像度なマルチモダル計測を開発し、fMRIの定量化および酸素代謝計測法を実現する。これらの手法を用いて脳機能研究の新たな展開を目指し、画像診断技術の進歩を促す。,基盤研究(B),小区分51010:基盤脳科学関連,機能的MRI,定量化,酸素代謝,脳血流量,脳血液量,超高磁場,高分解能,脳機能計測,BOLD,,,,,,,,,,,,,,,,,,,,,,,,,,,,,,,,,,,,,,,,,,,,,,,
19H03536,国立研究開発法人国立精神・神経医療研究センター,花川 隆,学習による小脳構造マクロ可塑性の神経生物学的機構の解明研究,ヒトの知性を支える脳の神経可塑的変化が、MRIで測定できることが明らかになってきたが、その背景となる神経細胞・分子メカニズムは未知である。われわれは、ラットの学習に伴い小脳の一部に脳構造可塑性が生じることを発見した。この実験系を用いて、AMPA受容体PETによる可塑性イメージングと細胞組織学的・遺伝子発現の検討を組み合わせ、AMPA受容体を発現しているシナプスの変化が脳構造マクロ可塑性に寄与しているという仮説を検証する。AMPA受容体PET技術が動物で確立すればヒトにも応用する。本研究は、可塑性の新しい分子細胞神経機構の理解の端緒となり、記憶障害に抵抗する新たな薬剤の開発に繋がる可能性がある。,基盤研究(B),小区分51010:基盤脳科学関連,学習,神経可塑性,神経画像,MRI,顕微鏡,小脳,脳可塑性,AMPA受容体,ポジトロン断層像,組織学,,,,,,,,,,,,,,,,,,,,,,,,,,,,,,,,,,,,,,,,,,,,,,
19H03535,東京大学,渡部 喬光,自閉症の認知硬直性を惹起する神経遷移ダイナミクスの同定と動的脳刺激法による介入,自閉スペクトラム症は人口の数パーセントに見られる発達障がいである。その症状として社会疎通性の障害が注目されがちだが、もう一つの中核症状である活動と興味の範囲の著しい限局性も、たとえ知能が平均もしくは平均以上であっても、当事者の社会生活に大きな影響を与えている。本研究では、「この自閉症に見られる認知の硬直性が神経活動の過度の安定性にあるのではないか」という仮説を独自の統計解析手法および心理実験パラダイムを用いて検証する。さらに新たに開発する動的脳刺激法によって、その神経-行動相関の因果性を実証し、将来的な非侵襲的治療のヒントを探る。,基盤研究(B),小区分51010:基盤脳科学関連,自閉スペクトラム症,MRI,TMS,エネルギー地形解析,神経タイムスケール解析,脳活動駆動型神経刺激装置,非侵襲的神経刺激,認知の硬直性,脳活動駆動型神経刺激法,神経ダイナミクス,磁気刺激,脳波,脳科学,精神神経科学,精神疾患,認知の柔軟性,精神神経医学,計算論的精神医学,脳機能画像,データ駆動型解析,自閉症,脳画像,脳刺激法,,,,,,,,,,,,,,,,,,,,,,,,,,,,,,,,,
19H03534,関西医科大学,小原 圭吾,新戦略を用いた遺伝子導入技術の開発と成体海馬における「細胞競合仮説」の検証と解析,遺伝子導入技術は極めて重要な基盤技術の一つであり「ライフサイエンス技術の扇の要」である。しかしながらこれまで自在性のある「遺伝子導入技術」を開発するのは困難であった。本研究課題の第一の目的は、新たな戦略を用いて、自在性のある「遺伝子導入技術」を開発することである。そして第二の目的は、この新戦略技術を活用し、「局所脳領域において神経活動依存的な細胞競合によって神経回路やシナプスが精錬され調節される」という有力な仮説の検証を成体マウス海馬領域において行うことである。これにより成体海馬における場所細胞の場所受容野形成、精錬における“神経活動依存的な細胞競合”の役割の解明を行う。,基盤研究(B),小区分51010:基盤脳科学関連,遺伝子の戦い,海馬,遺伝子導入,神経細胞,Cre,細胞競合,神経活動,シナプス,遺伝子導入技術,ウイルス,Cre リコンビナーゼ,FLP リコンビナーゼ,神経回路,場所細胞,,,,,,,,,,,,,,,,,,,,,,,,,,,,,,,,,,,,,,,,,,
19H03533,名古屋大学,山下 貴之,X線を用いた脳機能操作法の確立,自由行動中の動物において深部脳細胞を効率よく体外から遠隔操作することは未だ困難である。本研究では、これまで独自に開発を進めてきた、生体組織を透過するX線を可視光へと変換する発光素材である無機シンチレータを用いた神経活動の遠隔操作技術をより安全な実験系として確立することを目的とする。特に、被爆線量を最小限化する手法の開発を目指すとともに、手法の安全性・侵襲性・スケーラビリティについての改善策を検討する。,基盤研究(B),小区分51010:基盤脳科学関連,光遺伝学,X線,シンチレータ,マウス,オプシン,ドーパミン,in vivo,電気生理学,神経操作,,,,,,,,,,,,,,,,,,,,,,,,,,,,,,,,,,,,,,,,,,,,,,,
19H03532,名古屋大学,溝口 博之,リスク志向な意思決定の神経基盤：行動・神経回路操作・計算論的手法によるアプローチ,依存症は健康を脅かす疾患であり、ギャンブル障害、ゲーム障害などが新たに精神疾患として認定されるなど、今まで以上に身近な社会問題として懸念されている。この事から新たな依存症の包括的理解に向けた機序解明が必要である。本研究では、多種多様な遺伝子発現制御法と遺伝子改変ラットを用いて、島皮質を基軸とした意思決定・行動選択の変容に関わる領域間ネットワーク、神経-神経ネットワークを解明し、依存症の新たな治療戦略の発信を目指す。,基盤研究(B),小区分51010:基盤脳科学関連,リスク志向,意思決定,島皮質,大脳基底核,,,,,,,,,,,,,,,,,,,,,,,,,,,,,,,,,,,,,,,,,,,,,,,,,,,,
19H03531,山梨大学,宇賀 貴紀,柔軟な判断の神経メカニズムの解明,環境に応じて柔軟に判断を切り替える能力は、ヒトを含めた霊長類特有の認知機能である。我々はこれまで、2つの環境（ルール）に応じて柔軟に判断を切り替えるタスクスイッチ課題を用い、判断形成における情報収集過程のダイナミックな制御を明らかにしてきた。本研究では、タスクスイッチ課題に重要であると思われる3つの脳領域間の相互作用の因果関係を解明することで、柔軟な情報収集を可能にする神経ネットワークメカニズムを明らかにする。,基盤研究(B),小区分51010:基盤脳科学関連,霊長類,意思決定,高次視覚野,頭頂葉,機能結合,脳・神経,,,,,,,,,,,,,,,,,,,,,,,,,,,,,,,,,,,,,,,,,,,,,,,,,,
23K20318,北海道大学,藤山 文乃,機能的ドーパミン神経細胞サブセットの解明,パーキンソン病の原因は黒質緻密部のドーパミン神経細胞の変性脱落であるが、どのドーパミン神経細胞サブセットの変性脱落がパーキンソン病のどの症状を引き起こすのかはわかっていない。応募者らを含む複数のグループの研究により、黒質緻密部のドーパミン神経細胞は、その領域ごとに不明瞭ながら近接した線条体領域へ投射するトポグラフィーを示すことがわかっているが、この投射様式の違いと遺伝子発現の違いとを結びつける要因はわかっていない。本研究課題では、ドーパミン神経細胞の投射様式と遺伝子発現プロファイリングとの相関を明らかにし、機能的ドーパミン神経細胞サブセットを同定することで、大脳基底核回路の機能的解明を行う。,基盤研究(B),小区分51010:基盤脳科学関連,大脳基底核,ドーパミン,ドーパミン神経細胞,パーキンソン病,,,,,,,,,,,,,,,,,,,,,,,,,,,,,,,,,,,,,,,,,,,,,,,,,,,,
20H03550,北海道大学,佐藤 正晃,セルアセンブリ形成メカニズムの構成的理解,記憶の形成に重要な役割を果たす海馬の錐体細胞は、動物の場所に特異的に活動する「場所細胞」としての性質をもつ。このような機能回路の構築メカニズムを明らかにするためには、生後発達過程の回路活動を大規模に計測し、その形成と成熟の原理を理解することが不可欠である。そこで本研究は、まず生後発達期マウスの海馬神経回路の活動を二光子カルシウムイメージングで解析する。さらに、幹細胞から分化させた神経細胞を海馬に移植し、これらの外来性の錐体細胞が成熟動物において共通の機能をもつ細胞集団を形成するかどうかを検証する。,基盤研究(B),小区分51010:基盤脳科学関連,海馬,生後発達,二光子レーザー顕微鏡,カルシウムイメージング,樹状突起スパイン,ナビゲーション,バーチャルリアリティ,神経ダイナミクス,,,,,,,,,,,,,,,,,,,,,,,,,,,,,,,,,,,,,,,,,,,,,,,,
20H03548,京都大学,肥後 剛康,非侵襲技術による霊長類の神経回路操作と応用による高次認知機能制御メカニズムの解明,ヒトを含む霊長類の高次認知機能は、高度に発達した大脳皮質の神経回路によって制御されると考えられている。しかし、その検証技術が未開発なため、研究は国際的に停滞している。本研究では、現在申請者が開発に成功しているシルク素材のウイルスベクターフィルム遺伝子導入法をマカク属サル脳回路へ導入することで非侵襲な神経回路操作技術を完成させる。次に、当該回路操作技術を課題訓練サルへ適用し、高感度の電気生理学と行動学実験解析を駆使することで、高次認知機能の制御メカニズムを回路レベルから明らかにする。,基盤研究(B),小区分51010:基盤脳科学関連,霊長類,高次脳機能,前頭前野,ウイルスベクター,回路操作,,,,,,,,,,,,,,,,,,,,,,,,,,,,,,,,,,,,,,,,,,,,,,,,,,,
20H03547,京都大学,小川 正晃,先端的光計測・光操作技術による期待外れを乗り越える意欲の神経機構の解明,物事が期待通りに行かない期待外れの場合にも、それを乗り越えようと意欲を高めることは将来の成功に繋がる重要な機能であるが、その神経メカニズムは不明である。本研究は、そのような意欲を強く誘導する動物行動モデルを開発し、光を用いた先端的な神経活動計測技術・活動操作技術を導入して、その神経メカニズムを明らかにする。その結果、意欲に関わる脳領域の本質的機能の理解を変え、期待外れを制御する他の脳領域の機能理解の革新、精神疾患の理解や治療に繋げる。,基盤研究(B),小区分51010:基盤脳科学関連,意欲,報酬,光遺伝学,,,,,,,,,,,,,,,,,,,,,,,,,,,,,,,,,,,,,,,,,,,,,,,,,,,,,
20H03546,東京大学,蝦名 鉄平,環境に応じた運動を実現する霊長類の脳領域間ネットワーク連関の光計測と制御,平坦な道を歩いている時とゆるやかな坂道を上っている時、私たちは同じ様に足を踏み出し、歩き続けることができる。常に変化し続ける環境の中で同じ様に運動するためには、環境の情報や運動の結果をもとに次の動作を修正し続ける必要がある。本研究ではこのような「運動適応」に必要であると考えられている脳領域間の情報フローをカルシウムイメージングと光遺伝学を用いて霊長類の大脳皮質で計測し、環境に応じた運動実行のための神経活動がどのように形成されているのかを明らかにする。,基盤研究(B),小区分51010:基盤脳科学関連,コモンマーモセット,カルシウムイメージング,大脳皮質運動野,学習,前肢運動,光遺伝学,マーモセット,,,,,,,,,,,,,,,,,,,,,,,,,,,,,,,,,,,,,,,,,,,,,,,,,
20H03545,東北大学,佐々木 拓哉,海馬同期スパイク列のリアルタイム操作による生理機能の検証,海馬は、記憶や学習に重要な脳領域であり、神経活動に関する多くの知見が得られてきた。しかし従来の研究は、計測のみに基づいた相関解析がほとんである。本研究では因果的な実証を目指し、ラット海馬の神経活動をリアルタイムで検出し、同時に海馬にフィードバック刺激を加えることで、その活動のみを時間選択的に攪乱させる。動物には複数の選択肢と解が用意されているような迷路課題を解かせ、オンライン操作法を適用することで、予測や意思決定、学習・記憶などの脳機能がいかに変化するか検証する。,基盤研究(B),小区分51010:基盤脳科学関連,海馬,記憶,学習,神経同期活動,場所細胞,スパイク列,空間課題,同期活動,シータ波,オンライン操作,,,,,,,,,,,,,,,,,,,,,,,,,,,,,,,,,,,,,,,,,,,,,,
23K21393,筑波大学,山田 洋,欲求に応じて行動を調節する神経回路の解明：モデル動物を用いた研究,判断と意志決定は人間の社会生活の根幹であり、その異常は、肥満、薬物依存症、うつ病などの障害として現れる。先行研究により、ヒトの前頭葉内側部の異常がうつ病と関わることが知られている。更に、マカクザルのこの脳部位を磁気刺激すると、うつ様行動が発現する可能性が指摘されている。これらの点から、マカクザルの前頭葉内側ネットワークの活動を測定、操作することで、うつ病の機序の解明につながる可能性が期待できる。以上のように、霊長類の前頭葉内側ネットワークの機能を理解することは科学的・医学的に意義が大きく、申請者の創造的で独創性が高い研究により、新規の発見が期待される。,基盤研究(B),小区分51010:基盤脳科学関連,サル,報酬,欲求,価値,神経回路,意欲,計算,行動調節,脳,コスト,空腹,喉の乾き,計算論,,,,,,,,,,,,,,,,,,,,,,,,,,,,,,,,,,,,,,,,,,,
21H02801,国立研究開発法人量子科学技術研究開発機構,揚妻 正和,光学・機械学習が融合したデータ駆動型研究体系による脳回路並列計算様式の解明,大脳皮質前頭前野は、快・不快の情動や外界からの感覚刺激など様々な情報を「並列処理」することで生存に不可欠な判断を実現する。脳の限られた容量を効率的に利用するための独自の並列処理様式がその機能を支えると推察されるが、技術的制限によりその理解は理論や仮説の提唱に留まっている。そこで申請者らは新たなシステムを開発し、マウス前頭前野の詳細な神経活動記録と、複数の情動記憶が並列に形成される行動課題を実施可能にした。本研究課題では、機械学習によるデータ駆動型の解読と、光遺伝学による精密な因果性の検証により、前頭前野における並列処理の核となる要素を同定し、脳独自の並列処理様式の実態を証することを目指す。,基盤研究(B),小区分51010:基盤脳科学関連,二光子イメージング,population coding,並列計算,前頭前野,光遺伝学,,,,,,,,,,,,,,,,,,,,,,,,,,,,,,,,,,,,,,,,,,,,,,,,,,,
21H02800,東北福祉大学,小川 誠二,安静時fMRIにおける機能・生理情報分離と生理的fMRI創出可能性についての検討,タスクを遂行しない安静時 fMRI は測定が容易である利点がある反面、刺激に対する局所的神経活動と脳血流・血管のカプリングなどそのメカニズムが分かっている通常のタスクfMRI と比べて、安静時 fMRI 信号の神経活動との関係はまだ不明な点が多い。本研究ではその安静時 fMRI 信号に存在しうる成分、つまり、fMRI 時系列信号に存在する認知機能を含む機能的神経活動を反映する成分、それらを支える定常状態での脳エネルギー代謝を反映する成分、そして神経活動とエネルギー代謝を調節する生理状態を反映する信号成分の分離を試みる。,基盤研究(B),小区分51010:基盤脳科学関連,安静時ｆMRI,脳機能活動,脳代謝,ノイズ除去,fMRI,resting state,physiological signal,pituitury gland,hypothalamus,resting state fMRI,metabolic components,pituitary gland,physiological condition,,,,,,,,,,,,,,,,,,,,,,,,,,,,,,,,,,,,,,,,,,,
21H02799,神戸大学,橘 吉寿,神経回路可視化と光操作による薬物依存形成脳内機構の解明,薬物依存は精神と肉体を蝕み、自己のみならず家族をも不幸に巻き込む由々しき問題であり、社会的関心は非常に高い。しかしながら、薬物依存の病態メカニズムの解明は未だ十分でない。本研究では、情動と行動を繋ぐ脳部位である大脳基底核を中心とする薬物依存に関わる神経回路を考え、覚醒状態の齧歯類を用い、1）脳深部イメージング法により、薬物依存形成に拘わる神経回路動態を可視化する、2）その神経回路動態を基に、光遺伝学による人工神経活動操作を行い薬物探索行動の変容を導く、ことを目標とする。,基盤研究(B),小区分51010:基盤脳科学関連,依存症,コカイン,ドーパミン,マウス,大脳基底核,大脳皮質,ニューロン,ミクログリア,イメージング,腹側淡蒼球,光遺伝学,側坐核,淡蒼球,視床下核,腹側被蓋野,,,,,,,,,,,,,,,,,,,,,,,,,,,,,,,,,,,,,,,,,
21H02798,京都大学,山口 玲欧奈,霊長類における経路選択的回路操作の技術開発と疾病モデルへの応用,本研究では、ヒトに近い脳構造を持つマカクザルを対象とし、広範囲の脳領域に対して経路選択的かつ可逆的に操作ができる技術開発に取り組む。これを実現するために、広範囲にウイルスベクターを注入できるCED、特定の経路を選択できるウイルスベクター2重感染法、可逆的に経路を操作できるDREADDsという手法を組み合わせる。また、注入部位に脳波皮質電極を留置し、回路操作による脳活動の変化を明らかにする。さらに、当該回路操作技術をサル脊髄損傷モデルに適用し、脊髄損傷モデルからの機能回復に関わる脳機能を明らかにする。,基盤研究(B),小区分51010:基盤脳科学関連,脊髄損傷,サル,機能回復,ウイルスベクター,DREADD,,,,,,,,,,,,,,,,,,,,,,,,,,,,,,,,,,,,,,,,,,,,,,,,,,,
23K24201,同志社大学,正水 芳人,神経回路創出により解明する高度な運動学習の神経基盤,これまでの研究で、個体脳（in vivo）カルシウムイメージング（カルシウムセンサーの蛍光強度と神経活動には正の相関関係がある）で長期間、多細胞で同一の神経細胞の活動を観察することによって、げっ歯類（マウス）と霊長類（マーモセット）の運動学習の神経基盤を解明した。これまでの研究で明らかになったげっ歯類と霊長類の運動学習の神経基盤の違いに着目し、本研究では、なぜ霊長類はげっ歯類と比べ高度な運動学習が可能なのかを解明する。,基盤研究(B),小区分51010:基盤脳科学関連,in vivo カルシウムイメージング,運動学習,ドーパミン,,,,,,,,,,,,,,,,,,,,,,,,,,,,,,,,,,,,,,,,,,,,,,,,,,,,,
