awardnumber,organization,name,title,abstract,section,review_section,keyword1,keyword2,keyword3,keyword4,keyword5,keyword6,keyword7,keyword8,keyword9,keyword10,keyword11,keyword12,keyword13,keyword14,keyword15,keyword16,keyword17,keyword18,keyword19,keyword20,keyword21,keyword22,keyword23,keyword24,keyword25,keyword26,keyword27,keyword28,keyword29,keyword30,keyword31,keyword32,keyword33,keyword34,keyword35,keyword36,keyword37,keyword38,keyword39,keyword40,keyword41,keyword42,keyword43,keyword44,keyword45,keyword46,keyword47,keyword48,keyword49,keyword50,keyword51,keyword52,keyword53,keyword54,keyword55,keyword56
23K24200,藤田医科大学,山下 貴之,X線光遺伝学の多色化・高効率化による汎用的な脳神経回路操作法の開発,自由行動中の動物において深部脳細胞を効率よく体外から遠隔操作することは未だ困難である。本研究代表者たちは、生体を透過するX線を用いて神経細胞の活動を遠隔操作する「X線光遺伝学」を独自に開発した。本技術では放射線励起蛍光体であるシンチレータを用いるが、本技術での有効性が証明されたシンチレータは未だ1種類のみであり応用が限定されている。そこで、本研究では、様々な発光波長を持つ高効率シンチレータを活用するとともにX線エネルギーを高効率で光感受性タンパク質に伝達する技術を開発することで、汎用的な脳神経機能の遠隔操作技術を確立する。,基盤研究(B),小区分51010:基盤脳科学関連,光遺伝学,X線,電気生理学,シンチレータ,マウス,オプシン,シンチレーター,ドーパミン,ナノ粒子,,,,,,,,,,,,,,,,,,,,,,,,,,,,,,,,,,,,,,,,,,,,,,,
23K24199,国立研究開発法人理化学研究所,水田 恒太郎,記憶固定化における大脳皮質領域間の並列処理機構の解明,想現実システム、二光子カルシウムイメージングおよび薬理遺伝学手法を用いて、ACC-RSCの皮質領域での神経細胞の活動を観察と操作を通じて、Systems consolidationに関する記憶の保持や想起における並列処理の法則と役割を明らかにする。具体的には、以下の実験を行う。,基盤研究(B),小区分51010:基盤脳科学関連,記憶の固定化,記憶,場所細胞,二光子イメージング,バーチャルリアリティ,,,,,,,,,,,,,,,,,,,,,,,,,,,,,,,,,,,,,,,,,,,,,,,,,,,
23K24198,新潟大学,田井中 一貴,高解像度3次元イメージングによるヒト脳全細胞病理解析プラットホーム,本研究では、ヒト脳組織の組織透明化・色素や抗体の均一染色技術による「ヒト脳組織加工技術」と、岩石の高解像トモグラフィ・超大規模画像解析技術からなる「デジタルトランスフォーメーション(DX)化した惑星探査技術」を融合することでヒト脳全細胞病理解析プラットホームを創成する。一細胞解像度でヒト全脳丸ごと描出した標準脳アトラスを構築し、サンプル間の定量比較・上書き・編集が可能なヒト脳デジタルアーカイブを構築する。,基盤研究(B),小区分51010:基盤脳科学関連,トモグラフィイメージング,ヒト脳アトラス,組織透明化・3Dイメージング,,,,,,,,,,,,,,,,,,,,,,,,,,,,,,,,,,,,,,,,,,,,,,,,,,,,,
23K24197,北海道大学,吉田 正俊,アクティブ・ヴィジョンの脳内メカニズムの解明に向けて,我々の視知覚は眼球運動という行為によって構成される。この「アクティブ・ヴィジョン」をシーン理解と眼球運動の制御の両面から明らかにしたい。そこで本研究では「ベイジアン・サプライズ」が脳内で処理されているか検証することを目的とする。この目的のため、視覚性ミスマッチ課題またはフリービューイング課題中の脳活動を計測することで、ベイジアン・サプライズに関連する脳活動があるかどうか実験的に検証する。,基盤研究(B),小区分51010:基盤脳科学関連,自由エネルギー原理,フリービューイング,,,,,,,,,,,,,,,,,,,,,,,,,,,,,,,,,,,,,,,,,,,,,,,,,,,,,,
23K27474,順天堂大学,小西 清貴,反応抑制機能におけるヒト大脳皮質マクロ神経回路の解明,機能的磁気共鳴画像法（fMRI）で取得した脳機能画像に対して機能的結合性解析を適用することにより、ヒト大脳皮質を400個程度の機能単位（「パーセル」とよばれる）に分割する方法が開発され、神経回路のネットワーク解析が可能となっている。本研究では、前頭前野が関わる比較的単純な高次認知機能である反応抑制（不適切な反応を抑制することにより、行動を意識的にコントロールする機能）を対象として、経頭蓋磁気刺激（TMS）と経頭蓋超音波刺激（TUS）を相補的に適用した可逆的かつ非侵襲的方法によって行動との因果関係を検証しつつ、このパーセルを単位とした神経回路を大脳全体のレベルで解明することを目的とする。,基盤研究(B),小区分51010:基盤脳科学関連,神経回路,磁気共鳴画像法,経頭蓋磁気刺激法,経頭蓋超音波刺激法,反応抑制,機能的磁気共鳴画像法,,,,,,,,,,,,,,,,,,,,,,,,,,,,,,,,,,,,,,,,,,,,,,,,,,
23K27473,京都大学,坂本 雅行,ホログラム技術を応用した嗅球・顆粒細胞の機能的意義の解明,本研究では、革新的なAll-Optical（全光学的）な高精度計測・操作技術を創出し、嗅球神経回路における顆粒細胞の機能を１細胞レベルで解明する。具体的には、嗅球・顆粒細胞の２光子カルシウムイメージングによる活動計測と、光遺伝学ツールおよび空間光位相変調器（LCOS-SLM）を用いた活動操作を１細胞レベルの解像度でおこなう光技術を確立する。確立する光操作技術を用いて匂い刺激に応答する顆粒細胞の活動操作をおこない、嗅覚機能や嗅覚記憶への影響を明らかにする。,基盤研究(B),小区分51010:基盤脳科学関連,嗅球,顆粒細胞,カルシウムイメージング,光遺伝学,パターン照射,,,,,,,,,,,,,,,,,,,,,,,,,,,,,,,,,,,,,,,,,,,,,,,,,,,
23K27472,京都大学,井上 謙一,マルチモーダルスキルを支える大脳皮質－大脳基底核連関の情報処理様式,本研究は、独自開発した双方向性多重蛍光越シナプストレーシング法や、神経路選択的な機能介入などの先端的ネットワーク解析法を駆使し、多様なスキルの習得と利用に関わる大脳皮質―大脳基底核ループの情報処理回路構造とその機能を解明することを目的とする。具体的には、順行性トレーシングと逆行性越シナプストレーシングを同時適用した双方向性多重蛍光トレーシングとAIや空間統計を利用したラベル解析により、皮質―基底核ループ回路における情報統合様式を明らかにする。このことにより、同回路の基本的役割の理解と、同回路が関与する運動・精神疾患の病態の理解に貢献する。,基盤研究(B),小区分51010:基盤脳科学関連,スキル,霊長類,大脳基底核,ウイルスベクター,トレーシング,解剖学,,,,,,,,,,,,,,,,,,,,,,,,,,,,,,,,,,,,,,,,,,,,,,,,,,
23K27471,筑波大学,國松 淳,協同性と共感における小脳の役割,社会性行動の障害を特徴とする発達障害の一つである自閉症スペクトラム症（ASD）は、小脳の細胞の異常と関連する特定遺伝子などの分子病態が明らかになりつつある。しかしながら、小脳が社会性機能に果たす役割についての理解が乏しいため、ASD病態理解において大きなギャップが存在している。本研究課題では、協同性や共感を含む社会性行動遂行中のマカクザルからの小脳外側部の神経活動記録および最新の経路選択的な神経活動操作技術を適用することにより、社会性機能実現のための小脳の神経機構を明らかにすることを目指す。,基盤研究(B),小区分51010:基盤脳科学関連,霊長類,眼球運動,呼吸,社会行動,小脳,共感,社会性,,,,,,,,,,,,,,,,,,,,,,,,,,,,,,,,,,,,,,,,,,,,,,,,,
24K02341,国立研究開発法人量子科学技術研究開発機構,八幡 憲明,広域カルシウムイメージングとVRシステム行動実験による磁覚情報処理の神経機構解明,多くの動物種は、地磁気を感知し、空間を定位することで、渡りや帰巣などの距離をまたぐ行動を可能としている。げっ歯類の場合、巣作りや特定条件下での空間認知課題において、磁覚に基づく行動を取ることが報告されているが、磁気受容の神経メカニズムの詳細については殆ど解明されていない。本研究では、マウスの磁覚に伴う行動をVRシステムで捉え、同時に脳活動を広視野型二光子顕微鏡にて計測可能な磁覚実験系を構築する。得られたデータに対して先進的な脳情報解析技術を適用することで、磁覚に関わる神経機構の様態をデータ駆動的に明らかにする。このことを通して、磁気受容の分子メカニズムに関する複数の従来仮説の妥当性を検証する。,基盤研究(B),小区分51010:基盤脳科学関連,磁気受容,神経回路,カルシウムイメージング,,,,,,,,,,,,,,,,,,,,,,,,,,,,,,,,,,,,,,,,,,,,,,,,,,,,,
24K02340,大阪公立大学,宮脇 寛行,睡眠時に新たな機能的ネットワークが構築されるメカニズムの解明,経験時に獲得された記憶情報は、その後の睡眠中に安定的な形へと定着される。申請者はこれまでに、記憶を獲得したあとの睡眠中に新たな海馬－大脳皮質前頭前野の機能的なネットワークが形成され、このネットワークが記憶を想起する際にも活性化されることを発見した。しかし、正しく機能するネットワークを睡眠中に構築するメカニズムは不明である。この点について本研究では、「覚醒時シータ波を介した、機能的ネットワーク構築に必要なシナプスのラベリング」「睡眠時リップル振動を介した、ラベルされたシナプスの増強」という２段階のプロセスにより、機能的なネットワークが構築されるとの仮説を検証する。,基盤研究(B),小区分51010:基盤脳科学関連,神経生理学,記憶固定化,大規模電気生理学,,,,,,,,,,,,,,,,,,,,,,,,,,,,,,,,,,,,,,,,,,,,,,,,,,,,,
24K02339,神戸大学,橘 吉寿,不随意運動発現に関わる神経ネットワークの同定とその制御による新規治療法開発,本研究では、不随意運動モデルマウスを作製し、末梢から中枢への感覚伝達経路に変調を加えることで運動障害が改善されるかどうかを検証し、 不随意運動の病態メカニズムを脳科学的に解明することを目標とします 。 最終的なねらいは、 末梢感覚の変調を誘導する非侵襲かつ簡便な工学デバイスを用いた治療法創出であり、不随意運動で悩む患者のウェルビーイングに貢献したいと考えます。,基盤研究(B),小区分51010:基盤脳科学関連,チック症,トゥレット症候群,大脳基底核,視床,DREADD,,,,,,,,,,,,,,,,,,,,,,,,,,,,,,,,,,,,,,,,,,,,,,,,,,,
24K02338,大阪大学,高田 昌彦,脳病態サルモデルを用いた経頭蓋集束超音波照射術による非侵襲的遺伝子治療法の開発,本研究では、経頭蓋集束超音波照射による血液脳関門の一過性開放術をパーキンソン病サルモデルに適用し、非侵襲的遺伝子治療法の開発に向けた基礎的研究をとおして、実用的なレベルで確立することを目的とする。パーキンソン病の際に活動性が亢進することが知られているグルタミン酸作動性の視床下核ニューロンをウイルスベクターを介した外来遺伝子導入のターゲット部位とし、inhibitory DREADDを用いた化学遺伝学的な介入操作、およびグルタミン酸をGABAに変換する酵素であるGADをrecruitすることによる、グルタミン酸作動性（興奮性）ニューロンのGABA作動性（抑制性）ニューロンへの変換を試みる。,基盤研究(B),小区分51010:基盤脳科学関連,経頭蓋集束超音波照射,ウイルスベクター,遺伝子導入,パーキンソン病,非侵襲的遺伝子治療,,,,,,,,,,,,,,,,,,,,,,,,,,,,,,,,,,,,,,,,,,,,,,,,,,,
24K02337,近畿大学,中島 敏,割込みに対処しつつ目的志向の行動を遂行する脳内機構,私達は目的を達するために行動しますが，行動の最中に割込が入りそれに対処しなくてはならないことはよくあります．例えば家で料理中に子供に呼ばれて相手をする，職場で報告書を作成中に着信した電話に出る，という状況です．割込後に大抵の場合元の行動に戻ることができるのは，過去の研究より，海馬が活動して元の行動の情報を割込中も保持してくれるお陰だと予想されます．そこで本研究では訓練したニホンザルの海馬から信号を記録してその予想を検証します．なお使用する動物はNBRP「ニホンザル」(代表機関：京大ヒト行動進化研究センター) から研究用に配分された個体に限定し，実験計画は近畿大学動物実験委員会の承認を受けます．,基盤研究(B),小区分51010:基盤脳科学関連,二重課題,海馬,高次運動野,霊長類,,,,,,,,,,,,,,,,,,,,,,,,,,,,,,,,,,,,,,,,,,,,,,,,,,,,
25K02545,国立研究開発法人量子科学技術研究開発機構,揚妻 正和,前頭前野全細胞ライブ観察による恐怖記憶長期化と消去の神経回路ダイナミクスの解明,情動は喜怒哀楽の感情であり、生存に関わる記憶・判断に不可欠である。例えば恐怖の記憶に関する脳領域として、脳の前頭前野の重要性が多く報告され、その機能異常は心的外傷後ストレス障害など慢性的な心の病につながる。しかし、前頭前野内の詳細な仕組みは多くが不明であり、その機能異常に基づく疾患の決定的治療法も確立出来ていない。そこで本課題では、モデル動物であるマウスを用い、光学・機械学習による脳回路動態を紐解く独自技術をもとに前頭前野内の複雑な動作原理を理解し、精神疾患の治療等への応用を目指す。,基盤研究(B),小区分51010:基盤脳科学関連,二光子イメージング,population coding,前頭前野,高次元演算,光遺伝学,,,,,,,,,,,,,,,,,,,,,,,,,,,,,,,,,,,,,,,,,,,,,,,,,,,
25K02544,藤田医科大学,山下 貴之,触覚嗜好性を司る神経システムの解明と病態解析,肌触りのよいシーツを触った時に心地よさを感じるように、動物には特定の触刺激に対する嗜好が備わっている。しかし、その神経機構はよく分かっていない。今回私たちは新たな行動実験系を構築し、マウスが特定の床質感を好むことを発見した。予備研究により、この嗜好の発現は従来説では説明できず、これまでに報告のない末梢と中枢の感覚受容メカニズムが関与していることが示唆された。本研究では、最新の神経科学ツールを駆使し、マウスの床質感に対する触嗜好を司る神経回路システムについて、特に大脳皮質における情報処理機構と末梢の感覚受容器に焦点を当て、解明する。加えて、この触嗜好回路の病態モデルマウスでの異常性を探求する。,基盤研究(B),小区分51010:基盤脳科学関連,大脳皮質,体性感覚,マウス,嗜好,質感,,,,,,,,,,,,,,,,,,,,,,,,,,,,,,,,,,,,,,,,,,,,,,,,,,,
25K02543,東京大学,蝦名 鉄平,様々な環境に応じた運動を実現する霊長類の脳領野間ネットワークの光学計測と制御,平坦な道を歩いている時とゆるやかな坂道を上っている時、私たちは同じ様に足を踏み出し、歩き続けることができる。常に変化し続ける環境の中で同じ様に運動するためには、様々な環境情報をもとに次の動作を修正し続ける必要がある。本研究ではこのような「運動適応」に必要であると考えられている、大脳皮質領野間ネットワーク活動をカルシウムイメージングと光遺伝学を用いて霊長類の大脳皮質で計測・制御して、環境に応じた運動実行のための領野間ネットワークがどのように形成されているのかを明らかにする,基盤研究(B),小区分51010:基盤脳科学関連,カルシウムイメージング,光遺伝学,コモンマーモセット,運動適応,,,,,,,,,,,,,,,,,,,,,,,,,,,,,,,,,,,,,,,,,,,,,,,,,,,,
