awardnumber,organization,name,title,abstract,section,review_section,keyword1,keyword2,keyword3,keyword4,keyword5,keyword6,keyword7,keyword8,keyword9,keyword10,keyword11,keyword12,keyword13,keyword14,keyword15,keyword16,keyword17,keyword18,keyword19,keyword20,keyword21,keyword22,keyword23,keyword24,keyword25,keyword26,keyword27,keyword28,keyword29,keyword30,keyword31,keyword32,keyword33,keyword34,keyword35,keyword36,keyword37,keyword38,keyword39,keyword40,keyword41,keyword42,keyword43,keyword44,keyword45,keyword46,keyword47,keyword48,keyword49,keyword50,keyword51,keyword52,keyword53,keyword54,keyword55,keyword56
23K20111,京都大学,西田 愛,西チベットにおける古チベット語碑文の総合的研究 ～岩石碑文の歴史的意義の再検討～,ラダック地域をはじめとする西チベットは、古代チベット帝国が西域（中央アジア～西アジア）へ進出するための主要ルート上に位置する地域であり、帝国崩壊後にその末裔が王国を建て、仏教復興の拠点とした地域でもある。歴史的にみて非常に重要なこの地域の研究は、従来、後代に記された仏教史文献を用いて行われてきた。本研究では、未だ詳細と現状が十分に知られていない西チベットの石刻碑文について悉皆調査と総合的分析を行い、全容の解明に取り組む。そこから得られた知見を各種文献と対照することにより、西チベット碑文の内容をチベット史及び中央ユーラシア史の文脈に位置づけ、その歴史的意義を検証する。,基盤研究(B),小区分03030:アジア史およびアフリカ史関連,古代チベット,碑文,西チベット,バルティスタン,ラダック,古チベット語碑文,石刻資料,キナウル,岩石碑文,金石文,吐蕃,グゲ・プラン王家,古チベット語木簡,石刻碑文,古チベット語,石刻史料,チベット史,,,,,,,,,,,,,,,,,,,,,,,,,,,,,,,,,,,,,,,
23K20110,筑波大学,柴田 大輔,前２千年紀ハブール川流域の歴史と文化：テル・タバン文書（前13～11世紀）の研究,シリア北東部のハブール川の流域に位置するテル・タバン遺跡（古代のマリ国の首都タベトゥ市）において日本隊が発見した、前13～11世紀の行政記録や書簡、建築記念碑文を記した粘土板と種々の土製品などの楔形文字文書を手掛かりにしながら、メソポタミアの歴史・社会・文化の諸相に関する研究に取り組む。,基盤研究(B),小区分03030:アジア史およびアフリカ史関連,楔形文字,アッカド語,西アジア,メソポタミア,アッシリア,シュメール語,バビロニア,粘土板文書,ハブール川,,,,,,,,,,,,,,,,,,,,,,,,,,,,,,,,,,,,,,,,,,,,,,,
23K20109,岩手大学,平原 英俊,11～14世紀の日本に流通する中国産陶磁器の産地推定と流通に関する比較研究,日本に流通した中国産陶磁器の理化学的分析、日本国内で出土の中国産陶磁を中心に、可搬型ポータブル複合X線分析装置を用いた分析を、沖縄、福岡(博多)、京都、平泉ならびに生産地(福建諸窯、龍泉窯)とこれまで蓄積してきたデータとの比較を進める。2024(令和6)年度に行う中国の生産地の資料のデータ蓄積を進めながら検討を進める。 2「比較流通研究班」は、東北地方、沖縄の遺跡出土の中国産陶磁器について各地域の埋蔵文化財センターなどで観察調査を行う。学会などでの研究成果の一部発表を行う。研究の進捗状況の把握と分析結果の相互の共有を図るため、平泉文化研究センターにおいて研究シンポジウムを行う。,基盤研究(B),小区分03030:アジア史およびアフリカ史関連,中国陶磁器,産地推定,流通ルート,国際共同研究,日中比較,比較,日本陶磁器,平泉,流通,蛍光X線分析,中国陶磁,奥州藤原氏,可搬型ポータブル複合X線分析装置,,,,,,,,,,,,,,,,,,,,,,,,,,,,,,,,,,,,,,,,,,,
20H01331,公益財団法人東洋文庫,梅村 坦,現代新疆における少数民族の文化動態に関する研究：民族言語出版物からの検討,中央ユーラシア地域のテュルク系諸民族住民の中で、相対的に人口の多いのはウイグル人、カザフ人である。彼らの近代以降における民族文化状況を辿ることを目的とする。,基盤研究(B),小区分03030:アジア史およびアフリカ史関連,新疆ウイグル自治区,出版文化,現代ウイグル語文献,少数民族,民族語出版物の書誌,言語資料の文化的背景,現代史と多民族,少数民族文化動態,現代ウイグル人,民族言語出版物,現代カザフ語文献,現代ウイグル語出版物,現代カザフ語出版物,書誌データベース,,,,,,,,,,,,,,,,,,,,,,,,,,,,,,,,,,,,,,,,,,
20H01330,同志社大学,板垣 竜太,冷戦期北朝鮮の文化史：人・情報の流動性に注目して,本研究は、冷戦期（1945年～1980年代）の北朝鮮において、国内外での人口や情報の流動性を背景として、いかに文化の諸領域が歴史的に形成され変化を遂げてきたのかを学際的に明らかにすることを目的とする。研究に際しては、社会の流動性、北朝鮮外の人口の相互影響、個人の能動性、文化の諸領域の相互関係(収斂)という4つの視点を一貫して導入する。その遂行のために学際的な研究体制を組織し、海外に散在する豊富な北朝鮮資料を共同で調査・分析するとともに、インタビュー調査も併用する。,基盤研究(B),小区分03030:アジア史およびアフリカ史関連,朝鮮民主主義人民共和国,文化史,流動性,,,,,,,,,,,,,,,,,,,,,,,,,,,,,,,,,,,,,,,,,,,,,,,,,,,,,
20H01329,南山大学,宮沢 千尋,マルチ・アーカイブズ的調査によるアジア・太平洋戦争期日本・ベトナム関係史の再検討,アジア・太平洋戦争期の日本とベトナムの関係史を、当時のベトナムに駐在してべトナム人民族主義者と交流し、彼らを援助していた大南公司社員・西川寛生氏の日記を主な資料に用いて再検討する。,基盤研究(B),小区分03030:アジア史およびアフリカ史関連,近代日本・ベトナム関係史,マルチ・アーカイブズ的研究,アジア・太平洋戦争,ベトナム民族運動,近代・日本ベトナム関係史,マルチ・アーカイブズ的調査,「大川塾」,,,,,,,,,,,,,,,,,,,,,,,,,,,,,,,,,,,,,,,,,,,,,,,,,
20H01328,中部大学,西山 伸一,境界域に着目した古代西アジア帝国の支配形態と構造解明を目指す歴史考古学的研究,古代西アジアの帝国における境界域に着目し、文献学・考古学・地理情報学・貨幣学の知見をあわせた総合的歴史考古学研究により、帝国の支配形態や構造を解明することを目的とする。研究対象とするのは、「最古の世界帝国」といわれる新アッシリア帝国とユーラシア大陸における東西交流に貢献したサーサーン朝ペルシア帝国で、地域は、この２つの帝国の境界域に相当するイラク・クルディスタン地域とイラン西部である。これまで政治的理由から現地調査が停滞していたこの地域を対象に新たな「帝国像」を提示することを目標とする。,基盤研究(B),小区分03030:アジア史およびアフリカ史関連,アッシリア帝国,古代帝国,支配構造,歴史考古学,サーサーン朝,境界域,サーサーン朝ペルシア帝国,帝国,支配形態,古代西アジア,鉄器時代,辺境部,アッシリア帝国　　　　　　６,,,,,,,,,,,,,,,,,,,,,,,,,,,,,,,,,,,,,,,,,,,
20H01326,大阪大学,坂尻 彰宏,石窟史料からみた敦煌オアシス地域の研究,本研究では、オアシス地域の生活圏・信仰圏の核となる仏教石窟寺院を歴史資料としてあつかい、7~13世紀の敦煌オアシス地域の歴史像を再構築する。中国・甘粛省西部の敦煌オアシス地域には、地域の宗教的な拠点であった仏教石窟寺院群(敦煌石窟)が残されている。本研究では、敦煌石窟の石窟史料を活用して、敦煌オアシス地域の歴史研究に新たな局面を開くことを目指す。なお、本研究で用いる石窟史料とは、歴史資料としての石窟寺院の位置、景観、構造、壁画、仏像、供養人像、銘文等の総称である。,基盤研究(B),小区分03030:アジア史およびアフリカ史関連,敦煌,オアシス地域,石窟史料,現地調査,敦煌オアシス地域,石窟寺院,敦煌石窟,,,,,,,,,,,,,,,,,,,,,,,,,,,,,,,,,,,,,,,,,,,,,,,,,
20H01325,大阪大学,池田 一人,東南アジア大陸部におけるイスラーム受容と社会関係の歴史像構築のための基盤研究,本研究は、東南アジア大陸部社会とイスラームの歴史的社会的関係の全体像解明と現今の問題への新しい視座の提供を目的とする。そのために研究課題として、第一に大陸部のムスリムに関する基本的情報・知見の収集と整備、第二に比較のための指標策定とデータ集成、第三に歴史的全体像の提示の３点に取り組む。4年間の研究期間で、縁辺4事例・内陸部の諸事例・移動事例の3カテゴリーを研究対象とした10班を編成し、各メンバーは主副で複数の班を担当する。海外合同調査は研究の中核的活動であり、1年目は大陸中央部のタイ、2年目は西部のミャンマー、3年目は東部のベトナム・カンボジア（・ラオス）を対象として実施する。,基盤研究(B),小区分03030:アジア史およびアフリカ史関連,東南アジア大陸部,イスラーム,上座部仏教,ロヒンギャ,チャム,イスラーム受容,グローバルヒストリー,雲南ムスリム,マレー・ムスリム,,,,,,,,,,,,,,,,,,,,,,,,,,,,,,,,,,,,,,,,,,,,,,,
20H01324,大阪大学,松井 太,古文書資料の言語横断的総合分析に基づくモンゴル帝国の支配システムの解明,モンゴル帝国支配下の多言語資料を，同時代資料としての古文書を軸として総合的に分析することで，言語文献学・歴史学双方の知見を学際的に架橋すると同時に，言語・地域分業を超えて総体的な視角からモンゴル帝国支配下のユーラシア世界史を理解しようとするものである。,基盤研究(B),小区分03030:アジア史およびアフリカ史関連,モンゴル帝国,古文書資料,中央アジア,中国,イラン,,,,,,,,,,,,,,,,,,,,,,,,,,,,,,,,,,,,,,,,,,,,,,,,,,,
20H01323,金沢大学,古畑 徹,高句麗・渤海を東部ユーラシア史に位置づけるための基礎的研究,古代東北アジア北部に興った高句麗・渤海は、領域が現在の中国・朝鮮の国境を跨ぎ、居住諸種族もそれらの構成民族の源流の一部となっているため、両国間の歴史の争奪の対象となっている。この克服にあたり注目されるのが、渤海以後に東北アジア北部に興った国家は中国だけでなくモンゴリアとも一体化していたという事実で、これは東部ユーラシア史と高句麗・渤海を関連づけることの有効性を想起させる。ただ、そのための基礎作業はほとんど行われていない。本研究課題では、高句麗・渤海が東部ユーラシア諸地域とどのように関わりどのように認識されてきたかを明らかにし、東部ユーラシア史に高句麗・渤海を位置づけるための基礎の確立を目指す。,基盤研究(B),小区分03030:アジア史およびアフリカ史関連,高句麗,渤海,東部ユーラシア史,東北アジア,歴史の争奪,,,,,,,,,,,,,,,,,,,,,,,,,,,,,,,,,,,,,,,,,,,,,,,,,,,
20H01322,東京大学,秋葉 淳,オスマン帝国における社会階層とジェンダーに関する国際共同研究,本研究は、オスマン帝国の社会階層とジェンダーについて、(1)特定の社会集団の研究、(2)法・社会秩序とジェンダー、(3)文化と階層・ジェンダー、(4)構築される階層・ジェンダーという4つのアプローチから実証的研究を進めつつ、国際共同研究を通じて17世紀から20世紀初頭にかけてのオスマン帝国社会の変容と持続性について探究する。具体的には、(1)海外資料調査、(2)国内研究会、(3)招聘研究者によるワークショップ・セミナー、(4)海外学会への参加、(5)国際研究集会を柱とし、個別の実証的研究と国際的な連携に基づく協働との総合によって研究を進める。,基盤研究(B),小区分03030:アジア史およびアフリカ史関連,オスマン帝国,社会階層,トルコ,国際共同研究,ウラマー,軍人,教育,法廷文書,ジェンダー史,,,,,,,,,,,,,,,,,,,,,,,,,,,,,,,,,,,,,,,,,,,,,,,
23K20505,奈良大学,川本 正知,ハラム文書に含まれるペルシア語文書の解読と研究,継続課題のため記入なし。,基盤研究(B),小区分03030:アジア史およびアフリカ史関連,ハラム文書,エルサレム,イスラム法廷文書,アルダビール文書,モンゴル時代,イェルサレム,14世紀イラン社会史,ヤルリグ,,,,,,,,,,,,,,,,,,,,,,,,,,,,,,,,,,,,,,,,,,,,,,,,
23K20504,南山大学,石原 美奈子,エチオピアにおける郷土史・地方史の体系的収集・分析を通した多元的歴史認識の解明,本研究は、エチオピアにおける地方史（外部世界との関係性を示唆する、民族や宗教に関する文字資料やモニュメント）・郷土史（地域住民が口頭、あるいは身体所作を介して伝えられる、特定の人物や集団、土地の歴史に関する語り）の体系的収集・分析を通して、多元的な歴史認識の実相を明らかにすることを目的とするものである。つまり、文字が生み出す歴史と、モノや身体所作、口頭で伝えられる歴史が相互に作用し合いながら創造的に再編される動態的様相を解明することを目指す。,基盤研究(B),小区分03030:アジア史およびアフリカ史関連,エチオピア,ティグライ,オロモ,多元的な歴史認識,地方史と郷土史,ベニシャングール・グムズ,郷土史,地方史,歴史認識,口頭伝承と文字資料,,,,,,,,,,,,,,,,,,,,,,,,,,,,,,,,,,,,,,,,,,,,,,
23K20503,ものつくり大学,林 英昭,伝統木造建築に見るベトナム越族文化の南北分断の実相,本研究は近世ベトナムにおける越族文化の南北分断について，具体的な建築を通じて解明することを目的とする．ベトナム越族の建築の伝統は南北の相違が顕著であり，単なる地域性に留まらない分断が確認できる一方で，それらを具体的且つ網羅的に比較分析するための建築資料が決定的に不足している．本研究はその不足を補うため，ベトナムの伝統的村落の中心施設「ディン」について，ベトナム全土計11の地域（北部三地域・中部六省・南部二省）から計26棟を目標に実測調査を行う．19世紀初頭の阮朝は，なぜ歴代王朝の伝統とは異なる建築様式を選択したのか．建築文化の側面から近現代ベトナム史に底流する南北分断の問題の核心に迫りたい．,基盤研究(B),小区分03030:アジア史およびアフリカ史関連,建築史,東洋建築史,東洋建築,ベトナム,,,,,,,,,,,,,,,,,,,,,,,,,,,,,,,,,,,,,,,,,,,,,,,,,,,,
23K20502,大阪大学,菅原 由美,東南アジアのイスラーム化前期に関する研究―宗教・王権・宇宙観,本研究では、東南アジアのイスラーム化過程をより詳細に理解するために、段階を二つに分け、ペルシャやインドの影響を受けた14~17世紀を「イスラーム化前期」とし、この時期を「ヒンドゥー・仏教的インド期」からの移行期と位置付ける。その上で、東南アジア島嶼部が南アジアから14~17世紀にどのような新しい宗教体系としてのイスラームを受容したのかを、東南アジア諸語（アチェ、マレー、ジャワ、チャムなど）史料の分析を中心に解明する。この分析を通して、東南アジアの「イスラーム化」前半の内実を明らかにし、アラビア語文献の影響を強く受ける18世紀以降の「イスラーム化後期」と比較する材料を準備する。,基盤研究(B),小区分03030:アジア史およびアフリカ史関連,イスラーム化,英雄伝,スーフィズム,普遍史,文献学,,,,,,,,,,,,,,,,,,,,,,,,,,,,,,,,,,,,,,,,,,,,,,,,,,,
23K20501,名古屋大学,吉田 早悠里,デジタル人文学が拓くアフリカ史研究の新地平：エチオピア・カファ地方をモデルとして,継続課題のため、記入しない。,基盤研究(B),小区分03030:アジア史およびアフリカ史関連,デジタル人文学,アーカイヴズ,アフリカ史,エチオピア,カファ地方,F.J.ビーバー,A.ミリウス,,,,,,,,,,,,,,,,,,,,,,,,,,,,,,,,,,,,,,,,,,,,,,,,,
23K20500,東京大学,郭 南燕,日本における上海土山湾工房作品の流布と影響に関する調査,本プロジェクトは、日本における土山湾作品の流布を継続調査し、日本における土山湾刊行物の収蔵を網羅的に調査する蔵書目録を作り、土山湾刊行物の利用から生まれた日本の文化的成果を研究する。また、土山湾作品の日本輸入に関する当時の記録を、中国、日本、台湾、欧州のアーカイブで探す。本プロジェクトのWebsiteを公開し、研究成果を明示する。さらに研究成果の論文集『上海土山湾工房と日本文化』（仮題）を作り、土山湾が日本の文化に与えた影響を総合的に論考する。また、土山湾作品は日本以外に、東アジア諸国にも伝わっているため、研究と保存のための東アジアのネットワーク（研究者と収蔵機関）を構築する予定である。,基盤研究(B),小区分03030:アジア史およびアフリカ史関連,イエズス会の上海土山湾工房,パリ外国宣教会の日本流布,教会美術,出版文化,東アジアの教会,聖具と聖像の発見,土山湾印書館刊行物の影響,ド・ロ版画の研究,文化遺産と地域活性化,土山湾研究会の開催,東アジアの文化交流,研究成果集の執筆刊行,土山湾工房,キリスト教文化,聖画聖像聖具,カトリック書籍,流布と影響,土山湾工房作品,パリ外国宣教会,ド・ロ版画,カトリックの信仰伝播,イエズス会,聖具、聖画、聖像,上海徐家匯地域,上海土山湾工房作品,キリスト教漢籍,キリスト教美術工芸品,プティジャン版,多言語多文化的融合,収蔵品の実地調査,土山湾作品の影響力の研究,研究成果の刊行,ウェブ発信の準備,国内外の学会で研究発表,国内収蔵機関との協働,先行研究と既刊書籍の収集,国外メンバーとの意見交換,,,,,,,,,,,,,,,,,,,
21H00577,広島大学,八尾 隆生,ベトナム近世文書の東アジア文書世界における位置づけ,研究チームのいままでの個別研究の成果と既収集文書及び新出文書に立脚し、ベトナムの近世文書論を共通の課題とすることが今回の科研目的である。,基盤研究(B),小区分03030:アジア史およびアフリカ史関連,ベトナム,黎朝,阮朝,地簿,神勅,私文書,公文書,村落文書,土地売買文書,神蹟,第一国家公文書,ハノイ,ナムディン,フエ,近世漢文文書,漢喃研究院,第一国家公文書館,ハイフォン,ナムディン省,西北地方,阮朝地簿,阮朝シュ本,タインホア省,バクニン省,,,,,,,,,,,,,,,,,,,,,,,,,,,,,,,,
21H00576,大阪大学,片山 剛,日中戦争期（1930～40年代）、南京の人と不動産をめぐる新研究,日中戦争の初期、1937年夏～秋、戦禍を避けるために南京から多くの「富裕な人々」が疎開していった。そして南京の建物の多くが損壊・焼失した。,基盤研究(B),小区分03030:アジア史およびアフリカ史関連,東洋史,南京と上海,土地制度,租界外部,占領地統治,日中戦争期,上海,新敵産,租界,南京,不動産,不在地主・家主,日本人商店,家主不在家屋,地理空間情報,,,,,,,,,,,,,,,,,,,,,,,,,,,,,,,,,,,,,,,,,
23K21976,関西学院大学,水越 知,地方档案史料による清代中国基層社会の構造研究―都市・農村の社会圏を中心に,本研究では地方官庁の公文書である「地方档案史料」解読を基礎に、現地調査を含む地理情報の収集を行い、清代中国の基層社会の人間関係,基盤研究(B),小区分03030:アジア史およびアフリカ史関連,档案史料,基層社会,社会圏,家族・ジェンダー,都市・農村,档案,都市,清代,女性,法制,訴訟,家族,,,,,,,,,,,,,,,,,,,,,,,,,,,,,,,,,,,,,,,,,,,,
23K21975,京都大学,大野 美紀子,東南アジア大陸部越僑コミュニティの基礎研究：ベトナム仏教寺院資料分析から,東南アジア大陸部に散在する越僑コミュニティの「①成立の歴史的経緯」と、「②内部の社会構造」を明らかにするため、当該コミュニティの中核を担ってきたベトナム仏教寺院が所蔵する資料を調査・分析する。歴史的に古いタイ国内ベトナム仏教寺院の所在地とそれら寺院と関係がある本国ベトナムに加えて、経由地となるカンボジア・ラオスを調査対象とすることで、越僑の移住先・移住元を繋ぐ移住過程で、越僑コミュニティの内部社会を構成する出身地・移住経緯によるサブグループを明らかにする。,基盤研究(B),小区分03030:アジア史およびアフリカ史関連,ベトナム仏教,越僑,東南アジア,地域研究,ベトナム仏教寺院,,,,,,,,,,,,,,,,,,,,,,,,,,,,,,,,,,,,,,,,,,,,,,,,,,,
23K21974,京都大学,磯貝 健一,ロシア帝国領中央ユーラシアにおける家族と家産継承,本研究は、ウズベキスタン共和国とロシア連邦内に所蔵される各種のアラビア文字ムスリム諸語およびロシア語の歴史文書、法律文献に依拠して、19世紀後半から20世紀初頭のロシア帝国内のムスリム諸地域（とくに中央アジアとヴォルガ・ウラル地域）における家族と家産継承の諸相を質的・量的分析により解明するとともに、他地域の歴史研究者、ロシア法研究者、文化人類学者との協働により、この時期のムスリム家族、および、多数の家族の集合体としての社会の常態を学際的視野から再構成しようとするものである。,基盤研究(B),小区分03030:アジア史およびアフリカ史関連,家族史,ロシア帝国,中央ユーラシア,ムスリム,法廷文書,ロシア,家産継承,イスラーム法,ロシア法,イスラーム法廷文書,,,,,,,,,,,,,,,,,,,,,,,,,,,,,,,,,,,,,,,,,,,,,,
23K21973,信州大学,豊岡 康史,清朝史の再構築：人口構造・国際関係と政策基調についての総合的研究,本研究は、清朝の経済構造・国際環境・政策基調の通時的把握により、「近世」から「近代」への社会・経済・政治の構造変動を活写し、現代中国の政治構造の原型形成過程を示すものである。従来、日本の明清史・中国近代史研究は世界的に極めて高いレベルの業績を輩出してきたが、長期的な構造変動にかかわる枠組みの提示が出来ていなかった。これに鑑み、本研究では、従来の研究成果に、代表者および共同研究者らが取り組んできた18・19世紀転換期の清朝の構造変動・諸改革にかかわる研究成果を組み合わせて、17世紀から20世紀初頭までの構造変動を軸とした清朝史の新たな歴史像を提示する。,基盤研究(B),小区分03030:アジア史およびアフリカ史関連,清朝史,中国政治史,中国経済史,国際関係史,中国社会史,,,,,,,,,,,,,,,,,,,,,,,,,,,,,,,,,,,,,,,,,,,,,,,,,,,
