awardnumber,organization,name,title,abstract,section,review_section,keyword1,keyword2,keyword3,keyword4,keyword5,keyword6,keyword7,keyword8,keyword9,keyword10,keyword11,keyword12,keyword13,keyword14,keyword15,keyword16,keyword17,keyword18,keyword19,keyword20,keyword21,keyword22,keyword23,keyword24,keyword25,keyword26,keyword27,keyword28,keyword29,keyword30,keyword31,keyword32,keyword33,keyword34,keyword35,keyword36,keyword37,keyword38,keyword39,keyword40,keyword41,keyword42,keyword43,keyword44,keyword45,keyword46,keyword47,keyword48,keyword49,keyword50,keyword51,keyword52,keyword53,keyword54,keyword55,keyword56
23K21972,北海道大学,佐藤 健太郎,地域から見直すアラビア語文化圏：11-15世紀,本研究は、アラビア語を共通語として営まれる知的活動の空間をアラビア語文化圏と位置づけ、それを地域の視点から捉えることを目的とする。イスラーム世界の知識人と彼らの知的活動については、従来、クルアーンの言語アラビア語を紐帯とする一体性が強調されてきた。しかし、この空間の中には多様な地域が含まれ、それら諸地域間の関係は一様でも対等でもない。本研究では、この地域間関係を特に「旅と書簡」、「人脈と学知」、「地域像」の三点に着目しながら明らかにする。その際、マグリブ(西方)・マシュリク(東方)間の関係のみならず、マシュリク内の地域間関係も視野に入れる。,基盤研究(B),小区分03030:アジア史およびアフリカ史関連,アラビア語,マシュリク,マグリブ,知識人,アラビア語文化圏,,,,,,,,,,,,,,,,,,,,,,,,,,,,,,,,,,,,,,,,,,,,,,,,,,,
23K25377,龍谷大学,村岡 倫,モンゴル帝国時代における「草原のシルクロード」をつなぐ仏教施設の研究,本研究のメンバーは、モンゴル国現地での調査・研究を長く継続し、多くの成果をあげてきた。ハルザン・シレグ遺跡が重要な軍事拠点であったことを明らかにし、その発掘調査によって仏像の一部を発見している。また、釈迦院遺跡の本格的な発掘調査も行なった。前者はモンゴル高原から中央アジアへ、後者はシベリア方面に通じる「草原のシルクロード」の要衝でり、民族融合の場でもあったと感がえられる。本研究ではさらなる調査を行ない、遺跡全体の構造の把握、出土物などの分析、関連文献資料との対照など、総合的な研究を進め、歴史上、これらの地を往来する多様な人々によって、両地で行なわれた交流の諸相を解明する。,基盤研究(B),小区分03030:アジア史およびアフリカ史関連,釈迦院遺跡,ハルザン・シレグ遺跡,草原のシルクロード,モンゴル帝国,,,,,,,,,,,,,,,,,,,,,,,,,,,,,,,,,,,,,,,,,,,,,,,,,,,,
23K25376,京都女子大学,箱田 恵子,モリソンコレクション形成過程の総合的分析による東アジアをめぐる知的体系の解明,本研究は、東洋文庫が所蔵するモリソンコレクションの形成過程の分析を通じ、コレクションに反映される東アジアをめぐる当時の世界の知識・認識の在り方、その共有の在り方を総合的に捉えようとするものである。本研究では、宣教師関連文献、地理書・旅行記、時事パンフレットというコレクションを特徴づける資料を取り上げ、精緻な分析を加える。あわせて、G.E.モリソン自身の多面的な活動とコレクションとの関係について、彼の日記をはじめとする関連資料の渉猟と新しい情報技術を活用した分析により、コレクション形成の背景にあった人的・知的ネットワークや歴史的・文化的事実を明らかにし、当時の東アジアをめぐる知的体系を解明する。,基盤研究(B),小区分03030:アジア史およびアフリカ史関連,東洋文庫,モリソン文庫,モリソンコレクション,モリソン文書,東アジア,,,,,,,,,,,,,,,,,,,,,,,,,,,,,,,,,,,,,,,,,,,,,,,,,,,
23K25375,東北学院大学,小沼 孝博,近世・近代移行期のアジア山岳地域における峠の交通と地域変容,アジア内陸部の山岳地域は、隔絶された地理条件や文化の異質性から「辺境」視される嫌いがあり、また史料的な制約も相俟って、かつては歴史学の研究対象に選定されることは稀であった。しかし近年では、研究環境の改善や隣接分野の調査研究の進展もあり、多様な世界が重なりあう「境域」として関心が払われるようになった。このような潮流をふまえ、本研究では、近世・近代移行期におけるアジア山岳地域の地域社会像を、峠の交通と維持管理への関与のあり方、及びそれらに関連する制度・慣例・技術に着目して解明する。また峠の通行者、周辺の集落・集団、国家や宗教などの各アクターが取り結んでいた諸関係について地域間比較を行う。,基盤研究(B),小区分03030:アジア史およびアフリカ史関連,アジア,山岳地域,峠,交通,近世・近代移行期,山岳地帯,境界,国境,クルグズ,パキスタン,ヒマラヤ,,,,,,,,,,,,,,,,,,,,,,,,,,,,,,,,,,,,,,,,,,,,,
23K25374,宮城大学,山本 まゆみ,日本占領期インドネシアにおける「慰安婦」の総合的研究,本研究は、歴史の基礎である文書主義に立ち返り、史料を当時の社会の文脈で分析し、慰安婦の歴史を総合的に理解することを目的とする。,基盤研究(B),小区分03030:アジア史およびアフリカ史関連,慰安婦,日本占領期インドネシア,歴史人類学,ジェンダー,ポスト・コロニアル研究,,,,,,,,,,,,,,,,,,,,,,,,,,,,,,,,,,,,,,,,,,,,,,,,,,,
23K25373,大阪大学,田口 宏二朗,近代中国都市不動産政策の比較制度史的研究,本年も昨年度から引き続き、近世近代中国の土地不動産に関する史料収集・分析、および比較作業を継続する。具体的には、中華民国期の華中における諸都市（とりわけ南京市や上海市など）を中心として、不動産公示（土地登記）の際に集積された史料の整理・分析を行う。この作業を基礎として、特にムガール期・植民地期・独立後のインドにおける類似の制度との比較作業を繰り返す予定である。,基盤研究(B),小区分03030:アジア史およびアフリカ史関連,土地制度,不動産,中国,制度比較,インド,,,,,,,,,,,,,,,,,,,,,,,,,,,,,,,,,,,,,,,,,,,,,,,,,,,
23K25372,京都大学,石川 禎浩,中国共産党史資料の再構築に向けた基礎研究,中国共産党は、その存在意義を歴史決議によって顕彰しながらも、現実には近年歴史資料の公開を極度に制限し、研究著作の出版や内外の学術交流に厳しい枠を設けるなど、学術や言論活動への統制を強めている。このような状況が当面続くことを前提とした場合、これまで中国共産党史、現代史研究を成り立たせてきた研究活動の枠組自体を見直して、新たな資料基盤の構築を進める必要がある。本研究は、従来の中国共産党史研究の対中依存を脱却し、自立的かつ国際的な歴史研究を行うための方途を提示する試みである。,基盤研究(B),小区分03030:アジア史およびアフリカ史関連,中国共産党,中国現代史,共産主義,資料,,,,,,,,,,,,,,,,,,,,,,,,,,,,,,,,,,,,,,,,,,,,,,,,,,,,
23K25371,東京大学,森本 一夫,「スンナ派」と「シーア派」：自己意識と相互認識のイスラーム史研究にむけて,イスラーム史上の様々な場に現れ「スンナ派」「シーア派」と名乗った／他から呼ばれた多様な集団や個人のより適切な理解、同じくしばしば見られる「両宗派混淆」とされる状況のより正確な解釈を目指し、様々な場における「スンナ派」と「シーア派」の自己意識と相互認識を研究する。「スンナ派」「シーア派」という呼び名の揺らぎは重要な変化の時代に見られることが多い。本研究は、変化の相に着目したイスラーム史研究としての性格も持つ。,基盤研究(B),小区分03030:アジア史およびアフリカ史関連,イスラーム教,イスラーム史,スンナ派,シーア派,宗派意識,,,,,,,,,,,,,,,,,,,,,,,,,,,,,,,,,,,,,,,,,,,,,,,,,,,
24K00128,同志社大学,板垣 竜太,貫戦期日本の朝鮮人留学生の政治-文化史,本研究は、時間的には1945年8月の前後をまたがり、空間的には日本と(南北)朝鮮にまたがっているため、体系的な研究実施体制を整える必要がある。,基盤研究(B),小区分03030:アジア史およびアフリカ史関連,留学生,植民地,冷戦,越境,,,,,,,,,,,,,,,,,,,,,,,,,,,,,,,,,,,,,,,,,,,,,,,,,,,,
24K00127,慶應義塾大学,太田 淳,1900-1920年代の西ジャワ稲作農民の環境適応と幸福拡大に向けた「現地の知」の探究,本研究は、西ジャワの農民が1900-1920年代に異常気象や灌漑整備・プランテーション開発などの自然・社会環境要因にどのように対応しながら自給農業および商品作物栽培を維持し 幸福度の向上に努めていたのかを、オランダ植民地資料の文献調査と現地フィールドワークおよび自然科学の手法を通じて現代と比較しつつ明らかにするものである。気候の温暖化と極端化は現代の喫緊の課題であるが、植民地期に幾多の旱魃や洪水を乗り越え、異常気象や経済開発に対応しながら得られた西ジャワ社会のローカルナレッジは、食料の輸出向け大量生産 と地域向け安定生産の両立が求められるアジア現代社会に有用な視座を与えるものとなろう。,基盤研究(B),小区分03030:アジア史およびアフリカ史関連,ローカルナレッジ,環境,西ジャワ,農業,,,,,,,,,,,,,,,,,,,,,,,,,,,,,,,,,,,,,,,,,,,,,,,,,,,,
24K00126,神戸大学,真下 裕之,近世ユーラシアにおける帝国統合と〈軍事力〉の比較史的研究,本研究は近世ユーラシア諸帝国の統合に資した〈軍事力〉の構造や特質を、その人的基盤と物的基盤の二つの検討課題に即して、相互に比較・検討する方法を取る。検討課題をさらに8つの共通課題に細分したうえで、それぞれを主題とする定期研究会を実施して、メンバーの専門に則した知見の交換と総合を横断的に進めていく。こうして得られた総合的知見を実地に検討するため、インドおよびイランにおける、軍事史上の舞台となった城砦等を合同で実地に調査する。これらの知見は各年度にワークショップを開催して、国際的に共有するとともに、最終的な成果を国際シンポジウムの形で発信する予定である。,基盤研究(B),小区分03030:アジア史およびアフリカ史関連,ユーラシア帝国,軍事力,比較史,軍事エリート,城塞,,,,,,,,,,,,,,,,,,,,,,,,,,,,,,,,,,,,,,,,,,,,,,,,,,,
24K00125,大阪大学,坂尻 彰宏,石窟史料からみた河西回廊オアシス地域の研究,本研究では、オアシス地域の生活圏・信仰圏の核となる仏教石窟寺院を歴史資料としてあつかい、7～14世紀の河西回廊オアシス地域の歴史像を再構築する。中国・甘粛省西部の河西回廊オアシス地域には、地域の宗教的な拠点であった仏教石窟寺院群が残されている。本研究では、河西回廊オアシスの石窟史料を活用して、河西回廊オアシス地域の歴史研究に新たな局面を開くことを目指す。なお、本研究で用いる石窟史料とは、歴史資料としての石窟寺院の位置、景観、構造、壁画、仏像、供養人像、銘文等の総称である。,基盤研究(B),小区分03030:アジア史およびアフリカ史関連,河西回廊オアシス地域,敦煌オアシス,石窟史料,石窟寺院,敦煌石窟,,,,,,,,,,,,,,,,,,,,,,,,,,,,,,,,,,,,,,,,,,,,,,,,,,,
24K00124,京都大学,太田 出,東アジア海域・北太平洋をめぐる「新しい海洋史」――海洋観・海洋資源・海洋知,近年東アジアの海はさまざまな問題に直面しつつある。領海主権・領土主権をめぐる紛争、サケ・マス等の魚類、オットセイ・アザラシ等の海獣、クジラといった海洋資源の減少、メタンハイドレート・油田など海底資源の争奪等、国家間に跨がる重大な課題が山積している。これら諸問題の解決に取り組もうとする場合、歴史的な経緯や事実の丹念な発掘が求められるが、これまで十分には行われず、学術的な見地から検証されてこなかった。本研究では、東アジア史、アメリカ史、日本政治外交史、日本漁業史、台湾漁業外交史を専門とする研究者が、学問横断的に協力しながら“歴史の中に現代の海洋問題の諸根源を問う”作業を行っていく。,基盤研究(B),小区分03030:アジア史およびアフリカ史関連,海洋史,海洋観,海洋資源,海洋知,西北太平洋,,,,,,,,,,,,,,,,,,,,,,,,,,,,,,,,,,,,,,,,,,,,,,,,,,,
24K00123,新潟大学,村上 正和,清朝政府・社会の災害対応に関する総合的・比較史的研究,本研究は、災害への対応という視点から清代史研究を進めていくことを目指す。そのために清朝中央政府、地方政府、地域社会の人々が災害にどのように対応したのかを、様々な地域を対象にして実証的に論じていく。そしてその成果を総合して近世から近代にかけての災害対応の基調とその変化について分析する。またアジア諸地域との比較も並行して行うことで、清代における災害対応の特質や、他の地域との共通点などを議論していく。,基盤研究(B),小区分03030:アジア史およびアフリカ史関連,清朝,災害,嘉慶,道光,,,,,,,,,,,,,,,,,,,,,,,,,,,,,,,,,,,,,,,,,,,,,,,,,,,,
24K00122,東京大学,城山 智子,近現代中国における水利と水害―気象・水文データによる環境・社会連関の解明,黄河や長江等の大河を始めとする河川流域や湖沼の周辺に、大人口を有する中国では、「水利」と呼ばれる水管理は、歴史的に社会経済と政治行政の基礎であり、各時代・各地の水利に関する研究も蓄積されてきた。近年来の地球環境とエネルギー利用の長期的展開に関する問題関心を受けて、本研究では、歴史学者と、気象学、水文学の研究者が協働し、19世紀半ばから20世紀末までの百年余りについて、19世紀以降、中国各地で行われ始めた気象・水文の定期観測のデータと、モデルを応用した解析から、過去の自然環境を再現し、その中に人間の営為を位置付けていくことにより、自然環境と人間社会の相互関係の動態を明らかにしていく。,基盤研究(B),小区分03030:アジア史およびアフリカ史関連,水利,水害,中国,環境,気象,,,,,,,,,,,,,,,,,,,,,,,,,,,,,,,,,,,,,,,,,,,,,,,,,,,
24K00121,筑波大学,塩谷 哲史,近現代中央アジアの水利行政と社会の持続性,本研究は、政治・社会変動および自然環境の変化の影響を多大に受けながらも、持続的な水利行政と制度を継続させてきた中央アジア社会の動態とその構造を解明する。中央アジアのオアシス社会は、騎馬遊牧民の度重なる征服やロシア・ソ連という帝国権力による大規模な社会変革を経験したが、そこに存在する強固かつ不変化な政治的、社会的、文化的伝統は、現代においてもなお生活の様々な側面で看取できる。本研究は、乾燥地域の社会の存立に不可欠な水資源を差配する水利行政に着目し、そうした強固な伝統の存在とその存続理由を示すものとなろう。,基盤研究(B),小区分03030:アジア史およびアフリカ史関連,水利灌漑,アラル海流域,アム川,フェルガナ,ザラフシャン川,,,,,,,,,,,,,,,,,,,,,,,,,,,,,,,,,,,,,,,,,,,,,,,,,,,
24K00120,山形大学,中村 篤志,清代モンゴル地図の総合的研究,本研究は、清朝統治下のモンゴルで作成された行政図のうち、特に調査研究・保存保護が十全になされていないモンゴル国立図書館所蔵地図を中心に、地図に描かれた地形や寺院をGISにより空間分析し、幾つかの地域において、聞き取り調査やドローンを用いた3D画像の撮影を行う。これらの知見を、文書史料を用いた社会史研究の知見と総合し、清代の行政区画、土地利用、地方寺院の特徴とその変遷過程を多角的に分析する。,基盤研究(B),小区分03030:アジア史およびアフリカ史関連,モンゴル史,地図史料,文化財,土地利用,,,,,,,,,,,,,,,,,,,,,,,,,,,,,,,,,,,,,,,,,,,,,,,,,,,,
24K00119,東北大学,阿南 友亮,大国の狭間の中国内戦―1940年代における日米ソの対中軍事作用とその影響,本研究は、「日本、米国、ソ連の対中軍事作戦や軍事支援が中国内戦の趨勢に決定的な影響を及ぼした」という仮説を設定し、中国、台湾、日本、米国における史料調査に基づく実証研究によってその仮説を検証する取組である。これまで中国の国内事情に焦点をあてて論じられてきた中国内戦およびその結果としての中華人民共和国誕生の過程を国際政治の文脈で捉え直すことが本研究の意義といえる。,基盤研究(B),小区分03030:アジア史およびアフリカ史関連,中国政治史,中国内戦,中国共産党,中国国民党,,,,,,,,,,,,,,,,,,,,,,,,,,,,,,,,,,,,,,,,,,,,,,,,,,,,
25K00510,関西大学,藤田 高夫,AIを活用した中国木簡の筆跡分析の方途創出,研究は、木簡筆跡に内在する多様な非言語情報を定量化し、木簡の総体的研究を新たな段階に推し進めるものである。そして、膨大な数量の筆跡分析を基礎として、木簡を書写した下層官吏たちの営為を復元し、中国古代社会の実態解明を目指すものである。具体的には（Ａ）筆跡情報の定量化、（Ｂ）AI技術による筆跡データセットの半自動生成、（Ｃ）筆跡研究プラットフォーム構築、という研究項目を実現し、目的の達成を期す。,基盤研究(B),小区分03030:アジア史およびアフリカ史関連,木簡,筆跡,情報の定量化,AIによる自動生成,筆跡研究プラットフォーム,,,,,,,,,,,,,,,,,,,,,,,,,,,,,,,,,,,,,,,,,,,,,,,,,,,
25K00509,東洋大学,西村 陽子,シルクロード探検隊撮影古写真の時空間照合による新旧考古情報の統合,本課題は、2023年度に実施した中・独での長期在外研究の成果に基づきドイツ=トルファン探険隊が撮影しつつ未整理のまま残されてきた高解像度古写真を中心として、各国探険隊が撮影した古写真を総合的に解析し、探険隊調査遺跡の当時の景観を全面的に復原することでシルクロード探険隊の考古基礎情報を拡張し、新旧の考古情報の統合を図る。本目的を達成するために、1)独・露・英・仏・中・日の探険隊古写真の解析と探険隊調査遺跡の景観復原を行い現況との対応関係を把握し、2）現地における追加調査を実施し、3）データ分析と公開のシルクロード遺跡データベース、新旧写真比較ツールのメモリーグラフ等の研究基盤の発展に取り組む。,基盤研究(B),小区分03030:アジア史およびアフリカ史関連,シルクロード,遺跡,探険隊,GIS,データベース,,,,,,,,,,,,,,,,,,,,,,,,,,,,,,,,,,,,,,,,,,,,,,,,,,,
25K00508,九州大学,小林 亮介,「チベット仏教圏」からみた近代中央ユーラシアと日本：帝国日本との関係を中心に,これまで、近代中央ユーラシア史は、英国・ロシア・日本・中国など帝国間・大国間の競合の狭間で「周縁化」が進んだ地域の歴史とみなされ、受動的に解釈される傾向にあった。本研究は、当時の日本・アジア・欧米を横断した各地の仏教徒たちの活動に注目し、これを、ヒマラヤ・チベット・モンゴル・満洲などを包摂する「チベット仏教圏」を中核としてユーラシア規模で広がる仏教者ネットワークの形成・展開の過程として捉え直す。そして、近代中央ユーラシア史像、さらに近代日本とユーラシアの関係史を、チベット仏教圏内外の政治的・宗教的動態から見直すことを目的とする。,基盤研究(B),小区分03030:アジア史およびアフリカ史関連,中央ユーラシア,チベット,モンゴル,チベット仏教,日本,,,,,,,,,,,,,,,,,,,,,,,,,,,,,,,,,,,,,,,,,,,,,,,,,,,
25K00507,大阪大学,池田 一人,ミャンマー史における1947年神話の形成と解体についての研究,ミャンマーにおける1947年神話とは、独立の英雄アウンサンとビルマ・ナショナリスト組織タキン党の功績を無謬とする国民的な物語で、独立以来ミャンマー国史の中核部分を構成する。2021年クーデター以後、この神話体制に破綻の兆しがみられる。本研究ではこのその形成過程、排除してきたものを明らかにして、新しい1947年像、新しいミャンマー現代史を提示することを課題とし、現ミャンマーの変動する政治状況に一貫した歴史的視野を与えることを目指す。本研究は、ミャンマー史研究に実績のある歴史学、政治学、人類学の研究者6人による総合的ミャンマー史研究プロジェクトである。,基盤研究(B),小区分03030:アジア史およびアフリカ史関連,ミャンマー,ビルマ,1947年政治,神話,歴史観,,,,,,,,,,,,,,,,,,,,,,,,,,,,,,,,,,,,,,,,,,,,,,,,,,,
25K00506,京都大学,西田 愛,古代から中世へ -西チベット新出史料による帝国崩壊前後のチベット史の再検討-,本研究では、未だ歴史研究に十分に活用されていない新出の西チベット史料（10世紀以降）の研究に取り組む。チベットの古代史と中世史の専門家、また歴史学のみならず仏教学や美術史、考古学の専門家からなる学際的な研究体制のもと、西チベット史料を俯瞰的に研究し、チベット史の文脈に位置付ける。従来は連続的に語られてこなかった、古代から中世初期に至るチベット史の継承と展開の具体的様相を明らかにすることを目指すものである。,基盤研究(B),小区分03030:アジア史およびアフリカ史関連,チベット史,西チベット,新出写本,中央アジア出土文献,石刻資料,,,,,,,,,,,,,,,,,,,,,,,,,,,,,,,,,,,,,,,,,,,,,,,,,,,
25K00505,京都大学,宮宅 潔,中華帝国の誕生とその継承：秦漢期の統治制度と集団自意識の複眼的考察,本研究は、近年における世界的な研究動向をふまえ、世界史上、ほかに例を見ない中国の一体性が、どのような背景・要因により生み出されたのかを論じ、複眼的な視野から新たな古代史研究の可能性を模索することを企図した共同研究である。国際的、かつ分野横断的な協業体制の下、統治制度が形成されていく道程をより具体的に解明するとともに、言語や習俗など、集団の一体性を支えるイデオロギーや、「統一体としての中国」というコンセプトが構築される過程を、文字文化、民間習俗、国家儀礼に注目して再検討する。,基盤研究(B),小区分03030:アジア史およびアフリカ史関連,中国古代,統治制度,集団的アイデンティティ,,,,,,,,,,,,,,,,,,,,,,,,,,,,,,,,,,,,,,,,,,,,,,,,,,,,,
