awardnumber,organization,name,title,abstract,section,review_section,keyword1,keyword2,keyword3,keyword4,keyword5,keyword6,keyword7,keyword8,keyword9,keyword10,keyword11,keyword12,keyword13,keyword14,keyword15,keyword16,keyword17,keyword18,keyword19,keyword20,keyword21,keyword22,keyword23,keyword24,keyword25,keyword26,keyword27,keyword28,keyword29,keyword30,keyword31,keyword32,keyword33,keyword34,keyword35,keyword36,keyword37,keyword38,keyword39,keyword40,keyword41,keyword42,keyword43,keyword44,keyword45,keyword46,keyword47,keyword48,keyword49,keyword50,keyword51,keyword52,keyword53,keyword54,keyword55,keyword56
22K18822,東京大学,澤田 洋平,水害予測におけるオオカミ少年効果の理論・実証分析：新しい水害警報の設計への挑戦,水害の激甚化が進んでおり、高い計算能力をフルに活かした確率的気象予測を有効に用いて人命を守ることが求められている。確率予測を使えば捕捉率の高い警報を発することができるが、捕捉率の高い警報は空振りも多い。そのため人々が気象警報を信用せず、避難行動を促せなくなる恐れがある。このようなオオカミ少年効果の発現を定量化し気象警報の設計に役立てた研究は皆無だ。本研究では数理モデルと災害統計を組み合わせる独自のアプローチにより日本におけるオオカミ少年効果の理論・実証分析にチャレンジする。,挑戦的研究(萌芽),中区分22:土木工学およびその関連分野,オオカミ少年効果,水害予測,水害警報,,,,,,,,,,,,,,,,,,,,,,,,,,,,,,,,,,,,,,,,,,,,,,,,,,,,,
22K18821,千葉大学,小槻 峻司,スパースセンサ最適化による費用対効果の高い観測位置決定手法の開拓,本研究では、情報科学分野で深化したスパースセンサ最適化手法を水工学に応用し、費用対効果の高い観測位置決定手法を開拓することである。(1)「気象庁の2船舶を東シナ海のどこに配置しゾンデにより大気プロファイルを観測すると、集中豪雨予測を改善できるか」、(2)「新たな地表面フラックス観測をアジア圏のどこに設置すると、陸域水熱収支推定を効率的に改善できるか」という2つの問いを探求する。観測位置最適化を含む新しい観測システムシミュレーション実験により、実務者/観測研究者を納得させうる効果を証明し、気象庁やAsia Fluxとの共同実証実験への展開に挑戦する。,挑戦的研究(萌芽),中区分22:土木工学およびその関連分野,観測位置最適化,データ同化,数値気象予測,データ駆動型,陸域モデル,,,,,,,,,,,,,,,,,,,,,,,,,,,,,,,,,,,,,,,,,,,,,,,,,,,
22K18820,群馬大学,伊藤 司,マイノリティ微生物によるマジョリティ機能の誘導機構の解明,存在割合1%の微生物Aが存在割合99%の微生物Bの機能向上効果（速度向上、早期機能発現、持続性向上）をもたらすメカニズムを解明する。アンバランスに思える1:99の存在比におけるA・B両微生物の細胞内外代謝と相互作用に着目し、少数の微生物Aの存在により無関係にみえる大多数の微生物Bの細胞全体の代謝活性がどのように高まり、微生物Bの機能発現に繋がっているのかを機構解明する。,挑戦的研究(萌芽),中区分22:土木工学およびその関連分野,相互作用,多様性,Bacillus,持続可能性,微生物,脱色,メタボローム,持続可能,,,,,,,,,,,,,,,,,,,,,,,,,,,,,,,,,,,,,,,,,,,,,,,,
22K18819,宇都宮大学,藤倉 修一,構造物の耐久性を飛躍的に向上させる新材料を用いたプレストレス導入法の開発,近年，構造物の老朽化が大きな社会問題となり，既設構造物の補修・補強が急務である．このような背景から，RC構造物を複数に分割し，工場製作されたプレキャスト部材を現場で接合する工法が注目を集めているが，接合部は現場で施工されるため，弱点となり耐久性が懸念されている．接合部にプレストレスを導入し耐久性を向上する例もあるが，施工上やコストの問題があり，耐久性を向上する有効な手段が存在しない．そこで，本研究では，異分野である金属材料工学と構造工学を融合することにより，構造物の耐久性向上を目指し，新しい形状記憶合金を開発するとともに，低価格で新たなプレストレス導入方法の開発を目指す．,挑戦的研究(萌芽),中区分22:土木工学およびその関連分野,プレストレス,形状記憶合金,マルテンサイト変態,ヒステリシス,コンクリート部材,プレストレス導入,耐久性向上,コンクリート構造物,,,,,,,,,,,,,,,,,,,,,,,,,,,,,,,,,,,,,,,,,,,,,,,,
22K18818,東北大学,久保田 健吾,廃水処理における除去メカニズム解明のためのウイルスの視覚的・特異的検出技術の開発,生物学的廃水処理におけるウイルス除去機構は未解明である。廃水処理活性汚泥中に存在する微生物による吸着が、ウイルス除去に一役買っていることを示唆する結果が報告されている。一方で、微生物やウイルスの多くが人為的に培養できないことを踏まえると、微生物とウイルスの結合性を調べるためには、視覚的に検出・同定する方法が必要である。そこで本研究では、活性汚泥における微生物とウイルスの結合性を視覚的に明らかにするために、ウイルスを培養に依らず特異的に検出可能な技術を開発する。,挑戦的研究(萌芽),中区分22:土木工学およびその関連分野,視覚的検出技術,,,,,,,,,,,,,,,,,,,,,,,,,,,,,,,,,,,,,,,,,,,,,,,,,,,,,,,
22K18817,北海道大学,白崎 伸隆,汎用細胞増殖系を活用した浄水処理工程におけるサポウイルスの未知動態の解明,本研究では，サポウイルスを増殖可能な汎用細胞を活用することにより，添加実験の実施に必要なサポウイルスの高濃度ストックを調整可能な高効率培養法を構築すると共に，浄水処理におけるサポウイルスの感染性の消長を定量的に評価可能な感染性評価手法を構築し，これらを駆使することにより，これまで全く明らかにされていないサポウイルスの浄水処理性（ろ過における除去特性，消毒における不活化特性）を詳細に把握する．,挑戦的研究(萌芽),中区分22:土木工学およびその関連分野,病原ウイルス,ヒトサポウイルス,マウスノロウイルス,トウガラシ微斑ウイルス,細胞培養増殖系,ウイルス精製法,感染性評価手法,浄水処理,ウイルス添加実験,サポウイルス,汎用細胞増殖系,,,,,,,,,,,,,,,,,,,,,,,,,,,,,,,,,,,,,,,,,,,,,
23K17780,国立研究開発法人海洋研究開発機構,堀 宗朗,高性能計算利用のための土木系応用力学の解析理論の考案,自然災害の評価を念頭に，計算量を削減しても精度・分解能が確保できる効率的な数値解析のための理論を構築する．広域が対象となるため，高性能計算の利用が前提となる数値解析である．解析理論の要諦は曲線座標の利用である．これは「数値解析に適した座標系は何か」という学術的な問いの答えることも意図している．曲梁・シェルや河道・水系に適した曲線座標を微分幾何学に基づいて厳密に取扱い，この曲線座標での適切な微分方程式の導出と関数の離散化を考案する．直交座標の利用を前提とした従来の数値解析を超える，効率的な数値解析を実現する数値解析の理論構築を目指す．,挑戦的研究(萌芽),中区分22:土木工学およびその関連分野,数値解析理論,高性能計算,曲線座標,構造力学計算,河道力学計算,,,,,,,,,,,,,,,,,,,,,,,,,,,,,,,,,,,,,,,,,,,,,,,,,,,
23K17779,国立研究開発法人海上・港湾・航空技術研究所,川端 雄一郎,深海という極限環境に耐え得るセメント系材料の開発,深海は「地球に残された最後のフロンティア」と称されており，深海をより有効に利用できれば，我が国の国際競争力は飛躍的に高まると期待できる。今後深海を有効に活用するためには，深海底にインフラの構築が不可欠となるが，深海に適したインフラ材料，特にセメント系材料はこれまで検討されていない。本研究は，深海という極限環境に適用可能なセメント系材料の開発を目的として，高水圧による物理的損傷，また低温海水による化学的変質に対して抵抗性の高いセメント系材料を開発する。具体的には，物理的損傷，化学的変質それぞれに抵抗性の高いセメント系材料を室内実験で開発・検証する。,挑戦的研究(萌芽),中区分22:土木工学およびその関連分野,深海,セメント系材料,水圧,低温海水,,,,,,,,,,,,,,,,,,,,,,,,,,,,,,,,,,,,,,,,,,,,,,,,,,,,
23K17778,神奈川大学,森 淳一,先端環境観測技術を応用した長期音響暴露反応に基づく動物の行動管理法の構築,本研究では、バードストライク、ロードキル、畜産動物疫病等の野生動物によるインフラやライフラインの獣害を抑制するために、動物を対象とした音響暴露の実験室実験を行い、音信号を用いた動物の行動管理法を構築することが目的である。動物は環境に対する馴化能力が高いために、各試験は動物への福祉と生命倫理を考慮しつつ、中長期間を通して進める。この種の試験を遂行するためには、音響学、生物学等の知識の他に、長期間における動物の感情・行動を理解する客観的な判定技術が必要で、本件では、近年の発展が目覚ましい、動体検出や機械学習等の知覚・知能情報処理技術を応用する。,挑戦的研究(萌芽),中区分22:土木工学およびその関連分野,音響暴露実験室実験,指向性スピーカの検討,システムの構築,常時モニタリングシステム整備,実験条件検討,先端環境観測技術,長期音響暴露反応,動物の行動管理,動物の心理音響,感情行動反応,,,,,,,,,,,,,,,,,,,,,,,,,,,,,,,,,,,,,,,,,,,,,,
23K17777,高知工科大学,大内 雅博,極高濃度炭酸水浸漬による廃コンクリートの材料再生,本研究の目的は，廃コンクリートを極高濃度炭酸水に浸漬して原材料に分解する技術の確立を目標に，その成立の見通しを得ることである。二酸化炭素のみを材料として用いてコンクリートを原材料に分解する技術を構築する。本応募課題は、使用後のコンクリートからの材料再生技術を開発するものであり、最終処分せざるを得ないコンクリートの廃棄の現状を物質循環可能に転換させるものである。本研究の成果により、コンクリートの低環境負荷による物質循環が大きく革新・確立され、有限な鉱物資源供給と最終処分場所確保の問題が解決されることを意図している。,挑戦的研究(萌芽),中区分22:土木工学およびその関連分野,材料再生,物質循環,高濃度炭酸水,カルシウムシリケート水和物,水酸カルシウム,炭酸濃度,加圧容器,二酸化炭素,セメント硬化体の分解,炭酸化,,,,,,,,,,,,,,,,,,,,,,,,,,,,,,,,,,,,,,,,,,,,,,
23K17776,広島大学,内田 龍彦,渦と波の原理を応用した洪水時の水面撮影動画からの水面下の流れと河床の革新的推定法,本研究では水面流況から水面下の流れや河床を推定するために，申請者らの開発した流れ数値解析法と水面の画像解析技術を組み合わせる．水面流況の平均構造は大きな流れの三次元渦構造は水深平均流速場から決定されることから，渦糸の運動を引き起こす流れ場の推定問題とすることができると考えた．この検討は壁法則の開発そのものであり，これまで曖昧とされてきたサブグリッドスケールの三次元流と乱流を分離した新たな壁法則の展開に繋がり，その成果は環境流体研究全体に波及する．さらにこの成果を水面の高精度解析にフィードバックさせ，重力波の波速分布と流速分布の変形量を抽出し，河床形状，河床粗度の推定法に挑戦する．,挑戦的研究(萌芽),中区分22:土木工学およびその関連分野,渦,波速,水面画像,PIV,水面変動,水面流速計測,波,洪水流,壁法則,,,,,,,,,,,,,,,,,,,,,,,,,,,,,,,,,,,,,,,,,,,,,,,
23K17775,京都大学,藤井 聡,ビッグデータとマクロシステム生態学に基づく東京一極集中メカニズムの処方的研究,本研究は、人口や経済力の東京一極集中をもたらした要因を分析し、そのメカニズム記述するとともに解決策を検討することを目的とする。人口や経済力の地理的分布は多様な要因に影響されるため、膨大なデータを利用する必要がある。また、企業や個人などの各主体のミクロな行動と、国レベル・地域レベルで生じるマクロな現象とを統合的に分析する必要もある。そこで本研究では、生態系においてビッグデータを用いてミクロ・マクロの両システムを統合的に記述することを試みている「マクロシステム生態学」のアプローチを応用し、東京一極集中メカニズムの記述と、道路ネットワーク拡充のような集中緩和策の効果の検証を行う。,挑戦的研究(萌芽),中区分22:土木工学およびその関連分野,東京一極集中,生態学,機械学習,マクロシステム生態学,定住型社会,人口,インフラ,地方振興,,,,,,,,,,,,,,,,,,,,,,,,,,,,,,,,,,,,,,,,,,,,,,,,
23K17774,京都大学,岩井 裕正,力学系理論で紐解くn体問題としての粒状体の流れ～定常状態からの分岐に着目して～,本研究が見据える最終的な目標は，斜面を流下する落石や土石流などの“粒状体流れ”の 運動に支配的な影響因子を明らかにすることで，「なぜ落石や土石流が人命を脅かすまでに加速し大規模化するのか？」という問いに答えることである。,挑戦的研究(萌芽),中区分22:土木工学およびその関連分野,粒状体流れ,力学系理論,個別要素法,定常状態,Micro-polar fluid,分岐現象,初期値鋭敏性,個別要素法解析,,,,,,,,,,,,,,,,,,,,,,,,,,,,,,,,,,,,,,,,,,,,,,,,
23K17773,京都大学,中道 治久,光ファイバーと分散型音響計測システムを用いた火山性土石流の速度の決定,光ファイバーと分散型音響計測システム（DAS）を用いて桜島の火山性土石流の検知し、土石流の速度を決定することを目的とする。土石流の検知はワイヤーセンサーとカメラにて行われ、前者であればワイヤー破損が生じ、後者であれば夜間や悪天候時の土石流の見逃しがある。本研究で提案する手法は土石流に伴う振動を観測するため、直接的な土石流の影響を受けず、天候に左右されずに土石流検知が可能である。本研究が成功すれば、砂防施設の土石流の流下方向に延長している光ファイバーに適用可能であるため、火山以外の土石流への適用といった発展性がある。,挑戦的研究(萌芽),中区分22:土木工学およびその関連分野,光ファイバー,土石流,分散型音響計測,桜島火山,火砕物,分散型音響計測システム,地震観測,,,,,,,,,,,,,,,,,,,,,,,,,,,,,,,,,,,,,,,,,,,,,,,,,
23K17772,名古屋工業大学,前田 健一,粒状体流れのマルチスケール動力学の解明：土砂災害防止策の新パラダイムをめざして,粒子濃度が高く、大きな運動エネルギーを持つ粒子流れである土砂流の挙動を二重性（粒子性と波動性）に着目した量子力学的視点とマルチスケールな視点から捉える。従来から難題とされてきた、粒子特性や河床特性（勾配や粗度）が異なる場合の流れのパターン（流れ構造等）を合理的に分類可能な力学指標・法則の発見や大きな粒子の浮き上がり現象や分級などの特徴的挙動の統一的解釈について、学術的突破口を切り開く、全く新しい学理、ダイナミクスの発見、構築が目的である。,挑戦的研究(萌芽),中区分22:土木工学およびその関連分野,マイクロメカニクス,マルチスケール,二重性,粒状体,個別要素法,,,,,,,,,,,,,,,,,,,,,,,,,,,,,,,,,,,,,,,,,,,,,,,,,,,
23K17771,名古屋工業大学,京川 裕之,オゾンによる地盤の酸化促進実験と反応予測マルチフィジックス解析,世界中に広く分布する黄鉄鉱を含む酸性硫酸塩土壌は，有機酸などにより黄鉄鉱が酸化されることで硫酸が発生し，土木工学的諸問題の素因となる．しかしながら，黄鉄鉱の酸化は実地盤中で数十年と長い年月を要するため，酸性硫酸塩土壌の酸化・風化をタイムスケールから議論した研究はこれまでにない．,挑戦的研究(萌芽),中区分22:土木工学およびその関連分野,酸化,黄鉄鉱,オゾン,珪藻泥岩,酸性硫酸塩土壌,風化,マルチフィジックス解析,,,,,,,,,,,,,,,,,,,,,,,,,,,,,,,,,,,,,,,,,,,,,,,,,
23K17770,電気通信大学,松本 光春,生分解性材料により構成された植物内包型ロボットスキンの実現,本研究課題の実現にあたり、まずはロボットスキンとしての植物の利用可能性や過酷状況下における植物の物理・化学特性について調査する．,挑戦的研究(萌芽),中区分22:土木工学およびその関連分野,ロボット,ロボットスキン,植物,,,,,,,,,,,,,,,,,,,,,,,,,,,,,,,,,,,,,,,,,,,,,,,,,,,,,
23K17769,東京大学,清田 隆,災害史上稀にみる長距離地盤流動のリスク地域の比定と対応策に関する研究,2018年インドネシア・スラウェシ島地震で発生したPalu市の大規模地盤流動は、超緩斜面地盤で数百m～1km以上の流動が複数個所で発生し、2000人を超える死者を出した。この地盤災害は世界的にも稀であり、同様の壊滅的な地盤流動の可能性を有する地域の比定とリスクの検討は危機管理上非常に需要である。本研究では、被災地調査に基づく知見と室内実験および数値解析により、地震時における地盤流動の発生条件を整理する。また、GISによる広域的な分析により、被災地と整合する地形・地盤条件を有する地域の比定を目指すと共に、詳細なフィールド調査を通じて将来的に発生し得る地震を考慮した被害予測と対策の道筋を示す。,挑戦的研究(萌芽),中区分22:土木工学およびその関連分野,大規模地盤流動,液状化,スラウェシ島地震,被圧地下水,地盤流動,インドネシア・スラウェシ島地震,現場調査,GIS,,,,,,,,,,,,,,,,,,,,,,,,,,,,,,,,,,,,,,,,,,,,,,,,
23K17768,埼玉大学,浅本 晋吾,塩化物を高含有したコンクリートの腐食抑制効果と物性評価,本研究は，鉄筋コンクリートの最も有害物質の一つである塩分を，コンクリートの練り混ぜ水の飽和濃度近くまで意図的に添加し，内部鉄筋腐食の抑制を試みる，世界で類例のない萌芽研究である．一般的にコンクリートに含まれる塩化物イオンには制限値があるが，死海など高濃度の塩分を含有した場合，溶存酸素濃度の低下により鉄筋腐食速度が抑制されることが報告されており，本研究の着想を得た．高濃度で塩化物イオンが内部に存在するコンクリートを開発し，鉄腐食抑制のみならず，産業副産物である混和材も活用しながら，強度や収縮といった力学的特性及び塩化物イオンの拡散現象の検討も行う．,挑戦的研究(萌芽),中区分22:土木工学およびその関連分野,高濃度塩化物イオン,腐食抑制,混和材,海水,海砂,,,,,,,,,,,,,,,,,,,,,,,,,,,,,,,,,,,,,,,,,,,,,,,,,,,
23K17767,北海道大学,佐藤 久,ポストPCR時代を見据えた宿主認識分子の検出に基づく病原体センサーの開発,本研究ではDNAアプタマーを用いて病原体が持つ宿主認識分子を検出することで、環境水中の病原体を検出する技術を開発する。研究期間（2年間）では、①アデノウイルス、ノロウイルス、ロタウイルス特異的DNAアプタマーの選抜、②光導波路装置を用いた病原体センサーの開発、③下水処理水中の病原体濃度の測定を行う。病原体の目標検出下限値を1mL中100個とする。申請者はPCRには課題があると考えており、PCRに変わる病原体検出技術が普及する社会に転換したいと考えている。本法が完成すれば、PCR法によらずに簡易に（混合のみ）、迅速に（10分）、低コスト（1回1円）で病原体を検出できる。,挑戦的研究(萌芽),中区分22:土木工学およびその関連分野,アプタマー,病原体,光導波路,下水,,,,,,,,,,,,,,,,,,,,,,,,,,,,,,,,,,,,,,,,,,,,,,,,,,,,
24K21639,国立研究開発法人国立環境研究所,青木 仁孝,好気性脱窒微生物ダークマターを対象とした新たな培養戦略の構築,地球上に存在する原核生物の大部分はこれまでに人為的な培養が達成されておらず、今日では「微生物ダークマター」と呼ばれている。微生物ダークマターが有する生物機能を活用した環境浄化技術の開発やそれらの物質循環における役割を理解する上で、それらを純粋培養することは重要な課題の1つである。しかし、純粋培養には多大な時間と労力が必要であり、従来式の培養法のみで微生物ダークマターを純粋化することは容易ではない。そこで本研究では、環境中における窒素循環の理解や栄養塩除去技術の開発に資する好気性脱窒反応に関与する微生物ダークマターを対象とし、それらを効率的に培養するための培養戦略の構築とその有効性の検証を行う。,挑戦的研究(萌芽),中区分22:土木工学およびその関連分野,微生物ダークマター,好気性脱窒,培養,,,,,,,,,,,,,,,,,,,,,,,,,,,,,,,,,,,,,,,,,,,,,,,,,,,,,
24K21638,関西大学,新井 泰彦,光学的測定技術を用いた座屈発生メカニズムの初期変形過程解明における新たな挑戦,座屈は、橋梁のような細長い部材で構成された構造物にとって小さな力で破壊をもたらす危険な現象である。発生過程においては、nmオーダーから急速に変形をmmオーダーへと拡大するとともに、面内・面外変形が同時に発生するために、実測が困難な現象である。古くから理論的解析がなされている。本研究では、実測値に基づく議論が十分になされていなかった座屈の発生初期過程を解析することが可能な実験的解析技術を提案する。さらに、この技術を広く工学分野に公開することで、我が国に座屈研究の拠点を築き、高度成長期に製作されたインフラに生じる座屈の評価・回避を目指すことで、安全・安心な社会インフラの維持を目指している。,挑戦的研究(萌芽),中区分22:土木工学およびその関連分野,座屈発生初期過程,実証的座屈研究手法,スペックル干渉計測,インフラの維持・管理,エンタシス,,,,,,,,,,,,,,,,,,,,,,,,,,,,,,,,,,,,,,,,,,,,,,,,,,,
24K21637,早稲田大学,秋山 充良,一軸引張を受ける劣化RC柱のX線連続撮影と腐食生成物を考慮した付着応力－すべり関係,本研究は，劣化RC部材の靭性評価の高精度化に資する付着応力－すべり関係の構築を目的とする．従来のRC部材の構成則開発の手順にX線撮影を加え，これにディープラーニングを介することで腐食生成物を自動で画像抽出し，その厚さおよび載荷実験中のその変形を可視化し，未腐食鉄筋・腐食生成物・コンクリート間の付着応力－すべり関係を新たに提案する．この成果は，劣化が進行するインフラ構造の性能評価の高度化に資するものになると期待される．,挑戦的研究(萌芽),中区分22:土木工学およびその関連分野,付着,腐食生成物,X線撮影,ディジタル画像処理,鉄筋腐食,,,,,,,,,,,,,,,,,,,,,,,,,,,,,,,,,,,,,,,,,,,,,,,,,,,
