awardnumber,organization,name,title,abstract,section,review_section,keyword1,keyword2,keyword3,keyword4,keyword5,keyword6,keyword7,keyword8,keyword9,keyword10,keyword11,keyword12,keyword13,keyword14,keyword15,keyword16,keyword17,keyword18,keyword19,keyword20,keyword21,keyword22,keyword23,keyword24,keyword25,keyword26,keyword27,keyword28,keyword29,keyword30,keyword31,keyword32,keyword33,keyword34,keyword35,keyword36,keyword37,keyword38,keyword39,keyword40,keyword41,keyword42,keyword43,keyword44,keyword45,keyword46,keyword47,keyword48,keyword49,keyword50,keyword51,keyword52,keyword53,keyword54,keyword55,keyword56
20K21022,愛媛大学,中畑 和之,ソフトマター薄膜中の超音波の伝搬特性の解明と非破壊検査技術への応用,ソフトマターは粘弾性的な性質を持つため，周波数毎に波動特性が変化することが想定され，さらに，薄膜中ではガイド波として伝搬することから，分散性とモード重畳性を発現することも想像できる．まず，ポリイミド薄膜について波動を計測して，その特徴を整理する．次に，一次元波動場に対して，これらの現象を数理的にモデル化する．最終的には，3次元粘弾性体を数値的に扱うため，複素弾性係数を組み入れた半解析的有限要素法を構築する．これらの知見を生かし，ソフトマター薄膜を広域にわたって効率的に検査するために，ガイド波の長距離伝搬の利点を活かした“波動の広高視野可視化”を軸とした非破壊検査法を提案する．,挑戦的研究(萌芽),中区分22:土木工学およびその関連分野,非破壊評価,ソフトマター,薄膜,波動伝搬,振動伝搬,ガイド波,広視野可視化,,,,,,,,,,,,,,,,,,,,,,,,,,,,,,,,,,,,,,,,,,,,,,,,,
20K21021,横浜国立大学,鈴木 崇之,ICレコーダーを用いて録音した波浪音による現地波浪情報のリアルタイム推定法の確立,本研究では，波浪場をより簡易，安価に計測できるよう陸上部にて波浪音をICレコーダーにより観測し，波浪データと比較検討することにより波高等の波浪情報推定式の提案を行い，波浪のリアルタイム推定を試みる．また，この観測を海岸地形形状の異なる複数の海岸において調査を実施することにより，底質中央粒径等の海岸特性をパラメータとして複数海岸においても適用可能となる提案式の開発を試みる．,挑戦的研究(萌芽),中区分22:土木工学およびその関連分野,波高予測,ICレコーダ,リアルタイム,相模灘,波浪予測,現地海岸,音,,,,,,,,,,,,,,,,,,,,,,,,,,,,,,,,,,,,,,,,,,,,,,,,,
20K21020,電気通信大学,松本 光春,非電気系により駆動する自壊型ロボットによる侵入不可能領域の構造物補修の実現,本研究では従来型ロボットが侵入不可能な領域の構造物の補修に焦点を当て，,挑戦的研究(萌芽),中区分22:土木工学およびその関連分野,ロボット,非電気駆動,,,,,,,,,,,,,,,,,,,,,,,,,,,,,,,,,,,,,,,,,,,,,,,,,,,,,,
20K21019,お茶の水女子大学,大瀧 雅寛,合成DNAを用いた汎用性の高いUV線量計の開発,通水型UV殺菌装置の性能評価には，UV耐性既知の生物を投入し，その生残率から装置内の平均的UV照射量を算定する生物線量計法が世界的にも一般的であるが，使用可能な生物は実質的には限られている．本研究は生物の代わりに合成DNAを用いることで，様々なUV耐性バリエーションをもつ線量計を開発することが目的である．UV照射による合成DNAのUV損傷を分断酵素とPCR法を併せて用いることで定量化する方法を試みる．,挑戦的研究(萌芽),中区分22:土木工学およびその関連分野,合成DNA,UV反応性,連続チミン対数,DNA二次構造,塩基配列,二次構造,自由エネルギー,UV線量計,チミン連続対,制限酵素,UV装置評価,UV耐性バリエーション,,,,,,,,,,,,,,,,,,,,,,,,,,,,,,,,,,,,,,,,,,,,
20K21018,東京大学,長井 宏平,人工衛星LandsatデータとAI分析による橋梁建設年推定システムの構築,人工衛星データとAIによる分析から世界中の建設年不明橋梁の建設年推定を可能にする手法を確立することが本研究の目的である。NASAのLandsatデータを用い，対象橋梁位置と周辺の過去から現在の衛星可視画像や，光学センサから得られる波長データの数値を用いて算出する正規化水指数NDWIや植生指標NDVIなどの水分情報に関する指標の変化の分析から，建設年を推定する仕組みを構築する。中規模と小規模橋梁に対しては，解像度の粗い画像や小さな指標の変化からも推定可能とする画像判定とデータ分析のAIシステムを開発する。,挑戦的研究(萌芽),中区分22:土木工学およびその関連分野,橋梁建設年推定,人工衛星,正規化水指数,橋梁建設年,人工衛星データ,推定,AI,Landsat,画像解析,,,,,,,,,,,,,,,,,,,,,,,,,,,,,,,,,,,,,,,,,,,,,,,
20K21017,筑波大学,谷口 守,インビジブルシティ（見えない都市）のエモーショナルな「見える化」まちづくり,本申請ではリモート化の進展による一方的な都市活動のサイバー化の実態を客観的に踏まえ、実空間とサイバー空間のバランスある発展を実現していくための道筋を提示する。その達成のために、ツイート内容に関する大規模な統計分析や、コロナ下でのリモート化推移に関する実態調査を重ね、両空間の長所をあわせもつハイブリッドシティの見える化を検討する。そのためには両空間の潜在連携ポテンシャルを定量的に明らかにし、どのような方策が有効かを具体的に検討する。あわせてその実装を促進する「化学反応」を起こすための様々なエモーショナルな「仕掛け」に言及する。,挑戦的研究(萌芽),中区分22:土木工学およびその関連分野,サイバー空間,ハイブリッドシティ,見えない都市,コロナ,感情,実空間,ワークプレイス・マネジメント,見える化,DX（デジタル・トランスフォーメーション）,,,,,,,,,,,,,,,,,,,,,,,,,,,,,,,,,,,,,,,,,,,,,,,
20K21016,筑波大学,安永 守利,大脳二次聴覚野モデルに基づくコンクリート打音検査装置,橋やトンネルなどの社会インフラの老朽化が進んでおり，その点検作業が急務となっている．一方，熟練点検者の数は年々減少しており，老朽化に対して点検作業が追い付いていない現状にある．,挑戦的研究(萌芽),中区分22:土木工学およびその関連分野,打音検査,大脳,自己組織化マップ,ニューラルネットワーク,コンクリート,FPGA,フォールトトレラント,フォールトトレランス,ニューラルネット,機械学習,,,,,,,,,,,,,,,,,,,,,,,,,,,,,,,,,,,,,,,,,,,,,,
20K21015,茨城大学,辻 龍介,レーザースポットよりも小さいアラゴスポットを用いた直線発生装置の開発,従来の建設現場等では、レーザー光を使った直線発生装置で直線上に建造物や大型装置を設置する。しかしレーザー光でも遠距離では広がるので高精度な直線が作れない。,挑戦的研究(萌芽),中区分22:土木工学およびその関連分野,アラゴスポット,直線発生,位置計測,極細直線発生,設置誤差検出,歪み検出,,,,,,,,,,,,,,,,,,,,,,,,,,,,,,,,,,,,,,,,,,,,,,,,,,
20K21014,東北大学,宮本 慎太郎,脱炭素社会構築への貢献を目的とした焼成工程を省略したセメントの開発,世界で最も消費されている建設材料はセメントであるが，セメントは製造時に石灰石を含むセメント原料を焼成するため，原燃料由来の二酸化炭素が大量に排出される。この工程によってCa，Si，Al，Feが混ざり合った水和活性を持つ酸化物（セメントクリンカー）が生成されるため，セメント製造には欠かせない工程である。本研究では，この原料の焼成という工程を省くことで，二酸化炭素の排出量を大幅にカットする技術の開発が大きな目的である。,挑戦的研究(萌芽),中区分22:土木工学およびその関連分野,アルカリ活性材料,収縮低減,副産物利用,寸法安定性,二水セッコウ,石灰石微粉末,セメントクリンカー,高炉スラグ微粉末,炭酸カルシウム,メタカオリン,熱力学的相平衡計算,廃棄物利用,新材料,混和材,石灰石,焼成粘土,,,,,,,,,,,,,,,,,,,,,,,,,,,,,,,,,,,,,,,,
20K21013,東北大学,内藤 英樹,移動型加振源とレーザー振動計を用いた鉄道構造物の高速検査技術,リニア中央新幹線やカリフォルニア高速鉄道の整備など、国内外において高速鉄道の需要が高まる中で、供用中の構造物や軌道内部までも検査できる、効率的かつ高精度な検査技術の開発が望まれている。本研究は、走行車両を用いて構造物や軌道内部を検査するため、i)移動型加振源を用いた高精度検査技術の開発、ii)AIを用いた波形処理高速化と移動型検査への応用、およびiii)AIを用いた新幹線軌道の劣化マップの更新・精緻化に取り組む。本研究成果は、次世代型の高精度検査車両の実現へと繋がり、新幹線をはじめとする高速鉄道の安全性と快適性の向上に大きく寄与できる。,挑戦的研究(萌芽),中区分22:土木工学およびその関連分野,コンクリート構造物,非破壊検査,点検・診断,ロボット,機械学習,点検,振動試験,ヘルスモニタリング,異常検知,ひび割れ,構造ヘルスモニタリング,振動,AI,,,,,,,,,,,,,,,,,,,,,,,,,,,,,,,,,,,,,,,,,,,
20K21012,北海道大学,白崎 伸隆,リバースジェネティクス法を用いたウイルス野生株・流行株の塩素消毒不活化特性の把握,本研究では，ゲノム解析による情報の集積が世界中で進む病原ウイルスの遺伝子塩基配列データと医学分野で研究が進むリバースジェネティクス法を活用することにより，塩基配列データから病原ウイルスの野生株・流行株の感染性ウイルスを人工合成し，得られたウイルス株を処理実験に用いることにより，単離や輸送による株の入手に頼ることなく，株の差異にまで踏み込んだ病原ウイルスの塩素消毒処理性（不活化特性）を詳細に把握する．,挑戦的研究(萌芽),中区分22:土木工学およびその関連分野,病原ウイルス,コクサッキーウイルス,コロナウイルス,浄水処理,塩素処理,ウイルス濃縮,高不活化率,テーリング現象,リバースジェネティクス法,ウイルス株,塩素消毒,消毒耐性,,,,,,,,,,,,,,,,,,,,,,,,,,,,,,,,,,,,,,,,,,,,
21K18756,早稲田大学,秋山 充良,配筋作業の省力化を可能にするSFRC杭と耐荷力保証のためのX線自動検査システム,少子高齢化の進展に伴い，建設産業における人手不足が深刻化している．本研究は，プレキャスト杭部材の製作工程の省力化とその品質管理体制の自動化に貢献することを目的とする．具体的には，遠心成形工法の活用により，せん断補強鉄筋の配筋作業を不要にした鋼繊維補強コンクリート（SFRC）杭を製造し，かつ，X線とディジタル画像処理により，その部材耐荷力の品質を自動で管理する一連のシステムの構築を目指すものである．,挑戦的研究(萌芽),中区分22:土木工学およびその関連分野,SFRC,遠心成形,せん断強度,寸法効果,X線撮影,ディジタル画像処理,省力化,鋼繊維,遠心成型,杭,鋼繊維補強コンクリート,せん断,プレキャストコンクリート杭,せん断耐力,プレキャスト,,,,,,,,,,,,,,,,,,,,,,,,,,,,,,,,,,,,,,,,,
21K18755,高知工科大学,佐藤 愼司,海洋プラスチックごみ削減に資する海岸漂着物の量と質の調査手法の確立,海洋プラスチックごみは、沿岸波浪の作用により、海岸に集積することが多い。したがって、海岸漂着物の特性を詳細に把握すれば、周辺海域のごみの量と質を推定でき、海洋ごみ削減の具体的な目標設定ができる。本研究では、マルチスペクトルカメラを装備したUAVによる調査手法を確立し，海岸漂着ごみの量と質を効率的に調査する。数km程度の長さの海岸における漂着ごみの特性を1日程度で調査できる比較的安価で簡便な手法の確立を目指す。簡便で実用的な手法を構築できれば、草の根活動として全国的に普及している海岸清掃活動などにおいて容易に導入でき、全国的な規模での調査が進むことを期待している。,挑戦的研究(萌芽),中区分22:土木工学およびその関連分野,海岸・海洋ごみ,プラスチックごみ,海岸ごみ回収,海岸ゴミ,マルチスペクトルカメラ,漂着ごみの回収,海浜堆積物,,,,,,,,,,,,,,,,,,,,,,,,,,,,,,,,,,,,,,,,,,,,,,,,,
21K18754,琉球大学,松原 仁,珪酸塩固定を実現する新しいジオバイオテクノロジーの創生,無降雨・無地震下における地盤災害が多発している中，環境性に優れた次世代型の地盤修復技術の開発が求められている。本研究は，高強度かつ経年劣化に強い次世代の岩石修復技術の確立を目指し，珪酸塩鉱物の析出と固定化を誘発する微生物を探索し，これを用いた新しいジオバイオテクノロジーの創生に挑むものである。,挑戦的研究(萌芽),中区分22:土木工学およびその関連分野,珪酸塩,ジオバイオテクノロジー,MISP,自己修復,地盤修復,,,,,,,,,,,,,,,,,,,,,,,,,,,,,,,,,,,,,,,,,,,,,,,,,,,
21K18753,鹿児島大学,児玉谷 仁,水処理システムにおける有機窒素化合物の網羅的モニタリング法の開発,持続可能な水資源の確保のため，廃水の再利用が進められているが，尿素やN-ニトロソアミン類などの低分子で非イオン性の有機窒素化学物質の再生水への混入が問題となっている．,挑戦的研究(萌芽),中区分22:土木工学およびその関連分野,低分子化合物,有機窒素化合物,硝酸,光化学反応,ルミノール,化学発光,紫外線,水処理,紫外線照射,硝酸イオン,ペルオキシナイトライト,ルミノール化学発光,窒素化合物,モニタリング,,,,,,,,,,,,,,,,,,,,,,,,,,,,,,,,,,,,,,,,,,
21K18752,九州大学,安福 規之,連続加圧場を活かした不飽和土の浸透・強度特性値評価の超効率・高精度化への挑戦,本研究は、これまで技術的に困難とされてきた不飽和土の浸透・強度特性値、つまり水分特性曲線と不飽和・飽和透水係数に加えて、水分特性に応じた強度定数を連動させて評価できるハイブリッド型の室内測定システムの構築に挑むものである。具体的な目標として、砂質系の不飽和土を対象として、水分特性と浸透特性値を得るのに必要な試験時間を従来の方法と比べて1/20程度の時間に短縮することを目指している。また、水分特性の給・排水履歴の効果を供試体をワンステップで一面せん断に供することのできる実用的なシステムの確立を行う。この取り組みを通して、実務として土砂移動現象の評価全般に広く展開できる環境を確立する。,挑戦的研究(萌芽),中区分22:土木工学およびその関連分野,不飽和土,水分特性曲線,不飽和透水係数,一面せん断強さ,吸排水履歴とせん断強さ,連続加圧型保水試験,ハイブリッド形式,不飽和一面せん断強さ,連続加圧場,不飽和浸透特性,吸水履歴とせん断強さ,,,,,,,,,,,,,,,,,,,,,,,,,,,,,,,,,,,,,,,,,,,,,
21K18751,高知大学,浦本 豪一郎,「掘りクズ」から「コア試料」への3Dデジタル転生による海底下超深部の岩石物性評価,"国際プロジェクトによる地震発生帯等の海底下超深度（＞3,000m）ボーリングコア掘削で採取される試料に「カッティングス」がある。これは米粒サイズの「掘りクズ」だが、超深度地下環境の情報を保持した貴重試料である。従来、カッティングスから超深度の地震発生帯の環境を知ることは困難だったが、本研究ではデジタルモデルと3Dプリント技術を組み合わせ、地震発生帯の模造岩石を作成することで、プレート境界断層帯の地下環境の復元を試みる。",挑戦的研究(萌芽),中区分22:土木工学およびその関連分野,カッティングス,3Dプリント,岩石物性,マイクロCT,3Dモデル,微細構造,空隙,,,,,,,,,,,,,,,,,,,,,,,,,,,,,,,,,,,,,,,,,,,,,,,,,
21K18750,広島大学,内田 龍彦,Available Porosity理論に基づく流体・混合粒径粒状体力学の新展開,混合粒径の土砂輸送解析においては領域平均可能なオイラー型の有効な解析手法が確立されておらず，半世紀近く未解決のままであり，河川，海岸や地形に関する多くの学術，技術の発展を妨げている．申請者はAvailable Porosity(AP)という新しい理論を提案し，粒径集団ごとに空間平均された連続式を理論的に定式化することに成功し，混合粒径土砂の最密空隙率の計算法を開発した．本研究はAP理論を応用し，流体・細粒子の混合粒径集合体への浸透過程，および混合粒径粒状体・流体の混相流動などマクロモデルによる検討が出来なかった問題のモデル化に挑戦するものである．,挑戦的研究(萌芽),中区分22:土木工学およびその関連分野,分級,空隙率,細粒土砂,利用可能空隙率,流速分布,掃流力,オイラー型混相流モデル,混合粒径,粗粒化,混合粒径流砂量式,AP理論,堆積実験,粒径比,粗粒子充填,細粒子充填,歪,浸透流,,,,,,,,,,,,,,,,,,,,,,,,,,,,,,,,,,,,,,,
21K18749,神戸大学,竹林 幹雄,大規模火山噴火による航空輸送への影響把握のための予測システムの開発,本研究は，活発な活動を続ける九州の活火山（主として桜島）を対象として，想定されうる航空輸送への影響を噴火シミュレーションとフライトデータとの連動により時空間レベルで把握し，噴火情報の更新に伴う最適フライトコントロール方法を海外の噴火事例とフライトコントロールデータとの解析から検討するとともに，航空機の被災回避行動と空港の収容能力との関連性についても考究し，最適フライトコントロールを行う上で望ましい空港整備の方向性について検討を加えることを目的とする．,挑戦的研究(萌芽),中区分22:土木工学およびその関連分野,航空輸送,火山噴火,BCP,フライトプラン,噴火,火山灰,シミュレーション,密度準拠クラスタリング,階層型クラスタリング,空路,火山,フライトコントロール,,,,,,,,,,,,,,,,,,,,,,,,,,,,,,,,,,,,,,,,,,,,
21K18748,京都大学,宮澤 理稔,光ファイバ通信ケーブルが拓く新しい活断層調査と構造のリアルタイムモニタリング,国の管理する河川・道路管理用光ファイバのうち、京都市～京丹波町の一般国道9号線沿いに敷設された約50kmを借り受け、分散型音響センシング(DAS)による測定を行い、地表の歪みの変化を約1ヶ月間にわたり連続測定する。この区間は、2018年大阪府北部地震域の北部を通過するため、余震が多数観測される可能性があり、DASによる地震観測を検証する。また、京都西山断層帯を跨ぐことや、桂川の橋梁等を通過するため、トラフィックノイズを解析することで地下構造や人工構造物の調査等も試みる。また気象現象に伴うノイズの特徴についても調査を行う。,挑戦的研究(萌芽),中区分22:土木工学およびその関連分野,分布型音響センシング,光ファイバー,地震活動,歪み波動場,地盤増幅率,交通量カウント,光ファイバーケーブル,DAS,振動測定,構造物,トラフィックシグナル,京都府南部,活断層,地震観測,光ケーブル,構造調査,,,,,,,,,,,,,,,,,,,,,,,,,,,,,,,,,,,,,,,,
21K18747,京都大学,田中 智大,水工学と都市計画学の融合による総合的治水対策の評価システムの構築,洪水災害のリスクを河川整備のみで対応することは非現実的であり，都市政策を組み合わせた総合的治水対策の重要性が長年叫ばれてきた．しかしながら，土木工学における研究分野は細分化しており，水工学分野での河川整備の評価と都市計画学分野での政策分析は独立している．本研究は，河川工学と都市計画学の学際融合により，洪水発生と立地選択の両方を表す新たなエージェントベースモデルを開発する．淀川流域中流部の京都市とその周辺域を対象に，開発した洪水発生・立地選択モデルを適用して河川・都市・気候が変化する中で壊滅的な損失を避ける河川・都市シナリオパスを分析する．,挑戦的研究(萌芽),中区分22:土木工学およびその関連分野,流域治水,立地適正化,立地選択,マルチエージェントモデル,洪水リスク,立地選択モデル,交通利便性,コンパクトシティ,立地適正化計画,アメニティ,公共交通,住宅価格,エージェントベースモデル,気候変動,立地誘導,水災保険,,,,,,,,,,,,,,,,,,,,,,,,,,,,,,,,,,,,,,,,
21K18746,静岡大学,石原 進,無線通信困難な地下空間でのドローン群活動のための高信頼無線ネットワーク技術の開発,下水道等の老朽地下管路の省力化、短時間検査をするための基盤技術として、複数の小型ドローンによる協調動作によって、長距離の無線通信が困難な地下管路内でも常時接続の映像通信、遠隔操作を可能とするための無線ネットワーク制御技術（通信品質・ドローンでの観測対象領域・移動計画に応じたドローン陣形の制御手法、ドローン陣形と通信品質に応じたデータ・制御パケットの送信制御手法）を開発する。,挑戦的研究(萌芽),中区分22:土木工学およびその関連分野,下水管検査,ドローン,映像ストリーミング,マルチホップ通信,無線LAN,位置追跡,下水道維持管理,UAV,マルチホップ無線通信,ビデオストリーミング,UAV隊形制御,音声ビーコン測位,マルチホップ無線ネットワーク,UAV陣形制御,位置推定,UWB,音声位置推定,映像伝送,アドホックネットワーク,,,,,,,,,,,,,,,,,,,,,,,,,,,,,,,,,,,,,
21K18745,長岡技術科学大学,豊田 浩史,微小ガラスビーズの自己膠結作用のメカニズム解明と地盤工学的利用,ガラスビーズに，圧密時間とともに初期せん断剛性率が増加していく明確な時間効果が現れた．一方，1年間計測を続けた豊浦砂には，時間にともなう変化は認められなかった．ガラスビーズ1ヶ月圧密と同等のせん断弾剛性率増加を得るためには，豊浦砂に質量比で約 1 % 弱のセメントを混入する必要があった．本研究では，ガラスビーズ試料の力学特性の変化（三軸試験），間隙水質の変化（イオンクロマトグラフ），析出物の分析（X線回折）を行い，自己膠結作用のメカニズムを解明する．これらの成果は，廃ガラスの処理法（地盤材料や地盤改良としての利用）の基礎データとなり，発展性は大きく，挑戦的研究としての意義は大きい．,挑戦的研究(萌芽),中区分22:土木工学およびその関連分野,ガラスビーズ,膠結作用,せん断剛性率,三軸試験,間隙水質,土質改良,液状化対策,年代効果,溶出試験,,,,,,,,,,,,,,,,,,,,,,,,,,,,,,,,,,,,,,,,,,,,,,,
