awardnumber,organization,name,title,abstract,section,review_section,keyword1,keyword2,keyword3,keyword4,keyword5,keyword6,keyword7,keyword8,keyword9,keyword10,keyword11,keyword12,keyword13,keyword14,keyword15,keyword16,keyword17,keyword18,keyword19,keyword20,keyword21,keyword22,keyword23,keyword24,keyword25,keyword26,keyword27,keyword28,keyword29,keyword30,keyword31,keyword32,keyword33,keyword34,keyword35,keyword36,keyword37,keyword38,keyword39,keyword40,keyword41,keyword42,keyword43,keyword44,keyword45,keyword46,keyword47,keyword48,keyword49,keyword50,keyword51,keyword52,keyword53,keyword54,keyword55,keyword56
18K18890,木更津工業高等専門学校,石井 建樹,岩石材料試験イノベーションを促進するマイクロクラック可視化技術の構築,本研究では，破壊力学に立脚する岩石破壊力学分野におけるイノベーションを促進するために，現在も定かではないマイクロクラックの形状を明らかにすること目指した基礎研究である．そのために必要な岩石中のマイクロクラックを可視化観察する安価な技術構築を目的としている．本研究では，蛍光樹脂を試験体に含浸するための手法を提案し，その性能を検討した．その成果として，蛍光樹脂を岩石内部に含浸させることができる２つの方法を提案することができた．また，それらの手法により観察されたマイクロクラックの形状を確認することができた．,挑戦的研究(萌芽),中区分22:土木工学およびその関連分野,岩盤,可視化,マイクロクラック,微視クラック,花崗岩,岩石,プラスティネーション,蛍光樹脂含浸,岩石材料,樹脂含浸,,,,,,,,,,,,,,,,,,,,,,,,,,,,,,,,,,,,,,,,,,,,,,
18K18889,中央大学,山村 寛,膜ファウリング物質を資化する好低温グラム陽性菌の単離と応用技術の開発,膜分離活性汚泥法は、既存の標準活性汚泥方と比較して極めて高度な処理水を得られる一方で、膜の目詰まりが課題となっている。本研究では、低温で膜ファウリング物質を分解しうる菌を探索することを目的として研究を実施した。低温で馴致した汚泥から、バイオポリマーを基質として利用する細菌を単離することに成功し、中温時とは全くことなる細菌が低温時に活動することが明らかとなった。また、低温時にこれらの細菌が活動することで、膜ファウリングが抑制できることも確認した。,挑戦的研究(萌芽),中区分22:土木工学およびその関連分野,膜分離活性汚泥法,酵素処理,膜ファウリング,細菌の単離,活性剤,バイオポリマー,酵素,バチルス属細菌,膜分離汚泥法,Membrane bioreactor,低水温,膜ろ過,枯草菌,酵素分解,好低温細菌,,,,,,,,,,,,,,,,,,,,,,,,,,,,,,,,,,,,,,,,,
18K18888,東北学院大学,中沢 正利,形状最適化アプローチに基づいたカンチレバー形式モジュール橋梁構造の設計と試作,カンチレバー形式橋梁を模した解析領域を工夫してトポロジー最適化計算を行ない、フォース鉄道橋と類似性のあるX形状の卓越した最適構造を得た。,挑戦的研究(萌芽),中区分22:土木工学およびその関連分野,トポロジー最適化,カンチレバー橋,周期性構造,基本モジュール,寸法最適化,試作,周期性構造物,3DCAD,3Dプリンター,単位モジュール,緊急橋,形状最適化アプローチ,カンチレバー形式,ポンツーン,,,,,,,,,,,,,,,,,,,,,,,,,,,,,,,,,,,,,,,,,,
18K18887,熊本大学,川越 保徳,酸素と光に高い耐性を有する新たなAnammox細菌の探索と土壌浄化技術への展開,土壌やオキシデーションディッチ施設（OD）汚泥などを植種源として回分実験，連続実験を行い，耐酸素能に優れるAnammox細菌の集積培養に挑戦した。,挑戦的研究(萌芽),中区分22:土木工学およびその関連分野,Anammox,酸素耐性,集積培養,Anammox細菌,好気,溶存酸素濃度,アナモックス,アナモックス細菌,光耐性,土壌修復,,,,,,,,,,,,,,,,,,,,,,,,,,,,,,,,,,,,,,,,,,,,,,
18K18886,九州大学,梶田 幸秀,ダイラタント流体を用いた落橋防止システム用緩衝材の適用可能性の検討,ダイラタント流体として水溶き片栗粉に対する重錘自由落下実験を行い衝撃力緩衝効果を確認した。比較対象として，橋梁分野でよく用いられている天然ゴムを用いた。ダイラタント流体は，衝突物体を流体中で制止させることができれば，天然ゴムよりも優れた衝撃力緩衝効果を示すが，本実験の範囲内では，実橋梁に設置するためには少なくとも天然ゴムのサイズより３倍以上のサイズのダイラタント流体を設置しないといけないことがわかった。,挑戦的研究(萌芽),中区分22:土木工学およびその関連分野,ダイラタント流体,水溶き片栗粉,重錘自由落下実験,天然ゴム,衝撃力緩衝効果,緩衝材,横変位拘束構造,重錘落下実験,,,,,,,,,,,,,,,,,,,,,,,,,,,,,,,,,,,,,,,,,,,,,,,,
18K18885,愛媛大学,中畑 和之,超音波伝搬の非接触観察による3次元弾性定数の推定,本研究は，部材表面を伝搬する超音波の可視化(Wavefield data)を数値的に処理し，材料を切り出すことなく異方性弾性体中の3次元弾性定数を求める方法を提案し，それを検証することを目的とする．Wavefield dataを得るために，レーザードップラー振動計を用いて計測する方法と光音響効果を利用した方法の2つを構築した．材料表面のWavefield dataを記録し，そのデータに時空間フーリエ変換を施すことによって，その面内の全方向の位相速度(P波，2種類のS波)を抽出する．複数方向の3種類の位相速度から独立な弾性定数を求める最適化問題を構築し，最小二乗法でこれを求める方法である．,挑戦的研究(萌芽),中区分22:土木工学およびその関連分野,音響異方性,レーザー,弾性定数,光音響,非接触・非踏襲,逆解析,超音波,非接触・非侵襲,,,,,,,,,,,,,,,,,,,,,,,,,,,,,,,,,,,,,,,,,,,,,,,,
18K18884,広島大学,金田一 智規,近赤外線を利用する光合成アンモニア酸化微生物の獲得と革新的排水処理プロセスの構築,本研究では無酸素で光エネルギーを利用(光合成)するアンモニア酸化反応を担う微生物の培養を行い、革新的な排水処理プロセスの開発することを目的とする。培養は通常の光合成微生物が増殖しないように、可視光をカットした近赤外線を照射し、光合成アンモニア酸化微生物が保有するバクテリオクロロフィルにのみ光エネルギーが吸収されるように工夫した。,挑戦的研究(萌芽),中区分22:土木工学およびその関連分野,アナモックス,光合成,窒素除去,,,,,,,,,,,,,,,,,,,,,,,,,,,,,,,,,,,,,,,,,,,,,,,,,,,,,
18K18883,大阪大学,鎌田 敏郎,弾性波と電磁場応答を統合したコンクリート中鋼材表層部の腐食の非破壊評価手法,かぶりコンクリートの品質の影響を受けず、コンクリート内部に浸透する数kHz～数100kHz帯域の高周波交流磁場と、これを印加した際の鋼材上の誘導電流の表皮効果を組み合わせることにより、コンクリート中鋼材表層部の腐食を検出する手法について検討した。鋼材表層で発生する微小磁場を安定して検出できる電磁場検出システムの開発を行い、ロックイン検波（位相敏感検波）により、鋼材表層性状の変化を高精度に測定する信号処理手法を評価した。,挑戦的研究(萌芽),中区分22:土木工学およびその関連分野,コンクリート中鋼材腐食,高周波交流磁場,電磁場応答,電磁場検出センサ,非破壊評価,弾性波,コンクリート中鋼材,腐食,非破壊評価手法,,,,,,,,,,,,,,,,,,,,,,,,,,,,,,,,,,,,,,,,,,,,,,,
18K18882,京都大学,高橋 良和,戦時下における橋梁研究の技術史的評価と耐落橋性能の高い次世代耐震技術への応用,戦争時に爆撃の対象となる重要構造物である橋梁について，昭和10年代に行われた耐弾性能を高めるための技術的検討を整理し，内的・外的不静定，吊構造などの異なる技術の組み合わせ（多様性）を推奨していたこと，また高次不静定橋梁の構造計算は，近似的解法による一次応力の算出だけではなく，曲げによる二次応力も算出し，その精度が極めて高いことを証明した．,挑戦的研究(萌芽),中区分22:土木工学およびその関連分野,橋梁,技術史,第二次世界大戦,ロバスト性評価,耐弾性能,ロバスト性,鴨緑江,損傷影響線,耐震構造,危機耐性,,,,,,,,,,,,,,,,,,,,,,,,,,,,,,,,,,,,,,,,,,,,,,
18K18881,京都大学,原田 英典,アジア・アフリカの都市下水の全ゲノム解析による多剤耐性大腸菌プロファイリング,途上国由来の多剤（薬剤）耐性菌の広がりが世界的に懸念されている。本研究では，ウガンダにおける調査から，リスクの高いクローンの存在実態や薬剤耐性大腸菌の伝播実態を明らかにし，下水（またはし尿）サーベイランスと全ゲノム解析の組み合わせは，都市レベルでの薬剤耐性大腸菌の保有・排出状況を監視するための強力なツールとなりうることを示した。タイにおける調査から，下水処理場を経ても多量の薬剤耐性大腸菌が環境中に放出されており，人口密度と相関して薬剤耐性大腸菌の濃度が増加していることがわかった。これらより，薬剤耐性大腸菌の環境への排出実態と，その伝播の一旦を明らかにすることができた。,挑戦的研究(萌芽),中区分22:土木工学およびその関連分野,多剤耐性大腸菌,都市下水,アジア・アフリカ,全ゲノム解析,,,,,,,,,,,,,,,,,,,,,,,,,,,,,,,,,,,,,,,,,,,,,,,,,,,,
18K18880,京都大学,高谷 哲,コンクリート用有機系表面被覆材の劣化指標の提案,本研究課題では，3つの有機系材料に対して促進耐候性試験を行い，劣化による構造および光退色曲線の変化について検討した．その結果，エステル結合を有する樹脂の場合には，劣化するにつれて，エステル結合が切れ，-COOHになることで蛍光が大きくなり，光退色しにくくなることが確認された．一方で，塩化ビニル樹脂の場合には，劣化するにつれて，ポリエン(-C=C-)が生成することで蛍光が大きくなることが確認されたが，光退色はしやすくなる傾向が見られた．いずれの樹脂も劣化に伴い光退色曲線に一定の傾向が見られたことから，光退色曲線が劣化度の指標として用いることができると考えられる．,挑戦的研究(萌芽),中区分22:土木工学およびその関連分野,表面被覆材,コンクリート,ラマン分光,蛍光,光退色,光退色曲線,,,,,,,,,,,,,,,,,,,,,,,,,,,,,,,,,,,,,,,,,,,,,,,,,,
18K18879,京都大学,澤田 純男,地表断層変位の高精度予測を可能にする新理論の構築,ライフライン構造物のように空間的に複雑なネットワークを構成するシステムの地震対策を進めるためには，システム全体の機能が影響を受けることを避けるため，地表断層変位への対策が必要である．本研究は，スリップパーティショニングや分岐断層により生じる断層変位の発生に関する新しい力学的理論を構築しその高精度予測を目指した．分岐断層を解析可能な数値解析手法を開発した．その上で，いくつかの具体的な事例（2016年熊本地震や1992年Landers地震）について検討した．,挑戦的研究(萌芽),中区分22:土木工学およびその関連分野,地表断層,断層運動,数値解析,XFEM,スリップパーティショニング,,,,,,,,,,,,,,,,,,,,,,,,,,,,,,,,,,,,,,,,,,,,,,,,,,,
18K18878,京都大学,森 信人,亜熱帯沿岸部の巨礫分布より逆推定する歴史的台風評価法の開発,近年，海中から移動し陸域に打ち上げられた巨礫（津波石）の分布についての調査が行われている．本研究では，観測された台風石の分布から，波浪および台風強度の逆推定を試みることを目的とした．,挑戦的研究(萌芽),中区分22:土木工学およびその関連分野,巨礫,波浪,台風,逆推定,,,,,,,,,,,,,,,,,,,,,,,,,,,,,,,,,,,,,,,,,,,,,,,,,,,,
18K18877,豊橋技術科学大学,山田 剛史,微生物指標導入の嚆矢: 廃水処理系微生物のオンサイト新計測技術,本研究は、廃水処理プロセス管理における微生物指標の将来的な導入へ向けて、廃水処理系微生物のオンサイト計測の基盤技術を開発することを試みた。とくに本研究では、複数種の標的微生物を識別するDNAアプタマーの選別方法を確立し、迅速・簡便な標的微生物の定量法の基盤を構築できた。改良する必要生はあるものの、本研究で採用した方法を用いることによって、メタン生成に関わる重要な微生物であるメタノサルシナ属アーキアを特異的かつ網羅的に識別できる分子ツールの獲得に成功した。,挑戦的研究(萌芽),中区分22:土木工学およびその関連分野,アンモニア酸化細菌,亜硝酸酸化細菌,メタノサルシナ属アーキア,Cell-SELEX法,DNAアプタマー,細胞表層タンパク,Cell-SELEX,金ナノ粒子,簡易微生物計測技術,機能性核酸分子,微生物指標,簡易計測技術,,,,,,,,,,,,,,,,,,,,,,,,,,,,,,,,,,,,,,,,,,,,
18K18876,名古屋工業大学,吉田 奈央子,酸化処理による炭素バイオフィルムのミクロ・ナノ生物活性領域の成長,"Geobacter bremensis R4株において、炭素材料の違いはそれぞれ生物膜形成/水溶性電子キャリアーを介した電流生産という代謝の転換を引き起こすが、細胞内部でクエン酸回路で得た還元力を, 呼吸鎖を通じて外部へ電子を伝達するまでの代謝経路に大きな違いはないことが示された.また他の電流生産微生物や下水汚泥では、炭素材料の表面化学組成による影響は限定的であった。これより長期的な電流生産の活性化には初期のバイオフィルム成長よりも、成熟したバイオフィルムへ基質をいかに供給するかが重要であり、バイオフィルム周りの流れが電流生産を活発化する現象をミカエリスメンテン式で表せることを示した。",挑戦的研究(萌芽),中区分22:土木工学およびその関連分野,微生物燃料電池,酸化グラフェン,炭素材料,アノード電極,電流生産微生物,流れ,電気化学培養,下水処理,酸化黒鉛,,,,,,,,,,,,,,,,,,,,,,,,,,,,,,,,,,,,,,,,,,,,,,,
18K18875,岐阜大学,八嶋 厚,”弦”の振動理論に基づいてグラウンドアンカーの残存引張り力を知る,グラウンドアンカー（以下、アンカー）は、自然斜面や切土、構造物等の安定化を図る目的で用いられる。アンカーおよび地盤の安定性を評価するためには、アンカーに作用している現状での緊張力を確認しなければならない。アンカーの残存緊張力は、リフトオフ試験や荷重計等で確認できるが、数多くのアンカーを、長期的・定期的に計測することは、費用面及び安全対策上困難である。本研究では、こうした課題を解決するために、模型実験と現場実証試験を通し、振動法を用いた新しい非破 壊計測方法を提案した。その結果、ある程度の精度で、さまざまな定着タイプのアンカーの残存緊張力を推定することが可能となった。,挑戦的研究(萌芽),中区分22:土木工学およびその関連分野,グラウンドアンカー,固有周波数,振動法,残存緊張力,スィープ加振,固有振動数,模型実験,スウィープ加振,弦,スペクトログラム,固有振動周波数,振動理論,残存引張り力,,,,,,,,,,,,,,,,,,,,,,,,,,,,,,,,,,,,,,,,,,,
18K18874,金沢大学,高山 雄貴,集積の経済を考慮した空間応用一般均衡分析のための基本的枠組の構築,本研究では，集積の経済を考慮した空間応用一般均衡(SCGE)分析の基本的枠組を構築した．より具体的には，現実に観測される経済集積パターン変化の特徴を表現することができるSCGEモデルを開発するとともに，そのパラメータの設定法・効率的な数値解析手法を提示した．そして，その分析枠組により，これまでに実施されてきた高速道路整備が大都市・地方都市経済に与えた影響を評価した．その結果，単独の路線開通は整備区間周辺の経済活動の活性化をもたらしたこと，1960～2005年の高速道路整備全体の主要な効果は (路線網の中心に位置する) 大都市部への経済集積であることが確認された．,挑戦的研究(萌芽),中区分22:土木工学およびその関連分野,空間応用一般均衡分析,集積の経済,空間応用一般均衡モデル,,,,,,,,,,,,,,,,,,,,,,,,,,,,,,,,,,,,,,,,,,,,,,,,,,,,,
18K18873,東京大学,市村 強,Supercomputed dataによる物理的地震被害推定人工知能構築手法開発,地震被害軽減を目指す上で，地震被害推定の信頼性向上が必要とされ，多くの試みがなされている．高詳細モデルを用いた地震シミュレーションにおいて解析コストは大きく，この軽減が必要とされている．本研究課題では，大規模な数値シミュレーション結果（Supercomputed data）と物理的考察を踏まえた学習により，地震被害推定のための効率的な人工知能構築手法を開発し，適用例によりその有効性を示した．,挑戦的研究(萌芽),中区分22:土木工学およびその関連分野,人工知能,地震被害推定,大規模解析,,,,,,,,,,,,,,,,,,,,,,,,,,,,,,,,,,,,,,,,,,,,,,,,,,,,,
18K18872,秋田大学,川村 洋平,テーリングダム調査を目的とした地中ドローンの開発,採鉱活動の副産物となる“ずり”の貯蔵場である“テーリングダム”の内部を調査可能な地中ドローンを開発するものである。研究は次の４つの研究開発領域からなる。【二重反転ドリル掘削機構の開発】、【3次元ヘビ型推進機構設計・製作】、【機械学習による制御系設計とモータートルク分配の最適化】、【全開発項目実装と実証実験】であった。開発した2つの機構を地中ドローンのプロトタイプに実装し、実砂槽にて自由に移動が可能であるか検証実験を行った。結果として本助成期間中では掘削部分と推進部分の相互作用の最適化が実現できず、双方の部分最適に止まった。しかしながら、へび型推進機構によるスラリー内の自由な移動を実現した。,挑戦的研究(萌芽),中区分22:土木工学およびその関連分野,DigBot,地中ドローン,2重反転ドリル,テーリングダム,汚染物質,へび型推進機構,機械学習,シミュレーション,実水槽実験,ドリルの回転数最適化,ヘビ機構運動制御の最適化,掘削,ヘビ型推進機構,テ―リングダム,,,,,,,,,,,,,,,,,,,,,,,,,,,,,,,,,,,,,,,,,,
18K18871,北海道大学,西村 聡,凍結・融解による土の不可逆変化メカニズム解明へ、ミクロ～メソ可視化からの突破口,地盤材料、特に粘土などの細粒土が凍結・融解を繰り返す際には、長期的（排水条件）には体積の変化、短期的（非排水条件下）には有効応力の変化など、不可逆な状態変化が起こる。この現象のメカニズム解明を経て、都市部インフラ整備の補助工法としての人工凍結工法適用に伴う地盤変形の解析や、寒冷地防災・インフラ維持管理技術の発展に有用な土質モデルを構築することを目的として室内土質試験・マイクロフォーカスX線CTスキャン・要素モデル化などを含む多面的な研究を実施し、実際の工学的解析に適用できる数理モデルを開発するとともに、入力パラメタの推定に必要な実験手法の骨子をまとめた。,挑戦的研究(萌芽),中区分22:土木工学およびその関連分野,土質力学,凍結,融解,地盤材料,可視化,地盤変形,地盤工学,地盤凍結,土質試験,,,,,,,,,,,,,,,,,,,,,,,,,,,,,,,,,,,,,,,,,,,,,,,
19K21998,国立研究開発法人国立環境研究所,山田 一夫,放射性同位元素を用いたコンクリート中への微量有害イオンの浸透評価手法確立への挑戦,コンクリートもしくはモルタル試料にRI含有溶液を浸透させ、溶液と試料表面のβ線とγ線の線量率変化から浸透速度を評価する。浸透試験終了後、浸透方向に薄片状試料を加工し、イメージングプレートに暴露することでオートラジオグラフ測定を実施する。IP暴露時に異なる密度の遮蔽体を挿入し、Cs-137とSr-90の分離定量分析の最適条件を探る。,挑戦的研究(萌芽),中区分22:土木工学およびその関連分野,分離定量,セシウム,ストロンチウム,コンクリート,浸透,イメージングプレート,オートラジオグラフ,低濃度,Cs-137,Sr-90,遮蔽板,厚さ,ラジオアイソトープ,塩素,,,,,,,,,,,,,,,,,,,,,,,,,,,,,,,,,,,,,,,,,,
19K21997,熊本大学,圓山 琢也,世帯不在率の時空間変化の解明と課題解決への応用： 国内外の交通調査データの新活用,最近の宅配便の再配達の増加の問題は，受取手の世帯単位での不在が一因であるが，この世帯単位の不在の実態把握は十分でない．本研究は，国内外の交通調査・生活時間データを活用して，世帯単位の不在の実態を解明し，課題解決に向けた分析手法を提案することを目的とする．交通調査データの研究は通常「人の移動」に着目するが，その発想を転換し「世帯全員が外出している状態」に着目する．そして世帯不在率の実態を国内外の複数の都市・複数の時点で時間帯別・地区別に明らかにする．そして宅急便の再配達問題に対する効率的な配送方法，空き巣の時空間別発生状況との関連分析など，実社会の課題解決に資する手法の構築を検討する．,挑戦的研究(萌芽),中区分22:土木工学およびその関連分野,世帯不在率,トリップ記入漏れ,社会生活基本調査,PT調査,世帯不在時間,宅急便再配達,空き巣,時間帯別世帯不在率,都市間比較,再配達,,,,,,,,,,,,,,,,,,,,,,,,,,,,,,,,,,,,,,,,,,,,,,
19K21996,愛媛大学,渡辺 幸三,次世代シーケンシングによる温暖化適応遺伝子のゲノム検索：遺伝的多様性予測への活用,気候変動に伴う温暖化や異常気象は，流域内の河川底生動物の遺伝的多様性（同種個体間の遺伝的変異）を劣化させる可能性がある。本研究は，気候変動下の水温・流速等の流域環境の変化への適応進化を予測するモデルを開発する。膨大なゲノムから環境選択を受けている遺伝子を次世代シークエンシング解析を活用して迅速に検索し，これら環境選択性遺伝子と環境変数の関係を定量的に結びつける機械学習モデルを開発する。そして，このモデルを全球気候モデルとカップリングすることにより，気候変動下の遺伝子型や遺伝的多様性の空間分布を予測する。,挑戦的研究(萌芽),中区分22:土木工学およびその関連分野,ゲノム,適応遺伝子,次世代シークエンシング,遺伝的多様性,河川,気候変動,次世代シーケンシング,,,,,,,,,,,,,,,,,,,,,,,,,,,,,,,,,,,,,,,,,,,,,,,,,
