awardnumber,organization,name,title,abstract,section,review_section,keyword1,keyword2,keyword3,keyword4,keyword5,keyword6,keyword7,keyword8,keyword9,keyword10,keyword11,keyword12,keyword13,keyword14,keyword15,keyword16,keyword17,keyword18,keyword19,keyword20,keyword21,keyword22,keyword23,keyword24,keyword25,keyword26,keyword27,keyword28,keyword29,keyword30,keyword31,keyword32,keyword33,keyword34,keyword35,keyword36,keyword37,keyword38,keyword39,keyword40,keyword41,keyword42,keyword43,keyword44,keyword45,keyword46,keyword47,keyword48,keyword49,keyword50,keyword51,keyword52,keyword53,keyword54,keyword55,keyword56
23K03715,東京都立大学,田川 俊夫,相変化をともなう熱輸送現象の数値予測,格子ボルツマン法は，計算効率，質量保存性，複雑な現象への応用性に優れるとされ，近年注目を集めている．本研究では，このLBMに着目し，相変化を伴う気液二相流に対して適用し，これまで不可能であった解析の実現をはかる．それを達成するために，相変化の影響をソース項としてモデル化し支配方程式に組み込む点は本研究の特徴として挙げることができる．また，Graphics Processing Unit(GPU)を用いて様々な問題の解析を行い，本手法の有用性の確認を行う．最終目標として，CFDによる核沸騰の再現を試み，三次元計算でのコストの検証も行い，核沸騰伝熱面での熱流束や熱伝達率の数値予測まで行う．,基盤研究(C),小区分19020:熱工学関連,沸騰・凝縮,数値シミュレーション,格子ボルツマン法,濡れ性,相変化モデル,フェーズフィールド法,マイクロレイヤーモデル,,,,,,,,,,,,,,,,,,,,,,,,,,,,,,,,,,,,,,,,,,,,,,,,,
23K03714,神戸大学,劉 秋生,地球環境問題の解決に貢献する海水における二酸化炭素の物質輸送特性の解明,本研究では，海水中の二酸化炭素(CO2)隔離技術の確立に寄与するために，広範囲の圧力，温度条件下での海水へのCO2の溶解度の測定，CO2気泡の溶解・拡散過程における気泡径の経時変化挙動の測定，及びCO2の海水中における溶解・拡散過程の数値シミュレーションを行い，高圧・低温条件下における海水へのCO2の吸収能力及び吸収速度を求め，海水へのCO2の物質輸送特性を解明する。,基盤研究(C),小区分19020:熱工学関連,二酸化炭素,物質移動,溶解度,ヘンリー定数,溶解拡散過程,溶解過程,拡散過程,海水,高圧,,,,,,,,,,,,,,,,,,,,,,,,,,,,,,,,,,,,,,,,,,,,,,,
23K03713,東京理科大学,植木 祥高,混相場の状態検出を実現するデータ駆動型音響診断の学理構築と技術開拓,機械学習による高確度の音響識別により，沸騰発生を早期に検知し，事象推移に至る物理現象をほぼ時間遅れ無く把握する新たな安全性強化技術（データ駆動型音響診断）を創出する．これにより深刻な損傷に至るまでに事象進展の防止や緩和策を可能とするより安全なシステム概念の構築に寄与する．本技術の実現にあたり技術的・学理的に課題であった「沸騰」と「気液混相場」の音響学理を明らかにするとともに，高確度な診断を与える情報工学技術を構築する．,基盤研究(C),小区分19020:熱工学関連,データ駆動型音響診断,深層学習,機械学習,沸騰,音響工学,混相流,音響計測・診断,異常検知,,,,,,,,,,,,,,,,,,,,,,,,,,,,,,,,,,,,,,,,,,,,,,,,
23K03712,静岡大学,福田 充宏,無潤滑テスラタービンの開発による冷凍サイクルの高効率化,冷凍空調システムでは膨張機を用いることで，膨張エネルギー回収により性能を改善することができる．一方，潤滑油が必要な場合，潤滑油の混入が冷凍サイクル性能の低下をもたらし，熱交換器の設計の自由度も低くなる．このため，無潤滑で小型高性能な膨張機の開発が望まれている．本研究ではこれらの問題を解決し，冷凍空調システムの性能向上に向けて，テスラタービンを応用した無潤滑膨張機の開発を試みる．テスラタービンの試作を行い，その基本性能を把握するとともに，冷凍サイクルにおける二相膨張特性を明らかにする．さらに，タービン内部の流動状態に基づき，性能向上策を施すことで小型高性能な無潤滑膨張機の実現を目指す．,基盤研究(C),小区分19020:熱工学関連,テスラタービン,膨張機,無潤滑,冷凍サイクル,,,,,,,,,,,,,,,,,,,,,,,,,,,,,,,,,,,,,,,,,,,,,,,,,,,,
23K03711,山梨大学,鳥山 孝司,カメラの感度特性を利用したロバストで高精度な表面・液体内温度分布計測法の開発,本研究では，短波長の可視光に対してRGBカメラを利用することで，より簡便で高精度な温度計測技術に発展させることを試みる．まず始めに，感温液晶シートによる表面温度計測技術の開発に取り組み，その技術の確立後，感温液晶微粒子を用いた液体内温度計測法への拡張を行う．散乱光の温度への換算と画像処理プロセスでは，温度換算用データベースの構築と計測のエラー要因を前処理で除去する仕組みに対して深層学習を適用し，高速・高精度で、かつ計測エラーの少ないロバストな温度計測法の確立を目指す．,基盤研究(C),小区分19020:熱工学関連,温度計測,温度分解能,不確かさ解析,汎用デジタルカメラ,青色LED光源,感温液晶,温度分布計測,RGBカメラ,ロバスト,深層学習,,,,,,,,,,,,,,,,,,,,,,,,,,,,,,,,,,,,,,,,,,,,,,
23K03710,金沢大学,多田 幸生,高周波超音波とパルス交番磁場を併用した過冷却制御による食品の高品質凍結技術の開発,食品の凍結過程では，細胞内外の氷晶成長や細胞の脱水などのミクロ挙動が生じ，これが解凍後の品質低下の原因となる．そこで本研究では，高周波超音波とパルス交番磁場を併用して細胞内外の氷晶形成を制御し，食味を劣化させない高品質冷凍技術の開発を目的とする．具体的には，,基盤研究(C),小区分19020:熱工学関連,凍結,過冷却,高周波超音波,交番磁場,食品,,,,,,,,,,,,,,,,,,,,,,,,,,,,,,,,,,,,,,,,,,,,,,,,,,,
23K03709,東京農工大学,村田 章,ディンプル面による熱伝達促進での粗面影響層厚さを考慮した多目的最適化とPOD解析,ガスタービン翼内部冷却は高効率化に必須な技術であり，低圧力損失で高熱伝達率な凹みディンプルは有力な粗面形状である．本研究では，最初にディンプル面による影響層厚さを考慮した片側ディンプル面チャネル脈動流の数値解析を行い，実験計画法・応答曲面法・多目的最適化により熱伝達促進におけるディンプル面形状と脈動条件の最適解群を求める．次にその最適解群の代表ケースでの乱流変動を再現する数値解析と粒子画像流速計測の結果の流れ場の直交モード分解解析によって，最適形状・脈動パラメータの熱伝達促進・影響層厚さ決定要因の原理説明を行う．数値解析の結果は，伝熱計測，粒子画像流速計測，より高精度な数値解析で検証する．,基盤研究(C),小区分19020:熱工学関連,脈動流,伝熱促進,ガスタービン翼,ディンプル,非定常法,流れの可視化,多目的最適化,POD解析,熱工学,流体工学,エネルギー効率化,省エネルギー,,,,,,,,,,,,,,,,,,,,,,,,,,,,,,,,,,,,,,,,,,,,
23K03708,東京学芸大学,望月 高昭,交番電場付与による液滴型マイクロリアクター内液滴の温度制御,微小流路内を通過する液滴の内部において化学反応を行わせる装置が提案されている(液滴を化学実験に使用する試験管の代わりとする)．同液滴に交流電場を付与した場合，液滴は，電場強さの変化に応じて球形(電場強さ＝0)から回転楕円体形(電場強さ≠0)へ，回転楕円体形から球形へと周期的に変形する．この際，液滴内外に流れが誘起され，液滴と流路壁の間の熱移動が促進される．この結果，「反応熱を速やかに液滴外に放出し，液滴内温度を一定に保つ(一定温度下で反応させる)」，「壁面の温度の変化に応じるように液滴内温度を変化させる(反応の温度を制御する)」などが期待される．本研究では，上述の温度制御方法について検討する．,基盤研究(C),小区分19020:熱工学関連,熱移動,液滴,交番電場,マイクロデバイス,物質移動,,,,,,,,,,,,,,,,,,,,,,,,,,,,,,,,,,,,,,,,,,,,,,,,,,,
23K03707,東京大学,志村 敬彬,固体酸化物形セル電極反応のマルチスケールモデリング,固体酸化物形セルを用いた発電，電気分解システムは，様々なエネルギー源の需給バランスを調整し，エネルギーの有効利用に貢献するものである．両運転モードをリバーシブルに運転するためには，電極性能のさらなる高効率化が求められる．ナノスケールの粒子を用いて電極を作成することで，電極性能を向上させることが可能であるが，耐久性の観点から課題がある．実用化のためには，その反応メカニズムのさらなる理解が必要である．本研究を通して様々なスケールの電極に適応可能な反応モデルを確立することで，電極性能や耐久性の観点からの設計指針が明確になると期待される．,基盤研究(C),小区分19020:熱工学関連,固体酸化物形燃料電池,固体酸化物形電解セル,三次元電極微細構造,スピンコート,粒界,電気化学計測,格子ボルツマン法,酸素同位体交換,,,,,,,,,,,,,,,,,,,,,,,,,,,,,,,,,,,,,,,,,,,,,,,,
23K03706,東北大学,グエン・ヴァン トゥアン,Energy harvesting by indoor ambient thermal variations,This research aims to create a novel field that converts the indoor ambient thermal variations into electrical energy.,基盤研究(C),小区分19020:熱工学関連,IoT sensing sysems,Energy harvesting,Phase change materials,Energy Harvesting,Thermal fluctuation,IoT sensing system,,,,,,,,,,,,,,,,,,,,,,,,,,,,,,,,,,,,,,,,,,,,,,,,,,
23K03705,防衛大学校(総合教育学群、人文社会科学群、応用科学群、電気情報学群及びシステム工学群),安永 健治,新規燃料の可能性を探る,バイオマス由来のC5単糖を経由して種々の燃料が合成される。これらの化合物の燃料としてのポテンシャルを評価するためには、詳細燃焼反応モデルが必須である。実験的には、急速圧縮機(低温高圧実験)と衝撃波管(高温低圧高圧実験)を用いて、大気圧から10気圧以上の高圧条件下で、低温から高温までの着火遅れ時間と熱分解生成物分布を取得する。幅広い温度と圧力領域と着火および反応生成物をカバーした実験をベースとした反応モデルを構築し、着火のタイミングや燃焼排出物の予測までを可能とする幅広い用途に適用可能な燃焼反応モデルの提供を目的とする。,基盤研究(C),小区分19020:熱工学関連,生成物分析,着火遅れ時間,燃焼反応モデル,衝撃波管,急速圧縮機,バイオマス燃料,カーボンニュートラル,,,,,,,,,,,,,,,,,,,,,,,,,,,,,,,,,,,,,,,,,,,,,,,,,
23K03704,東京工業大学,鈴木 佐夜香,木質材料の燃焼における接着剤成分の燃焼機構及び生成する気体に与える影響,地球温暖化の原因である二酸化炭素排出削減のために木材の利用が注目されており、建物への利用も推進されている。木材を建物に使用する場合、使用される木材の多くは接着剤で木片を接着して作製される木質材料である。しかしながら木材は火災に弱い。既往の研究では木質材料からの燃焼生成物に関しては大局的に検討されており、実験室レベルで詳細に検討したものはない。本研究課題では雰囲気温度を変化させながら、木質材料を燃焼させる。燃焼によって生成する気体の構成の変化を分析及び採取したすす粒子の電子顕微鏡での観察を通じて解明する。最終的には木質材料の中の接着剤成分が燃焼機構及び生成する気体へ与える影響を明らかにする。,基盤研究(C),小区分19020:熱工学関連,すす,木質材料,燃焼排出物,生成期待,gaseous emission,particulate matter,building materials,combustion mechanism,adhesive,,,,,,,,,,,,,,,,,,,,,,,,,,,,,,,,,,,,,,,,,,,,,,,
23K03703,国立研究開発法人物質・材料研究機構,神谷 宏治,スターリング型磁気冷凍の基礎研究,超伝導型量子コンピューターは100 mK以下の超低温環境を必要とし、主にヘリウム3とヘリウム4の希釈冷凍機が用いられる。希釈冷凍機と同程度の温度まで冷却可能である断熱消磁冷凍機(ADR)は、ヘリウム3の使用量を劇的に削減することが可能であるが、磁気冷凍は部品点数が多いことやカルノーサイクルを辿るため、低温過程と高温過程の間に量子コンピューターが必要とする1 Kの熱アンカーを提供することができないなどの課題がある。,基盤研究(C),小区分19020:熱工学関連,磁気冷凍,スターリング,熱音響,断熱消磁冷凍機,ADR,能動的蓄冷式磁気冷凍,AMR,熱音響冷凍,超電導磁石,磁気熱量効果,,,,,,,,,,,,,,,,,,,,,,,,,,,,,,,,,,,,,,,,,,,,,,
23K03702,崇城大学,齊藤 弘順,純アルコールディーゼル機関の開発：世界レベルのCN化実現に向けた選択肢の一つとして,純アルコールディーゼルエンジン開発のキー技術は自着火制御である。これまでの基礎研究で得た知見（アルコール噴霧の自着火現象を律速する周囲ガス条件）を基に、物理・化学両側面からの現象理解の積み上げによる自着火制御法に関するアイディアを提案し、それを現有の急速圧縮膨張装置ならびに様々な燃料噴射を制御できるコモンレール式燃料噴射装置を搭載した実機に適用して、その効果を実験および数値解析により検証する。数値解析による予測と実験検証を繰り返しながら、現象解明とともに、着実に実用化に向けた技術開発を行う。,基盤研究(C),小区分19020:熱工学関連,アルコール,噴霧,自着火,燃料噴射制御,数値解析,噴霧自着火可視化実験,ディーゼル,,,,,,,,,,,,,,,,,,,,,,,,,,,,,,,,,,,,,,,,,,,,,,,,,
23K03701,岡山理科大学,森 嘉久,高圧SPS装置による車載用熱電モジュール開発,2050年までに温室効果ガスの排出を全体としてゼロにするカーボンニュートラルが日本政府として宣言され，その脱炭素の重点対策であるゼロカーボン・ドライブに対しては，日本経済の基幹産業である自動車製造業界としても，喫緊の課題として研究開発を行っている．,基盤研究(C),小区分19020:熱工学関連,高圧合成,熱電材料,シリサイド,高圧,熱電素子,SPS,,,,,,,,,,,,,,,,,,,,,,,,,,,,,,,,,,,,,,,,,,,,,,,,,,
23K03700,関西大学,小田 豊,過渡乱流場の乱流熱流束モデル開発に向けた脈動乱流場の熱・運動量輸送の解明,強い加減速を伴う流れである脈動乱流場の熱伝達現象は，自動車エンジン等に見られる重要かつ基礎的な現象である。本研究では，感温塗料を塗布した金属箔ヒータを用いて壁面温度の瞬時・時系列画像計測を行い，高い時空間分解能で広範囲の脈動条件（平均速度，振幅，周波数）における熱伝達率の非定常計測を実現する。また，実験を模したシミュレーションの結果と併せて脈動乱流場における運動量および熱輸送のメカニズムを解明する。加えて，脈動乱流のように過渡的な乱流に適用可能な乱流モデル・乱流熱流束モデルの構築に向けて，脈動乱流場の実験・DNSデータベースを構築する。,基盤研究(C),小区分19020:熱工学関連,脈動乱流,直接数値計算,乱流熱伝達,感温塗料,非平衡乱流,脈動流,乱流伝熱,,,,,,,,,,,,,,,,,,,,,,,,,,,,,,,,,,,,,,,,,,,,,,,,,
23K03699,明治大学,中別府 修,火炎壁面相互作用を計測するMEMS熱流束・イオン電流センサの開発,MEMS技術により薄膜RTDを用いた熱流束センサと櫛歯電極を用いたイオン電流センサを隣接させた同時計測センサを製作し，定容燃焼容器内で予混合火炎のクエンチに対する火炎壁面相互作用を計測する技術を開発する。櫛歯電極に正負の電圧を印加して形成する双極性電界は火炎が壁面近傍に接近するとイオン電流を検出でき，イオン捕獲電圧をフィードバック制御するトラッキング計測により，サブミリメートルの壁面近傍での火炎の接近速度，消炎距離を計測する。同時に壁面熱流束を測定することで，火炎の特性と冷却損失の関係を明らかにできることを示す。,基盤研究(C),小区分19020:熱工学関連,火炎壁面相互作用,イオン電流,熱流束,MEMS,計測,,,,,,,,,,,,,,,,,,,,,,,,,,,,,,,,,,,,,,,,,,,,,,,,,,,
23K03698,慶應義塾大学,長坂 雄次,ナノ・マイクロ熱物性計測の Working Equation 基盤形成に関する研究,ナノ・マイクロスケールサンプルの熱物性値（熱伝導率等）の新たな計測方法は，最近も数多く提案されている。確立された方法がある一方で，計測原理レベルの単純な理論式しか公表されていない場合や，実験条件を厳密に記述する理論的根拠が不明瞭な方法も散見される。新しい計測原理や計測技術が十分に練られていない段階で公表されることも多く，実験的に極めて巧妙な方法のように見えても，見逃している大きな系統的誤差要因がその測定データに含まれている場合もある。本研究は，測定量から熱物性値を算出するための詳細なWorking Equationを２つの測定方法について体系的に導出し，見逃している系統的誤差要因の検討を行う。,基盤研究(C),小区分19020:熱工学関連,熱物性,レーザー計測技術,粘性率,パルスレーザー粘度計,熱工学,計測技術,,,,,,,,,,,,,,,,,,,,,,,,,,,,,,,,,,,,,,,,,,,,,,,,,,
23K03697,秋田県立大学,大徳 忠史,4D計測に基づく可燃性固体の熱分解機構解明へのアプローチ,本研究では木質系バイオマスを対象にバイオマスエネルギー変換技術への貢献を目指す．熱的厚みをもつ固体であることを考慮し，熱分解により内部に温度および構造の変化を生じる条件下において，放射光X線を利用したリアルタイム超高速非破壊可視化手法を適用する．内部の構造変化のみならず組成・成分の非定常変化の評価を試み，木質系バイオマスの直接燃焼メカニズムの解明を目指す．,基盤研究(C),小区分19020:熱工学関連,木質バイオマス,高速X線CT,熱分解,可視化,超高速X線CT,燃焼,,,,,,,,,,,,,,,,,,,,,,,,,,,,,,,,,,,,,,,,,,,,,,,,,,
23K03696,琉球大学,永島 浩樹,固体酸化物電解質膜内の粒界及びナノ結晶構造による酸素イオン伝導特性の制御,本研究は、固体酸化物形燃料電池に使用されている固体酸化物電解質膜の酸素イオン伝導特性向上のために、固体酸化物電解質膜内の粒界構造及びナノ結晶構造によるイオン伝導特性の制御指針を示し、高い酸素イオン伝導特性を示す固体酸化物電解質膜を提案することを目的としている。研究は、まず電子状態からボトムアップ的に酸素イオン伝導特性を評価する手法を構築する。次に、構築した手法を用いて粒界とナノ結晶構造による酸素イオン伝導メカニズムを解明する。この解明したメカニズムに基づいて高イオン伝導性を示す固体酸化物電解質膜構造を提案する。,基盤研究(C),小区分19020:熱工学関連,固体酸化物形燃料電池,酸素イオン伝導,粒界,分子動力学計算,第一原理計算,動的モンテカルロ法,イオン伝導,ナノスケール,,,,,,,,,,,,,,,,,,,,,,,,,,,,,,,,,,,,,,,,,,,,,,,,
23K03695,熊本大学,鳥居 修一,極長期間安定化を目指した次世代バイオデイーゼルエマルジョン燃料の開発,次世代バイオディーゼル燃料（食糧競合を起こさない素材を「次世代又は第二世代」という）を用いてエマルジョン燃料を製造する。本提案は、使用する燃料（100%BDF）として市場化に耐えうる低価格で極長期安定性を確保した次世代バイオディーゼルエマルジョン燃料を開発することを目的とする。そこでまず、市販されている低価格の界面活性剤を数多く用いて、次世代バイオディーゼル燃料と蒸留水との混合媒体が極長期的に分離しないエマルジョン燃料を作る。その後、最適なエマルジョン燃料を各種燃焼機器で使用しながら、排ガス等の特性を検証する。最後に、開発した次世代バイオディーゼルエマルジョン燃料を完成させる。,基盤研究(C),小区分19020:熱工学関連,エマルジョン燃料,再生可能エネルギー,バイオ燃料,,,,,,,,,,,,,,,,,,,,,,,,,,,,,,,,,,,,,,,,,,,,,,,,,,,,,
23K03694,佐賀大学,光武 雄一,高温面噴流冷却時の不安定固液接触現象のモデル化と非定常冷却予測手法構築への展開,工業的に幅広い応用分野を持つ水噴流による高温面の非定常沸騰冷却において，表面上を均一に高い精度で冷却温度履歴制御および除熱能力向上を行うために不可欠となる高温面上での不安定な固液接触現象の伝熱計測と現象を支配するモデル化を検討し，解析モデルに必要な非定常条件で不均一温度面上での局所熱伝達予測式を確立する．その特徴は，高温面上での短時間で生じる固液接触に伴う非定常伝熱を直接計測する実験手法にある．,基盤研究(C),小区分19020:熱工学関連,クエンチング,非定常遷移沸騰熱伝達,衝突噴流冷却,非定常熱伝導逆問題,自発核生成温度,高温面のぬれ,高速応答表面温度計測,ぬれ,衝突噴流,非定常遷移沸騰,ウエッティングフロント,自発核生成,,,,,,,,,,,,,,,,,,,,,,,,,,,,,,,,,,,,,,,,,,,,
23K03693,高知大学,小林 厚子,生体内マグネタイト微粒子氷晶モデルに基づく植物遺伝資源の過冷却低温貯蔵技術,過冷却促進の程度は、マグネタイト微粒子の粒子径・濃度に依存する。これまで生体内にある強磁性体マグネタイト（Fe3O4）微粒子が過冷却操作可能な氷晶核因子となることに注目し、過冷却の促進が現れない試料の存在、物理的矛盾を明らかにしてきた。本研究では、歳差磁場下で植物細胞内に過冷却を促進・持続させて耐寒温度を下げれば、多発休眠の覚醒期間が遅れることに注目して、歳差磁場下による過冷却降下到達温度は、各種植物の残留磁化測定値から求めるマグネタイト微粒子の単位体積当たりの含有量に依存することを検証し、植物遺伝資源の長期低温貯蔵技術を確立することを目的とする。,基盤研究(C),小区分19020:熱工学関連,supercooling,magnetite,genetic resources,,,,,,,,,,,,,,,,,,,,,,,,,,,,,,,,,,,,,,,,,,,,,,,,,,,,,
23K03692,京都工芸繊維大学,西田 耕介,レーザ・X線複合計測とエントロピーマッピングによる燃料電池反応輸送場の最適設計,本研究では、レーザ分光やX線CT技術を用いた複合オペランド計測と多孔質電極内の反応輸送連成シミュレーションを一貫して行うことで、実作動状態PEFCの流路・電極内における全化学種の濃度、液水、温度分布を把握できるようにする。さらに分布データを活用して、反応・輸送各プロセスのエントロピー生成速度を局所的に解析し、エントロピー生成分布の３次元マッピングを行う。その上で、反応輸送場でのエネルギー損失の律速過程を特定し、エントロピー生成最小化のための新規電極流路構造を提案・設計する。構造パラメータは機械学習（ニューラルネットワーク）により最適化を図る。,基盤研究(C),小区分19020:熱工学関連,熱工学,燃料電池,レーザ計測,X線CT計測,エントロピー生成解析,複合計測,エントロピー,,,,,,,,,,,,,,,,,,,,,,,,,,,,,,,,,,,,,,,,,,,,,,,,,
