awardnumber,organization,name,title,abstract,section,review_section,keyword1,keyword2,keyword3,keyword4,keyword5,keyword6,keyword7,keyword8,keyword9,keyword10,keyword11,keyword12,keyword13,keyword14,keyword15,keyword16,keyword17,keyword18,keyword19,keyword20,keyword21,keyword22,keyword23,keyword24,keyword25,keyword26,keyword27,keyword28,keyword29,keyword30,keyword31,keyword32,keyword33,keyword34,keyword35,keyword36,keyword37,keyword38,keyword39,keyword40,keyword41,keyword42,keyword43,keyword44,keyword45,keyword46,keyword47,keyword48,keyword49,keyword50,keyword51,keyword52,keyword53,keyword54,keyword55,keyword56
18K04002,国立研究開発法人宇宙航空研究開発機構,石川 毅彦,静電浮遊法を利用した高温融体の定圧比熱温度依存性の計測,本研究では、静電浮遊炉内に浮遊溶融する直径2mm程度の高温融体（球状）にレーザーを当て、反射光の偏光情報から試料の輻射率を算出する方法を確立する。既設の定圧比熱測定法等を組み合わせて、幅広い温度範囲での測定が可能となる。薄膜技術の進展に伴って安価なエリプソメータ（偏光計）が入手可能となり、これを用いて技術確立を進めた。偏光による輻射率計測は原理的に平板状の試料でレーザーが反射し、強い反射光が偏光計に入射することを前提としている。直径2mmの試料では、この前提が成り立たず、地上静電浮遊炉での計測は困難なことが明らかとなった。今後、試料回転による扁平形状を利用した計測の検討を進める。,基盤研究(C),小区分19020:熱工学関連,無容器プロセッシング,高温融体,熱物性計測,定圧比熱,輻射率,偏光計測,浮遊,,,,,,,,,,,,,,,,,,,,,,,,,,,,,,,,,,,,,,,,,,,,,,,,,
18K04001,国立研究開発法人産業技術総合研究所,阿子島 めぐみ,遮熱コーティングの高温高圧下における熱拡散率測定技術の開発と遮熱機構の解明,"ガスタービン発電の高効率化に重要な遮熱コーティング（Thermal Barrier Coating, TBC）の表面層（Top coat, TC）の熱特性を明らかにするため、TBCが実際に暴露される高温高圧ガスの条件を考慮して、1気圧～数気圧に加圧したガス中に試験片を保持して200 ℃程度まで加熱した状態で熱拡散率を測定できる装置を作製した。また、一般的なレーザフラッシュ法を用いて溶射条件が異なるTCの熱拡散率を高温まで詳細に調べ、微細組織と遮熱性の関連性に関する知見を得た。",基盤研究(C),小区分19020:熱工学関連,遮熱コーティング,熱拡散率,レーザフラッシュ法,溶射皮膜,多孔質,遮熱コーテイング,溶射被膜,多孔質材料,遮熱機構,,,,,,,,,,,,,,,,,,,,,,,,,,,,,,,,,,,,,,,,,,,,,,,
18K04000,国立研究開発法人物質・材料研究機構,篠原 嘉一,誘電体を活用したハイブリッド熱電材料の創製によるトレードオフ呪縛からの解放,熱電発電の性能は材料の出力因子（ゼーベック係数の二乗と電気伝導率の積）で支配されるが、ゼーベック係数と電気伝導率はトレードオフの関係にある。本研究では、高電気伝導率＆低ゼーベック係数、低電気伝導率＆高ゼーベック係数の二種類の材料で構成されるハイブリッド多層膜をスパッタ成膜し、膜厚の比率と熱電特性の相関を検討した。高電気伝導率＆低ゼーベック係数の層の膜厚比率が小さい場合に、ハイブリッド膜の出力因子が構成材料を上回ることが見いだされた。熱電材料粉末に金属微粉を微量混合してホットプレス成形したバルクハイブリッド材料でも、ハイブリッド膜と同様に出力因子が～90％増加することが見いだされた。,基盤研究(C),小区分19020:熱工学関連,熱電材料,ハイブリッド,出力因子,誘電体,,,,,,,,,,,,,,,,,,,,,,,,,,,,,,,,,,,,,,,,,,,,,,,,,,,,
18K03999,米子工業高等専門学校,森田 慎一,CNT分散潜熱蓄熱材による高速蓄熱に関する研究,パラフィン系潜熱蓄熱材の蓄熱時間短縮は，高熱伝導率化と融解対流促進の両立を要する．本研究は，超高熱伝導率カーボンナノチューブを潜熱蓄熱材中に分散させ，高熱伝導率かつ融解対流の両立を実現する新発想物質を用い，蓄熱時間短縮を実現する流動・伝熱メカニズムの解明を目指して実施された．主な研究成果は，以下に挙げる事項である．,基盤研究(C),小区分19020:熱工学関連,潜熱蓄熱,潜熱,蓄熱,熱物性,CNT,ＣＮＴ,,,,,,,,,,,,,,,,,,,,,,,,,,,,,,,,,,,,,,,,,,,,,,,,,,
18K03998,和歌山工業高等専門学校,大村 高弘,不均一温度場における熱伝導率測定方法に関する研究,断熱材の熱伝導率測定方法に関して，フーリエ則を適用できない不均一な温度勾配が一部に存在するような温度場でも測定できる方法を提案し，その適用可能な条件を確立した．提案した測定法では，試験体の厚さ方向に流れる熱流と，それ以外の方向に流れる熱流に分離することで，厚さ方向の熱伝導率を求めており，これを熱流分離法と称した．この原理に基づく装置を開発し，アルミナ系繊維質断熱材やフュームドアルミナ断熱材の熱伝導率を100℃～1000℃の温度範囲で測定したところ，保護熱板法や周期加熱法の結果に対して±10%以内で一致する値が得られ，測定方法の妥当性を確認できた．,基盤研究(C),小区分19020:熱工学関連,熱伝導率,断熱材,保護熱板法,周期加熱法,不均一温度場,熱流分離,熱流分離法,温度分布,定常法,不均一温度,測定,,,,,,,,,,,,,,,,,,,,,,,,,,,,,,,,,,,,,,,,,,,,,
18K03997,大阪府立大学工業高等専門学校,杉浦 公彦,溶融塩ガス化／円筒型ＭＣＦＣ結合型高機能ダイレクトカーボン燃料電池の高性能化,溶融塩ガス化／円筒型ＭＣＦＣ結合型高機能ダイレクトカーボン燃料電池の高性能化を試みた結果、①ステンレス支持管において850mV@150mA/cm2の特性を得ることができた。②T-MCFC２セルスタックの試作では、ステンレス管をアルミナ継手で繋いだソケット型は作成できた。③HF-DCFC用ガス化条件の最適化では、HF-DCFCとしてのT-MCFC運転条件とガス化特性の両立可能な条件を見出せた。④HF-DCFCの基本特性の取得では、アノードガスに燃料ガス利用率100％でH2/CO2/H2O/N2をベースガスとして3gの木質ペレット供給時に、電池出力を5mW/cm2向上させることができた。,基盤研究(C),小区分19020:熱工学関連,ダイレクトカーボン燃料電池,溶融炭酸塩形燃料電池,溶融塩ガス化,DCFC,MCFC,燃料電池,高温型燃料電池,円筒型MCFC,,,,,,,,,,,,,,,,,,,,,,,,,,,,,,,,,,,,,,,,,,,,,,,,
18K03996,岐阜工業高等専門学校,片峯 英次,時間発展型マルチフィジックス問題における形状最適化の検証,基礎的な非定常熱弾性場と非定常熱対流場における形状決定問題に対する数値解法を提案した．熱弾性場問題では，指定された時間区間において熱変形が最小化する形状を決定する剛性最大化問題などが検討された．また熱対流場問題では，部分境界での温度時間履歴を制御する形状決定問題などが検討された．これらの形状設計問題に対して，随伴変数法を用いて形状修正の感度となる形状勾配関数が理論的に導出された．FreeFEMを利用し，導出した形状勾配関数に基づいて最適形状を解析するプログラムが開発された．二次元問題の解析結果に基づいて，提示した解法の妥当性が示された．,基盤研究(C),小区分19020:熱工学関連,最適設計,形状最適化,形状同定,連成問題,有限要素法,随伴変数法,,,,,,,,,,,,,,,,,,,,,,,,,,,,,,,,,,,,,,,,,,,,,,,,,,
18K03995,秋田工業高等専門学校,野澤 正和,極低温流体による生体細胞の機能的冷却時に発生する沸騰現象の熱・流体・物質伝達機構,凍結保存技術の凍結・融解後の生存率の向上を目指して、液体窒素浸漬冷却時に冷却対象周囲に発生する膜沸騰による蒸気挙動の制御を試みた。冷却対象表面の膜沸騰の様子を可視化観測を行った。得られた可視化画像を、輝度値の変化の画像解析を行うことで、容器表面の形状を変化させた場合の影響について考察を行った。冷却対象表面を60meshのステンレスメッシュで覆った場合、何も覆わない場合と比較して、発生する蒸気量が抑制されることが確認できた。また、温度計測により、冷却対象表面の伝熱特性の変化は、対象内部の深さ1 mm以内には影響を及ぼすことが確認できた。,基盤研究(C),小区分19020:熱工学関連,沸騰制御,熱工学,凍結保存,伝熱促進,液体窒素,沸騰熱伝達,液体窒素中の伝熱・流動,可視化,温度計測,二成分の沸騰現象,生体熱工学,極低温流体,沸騰抑制,,,,,,,,,,,,,,,,,,,,,,,,,,,,,,,,,,,,,,,,,,,
18K03994,関西大学,松本 亮介,X線μCTを用いた霜層微細構造計測に基づく熱物質輸送解析による霜成長過程の解明,冷凍空調機器の熱交換器において霜の形成は多大なエネルギー損失を招くため，霜成長過程の解明は急務な課題である．本研究は，霜結晶構造と霜層内の熱物質輸送との関係の解明し，霜成長過程を明らかにすることを目的とする．X線マイクロCTを用いて霜結晶の３次元微細構造を測定することで，冷却面性状が結晶構造に与える影響を評価した．さらに，測定された３次元微細構造を用いて，氷結晶と湿り空気の複合熱伝導を解析した．霜層の成長と共に霜層表面温度が上昇するのに対し，霜層底部の温度は低下する．その結果，霜層底部の霜結晶は層内での昇華により供給された水蒸気によって成長することが明らかとなった．,基盤研究(C),小区分19020:熱工学関連,霜,氷結晶,X線マイクロCT,３次元微細構造,熱物質輸送,3次元構造,着霜,霜結晶,X線μCT,,,,,,,,,,,,,,,,,,,,,,,,,,,,,,,,,,,,,,,,,,,,,,,
18K03993,愛知工業大学,牧野 敦,固体粒子の燃焼完結に不可欠な粒子活性化を誘引する限界粒子径の明確化に関する研究,エネルギの有効利用に関連して固体燃料粒子の燃焼限界が，実験・解析の両面から調べられた．実験においては大気圧高温（1300 K以上）の酸化剤雰囲気中に，粒径が明確な固体炭素粒子を投入し，燃焼状態への移行が生じるのかが調べられ，粒径が70μm以上でないと燃焼が観察されないことが確認された．解析においては，燃焼への移行（着火）ないしは燃焼の停止（消炎）が生じる温度や粒径が調べられ，燃焼可能な領域は限定されていること，実験において用いられた条件下では73μm以上の粒子でないと燃焼へと移行できないこと，燃焼の進行により粒径が17μm以下となると，燃焼が維持できなくなることなどが明らかとなった．,基盤研究(C),小区分19020:熱工学関連,固体粒子の燃焼,限界粒径,着火条件,燃焼活性化条件,消炎条件,燃焼完結条件,,,,,,,,,,,,,,,,,,,,,,,,,,,,,,,,,,,,,,,,,,,,,,,,,,
18K03992,日本大学,秋濱 一弘,レーザーブレイクダウン支援長距離火花放電による広域点火に関する研究,火花点火ガソリンエンジンの希薄燃焼限界を向上させる新しい広域点火法を提案した。レーザーブレイクダウンと高電圧印加を組み合わせた長距離放電点火LBALDI （Laser Breakdown Assisted Long-distance Discharge Ignition） の基礎特性明確化と有効性実証を目的としている。レーザーと高電圧印加の角度は90°付近が最も放電距離が長くなる。定容容器を用いて燃料依存性を調査しルイス数１以上の条件にて有効な点火法であることが分かった。急速圧縮装置を用いてエンジンに近い条件の高圧場においても長距離放電可能なLBALDIの有効性を実証し、目標を達成した。,基盤研究(C),小区分19020:熱工学関連,点火,火花点火エンジン,レーザー,レーザーブレイクダウン,燃焼,プラズマ,希薄燃焼,放電,火花点火機関,火花放電,内燃機関,,,,,,,,,,,,,,,,,,,,,,,,,,,,,,,,,,,,,,,,,,,,,
18K03991,東洋大学,森本 久雄,ガンの温熱療法への応用を目的とした磁性ナノ粒子の自己配列化と発熱特性に関する研究,本研究では，ガンの温熱療法への応用を目的として高周波交流磁場中における強磁性ナノ粒子の自己配列化および発熱をコンピュータシミュレーションと実験により解析した．外部磁場中において強磁性ナノ粒子は自己配列化してクラスターを形成するが，粒子の発熱効率はそれらクラスターの構造に応じて変化することがわかった．クラスター構造および粒子発熱量が外部磁場強度や粒子の充填率などの実験条件に対してどのように変化するかを明らかにするとともに，粒子のクラスター構造が発熱量におよぼす効果を明らかにした．,基盤研究(C),小区分19020:熱工学関連,磁性ナノ粒子,温熱療法,自己配列化,交流磁場,,,,,,,,,,,,,,,,,,,,,,,,,,,,,,,,,,,,,,,,,,,,,,,,,,,,
18K03990,上智大学,高橋 和夫,１００ミリ秒の高温持続時間を有する高圧衝撃波管の開発・評価と冷炎観測への応用,化学衝撃波管は衝撃波圧縮を利用した反応容器であり，試料気体を瞬時かつ均一に昇圧・昇温が可能であることから，これまで1000K以上の高温化学反応研究や着火研究に広く用いられてきた。しかし，この装置の欠点は衝撃波加熱された試料気体が高温のまま維持される時間（高温持続時間）が，通常1～1.5ミリ秒と極めて短いことにある。本研究では，現在工学分野で用途の高まっている高圧衝撃波管の高温持続時間を延ばすための装置開発を行った。その結果，高温持続時間を32ミリ秒まで延ばすことができ，自動車エンジンのノック現象解明の化学的研究に応用するとともに，650～1000 Kの中間温度域の化学反応追跡法を確立した。,基盤研究(C),小区分19020:熱工学関連,高圧衝撃波管,着火遅れ,ノッキング,低温酸化,冷炎,反応モデル,衝撃波管,高温持続時間,自着火,,,,,,,,,,,,,,,,,,,,,,,,,,,,,,,,,,,,,,,,,,,,,,,
18K03989,岡山県立大学,春木 直人,血流を模擬した熱エネルギー輸送システムを実現する変形能カプセルスラリーの開発,本研究は，蓄熱物質を熱輸送媒体に混合させて，単位体積あたりの熱輸送量を増加させる熱輸送技術において，新たに血液中の赤血球をモデルとした弾性変形可能なカプセルに，蓄熱物質を内封させて熱輸送媒体と混合させる技術開発を行った．その結果，ゼラチンをカプセル材料とすることで含有する潜熱蓄熱材が液相時には柔らかくなるカプセルが作製された．さらに，カプセルスラリーの流動抵抗と熱伝達特性の測定を行い，潜熱蓄熱材が液相時のカプセルスラリーの熱伝達が，固相時よりも高くなることや，相変化によってスラリーの熱伝達特性が増加することが確認された．,基盤研究(C),小区分19020:熱工学関連,潜熱蓄熱材,カプセルスラリー,ゼラチンカプセル,相変化,変形能,熱エネルギー輸送,変形能カプセル,熱輸送,蓄熱物質,流動抵抗,熱伝達,熱輸送媒体,赤血球,,,,,,,,,,,,,,,,,,,,,,,,,,,,,,,,,,,,,,,,,,,
18K03988,大阪府立大学,金田 昌之,熱磁気力による対流制御に最適な磁場分布の探求とその検証,外部磁場印加による対流伝熱の促進や制御についての知見を得るために，常磁性流体への磁気力の効果について研究を進めた．その結果複数個並べた磁石の間で強い磁気力を生じることがわかった．これを自然対流への対流制御ならびに温度成層状態の流体の対流誘起に応用するために数値解析ならびに実験を実施した．その結果，2個の磁石を交互に並べた場合で最も局所的な効果が大きくなることがわかった．磁石を増やすことで効果の増大を期待したが，磁場印加の領域は広がるものの局所的なピーク値はむしろ低下することがわかった．,基盤研究(C),小区分19020:熱工学関連,磁気力,常磁性流体,熱流動,対流制御,対流誘起,対流,磁場印加,伝熱,自然対流,永久磁石,磁場分布,磁場印加効果,,,,,,,,,,,,,,,,,,,,,,,,,,,,,,,,,,,,,,,,,,,,
18K03987,富山県立大学,大嶋 元啓,薄膜・ナノ粒子形成のための高真空条件における浮遊液滴の減圧沸騰,本研究テーマは高真空雰囲気圧における液滴の減圧沸騰に至る過程を実験および数値計算により明らかにすることを目的としている．本研究では超音波により液滴を浮遊させ，これを急減圧させることにより液滴内部の核生成による液滴の減圧沸騰現象を実験的に観察した．また，同時に過去の研究で報告されている減圧沸騰に関する知見を基にシミュレーションコードを改良し，減圧場の液滴および噴霧のシミュレーションを行った．,基盤研究(C),小区分19020:熱工学関連,減圧沸騰,液滴,真空,蒸発,数値計算,,,,,,,,,,,,,,,,,,,,,,,,,,,,,,,,,,,,,,,,,,,,,,,,,,,
18K03986,九州大学,森上 修,燃料噴霧の自着火の素過程モデル構築,燃料噴霧の自着火の素過程として液滴群を対象とした．直径数10ミクロンオーダーの微小液滴の高温雰囲気中における蒸発特性が粗大液滴のそれに従うことを実験的が確認され，発光を伴わない冷炎の発生が液滴径履歴より確認可能であることが示された．また，直径の異なる複数粗大液滴の高温空気中の自着火の実験により，直径の小さい方の単一液滴の場合よりも複数液滴の方が系全体の自着火が促進される条件が存在することが実験的に初めて確認されるなど，液滴間干渉の自着火への影響が液滴径，液滴間隔，雰囲気条件の諸条件に複雑に依存することが示された．上記が数値計算を用いて説明された．,基盤研究(C),小区分19020:熱工学関連,燃焼,噴霧,自着火,,,,,,,,,,,,,,,,,,,,,,,,,,,,,,,,,,,,,,,,,,,,,,,,,,,,,
18K03985,九州大学,中島 裕典,燃料・熱自立型接触部分酸化触媒内蔵ハニカム固体酸化物形燃料電池の三次元電流分布,有望な体積出力密度が期待できる，燃料極支持形ハニカム固体酸化物形燃料電池を，３ｘ３の9本の流路を有する多孔質燃料極支持体上に，電解質、空気極を当研究室において塗布，焼成し作製した．このセルの燃料極流路内にRh系の部分酸化改質触媒を設置して，メタン・空気混合ガスを供給し，セル内で燃料改質を進行させながら，発電試験を行い，I-V特性の評価に成功した．また，3次元温度分布を計測できた．触媒を設置し燃料を供給する流路および排気流路の配置を変えることにより，3次元的に燃料輸送経路を変えることで性能向上を図れることがわかった．,基盤研究(C),小区分19020:熱工学関連,固体酸化物形燃料電池,ハニカム支持構造,多孔質燃料極,体積出力密度,部分酸化改質,三次元電流分布,コンパクト電源,接触部分酸化改質,ハニカム形燃料極支持体,燃料自立,熱自立,多孔質ハニカム燃料極,三次元反応場,内部改質,接触部分酸化,燃料・熱自立,,,,,,,,,,,,,,,,,,,,,,,,,,,,,,,,,,,,,,,,
18K03984,九州大学,福永 鷹信,生体内熱輸送特性を可視化する新たな画像診断技術の開発,本研究は，生体組織内部の熱的情報を非接触で可視化するレーザースキャニングサーモグラフィと名付けた新たな画像診断技術の実現のため，シミュレーションにより原理を確立し適用条件を明らかにすること，さらに，生体模擬試料を用いて実験を行い，考案した測定方法の実証を行うことを目的とした．解析の結果から，シートレーザー通過後の試料表面温度は包埋させた試料の熱輸送性質に依存して異なり，生体試料と同程度の熱拡散率を持つアクリル試料において最も明瞭な可視画像を得ることができた．実証実験では，解析で求められた温度上昇と概ね一致する値を示す可視化画像を得ることができ，非接触可視化法の確立ができた．,基盤研究(C),小区分19020:熱工学関連,非接触可視化法,熱輸送性質,レーザースキャニングサーモグラフィー,熱物性,レーザースキャニングサーモグラフィ,非接触可視化技術,生体組織,可視化,画像診断,,,,,,,,,,,,,,,,,,,,,,,,,,,,,,,,,,,,,,,,,,,,,,,
18K03983,九州大学,Cannon James,,現代社会における冷媒の用途は広範囲に及んでいます。しかし、冷却剤の性質は過去１００年間ほとんど変わっておりません。ほとんどの開発が実験的に行われています。近年の計算能力の向上と機械学習の発展に伴います。本研究では、シミュレーション、統計学、機械学習の観点から、熱物性と冷媒技術の検討に焦点をあてています。,基盤研究(C),小区分19020:熱工学関連,coolant,Molecular simulation,alcohol,simulation,molecular dynamics,nano-scale,thermophysical,water,Nanoscale,Molecular Dynamics,Optimisation,Simulation,Thermodynamics,,,,,,,,,,,,,,,,,,,,,,,,,,,,,,,,,,,,,,,,,,,
18K03982,九州大学,東 之弘,次世代冷媒を成分とする３成分系混合冷媒の気液臨界点に関する研究,オゾン層破壊や地球温暖化の起因物質と考えられているフルオロカーボン冷媒に代わる新物質の探索は急務である。しかし研究代表者等のおこなった過去の研究結果から単一物質から候補物質を探すことは難しく、今では3成分系以上の混合物が候補となっている。3成分系冷媒の開発の基盤となる熱力学性質は、まだまだ未知な部分が多く、信頼できる推算方法さえ出来上がっていない。本研究では、最も基本となる熱物性値である臨界定数を、3種類の混合冷媒について実験から高精度で求めた。そして、従来の推算法の比較を行い、新たに適合できる推算法の開発を行った。,基盤研究(C),小区分19020:熱工学関連,気液臨界点,3成分系混合冷媒,低GWP冷媒,熱物性測定,臨界定数,相関式,３成分系混合冷媒,推算式,混合冷媒,,,,,,,,,,,,,,,,,,,,,,,,,,,,,,,,,,,,,,,,,,,,,,,
18K03981,徳島大学,名田 譲,平行噴流噴霧バーナー上に形成される希釈火炎のNOx排出量スケーリング則の導出,本研究では，大型加熱炉に多く用いられる平行噴流バーナーの構造が窒素酸化物（NOx）排出量に与える影響を明らかにし，その予測モデルを提案することを目的としている．燃料には液体燃料である灯油およびデカンを用いた．予熱温度が高い場合，ノズル間隔を広げると希釈効果によりNOx排出量は低下する．一方で，予熱温度が低い場合では，希釈効果が弱いため液体燃料の蒸発促進効果が優位となり，NOx排出量は増加する．これらの挙動を予測可能な，火炎体積と最高温度を用いた予測モデルを構築した．,基盤研究(C),小区分19020:熱工学関連,希釈燃焼,平行噴流バーナー,窒素酸化物,スケーリング則,総括反応機構,高温空気噴霧燃焼,火炎体積,液滴到達距離,完全攪拌反応器,NOx生成速度,スケーリング,数値シミュレーション,希釈火炎,,,,,,,,,,,,,,,,,,,,,,,,,,,,,,,,,,,,,,,,,,,
