awardnumber,organization,name,title,abstract,section,review_section,keyword1,keyword2,keyword3,keyword4,keyword5,keyword6,keyword7,keyword8,keyword9,keyword10,keyword11,keyword12,keyword13,keyword14,keyword15,keyword16,keyword17,keyword18,keyword19,keyword20,keyword21,keyword22,keyword23,keyword24,keyword25,keyword26,keyword27,keyword28,keyword29,keyword30,keyword31,keyword32,keyword33,keyword34,keyword35,keyword36,keyword37,keyword38,keyword39,keyword40,keyword41,keyword42,keyword43,keyword44,keyword45,keyword46,keyword47,keyword48,keyword49,keyword50,keyword51,keyword52,keyword53,keyword54,keyword55,keyword56
19J23329,東京大学,李 華雨,日本中世における蘇軾・黄庭堅の受容ーー万里集九の注釈と創作を中心として,本研究は主に万里集九という五山僧を取り上げ、日本中世における中国文学・文化の受容、特に宋代文化の受容の展開と深化の過程を考察し、中世紀日中文化交流の一側面を端的に解明し、東アジアにおける蘇軾・黄庭堅を代表とする「宋型文化」の影響と価値を全面的に評価する。,特別研究員奨励費,小区分02020:中国文学関連,五山文学,抄物,五山文化,,,,,,,,,,,,,,,,,,,,,,,,,,,,,,,,,,,,,,,,,,,,,,,,,,,,,
19J21689,東京大学,田中 雄大,中国語文学における「現代主義」的思考様式の形成と変遷――穆時英・戴望舒を起点に,本研究は、穆時英（1912-1940）の小説において顕著な「直線的な時間への違和感」や「因果関係に基づかない思考のあり方への関心」といった諸特徴を、他のいわゆる「現代主義」作家とも共有可能な一般性を有する一つの思考様式（＝「現代主義」的思考様式）であると暫定的に捉えた上で、1920年代から1930年代の中国において同思考様式が形成されるまでの、文学的・思想的・社会的言説の動態を明らかにすることを目指すものである。また同時に1930年代以降の複数の時代・地域におけるいわゆる「現代主義」作家のテクストを分析することで、一度形成された同思考様式が変遷していく様相についても考察を行う。,特別研究員奨励費,小区分02020:中国文学関連,モダニズム,文学史,詩的言語,個性・主体性,現代主義,個性,穆時英,廃名,,,,,,,,,,,,,,,,,,,,,,,,,,,,,,,,,,,,,,,,,,,,,,,,
19J12592,早稲田大学,柯 明,東アジア近世女性漢詩人の作品に関する比較研究―旅を中心として―,本研究では、日本・中国・朝鮮三つの国の女性文学を同じ漢文化圏の視野に入れ、東アジア全体を渡し、従来の研究を踏まえながら、さらに旅を中心として、東アジア近世女性漢詩人の比較研究を取り組む。同じ時代に生まれ、旅に出ている女性漢詩人たちによる創作はどのような特徴を持っているのかという問題を着眼点とし、未だ解明していない問題点を取り上げて明らかにする。具体的に、遊歴の実践・実地教育が彼女らの文学に与える具体的な影響を明らかにし、詩作における移動の空間性・景物のイメージまたは用いられた時間表現などの特徴に関する考察を行う。,特別研究員奨励費,小区分02020:中国文学関連,原采蘋,女流詩人,漢詩,旅,近世東アジア,女性文学,旅の「形態論」,「舟」表現,東アジアの女性漢詩人,,,,,,,,,,,,,,,,,,,,,,,,,,,,,,,,,,,,,,,,,,,,,,,
19J12524,一橋大学,王 晴,満洲国における日本浪曼派の受容と変容,本研究は、日本浪曼派および満洲浪曼派を文学的事例として取り上げ、満洲という日本の傀儡国家が建設された地域における浪曼派的思想の機能と意味について考察する。これまでの「日本浪曼派」あるいは「満洲浪曼派」を扱った研究の多くは、その視点が一地域あるいは一国に限定されており、特に相互影響関係に基づいた研究はほとんどなされてこなかった。本研究は、昭和精神史の重要な内容としての「満洲叙述」あるいは「大陸想像」が如何なる意味が持つのかを問題意識として、日本浪曼派と満洲浪曼派の関連付けに基づいて、文学形態の移り変わりを歴史的に再現することで、国や地域の枠を乗り越える超域的研究の可能性を提示することを試みたい。,特別研究員奨励費,小区分02020:中国文学関連,満州国文学,日本浪漫派,満州浪漫,満洲国文学,「満州浪漫」,近代意識,,,,,,,,,,,,,,,,,,,,,,,,,,,,,,,,,,,,,,,,,,,,,,,,,,
19J10671,関西大学,陳 駿千,『三国志演義』版本の研究～二十四巻系諸本の系譜～,『三国志演義』の版本は現在三十余種存在し、その相互関係は極めて複雑である。とりわけ二十四巻系諸本は、そのテキスト進化の中間段階に位置し、『演義』が大きな変貌を遂げた時期にあたり、特に重要なグループであると考えられる。二十四巻諸本の相互関係は、『演義』テキストの成立・進化の過程をめぐる研究の重要な一環であり、それを解明することは、『演義』人物像の変遷から、中国近世の出版事情、知識人や一般庶民の思想観念に至る諸問題の研究にあたっても、重要な意味をもつ。,特別研究員奨励費,小区分02020:中国文学関連,三国志演義,夷白堂本,小野清,仙台藩,朝鮮銅活字本,,,,,,,,,,,,,,,,,,,,,,,,,,,,,,,,,,,,,,,,,,,,,,,,,,,
19J01097,京都大学,宮本 陽佳,漢籍解釈から見る言語観の確立――日本近世期における唐話学再評価,本研究は、近世期における唐話・白話小説の受容と言語観の確立の関係を明らかにすることを目的とするものである。主に近世中期頃の漢籍解釈を対象とした言語論の展開を分析し、その中で確立されていく言語観について考える。当時において「漢籍（主に文言文作品）を読むこと」は「学問をすること」と同義であり、本研究で着目する言語観は、当時の学問の世界を考える上で認識しておくべきものである。また本研究は、上記の目的を達成することによって、唐話・白話小説の受容を近世期以降の日本文化というより大きな枠組みの中で捉える基盤を構築することをも目指すものである。,特別研究員奨励費,小区分02020:中国文学関連,漢籍解釈,岡白駒,論語徴,唐話学,明律,明律注釈書,荻生徂徠,,,,,,,,,,,,,,,,,,,,,,,,,,,,,,,,,,,,,,,,,,,,,,,,,
20J02107,上野学園大学,早川 太基,詩律と格律――古楽譜による唐代「声詩」研究,本研究は、唐宋時代における音楽と歌詞との関係性について分析する。具体的には、音楽方面の資料の多くは「雅楽」として日本に残され、歌詞は「漢詩」として中国に伝来するが、この長い歴史のなかで分離してしまった両者を、ふたたび重ね合わせてゆく作業である。,特別研究員奨励費,小区分02020:中国文学関連,日本雅楽,唐代音楽,配辞研究,楽府,格律,三五要録,琵琶,詞曲,唐宋音楽,声詩,配詞研究,古楽譜,,,,,,,,,,,,,,,,,,,,,,,,,,,,,,,,,,,,,,,,,,,,
20J00123,東京大学,福長 悠,中国における左翼文学とモダニズム文学の交錯――張天翼を中心に――,本研究では、中華民国期に新進気鋭の作家として活躍した張天翼（1906-1985）の作品を検討する。張天翼は軍隊小説、革命小説、風刺小説など社会情勢に鋭く切りこむ作品を発表した作家である。本研究では、張天翼の作品のうち、内戦や革命運動など社会の動乱を題材にした作品に焦点を絞り、報道や雑誌、歴史資料を用いて小説執筆の契機となった具体的事実を明らかにする。また、張天翼は俗語表現を巧みに用いることで高い評価を得たが、彼のテクストには実験的あるいは遊戯的な技巧も見られる。これらの技巧をモダニズムの影響の観点から分析し、文体上の技巧が当時の社会的現実との間に切り結んだ関係を分析する。,特別研究員奨励費,小区分02020:中国文学関連,言語遊戯,プロレタリア文学,モダニズム,身体表象,民衆文化,モダニズム文学,漢字簡略化,グロテスク,児童文学,リスク・コミュニケーション,新感覚派,,,,,,,,,,,,,,,,,,,,,,,,,,,,,,,,,,,,,,,,,,,,,
21J15695,京都大学,キョウ 麗坤,9-12世紀西域対音資料の研究,本研究は現在見ることの出来る9-11世紀の対音資料を收集、総合することを通して、利用可能な対音資料の数量を増加させ、中世紀西北地区の漢語方言の時代区分、音韻体系、文法構造をより細かに提示することが出来る。「工具」としての「対音資料」を磨き上げることで、中世紀中央アジア文献の解読、言語及び歴史研究の進展に資することが出来る。同時に字譜DBという手段によって、隣接領域の学者が対音資料的を用いる際の難度を低下させ、対音資料を捜索、分析、統合するのに費やす時間を減少させることができるため、研究效率が向上し、対音資料が関連領域の研究で使用される頻度も増加することになるはずである。,特別研究員奨励費,小区分02020:中国文学関連,敦煌,対音文献,中国語学,古チベット語,チベット語学,,,,,,,,,,,,,,,,,,,,,,,,,,,,,,,,,,,,,,,,,,,,,,,,,,,
21J11831,大阪大学,宋 新亜,「知日派」中国知識人の日本認識の変容ーー1925～1937年の上海を中心に,本研究は、1920、30年代の新聞や雑誌に載った文章を中心に、言語表現の細部を緻密に分析しつつ、全体を歴史・社会的文脈から読み解いていく。また、知識人たちの言論と営為を社会的伝達行為の中に位置づけることによって、テクストとコンテクストを融合して研究する。具体的に言えば、研究の主軸としては、1920～30年代に上海で活躍した知日派知識人の日本認識を動態的に追跡することである。研究の副軸としては、新聞・回想録・日記・公文書などの資料によって、個々人の1925～1937年の上海における日常生活の様相を再構築することである。,特別研究員奨励費,小区分02020:中国文学関連,郁達夫,旧制高校,留学生文学,中国人日本留学生,対日認識,中国近代文学,中国語教育史,日中知識人の交流,日本中国人留学生,創造社,,,,,,,,,,,,,,,,,,,,,,,,,,,,,,,,,,,,,,,,,,,,,,
21J00829,一橋大学,杉谷 幸太,「毛文体」から読み解く文化大革命の言語世界――日常と内面へのアプローチ,,特別研究員奨励費,小区分02020:中国文学関連,,,,,,,,,,,,,,,,,,,,,,,,,,,,,,,,,,,,,,,,,,,,,,,,,,,,,,,,
22KJ3009,立命館大学,藤田 優子,中国韻文芸能の展開：異種芸能間の交流と文学化,本研究は、宋元明代における多様な韻文芸能（韻文の歌唱と散文のセリフ・語りから構成される芸能）の展開を明らかにすることを目的とするものである。雑劇や南戯をはじめとする多様な韻文芸能を総合的に捉え、特にそれらを構成する韻文と楽曲に着目して共時的・通時的分析を行う。これによって、複雑に交錯しながら発展してきた韻文芸能間の交流の様相を描写することを目指す。,特別研究員奨励費,小区分02020:中国文学関連,詞,北曲,雑劇,韻文芸能,戯曲,芸能,韻文,歌辞,,,,,,,,,,,,,,,,,,,,,,,,,,,,,,,,,,,,,,,,,,,,,,,,
22KJ2829,日本大学,山口 早苗,日本占領期上海の「対日協力者」の文学活動―新聞文藝欄に関する考察を中心に―,本研究は、日中戦争時期に日本の占領地政権であった汪精衛政権で活躍した中国文化人の文学活動を当時の新聞を材料に再検討するものである。特に本研究では日中戦争時期に上海で刊行された新聞（『新申報』など）上に掲載された文芸欄に注目し、文芸欄の全記事目録を作成し、その傾向・性格を分析した上で、汪政権に近い位置にいた文化人たちの活動・思想を明らかにする。,特別研究員奨励費,小区分02020:中国文学関連,日中戦争,対日協力,中国文学,上海,文学者,,,,,,,,,,,,,,,,,,,,,,,,,,,,,,,,,,,,,,,,,,,,,,,,,,,
22KJ2826,日本大学,松崎 寛子,戦後台湾「国文」教科書における現代文学と郷土想像について,戦後直後の国語推進運動期 (1945-70年代)の「国文」教育における郷土表象について考察し、民主化運動の中(70年代-99年)「国文」教科書における郷土表象がどのように変化したか解明する。そして国定教科書から民間出版社による教科書編纂の移行と新検定制度(99年-2008年)に到るまでの「国文」教科書における現代文学作品と郷土表象を解明し、2008年以降の「国文」教科書における現代文学の郷土表象の新しい方向性について明らかにする。,特別研究員奨励費,小区分02020:中国文学関連,台湾文学,児童文学,環境問題,郷土想像,アイデンティティ,国語教育,郷土表象,,,,,,,,,,,,,,,,,,,,,,,,,,,,,,,,,,,,,,,,,,,,,,,,,
22KJ2114,大阪大学,小川 主税,20世紀中国文学における男子学生表象――規範と逸脱に着目して,本研究は、近現代中国の男性性規範に関する各種言説を踏まえつつ20世紀中国文学における男子学生表象を分析するものである。近代中国の思想界を牽引した雑誌『新青年』は、男子学生の目指すべき理想像として新たに「中国青年」という概念を構築し、彼らの活躍に社会変革を期待した。だが、理念は現実との間に様々な軋轢を生じさせる。「中国青年」なるモデルが生身の男子学生に重くのしかかってきたがゆえに、理想像から零れ落ちるような男子学生も少なからず生み出されていたのである。,特別研究員奨励費,小区分02020:中国文学関連,男子学生,自由恋愛,テクスト論,近代化のひずみ,ミソジニー,「中国青年」,ジェンダー,社会主義,,,,,,,,,,,,,,,,,,,,,,,,,,,,,,,,,,,,,,,,,,,,,,,,
22KF0100,東京大学,齋藤 希史,日唐交流における「六朝詩体」,中国における近体詩の確立以前に、六朝文学を起点として広く東アジアに流通し、唐代においても継承されたた詩体を「六朝詩体」とし、奈良 ・平安朝の漢詩文にそれがどのように享受され制作されたか、近体詩との関連を視野に入れながら考察する。 これによって日本と唐朝との文 学交流における詩体の多元性を明らかにするとともに、それぞれの文学が独自に変革を遂げていくさいにもその多元性が大きく作用したことを明らかにする。,特別研究員奨励費,小区分02020:中国文学関連,六朝詩体,仄韻律詩,懐風藻,詩語,首尾不対,唐代,韻律,斉梁体,,,,,,,,,,,,,,,,,,,,,,,,,,,,,,,,,,,,,,,,,,,,,,,,
22F22005,東京大学,齋藤 希史,日唐交流における「六朝詩体」,,特別研究員奨励費,小区分02020:中国文学関連,,,,,,,,,,,,,,,,,,,,,,,,,,,,,,,,,,,,,,,,,,,,,,,,,,,,,,,,
23KJ1821,京都府立大学,永井 もゆ,通俗歴史小説『説唐全伝』成立に関する研究；非知識人層における文化・思想の観点から,本研究は、中国の歴史小説『説唐全伝』について、続編として刊行された五つの後続作品を着眼点とし、その成立年代・成立過程を明らかにしようとするものである。『説唐全伝』には同シリーズとして刊行された後続作品が五つ存在するが、その中には、現在一般的に考えられている『説唐全伝』の成立年代より古い時代の版本の特徴を持つものがある。そこで、本研究では、まずそれらの後続作品について、本文が基づく文献の検討や作品間の比較を行い、成立過程・成立年代を特定する。そのうえで、『説唐全伝』と後続作品との比較を行い、『説唐全伝』の成立年代・成立過程を解明することを目指す。,特別研究員奨励費,小区分02020:中国文学関連,中国文学,中国古典小説,白話小説,説唐全伝,校勘,資治通鑑,版本,,,,,,,,,,,,,,,,,,,,,,,,,,,,,,,,,,,,,,,,,,,,,,,,,
23KJ1429,大阪大学,岑 天翔,南宋士大夫の内面と詩に関する研究―郷里との結びつきに着目して―,本研究は、郷里との結びつきという観点から南宋士大夫の内面と詩を分析するものである。南宋に至ると、士大夫は長期にわたって郷里に帰り生活するようになり、それ以前の唐・北宋期よりも、郷里との結びつきがより密接なものとなる傾向が見られる。こうした新たな結びつきの展開は、南宋士大夫の内面と文学に重大な影響を与えてきた。,特別研究員奨励費,小区分02020:中国文学関連,南宋士大夫,郷居,郷里社会,郷論,作詩姿勢,,,,,,,,,,,,,,,,,,,,,,,,,,,,,,,,,,,,,,,,,,,,,,,,,,,
23KJ1424,大阪大学,村田 真由,宋元王朝交替期における「遺民」の文学―文天祥を基軸として―,宋元王朝交替期にあっては、宋王朝に対する忠節を持して新たな王朝に仕えず、「遺民（＝身を寄せるべき王朝を失い、あとに残された民）」として生きることを選択した人々が多数存在した。南宋末の文天祥(1236-1283)は、その代表的存在である。,特別研究員奨励費,小区分02020:中国文学関連,文天祥,宋代文学,,,,,,,,,,,,,,,,,,,,,,,,,,,,,,,,,,,,,,,,,,,,,,,,,,,,,,
24KJ1417,京都大学,于 恒超,沈約の声律論について,漢字の音韻配列は漢詩文のリズムなどを左右する。その形式あるいは規則が声律と呼ばれている。本研究では、声律論を提唱する代表的な学者・沈約の声律論を検討する。そのために、先行研究で展開されてきた研究方法を整理、検証し、その上で、統計学を取り入れ、新しい研究方法を確立する。この新しい研究方法と、『文鏡秘府論』などの文学理論書から抽出された声律規則とを、沈約らの詩文作品の声律の実態に適用し、その結果を以て、文学理論書に記述された声律規則を修正し、できるだけ沈約当時の声律規則を復元する。また、復元された声律規則に基づき、沈約声律論の原理・受容・伝承などの問題について再検討する。,特別研究員奨励費,小区分02020:中国文学関連,,,,,,,,,,,,,,,,,,,,,,,,,,,,,,,,,,,,,,,,,,,,,,,,,,,,,,,,
24KJ1224,名古屋大学,胡 勝,戦時期の文芸的共同体の亀裂と交流ーー中国、日本、イギリス文壇を中心に,本研究は、抗日の文芸的共同体である「文協」とその機関誌『抗戦文芸』を中心に、新体制下では不可視化されてきた多様な政治的立場と文芸的主張が共存する戦時期文芸界の実態を探究する。また、対立と傀儡の関係性が強調されてきた戦時期日中文学について、日中左翼文学交流の新視点を見出す。その上で欧米文化人の中国大陸での活動を合わせて考察し、異なる国家の文化人の間の交流に焦点を当て、周縁化されてきた戦時期のトランスナショナルな人的交流を跡付け、戦時期文学のインターナショナリズムの側面を明らかにし、国別文学を超える広域文学研究を目指して戦時期文学史を描き直そうとする。,特別研究員奨励費,小区分02020:中国文学関連,,,,,,,,,,,,,,,,,,,,,,,,,,,,,,,,,,,,,,,,,,,,,,,,,,,,,,,,
25KJ1545,京都大学,仲村 康太郎,本邦にのみ伝存する中国書論を用いた中国中古時代の書論の研究,本研究は中国中古時代に書かれた書芸に関する専門著作（書論）のうち、中国では散佚し日本にのみ伝存する、いわゆる佚存書を主たる対象とし、これらを中国書論史研究の基礎資料として利用しやすい形態で公表するとともに、現存文献に対する総体的な認識にもとづき、中国中古時代の書論の形成と受容の様相を明らかにするものである。,特別研究員奨励費,小区分02020:中国文学関連,,,,,,,,,,,,,,,,,,,,,,,,,,,,,,,,,,,,,,,,,,,,,,,,,,,,,,,,
25KJ1085,東京大学,胡 睿,中国モダニズム文学の「終焉」を問い直す：ディアスポラ、翻訳、「現実」の捉え方から,本研究は「孤島」期上海から日中戦争期における中国モダニズム文学の転換に焦点を当てる。テクスト研究と実証研究を基盤にカルチュラル・スタディーズの視点を導入し、戦時下の中国モダニズム文学の揺れと再構築を検討する。そして、新しい文学規範を含め当時の様々な政治、イデオロギーが交錯する場に巻き込まれた彼らが、それをいかに受け止めたかを浮き彫りにしようと試みる。本研究では1940年代の中国文学とその複雑な言説状況を理解するための一つのオルタナティブな道筋を提供したい。また、翻訳やメディアなどの視座から、同時期の中国、日本、欧米モダニズムの間に存在する対話的関係について議論を展開することも予定している。,特別研究員奨励費,小区分02020:中国文学関連,,,,,,,,,,,,,,,,,,,,,,,,,,,,,,,,,,,,,,,,,,,,,,,,,,,,,,,,
25KJ0224,大阪大学,永井 もゆ,物語の発展過程：隋末唐初を舞台とする小説と民間故事の様相から,本研究は、中国の白話歴史小説（口頭語彙で書かれた歴史小説）のうち、隋末唐初を舞台とするいわゆる隋唐ものの作品群について、その物語の発展過程について解明しようとするものである。研究は課題ごとに以下の２点に分け、実施する。,特別研究員奨励費,小区分02020:中国文学関連,,,,,,,,,,,,,,,,,,,,,,,,,,,,,,,,,,,,,,,,,,,,,,,,,,,,,,,,
