awardnumber,organization,name,title,abstract,section,review_section,keyword1,keyword2,keyword3,keyword4,keyword5,keyword6,keyword7,keyword8,keyword9,keyword10,keyword11,keyword12,keyword13,keyword14,keyword15,keyword16,keyword17,keyword18,keyword19,keyword20,keyword21,keyword22,keyword23,keyword24,keyword25,keyword26,keyword27,keyword28,keyword29,keyword30,keyword31,keyword32,keyword33,keyword34,keyword35,keyword36,keyword37,keyword38,keyword39,keyword40,keyword41,keyword42,keyword43,keyword44,keyword45,keyword46,keyword47,keyword48,keyword49,keyword50,keyword51,keyword52,keyword53,keyword54,keyword55,keyword56
23K25598,明治大学,倉地 真太郎,移民の福祉財政的分析ー「移民政策」のための自治体財源保障の検討ー,これまで移民問題に対して、経済学を中心に「移民が自国経済・財政に貢献をするか」という問いが立てられ実証分析が積み重ねられてきた（これを本研究では「移民財政貢献論」と呼ぶ）。これらの分析からはたしかに「移民を受け入れるべきか／べきでないか」という政策的示唆が得られる。しかし、「移民にどのような財政措置が必要か」といった財源論は検討することが難しいという問題点がある。そこで本研究は、自治体比較や国際比較の視点から移民問題を財政学的に分析することで、マイノリティを財政学的に分析する方法論的整理を行うとともに、「移民政策」のための自治体財源保障・支援制度のあり方を検討する。,基盤研究(B),小区分08020:社会福祉学関連,移民,多文化共生,地方財政,国際比較,財政学,福祉財政,ケア,外国人住民支援,,,,,,,,,,,,,,,,,,,,,,,,,,,,,,,,,,,,,,,,,,,,,,,,
23K25597,淑徳大学,松尾 加奈,アジアにおける国際ソーシャルワーク教育（再）構築のための共同調査研究,本研究はフィリピン、タイ、インドネシア、マレーシア、スリランカ、バングラデシュ、パキスタン、モンゴルの8か国を対象として、各国のソーシャルワーク研究者と共同で行うアクションリサーチを用いて、国際ソーシャルワーク教育を問い直し、再構築を試みる研究である。国際ソーシャルワーク教育の諸相を解明しながら、各国・地域の固有の文脈を考慮したカリキュラム開発を試みる。開発の過程では知見を踏まえた対話を行い、教育計画の試行実施と評価を対等な関係において実施する。本研究で得られた知見や成果を国内外に発信することで、国際ソーシャルワーク研究のハブ機能形成を目指すものである。,基盤研究(B),小区分08020:社会福祉学関連,国際ソーシャルワーク,脱植民地化,仏教ソーシャルワーク,アジアのソーシャルワーク教育モデル,インディジナスなソーシャルワーク,ソーシャルワーク教育,国際ソーシャルワーク教育モデル,インディジナス・ソーシャルワーク,アジアのソーシャルワーク教育,,,,,,,,,,,,,,,,,,,,,,,,,,,,,,,,,,,,,,,,,,,,,,,
23K25596,福島学院大学,内山 登紀夫,自閉スペクトラム症の幸福学の確立に向けた基礎的研究,本研究は，自閉スペクトラム症(以下ASD)のある成人の主観的幸福感を計測するための尺度を開発し，ASDの成人がどのような状態であると幸せなのかについての因果構造を，適切な統計学的手法によって明らかにする．主観的幸福という多義的で多様であり一見とらえどころがないものを「可視化し」，現実の中でASD成人の人生全体・生活全体への支援に取り組むための共通理解の基盤を提供できるようにする。,基盤研究(B),小区分08020:社会福祉学関連,自閉スペクトラム,Well-being,自閉症スペクトラム,,,,,,,,,,,,,,,,,,,,,,,,,,,,,,,,,,,,,,,,,,,,,,,,,,,,,
23K25595,岡山県立大学,佐藤 ゆかり,認知症の人が主体となる個別避難計画提案ツールの開発,近年、体験知から学ぶ研究により明らかにされてきた、避難行動の特徴や点在する関連要因を複合的に活用し、本人の希望を叶え、かつ合理的判断を導く計画作成プロセスを構築することが喫緊の課題である。本研究は、認知症の人が地域で安心安全に暮らせる社会基盤整備に向け、先行研究と体験知から導かれた、避難行動の特徴と関連要因の活用指針を得ることをねらいに、避難行動を適切に予測し、科学的根拠に基づき避難行動を促進する「適正候補提案アルゴリズムを組み込んだ個別避難計画作成デジタルツール」を開発する。,基盤研究(B),小区分08020:社会福祉学関連,認知症の人,個別避難計画,要配慮者,災害,,,,,,,,,,,,,,,,,,,,,,,,,,,,,,,,,,,,,,,,,,,,,,,,,,,,
23K25594,福知山公立大学,川島 典子,重層的支援における介護予防・防災機能付「独居高齢者の見守りロボット」の研究,本研究は、現在、日本において急激に増加しつつある独居高齢者が、独居であっても最後まで生き生きと住み慣れた地域において生活していけるようにすることを研究の目的としている。具体的には、地域福祉分野での重層的支援（包括的支援）を行う際、人口減少社会において枯渇するであろう福祉専門職の業務の1部を小型ロボットに代行させるために、「見守りロボット」の実装化を行う。,基盤研究(B),小区分08020:社会福祉学関連,独居高齢者の見守りロボット,介護予防機能,健康管理機能,防災機能,見守りロボット,独居高齢者,重層的支援,地域包括支援センター,福祉専門職,防災,健康管理,孤独解消,,,,,,,,,,,,,,,,,,,,,,,,,,,,,,,,,,,,,,,,,,,,
23K25593,長崎大学,平野 裕子,インドネシア人技能実習生に対する食事介助研修プログラムの開発と評価,本研究では、来日前のインドネシア人技能実習生を対象に、食事介助研修プログラムを開発し、その評価を行うことを目的とする。そのために、まず来日前の介護技能実習生の食事介助に関する知識や理解度を把握し、理解度が低い、あるいは誤解している点を改善するための研修プログラムを作成する。そして当該プログラムの効果を、食事介助に関する知識や技術の点について、来日前と来日後の時点で測定し、評価を行う。,基盤研究(B),小区分08020:社会福祉学関連,食事介助,介護技術研修プログラム,インドネシア,技能実習生,技術移転,介入研究,,,,,,,,,,,,,,,,,,,,,,,,,,,,,,,,,,,,,,,,,,,,,,,,,,
23K25592,大阪大学,山井 弥生,日独韓の地域包括ケアにみる市民参加の構造分析－超高齢社会と福祉ボランティアの位相,日本の「地域包括ケアシステム」では地域住民の互助が期待されている。申請者らはこれまでの共同研究で、日本の福祉ボランティアの位相は多面的であるとし、「委嘱型」ボランティアとされる（動員性＋贈与性）民生委員児童委員に焦点をあて、その活動と意識の変容を実証的に示した。福祉ボランティアの位相は社会や制度レジームの変化の影響を受け、変わりうる。本研究では、介護保険制度のもと、介護の地域化が進む日本、韓国、ドイツを対象に、地域包括ケアにみる市民参加の構造を分析し、国際比較を行うことで、今日の福祉ボランティアの位相を理論的かつ実証的に明らかにする。,基盤研究(B),小区分08020:社会福祉学関連,地域包括ケア,福祉ボランティア,市民参加,ドイツ,韓国,,,,,,,,,,,,,,,,,,,,,,,,,,,,,,,,,,,,,,,,,,,,,,,,,,,
24K00349,国立研究開発法人国立長寿医療研究センター,斎藤 民,要介護者の幸福感向上モデル構築のための縦断的研究：関連要因とその社会的影響の解明,本研究では3年間の研究期間において、1）要介護者の幸福感（WB）の関連要因の同定、2）要介護者のWBが家族や介護職のWB、地域の医療介護費にもたらす影響の検証を行う。これらに基づき、3）SWB向上ケアモデルを考案し、実装戦略の検討を行う。分析は、愛知県内4市町の新規軽度要介護認定者全数約1500名への2年間の追跡調査等複数の調査データ、医療介護レセプトデータ、インタビューデータに基づき実施する。,基盤研究(B),小区分08020:社会福祉学関連,ウェルビーイング,幸福感,要介護者,縦断的研究,健康の社会モデル,,,,,,,,,,,,,,,,,,,,,,,,,,,,,,,,,,,,,,,,,,,,,,,,,,,
24K00348,立命館大学,岡田 まり,ソーシャルマーケティングによるスーパービジョンの普及,福祉分野におけるスーパービジョンは、福祉サービスの質および福祉専門職の資質の向上に役立つ。しかし、わが国の福祉現場ではスーパービジョンが定着していない。本研究では、ソーシャルマーケティングの手法を用いて、職場へのスーパービジョンの導入・定着のために重要な要因を把握し、それを踏まえて組織にスーパービジョンを導入するプロジェクトを実施し、その方法や結果を評価する。また、スーパーバイザーの研修プログラムの向上もめざし、スーパービジョン導入・定着のために講ずる方策を明らかにする。,基盤研究(B),小区分08020:社会福祉学関連,スーパビジョン,スーパーバイザー,ソーシャルワーカー,ソーシャルマーケティング,ソーシャルワーク,,,,,,,,,,,,,,,,,,,,,,,,,,,,,,,,,,,,,,,,,,,,,,,,,,,
24K00347,立命館大学,黒田 学,ウクライナ戦争・戦時下及び終結後の障害者の生活状況と周辺諸国による支援と課題,本研究は「ウクライナ戦争・戦時下及び終結後の障害者の生活状況と周辺諸国による支援と課題」を研究課題とし、ロシアによるウクライナ侵攻におけるウクライナ障害者の生活状況と周辺諸国：主にポーランドによる障害者支援について、現地調査に基づいて分析し、戦争がもたらす障害者への影響及び実情を明らかにすることを目的とする。,基盤研究(B),小区分08020:社会福祉学関連,ウクライナ戦争,障害者,避難民,社会福祉,特別ニーズ教育,,,,,,,,,,,,,,,,,,,,,,,,,,,,,,,,,,,,,,,,,,,,,,,,,,,
24K00346,日本福祉大学,山田 壮志郎,社会的貧困観の形成に向けた貧困教育プログラムの開発と効果検証,貧困の原因を個人に求める考え（個人的貧困観）から社会に求める考え（社会的貧困観）への＜旋回＞が経験されてから1世紀以上経った今日においても、社会的貧困観が人々の意識の間に根付いているとは言い難い。本研究では「どうすれば社会的貧困観を形成することができるか？」という問いを立て、社会的貧困観の形成を促すための方策を明らかにすることを目指す。米国ミズーリ州の体験型教育プログラムをモデルとして日本版貧困シミュレーションを開発するとともに、日本語版貧困観尺度を開発し、貧困シミュレーション参加者の貧困観の変化を分析することで、プログラムへの参加が貧困観の変化に及ぼす効果を検証する。,基盤研究(B),小区分08020:社会福祉学関連,貧困観,教育プログラム,尺度開発,,,,,,,,,,,,,,,,,,,,,,,,,,,,,,,,,,,,,,,,,,,,,,,,,,,,,
24K00345,武蔵野大学,永野 咲,ケアリーバー調査におけるデータ収集と評価システム構築のための開発的研究,本研究では、社会的要請に即応し、データの分析・調査・検証をConcurrent（同時並行的）に実施する。さらに、当事者の参画を得た共同研究により、実践・事業・制度に接続する日本版ケアリーバー調査を開発する。,基盤研究(B),小区分08020:社会福祉学関連,社会的養護,ケアリーバー,,,,,,,,,,,,,,,,,,,,,,,,,,,,,,,,,,,,,,,,,,,,,,,,,,,,,,
24K00344,武蔵野大学,木下 大生,医療と福祉の連携を基盤とした知的障害で認知症の人の支援モデルと研修制度の構築,海外、特にイギリス、アメリカ、オーストラリアでは、国の認知症対策の中に知的障害者も包含されており、認知症支援において、知的障害があることにより必要な配慮等が医学、福祉が融合した研究が進められている。,基盤研究(B),小区分08020:社会福祉学関連,知的障害者,認知症,医療と福祉の連携,研修制度,,,,,,,,,,,,,,,,,,,,,,,,,,,,,,,,,,,,,,,,,,,,,,,,,,,,
24K00343,国際医療福祉大学,橋本 和明,ネグレクトをする親の認知アセスメントツールの作成と支援方法についての研究,本研究では，1）児童相談所等の虐待対応の実践に役立つ認知アセスメントツールの開発，2）メタ認知トレーニングを活用した認知に問題を持つ親への支援プログラムの作成，を目的とする。,基盤研究(B),小区分08020:社会福祉学関連,児童虐待,ネグレクト,認知,保護者,注意,,,,,,,,,,,,,,,,,,,,,,,,,,,,,,,,,,,,,,,,,,,,,,,,,,,
24K00342,岡山県立大学,竹本 与志人,MCI（軽度認知障害）と診断された人のための包括的支援モデルの開発,本研究は5年計画で実施する（3部構成）。第1部では、当事者や家族の心理・社会的状況と受診の有無の関係についてベイジアンネットワークを用いて実証するとともに、質的調査を実施して研究の妥当性を高める。第2部では、医療機関等のヒアリングに加え、認知症専門医のいる医療機関において診断後支援を行う専門職（ソーシャルワーカーや看護師等）、地域包括支援センターの認知症地域支援推進員を対象に第1部で得られた受診の阻害要因への支援の状況について量的調査を行い、支援の実態と課題を明らかにする。第3部では、一連の研究成果をふまえて、MCIに特化した包括的支援モデルを開発する。,基盤研究(B),小区分08020:社会福祉学関連,軽度認知障害,包括的支援,ソーシャルワーク,診断後支援,,,,,,,,,,,,,,,,,,,,,,,,,,,,,,,,,,,,,,,,,,,,,,,,,,,,
24K00341,兵庫県立大学,筒井 孝子,介護現場の安全性向上のためのデータベースの開発と研修カリキュラムに関する研究,介護保険施設等での事故は、終末期を安寧に過ごしたい国民にとって大きな課題といえる。しかし、この介護事故に関しては、全国的を網羅した公的資料が整備されておらず、実態の把握や分析が検討できない状況にある。本研究では、全国の介護サービスの質が高い介護保険施設等から収集した事故とその防止や対応策に係る報告書を基に介護職員が簡易に利用できるデータベースを開発すると共に、この利用方法について検討を行う。,基盤研究(B),小区分08020:社会福祉学関連,介護事故,安全管理,データベース,プログラム開発,リスクマネジメント,,,,,,,,,,,,,,,,,,,,,,,,,,,,,,,,,,,,,,,,,,,,,,,,,,,
24K00340,東京都立大学,室田 信一,日本におけるコミュニティ・オーガナイジングの実装と理論,本研究は4つの研究班に分かれて研究を進める。第一に、理論研究班はCO研究全体の理論枠組みを提示する。第二に、国際比較研究班は海外の研究動向の調査と国際共同研究の推進を担当する。第三に、研修プログラム研究班は海外の調査を通して国内における研修プログラムを開発する。第4に、財源・評価研究班も海外の調査を通して国内における助成プログラムの枠組みを開発する。,基盤研究(B),小区分08020:社会福祉学関連,コミュニティ・オーガナイジング,,,,,,,,,,,,,,,,,,,,,,,,,,,,,,,,,,,,,,,,,,,,,,,,,,,,,,,
24K00339,滋賀大学,伊達 平和,アルコール依存症の治療ギャップ解消をめざす基礎的研究,アルコール依存症は多くの社会問題と関連が深く、社会的な解決が求められている一方、一般的医療機関の潜在的な患者の数に比して、依存症専門医療機関に繋がっている人はごくわずかであるという「治療ギャップ」が指摘されている。本研究では、依存症当事者、当事者の家族、そして医療福祉相談や退院支援を担当する医療ソーシャルワーカーそれぞれのアクターに対する量的調査・質的調査を通じて、専門医療機関への接続／未接続の原因を把握し、治療ギャップの解消に向けた政策提言や社会福祉実践への基盤となる知識を提供する。,基盤研究(B),小区分08020:社会福祉学関連,アルコール依存症,治療ギャップ,ソーシャルワーカー,当事者,自助グループ,,,,,,,,,,,,,,,,,,,,,,,,,,,,,,,,,,,,,,,,,,,,,,,,,,,
24K00338,千葉大学,佐々木 綾子,越境を日常としたトランスナショナルソーシャルワークの確立に向けて,本研究では、国民国家の枠組みで言語、文化を捉えること自体を批判的に捉え直し、移民難民の受け入れ国において議論されてきた「多文化ソーシャルワーク」とその送り出し国において議論されてきた「国際開発ソーシャルワーク」をつなぐものとして「トランスナショナルソーシャルワーク」を位置づける。そのうえで、「国際移動する人」を中心として構成される国境を越えたネットワークのなかにソーシャルワークの展開に必要な社会資源を見出し、その理論と実践の確立に必要な基礎条件を特定することを試みる。,基盤研究(B),小区分08020:社会福祉学関連,トランスナショナルソーシャルワーク,移民コミュニティ,国際移動する家族,アクションリサーチ,スリランカ,,,,,,,,,,,,,,,,,,,,,,,,,,,,,,,,,,,,,,,,,,,,,,,,,,,
24K00337,筑波大学,安梅 勅江,28年追跡調査による育児困難感推移特性別の虐待予防サポートの有効性に基づく支援開発,乳幼児期にどのような子育ち・子育て支援を提供すれば虐待予防を効果的に促進し、子どもへの好ましくない影響を最小限に留め、子どもの子育ち力、保護者の子育て力を最大限に発揮し、子どもの健やかな成長発達が保障できるのかを検討する。乳幼児期の保護者の抱える育児困難感、支援状況、子どもの発達状態などを複合的に加味し、影響要因の機序を明示可能な追跡研究を用いて「有効な子育て支援の根拠」を明らかにする。,基盤研究(B),小区分08020:社会福祉学関連,虐待予防,,,,,,,,,,,,,,,,,,,,,,,,,,,,,,,,,,,,,,,,,,,,,,,,,,,,,,,
25K00733,地方独立行政法人東京都健康長寿医療センター,涌井 智子,認知症介護の情緒的消耗の予防機序の解明およびCare quantificationの理論化,本研究は、団塊ジュニア世代の高齢化を見据え、多様化・個別化が進む家族介護に対応した新たな支援のあり方を検討するものである。家族介護者の「生活」に着目し、介護活動と日常生活（睡眠・活動量・情緒状態等）を定量化する「Care-quantification」を理論化、情緒的消耗の予防や行動変容を促す支援の構築を目指す。オンライン記録および活動量計を用いたデータから、従来支援に届かなかった介護者への有効性を検証し、地域包括ケアシステムにおける実装可能性を評価する。,基盤研究(B),小区分08020:社会福祉学関連,家族介護,情緒的消耗,Care quantification,理論化,うつ,,,,,,,,,,,,,,,,,,,,,,,,,,,,,,,,,,,,,,,,,,,,,,,,,,,
25K00732,国立保健医療科学院,森山 葉子,社会的ケア関連QOL測定尺度(代理記入式)の開発と地域包括ケアシステムの評価への応用,少子高齢化が進む中、高齢者を支える持続可能な体制を整備するため、地域包括ケアシステムの構築が推進されてきた。目標の達成度合いの評価が必要であり、これまで英国で開発されたケアや支援を受けてのQOL測定尺度：ASCOTの自記式日本版（我われチームで構築）を活用してきたが、重度の要介護や認知症で本人回答が難しい場合、家族介護者や介護職が代理回答することもあり、自治体調査では約半数が代理回答であった。そこで①英国のASCOT代理記入式の日本版を構築することと、②これを用いて、地域包括ケアシステムの評価指標としての活用可能性を検討することを目的に研究を実施する。,基盤研究(B),小区分08020:社会福祉学関連,社会的ケア関連QOL,代理回答尺度,地域包括ケアシステム,ロジックモデル,評価,,,,,,,,,,,,,,,,,,,,,,,,,,,,,,,,,,,,,,,,,,,,,,,,,,,
25K00731,高松大学,山口 明乙香,成人障害者向け日本版自己決定尺度と就労訓練における自己決定力向上プログラムの開発,本研究は、障害のある成人を対象とする日本版自己決定力尺度と自己決定力促進プログラムを組み合わせた就労系障害福祉サービス支援事業所の就労訓練場面で活用する自己決定力向上プログラムパッケージを開発する。障害者の「自分らしい」働き方や働く上で必要な合理的配慮の内容を決定していく上でも、自らの意志を基に自己決定できる力は重要な力である。本尺度とプログラムを開発で、障害者の豊かな職業自立の選択や職場定着、キャリア形成の課題解決など質の高い職業生活を実現することに直接的に貢献するものであり、障害者のキャリア発達の視点においても重要な研究課題である。,基盤研究(B),小区分08020:社会福祉学関連,日本版自己決定尺度,自己決定力,障害者,就労訓練,キャリア発達,,,,,,,,,,,,,,,,,,,,,,,,,,,,,,,,,,,,,,,,,,,,,,,,,,,
25K00730,武庫川女子大学,中尾 賀要子,LGBT高齢者の生と性を捉えるデータセットの作成：混合研究法による領域横断研究,本研究の目的は、性的マイノリティ（LGBT）高齢者における身体的・心理的・社会的ウェルビーイングの現状、ライフコース、歴史・文化的背景の特徴を把握し、LGBT高齢者の包括的理解と適切な対応を支援現場に促すデータセットを作成することである。我が国ではLGBT高齢者の老年期の実態や生活体験はもとより、性の多様性が病理化されたコーホートとしての人生経験など、適切な理解が浸透しているとは言い難い。「自分が自分であることの矜持と共に齢を重ねる－Age with Pride－」を促進する嚆矢としてデータセットを作成し、人生100年時代の「誰ひとり取り残さない」超高齢社会の発展に寄与したい。,基盤研究(B),小区分08020:社会福祉学関連,LGBT,高齢者,性,人生,マイノリティ,,,,,,,,,,,,,,,,,,,,,,,,,,,,,,,,,,,,,,,,,,,,,,,,,,,
25K00729,立命館大学,石田 賀奈子,ACEs（幼少期逆境体験）からの回復に寄与する意見表明等支援事業のあり方の検討,ACEsの高い子どもたちの健康リスクを低減することは、児童虐待によって生じる社会的損失の低減につながる。本研究では、A.意見表明等支援事業がACEsからの回復に寄与するために必要な要素、B.意見表明等支援事業のKPI指標、C.意見表明等支援事業が子どもの回復、自立に寄与するための専門職連携の在り方、の三つを明らかにする。そのために①意見表明等支援事業の利用者評価、②社会的養護の施設における子どもの意見表明権保障の実態把握を行う。また、現在の意見表明等支援では周縁化されているが、親権者の「親をする」権利の保障に向けた③社会的養護の施設における家族支援の実態把握を行う。,基盤研究(B),小区分08020:社会福祉学関連,児童家庭福祉,ソーシャルワーク,社会的養護,権利擁護,子どもの権利,,,,,,,,,,,,,,,,,,,,,,,,,,,,,,,,,,,,,,,,,,,,,,,,,,,
