awardnumber,organization,name,title,abstract,section,review_section,keyword1,keyword2,keyword3,keyword4,keyword5,keyword6,keyword7,keyword8,keyword9,keyword10,keyword11,keyword12,keyword13,keyword14,keyword15,keyword16,keyword17,keyword18,keyword19,keyword20,keyword21,keyword22,keyword23,keyword24,keyword25,keyword26,keyword27,keyword28,keyword29,keyword30,keyword31,keyword32,keyword33,keyword34,keyword35,keyword36,keyword37,keyword38,keyword39,keyword40,keyword41,keyword42,keyword43,keyword44,keyword45,keyword46,keyword47,keyword48,keyword49,keyword50,keyword51,keyword52,keyword53,keyword54,keyword55,keyword56
20H01606,大阪歯科大学,濱島 淑恵,地域を基盤とした「ヤングケアラーの発見・支援モデル」の検討,ヤングケアラーとは「家族のケア（介護，精神的支え，家事，きょうだいの世話等）を担う子ども」を指す。彼らは健康，学業，人間関係等に様々な困難を抱えるが，日本では発見・支援の方法が確立せず，専門的な支援がほとんど行われていない。そこで本研究では，ヤングケアラーの実態把握とともに，①ヤングケアラーの発見手法（「判断基準・指標」の改良等），②ヤングケアラーの支援方法（支援のメニュー，プログラム等），③ヤングケアラー発見・支援の多職種連携のあり方を検討する。さらにこれらを統括し，地域を基盤とした「ヤングケアラーの発見・支援モデル」として検討，提案する。,基盤研究(B),小区分08020:社会福祉学関連,ヤングケアラー,家族介護,当事者活動,地域福祉,高齢者福祉,若者ケアラー,イギリス,NPO,高校生,中学生,質問紙調査,ピアサポート,介護者支援,若者介護者,地域支援ネットワーク,,,,,,,,,,,,,,,,,,,,,,,,,,,,,,,,,,,,,,,,,
20H01605,立命館大学,松田 亮三,多様化する社会における福祉体制の動態―日韓台比較研究を通した理論開発,本研究は、日本・韓国・台湾という３か国での社会保障・社会政策が、世代構成、身心の機能上の障害などの個人の属性、雇用・就労の形態などの点で社会の多様化が進む中で、どのように変化しているかを整理し、それに関わる要因を検討し、新たな理論をつくることを目指します。その際、特に共通性と違いをどう理解するか、それをもたらす要因の影響を重視して、他分野で用いられている各種の手法を応用した図示を試みます。,基盤研究(B),小区分08020:社会福祉学関連,福祉体制,日台韓比較,理論開発,領域変化,グラフ表現,比較研究,体制変化,多様性,日本,台湾,韓国,国際比較,労使関係,因果論,レジリエンス,持続可能性,日中韓比較,,,,,,,,,,,,,,,,,,,,,,,,,,,,,,,,,,,,,,,
20H01604,立命館大学,丹波 史紀,原子力災害にともなう被災者の生活再建に関する調査研究,本研究は、2011年の東日本大震災および原子力災害から10年という節目に、原子力災害による被災者の生活再建に関する大規模調査を実施し、被災者の生活再建と地域の復興を評価することをねらいとしている。原発立地周辺自治体の住民を対象にした第３回目の大規模調査を実施する。,基盤研究(B),小区分08020:社会福祉学関連,災害,原子力災害,長期避難,国内避難民,双葉郡,生活再建,災害ケースマネージメント,被災者の生活再建,災害ケースマネジメント,複線型復興,東日本大震災,災害関連死,災害復興,復興政策,被災者調査,国内避難民（IDPs）,震災関連死,,,,,,,,,,,,,,,,,,,,,,,,,,,,,,,,,,,,,,,
20H01603,早稲田大学,辻内 琢也,原発事故被災者の移住・帰還・避難継続における新たな居住福祉に関する人間科学的研究,本研究は、「帰還か移住か避難継続か」の選択を迫られる原発事故被災者が、今後数年間,基盤研究(B),小区分08020:社会福祉学関連,原発事故,被災者,移住,居住福祉,人間科学,差別,国内避難民,PTSD,災害,,,,,,,,,,,,,,,,,,,,,,,,,,,,,,,,,,,,,,,,,,,,,,,
20H01600,東北福祉大学,大嶋 巌,福祉課題への変革プログラムに取組む実践家と組織の評価キャパシティ形成支援法の開発,本研究では、実践家と所属組織がECBを推進させ、より良い課題解決成果を納めることを支える中間支援組織の有効なコンサル支援方法を開発、その有効性を実証的に明らかにする。支援法開発プロセスは３フェーズで行う。第Ⅰフェーズでは、評価を活用した体系的なコンサル支援方法（暫定版）を開発する。第Ⅱフェーズでは、中間支援組織のコンサル支援を用いた１年間のECB試行評価調査を、変革PGに取組む各プログラム当り5～10事業所の参加を得て実施し有効性を検証する。第Ⅲフェーズでは、社会課題解決に有効な汎用性のある「評価を活用したコンサル支援法ガイドライン」を、試行評価調査結果に基づいて作成し、公表する。,基盤研究(B),小区分08020:社会福祉学関連,実践家参画型エンパワメント評価,形成的評価,評価キャパシティ形成,コンサルテーション支援,中間支援組織,,,,,,,,,,,,,,,,,,,,,,,,,,,,,,,,,,,,,,,,,,,,,,,,,,,
20H01598,津田塾大学,森川 美絵,地域包括ケアのアウトカムとしてのケア関連QOLの測定と応用に関する研究,地域包括ケアのアウトカムである「生活の質」（QOL）を測定し、それをエビデンスとしたケアマネジメント方法論の構築を目指す。4年の研究期間で、３つの課題に取り組む。第１は、高齢者等の社会的ケア関連QOLのデータ収集分析と、データのケアマネジメント（地域・組織・個人の各レベル）への活用方法のモデル化である。第２は、社会環境変化に対応したQOL尺度の新版（イラスト版、電子タブレット版等）の開発である。第３は、国際プロジェクトと連動した統合QOL尺度の日本語版開発である。,基盤研究(B),小区分08020:社会福祉学関連,QOL,ケア,アウトカム,尺度,評価,社会的ケア,ケアの質,QOL尺度,地域包括ケア,ケア関連QOL,,,,,,,,,,,,,,,,,,,,,,,,,,,,,,,,,,,,,,,,,,,,,,
20H01597,専修大学,小池 隆生,「生活最低限」の地域性と貧困の「農村的性格」を基礎にした貧困対策に関する調査研究,暮らしに必要な最低限の「地域性」を対象化し、講じられるべき貧困対策の効果的な実施に資する根拠を提示するために、生活様式と貧困をテーマとする数量的調査と、生活様式を踏まえた狭義の消費構造を把握する家計調査の二つを研究期間を通して実施する。,基盤研究(B),小区分08020:社会福祉学関連,暮らしの最低限,貧困,貧困の地域性,ナショナルミニマム,ローカルミニマム,農村,消費様式,生活様式,福祉意識,,,,,,,,,,,,,,,,,,,,,,,,,,,,,,,,,,,,,,,,,,,,,,,
20H01596,大阪市立大学,大西 次郎,非認知症高齢精神障害者の在宅生活を支える福祉と医療の連携モデル開発と有効性の検証,訪問介護・看護を受ける在宅高齢精神障害者が、地域移行支援の広がりから増えている。ただし、高齢精神障害者のうち統合失調症や老年期うつ病等を有する非認知症高齢精神障害者には、認知症者と比べて福祉サービスが届けられにくい一方で、生活の維持に医療が少なからず関与する。,基盤研究(B),小区分08020:社会福祉学関連,多職種連携,協働,認知症,精神障害,在宅,医療福祉,医療ソーシャルワーク,精神保健福祉,メンタルヘルスソーシャルワーク,ソーシャルワーク機能,専門職連携,オンライン,精神科ソーシャルワーク,司法,,,,,,,,,,,,,,,,,,,,,,,,,,,,,,,,,,,,,,,,,,
20H01595,広島大学,田淵 仁志,視覚障害者の社会参加を促す視覚リハビリテーション・マネージメント・パスの構築,視覚障害によるQOL低下の低減と社会的損失抑制のためには、医療・保健・福祉・教育・労働が連携したソーシャルケアが必須である。しかし現状は施設間の相互の連携が十分ではなく視覚障害者のソーシャルケアは離散的である。ロービジョン担当医が視覚障害者のパートナーとして関連各施設との情報連携・共有のコントローラー役を担い、スムーズなソーシャルケアの提供を実現する体制を整備するために、視覚障害者のソーシャルケアの体系を整理・モデル化して「視覚リハビリテーション・マネジメント・パス」とその運用体制の共通モデルを開発する。更に研究協力4地域で試行して、有用性と問題点を洗い出しモデルのブラッシュアップを行う。,基盤研究(B),小区分08020:社会福祉学関連,視覚障害者,ロービジョン,眼科,視覚,医療福祉連携,クリニカルパス,リハビリ,障害者福祉,リハビリテーション,インタビュー,,,,,,,,,,,,,,,,,,,,,,,,,,,,,,,,,,,,,,,,,,,,,,
20H01594,京都大学,高橋 由光,生活困窮者の健康・自立支援のためのビッグデータ基盤整備：健康格差是正をめざして,社会福祉の柱の一つである生活保護制度は健康で文化的な最低限度の生活を保障するとともに、自立を助長することを目的としている。「健康管理支援」と「医療費の適正化」の推進が重視されるが、健康格差を是正し自立を助長する、適切な健康・医療支援のための実践的なエビデンスは不足している。本研究では、ビッグデータ（全国や自治体レベルのレセプトや公的統計）を活用し、質問紙調査、ミックスドメソッドも用いる。生活保護受給者・生活困窮者の包括的健康状態を全国および自治体レベルで明らかにすること、患者および医療提供者の両側面からその関連要因を明らかにすることを目的とする。,基盤研究(B),小区分08020:社会福祉学関連,生活困窮者,医療ビッグデータ,健康格差,生活保護,リテラシー,ヘルスリテラシー,,,,,,,,,,,,,,,,,,,,,,,,,,,,,,,,,,,,,,,,,,,,,,,,,,
20H01593,横浜国立大学,相馬 直子,ケアをめぐる負の世代間連鎖：ジェンダー・世代・障がいの包摂的権利保障へ向けて,本研究は、ケアをめぐる負の世代間連鎖に関する実証研究を通じて、ジェンダー・世代・障がいの交差する暴力（虐待）の連鎖に関する構造的把握と、包摂的権利保障システムの構想を行うことを目的とする。,基盤研究(B),小区分08020:社会福祉学関連,ケア,世代間連鎖,ケアリングデモクラシー,包摂的権利保障,ダブルケア,ジェンダー,権利擁護,社会政策,,,,,,,,,,,,,,,,,,,,,,,,,,,,,,,,,,,,,,,,,,,,,,,,
20H01592,筑波大学,小澤 温,障害者ケアマネジメントのプロセスとアウトカムに基づいた総合的評価法の開発,障害者総合支援法では、障害福祉サービスの利用の際に、サービス等利用計画書の作成が必須となったため、これを作成しケアマネジメントプロセスに基づいた支援を行う相談支援事業者（相談支援専門員）の養成が求められてきている。このことを踏まえて本研究では、都道府県・市町村に策定が義務づけられている障害福祉計画の評価指標としてあげられている地域移行の評価指標（入所障害者支援施設からの地域移行、移行後の地域での安定的な生活継続）に、ケアマネジメントがどの程度有効であるのかを検証し、障害者ケアマネジメントのプロセス評価とアウトカム評価とを統合した評価法を確立することを目的とした。,基盤研究(B),小区分08020:社会福祉学関連,地域移行,地域定着,ケアマネジメント,プロセス,アウトカム,プロセス評価,アウトカム評価,社会的ケア関連QOL,障害者,,,,,,,,,,,,,,,,,,,,,,,,,,,,,,,,,,,,,,,,,,,,,,,
23K20663,国立保健医療科学院,森山 葉子,40・50代介護者の介護・育児・仕事における幸福感アップ総合支援プログラムの開発,これまで介護者支援と一括りに語られてきたが、介護者の年代や属性により、老老介護、ヤングケアラー、ビジネスケアラー、ダブルケア等との名称も見かけるようになったように、介護者の状況も必要な支援も多様化してきている。我われはこれまで、女性家族介護者の幸福感が低いことや、40代介護者の社会的ケア関連QOLが低いことを明らかにしてきた。本研究では、いわゆる現役世代の家族介護者に着目し、介護をしながら自身の生活も大切に充実させることを考えるプログラムを、現役世代に特有な状況として育児や仕事における支援も含め、ポジティブ心理学やその周辺領域の理論・手法を取り入れて作成し、評価することを目的としている。,基盤研究(B),小区分08020:社会福祉学関連,介護者支援プログラム,介護者のWell-being,ポジティブ心理学,従業員幸福感,育児支援,介護者のWell-being（幸福感、QOL）,介護者の幸福感・QOL,育児,現役世代介護者,,,,,,,,,,,,,,,,,,,,,,,,,,,,,,,,,,,,,,,,,,,,,,,
23K20662,熊本学園大学,仁科 伸子,人口減少社会における社会的企業による雇用とエンパワメントに関する社会福祉学的研究,高齢化の進展や人口減少を背景として、新たな社会の担い手やシステムを開発し、持続可能な社会福祉システムを構築することが求められている。本研究は、この課題に社会福祉学の観点からアプローチするものである。生活困窮者やディスパワメントの状態にある人など市場や社会から排除されている人々を社会的企業が雇用することによって社会包摂していく仕組み、組織、制度的支援について研究する。①日本の現状を調査し、②欧米、韓国などの先進地域において方法論及び制度に関する研究を実施し、③中山間地域の村において就労による高齢者のエンパワメントについてアクションリサーチを実施する。,基盤研究(B),小区分08020:社会福祉学関連,就労,エンパワメント,福祉国家,サスティナビリティ,社会的連帯経済,社会的企業,社会包摂,ポスト福祉国家,社会連帯経済,スペイン,アメリカ,コミュニティ,移民,就労支援,労働福祉,Welfare to Work,持続可能な社会,社会福祉制度,雇用,労働統合型,ソーシャルインクルージョン,,,,,,,,,,,,,,,,,,,,,,,,,,,,,,,,,,,
23K20661,日本福祉大学,藤原 正範,刑事裁判の弁護活動へのソーシャルワーク専門職の関与のあり方に関する総合的研究,罪を犯して刑事司法手続に入ることを余儀なくされた人の相当数には福祉ニーズが存在する。これが公的に認知されず、また認知されても適切な支援が得られず、その結果犯罪を繰り返す人も多い。軽微な犯罪で検挙され累犯者であるため刑務所に辿り着く障害者、高齢者は増加傾向にある。,基盤研究(B),小区分08020:社会福祉学関連,司法ソーシャルワーク,刑事裁判,刑事弁護,更生支援計画,福祉ニーズのある被告人,立ち直り支援,環境調整,情状証言,更生支援,福祉のニーズのある被疑者・被告人,再犯防止,刑事司法手続,福祉ニーズのある被疑者・被告人,,,,,,,,,,,,,,,,,,,,,,,,,,,,,,,,,,,,,,,,,,,
23K20660,早稲田大学,古山 周太郎,災害時要援護者が参画する包摂型地域防災プログラムの構築に関する基礎的研究,本研究は、要援護者を包摂する地域共生社会の実現にむけ、地域社会の理解向上を基盤とした要援護者が参画する地域防災プログラムを構築し、その意義を考察することを目的とする。そのため、まず災害時の実際の支援活動において、要援護者のニーズを整理体系化し、地域社会が関わる支援方法と役割を明確化する。続いて、地域社会の理解と要援護者の自助力を高める防災教育プログラムを構築する。次に、要援護者が参画する包摂型の地域防災プロジェクトを対象に、要援護者の参画手法や支援活動の実態を把握し、住民意識や要援護者本人の力に及ぼす影響を明らかにすることで、包摂型の地域防災プログラムを構築する。,基盤研究(B),小区分08020:社会福祉学関連,災害時要援護者,インクルーシブ防災,地域防災組織,防災教育,インドネシア中部ジャワ州,地域防災教育,自立支援協議会,地域共生社会,当事者参画,,,,,,,,,,,,,,,,,,,,,,,,,,,,,,,,,,,,,,,,,,,,,,,
23K20659,立教大学,菅沼 隆,イノベーティブ福祉国家としてのデンマークー福祉国家の持続可能性の制度的基盤の研究,イノベーション政策にかかわる政府機関（経済産業省、科学技術イノベーション省、租税省、産業推進機構、教育省所管職業訓練委員会）への聞き取り調査、デンマークのリーディングインダストリーの経営者・イノベーションクラスター・エンジェルファンドなどの責任者への聞き取り、主要な労働組合の幹部に対する聞取り調査を行ってきた。また、デンマーク統計庁の研究者からデンマーク統計の情報について説明を受けた。文献研究も別途行い、ナショナル・イノベーション・システムの理論的フレームワークを援用し、デンマーク・イノベーション・システムを分析した。これらの情報をもとに研究の目的を果たしていく。,基盤研究(B),小区分08020:社会福祉学関連,福祉国家,イノベーション,フレキシキュリティ,投資財団,社会的投資,産業財団,職業訓練,リスキリング,税制,環境,公共部門,デンマーク,学習経済,ナショナル・イノベーション・システム,ダイバーシティ,経済政策,財政,社会政策,,,,,,,,,,,,,,,,,,,,,,,,,,,,,,,,,,,,,,
23K20658,明治大学,小関 隆志,日本に住む外国人に対する金融包摂の方策,在留外国人が、日本で生活するうえで様々な金融サービス（銀行口座、貸付、送金、保険など）を利用する必要がありますが、その際にどのような障害があり、改善すべき点があるのかを明らかにするのが、本研究の目的です。,基盤研究(B),小区分08020:社会福祉学関連,金融排除,金融包摂,外国人,移民,母子世帯,家計改善支援,母子生活支援施設,在留外国人,医療保険,融資,フランス,,,,,,,,,,,,,,,,,,,,,,,,,,,,,,,,,,,,,,,,,,,,,
23K20657,順天堂大学,アウン ミョーニエン,"Digitally inclusive, healthy ageing communities (DIHAC): A cross-cultural study in Japan, Republic of Korea, Singapore and Thailand","1. Organizing regular, international transdisciplinary meetings every two months  and publishing the DIHAC cross-cultural meeting analysis reports in https://digital-ageing.com/surveys-and-blog/",基盤研究(B),小区分08020:社会福祉学関連,digital inclusion,healthy ageing,social innovation,empowerment,health promotion,e-health literacy,grey digital gaps,social inclusion,population ageing,Asia,cross-cultural exchange,global health,older people,Japan,Korea,Singapore,Thailand,mixed-method,culture,,,,,,,,,,,,,,,,,,,,,,,,,,,,,,,,,,,,,
23K20656,目白大学,青木 豊,社会的養護における養育環境測定法EQ（略号暫定）の開発とその妥当性の検討,継続課題のため、記入しない。,基盤研究(B),小区分08020:社会福祉学関連,継続課題のため、記入しない。,社会的養育,被虐待・ネグレクト乳幼児,環境,測定法,里親養育,施設養育,環境質問紙,虐待・ネグレクト,里親,乳児院・児童養護施設,社会的養護,質問紙,※社会的養護,乳幼児,児童養護施設,,,,,,,,,,,,,,,,,,,,,,,,,,,,,,,,,,,,,,,,
23K20655,国際医療福祉大学,白澤 政和,包括支援体制の構築に向けてのストレングスモデル・ソーシャルワークの展開方法,制度の狭間や縦割りの仕組みなどで相談が受けられない人や世帯を支援し、それらの支援を可能にする地域づくりを実施している相談支援包括化推進員がどのように相談支援とそれを支える地域づくりが進めていくべきかを明らかにすることにある。そのため。、相談機関が既にあり自ら相談に行くことができる利用者を支援するソーシャルワーカーの業務に比べて、追加される業務が存在するが、それらを明らかにし、その実施方法を示すことにある。その際に、相談支援包括化推進員は、支援する利用者や家族、連携する相談機関やそこでの職員、地域の団体や人々に対してストレングスをどのように理解し、活用しているのかを明らかすることにある。,基盤研究(B),小区分08020:社会福祉学関連,相談支援包括化推進員,包括的支援体制,相談支援,地域づくり,ストレングス,ケアマネジメント,コミュニティマネジメント,地域共生社会,地域包括支援体制,重層的支援体制整備事業,包括支援体制,ソーシャルワーク,重層的支援体制構築事業,,,,,,,,,,,,,,,,,,,,,,,,,,,,,,,,,,,,,,,,,,,
23K20654,新見公立大学,鄭 丞媛,Age Friendly Cities指標を用いた介護予防政策評価と社会実装研究,社会環境が人々の健康や生活に与える影響の重要性は「健康日本21（第2次）」や多くの研究で示されるなど関心が高まってきているが，それをどのように「政策」や「まちづくり」に応用するのかに関するエビデンスは十分に蓄積されておらず課題となっている．,基盤研究(B),小区分08020:社会福祉学関連,Age Friendly Cities,介護予防,実装研究,社会環境,健康格差,Age-Friendly Cities,,,,,,,,,,,,,,,,,,,,,,,,,,,,,,,,,,,,,,,,,,,,,,,,,,
23K20653,島根大学,杉崎 千洋,医療機関を起点とした生活課題をもつ人への地域連動型支援プログラムの開発研究,本研究の目的は、医学的要因だけでなく、社会的要因（貧困や社会的孤立など）によっても再入院しやすい心不全患者を対象にした地域連動型支援プログラムを開発することです。このプログラムは、心不全患者の貧困や社会的孤立を発見し、軽減することを通して、再入院の減少、その人らしい地域生活のできる限りの延長を目指すものです。,基盤研究(B),小区分08020:社会福祉学関連,心不全患者,再入院減少,その人らしい地域生活,地域連動型支援プログラム,病院・診療所起点,再入院の社会的要因,社会的処方,地域連動型支援プログラム開発,心不全,その人らしい地域生活のできる限りの延長,心不全患者の病いの経験,病院・診療所,病いの経験,心不全の経験,再入院,社会的要因,,,,,,,,,,,,,,,,,,,,,,,,,,,,,,,,,,,,,,,,
21H00800,神戸学院大学,西垣 千春,若者の不安定就労の長期的影響および原因分析に基づく困窮予防対策に関する研究,若者の不安定就労の原因と長期的影響を明らかにし、生活困窮に陥らないための対策を考案する。,基盤研究(B),小区分08020:社会福祉学関連,若者,生活困窮,不安定就労,困窮予防,相談窓口,長期的影響,精神状態,非正規就労,コロナ,生活保護,,,,,,,,,,,,,,,,,,,,,,,,,,,,,,,,,,,,,,,,,,,,,,
21H00790,筑波大学,安梅 勅江,25年追跡調査による育児困難感別効果的な虐待予防および悪化防止支援の検証と実装,乳幼児期の虐待など不適切な養育の社会問題化にともない、青年期におよぶ成長発達への,基盤研究(B),小区分08020:社会福祉学関連,虐待予防,コホート研究,支援,家庭環境,子育て支援,,,,,,,,,,,,,,,,,,,,,,,,,,,,,,,,,,,,,,,,,,,,,,,,,,,
