awardnumber,organization,name,title,abstract,section,review_section,keyword1,keyword2,keyword3,keyword4,keyword5,keyword6,keyword7,keyword8,keyword9,keyword10,keyword11,keyword12,keyword13,keyword14,keyword15,keyword16,keyword17,keyword18,keyword19,keyword20,keyword21,keyword22,keyword23,keyword24,keyword25,keyword26,keyword27,keyword28,keyword29,keyword30,keyword31,keyword32,keyword33,keyword34,keyword35,keyword36,keyword37,keyword38,keyword39,keyword40,keyword41,keyword42,keyword43,keyword44,keyword45,keyword46,keyword47,keyword48,keyword49,keyword50,keyword51,keyword52,keyword53,keyword54,keyword55,keyword56
19H01600,日本福祉大学,野尻 紀恵,子どもの貧困を支援するスクールソーシャルワークの介入プログラム構築とその評価,本研究では、スクールソーシャルワーク実践事業の中でも、子どもの貧困の課題の軽減に向けたスクールソーシャルワーク実践活動に着目し、子どもの貧困への支援方法を調査する質問紙調査データ、スクールソーシャルワーカーへのグループインタビュー調査、スクールソーシャルワーカー養成担当教員へのインタビュー調査のデータを統合し、子どもの貧困への支援手順書のモデルを構築する。,基盤研究(B),小区分08020:社会福祉学関連,スクールソーシャルワーク,子どもの貧困,介入プログラム,多職種連携,プログラム評価,スクールソーシャルソーシャルワーク,評価,,,,,,,,,,,,,,,,,,,,,,,,,,,,,,,,,,,,,,,,,,,,,,,,,
19H01599,日本福祉大学,平野 隆之,自治体地域福祉行政の形成過程における権利擁護支援の選択・強化の方法に関する研究,本研究のテーマは、「自治体地域福祉行政の形成過程における権利擁護支援の選択・強化の方法に関する研究」である。生活困窮者自立支援法（改正）や成年後見利用促進法が厚生労働省社会・援護局地域福祉課によって推進される政策環境のもとで、それらの制度運用に当たる自治体福祉行政が、地域福祉行政として権利擁護支援を選択し、強化策に取組む実態を把握し、「地域福祉行政の形成」と「権利擁護支援の体制整備」との相互作用の効果を得る方法に焦点化して明らかにする実証的な研究である。最終的な成果としては、両者の関連性をめぐる相互作用モデルを抽出し、権利擁護支援の促進計画の策定に資する実践研究を目指す。,基盤研究(B),小区分08020:社会福祉学関連,地域福祉行政,権利擁護支援,重層的支援体制整備事業,成年後見制度利用促進基本計画,参加支援事業,A+B+C重層モデル,評価的思考,権利擁護行政,権利擁護センター運営,意思決定支援,地域福祉計画,成年後見制度利用促進計画,権利擁護政策,都道府県,権利擁護センター,計画の進行管理,日常生活自立支援事業,相互作用モデル,福祉研究と法学研究の融合,,,,,,,,,,,,,,,,,,,,,,,,,,,,,,,,,,,,,
19H01598,愛知学院大学,辰巳 寛,双方向性意思伝達支援アプリを応用した革新的コミュニケーション支援システムの開発,重篤な発語困難を呈する居宅療養者の在宅医療においては，緊密な多職種間の機能的連携が保たれた包括的ケア（リハビリテーション含む）が重要である．その実現のためには，技術革新が著しい情報通信技術（ICT）の活用が鍵となる．,基盤研究(B),小区分08020:社会福祉学関連,失語症,言語支援アプリケーション,機械学習,機能的MRI,発語障害,リハビリテーション,アプリケーション,脳機能画像評価,人工知能,,,,,,,,,,,,,,,,,,,,,,,,,,,,,,,,,,,,,,,,,,,,,,,
19H01597,明治学院大学,榊原 美樹,地域福祉計画の策定・実施・改定を促進する複合的評価システムの開発に関する研究,社会福祉法の改正により、市町村には地域福祉計画の策定とその評価が求められるようになっている。しかし既存の研究においては、地域福祉計画の特性を踏まえた評価理論の未形成、評価手法の応用性・実用性の未検証等の課題があり、実践上も評価体制未構築の市町村が半数強に上るなど多くの課題がある。,基盤研究(B),小区分08020:社会福祉学関連,地域福祉計画,評価システム,進行管理,プログラム評価,参加型評価,評価活動,重層的支援体制整備事業,包括的支援体制,,,,,,,,,,,,,,,,,,,,,,,,,,,,,,,,,,,,,,,,,,,,,,,,
19H01596,明治学院大学,北川 清一,児童養護施設実践のソーシャルワーク化に向けた支援環境の整備に関する研究,本研究の題材となる児童養護施設群を中核とする生活型児童福祉施設では、施設生活を余儀なくされた子どもの「荒み」にいかに対応するかの議論が深まらないまま、施設養護の過程に多様な実践課題が重層的に浮上している。,基盤研究(B),小区分08020:社会福祉学関連,ソーシャルワーク,家族ソーシャルワーク,施設養護論,社会福祉組織論,施設養護,スーパービジョン,人材育成,人材養成,実践組織の環境,ソーシャルワーク組織,職場内研究,ケース管理責任,生活型児童福祉施設,アセスメント,家庭支援,ソーシャルワーク実践,,,,,,,,,,,,,,,,,,,,,,,,,,,,,,,,,,,,,,,,
19H01595,法政大学,岩田 美香,児童福祉施設における青少年支援の再検討－遊び・スポーツ等を通した支援を中心に－,本研究は、児童福祉施設における青少年支援、とりわけ遊びやスポーツ、レクリエーションを通した支援の再検討を行うことを目的としている。,基盤研究(B),小区分08020:社会福祉学関連,青少年支援,児童福祉施設,レクリエーション,スポーツ,社会的養護,,,,,,,,,,,,,,,,,,,,,,,,,,,,,,,,,,,,,,,,,,,,,,,,,,,
19H01594,東洋大学,須田 木綿子,混合介護の導入による介護保険政策の転換と非営利事業者の「営利化」,混合介護の導入という政策の転換にあたり、申請者らが行ってきたパネル調査を活用する。,基盤研究(B),小区分08020:社会福祉学関連,介護保険,営利,非営利,ファイナンシャリゼーション,民営化,コロナ,介護保険制度,混合介護,コロナ化,チェーン化,人材,介護保険指定事業者,コロナ禍,倒産,管理主義,厚生労働省,市場化,入所施設,通所介護,訪問介護,退出パターン,社会福祉法人,NPO法人,ハイブリッド,,,,,,,,,,,,,,,,,,,,,,,,,,,,,,,,
19H01593,兵庫県立大学,筒井 孝子,介護技術評価に基づくOJT推進に向けた人材マネジメント手法の開発に関する研究,日本で展開されている介護キャリア段位制度のフレームワークを活用し、介護事業所を対象に介護技術評価とOJT実践に関わる継時的なデータを収集・分析し、職員の介護技術評価を基礎としたOJT実行マニュアルを作成する。また、評価に基づくOJTを継続的な介護サービスの質改善システムに位置づけるために、これを基盤とした人材マネジメントの在り方について検討し、実践的スキルの習得支援のための教育システムを開発する。,基盤研究(B),小区分08020:社会福祉学関連,OJT体制整備,キャリアアップ,OJTマニュアル,介護サービス,介護キャリア段位,自己評価,他者評価,介護技術評価,OJT,人材マネジメント,質保証,他者評 価,介護キャリア段位制度,OJTの体制整備,実行マニュアル,教育システム,,,,,,,,,,,,,,,,,,,,,,,,,,,,,,,,,,,,,,,,
19H01592,一般社団法人部落解放・人権研究所(調査・研究部),福原 宏幸,EUとその加盟国における多様な社会的包摂政策の展開とシティズンシップに関する研究,研究代表者とその分担者たちは2010年に「欧州福祉レジーム研究会」を立ち上げ、欧州の福祉レジーム、社会的排除／包摂、アクティベーション、そしてシティズンシップについて研究を進めてきた。その成果は、２冊の編著書としてとりまとめている。,基盤研究(B),小区分08020:社会福祉学関連,福祉レジーム,社会的包摂,シティズンシップ,アクティベーション,最低所得保障,EU,社会権,コロナ・パンデミック,社会的排除・包摂,移民・難民支援,社会的連帯経済,,,,,,,,,,,,,,,,,,,,,,,,,,,,,,,,,,,,,,,,,,,,,
19H01591,大阪市立大学,野村 恭代,施設コンフリクトの全国悉皆調査による実態経年比較分析とマネジメント手法の構築,本研究では、2010年度以降の障害者施設をめぐるコンフリクト発生実態を、全国調査を実施することにより究明する。そして、施設コンフリクト発生率の高い地域と低い地域の外部環境の差異、及び合意形成に至るプロセスを明らかにする。具体的には、精神障害者施設を取り上げ、施設コンフリクトの発生事由について、地域側の要因の関与を明らかにする。2010 年に申請者が実施した2000年から2010年までの10年間における施設コンフリクトの実態調査結果との比較検証を行うことにより、直近10年間の動向について分析し、コンフリクト・マネジメント手法の可能性と仲介者の属性や資質、期待される具体的な機能等について解明する。,基盤研究(B),小区分08020:社会福祉学関連,施設コンフリクト,コンフリクト,コンフリクト・マネジメント,合意形成,信頼,障害者施設,リスクコミュニケーション,コミュニケーション手法,経年比較,仲介者,精神障害者施設,リスクマネジメント,世界調査,国民意識,コンフリクト・マネジメント手法,合意形成プロセス,マネジメント手法,地域福祉,,,,,,,,,,,,,,,,,,,,,,,,,,,,,,,,,,,,,,
19H01590,首都大学東京,和気 純子,多文化共生ケアシステムにおけるグローカル・ソーシャルワークの理論的・実証的研究,本研究は、多文化共生の視点からグローカル・ソーシャルワークの実践方法を開発することを目的とする。とりわけ日本において懸念される深刻な介護人材不足を背景に、外国人介護士の本格的な導入が予定されている現状をふまえ、日本における多文化共生ケアシステムの構築に求められるグローカル・ソーシャルワークのあり方を理論的、実証的に検討する。そのために(1)グローカル・ソーシャルワークおよび多文化共生ケアシステムに関する理論的研究、(2)多文化共生ケアシステムの実態分析、(3)多文化共生ケアシステム構築にむけた専門職教育プログラムの開発と評価研究、の３つの課題を設定し、3か年にわたって取り組む。,基盤研究(B),小区分08020:社会福祉学関連,グローカル,ソーシャルワーク,多文化共生,外国人介護士,パンデミック,COVID-19,グローカル・ソーシャルワーク,国際ソーシャルワーク,新型コロナウィルス,地域共生ケア,専門職教育,,,,,,,,,,,,,,,,,,,,,,,,,,,,,,,,,,,,,,,,,,,,,
19H01589,首都大学東京,室田 信一,コミュニティ・オーガナイジングの理論と実践に関する基礎研究,本研究では理論研究を通して、①コミュニティ・オーガナイジング研究のための枠組みを示し、実証研究を通して、②日本国内におけるコミュニティ・オーガナイジングの実態を明らかにし、海外の養成プログラム調査を通して、③環太平洋圏域におけるコミュニティ・オーガナイジング養成の拡散と日本における養成プログラムのあり方を明らかにする。,基盤研究(B),小区分08020:社会福祉学関連,コミュニティ・オーガナイジング,,,,,,,,,,,,,,,,,,,,,,,,,,,,,,,,,,,,,,,,,,,,,,,,,,,,,,,
19H01588,大阪府立大学,隅田 好美,「社会参加」を促進する地域づくりの課題と主観的・客観的意義,本研究の目的は、健康・フレイル・要介護の全ステージにおける社会参加の意義と課題を多角的に解明することである。,基盤研究(B),小区分08020:社会福祉学関連,フレイル,オーラルフレイル,社会参加,口腔がん,身体機能,口腔機能,摂食嚥下機能障害,ソーシャルキャピタル,フィットネスクラブ,地域づくり,健康長寿,多職種連携,,,,,,,,,,,,,,,,,,,,,,,,,,,,,,,,,,,,,,,,,,,,
19H01587,静岡大学,石原 剛志,感化院・少年教護院における実践思想の系譜とその展開,児童自立支援施設は「不良行為をなし、又はなすおそれのある児童」等を対象に「自立を支援」すること等を目的とした施設である。この施設は、感化法にもとづく感化院に始まり、少年教護法にもとづく少年教護院、児童福祉法にもとづく教護院、児童福祉法第50次改正で児童自立支援施設へと名称等を変え、今日に至っている。,基盤研究(B),小区分08020:社会福祉学関連,感化院,少年教護院,精神医学,鑑別,コロニーシステム,児童の権利,児童保護員,ケースワーク,児童保護,東京府児童保護員,東京府鑑別委員会,北海道家庭学校,感化教育,教護,感化法,少年教護法,国立武蔵野学院,感化院・少年教護院,感化法・少年教護法,児童の権利思想,コロニー・システム,,,,,,,,,,,,,,,,,,,,,,,,,,,,,,,,,,,
19H01586,お茶の水女子大学,平岡 公一,社会福祉における評価レジーム再編の課題をめぐる理論的・実証的研究,日本の社会福祉において形成されてきた福祉サービス第三者評価制度を中心とする評価レジームは、諸外国には見られない特徴を持つものであるが、その再編が求められる状況にある。本研究では、この再編をめぐる課題に即して、評価レジーム形成の背景とその特質の理論的検討、諸外国の評価レジーム・評価制度の検討、都道府県・市区町村の各種評価制度の調査と分析、地域包括ケアシステムの評価制度の構築に向けての検討を行い、各種評価制度の改善策と評価レジームの再編の方向を示すことを目指す。,基盤研究(B),小区分08020:社会福祉学関連,社会福祉,評価レジーム,福祉サービス第三者評価,福祉計画,政策評価,,,,,,,,,,,,,,,,,,,,,,,,,,,,,,,,,,,,,,,,,,,,,,,,,,,
23K20169,武蔵野大学,渡辺 裕一,限界集落のコミュニティ・オーガナイジング実装と地域住民のエンパワメント評価研究,我が国の高齢化率は2065（令和47）年には38.4％に達すると推計されている。いわゆる「限界集落」では、様々なコミュニティ機能の低下から地域生活が継続できず、社会的に弱い立場の住民が地域生活から排除される可能性が高い。「限界集落」は将来のわが国の縮図である。地域住民自ら地域生活継続可能性を高める方策として地域住民のエンパワメントを検討した成果から、本研究では、①限界集落内で弱い立場に置かれている住民自ら、地域での生活継続を阻害する要因に向き合うコミュニティ・オーガナイジングの実践とその効果検証をすること、②限界集落におけるコミュニティ・オーガナイジングの実践モデルを検討することを目的とする。,基盤研究(B),小区分08020:社会福祉学関連,コミュニティ・オーガナイジング,限界集落,地域住民,エンパワメント,評価,実装,1on1,グループミーティング,関係構築・リーダーシップチーム構築,1対1,対話,,,,,,,,,,,,,,,,,,,,,,,,,,,,,,,,,,,,,,,,,,,,,
23K20168,日本女子大学,岩永 理恵,現代日本における貧困の検証：生活保護制度再考への示唆,本研究は、現代日本における貧困の実態を明らかにし、生活保護制度における最低生活保障に示唆を与えることを目的とする。具体的には、①最低限度の生活を担保した貧困線を導くこと、②所得だけではなく消費・資産状況も加味して金銭的貧困を捉え直すこと、③非金銭的な物質的剥奪の状況を観察すること、④生活保護受給者の状況に関する独自調査を実施し、貧困動態の分析をすること、以上4つの研究を行う。その意義は、日本における一元的な貧困測定を積み重ね、その分析を踏まえて多元的な貧困を明らかにすること、他方で、生活保護利用者という観点から貧困動態を調査して、生活保護制度における最低生活保障のあり方を検討することにある。,基盤研究(B),小区分08020:社会福祉学関連,貧困,生活保護,剥奪,公的統計,社会調査,貧困線,貧困測定,被保護者調査,貧困動態,剥奪指標,,,,,,,,,,,,,,,,,,,,,,,,,,,,,,,,,,,,,,,,,,,,,,
23K20167,東洋大学,森田 明美,10代親の主体的子育てを地域連携で支える継続的福祉支援モデルの日韓共同開発,これまでおこなってきた3期12年の調査研究で明確化した日本の10代親の特徴をふまえ、韓国や豪州などの先駆的な支援の方法論を学び、10代親への キャリア支援を含めた親自身の市民としての成長のための支援と、子育て支援の両輪支援のために、子育て世代包括支援センター、保育所、地 域子育て支援センターを中心に、医療・保健・福祉が連携した地域の継続的な福祉支援モデルを実践的に開発することを目的とする。これま で の科研で培った支援現場の実践家の協力を得ながら、10代親当事者の意見を聞くことをとおして有効な支援モデルを開発している,基盤研究(B),小区分08020:社会福祉学関連,１０代親,子育て,地域連携,福祉支援,日韓共同開発,子育て世代包括支援センター,国際比較,日韓比較,連携,妊娠,出産,10代親,日韓共同,開発,子育て支援,,,,,,,,,,,,,,,,,,,,,,,,,,,,,,,,,,,,,,,,,
20H01611,国立研究開発法人国立精神・神経医療研究センター,山口 創生,精神障害者就労支援における当事者視点の評価とサービス品質の自己管理システムの開発,精神障害当事者に対する就労サービスの質やアウトカム（例：就労率）には大きなばらつきがあります。これまで、私たちは就労サービスの品質管理の道具として、援助付き雇用フィデリティ尺度（モデルとなる実践をどの程度再現しているかを測るチェックリスト）を開発してきました。他方、フィデリティ尺度は当事者の視点はあまり反映されておらず、また第3者による評価を基本としていました。そこで、本研究は、①当事者と共同し、フィデリティ尺度における当事者視点の新項目の開発・検証に取り組みます。また、②フィデリティ尺度の他者（第3者）評価と自己評価の結果を比較し、自己評価についての信頼性の検証に取り組みます。,基盤研究(B),小区分08020:社会福祉学関連,就労支援,精神障害,フィデリティ,援助付き雇用,支援の質,障害者雇用,自己評価,当事者視点,モニタリングシステム,精神,精神障害者,IPS,,,,,,,,,,,,,,,,,,,,,,,,,,,,,,,,,,,,,,,,,,,,
20H01610,沖縄大学,山野 良一,基礎自治体における子どもの貧困対策の現状と課題に関する総合的研究,2019年子どもの貧困対策法の改正によって、基礎自治体には市町村計画を策定することが努力義務とされた。本研究では、先進的もしくは特徴的な実践を推進している全国の基礎自治体の施策や課題を整理し共通点などを定式化し、さらに都道府県における市町村支援の状況などを把握することで、基礎自治体において今後どのように施策を展開させていくべきかを検討していく。本研究は、研究代表者・分担者がそれまで関与してきた子どもの貧困調査、就学援助や給食制度、児童虐待、沖縄県における子どもの貧困対策などの領域における研究の蓄積を統合的に発展させることで、基礎自治体における包括的な施策の展開への寄与を試みるものである。,基盤研究(B),小区分08020:社会福祉学関連,貧困,自治体,専任職員,コロナ禍,社会福祉協議会,困難を抱える子どもや家族,地域福祉,困難を抱える子どもや子育て家族,子どもの貧困,自治体施策,民間団体との連携,社会的養護,市町村計画,子どもの貧困調査,基礎自治体,子どもの貧困対策計画,,,,,,,,,,,,,,,,,,,,,,,,,,,,,,,,,,,,,,,,
20H01609,熊本学園大学,堀 正嗣,障害児者の地域移行を志向する施設訪問アドボカシーの開発,長期に渡って施設生活を余儀なくされてきた障害児者の中には、管理された生活と社会的ネットワークからの隔絶、情報や経験の欠如、被虐待・権利侵害によるトラウマ等から、力を奪われ無為な生活を送っている人も少なくない。こうした人々は、自信や将来への希望を喪失し、施設入所の長期化や児童施設退所後も成人施設に移行する以外に選択肢のない状況に置かれている。本研究は、イギリスをモデルとした施設訪問アドボカシーと、当事者団体による地域移行支援の連携により、こうした状況を打破して利用者の権利擁護・エンパワメント・地域移行を一体的に支援する実践モデルを構築しようとするものである。,基盤研究(B),小区分08020:社会福祉学関連,アドボカシー,権利擁護,障害児者福祉,地域移行,入所施設,自立生活,障害児施設,アクションリサーチ,施設訪問アドボカシー,地域移行支援,障害者施設,障害児者,自立生活センター,意見表明権,意思決定支援,,,,,,,,,,,,,,,,,,,,,,,,,,,,,,,,,,,,,,,,,
20H01608,岡山理科大学,川島 聡,障害者就労制度の日独英比較――法学と経済学の学際的アプローチ,従来、障害者就労制度に関する諸研究（国際比較によるものを含む）の中で、法学と経済学の学際的アプローチを用いたものは、ほとんどなかった。では、法学と経済学の学際的アプローチを用いた国際比較研究により、障害者権利条約を批准した日本の障害者就労制度の全体的構造及び課題はどのように見えるのであり、どのような政策的処方箋が描けるか。本研究はこの問いに答えることを目的とする。この目的を達成するため、本研究は、法学と経済学の学際的アプローチを用いた日独英の比較分析により、4年間で、一般就労と福祉就労の両方を視野に入れた障害者就労制度の諸論点について、新たな知見を明らかにする。,基盤研究(B),小区分08020:社会福祉学関連,経済学と法学との学際研究,一般就労と福祉的就労,障害者権利条約の実施,障害モデル（社会モデルと人権モデル）,就労継続支援A型事業所,新しい差別理論,国際比較,障害者雇用,差別禁止,福祉的就労,学際研究,障害者権利条約,障害者差別解消法,障害者虐待防止法,不当な差別的取扱い,合理的配慮,障害の概念,障害者就労制度,法学と経済学の学際的アプローチ,障害者就労,学際性（法学と経済学）,国際比較（日独英）,制度の隙間,障害者基本法,,,,,,,,,,,,,,,,,,,,,,,,,,,,,,,,
20H01607,神戸学院大学,佐野 光彦,バングラデシュの障がい児童・生徒への教育支援、福祉、弱者包摂に向けての総合的研究,本研究は、バングラデシュの最も弱い立場に追い込まれている障がい児童・生徒に焦点を当て、彼らの社会参加への阻害要因を明らかにすると同時に、問題改善に向けた実践の方向性について、今までの発展途上国研究で個別に行われてきた社会科学的調査研究（社会福祉）と、福祉工学研究との分野横断的なアプローチで考察する。そして、これにより国連のSDGs（持続可能な開発目標）の「質の高い教育をみんなに」を目指す。,基盤研究(B),小区分08020:社会福祉学関連,障がい児童・生徒,教育支援,福祉,バングラデシュ,弱者包摂,障がい児・生徒,,,,,,,,,,,,,,,,,,,,,,,,,,,,,,,,,,,,,,,,,,,,,,,,,,
