awardnumber,organization,name,title,abstract,section,review_section,keyword1,keyword2,keyword3,keyword4,keyword5,keyword6,keyword7,keyword8,keyword9,keyword10,keyword11,keyword12,keyword13,keyword14,keyword15,keyword16,keyword17,keyword18,keyword19,keyword20,keyword21,keyword22,keyword23,keyword24,keyword25,keyword26,keyword27,keyword28,keyword29,keyword30,keyword31,keyword32,keyword33,keyword34,keyword35,keyword36,keyword37,keyword38,keyword39,keyword40,keyword41,keyword42,keyword43,keyword44,keyword45,keyword46,keyword47,keyword48,keyword49,keyword50,keyword51,keyword52,keyword53,keyword54,keyword55,keyword56
22K13294,山口大学,井川 志郎,企業の国境を越える人権保護義務の研究～サプライチェーンの労働者を念頭に～,本研究は、グローバル・サプライチェーン（GSC）ないしグローバル・バリューチェーン（GVC）の諸過程で生じうる労働者の人権侵害（とくに児童労働、強制労働、団結権侵害）の防止および是正につき、当該チェーンを形成・支配する中核企業に国家法上の義務を課すことが、解釈論上・立法論上望ましいかどうかおよび可能かどうかを検討し、かかる人権侵害問題の解決に貢献することを目的とする。換言すれば、GSCないしGVCにおける人権デューディリジェンスの労働法学的解明を目指す研究である。,若手研究,小区分05040:社会法学関連,人権デューディリジェンス,サプライチェーン,LkSG,グローバル・サプライチェーン,児童労働,強制労働,団結権,,,,,,,,,,,,,,,,,,,,,,,,,,,,,,,,,,,,,,,,,,,,,,,,,
23K12380,成蹊大学,宍戸 聖,デジタルプラットフォームによる「自己優遇」と競争法,独禁法2条5項の「排除」の外延を探るために、DPFが操業する市場に固有の種々の特性によって初めて排除効果を持つこととなる排除の代表例である「自己優遇」に焦点をあてて、違法な自己優遇となりうる行為の類型や、行為の不当性評価のあり方を明らかにする。,若手研究,小区分05040:社会法学関連,デジタルプラットフォーム,自己優遇,独占禁止法,競争政策,,,,,,,,,,,,,,,,,,,,,,,,,,,,,,,,,,,,,,,,,,,,,,,,,,,,
24K16262,広島大学,稲谷 信行,妊産婦等に関する解雇の特別規制の再検討,本研究は、ドイツ法を参照することにより、妊産婦等に関する解雇の特別規制のあり方について考察を行うものである。妊産婦等に関する解雇の特別規制としては、労基法19条や均等法9条、育介法10条等が存在する。しかし、均等法9条に関する裁判例をみると、その独自の意義が乏しいものとなっており、必ずしも適切な規制とはなっていない。近年、妊産婦等に対する解雇事案が増加していることからすれば、より適切な解雇規制の方法を模索する必要がある。そこで本研究は、ドイツ法における妊産婦等に関する解雇規制について、判例や学説の議論等を参照し、その全体像を明らかにすることにより、より実効的な特別規制のあり方を明らかにする。,若手研究,小区分05040:社会法学関連,解雇規制,妊産婦等の保護,母性保護法,男女雇用機会均等法,育児介護休業法,,,,,,,,,,,,,,,,,,,,,,,,,,,,,,,,,,,,,,,,,,,,,,,,,,,
24K16261,京都大学,CHENG Shin・Ru,Proactive Ex Ante Digital Platform Regulations and the Concept of “Fairness”,"To enhance competitiveness and reduce consumer harm in digital markets, Japan implemented the Act on Improving Transparency and Fairness of Digital Platforms in 2021. However, an undefined concept of “fairness” in the Act weakens the Act's effectiveness. A comparative legal study of ex ante digital regulations, supplemented by expert interviews with local scholars and practitioners around the globe, allows this research to clarify the meaning of “fairness” and propose guidelines to overcome related enforcement challenges.",若手研究,小区分05040:社会法学関連,market competition,digital market,ex ante regulation,fairness,,,,,,,,,,,,,,,,,,,,,,,,,,,,,,,,,,,,,,,,,,,,,,,,,,,,
24K16260,信州大学,弘中 章,雇用流動化社会を見据えた雇用保険制度と公務員退職手当制度の再編可能性,民間部門を念頭に「雇用保険」「退職金」の改革を通じて労働力の移動を促す政策が議論されているが、その議論は官民セクター間の労働力移動の局面にも及んでいく可能性がある。そして、官民間の労働力移動の増加に対応するには、雇用保険の適用を官民で統一することも一つの選択肢となる。そこで本研究は、「雇用保険制度」と、これに関連する「公務員退職手当制度」について、雇用法制全体における両制度の位置づけを分析するとともに、制度再編の条件を解明することを目指す。以上の知見は、公務を担う人材を民間労働者から確保することが課題となる中、その解決に適合する、官民を通じた雇用法制のあり方を議論するための一素材となるだろう。,若手研究,小区分05040:社会法学関連,雇用保険法,公務員退職手当法,公務員法と一般労働法の比較,雇用の流動化,公務を担う人材の確保,,,,,,,,,,,,,,,,,,,,,,,,,,,,,,,,,,,,,,,,,,,,,,,,,,,
25K16515,追手門学院大学,近藤 直人,デジタル時代の流通業者による商品等の推奨行為に対する競争法規制のあり方,流通業者による推奨行為は、サプライヤー間の競争を歪曲し消費者厚生を害するリスクがある。一方で、川上段階のサプライヤーは、流通業者による自社商品等の推奨を獲得するために相互に競争している。そして、川下段階の流通業者に様々な形で利潤を保証することで、自社商品等の推奨を獲得し競争を有利に進めようとするインセンティヴを有する。他方で、特に、デジタルプラットフォームを代表とする流通業者の巨人は、推奨行為を通じてサプライヤー間の競争を左右することで利潤を獲得することができる。本研究では、流通業者による推奨行為を消費者厚生の観点から制御するための規制基準を示すことを目的とする。,若手研究,小区分05040:社会法学関連,流通業者の推奨行為,競争法,法と経済学,垂直的制限,優越的地位の濫用,,,,,,,,,,,,,,,,,,,,,,,,,,,,,,,,,,,,,,,,,,,,,,,,,,,
25K16514,早稲田大学,西田 玲子,健康上の問題を抱える労働者と合意解約規制,労働者と使用者双方の合意により将来にわたり労働契約を解消する「合意解約」において、労働者による自由な意思決定を保障するためには、一定の条件整備が必要となる。精神疾患等で健康上の問題を抱える労働者が増加する中、(1)健康上の問題を抱える労働者の権利（自由意思に反する退職に強制的に合意させられることのない権利）が、現在の法状況の下で、どこまで保護されるかを明らかにするとともに、その問題点も指摘し、(2)労働者の退職に関する自由な意思決定を保障し、建設的な合意解約に向けて、どのような規制が必要かについて理論的検討を行う。,若手研究,小区分05040:社会法学関連,合意解約規制,,,,,,,,,,,,,,,,,,,,,,,,,,,,,,,,,,,,,,,,,,,,,,,,,,,,,,,
25K16513,岩手大学,西畑 佳奈,人権侵害に関する企業責任のあり方―イギリス現代奴隷法の展開を題材に,本研究は、比較的早期に立法を成し遂げたイギリス法（現代奴隷法）に焦点をあてる。人権デューデリジェンス立法は、人権侵害に係る責任を企業に負わせるものであることから、人権デューデリジェンス立法の正当化根拠および現代奴隷法の射程の解明を通じて、これはどのような根拠により正当化されるのか、また、企業が守らなければならない人権としてどの程度・範囲が対象となるのか、企業がデューデリジェンスを果たさない場合、行政機関はいかなる制裁を加えるのかを明らかにする。,若手研究,小区分05040:社会法学関連,人権デューデリジェンス,現代奴隷法,,,,,,,,,,,,,,,,,,,,,,,,,,,,,,,,,,,,,,,,,,,,,,,,,,,,,,
