awardnumber,organization,name,title,abstract,section,review_section,keyword1,keyword2,keyword3,keyword4,keyword5,keyword6,keyword7,keyword8,keyword9,keyword10,keyword11,keyword12,keyword13,keyword14,keyword15,keyword16,keyword17,keyword18,keyword19,keyword20,keyword21,keyword22,keyword23,keyword24,keyword25,keyword26,keyword27,keyword28,keyword29,keyword30,keyword31,keyword32,keyword33,keyword34,keyword35,keyword36,keyword37,keyword38,keyword39,keyword40,keyword41,keyword42,keyword43,keyword44,keyword45,keyword46,keyword47,keyword48,keyword49,keyword50,keyword51,keyword52,keyword53,keyword54,keyword55,keyword56
18K12654,立教大学,早川 雄一郎,消費者保護における競争法の役割,企業の戦略的行動における具体的な文脈に即して、どのような消費者利益がどのような態様で侵害される場合に、競争法による介入が求められるのかについての検討を行った。近時、データの利活用によってますます洗練されつつあるロイヤルティースキームについて、どのような場合に独禁法や景表法による介入が求められるのかを提示した。また、無料サービスに対する景表法上の規制のあり方に関する提言を行った。,若手研究,小区分05040:社会法学関連,景品表示法,独占禁止法,消費者保護,ロイヤルティースキーム,無料サービス,不当表示,FTC,ACCC,競争法,広告規制,不公正取引,欺瞞的行為,忠誠リベート,セット割引,個人情報,景表法,,,,,,,,,,,,,,,,,,,,,,,,,,,,,,,,,,,,,,,,
18K12653,北九州市立大学,石田 信平,労働契約規制の新たな理念と労働契約概念の再構成に関する比較法研究,本研究は、イギリス労働契約規制の適用対象の基礎的理念、歴史的発展経緯について検討を加えるものであり、次の点を明らかにした。第一に、employeesとworkersの二重の適用対象概念が歴史的に形成され、その置かれた時代背景を反映しながら複雑に発展してきたこと、である。第二に、employeesは時代によって異なるものの、救貧法や主従法の適用範囲と関わりがあり、関係の継続性が重視されたのに対して、workersの概念は本人による就労、就労の非代替性が重視されてきたこと、である。,若手研究,小区分05040:社会法学関連,労働者概念,worker概念,労働契約,クラウドワーク,イギリス労働法,worker,employee,イギリス法,使用者概念,Workers,心理的従属性,潜在能力アプローチ,イギリス,Worker,労働法の理念,,,,,,,,,,,,,,,,,,,,,,,,,,,,,,,,,,,,,,,,,
18K12652,大分大学,小山 敬晴,国による労働法規制と労使自治との関係の研究,本研究は、フランス労働法における、国の立法による介入と、労使自治の範囲との関係性を分析するために、フランスの2016・2017年労働法改革を分析した。この労働法改革が、他のヨーロッパ諸国での労働法改革の流れの一連であり、企業競争力強化を目的として、労働法規制の柔軟化と手続化を進めるものであり、このことから、交渉者たる労働組合の代表性の果たす役割がいっそう大きくなることを明らかにした。,若手研究,小区分05040:社会法学関連,フランス労働法,労働組合の代表性,公序,労使自治,団体交渉,労使関係,労働組合,労働法,,,,,,,,,,,,,,,,,,,,,,,,,,,,,,,,,,,,,,,,,,,,,,,,
18K12651,山口大学,井川 志郎,労働者の国際移動の自由としての平等原理の可能性と限界～EU法を素材として～,本研究は、国際的に移動する働き手に対して法適用の面で保障すべき平等取扱いを、主にEU法や労働抵触法の観点から探求した。まずEUを素材として、経済統合が進むにつれて単に自由な労働力移動だけでなく公正な労働条件保障が問題となり、そのために規制を導入しようとすれば公正性を担保する基本的視点が問われることを示した。また、労働契約の準拠法決定の基準を、とりわけ平等取扱いの観点から明らかにした。,若手研究,小区分05040:社会法学関連,国際貿易・投資と労働法,経済統合と労働法,労働抵触法,労働契約準拠法,自営的就労,労働力移動,フェア・モビリティ,EU労働法,欧州労働局,ライフ・タイム契約,国際的経済活動の自由,労働時間,労働者の国際移動,自由移動,市場統合,経済統合,平等,,,,,,,,,,,,,,,,,,,,,,,,,,,,,,,,,,,,,,,
18K12650,京都大学,島田 裕子,平等法理の補完としての労働契約の内容規制,今年度は、昨年度に引き続き、ドイツ法の文献研究を中心に行った。とりわけ、労働契約の内容規制（AGBーKontrolle im Arbeitsrecht）について、2002年のドイツ債権法改正前後の考え方や裁判例の変化、学説の議論状況について調査・分析を行った。また、ドイツ労働法における一般的な平等法理（労働法上の平等取扱い原則、協約当事者に適用される平等原則、事業所当事者に適用される平等原則）に関する裁判例・学説について、昨年以降の動向について調査をするほか、特定の自由に基づく差別を禁止する個別法（一般平等取扱法（AGG)、パート有期労働法（TzBfG)についても、同様の調査を行った。その結果の一部は、既に拙稿「ドイツ労働法における三つの一般的な平等法理　使用者、協約当事者、事業所委員会の平等取扱義務の内容と変化」において公表済みであるが、ここで論じられなかった部分についても分析を深めた。,若手研究,小区分05040:社会法学関連,平等取扱原則,ドイツ労働法,内容規制,内容審査,平等取扱い原則,就業規則,平等取扱い,一般労働条件,ドイツ,約款規制,,,,,,,,,,,,,,,,,,,,,,,,,,,,,,,,,,,,,,,,,,,,,,
18K12649,名古屋大学,早津 裕貴,非典型公務労働従事者の法的地位に関する日独比較法研究,「非正規」公務員は、現行法上例外的な位置付けだが、現実には、公務員全体の約２割に達しており、例外的な勤務形態ではなくなっている。しかし、彼女ら・彼らは、一方では「公務員」であるにもかかわらず公務員法による保障を十分に享受せず、他方では「公務員」であるがゆえに労働法の適用からも排斥され、「法の狭間」に陥っている。これに対し、公務部門でも労働法が適用され、また公務員法による保障機能も発揮されているドイツ法では、同様の問題は生じない。本研究は、こういった非典型公務労働従事者の問題について、ドイツ法との比較研究を行い、新たな規制原理と解釈原理を探求するものである。,若手研究,小区分05040:社会法学関連,公務労働従事者,非典型雇用,日独比較法研究,,,,,,,,,,,,,,,,,,,,,,,,,,,,,,,,,,,,,,,,,,,,,,,,,,,,,
19K13533,佛教大学,嶋田 佳広,居住継続支援の法的基盤の検討－災害救助法制と社会保障の接合を目指して,我が国には「住宅（保障）法」という学問枠組みは存在しない。一方で、住宅・居住に関わる社会的状況は大きく変動している（空き家の増加、大規模災害による罹災など）。住宅自己責任原則を貫き続けることが今後の日本で果たして可能なのか、現在の法制度の問題点はどこにあるのか、といった理論的課題について、「居住継続支援」をキーワードに、ドイツなど海外の法制度や取り組みも視野に入れつつ、社会保障制度と災害救助法制を横断した視点から検討するのが本研究である。,若手研究,小区分05040:社会法学関連,社会保障,公的扶助,住宅,災害法制,生活保障,災害,住宅保障,生活保護,居住継続支援,,,,,,,,,,,,,,,,,,,,,,,,,,,,,,,,,,,,,,,,,,,,,,,
19K13532,京都女子大学,植村 新,デジタル化の進展と集団的労使関係法の変容－争議行為法理の基礎研究,本研究は、ICT（情報通信技術）やAI（人工知能）、ロボット等のデジタル技術が発達し、雇用社会が大きく変化することが見込まれるなかで、わが国の集団的労使関係法が今後どのように展開しうるのか、することが望ましいのかを探求することを目的とする。その第一歩として、本研究では、労務給付態様の変化によりその規整内容がダイレクトな影響を受ける争議行為法の分野に着目して、デジタル化によって生じうる争議行為法の変化と展開の可能性を考察する。,若手研究,小区分05040:社会法学関連,労働法,集団的労使関係法,争議行為法,ドイツ労働法,労働組合,争議行為,労働協約,同一労働同一賃金,非正規雇用,一般的拘束力,団体行動,ドイツ法,デジタル化,,,,,,,,,,,,,,,,,,,,,,,,,,,,,,,,,,,,,,,,,,,
19K13531,岡山大学,土岐 将仁,実効的な労働法規制を可能とするための労働法の名宛人に関する総合的研究,本研究は，労働契約上の使用者と一定の関係を有する第三者企業が，労働法の実効性を高めるため，使用者による労働法の履行にどのように関与すべきかを我が国の状況に即して具体的に明らかにしようとするものである。ドイツやアメリカにおける国内法に関する比較法的知見のみならず，国際労働関係における多国籍企業に対するソフトロー規範に関する議論も参照する。これにより，労働法規範の多層性を踏まえつつ，第三者企業に課されるべき具体的な義務や責任を明らかにする。,若手研究,小区分05040:社会法学関連,使用者,サプライチェーン,親会社,発注者,ソフトロー,中核的労働基準,プラットフォーム,ガイドライン,法人格否認の法理,ILO,プラットフォームワーカー,個人事業主,名宛人,実効性,労働法,,,,,,,,,,,,,,,,,,,,,,,,,,,,,,,,,,,,,,,,,
19K13530,大阪大学,地神 亮佑,アメリカ労災補償法制の基本理念－排他的救済主義の意義と射程,わが国において、労働災害を被った労働者が、労災保険でカバーされない損害を使用者に賠償請求することが増加している。他方で、アメリカにおいてはそのような使用者に対する民事訴訟ができない仕組みとなっている（排他的救済主義）。本研究では、そのような制度をとっている理由、それが正当化される根拠等を文献研究をもとに明らかにし、またそうした制度が労働者の救済に与える実際の影響について、現地行政機関等への聴き取り調査をもとに明らかにする。,若手研究,小区分05040:社会法学関連,労災補償,労災保険,アメリカ,労災保険法,アメリカ法,労災補償法,排他的救済主義,第三者災害,メリット制保険料率,,,,,,,,,,,,,,,,,,,,,,,,,,,,,,,,,,,,,,,,,,,,,,,
19K13529,信州大学,島村 暁代,高齢期の所得保障制度の設計に関する比較法的考察,我が国の高齢期の所得保障制度には公的年金制度や私的年金制度等があるが、現状ではそれぞれの制度が別々に議論・設計されており、全体を見通したグランドデザインが描かれていないとの問題が指摘されている。その結果として高齢者間の所得格差を適切には是正できず、現役時代の所得格差が一段と広がることや各制度の破綻を招きかねないことが懸念される。本研究は、これらの問題に対応し、持続可能な年金制度を確立するために雇用政策やその他の社会保障制度をも踏まえて他国の法制と比較することを通じて、高齢期の所得保障制度の設計に関する国家の役割を考察するものである。,若手研究,小区分05040:社会法学関連,公的年金,私的年金,高齢期の就労,定年制,定年延長,所得保障,高齢者,企業年金,労働契約,引退,高齢者雇用,,,,,,,,,,,,,,,,,,,,,,,,,,,,,,,,,,,,,,,,,,,,,
19K13528,横浜国立大学,石崎 由希子,治療と仕事の両立に向けた法理論―コミュニケーション促進規範に着目して,本研究は、治療と仕事の両立に向けた法理論を明らかにすることにより、要配慮労働者が自らの意思と能力を最大限活かすことを可能とする社会の実現に貢献することを目的とするものである。本研究では、傷病労働者に対する配慮は個別的で多様であるため、その確定に際しては、職場における労使間のコミュニケーションが重要であるとの認識を前提に、こうしたコミュニケーションを実質化するために必要となる法理論について、ドイツ法との比較法的検討を行う。その際、障害者雇用や労働安全衛生、ワークライフバランス関連法制にも目配りする点に本研究の特徴がある。また、本研究の成果は、事業者の行為規範の明確化にもつながることが期待される。,若手研究,小区分05040:社会法学関連,病気休職・復職,合理的配慮,柔軟な働き方,テレワーク,健康管理,キャリア権,不妊治療と仕事の両立,不妊治療,障害者雇用,就労困難者,就労支援,高齢者雇用,試し出勤,障害者の雇用・就労,治療と仕事の両立,休職,,,,,,,,,,,,,,,,,,,,,,,,,,,,,,,,,,,,,,,,
19K13527,東京大学,西田 玲子,アメリカの障害者雇用におけるアファーマティブ・アクションの手法と差別是正の効果,本研究では、アファーマティブ・アクション（AA）と差別禁止が相補的に機能する運用方法を探るため、差別禁止アプローチにより障害者雇用を進めてきたアメリカで、2014年オバマ政権下で導入されたAAに着目する。補助事業期間中、文献研究と実施調査の両方を予定している。具体的には、①アメリカの障害者雇用とそれ以外の分野におけるAA手法の異同、②「障害」の定義と法の対象範囲に関する日米の異同、③様々な職務や職階に就くといった実質的な機会平等をもたらすAAの可能性、の3つの枠組みで研究を進める。,若手研究,小区分05040:社会法学関連,アファーマティブ・アクション,積極的差別是正措置,障害者雇用,雇用率制度,雇用平等,差別禁止,合理的配慮,,,,,,,,,,,,,,,,,,,,,,,,,,,,,,,,,,,,,,,,,,,,,,,,,
20K13341,九州国際大学,阿部 理香,多様化する職業性リスクと労働者の健康・安全に関する日仏比較研究,労働者の健康状態が悪化し十分に労働義務を履行できない場合、病気休職措置が講じられるのが一般である。しかし、精神疾患の特性上、時として、事前に病気休職の手続きを経ることができず、突発的に「労働を中断」させざるを得ないことが起こり得る。これまでの研究は、使用者の安全配慮義務等の事後的な救済に関する議論が中心であり、労働者が「労働の中断」をすることによって事前にかつ主体的に危険を回避するための理論研究は十分にはなされてこなかった。本研究は、緊急避難としての性格を有する「労働の中断」における当事者の権利義務の帰趨について、フランスの議論をもとに検討を行おうとするものである。,若手研究,小区分05040:社会法学関連,労働法,労働安全衛生法,フランス,労働契約,健康,労働安全衛生,職業性リスク,予防,,,,,,,,,,,,,,,,,,,,,,,,,,,,,,,,,,,,,,,,,,,,,,,,
20K13340,早稲田大学,鈴木 俊晴,傷病労働者の適正処遇実現にむけた労使対話システムの構築,本研究では、「傷病に陥った労働者の意思を適切にくみ取りつつも、その傷病の状態および就業能力に応じた適正な処遇を実現できるような労使対話システムを構築することができないか？」という問いを設定し、その問いに対し一定の示唆を得るため、フランスにおける実証的調査を行う。フランスでは、傷病に陥った労働者の処遇決定の際に、労働組合以外にも多くの機関が介入することが制度化されており、それが結果的に労使対話を促進する機能も果たしている。そこで本研究では、これら機関にインタビュー調査を行い、関与の実態について詳細に明らかにするとともに、これら機関の働きが、どのように労使対話の促進に寄与しているのかを分析したい。,若手研究,小区分05040:社会法学関連,労働者の健康管理,傷病予防,コロナ禍,テレワーク,使用者の健康管理義務,労働者の傷病,社会経済委員会,労働医,安全衛生労働条件委員会,労使対話,,,,,,,,,,,,,,,,,,,,,,,,,,,,,,,,,,,,,,,,,,,,,,
20K13339,大阪市立大学,川村 行論,企業年金法制における間接関与者の義務・責任に関する日英比較法研究,公的年金を補完する役割が期待されている企業年金制度において、年金の原資となる資産の管理運用に関与する者は「受託者責任」と呼ばれる厳格な規律を受けている。しかし、間接的に関与する者(間接関与者)への規律が不十分となっており、年金資産の適切な管理運用を図ることに問題がある。これについて社会保障法学では十分に検討されていない。,若手研究,小区分05040:社会法学関連,企業年金,受託者責任,社会保障法,,,,,,,,,,,,,,,,,,,,,,,,,,,,,,,,,,,,,,,,,,,,,,,,,,,,,
20K13338,神奈川県立保健福祉大学,川久保 寛,高齢者への相談支援の法と実務　-ドイツを参照した実証論的研究-,本研究はドイツにおける相談支援の制度と実態に着目して、高齢者が必要とする支援の内容を明らかにし、複数のサービス主体が相互に協力し合って支える仕組みを明らかにする。近年動きがあるドイツの状況を明らかにしつつ、高齢者らがどのように支援されているか具体的に提示する本研究によって、日本における高齢者支援の法政策研究に参照すべき知見を構築する。,若手研究,小区分05040:社会法学関連,社会保障法,介護保険,ドイツ,社会福祉,相談援助,相談支援,高齢社会,高齢者,介護保険法,社会法学,地域包括ケア,,,,,,,,,,,,,,,,,,,,,,,,,,,,,,,,,,,,,,,,,,,,,
20K13337,埼玉大学,田平 恵,日・米・欧における非水平型企業結合の違法判断基準と立証水準の確立,第一に、日・米・欧州の非水平型企業結合事例を検討対象とし、個別事例における市場構造・取引慣行・商品の特性等、違法判断基準に必要な要素を抽出する（2020年度、2021年度）。第二に、日・米・欧州における先行研究およびガイドライン等を参照しながら、反競争効果発生のメカニズムを解明する（2022年度）。第三に、非水平型企業結合の違法判断基準および立証水準を提示する（2023年度）。,若手研究,小区分05040:社会法学関連,垂直型企業結合,混合型企業結合,市場閉鎖効果,協調的効果,違法判断基準,問題解消措置,司法省,連邦取引委員会,欧州委員会,公正取引委員会,非水平型企業結合,,,,,,,,,,,,,,,,,,,,,,,,,,,,,,,,,,,,,,,,,,,,,
21K13202,同志社大学,岡村 優希,労使自治の多元的性格と法規整,本研究は、EU法における労使自治の解明を行った上で、日本法に対する立法上・解釈上の示唆を得ることを目的とする。労使自治の機能低下が指摘されているが、本来的に、労使自治は多元的性格を有し、多様な機能を果たしうる。EU法を見ると、体系的な制度設計が採用され、組合の団体交渉による労働条件の決定に加えて、立法の制度設計を行う公的な機能や経営上の意思決定への関与を行う私的な機能が認められている。これによって雇用関係・労使関係の自治的な運営が行われ、労使の最適な利益調整が可能となっている。本研究では、EU法の研究を通じて労使自治の多元的性格を明らかにしつつ、その議論の日本法への応用可能性を検討する。,若手研究,小区分05040:社会法学関連,労使自治,EU労働法,自治的規範,経営関与,労働法規制,AIの社会実装と労働法,従業員代表,労働法規整,基本権規範,,,,,,,,,,,,,,,,,,,,,,,,,,,,,,,,,,,,,,,,,,,,,,,
21K13201,立教大学,早川 雄一郎,デジタル経済における広告規制法の課題に関する比較法研究,デジタル経済の進展によって、インターネット上で商品に関する情報を発信することが容易になり、広告規制法に関係する様々な課題が生じている。本研究では、先例の豊富な米国・FTC法や豪州法との比較法研究、並びに、景表法と景表法以外の様々な広告規制法の横断的研究を行うことで、日本の様々な広告規制法の立法上・解釈上の課題を解明し、デジタル経済における望ましい広告規制のあり方を示すことを目指す。,若手研究,小区分05040:社会法学関連,景品表示法,不当表示,ステルスマーケティング,顧客誘引手段性,連邦取引委員会,FTC,ACCC,広告規制,営利広告,,,,,,,,,,,,,,,,,,,,,,,,,,,,,,,,,,,,,,,,,,,,,,,
21K13200,岩手県立大学,徐 侖希,韓国の非正規労働者の雇用安定と処遇改善のための法制度の立法効果に関する考察,本研究では、日本の非正規労働者にかかわる法制度の裁判規範としての不明確性はその行為規範としての実効性にも負の影響を及ぼす可能性があるのではないか、さらには、法の裁判規範及び行為規範としての側面は並立の関係にあるわけではなく、多かれ少なかれ相互に関連し、これらの間には何らかの相互作用があるのではないかということを、日本より先に非正規労働者の雇用安定や処遇改善のための立法措置を講じた韓国の法制度の裁判規範及び行為規範の両側面から見た立法効果を素材に考察しようとする。,若手研究,小区分05040:社会法学関連,非正規,,,,,,,,,,,,,,,,,,,,,,,,,,,,,,,,,,,,,,,,,,,,,,,,,,,,,,,
21K13199,大阪経済法科大学,稲谷 信行,管理職労働者等の解雇規制に関する日独比較法研究,管理職や高度専門職等、企業の上位職層の労働者は、職務での裁量の程度や経営における重要性において、一般労働者とは異なる利益状況にあり、それゆえ労働法上もそのような利益状況に即した特別な規制を行う必要がある。しかし、解雇規制の領域では、解雇権濫用法理を中心とした現行の解雇法制がそのような上位職層労働者の利益状況に十分に適応できていない。雇用慣行の変化により、中途採用の管理職や高度専門職に関する解雇紛争が増加する中で、解雇規制のあり方を再検討する必要は大きくなっている。そこで本研究は、ドイツ法との比較研究を行い、上位職層の労働者について、どのような解雇規制がなされるべきかを明らかにする。,若手研究,小区分05040:社会法学関連,管理職労働者,管理職員,解雇規制,業務執行役員,解雇制限法,業務執行者,ドイツ労働法,母性保護法,損害賠償責任,,,,,,,,,,,,,,,,,,,,,,,,,,,,,,,,,,,,,,,,,,,,,,,
22K13295,帝京大学,藤木 貴史,「ビジネスと人権」のための集団的労働法制の基礎的研究,本研究は、「ビジネスと人権」の問題に対する集団的労働法規制について、理論的基礎を解明することを目的とする。集団的労働法は、労働組合をはじめとする様々なステークホルダーが、複数企業との団体交渉を行い、コンプライアンス状況をモニタリングする等の、個別企業に限定されない救済メカニズムを予定しているからである。そこで、①労働分野の「ビジネスと人権」に関するステークホルダーは誰か、それらのステークホルダーが「ビジネスと人権」問題の解決に果たす役割は何か、②個別企業を超えた人権侵害を防止し、適切な苦情処理を可能とするために、集団的労働法は、どのような規制を提供するべきか、という問題に取り組む。,若手研究,小区分05040:社会法学関連,労働基本権,日米比較,ビジネスと人権,第一修正,基本権,労働組合,集団的労働法,SDGs,団体行動権,言論の自由,,,,,,,,,,,,,,,,,,,,,,,,,,,,,,,,,,,,,,,,,,,,,,
