awardnumber,organization,name,title,abstract,section,review_section,keyword1,keyword2,keyword3,keyword4,keyword5,keyword6,keyword7,keyword8,keyword9,keyword10,keyword11,keyword12,keyword13,keyword14,keyword15,keyword16,keyword17,keyword18,keyword19,keyword20,keyword21,keyword22,keyword23,keyword24,keyword25,keyword26,keyword27,keyword28,keyword29,keyword30,keyword31,keyword32,keyword33,keyword34,keyword35,keyword36,keyword37,keyword38,keyword39,keyword40,keyword41,keyword42,keyword43,keyword44,keyword45,keyword46,keyword47,keyword48,keyword49,keyword50,keyword51,keyword52,keyword53,keyword54,keyword55,keyword56
23K17893,東京大学,山下 真一,窒素酸化物の還元によるアンモニア生成：“放射線の還元力”の活用,脱炭素社会に必要な水素キャリアや燃料そのものとして注目されるアンモニアを、放射線のエネルギーを活用して生産する。放射線照射でアンモニアが生成することは既に観察されているが，生成量は線量率，原料となる窒素酸化物の濃度，添加する有機物の濃度といった条件に左右され，不明な点が多い。素反応の速度定数を測定し，シミュレーションも併用して反応メカニズムを解明し，最適な条件を検討する。(1)短寿命ラジカルの反応の直接観測，(2)シミュレーション，(3)最終的なアンモニア生成量の測定，を実施する。放射性廃棄物（ゴミ）を資源として蘇らせる潜在性があり，ハーバー・ボッシュ法に代わる生産法の提案になり得る。,挑戦的研究(萌芽),中区分31:原子力工学、地球資源工学、エネルギー学およびその関連分野,放射線,ラジカル,アンモニア,NOx,パルスラジオリシス,スパー内反応,,,,,,,,,,,,,,,,,,,,,,,,,,,,,,,,,,,,,,,,,,,,,,,,,,
23K17892,東北大学,吉川 彰,超臨界地熱発電を拓く低コスト高耐食性合金の開発,我が国は豊富な地熱資源を有し、高い地熱発電のポテンシャルを有しているが、強酸性坑井におけるケーシングパイプ等の腐食の問題により、地熱資源の利用は制限されている。特に大深度の高温高圧環境における超臨界地熱発電を目指す上で、耐食性部材の開発が課題であった。本研究では、従来の研究を通じて見出されたRu系合金に注目し、高い耐食性と機械的強度、低コスト性を兼ね備える新規Ru系合金を開発することを目的とする。,挑戦的研究(萌芽),中区分31:原子力工学、地球資源工学、エネルギー学およびその関連分野,超臨界地熱発電,耐食性合金,,,,,,,,,,,,,,,,,,,,,,,,,,,,,,,,,,,,,,,,,,,,,,,,,,,,,,
23K17891,東北大学,桐島 陽,アンタッチャブルな製錬残渣からのスカンジウム抽出への挑戦,スカンジウム(Sc)は強度向上のためのアルミ合金への添加材等として重用されている。このScが希土類鉱石の製錬残渣のうち、トリウム(Th)を主成分とする残渣に多く含まれることに着目した。現在、Thを含む希土類鉱石の製錬残渣は資源国に大量に発生しているが、放射性物質を多く含むことから、世界中でアンタッチャブルな迷惑物とされ、多額の処分コストが発生している。ここから高価値なScを産出することができれば、非常に高い経済性を持つSc資源供給を実現することができる。そこで本研究では、いくつかのThやUを含む希土類鉱石の製錬残渣からScの単離に挑戦し、より単純で簡易な方法でのSc抽出法構築を目指す。,挑戦的研究(萌芽),中区分31:原子力工学、地球資源工学、エネルギー学およびその関連分野,スカンジウム,抽出法,化学挙動,沈殿分離,希土類残渣,トリウム,抽出分離,,,,,,,,,,,,,,,,,,,,,,,,,,,,,,,,,,,,,,,,,,,,,,,,,
24K21749,京都大学,中村 秀仁,高純度ポリエステルを核とした革新的な高速中性子計測系のプロトタイプ創生,"本研究では、ヘリウムの国際的な枯渇問題が放射線・原子力分野へ及ぼす深刻な影響を克服すべく、独自開発した高純度ポリエステルを核に中性子高速計測系のプロトタイプ創生に挑む。そのアプローチは、3Heガスを充填した計数管にあるような(n,p)反応による中性子吸収に基づく長時間(約100マイクロ秒)のシーケンシャルな内部ガス増幅と一線を画し、(n,α)反応により生じるα線を一旦外部抽出することで、現主力の同計数管より3桁速く中性子を弁別する、というもの。",挑戦的研究(萌芽),中区分31:原子力工学、地球資源工学、エネルギー学およびその関連分野,放射線,検出器,,,,,,,,,,,,,,,,,,,,,,,,,,,,,,,,,,,,,,,,,,,,,,,,,,,,,,
24K21748,京都大学,山村 朝雄,天然由来の標的α線療法用核種ラジウム224の製造と安全なキャリア構築,原子力委員会がTAT用放射性同位体（RI）製造の国産化を求めている。申請者は、核原料物質トリウムの子孫核種の中にあるラジウムRa-224を純国産TAT用RIとして着目し、この単離法を提案した。初段のミルキングで膨大な量のThの溶解と溶液を扱う既報を採用せず、着想しにくい酸化物のカラムとしての利用に材料化学的研究を適用する。また、金表面にTATの抗体分子を結合できるナノ粒子製造法を提案した。製品のRaの固定化のために金・ガリウム系化合物を利用するという材料化学的手法である。最後に、年間必要量に対し、Ra回収率100%であれば複合研所有のThの数倍で国内需要を供給できるとの評価結果を得ている。,挑戦的研究(萌芽),中区分31:原子力工学、地球資源工学、エネルギー学およびその関連分野,Ra-224,二酸化トリウム,ミルキング,金ナノ粒子,ラジウム担持合金,,,,,,,,,,,,,,,,,,,,,,,,,,,,,,,,,,,,,,,,,,,,,,,,,,,
24K21747,長岡技術科学大学,末松 久幸,K-Na-Clの格子欠陥をセンサーとしたエウロパ氷下の温度計開発,生命の存在が示唆されてきた木星の衛星エウロパの非氷成分同定と氷下の温度推定のため、木星磁気圏内の低温・放射線量バースト環境を模擬したK-Na-Cl結晶への低温パルス電子ビーム照射と点欠陥低温回復挙動測定を実施する。上記茶色が放射線によって発生したNaCl基結晶の点欠陥による色中心であるとの仮説に基づき、非氷成分のK濃度決定のために低温での吸収ピーク波長と、80-120Kでの回復挙動測定の地上実験を行う。我が国唯一のパルス電子ビーム照射が可能なETIGO-III加速器をバースト環境模擬実験に使用する。既知の状態図との比較によりエウロパ氷下の液体水中の温度推定データを提供する。,挑戦的研究(萌芽),中区分31:原子力工学、地球資源工学、エネルギー学およびその関連分野,エウロパ,電子線,,,,,,,,,,,,,,,,,,,,,,,,,,,,,,,,,,,,,,,,,,,,,,,,,,,,,,
24K21746,東北大学,黒澤 俊介,微細構造をもつ革新的発光体の開発と超高位置分解能放射線撮像への応用,空港の手荷物検査など、内部の可視化にはエックス線などが使われるが、これらのエックス線を検出するためには、エックス線で光る「発光体」で紫外線や可視光に変えて、光検出器で検出する。エックス線画像のハイレゾ化（空間分解能の向上）を目指すうえで、既存の発光体は粉体（不透明）等で改善点があった。そこで、膜状に合成できる方法による新しい形態や材料による発光体を開発する。,挑戦的研究(萌芽),中区分31:原子力工学、地球資源工学、エネルギー学およびその関連分野,薄膜,化学気相成長,蛍光体,シンチレータ,,,,,,,,,,,,,,,,,,,,,,,,,,,,,,,,,,,,,,,,,,,,,,,,,,,,
24K21745,岩手大学,鎌田 康寛,新マイクロサンプリング型電磁計測装置の開発と核融合炉ブランケット材の磁気物性調査,過酷中性子照射を受けた核融合炉ブランケット材の磁気物性の把握は、炉構造体に加わる衝撃的電磁力と直結するため、核融合炉の安全性の担保につながる重要な課題である。しかし、中性子照射実験の実施および放射化した照射材の磁気計測の難しさから、研究がほとんど行われていなかった。この問題に取り組むため、本研究では、ホットラボに保管中の中性子照射済試験片から集束イオンビームを用いて切り出した微小試料の電磁計測を可能とする、超音波共振現象を利用した新しい計測法を提案する。これまでの研究ノウハウと構築済の研究体制を効果的に活用して、計測装置の開発とブランケット材の照射損傷と磁気物性の関係の解明を試みる。,挑戦的研究(萌芽),中区分31:原子力工学、地球資源工学、エネルギー学およびその関連分野,磁気計測,磁気物性,照射損傷,核融合炉ブランケット,,,,,,,,,,,,,,,,,,,,,,,,,,,,,,,,,,,,,,,,,,,,,,,,,,,,
25K22236,国立研究開発法人海洋研究開発機構,菊池 早希子,海洋深層水を用いた微生物培養による鉱物資源の創出,マンガン（Mn）酸化物は、吸着を介して海水中の様々な有用元素を固相に集める優れた能力を持つ。しかし、天然におけるMn酸化物の無機的な生成速度は極めて遅い。一方、微生物は無機反応よりはるかに高速にMn酸化物を合成することが可能である。本研究では、環境中に存在するMn酸化細菌が低溶存有機物環境を好むことに着目し、これらMn酸化細菌を低溶存有機物・高栄養塩である海洋深層水で選択的に増やし、Mn酸化物の合成と海水中の有用元素回収を高速に実現することを目指す。,挑戦的研究(萌芽),中区分31:原子力工学、地球資源工学、エネルギー学およびその関連分野,海洋深層水,Mn酸化物,Mn酸化細菌,,,,,,,,,,,,,,,,,,,,,,,,,,,,,,,,,,,,,,,,,,,,,,,,,,,,,
25K22235,国立研究開発法人日本原子力研究開発機構,南川 卓也,漆の構造解析・制御による環境に優しいウラン吸着剤の開発,本研究は、黒漆の高いウラン吸着性能を活かし、キトサンなどの天然高分子と金属イオン（Fe、Cu、UO2等）を加えることで、構造・機能を精密に制御した吸着材料を開発するものである。吸着性能、選択性、耐久性、再利用性を総合的に評価し、特に海水中での実用性を検証する。さらに、ウランに加え、資源的価値のある金属や毒性を有する元素の除去も視野に入れ、資源循環と環境調和を実現する新たな吸着材料技術の確立を目指す。,挑戦的研究(萌芽),中区分31:原子力工学、地球資源工学、エネルギー学およびその関連分野,漆,ウラン,資源循環,吸着剤,,,,,,,,,,,,,,,,,,,,,,,,,,,,,,,,,,,,,,,,,,,,,,,,,,,,
25K22234,東京大学,阿部 弘亨,放射線で切り拓く新しい非平衡材料界面創成工学,鉄鋼材料は一般に母相中の炭化物や酸化物等による強化を図っている。最近の研究からこの強化因子が照射下で不安定化し消滅する現象が明らかになり、照射環境下における構造材料の性能劣化への影響が指摘されている。本提案では、この現象の影響度評価を目的として、鉄基合金／（炭化物、酸化物、Laves相）からなる二層界面を用いた手法を新たに開発し、照射影響（界面移動やミキシング等）を定量的に計測するとともに、この現象と手法を利用した新材料の創成概念を構築する。,挑戦的研究(萌芽),中区分31:原子力工学、地球資源工学、エネルギー学およびその関連分野,金属／酸化物界面,イオン照射,,,,,,,,,,,,,,,,,,,,,,,,,,,,,,,,,,,,,,,,,,,,,,,,,,,,,,
25K22233,北見工業大学,小原 伸哉,CO2ハイドレート熱サイクルによる燃焼排ガスからのCO2の分離及び回収,本研究では燃焼排ガス中からCO2を高速・高効率に分離して回収できるよう、ガスハイドレート反応触媒と反応促進剤を添加して、さらに反応時に系の圧力を調整することで、繰り返しCO2の核沸騰・凝縮による強制撹拌を与える試みは世界で例がない。上で述べた技術は、複数の学問領域の専門知識を要するため学際的なアプローチを要する。さらに、火力発電所の燃焼排ガス中からCO2を分離して回収するという社会的に大きな課題を、安価で安定したCO2ハイドレート熱サイクルによって解決するという本研究の取組は、国内外の社会や産業界に大きなインパクトを与える可能性がある。,挑戦的研究(萌芽),中区分31:原子力工学、地球資源工学、エネルギー学およびその関連分野,ガスハイドレート,CO2分離,燃焼排ガス,ガスハイドレート熱サイクル,CO2回収,,,,,,,,,,,,,,,,,,,,,,,,,,,,,,,,,,,,,,,,,,,,,,,,,,,
