awardnumber,organization,name,title,abstract,section,review_section,keyword1,keyword2,keyword3,keyword4,keyword5,keyword6,keyword7,keyword8,keyword9,keyword10,keyword11,keyword12,keyword13,keyword14,keyword15,keyword16,keyword17,keyword18,keyword19,keyword20,keyword21,keyword22,keyword23,keyword24,keyword25,keyword26,keyword27,keyword28,keyword29,keyword30,keyword31,keyword32,keyword33,keyword34,keyword35,keyword36,keyword37,keyword38,keyword39,keyword40,keyword41,keyword42,keyword43,keyword44,keyword45,keyword46,keyword47,keyword48,keyword49,keyword50,keyword51,keyword52,keyword53,keyword54,keyword55,keyword56
18K19048,国立研究開発法人日本原子力研究開発機構,田中 万也,環境水中における四価アクチノイド可溶化への微生物活動の影響に関する研究,微生物が細胞外に分泌する有機化合物と錯体を形成してアクチノイドが可溶化することは、単離株を用いた室内実験では明らかにされている。しかし、実際の環境中において微生物活動がアクチノイドの可溶化にどの程度影響しているのかについては殆ど調べられていない。本研究では、人形峠及びオンネトー湯の滝においてウランや希土類元素の環境挙動を調べた。その結果、人形峠ではウラン、湯の滝では希土類元素の一つであるセリウムが微生物活動により可溶化していることを示唆する結果が得られた。,挑戦的研究(萌芽),中区分31:原子力工学、地球資源工学、エネルギー学およびその関連分野,微生物,アクチノイド,希土類元素,四価アクチノイド,シデロフォア,,,,,,,,,,,,,,,,,,,,,,,,,,,,,,,,,,,,,,,,,,,,,,,,,,,
18K19047,東海大学,浅沼 徳子,フルオラス溶媒とイオン液体を抽出媒体としたトリウム燃料再処理への適用性検討,トリウム燃料再処理のための溶媒抽出法の媒体として、化学的安定性の高いフルオラス溶媒と抽出化学種の溶解性に優れるイオン液体を適用することを検討した。トリウムの模擬元素としてセリウムを使用した。硝酸水溶液中のセリウムは、ホスフェート型フルオラス抽出剤によりフルオラス相へ抽出され、その後、抽出剤として塩化トリオクチルメチルアンモニウムを含むイミダゾリウム型イオン液体へ分配した。核分裂生成物の模擬元素を使用したトリウム燃料の模擬溶解液からの抽出試験では、フルオラス溶媒を介してイオン液体相へセリウムを選択的に回収できることを確認した。,挑戦的研究(萌芽),中区分31:原子力工学、地球資源工学、エネルギー学およびその関連分野,溶媒抽出,フルオラス溶媒,イオン液体,セリウム,核分裂生成物,,,,,,,,,,,,,,,,,,,,,,,,,,,,,,,,,,,,,,,,,,,,,,,,,,,
18K19046,佐賀大学,田中 徹,高不整合材料を用いた人工光合成技術の開拓,太陽光と水を利用して水素を生成する人工光合成は，二酸化炭素など温室効果ガスを削減しながら，無尽蔵かつ貯蔵可能な次世代エネルギー創製技術として大きな期待が寄せられている。本研究では，従来の半導体混晶と異なりバンド反交差作用によるユニークなバンドエンジニアリングが可能な高不整合半導体材料ZnTeOに着目し，水素発生応用に適したエネルギーバンドを実現することで，これまでにない新たな人工光合成システムを開拓することを目的とした。その結果，ZnTeOに対して水素発生に適したpnヘテロ接合構造を明らかにするとともに，水素発生を実証し，その発生量と反応時間の関係を明らかにした。,挑戦的研究(萌芽),中区分31:原子力工学、地球資源工学、エネルギー学およびその関連分野,高不整合材料,人工光合成,マルチバンドギャップ半導体,,,,,,,,,,,,,,,,,,,,,,,,,,,,,,,,,,,,,,,,,,,,,,,,,,,,,
18K19045,九州大学,笹木 圭子,炭素質頁岩の酵素分解を組み込んだゴールドバイオミネラルプロセッシングへの挑戦,炭素質頁岩を含む金鉱石は、金含有量が高いにもかかわらず、金回収率が低い。この理由は炭素質物質がシアン金錯体を吸着して、回収率を下げてしまうためで、効率の点、環境保全の点の両面から満足すべき解決法が確立されていない。本研究では、高温高圧条件を用いることなく、バイオテクノロジーによる炭素質物質の酵素分解を組み込んだ金回収法の確立を目指した。鉄酸化菌による硫化物の分解、続いて白色腐朽菌の放出粗酵素液による炭素質物質の分解を組み合わせることによって、シアン抽出による金回収率は、未処理段階で24%であったものが、92%にまで向上した。リグニン分解性酵素が炭素質物質の分解に寄与しているものと考えられる。,挑戦的研究(萌芽),中区分31:原子力工学、地球資源工学、エネルギー学およびその関連分野,趙難処理金鉱石,炭素質物質,シアン化処理,QEMSCAN,リグニン分解性酵素,粘土鉱物,白色腐朽菌,鉄酸化菌,炭素質頁岩,金鉱石,バイオミネラルプロセッシング,超難処理金鉱石,リグニンペルオキシダーゼ,マンガンペルオキシダーゼ,硫化鉱物,金回収率,超難処理型金鉱石,リグニン分解酵素,,,,,,,,,,,,,,,,,,,,,,,,,,,,,,,,,,,,,,
18K19044,岐阜大学,神原 信志,過熱水蒸気による水放電分解水素製造法の開発,水素製造コストが安価な革新的なCO2フリー水素製造装置の開発が望まれている。本研究は，水蒸気プラズマと水素分離膜で構成する革新的低コスト水素製造デバイスの開発を目的として，平板型プラズマメンブレンリアクターを開発した。しかし，過熱水蒸気の水素製造エネルギー効率は非常に低いレベル（0.0009 L/Wh）であった。,挑戦的研究(萌芽),中区分31:原子力工学、地球資源工学、エネルギー学およびその関連分野,水素製造,プラズマ,水素分離膜,過熱水蒸気,大気圧プラズマ,アンモニア水,CO2フリー水素,水素,,,,,,,,,,,,,,,,,,,,,,,,,,,,,,,,,,,,,,,,,,,,,,,,
18K19043,東京工業大学,中瀬 正彦,配位子搭載刺激応答ゲルによる錯形成空間制御に基づくf元素高度分離,原子力の使用済燃料からマイナーアクチノイドとランタノイドといったf元素分離の高度相互分離を目指し、配位子搭載型感温性ゲル吸着剤による“錯形成空間の制御”の可能性を探索した。重合性官能基を有する架橋剤型配位子を合成し、感温性単量体と共重合してゲルを合成した。次いでU(VI)、Th(IV)、Eu(III)、Nd(III)といったf元素の吸着に及ぼす酸濃度依存性、温度依存性、吸着等温線などを取得した。ゲルの体積相転移温度前後においてゲル中の金属イオンの局所構造をXAFSで、昇温過程を時分割XAFSで、各温度での高分子のコンフォーメーションをSAXSで調査し、錯体構造と高分子物性の相関を考察した。,挑戦的研究(萌芽),中区分31:原子力工学、地球資源工学、エネルギー学およびその関連分野,ゲル液抽出法,ハイドロゲル,f元素分離,放射光XAFS,時分割XAFS,X線小角散乱,錯形成空間制御,錯体化学,小角散乱,配位空間制御,,,,,,,,,,,,,,,,,,,,,,,,,,,,,,,,,,,,,,,,,,,,,,
18K19042,東北大学,簡 梅芳,レアメタルの持続可能な利用を目的としたモリブデンの生物学的濃縮・回収技術の開発,持続可能なレアメタル資源利用の実現に向け、レアメタルの生物学的濃縮技術の開発を行った。成果として、１、金属応答遺伝子を探索し、水銀耐性細菌MB１株の有機水銀分解酵素MerB3は生物学的水銀解毒剤になる可能性を見出した。２、水銀耐性細菌MB24株は水銀とヒ素の解毒遺伝子群を特殊な構造で併せ持つことを明らかにした。上記の成果をそれぞれ英文論文として投稿・掲載した。３、モリブデン吸着タンパクを酵母の細胞表面に発現させ、モリブデンに優れた吸着性を示す酵母を作製した。また、酵母を固定化することで吸着量がさらに上昇することを確認した。上記の成果を日本農芸化学会、細菌学会、国際生物冶金会議にて発表を行った。,挑戦的研究(萌芽),中区分31:原子力工学、地球資源工学、エネルギー学およびその関連分野,レアメタル,生物濃縮,モリブデン,微生物工学,酵母,微生物,,,,,,,,,,,,,,,,,,,,,,,,,,,,,,,,,,,,,,,,,,,,,,,,,,
18K19041,東北大学,加納 純也,天然鉱石からの不純物除去プロセスの開発を目指したメカノケミカル効果のその場観察,天然鉱石からの不純物除去を目指し、粉砕操作によるメカノケミカル効果を利用した分離プロセスの開発を行った。ボールミル粉砕における粉砕条件を最適化し、乾式粉砕と湿式粉砕の組み合わせにより高効率にヒ素を銅鉱石から分離可能な手法を開発した。鉱石中のヒ素は粉砕を行うことで硫化物から酸化物へと変化し、水に溶出しやすくなることで水洗により分離することが可能となった。乾式粉砕では鉱石表面近傍の酸化を、湿式粉砕では鉱石内部の酸化を進行させる効果があることが明らかとなった。,挑戦的研究(萌芽),中区分31:原子力工学、地球資源工学、エネルギー学およびその関連分野,メカノケミカル,シミュレーション,,,,,,,,,,,,,,,,,,,,,,,,,,,,,,,,,,,,,,,,,,,,,,,,,,,,,,
18K19040,東北大学,田中 秀治,放射線暴露によって動作不能になった集積回路のその場回復技術に関する研究,γ線による集積回路のダメージは，主にゲート酸化膜のチャージアップによって起こる。本研究では，集積回路にマイクロヒータを形成し，加熱によってディスチャージを促進し，γ線ダメージからの回復を試みた。,挑戦的研究(萌芽),中区分31:原子力工学、地球資源工学、エネルギー学およびその関連分野,γ線ダメージ,集積回路,マイクロヒータ,MEMS,放射線,センサ,,,,,,,,,,,,,,,,,,,,,,,,,,,,,,,,,,,,,,,,,,,,,,,,,,
18K19039,東北大学,渡邉 則昭,高温延性地殻の超臨界水による水圧破砕現象を利用した高透水性網状き裂システム形成法,超臨界地熱資源の形成環境を考慮して，最高温度500℃，最大応力100 MPa程度までの条件下の花崗岩に対して，世界初となる最大・中間・最小主応力を独立に制御（地下の応力場をより忠実に再現）した真三軸応力下での超臨界水圧破砕実験を実施し，水圧破砕に関する新しい学術体系の創出に向けた第一歩を踏み出すことを目的とした。地層条件（温度や地殻応力場）と破砕条件（井戸に対する主応力の方向や加圧速度）が，き裂発生に要する水圧レベルや，き裂進展パターン，さらには透水性増加に及ぼす影響を系統的かつ定量的に検討し，超臨界水圧破砕の基礎理論構築と，高透水性・網状き裂システム形成法を創出した。,挑戦的研究(萌芽),中区分31:原子力工学、地球資源工学、エネルギー学およびその関連分野,超臨界地熱資源,水圧破砕,延性地殻,透水性,貯留層,,,,,,,,,,,,,,,,,,,,,,,,,,,,,,,,,,,,,,,,,,,,,,,,,,,
19K22158,金沢工業大学,南戸 秀仁,放射能汚染の可視化が可能なフレキシブル二次元放射線RPLイメージセンサ,ビーズ状のリン酸塩ガラスの作製技術を確立するとともに、ビーズ状ガラスを透明な有機膜でラミネートした「シート状リン酸塩ガラスを用いたラジオフォトルミネッセンス(Radiophotoluminescece:略してRPL)2次元放射線量計」を実現し、その応用を図る。具体的には、放射能汚染分布を二次元で検知できるフレキシブル線量計、放射線管理区域で作業をする従事者が身に着ける手袋や作業衣に加工したRPL線量計などを開発し、その応用の可能性を検討する。,挑戦的研究(萌芽),中区分31:原子力工学、地球資源工学、エネルギー学およびその関連分野,放射線誘起蛍光体,ラジオフォトルミネッセンス,放射線イメージング,放射線画像読み取り装置,ガラス線量計,硫酸カルシウム蛍光体,二次元イメージセンサ,光刺激ルミネッセンス,放射線量分布,リン酸塩ガラス,CaSO４蛍光体,CaSO4蛍光体,二次元放射線イメージセンサ,RPL,フレキシブル,放射能汚染,,,,,,,,,,,,,,,,,,,,,,,,,,,,,,,,,,,,,,,,
19K22157,九州大学,寺西 亮,電気エネルギー輸送用超伝導薄膜線材の欠陥部位へのパッチ補修法の開発,REBa2Cu3Oy(RE:希土類)超伝導薄膜線材は、液体窒素冷却にて電気抵抗なく電力エネルギーを輸送できることから、長尺線材コイル化によるマグネット応用に期待されている。本研究では、線材の超伝導層の欠陥部位を補修する方法を開発する。,挑戦的研究(萌芽),中区分31:原子力工学、地球資源工学、エネルギー学およびその関連分野,酸化物超伝導,線材,薄膜,結晶配向,接合,熱処理,機械的圧力,微細組織,超伝導体,結晶成長,固相拡散,生成相,微構造解析,結晶方位,酸化物,酸化物超伝導薄膜,結晶化熱処理,通電性能,補修,,,,,,,,,,,,,,,,,,,,,,,,,,,,,,,,,,,,,
19K22156,九州大学,三木 一,アドバンストハイドロメタラジーのための超微量粉末電気化学の確立,電気化学的手法は酸化還元反応を精密測定できるため広く用いられているが、粉末試料の適用は難しく、微量の粉末を定量する手法は確立されていなかった。申請者は、超微量粉末試料の電極を開発し、従来よりはるかに良好な感度を得た。本研究では、超微量粉末電極を多種多様の粉末鉱物に適用し、独自のプログラムを用いた電位を精密に制御する電解槽の開発により、解析が難しかった粉末状の鉱物の浸出・反応機構を解明する。これらの反応機構を鉱物処理・湿式精錬プロセスおよび微生物の高速培養などの場面において応用することを念頭において最適条件を検討する。これらの組み合わせにより、効率よく反応を進めることが出来ると考えられる。,挑戦的研究(萌芽),中区分31:原子力工学、地球資源工学、エネルギー学およびその関連分野,超微量粉末電極,湿式精錬,浮遊選別,ガルバニック電流測定,インピーダンス分析,電気化学,粉末電極,キャラクタリゼーション,反応機構,電位制御槽,鉱物処理,,,,,,,,,,,,,,,,,,,,,,,,,,,,,,,,,,,,,,,,,,,,,
19K22155,徳島大学,浅田 元子,ホロセルロース完全エネルギー化を目指した多段階塩触媒加圧型マイクロ波システム創成,本研究は、未利用バイオマスである草本類を原料として実用化・産業化が可能な製品を製造し、利益創出・エコ型のバイオリファイナリーシステムを開拓することを目的とする。本提案システムは、燃料と同時に高付加価値物質を生産できる、塩触媒加圧型マイクロ波水熱前処理、耐塩耐熱性の酵素と酵母による糖化と発酵、発酵残渣からの有用製品産出を併合した、省エネ、低コスト、低環境負荷かつ減工程型プロセスである。,挑戦的研究(萌芽),中区分31:原子力工学、地球資源工学、エネルギー学およびその関連分野,バイオエタノール,バイオマス,ホロセルロース,,,,,,,,,,,,,,,,,,,,,,,,,,,,,,,,,,,,,,,,,,,,,,,,,,,,,
19K22154,名古屋大学,一野 祐亮,量子効果によるエネルギー材料性能の向上に向けたナノウィスカー成長技術の創製,酸化物超伝導体や酸化物熱電変換材料などの酸化物エネルギー材料は、エネルギーの高効率輸送、貯蔵や生成に大きく貢献する。しかし、実用化されている金属間化合物エネルギー材料と比較すると、超伝導では臨界電流密度の向上、熱電変換材料では熱電変換効率の向上が必要とされている。これらのエネルギー材料は、ナノメートルサイズの細線化を行うことで量子効果によってエネルギー性能が向上する可能性がある。,挑戦的研究(萌芽),中区分31:原子力工学、地球資源工学、エネルギー学およびその関連分野,超伝導,ナノウィスカー,液相成長,VLS成長,高品質薄膜,高速成膜,高品質結晶,酸化物超伝導,VLS,液相安定化,機能性酸化物,,,,,,,,,,,,,,,,,,,,,,,,,,,,,,,,,,,,,,,,,,,,,
19K22153,長岡技術科学大学,村上 健太,照射欠陥への偏析によるナノスケール組織形成を定量化するための実験手法の開発,3DAPでは、針状の試料に高周波パルス電圧を加えることで試料表面の原子を一つずつ電界蒸発させて、二次元＋時間の三次元情報とTime of Flight法による原子の質量数から、三次元の原子マップを再構成する手法である。,挑戦的研究(萌芽),中区分31:原子力工学、地球資源工学、エネルギー学およびその関連分野,原子力材料,照射欠陥,アトムプローブ,照射損傷,イオンビーム,原子力工学,格子欠陥,原子力材料・核燃料,,,,,,,,,,,,,,,,,,,,,,,,,,,,,,,,,,,,,,,,,,,,,,,,
19K22152,東京大学,阿部 弘亨,鉄鋼材料強化因子の照射劣化が原子力プラント健全性に与える影響評価手法の開発,鉄鋼材料は母相中の炭化物や酸化物などによる強化を図っている。最近の我々の研究により、この強化因子が照射下で不安定化して消滅する現象を明らかにし、原子炉や核融合炉の構造材料の性能劣化への影響を指摘している。現在の理解が定性的なものにとどまっていることから、本提案では、この現象の影響力の定量化を目的とする。そして、照射下における原子の流れ（拡散）を制御する照射技術を開発し、鉄基合金／炭化物（あるいは酸化物）二相界面に適用して、照射影響（界面移動など）を定量的に計測し、照射耐性の評価に資する知見としてまとめる。,挑戦的研究(萌芽),中区分31:原子力工学、地球資源工学、エネルギー学およびその関連分野,析出物,鉄鋼材料,ジルコニウム合金,二層界面,照射効果,炭化物,酸化物,照射誘起,イオン照射,鉄鋼,,,,,,,,,,,,,,,,,,,,,,,,,,,,,,,,,,,,,,,,,,,,,,
19K22151,筑波大学,山路 恵子,微生物のシデロフォアが関与するヨシの鉄プラーク形成機構の解明,水質浄化に関わる水生植物のヨシには、ウランや重金属を蓄積することが判明している。ヨシの浄化機能を高めるためには、植物の元素蓄積機構において寄与度が高い微生物との複合共生系を考慮する必要がある。これまでの研究によって、根の細菌がつくる化合物によって、ヨシにおける重金属吸着能力が増強される可能性が示唆されているが、本研究ではそのメカニズムを解明する。,挑戦的研究(萌芽),中区分31:原子力工学、地球資源工学、エネルギー学およびその関連分野,ヨシ,鉄プラーク,内生細菌,重金属蓄積,重金属,鉱山,自生植物,土着微生物,,,,,,,,,,,,,,,,,,,,,,,,,,,,,,,,,,,,,,,,,,,,,,,,
19K22150,東北大学,駒井 武,超臨界地熱の反応場を利用した炭素固定型エネルギー生産に関する挑戦的研究,天然の地圏環境を利用して水素製造とCO2削減とを同時達成可能な水素製造法を新たに考案する。本水素製造法では，地熱環境へCO2とカンラン石を輸送し，水素生成と炭酸塩鉱物の形成をともなうカンラン石の加水反応を利用して水素を製造し，同時にCO2を炭酸塩鉱物として地下に固定するものである。加えて，本水素製造法は目的に応じて発生した水素の一部あるいは全部を鉱物触媒反応によりCO2と反応させて炭化水素に転換して，新たな燃料資源を創成するという特長も有している。本研究では，主に実験的な検討により新規のプロセスに関する実証的な検討を行い，炭素固定と水素および炭化水素製造の同時達成な反応メカニズムを解明する。,挑戦的研究(萌芽),中区分31:原子力工学、地球資源工学、エネルギー学およびその関連分野,地球化学反応,鉱物資源,水素製造,二酸化炭素削減,超臨界地熱,ジオリアクター,CO2固定,地化学反応,水素生成,CO2削減,鉱物触媒,炭素固定,超臨界水,,,,,,,,,,,,,,,,,,,,,,,,,,,,,,,,,,,,,,,,,,,
19K22149,東北大学,森谷 祐一,スロー地震学の地下流体エネルギー開発分野への展開,ノイズに似た定周波の不明瞭な弾性波として観測される低周波イベントは，地下流体エネルギー開発分野でも観測される。低周波イベントはほぼ見過ごされてきた。 自然地震分野でのスロー地震学の理解の蓄積と，誘発有感地震等の本分野の深刻な問題を受け，低周波イベントの理解を通して，さらに貯留層内現象の深い理解が必要である。しかし，どの様なメカニズムとして低周波イベントが発生するかは理解されておらず，エネルギー開発工程との関連や，誘発有感地震との関連も分かっていない。よって，本研究では地下流体エネルギー開発でも観測される低周波イベントの物理現象解明とそれを用いた地熱貯留層計測法の開発を目指す。,挑戦的研究(萌芽),中区分31:原子力工学、地球資源工学、エネルギー学およびその関連分野,スロースリップ地震,ゆっくり滑り,スロースリップイベント,AE,微小地震,スロー地震,低周波地震,貯留層,地熱開発,時間周波数解析,,,,,,,,,,,,,,,,,,,,,,,,,,,,,,,,,,,,,,,,,,,,,,
20K21164,大阪府立大学,宮丸 広幸,狭角度域コンプトン非同時計数によるBNCT治療効果リアルタイム計測,“ほう素中性子捕捉療法”(BNCT)は世界に先駆けて日本で大きく進展している中性子を用いた新しいがん治療法であるが、放射線を外部から患部へ照射する際にその治療効果をリアルタイムで調べることが困難である。BNCTでは治療中患部からは478keVの特定のエネルギーを持つガンマ線が放出されるため、このガンマ線の検出により治療効果を推定する試みが多くの研究者でなされているが測定が極めて困難である。そこで本研究では新たに開発するコンプトン非同時計数法を用いるための特殊な形状を持つ検出器を考案し、特定ガンマ線を高感度に計測する新しい手法を開発し治療の質的向上を目指す。,挑戦的研究(萌芽),中区分31:原子力工学、地球資源工学、エネルギー学およびその関連分野,BNCT,gamma-ray detector,anticoincidence,Compton,非同時計数法,ガンマ線,放射線計測,コンプトン散乱,シンチレーター,コンプトン,,,,,,,,,,,,,,,,,,,,,,,,,,,,,,,,,,,,,,,,,,,,,,
20K21163,九州大学,佐々木 久郎,炭酸ナトリウムゲル生成によるCO2分離及び浅帯水層へのCO2固定化システムの開発,安価なメタケイ酸ナトリウム水溶液に亜臨界圧力下でCO2を溶解させることで炭酸ナトリウム(Na2CO2)ゲルが容易に生成でき、減圧後も安定なゲルを維持できることから、深帯水層に匹敵する貯留ポテンシャルをもつ300-400mの浅帯水層に低流動性のゲルとしてCO2を固定するシステムを開発する。とくに、メタケイ酸ナトリウム溶液のCO2ガスの吸収・分離特性、温度と圧力によるゲル化時間や強度および安定性を調べ、燃焼ガス(N2-CO2混合ガス)からCO2を選択的に吸収・分離し、浅帯水層へ圧入するシステムにおける物質バランスを実験的に明らかにし、鉱物化の可能性を含めた一連のシステム開発に関する研究を行う。,挑戦的研究(萌芽),中区分31:原子力工学、地球資源工学、エネルギー学およびその関連分野,二酸化炭素固,ケイ酸ナトリウム,浅帯水層,CO2地中貯留,ゲル,ダイレクトダンピング,二酸化炭素固定,浅層貯留,二酸化炭素分離,温暖化ガス,CO2,分離,,,,,,,,,,,,,,,,,,,,,,,,,,,,,,,,,,,,,,,,,,,,
