awardnumber,organization,name,title,abstract,section,review_section,keyword1,keyword2,keyword3,keyword4,keyword5,keyword6,keyword7,keyword8,keyword9,keyword10,keyword11,keyword12,keyword13,keyword14,keyword15,keyword16,keyword17,keyword18,keyword19,keyword20,keyword21,keyword22,keyword23,keyword24,keyword25,keyword26,keyword27,keyword28,keyword29,keyword30,keyword31,keyword32,keyword33,keyword34,keyword35,keyword36,keyword37,keyword38,keyword39,keyword40,keyword41,keyword42,keyword43,keyword44,keyword45,keyword46,keyword47,keyword48,keyword49,keyword50,keyword51,keyword52,keyword53,keyword54,keyword55,keyword56
20K21162,京都大学,黒崎 健,ホウ素同位体濃縮高熱伝導率ヒ化ホウ素,近年、極めて高い熱伝導率を示す新材料としてヒ化ホウ素が注目されている。一方、ホウ素の同位体にはホウ素１０とホウ素１１があり、天然の同位体組成はホウ素１０対ホウ素１１で約２対８である。物質を構成する原子の質量差は、固体中で熱を伝えるフォノンの散乱要因となる、すなわち、熱伝導率を低減させる。本研究において、従来は天然ホウ素から合成されているヒ化ホウ素に対して、そのホウ素の同位体組成を調整する（ホウ素１０かホウ素１１に濃縮したホウ素をもとにヒ化ホウ素を合成する）ことで、熱伝導率のさらなる向上を図る。,挑戦的研究(萌芽),中区分31:原子力工学、地球資源工学、エネルギー学およびその関連分野,ヒ化ホウ素,ホウ化シリコン,熱伝導率,同位体効果,,,,,,,,,,,,,,,,,,,,,,,,,,,,,,,,,,,,,,,,,,,,,,,,,,,,
20K21161,京都大学,神野 郁夫,X線コンピュータ断層撮影の低被ばく化を目指した低雑音電流敏感型前置増幅器の開発,X線コンピュータ断層撮影(CT)は人体内部の病巣を観察する強力な診断法であるが，被ばく量が高いという問題がある．この原因は，X線を電流として測定するために雑音レベルが高い電流敏感型前置増幅器を用いることにある．そこでCTを低被ばく化するために，低雑音の電荷敏感型前置増幅器を開発する．このため，低雑音特性を有する電荷敏感型前置増幅器を用いる．新規電流敏感型前置増幅器が従来のものより低雑音であり，低被ばくCTが実施できることを実証する．,挑戦的研究(萌芽),中区分31:原子力工学、地球資源工学、エネルギー学およびその関連分野,X線,電流測定,低被ばく,コンピュータ断層撮影,電流敏感型前置増幅器,電荷敏感型前置増幅器,X線コンピュータ断層撮影,低雑音,,,,,,,,,,,,,,,,,,,,,,,,,,,,,,,,,,,,,,,,,,,,,,,,
20K21160,東京大学,斉藤 拓巳,有機－無機複合コロイドのナノ構造評価に基づく特異的な核種吸着現象の解明,本研究は、スピンコントラスト中性子小角散乱（SC-SANS）法を用いて、有機―無機複合コロイドのナノ構造を決定し、複合コロイドに対する放射線核種の吸着特性や複合コロイドの凝集・分散特性を有機物コロイドの部分構造から明らかにしようとするものである。令和2年度は、SC-SANS法の適用性の評価とナノ吸着構造を評価すための評価モデルを検討し、令和3年度は、異なる環境条件における複合系のSC-SANS測定を行い、アルミナ表面における腐植物質のナノ吸着構造の変化を評価すると共に、複合系における吸着実験との比較から、複合コロイドの特異的な吸着特性と構造の関係に迫る。,挑戦的研究(萌芽),中区分31:原子力工学、地球資源工学、エネルギー学およびその関連分野,小角散乱,天然有機物,鉱物,ナノ構造,天然有機物質,,,,,,,,,,,,,,,,,,,,,,,,,,,,,,,,,,,,,,,,,,,,,,,,,,,
20K21159,東北大学,新堀 雄一,不飽和層の自己閉塞のダイナミクス：コンパクト地層処分システムの創成に向けた展開,不飽和層とは地下水によって満たされていない領域を指す。本研究では、乾燥に伴う不飽和層での物質移動と析出による止水性の動的挙動を、X線CT撮影や透水試験により定量的に整理し、それらを基に地層処分場の全体面積をよりコンパクトにできることを示す。,挑戦的研究(萌芽),中区分31:原子力工学、地球資源工学、エネルギー学およびその関連分野,放射性廃棄物,地層処分,コンパクト化,不飽和層,乾燥過程,表面集積,析出反応,自己閉塞,地層処分システム,バックエンド,,,,,,,,,,,,,,,,,,,,,,,,,,,,,,,,,,,,,,,,,,,,,,
21K18923,九州大学,三木 一,超微量粉末電気化学の展開による次世代型湿式精錬プロセスの開発,溶液内の状態を把握するため、電気化学的手法が広く用いられているが、湿式精錬で一般的な懸濁系、粉末試料への適用は難しい。本研究では、応募者の開発した超微量粉末電極の改良などにより、微小粉末試料の浸出・反応の定量に加え、粉末同士の接触時の挙動を解析する。応募者の確立した手法は、簡便に超微量の微粒子電極を作成でき、感度も従来法と比較して歴然としている。これらミクロスケールでの微粒子の挙動を組み合わせることにより、マクロスケールとなる反応槽内の懸濁液溶液での浸出挙動を予測する。応募者の作成する、溶存酸素やpH、電位を常に最適な状態に制御できる電解槽の開発により、次世代型湿式精錬プロセス開発に貢献する。,挑戦的研究(萌芽),中区分31:原子力工学、地球資源工学、エネルギー学およびその関連分野,超微量粉末電極,硫化鉱物反応挙動,湿式製錬,浮遊選鉱,酸化還元反応,電位走査,ストリッピングボルタンメトリ,インピーダンス測定,超微量粉末電気化学,硫化鉱物,浸出挙動,浮遊選別,電気化学,酸化還元剤,銅鉱物,含ヒ素銅鉱物,超微粉末電気化学,浸出機構,定量分析,湿式精錬,,,,,,,,,,,,,,,,,,,,,,,,,,,,,,,,,,,,
21K18922,九州大学,沖部 奈緒子,自己再生バイオミネラルを介した二大金属汚染水のループ型浄化/二次資源化への挑戦,"鉱害には閉山後も「酸性坑廃水」発生が続く特殊性がある。マンガンは不動化困難で最終段階まで溶存し続ける問題金属で、また、ヒ素含有硫化鉱の資源化が拡大化する今, 猛毒ヒ素を含有する廃水問題は悪化の一途にある。ここではヒ素とマンガンに注目し,「金属含有水処理を“負の事業”から“正の二次資源化技術”へ転換できないか？」を問う。耐酸性Mn酸化菌の活用と, 放射光X線散乱法によるナノバブル特性化で得た知見に基づき, 熱力学的に困難なMn酸化反応を高密度充填細胞で高速駆動し,バイオミネラルとして汚染廃水から二次資源化するだけでなく, 金属ロスの無い自己再生型酸化剤としてAs酸化処理に二次利用する。",挑戦的研究(萌芽),中区分31:原子力工学、地球資源工学、エネルギー学およびその関連分野,金属汚染水,マンガン,ヒ素,バクテリア,バイオプロセス,バーネサイト,マンガンスラッジ廃棄物,鉄スラッジ廃棄物,酸性鉱山廃水,マンガン酸化菌,,,,,,,,,,,,,,,,,,,,,,,,,,,,,,,,,,,,,,,,,,,,,,
21K18921,長岡技術科学大学,太田 朋子,過去100万年規模の宇宙線起源81Kr変遷の復元による地下水絶対年代測定法の提案,地球上の水資源の中で人類がアクセスしやすく体積が大きい淡水資源は地下水であり、持続可能な資源として活用するために、地下水の循環速度の速さ（地下水年代の若さ）を指標にできる。国内の地下水等を対象に、81Kr地下水絶対年代測定法より、地下水が涵養された時間を明らかにする。,挑戦的研究(萌芽),中区分31:原子力工学、地球資源工学、エネルギー学およびその関連分野,地下水,放射性希ガス,放射性核種,環境放射能,放射性廃棄物,同位体,放射性Kr,,,,,,,,,,,,,,,,,,,,,,,,,,,,,,,,,,,,,,,,,,,,,,,,,
21K18920,新潟大学,郷右近 展之,高温蓄熱による変動再エネ安定化および導入拡大に関する研究,2050年のCO2削減目標に向け太陽電池（PV）や風力発電等の再生可能エネルギーの導入拡,挑戦的研究(萌芽),中区分31:原子力工学、地球資源工学、エネルギー学およびその関連分野,高温蓄熱,相変化材料,潜熱蓄熱,化学蓄熱,太陽熱発電,蓄熱発電,顕熱蓄熱,,,,,,,,,,,,,,,,,,,,,,,,,,,,,,,,,,,,,,,,,,,,,,,,,
21K18919,東京大学,高橋 浩之,RIプローブと蛍光プローブの差異を明らかにするための薬剤挙動に関する動態解析,本研究は、現在、生物学・医学・薬学において広く用いられている、蛍光イメージングの根底にある信頼性、すなわち、忠実度がどれだけあり、どこまで得られた結果が信用できるものなのかについて再度問いかけなおす、という試みを行うものである。具体的には、いくつかの分子を対象として、RIイメージングと蛍光イメージングを系統的に比較し、これらの間の差異がどの程度生じるのかを明らかにすることを目的として、実験を実施するものである。,挑戦的研究(萌芽),中区分31:原子力工学、地球資源工学、エネルギー学およびその関連分野,PET,FDG,RI,蛍光体,イメージング,動態計測,Radioisotope,放射能,グルコース,トレーサー,,,,,,,,,,,,,,,,,,,,,,,,,,,,,,,,,,,,,,,,,,,,,,
21K18917,東京大学,高橋 嘉夫,粘土鉱物により放射性核種は還元されるか？ -放射性廃棄物地層処分と関連して-,2:1型粘土鉱物の八面体層中のFe(II)による還元反応が高レベル放射性廃棄物の地層処分において重要な元素で生じた場合、これら元素の地下環境での挙動に決定的に重要な影響を与える。また2:1型粘土鉱物であるスメクタイトは、放射性廃棄物の廃棄体と天然バリアの間の緩衝材として用いられる予定で、このスメクタイト中にFe(II)が存在した場合、吸着イオンに対する還元能を持つ可能性がある。本研究では、先端的なX線吸収微細構造法なども駆使して、実験室で調製したFe(II)を含むスメクタイト試料や幌延深地層研究センターの地下環境に保持したベントナイト試料などにより、Uどが還元されるかについて研究する。,挑戦的研究(萌芽),中区分31:原子力工学、地球資源工学、エネルギー学およびその関連分野,粘土鉱物,放射線核種,放射性廃棄物,EXAFS,還元,放射性核種,還元反応,,,,,,,,,,,,,,,,,,,,,,,,,,,,,,,,,,,,,,,,,,,,,,,,,
21K18916,東北大学,千田 太詩,放射性廃棄物のさらなる閉じ込めを狙う雲母鉱物の核種固定化メカニズムの新解釈,放射性廃棄物の埋設処分において，地下環境中に放射性核種を閉じ込めるバリア性能が期待される天然岩盤には，核種を吸着する能力に優れた雲母鉱物が含有される．従来，核種と鉱物の相互作用については，鉱物を粉砕した粉末試料により調べられてきた．しかし，実際の地下の雲母は層状構造を有し，数cm程度の薄片形状で存在する．このため，核種と雲母鉱物が相互作用する場合，薄片の端に吸着するのみならず，層状構造内部へ核種が浸入，固定化されると考えられる．本研究では，薄片状雲母を用いた実験検討により，粉末試料ではわからなかった核種収着メカニズムを解明し，天然岩盤にさらなる核種閉じ込め性能を見出すことを目指す．,挑戦的研究(萌芽),中区分31:原子力工学、地球資源工学、エネルギー学およびその関連分野,放射性廃棄物,地層処分,核種移行,収着,拡散,雲母,花崗岩,固定化,核種固定化,バックエンド,原子力,,,,,,,,,,,,,,,,,,,,,,,,,,,,,,,,,,,,,,,,,,,,,
22K19001,国立研究開発法人日本原子力研究開発機構,本田 充紀,土壌粘土鉱物を利用した熱電変換材料の創製,熱電材料は無益な排熱を有用な電力へ変換する材料である。高い変換効率材料の多くは希少・有毒・高価で実用性に難がある。代替材料として注目されるMg-Si系やFe-Al系も合成過程が複雑という課題がある。代表者は溶融塩法を用いて汚染土壌から放射性Csを除去する研究過程で土壌粘土鉱物からMg2Siより高い熱起電力をもつ鉱物が出来ていることを偶然発見した。本研究では溶融塩法の各条件を系統的に変えてできた多結晶鉱物に対し種々のX線分析と第一原理計算を駆使し結晶構造を同定する。さらに構造と物性の相関を熱電３物性計測（ゼーベック係数、電気抵抗率、熱拡散率）から明らかにし効率よく熱電材料生成条件を明らかにする。,挑戦的研究(萌芽),中区分31:原子力工学、地球資源工学、エネルギー学およびその関連分野,熱電変換材料,土壌粘土鉱物,溶融塩,高温,風化黒雲母,熱電材料,熱電物性,X線分析,,,,,,,,,,,,,,,,,,,,,,,,,,,,,,,,,,,,,,,,,,,,,,,,
22K19000,佐賀大学,田中 徹,高不整合材料の電子物性制御によるフルスペクトル光触媒の開発,無尽蔵な太陽光と水を利用して貯蔵可能な水素を生成する人工光合成は，次世代エネルギー創製技術として期待されている。本研究では，従来の半導体混晶と異なるユニークなバンドエンジニアリングによりマルチバンドギャップを生成可能な高不整合半導体材料に着目し，赤外から可視，紫外までの光を吸収可能とする新しいフルスペクトル光触媒を開拓することを目的とする。,挑戦的研究(萌芽),中区分31:原子力工学、地球資源工学、エネルギー学およびその関連分野,高不整合材料,人工光合成,マルチバンドギャップ半導体,太陽光水素生成,,,,,,,,,,,,,,,,,,,,,,,,,,,,,,,,,,,,,,,,,,,,,,,,,,,,
22K18999,九州大学,森 昌司,ハニカム多孔体とナノ流体の連成による自己組織化マイクロ流路を活用した水電解の革新,過剰な発電分を水素として貯蔵する水電解技術の高度化が必須である。特に最近は導入コスト削減のため高電流密度化し小型化するニーズが急激に高まっている。そのときの限界は、電極が大量の気泡に覆われてしまう水の物質移動律速で発生する。したがって電極上の微細気泡をうまく排除し、水を電極面に如何に供給できるかが鍵となる。ナノ流体を沸騰させ、その中で伝熱面に付着させると自己組織化現象により蒸気の排出が促進されるように伝熱面に多孔質層が形成され、大幅な限界熱流束向上効果が得られた。そこで、同様にナノ流体中で電極面上にナノ粒子を付着させそれが大幅な水電解の性能が向上できることを実験的に実証する。,挑戦的研究(萌芽),中区分31:原子力工学、地球資源工学、エネルギー学およびその関連分野,水電解,ハニカム多孔質体,,,,,,,,,,,,,,,,,,,,,,,,,,,,,,,,,,,,,,,,,,,,,,,,,,,,,,
22K18998,九州大学,笹木 圭子,不純物として鉄を含む粘土鉱物を空間制御反応場とする可視光応答型光触媒複合体,天然鉱物資源として比較的存在量が多く、紫外光応答型光触媒であるアナターゼ（TiO2）と粘土鉱物の組み合わせにより、より低いエネルギーの可視光応答型光触媒複合体を合成する。粘土鉱物もTiO2もFe3＋をよく吸着すると考えられ、ここではFe3＋の局在性による触媒活性の変化について実験およびDFT計算によって明らかにする。対象とする光触媒反応はカーボンニュートラルの要となる糖から酸への分解とし、CO2ゼロエミッションにも貢献する。,挑戦的研究(萌芽),中区分31:原子力工学、地球資源工学、エネルギー学およびその関連分野,粘土鉱物,鉄,光触媒,異元素ドープ,ジオミメティクス,Fe(III)イオン,太陽光,鉄イオン,二酸化チタン,光触媒複合体,DFT計算,,,,,,,,,,,,,,,,,,,,,,,,,,,,,,,,,,,,,,,,,,,,,
22K18997,奈良先端科学技術大学院大学,柳田 健之,超高エネルギー分解能シンチレーション検出器の開発,シンチレーション検出器のエネルギー分解能が向上すれば、医療やセキュリティといった応用、元素分析などの基礎科学に大きな影響を与える。本研究では、光電変換素子とシンチレータ双方の特性を融合させることで、662 keV で 1% 以上のエネルギー分解能の達成を目指す。,挑戦的研究(萌芽),中区分31:原子力工学、地球資源工学、エネルギー学およびその関連分野,シンチレータ,,,,,,,,,,,,,,,,,,,,,,,,,,,,,,,,,,,,,,,,,,,,,,,,,,,,,,,
22K18996,名古屋大学,清水 裕彦,磁場勾配を用いた低速中性子ビーム無損失輸送の実用化研究,低速中性子ビームの無損失輸送を、平面状に配置された永久磁石を用いて発生した非一様磁場中で中性子の双極子能率が受ける加速度を用いて実現できることを実証し、新たな中性子導管の実用化及び具体的な応用方法を明らかにする。これによって基礎物理、物質研究から産業利用にわたる広範な利用分野で拡大する中性子需要を賄うための新たな基盤技術として実用的利用を開拓する。本方法による中性子輸送は、従来法に比べて組上精度や設置精度を引き下げることができるため、安価で高効率輸送を可能とするものである。,挑戦的研究(萌芽),中区分31:原子力工学、地球資源工学、エネルギー学およびその関連分野,中性子磁気光学,斜入射反射光学,冷中性子,中性子光学,勾配磁場,中性子科学,,,,,,,,,,,,,,,,,,,,,,,,,,,,,,,,,,,,,,,,,,,,,,,,,,
22K18995,東北大学,野上 修平,再結晶強化組織とイオン注入組織安定化による「再結晶脆化しない」超耐熱金属の新創生,本研究の目的は、これまでにない設計思想に立脚した「再結晶脆化しない」タングステン合金を創生し、実機器における有効性を実証することである。熱光起電力発電システムのエミッターや核融合炉ダイバータなどにおいて、耐熱性の観点からWの使用が検討されているが、高温に晒されることによる再結晶と、その後の粒成長、それらによる脆化（再結晶脆化）を要因とする劣化が課題とされている。本研究では、再結晶した組織に対し、合金化や分散強化といった技術に加え、ヘリウム注入による組織安定化技術を適用することにより、再結晶脆化しないW合金を創生し、この課題を打破する。,挑戦的研究(萌芽),中区分31:原子力工学、地球資源工学、エネルギー学およびその関連分野,再結晶脆化,タングステン,分散強化,ヘリウム注入,合金化,イオン注入,,,,,,,,,,,,,,,,,,,,,,,,,,,,,,,,,,,,,,,,,,,,,,,,,,
22K18994,東北大学,宇野 正起,自己促進反応による加速度的CO2鉱物固定メカニズムの解明,本研究では，(1) 天然反応帯の解析により，天然炭酸塩化における温度・圧力・流体組成を制約し，実効的な反応速度や流体供給速度を推定する．(2) アナログ物質実験により，反応速度や流体供給速度を系統的に変化させ，これらのパラメーターが反応誘起割れ・流体流動に与える影響を明らかにする．(3) 無次元数をもちいたモデル化により，天然およびアナログ実験を統一的に説明する炭酸塩化加速メカニズムを構築し，その加速化条件を提示する．以上より得られた知見をもとに天然のかんらん岩，蛇紋岩を炭酸塩化し，その反応加速条件を実証する．,挑戦的研究(萌芽),中区分31:原子力工学、地球資源工学、エネルギー学およびその関連分野,鉱物炭酸塩化,反応誘起破壊,反応誘起応力,蛇紋岩,ブルース石,マグネサイト,反応透水試験,二酸化炭素地層貯留,透水率,自己促進反応,かんらん岩・蛇紋岩,,,,,,,,,,,,,,,,,,,,,,,,,,,,,,,,,,,,,,,,,,,,,
22K18993,北海道大学,能村 貴宏,蓄熱触媒によるエクセルギー再生コプロダクション,本研究では、相変化物質のマイクロカプセル化技術を応用して蓄熱機能・放熱機能を持つ触媒、「蓄熱触媒」を開発する。さらに、蓄熱触媒の特徴を最大限に活用することで、通常の反応熱の熱制御からさらに高難度の技術領域である熱再生/循環（＝エクセルギー再生コプロダクション）技術の実現を目指す。これらの技術の達成により、廃熱レスの化学プロセスの実現が期待できる。,挑戦的研究(萌芽),中区分31:原子力工学、地球資源工学、エネルギー学およびその関連分野,エクセルギー再生,コプロダクション,触媒,蓄熱,熱制御,マイクロカプセル,反応,,,,,,,,,,,,,,,,,,,,,,,,,,,,,,,,,,,,,,,,,,,,,,,,,
23K17897,九州大学,片山 一成,有機結合型トリチウム形成現象を利用した新しいトリチウム分離・固定化技術の原理実証,本研究では、水生植物を利用して水からトリチウムを分離・固定化する革新的な分離技術の原理実証を目的とする。トリチウムを安全に管理した水生植物育成環境を整備し、トリチウム水中で、繁殖力の高い水生植物の育成実験を行い、有効な植物種を探索する。植物中に安定して蓄積される非同位体交換型の有機結合型トリチウムを定量し、育成条件との関係性を明らかにしてトリチウム分離・固定化効率の最適化を図る。水生植物をトリチウムの固定化に利用した例はこれまでになく、既存技術とは全く異なる原理を適用するものであり、挑戦的な研究である。,挑戦的研究(萌芽),中区分31:原子力工学、地球資源工学、エネルギー学およびその関連分野,トリチウム,水生植物,有機結合型トリチウム,同位体交換,有機結合,光合成,,,,,,,,,,,,,,,,,,,,,,,,,,,,,,,,,,,,,,,,,,,,,,,,,,
23K17896,高知大学,野口 拓郎,海底熱水活動を起源とする微細気泡化ガスは、周辺海域への環境影響評価を変えうるか？,深海の高圧環境下において、海底から噴出後の気泡の挙動に関する理解は進んでいない。ファインバブルの保存性を鑑みると、海底資源開発における漏洩発生時の広範囲への物質拡散など、これまで認知されてこなかった環境指標となる可能性がある。,挑戦的研究(萌芽),中区分31:原子力工学、地球資源工学、エネルギー学およびその関連分野,微細気泡,海底熱水活動,海底資源,環境影響,,,,,,,,,,,,,,,,,,,,,,,,,,,,,,,,,,,,,,,,,,,,,,,,,,,,
23K17895,大阪大学,村田 勲,BNCTの深部腫瘍治療実現のための中性子照射プロトコルの提案,ホウ素中性子捕捉療法(BNCT)は、高いがん治療効果を有するが、深部に存在するがんの治療ができない。本研究では「熱外中性子」というBNCTに使用する特殊な中性子の人体内の輸送を3つの物理指標に分割し、検討を加えることで、総合的性能として深部照射の実現を目指す。具体的には以下について検討する。,挑戦的研究(萌芽),中区分31:原子力工学、地球資源工学、エネルギー学およびその関連分野,BNCT,深部照射,多門照射,Current/Flux比,照射プロトコル,,,,,,,,,,,,,,,,,,,,,,,,,,,,,,,,,,,,,,,,,,,,,,,,,,,
23K17894,静岡大学,近田 拓未,ガンマ線照射によるトリチウム除染技術の開拓,本研究は、核融合炉の実現に向けて最重要課題の一つである、材料中に蓄積したトリチウムの除染に関する新技術に取り組むものである。トリチウムはプラズマ容器の内壁を構成する材料中に大量に滞留することが懸念されているが、近年、室温でのガンマ線照射によってセラミックス被覆中の水素同位体濃度が減少することが見出されたことから、この効果がプラズマ容器を構成する材料に適用できるか検証することで、新しい除染手法を提案する。,挑戦的研究(萌芽),中区分31:原子力工学、地球資源工学、エネルギー学およびその関連分野,トリチウム,除染,ガンマ線,タングステン,,,,,,,,,,,,,,,,,,,,,,,,,,,,,,,,,,,,,,,,,,,,,,,,,,,,
