awardnumber,organization,name,title,abstract,section,review_section,keyword1,keyword2,keyword3,keyword4,keyword5,keyword6,keyword7,keyword8,keyword9,keyword10,keyword11,keyword12,keyword13,keyword14,keyword15,keyword16,keyword17,keyword18,keyword19,keyword20,keyword21,keyword22,keyword23,keyword24,keyword25,keyword26,keyword27,keyword28,keyword29,keyword30,keyword31,keyword32,keyword33,keyword34,keyword35,keyword36,keyword37,keyword38,keyword39,keyword40,keyword41,keyword42,keyword43,keyword44,keyword45,keyword46,keyword47,keyword48,keyword49,keyword50,keyword51,keyword52,keyword53,keyword54,keyword55,keyword56
19K13770,一橋大学,遠藤 貴宏,シェアリング・エコノミーに関する非市場戦略の実施プロセス：ライド・シェアを中心に,シェアリング・エコノミーの特徴として、サービス提供者と、利用者がインターネット上でその都度マッチングされる点が挙げられる。例えば、ライド・シェア(rideshare)では、自家用車を運転するスキルを持つサービス提供者と、移動手段を模索する利用者がマッチングされる。ライド・シェアの導入は北米を中心に急速に拡大していったのに対し、日本においては規制・ルール上の問題もあり、非常に限定的である。,若手研究,小区分07080:経営学関連,組織論,ロビー,非市場戦略,歴史的な発展,ネットワークオーケストレーション,シェアリングエコノミー,ロビー活動,正当性,既存参入企業,新規参入企業,反対,ギグエコノミー,制度,ライドシェア,プラットフォームエコノミー,ディスコース,実施,日本,,,,,,,,,,,,,,,,,,,,,,,,,,,,,,,,,,,,,,
19K13769,一橋大学,孫 康勇,The digitalization of corporate innovation process: A comparison study of Japanese and Chinese companies,"This research examines the role of digital technologies (e.g., AI, Big Data, IoT, etc.) in the innovation process of companies and further identifies managerial actions at both the organizational and process levels that are needed to successfully utilize digital technologies in managing innovations. This research uses a comparative case study method to examine cases of Japanese and Chinese companies. The objective is to advance the research on innovation management and bridge the gap between research literatures on innovation and digital technology.",若手研究,小区分07080:経営学関連,innovation,digital,digitalization,,,,,,,,,,,,,,,,,,,,,,,,,,,,,,,,,,,,,,,,,,,,,,,,,,,,,
19K13768,一橋大学,カン ビョンウ,特許ライセンス戦略に関する実証研究,企業のオープンイノベーションへの取り組みを進めるうえで、技術市場の確立は重要な問題である。本研究は、技術市場の一例として特許市場に注目し、特許ライセンスの戦略の実証研究を通じ、技術経営の観点から企業の知的財産権ライセンス戦略及び技術市場のメカニズム（自社技術を外部に公開、または外部技術を自社に取り入れ、等）を明らかにする。,若手研究,小区分07080:経営学関連,知識創造メカニズム,特許ライセンス,標準化,標準必須特許,,,,,,,,,,,,,,,,,,,,,,,,,,,,,,,,,,,,,,,,,,,,,,,,,,,,
19K13767,筑波大学,佐藤 秀典,日本企業の変革と迷走,「企業を取り巻く環境は変化し続けている。生き残るためには、企業もまた変化し続けなければならない。」ということが当然であると考えられている。しかし実際には、日本を代表する企業であっても変革を繰り返すなかで強みを見失い業績を悪化させて迷走してしまうケースも珍しくない。,若手研究,小区分07080:経営学関連,組織レジリエンス,組織事故,組織変革,戦略変更,組織アイデンティティ,戦略転換,センスギビング,センスメイキング,一貫性,,,,,,,,,,,,,,,,,,,,,,,,,,,,,,,,,,,,,,,,,,,,,,,
19K13766,茨城大学,原口 春海,製造業における人的要因を考慮した検品ツールの導入と効果に関する研究,製造業の多くは製品の品質を管理保証するために品質管理部門が設置されている．品質管理部門においても検品作業等の自動化が進んでいる一方で，中小企業の多くは未だに人手による品質チェックを行っている．無論，技術的には機械による自動チェックが可能である現場も少なくないが，自動化に二の足を踏む理由として「一気に自動化を実現するのが困難である」ことと「自動化による作業員への効果が明確でない」点が挙げられる．そこで本研究では，歯科治療用器具製造業を対象に品質管理部門への品質検査ツールの段階的開発と導入の支援及び導入による作業者への効果を定量的に評価する．,若手研究,小区分07080:経営学関連,生産管理,作業者訓練,人的要因,機械学習,検品作業,品質管理,生産システム,ニューラルネットワーク,品質検査,製造業,検品ツール,,,,,,,,,,,,,,,,,,,,,,,,,,,,,,,,,,,,,,,,,,,,,
19K13765,北海道大学,馬 嘉繁,現代中国国有企業における雇用改革の仕組み及び労務管理システムの実相,本研究では、移行期の中国国有企業における雇用管理の内面的な構造やメカニズムの転換、及びそのインパクトを解明し、国有企業雇用での真の特質をつかむ。また、本研究は実証研究を目指すため、現地調査・検討の際にして、企業の制度や現地政府の政策面のみならず、労働現場での実情、改革・管理制度の実効性についても重点的に考察する。,若手研究,小区分07080:経営学関連,中国雇用改革,中国国有企業,コロナ禍の実態調査,実態調査,企業「民主的管理」,労使関係,中国国有企業改革,中国雇用システム,中国労働市場,,,,,,,,,,,,,,,,,,,,,,,,,,,,,,,,,,,,,,,,,,,,,,,
20K13610,岩手県立大学宮古短期大学部,鈴木 将人,製品機能のオーバーシュートに関する経験的研究,本研究は、製品機能のオーバーシュートに関する経験的研究を行う。オーバーシュートとは、企業間競争の結果として製品が持つ機能・性能が過剰に供給され、その水準が顧客の求めるレベルを超える現象を指す。オーバーシュートは、製品のコモディティ化を促進し価格競争を生じさせることで、企業の利益獲得に影響を与える。本研究は、オーバーシュートを理論的・経験的に検討し、どのような製品機能がオーバーシュートと関連があるのかを分析する。,若手研究,小区分07080:経営学関連,製品機能,オーバーシュート,経営戦略,コモディティ化,,,,,,,,,,,,,,,,,,,,,,,,,,,,,,,,,,,,,,,,,,,,,,,,,,,,
20K13609,活水女子大学,前田 瞬,医療の質と経営の質を相互に高めるための医業経営データ分析環境のモデル構築,本研究は、第1に、システムが備えるべき要件や具体的機能を解明することである。第2に、システムのモデル構築を行うことである。第3に、構築したモデルの現実の医療機関への適用可能性と課題を解明することである。,若手研究,小区分07080:経営学関連,医業経営,医療情報システム,モデル構築,内部コード,医療の質,経営の質,情報品質,内部コード設計,アジャイルソフトウェア開発,データの可視化,意思決定支援,意思決定支援システム,ブロックチェーン,エンドユーザ・コンピューティング,タイムスタディ,組織的情報品質改善活動,根拠に基づいた経営,,,,,,,,,,,,,,,,,,,,,,,,,,,,,,,,,,,,,,,
20K13608,福岡大学,大上 麻海,外国人従業員の適応を促進する二種類の環境要因に関する研究,本研究の目的は，母国およびホスト国の要因が外国人従業員の適応およびその管理施策に与える影響を明らかにすることである。,若手研究,小区分07080:経営学関連,異文化適応,外国人従業員,メンタリング,メンター,介護職,環境要因,,,,,,,,,,,,,,,,,,,,,,,,,,,,,,,,,,,,,,,,,,,,,,,,,,
20K13607,流通科学大学,柿沼 英樹,日本企業におけるタレントマネジメントの理論化と実証的検討,本研究では、欧米発の枠組みであるタレントマネジメントが日本企業の人事管理とその革新にもたらす意味を検討するために、日本企業におけるタレントマネジメントの実践について、複数の観点から調査を行い、その実態と今後の展望を明らかにする。,若手研究,小区分07080:経営学関連,タレントマネジメント,戦略的人的資源管理,日本型人事システム,計量書誌学,人事管理哲学,人事管理施策,従業員知覚,日本型人事管理,計量書誌学的分析,人的資源管理,日本企業,人事改革,,,,,,,,,,,,,,,,,,,,,,,,,,,,,,,,,,,,,,,,,,,,
20K13606,大阪商業大学,中嶋 貴子,ソーシャル・ビジネスにおけるアカウンタビリティが経営持続性に及ぼす影響の研究,本研究では、ソーシャル・ビジネスを実践するNPOや社会的企業による説明責任の履行をアカウンタビリティに基づく組織的行為と捉え、それらの行為が組織内外のステークホルダーにどのような変化を及ぼし、組織の経営持続性にどのような影響を与えるのか検証を試みる。本研究の目的は、ソーシャル・ビジネスの供給と社会的包摂の促進に資する組織に対し、新たな経営指針の提供を試みることにある。また、本研究を発展させることによって、多様性な担い手による持続可能な地域や新しい公共の実現に向けて、普遍的かつ革新的な価値の創造を追究するNPOや社会的企業の経営持続性に資する成果を目指すものである。,若手研究,小区分07080:経営学関連,NPO,経営持続性,アカウンタビリティ,ソーシャルビジネス,コミュニティビジネス,社会的企業,プログラム・オフィサー（PO）,市民社会,マルチステークホルダー,ソーシャル・ビジネス,プログラム・オフィサー,事業承継,市民参加,非営利組織（NPO）,持続性,ステークホルダー,,,,,,,,,,,,,,,,,,,,,,,,,,,,,,,,,,,,,,,,
20K13605,同志社大学,鈴木 智気,サーバント・リーダーシップの形成プロセスと動態的相互作用に関する探索的事例研究,本研究は、具体的には以下の課題を論理探索的な事例研究により明らかにすることを目的とする。リーダーが組織内にSLを形成するプロセスにおいて、リーダーはどのようにサーバン ト・リーダーとしての信念や行動パターンを修得していくのか。リーダーによるSLの形成プロセスにおいて、リーダー・フォロワー間ではどのような動態的相互作用が発生し、その相互作用はリーダーによるSLの修得にどのような影響を及ぼすのか。,若手研究,小区分07080:経営学関連,サーバント・リーダーシップ,サーバント・リーダーシップの学習・修得,サーバント・リーダーシップの困難性,サーバント・リーダーシップのプロセス,リーダーシップ形成,動体的相互作用,サーバント・リーダー,形成プロセス,リーダーシップ,質的研究,主体的受容,,,,,,,,,,,,,,,,,,,,,,,,,,,,,,,,,,,,,,,,,,,,,
20K13604,東海学園大学,丸山 一芳,伝統産地における地域イノベーションの知識経営研究,本研究の目的は、伝統産業などの産地における地域イノベーションについて、知識を鍵概念とした理論的モデルを構築することである。特に、オープンファクトリーと呼ばれる全国20か所以上の産地で開催されている地域イノベーションシステムを対象として比較事例分析を行う。オープンファクトリーとは、産地の企業が連携して、一定期間に複数の製造現場で普段は見せることのない工場や職人の技をあえて公開し、来場者と職人が直接交流・体験するイベントである。このオープンな交流から生まれるイノベーションのプロセスやメカニズムについて明らかとする。,若手研究,小区分07080:経営学関連,知識,知識経営,知識共有,知識移転,中小企業,産地,地域イノベーション,オープンファクトリー,知識創造,事業承継,産地一体型オープンファクトリー,産地の変革,DX,連携,イノベーションの普及,越境,伝統産業,オープンハウス,イノベーション,伝統的工芸品,地域企業,産地の連携,,,,,,,,,,,,,,,,,,,,,,,,,,,,,,,,,,
20K13603,中京学院大学,古田 成志,計画的変革、創発的変革を統合したラディカルな組織変革に関する研究,ラディカルな組織変革は、組織における既存の枠組みを根本的に変革することを意味する。ラディカルな組織変革は、計画的変革（トップ・マネジメント主体の戦略、組織構造などの転換）、創発的変革（ボトム層主体の小規模な変革の蓄積）と2つの有力な議論が存在する。しかし、双方の視点を統合した研究は十分に検討されていない。本研究では以下の2つの研究課題を設定する。①計画的、創発的な組織変革を共に遂行する日本企業の特徴を、テキストマイニングによる分析から導出する。②グラウンデッド・セオリー・アプローチに基づいた事例研究を行い、計画的、創発的変革を統合したラディカルな組織変革の仕組みを構築する。,若手研究,小区分07080:経営学関連,組織変革,ラディカルな組織変革,センスメーキング,経営環境の認識,テキストマイニング,有価証券報告書,計画的変革,創発的変革,組織のライフサイクル,組織変革論,,,,,,,,,,,,,,,,,,,,,,,,,,,,,,,,,,,,,,,,,,,,,,
20K13602,事業創造大学院大学,岸田 伸幸,地域連携訪問ケア現場改善支援システムおよび同効果測定システムの開発と実証,本研究では、在宅ケア（含居住系施設向）現場の時間研究／動作研究のための省力型遠隔観察システムを構築し、ケア現場に実装し業務改善効果を実証する。これにより、モバイル導入によりケア現場業務の作業研究を通じて改善活動が創出した経済価値を測定し、連携ケア支援情報システムの医療経済的な価値評価という課題解決に資する。,若手研究,小区分07080:経営学関連,在宅ケア,作業研究,業務改善,自律型小チーム,遠隔観察システム,地域包括ケアシステム,後ろ向き作業研究,映像統合監視システム,モバイル端末,居住系施設,経済性評価,作業分析,実証実験,COVID-19対策,延期,DX,,,,,,,,,,,,,,,,,,,,,,,,,,,,,,,,,,,,,,,,
20K13601,東京工科大学,山口 淳,Industry4.0の有効な導入に向けた改善活動の特徴マップ作成,経営環境変化の著しい中、製造現場が本来の能力を発揮するには、改善活動の高頻度な実施による現場の最適化が必要である。そして、近年注目のIndustry 4.0は日本企業の蓄積した組織能力を開花させる絶好の機会であるが、その性質は高度な自動化であり、改善活動の継続による柔軟性確保との両立が求められる。,若手研究,小区分07080:経営学関連,改善活動の継続組織能力,Industry 4.0,改善活動のマネジメント,特徴マップ,ルーティンダイナミクス,ダイナミックケイパ ビリティ,インクリメンタルイノベーション,改善活動の継続,特長マップ,組織能力,ダイナミックケイパビリティ,メタルーティン,改善活動,,,,,,,,,,,,,,,,,,,,,,,,,,,,,,,,,,,,,,,,,,,
20K13600,横浜市立大学,小沢 和彦,過去の組織変革の経験が今後の組織変革に与える影響の理論的・実証的解明,既存研究では、組織変革の先行要因として「過去の組織変革に関する経験」が注目されてきた。しかし、既存研究では「過去に組織変革を行った経験」がその後の組織変革活動に与える影響について一貫した実証結果をえられていない。くわえて、その経験が組織変革の成否（パフォーマンス）に与える影響についても十分に解明できていない。,若手研究,小区分07080:経営学関連,経営組織論,経営戦略論,組織変革,経営学,戦略的転換,組織ルーティン,組織学習,ダイナミクス,経営組織,,,,,,,,,,,,,,,,,,,,,,,,,,,,,,,,,,,,,,,,,,,,,,,
20K13599,早稲田大学,清水 たくみ,デジタル文化資本と企業のICT投資：大規模サーベイとフィールド調査の混合研究法,本研究では「デジタル文化資本」概念に着目し、企業のICT投資成否を左右する組織要因について明らかにする。日本企業に対する大規模サーベイ調査のパネルデータ分析を用い、デジタル文化資本がICT投資成否に与える影響を定量的に評価する。加えて、デジタル文化資本の高い企業群と低い企業群を比較したフィールド調査を実施し、どのような組織的実践がデジタル文化資本を高めることにつながるかについての定性分析を実施する。本研究により、ICT投資と企業業績の関係性に関する新たな理論的・実証的貢献が期待される。,若手研究,小区分07080:経営学関連,デジタル文化資本,企業パフォーマンス,ICT投資,ハイブリッドワーク,経営情報,デジタル組織,質問紙調査,デジタル・トランスフォーメーション,敏捷性,サーベイ,フィールド調査,混合研究法,ICT,企業業績,,,,,,,,,,,,,,,,,,,,,,,,,,,,,,,,,,,,,,,,,,
20K13598,明治大学,徐 玉琴,クロスボーダーM&Aの統合プロセスにおける企業間関係についての研究,本研究は、統合プロセスにおける買収企業と被買収企業の間のマネジメント体制と知識移転の関係に着目する。既存研究ではクロスボーダーM&Aの特徴に焦点を当て、多文化への寛容性、組織的自律性を考慮した統合アプローチが知識移転の促進に寄与すると論じられてきた。しかし、このような統合アプローチを採用した際、買収企業と被買収企業の間のマネジメント問題が生じるにもかかわらず、両者間のマネジメント体制については十分に検討されてこなかった。本研究では上述した統合アプローチを採用した際のマネジメント体制の実態を調査し、それをもとに組織間関係のマネジメントのモデルを解明する。,若手研究,小区分07080:経営学関連,クロスボーダーM&A,統合プロセス,組織間関係マネジメント,知識移転,人的資本,統合アプローチ,,,,,,,,,,,,,,,,,,,,,,,,,,,,,,,,,,,,,,,,,,,,,,,,,,
20K13597,東京理科大学,安田 直樹,海外子会社のリストラクチャリングに関する実証研究,本研究の目的は、多国籍企業が形成する海外子会社ネットワークのリストラクチャリングのメカニズムを、海外子会社に関するデータの統計的分析によって明らかにすることである。リストラクチャリングとは、海外子会社の撤退とそれに伴う多国籍企業内の資源の再配分を意味する。具体的には、業績の悪化による撤退ではなく多国籍企業が戦略的に行っている撤退に着目し、このような撤退が多国籍企業の子会社ネットワークに与える影響を明らかにする。,若手研究,小区分07080:経営学関連,海外子会社,リストラクチャリング,撤退,資源配分,,,,,,,,,,,,,,,,,,,,,,,,,,,,,,,,,,,,,,,,,,,,,,,,,,,,
20K13596,昭和女子大学,三浦 紗綾子,イノベーションの支援者と企業家の利害対立発生メカニズム：利害の経時的変化への注目,企業家は、イノベーションの実現に向けて他者を説得して支援を得ようとする。支援者は多様な動機でそこに参加しうるため、「適切な」支援者を動員しないと企業家との間に利害対立が生じてイノベーションが停滞すると指摘されている。,若手研究,小区分07080:経営学関連,イノベーション,企業家,資源動員,意図せざる結果,利害対立,企業に対する社会運動論,靴,靴産業,市場変化,産業変化,間接効果,足の健康,インソール,シューフィッター,健康靴,中敷調整,利害関係,協調,靴選び,シュー・フィッティング,ドイツ,小売業,経時変化,,,,,,,,,,,,,,,,,,,,,,,,,,,,,,,,,
20K13595,中央大学,楊 文賀,IoT援用した経営システムにおけるリアルタイムシミュレーションに関する研究,経営システムにIoTを導入することにより、組み込み機器やセンサーなど、多様なデバイスからネットワークを通じて、生産・サービスプロセスに関するデータがクラウドに集約される。本研究は、IoT技術を応用して収集したデータをリアルタイムに利用し、実在システムの変化にダイナミックに対応できるシミュレーションモデリングのアプローチを提案することを目指す。また、実在システムをサイバー空間に再現・分析することにより、得られた知見を実システムにフィードバックして本研究の有効性を検証する。,若手研究,小区分07080:経営学関連,シミュレーション,経営情報,経営システム,システムシミュレーション,IoT,,,,,,,,,,,,,,,,,,,,,,,,,,,,,,,,,,,,,,,,,,,,,,,,,,,
20K13594,拓殖大学,寺本 直城,日本企業における情報セキュリティー組織の継承プロセスに関する実践論的研究,情報通信技術（ICT）の発展によって，あらゆる組織の経営もますますそれらの技術に依存するようになっている．ICTは組織の経営の合理化に貢献してきたが，他方で，組織はICTの導入に伴うインシデントに対応する必要も増している．このような背景の中で本研究は，組織の情報セキュリティの体制をいかに構築していくかといったプロセスを，経営組織論と経営情報の2つの分野を架橋する形で明らかにする．,若手研究,小区分07080:経営学関連,経営組織論,情報セキュリティ,CSIRT,実践,高信頼性組織化,,,,,,,,,,,,,,,,,,,,,,,,,,,,,,,,,,,,,,,,,,,,,,,,,,,
20K13593,慶應義塾大学,河村 智行,デジタルトランスフォーメーションの推進に影響を与える組織文化の要因の研究,我が国の90%の企業が、デジタルトランスフォーメーション（DX）による成果を十分に出していないと言われており、企業は効率的にDXを推進できる能力の獲得が急務である。DXの効率的な推進には、DXの実施に必要な能力を有する人材の獲得・育成のみならず、組織文化の影響を理解し、組織の変革を進めることが重要である。,若手研究,小区分07080:経営学関連,デジタルトランスフォーメーション,組織文化,インタビュー,インターネット調査,共分散構造分析,インターネットアンケート,,,,,,,,,,,,,,,,,,,,,,,,,,,,,,,,,,,,,,,,,,,,,,,,,,
20K13592,流通経済大学,難波 和秀,事業承継の後継者である第三者の資源がアントレプレナーシップへ与える影響,本研究は事業承継の後継者となった社外の第三者を対象として、事業承継後のアントレプレナーシップ（企業家活動）のプロセスにおいて、企業の成長のために、新たに持ち込まれる第三者に依存したどのような資源がどのように作用するかを明らかにする。本研究によって、社外の第三者への事業承継を成功させるための知識を提供することができ、多様な事業承継の推進に貢献することができる。,若手研究,小区分07080:経営学関連,アントレプレナーシップ,事業承継,第三者承継,後継経営者,イノベーション,第三者後継経営者,資源,中小企業,ファミリービジネス,,,,,,,,,,,,,,,,,,,,,,,,,,,,,,,,,,,,,,,,,,,,,,,
20K13591,東日本国際大学,中村 暁子,自社外の人的ネットワークが女性従業員の垂直的キャリア形成意欲にもたらす影響,自社外のパーソナル・ネットワーク内にロールモデルはいるのか？,若手研究,小区分07080:経営学関連,ワーク・キャリア,昇進意欲,キャリア・アスピレーション,社会的ネットワーク,ジェンダー,組織,ロールモデル,女性管理職,人的ネットワーク,昇進・昇格,キャリア形成,,,,,,,,,,,,,,,,,,,,,,,,,,,,,,,,,,,,,,,,,,,,,
