awardnumber,organization,name,title,abstract,section,review_section,keyword1,keyword2,keyword3,keyword4,keyword5,keyword6,keyword7,keyword8,keyword9,keyword10,keyword11,keyword12,keyword13,keyword14,keyword15,keyword16,keyword17,keyword18,keyword19,keyword20,keyword21,keyword22,keyword23,keyword24,keyword25,keyword26,keyword27,keyword28,keyword29,keyword30,keyword31,keyword32,keyword33,keyword34,keyword35,keyword36,keyword37,keyword38,keyword39,keyword40,keyword41,keyword42,keyword43,keyword44,keyword45,keyword46,keyword47,keyword48,keyword49,keyword50,keyword51,keyword52,keyword53,keyword54,keyword55,keyword56
23K12532,事業創造大学院大学,浅野 浩美,高齢労働者のキャリアの転機と変化に関する研究,本研究では、①高齢期以降のキャリアの転機や変化について、幅広い者を対象にその内容やプロセスを把握するとともに、②転機や変化を経験しながら、労働市場において長く力を発揮し続けることを可能とする要因を明らかにする。労働者へのインタビューおよびWeb調査を行ったのち、期間を空けて同じ回答者を対象に再度Web調査を行い、転機や変化の現状や、働き方などを変えながら長く働き続けるための要因を明らかにする。さらに企業からインタビューを行い、③職場や組織のどのような取り組みが、労働市場において長く力を発揮することに有効なのかについても検討する。,若手研究,小区分07080:経営学関連,キャリア,高齢者雇用,転機,TEA,仕事価値観,心理的資本,,,,,,,,,,,,,,,,,,,,,,,,,,,,,,,,,,,,,,,,,,,,,,,,,,
23K12531,明治大学,小村 彰啓,持続可能な経営と世代間ギャップ：国際研究からみえる背景,次世代向けに現世代人材が行っている企業経営（特に持続可能な活動に関するもの）と、実際に次世代人材が欲する施策とに大きなギャップが存在している可能性がある。現世代の負債を負うことになるのは次世代であり、次代の意思決定を行う人材が、どのような企業活動を必要としているか理解する必要性は非常に高いといえよう。本研究では、国内外の協力者と共に次世代人材を対象とした国際的な大規模アンケートを行い、また、現世代が重要と考える次世代向けの施策を理解するため、専門家へのインタビューも実施する。これらの結果を定量分析することで、世代間ギャップが如何にして生じているのか、を明らかにする。,若手研究,小区分07080:経営学関連,持続可能な企業活動,世代間ギャップ,気候変動問題,次世代経営,持続可能な活動,,,,,,,,,,,,,,,,,,,,,,,,,,,,,,,,,,,,,,,,,,,,,,,,,,,
23K12530,法政大学,丹下 英明,中小企業の国際競争力向上：海外M&Aのマネジメントと国内事業との相乗効果創出,国内市場の縮小などを背景に、中小企業においても、海外企業を買収する「海外M&A」が増加している。しかしながら、海外M&Aに関する研究のほとんどが、大企業を研究対象としたものである。経営資源に乏しい中小企業がなぜ海外M&Aを選択するのか、買収先企業の探索や決定、国内事業との経営統合や相乗効果創出といった海外M&Aのマネジメントをどのように行っているのかについては、わかっていない。,若手研究,小区分07080:経営学関連,中小企業,海外M&A,マネジメント,グリーンフィールド投資,国内事業への還流,,,,,,,,,,,,,,,,,,,,,,,,,,,,,,,,,,,,,,,,,,,,,,,,,,,
23K12529,拓殖大学,寺本 直城,日本企業の情報セキュリティ強化のための組織コミュニケーションの検討,本研究では情報セキュリティに関係する人々の実践や相互行為に着目しながら，情報セキュリティを強化するのに有効な組織コミュニケーションとその現象の過程を明らかにする．,若手研究,小区分07080:経営学関連,経営組織論,情報セキュリティ,CSIRT,組織コミュニケーション,心理的安心,経営組織,,,,,,,,,,,,,,,,,,,,,,,,,,,,,,,,,,,,,,,,,,,,,,,,,,
23K12528,慶應義塾大学,岩尾 俊兵,「経営戦略の品質管理」に関する社会実証実験研究,これまで、人工物のひとつであり、戦略系コンサルティングファーム等からすれば生産物でもあるはずの経営戦略には、既存の品質管理・生産管理の手法は適用できないと考えられてきた。,若手研究,小区分07080:経営学関連,経営戦略,アクション・リサーチ,社会実証実験的経営学,品質管理,ビジネスモデル,働き方改革,事業創造,技術経営,プロジェクト・マネジメント,人工物の科学,実験経営学,,,,,,,,,,,,,,,,,,,,,,,,,,,,,,,,,,,,,,,,,,,,,
23K12527,明治大学,沼田 優子,日米の職場における組織市民行動賛美がもたらす弊害の実証研究,「仕事密着性 」、「組織市民行動」といった組織にとって望ましい行動・状態は、組織のパフォーマンスを上げることが先行研究から明らかになっている。一方で近年は、これらが従業員にとっては望ましくない影響を与え得ることも判明した。しかしこうした弊害のメカニズムは、まだ十分にわかっていない。ましてこの弊害に文化的差異が見られるのかに着目した研究は見当たらない。本研究は、仕事密着性が組織市民行動を介して「組織市民行動疲れ」に与える影響と、「組織支援認識」が与える調整効果について日米で検証し、その文化的差異を明らかにすることを目的とする。,若手研究,小区分07080:経営学関連,組織市民行動,組織市民行動疲れ,近位の離職意図状態,仕事の密着性,仕事密着性,組織支援認,,,,,,,,,,,,,,,,,,,,,,,,,,,,,,,,,,,,,,,,,,,,,,,,,,
23K12526,明海大学,古川 傑,KAMの記載事項と減損開示情報の情報価値抽出による新たな企業不動産戦略への応用,近年、財務報告の情報価値を高める施策が注目され、監査上の主要な検討事項(Key Audit Matters 以下、「KAM」という)の記載が義務付けられた。当該記載は、情報利用者の意思決定が改善されることを目的としたものであり、個別性のない画一的な記載では本来の目的を阻害する恐れも生じる。,若手研究,小区分07080:経営学関連,KAM,減損,企業不動産戦略,情報価値,,,,,,,,,,,,,,,,,,,,,,,,,,,,,,,,,,,,,,,,,,,,,,,,,,,,
23K12525,流通経済大学,難波 和秀,第三者承継における経営理念創出・融合プロセスと後継経営者特性の関係に関する研究,本研究は、第三者承継による事業承継において、経営哲学、理念の創出、融合、浸透の一連のプロセスをスムーズに実行し、社会的価値を維持、創出し、事業承継後に事業を維持、成長させるために必要とされる社外の第三者の後継経営者の特性、備えるべき指針を明らかにする。本研究によって得られた成果を、社会課題となっている事業承継の問題に活用することで、サステナブル社会の実現へ貢献することができる。,若手研究,小区分07080:経営学関連,第三者承継,事業承継,経営哲学・理念,アントレプレナーシップ,後継経営者,,,,,,,,,,,,,,,,,,,,,,,,,,,,,,,,,,,,,,,,,,,,,,,,,,,
23K12524,青森中央学院大学,姜 尚民,GVCのアップグレーディングと中小企業のマルチパートナーネットワークに関する研究,中小企業は、GVC（グローバルバリューチェーン）の供給業者として中核的役割を果たしているものの、継続的に国際競争力を向上しなければならない。こうした問いについて、本研究では、GVCの供給業者を対象にマルチパートナーネットワークが中小企業のアップグレーディングにどのような影響を及ぼすかについて、海外現地調査およびフォローアップ調査を実施する。さらに、本研究では、供給業者がアップグレーディング壁に直面する問題に対して、克服する対案的方法をモデルとして探索的解析することによって、現在または潜在的である供給業者の実務家に実践的な示唆を提示する。,若手研究,小区分07080:経営学関連,グローバルバリューチェーン,サプライヤー,国際化,戦略的行動,戦略的ネットワーク,インターナショナルアントレプレナー,中小企業,スタートアップ企業,アップグレーディング,マルチパートナーネットワーク,,,,,,,,,,,,,,,,,,,,,,,,,,,,,,,,,,,,,,,,,,,,,,
23K12523,長崎県立大学,森内 泰,多国籍企業のInternational Corporate Governance機能と海外事業業績への影響分析,本研究では、海外子会社マネジメント機能（International Corporate Governance:ICG)が企業の海外事業業績にどのような影響を与えるか明らかにすることを目指す。ICGとは、多国籍企業がその海外拠点を効率よく管理・運営するための内部管理制度・機能のことである。企業がその活動領域を海外に伸ばす際、国内事業とは異なる様々な内部管理制度・機能を求められるが、研究・実務両面でこの機能の明確化には至っていない。本研究は、どのような機能を企業が構築しているか、さらに各機能が企業の海外事業全体業績に与える影響を明らかにすることを目指すものである。,若手研究,小区分07080:経営学関連,Management Control,多国籍企業,海外現地法人,海外子会社管理,マネジメントコントロール,,,,,,,,,,,,,,,,,,,,,,,,,,,,,,,,,,,,,,,,,,,,,,,,,,,
23K12522,釧路公立大学,曽我 寛人,中小企業の海外進出における意思決定者の能力に関する研究,本研究では異文化、アントレプレナーシップ、国際的な実務という側面から、意思決定者の個人の能力を統合的に捉えて、海外進出する際に中小企業の意思決定者が持つべき能力の指標を検討及び開発することを目的とする。また、その指標により把握した能力が企業の国際化と関連するものでなければ、意思決定者の国際ビジネスに関連した能力とは言い難い。そこで、本研究では、その指標と企業の国際化との関係を定量的な分析により確認することも併せて実施する。,若手研究,小区分07080:経営学関連,国際ビジネス,文化的知性,起業志向,アントレプレナーシップ,意思決定,異文化理解,国際実務,,,,,,,,,,,,,,,,,,,,,,,,,,,,,,,,,,,,,,,,,,,,,,,,,
23K12521,京都大学,柳 淳也,アントレプレナーシップ概念を再考する：LGBTQの起業活動の質的分析,アントレプレナーシップは、日本語で「企（起）業家精神」等と訳される多義的な概念である。「ゼロから事業を立ち上げようとする精神」や「リスクに対して果敢に挑戦していく性質」「不確実性を伴う事業を開発し、組織化し、運営する能力と心構え」など多様な定義が存在する。本研究の目的は、LGBTQの起業家が、どのように戦略的に自身のアイデンティティをマネジメントし、コミュニティのネットワークを活用し、生きのびてきたかを明らかにすることである。それにより、アントレプレナーシップ概念を、より公平で正確で、かつより多様な観点が反映された包括的なものにすることを目指す。,若手研究,小区分07080:経営学関連,LGBTQ,企業家,マイノリティ・アントレプレナーシップ,セクシュアル・マイノリティ,ジェンダー・マイノリティ,クィア,クリティカル・マネジメント・スタディーズ,アントレプレナーシップ,質的研究,マイノリティ,セクシュアリティ,,,,,,,,,,,,,,,,,,,,,,,,,,,,,,,,,,,,,,,,,,,,,
23K12520,信州大学,藤野 義和,同族関与の維持理由解明の実証研究：医薬業の考察を通じた新たな企業統治論の創造,本研究では、他産業より長く同族が経営に関与し続けた医薬業を対象に、当事者の統治を巡る言説を実践レベルで問い直すことによって、同族が資本の論理によらず関与し続ける現象が成立したメカニズムを解明し、現実に即した新たな統治論の導出を試みる。,若手研究,小区分07080:経営学関連,医薬品業,同族企業,善い経営,統治のテクノロジー,権力の正当性,企業統治観,,,,,,,,,,,,,,,,,,,,,,,,,,,,,,,,,,,,,,,,,,,,,,,,,,
23K12519,新潟大学,丸山 峻,戦略的人的資源管理が障害者の雇用促進と職場定着にもたらす影響を左右する条件,戦略的人的資源管理が、障害者の雇用促進や職場定着にもたらす影響はこれまでほとんど明らかにされてこなかった。本研究の目的は、戦略的人的資源管理が企業の障害者雇用率と障害のある従業員の職場定着率にもたらしている影響を明らかにし、障害のある従業員に対するどのような支援がその影響を左右するのかを検討することである。そのために、戦略的人的資源管理と障害者雇用率、障害のある従業員の職場定着率との関係について分析を行う。また、それらの関係の調整変数として、障害のある従業員に対する社内外からの支援について、検討する。さらに、交差遅延効果モデルから、それらの関係の因果の方向性を明らかにすることを試みる。,若手研究,小区分07080:経営学関連,障害者雇用,戦略的人的資源管理,インクルージョン,人事管理,,,,,,,,,,,,,,,,,,,,,,,,,,,,,,,,,,,,,,,,,,,,,,,,,,,,
23K12518,一橋大学,松本 行平,国際展開にむけた海外直接投資がリコールに与える影響の実証分析,短期的な利益を追求する経営者は製品の安全性を軽視し、リコールの可能性を高める傾向があることが先行研究で明らかにされているが、リコールの要因に関する研究は未だ限られている。企業の資源や経営者の注意には限りがあるとすると、経営者が短期的な利益を追求していなくても、長期的な成長のために、国際展開といった多大な資源や注意を必要とする戦略を追求すれば、製品の安全性に向けられる資源や注意が乏しくなり、リコールの可能性が高まることが考えられる。本研究は国際展開にむけた海外直接投資がリコールに与える影響を検証する。,若手研究,小区分07080:経営学関連,製品のリコール,国際展開,海外直接投資,,,,,,,,,,,,,,,,,,,,,,,,,,,,,,,,,,,,,,,,,,,,,,,,,,,,,
23K12517,東京工業大学,小野田 敬,アカデミアにおいてオープンイノベーションを促進する研究コラボレーション手法,技術経営分野において検討が進むオープンイノベーションは、昨今ではインダストリのみならずアカデミアも巻き込んだ広がりを見せているが、これを促進する研究コラボレーション手法の開発や実装まで至っておらず、その対応が課題となっている。,若手研究,小区分07080:経営学関連,オープンイノベーション,研究コラボレーション,オープンサイエンス,共創,アカデミック・エンゲージメント,,,,,,,,,,,,,,,,,,,,,,,,,,,,,,,,,,,,,,,,,,,,,,,,,,,
23K12516,立命館大学,SUOLINGA SUOLINGA,,"In Japan, the number of enterprises employ international workers has increased significantly in the past decade. And small-medium-sized enterprises (SMEs) are the major employers of foreign migrant workers. To understand how different types of international workers have worked in Japanese firms, and how Japanese firms are strategically developing and adjusting their International HRM approaches, this study adopts a qualitative research method to investigate the foreign worker management issues in SME sectors.",若手研究,小区分07080:経営学関連,career capital,IHRM framework,foreign migrant workers,skill construction,SME internationalization,International workers,Japanese SMEs,Technical interns,SIE,Global mobility,,,,,,,,,,,,,,,,,,,,,,,,,,,,,,,,,,,,,,,,,,,,,,
23K12515,北見工業大学,ウ アテイ,生産効率化に向けた人材力の個人差低減方法に関する研究,人材力向上の主要な要因に関しては、作業者の適性、知識・経験及び作業者の満足度、職業性ストレスなどの個人差が挙げられる。本研究では、VRや画像処理などの技術を用いて作業適性を評価する方法を提案し、知識・経験の個人差を低減するため作業教育支援方法を提案する。また、作業員の定着率を向上させるため複数年度に渡って継続的な変化を調査・分析することにより熟練作業者を含む作業者の職務満足度、職業性ストレスに影響する要因を明らかにする。さらに、客観的な視点から作業者の行動・工程分析および作業負担の評価により作業者の作業負担を低減し、定着率向上に有効な施策を明確にする。,若手研究,小区分07080:経営学関連,生産効率,人材力,職務満足,職業性ストレス,生産効率化,人材確保,作業負担,定着率,,,,,,,,,,,,,,,,,,,,,,,,,,,,,,,,,,,,,,,,,,,,,,,,
24K16457,立命館アジア太平洋大学,小澤 朋之,三方よし経営者と環境会計,本研究では、以下の問いに答えることにより、現在のCSRの概念と類似する三方よしの経営哲学が、企業の環境会計に関してプラスの影響を与えているかを検証し、それに伴う財務業績への影響を検証することにより、日本古来の三方よしの経営哲学が非財務業績と財務業績の両方に与える影響を明らかにする。,若手研究,小区分07080:経営学関連,三方よし,環境会計,ESG,Inclusion,,,,,,,,,,,,,,,,,,,,,,,,,,,,,,,,,,,,,,,,,,,,,,,,,,,,
24K16456,岡山理科大学,渡辺 圭史,地域エコシステムが生存するメカニズムを理論化する研究,本研究の目的は地域エコシステムが生存している時に、その内部メカニズムがどのように機能しているのかを明らかにすることである。本研究の調査では、岡山県真庭市の真庭バイオマス発電所に参加している複数の組織が協調関係を構築し、その協調の効果が他の組織に波及することが要因となって真庭市という地域エコシステム全体が健全に生存しているメカニズムを明らかにする。,若手研究,小区分07080:経営学関連,エコシステム,資源依存,制度,組織化,地域活性化,,,,,,,,,,,,,,,,,,,,,,,,,,,,,,,,,,,,,,,,,,,,,,,,,,,
24K16455,京都産業大学,森口 文博,ベンチャー企業における事業転換が出口戦略に与える影響,企業は、自らの事業がうまくいかない時に、現在の事業を継続するのか、方向転換するのかを検討する必要がある。企業の事業転換については、その要因や意思決定プロセスに焦点を当てた研究がなされており、本研究代表者も博士論文にて、事業転換の種類を大小に分類したうえで、事業転換が生じる要因とプロセスを分析した。一方で、事業転換した企業のその後を追跡した研究蓄積は少ないのが現状である。本研究では、事業転換がその後のベンチャー企業に与える影響について調査し、既存の事業転換前に関する理論との統合を試みる。これにより、ベンチャー企業が行う事業転換に関する研究を進展させることが期待できる。,若手研究,小区分07080:経営学関連,ピボット,事業転換,出口戦略,IPO,M&A,,,,,,,,,,,,,,,,,,,,,,,,,,,,,,,,,,,,,,,,,,,,,,,,,,,
24K16454,中京大学,濱田 知美,開発競争や製品需要の時系列変化をふまえた、企業の研究開発戦略のあり方に関する研究,本研究では、日本の製造業の持続的な成長に不可欠な、効果的な企業の多角化・新規事業開拓戦略のための、研究開発戦略および技術知識の探索と活用のあり方を、特許情報をベースとした企業の技術知識の量的分析から探る。具体的には、①多角化後に研究開発を促進および技術力を蓄積・活用するための施策、②自前主義的な研究開発とオープン・イノベーション的開発との適切なバランス、そして③収益化や業績向上につながる多角化に資する研究開発上の条件の3つを、産業全体の研究開発競争の状況や産業内の技術および市場の成熟度を踏まえて動態的に分析して明らかにする。,若手研究,小区分07080:経営学関連,経営学,技術経営,研究開発,特許分析,ネットワーク分析,,,,,,,,,,,,,,,,,,,,,,,,,,,,,,,,,,,,,,,,,,,,,,,,,,,
24K16453,ビジネス・ブレークスルー大学,永田 正樹,管理者コーチングが部下の職務態度・行動に与える効果性の研究,まず複数企業に対して実施したインタビューの結果を質的に分析し、管理者コーチング行動の次元を抽出する、次に、部下の職務態度・行動を成果変数として、抽出された、管理者コーチング行動の次元との関係について定量的に検討する。さらに、上記の分析により見出された次元を、他の業種、企業規模に対するアンケート調査で検証し尺度化する。最後に、管理者コーチングが部下のリフレクションを支援し、成果を生み出すメカニズムを解明し、効果性の高い管理者コーチングの実践手法を提案する。,若手研究,小区分07080:経営学関連,マネジリアル・コーチング,,,,,,,,,,,,,,,,,,,,,,,,,,,,,,,,,,,,,,,,,,,,,,,,,,,,,,,
24K16452,立教大学,村嶋 美穂,コロナ感染症が企業のESG評価と組織レジリエンスの関係性に与える影響,本研究では、新型コロナ感染症流行が企業のESG評価とレジリエンスの関係性に与える影響につき定量的手法を用いて日本企業を対象に分析するとともに、その結果をESGの概念が浸透している欧米とまだ初期段階にある東南アジア（ベトナム等）と比較することでその特徴を明らかにする。また、日本についても国際比較することで、日本独自の特徴や課題を把握する。,若手研究,小区分07080:経営学関連,新型コロナウイルス感染症,ESG評価,組織レジリエンス,国際比較研究,定量的・定性的分析,,,,,,,,,,,,,,,,,,,,,,,,,,,,,,,,,,,,,,,,,,,,,,,,,,,
24K16451,中央大学,彭 思雄,認知構造の多様性がチームの創造性に与える影響：脳波データを活用して,,若手研究,小区分07080:経営学関連,,,,,,,,,,,,,,,,,,,,,,,,,,,,,,,,,,,,,,,,,,,,,,,,,,,,,,,,
24K16450,麗澤大学,遠藤 寛士,計画的組織変革の実現に向けた組織成員の創発的変化：変革プロセスの単一ケース分析,組織変革研究は、経営者が組織を環境変化へ適応させ、存続させるための計画的変革の手法を開発してきた。反面、それら計画と、組織成員が自発的に組織を内部から変える創発的変革との関係については未解明な点が残る。計画的変革の場合、経営者は合理的計画に基づき変革を図るが、それら計画は組織成員の自発的変化の理由を特定し作用するものではない。一方、成員が経営者の計画下で自己のアイデンティティを更新し、自らの行為を変革の実現に資するものへと変える場合、計画のみならず、その裏面で変革が実現する理由が説明可能となる。本研究は、単一ケース分析により経営者の計画的変革下における組織成員による創発的変革の役割を解明する。,若手研究,小区分07080:経営学関連,組織変革,組織アイデンティティ,組織アイデンティフィケーション,計画と創発,歴史的組織研究,,,,,,,,,,,,,,,,,,,,,,,,,,,,,,,,,,,,,,,,,,,,,,,,,,,
