awardnumber,organization,name,title,abstract,section,review_section,keyword1,keyword2,keyword3,keyword4,keyword5,keyword6,keyword7,keyword8,keyword9,keyword10,keyword11,keyword12,keyword13,keyword14,keyword15,keyword16,keyword17,keyword18,keyword19,keyword20,keyword21,keyword22,keyword23,keyword24,keyword25,keyword26,keyword27,keyword28,keyword29,keyword30,keyword31,keyword32,keyword33,keyword34,keyword35,keyword36,keyword37,keyword38,keyword39,keyword40,keyword41,keyword42,keyword43,keyword44,keyword45,keyword46,keyword47,keyword48,keyword49,keyword50,keyword51,keyword52,keyword53,keyword54,keyword55,keyword56
21K13345,京都大学,Wang Tao,,"Small and medium-sized enterprises navigate and operate in a web of different and sometimes contradictory governance modes across corporate, political and social domains. Drawing on organization theory, and non-market strategy literature, this project proposes the concept of cultural imprinting, including a socio-spatial view of community imprinting and a political-ideological view of norm imprinting. Adopting a mixed research design, this project empirically demonstrates how SMEs in China manage the interdependence between self-governance, market-based standards, and multi-stakeholder rules.",若手研究,小区分07080:経営学関連,Corporate philanthropy,Place,Institution,Entrepreneurs,Networking,Crisis,Relisience,Emotion,Corporate social action,Corp. political activity,Imprinting,Community,SMEs,,,,,,,,,,,,,,,,,,,,,,,,,,,,,,,,,,,,,,,,,,,
21K13344,北陸先端科学技術大学院大学,中田 泰子,コロナ禍におけるイノベーション創出の「場」の最適化,コロナ禍となった現状において、従来、企業のオープンイノベーションへの取り組みで最も広く用いられ、大学のシーズアピールなど産学連携を促進するイノベーションの「場」であった展示会が、中止やオンライン開催に切り替わった。また、リアル開催であっても出展数や人数の制限があり、それを補うためにオンラインを併用したハイブリット型の展示会も開催されている。このようなオンライン化はさらに進むと思われるが、イノベーション創出や共創の「場」である展示会におけるオンラインの使用には試行錯誤の状態が続いている。,若手研究,小区分07080:経営学関連,産学連携,コロナ禍,URA,マッチング,場,モチベーション,創造性,イノベーション,オープンイノベーション,共創,場の理論,,,,,,,,,,,,,,,,,,,,,,,,,,,,,,,,,,,,,,,,,,,,,
21K13343,一橋大学,パドロン・エルナンデス イバ,,"This project addresses the perennial question of ""How do global and local actors interact in institutional maintenance and change?"" through two studies. The first study explains the behavior of multinational and domestic fast food chains as they drove and responded to the veganism trend across different countries. The second study unpacks formal and informal institutions in Japan surrounding organic food and geographical indication that were set in motion as Japan ratified bi- and multilateral economic partnership agreements with articles on rule harmonization.",若手研究,小区分07080:経営学関連,organization theory,international business,innovation,institutional change,food,sustainability,green food,nlp,,,,,,,,,,,,,,,,,,,,,,,,,,,,,,,,,,,,,,,,,,,,,,,,
21K13342,東京工業大学,Ho QuangBach,心理的資本醸成のための遠隔会議を通じた感情の共創に関する研究,従業員の成長の源泉となる心理的資本はポジティブ感情によって醸成される。だが、どのような感情の創造プロセスが心理的資本の醸成を促すのかは明らかにされていない。この課題に対し、本研究はポジティブ感情の共創に着目し、遠隔会議を対象に時系列分析を用いる。遠隔会議を通じたポジティブ感情の共創が心理的資本の醸成に与える影響を明らかにすることが研究目的である。本研究を達成することで、相互作用を通じた従業員の成長に関する新たな学術的知見を加え経営学の発展に貢献する。さらに、遠隔会議を通じた心理的資本の醸成について分析することで、テレワークの推進における業務パフォーマンスの向上に寄与できる。,若手研究,小区分07080:経営学関連,生体計測,心理的資本,ポジティブ感情,テレワーク,従業員,テクノロジー,バーチャルオフィス,ワークデザイン,遠隔会議,感情,,,,,,,,,,,,,,,,,,,,,,,,,,,,,,,,,,,,,,,,,,,,,,
21K13341,東北大学,赤間 愛理,中小企業の業績向上に資する知的財産活動及び知的財産活動支援,本研究の目的は「中小企業の業績に資する知的財産活動(以下知財活動)と知財活動支援はどのようなものか」を解明することである。知財活動に積極的に取り組んでいる中小企業群は、業績が相対的に好調であることが指摘されている。しかし、既存研究では知財活動及び知財活動支援が企業業績とどのように結び付くのかというプロセスは充分に明らかになってはいない。また資源に制約のある中小企業における知財活動は支援機関のサポートと共に推進されるケースが多く、支援機関の果たす役割も明らかにする必要がある。本研究では中小企業及び支援機関等へのインタビューから知財活動の推進が企業業績に与える影響を明らかにする。,若手研究,小区分07080:経営学関連,中小企業,知的財産活動,知的財産権ミックス,知的財産権マネジメント,業績向上,知的財産活動支援,知的財産マネジメント,中小企業支援,融資,事業性評価,オフバランス取引,資金調達,,,,,,,,,,,,,,,,,,,,,,,,,,,,,,,,,,,,,,,,,,,,
21K13340,北海道大学,須田 比奈子,対境担当者間の協働を促進する統合装置と企業メッセージの関係に関する研究,本研究では、利害の異なる多様なステークホルダーの組織に対するさまざまな期待を組織内に取り入れ、循環させ、調整を行い、組織の意思決定につなげることを対境担当者の重要な役割と捉え、組織内に存在する複数の対境担当者間の協働を実現する能力を組織のダイナミック・ケイパビリティ (環境適応能力) の構成要素と位置付ける。本研究では、日本企業における対境担当者のコミュニケーション活動に焦点をあてて、以下の2つのことを明らかにする。,若手研究,小区分07080:経営学関連,対境担当者,ステークホルダー・マネジメント,分化と統合,調整メカニズム,組織認識論,組織過程,統合装置,企業メッセージ,,,,,,,,,,,,,,,,,,,,,,,,,,,,,,,,,,,,,,,,,,,,,,,,
22K13491,熊本学園大学,松尾 健治,組織におけるスティグマとレジリエンスのメカニズム,この研究の目的は、組織におけるスティグマに対して、どのような場合に、なぜレジリエンスを持つことができるのかを明らかにすることである。スティグマとは、社会で逸脱者と見なされた人々に付与されるネガティブなラベルのことである。組織内で集団や個人にスティグマが付与されることは珍しくない（例えば、斜陽部門、窓際族）。従来、スティグマを付与されると、それを受け入れてしまわざるをえないことが前提とされてきた。どのような場合に、なぜレジリエンスを持つことができるのかを明らかにすることによって、集団や個人のモチベーション、パフォーマンス向上を考える手がかりとなることが期待できる。,若手研究,小区分07080:経営学関連,スティグマ,レジリエンス,創造性,独裁的リーダーシップ,インクルージョン,,,,,,,,,,,,,,,,,,,,,,,,,,,,,,,,,,,,,,,,,,,,,,,,,,,
22K13490,近畿大学,中村 文亮,買収に伴う事業部門の再構築：組織能力の形成と買収成果,本研究の目的は、①買収企業の過去の買収、部門再編、ジョイントベンチャー(JV)やアライアンスなどの活動領域改革の経験が、買収後のターゲット企業の部門を再構築能力の形成にどのような影響を与えるのか、さらに、②買収後のターゲット企業の事業再編が買収価値の創出にどのように影響するのかを明らかにすることである。,若手研究,小区分07080:経営学関連,企業買収,組織統合,子会社化,アライアンス,組織再編,M&A,再構築,組織能力,買収成果,PMI,,,,,,,,,,,,,,,,,,,,,,,,,,,,,,,,,,,,,,,,,,,,,,
22K13489,関西外国語大学,川村 悟,中小企業の人的支援に関する実証的研究－支援水準の向上を目指して－,感染症流行など中小企業を取り巻く経営環境は複雑化している。そのような状況を受けて、経営者と有識者が共に課題解決を図る「中小企業に対する人的支援」が注目されている。特に人口減少や経済低迷に苦しむ地方において支援強化を望む声が強い。しかし、同分野には特定のアプローチに偏重し、多様性を欠いている学術的課題がある。ゆえに仮説検証の過程を通じて社会課題の解決策を探る実証的研究の成果が期待されている。中小企業支援に携わる組織を対象とした調査を行い、なぜ高水準の支援を実現できるのかを明らかにする。,若手研究,小区分07080:経営学関連,中小企業,経営支援,実証研究,経営学,,,,,,,,,,,,,,,,,,,,,,,,,,,,,,,,,,,,,,,,,,,,,,,,,,,,
22K13488,京都精華大学,南 了太,人文社会系産官学連携の普及と定着,これまでの産官学連携は、理工・生物系分野のシーズを活用し研究開発を目的とするものが多く、人文社会系分野については十分考慮されてこなかった。本研究では、産官学連携の場面において人文社会系分野の知はどのように活用可能かを研究することを目的とする。事例として、売上高上位200社の上場企業を取り上げ、どれくらいの大学教員が企業の役員等に就任し、どのような知見を活用し、経営に参画しているかに関する実証研究を行う。さらに、企業役員に就任した経験をもつ大学教員に対してどのような知見を企業現場に活用しているかに関するインタビュー調査を行うとともに、2017年に実施した調査データと本調査データの比較研究を行う。,若手研究,小区分07080:経営学関連,人文社会系産官学連携,兼業,ガバナンス,産学連携指標,企業役員,総合知,,,,,,,,,,,,,,,,,,,,,,,,,,,,,,,,,,,,,,,,,,,,,,,,,,
22K13487,京都橘大学,FAZEKAS BALAZS,Investigating how network filters regulate flows and influences in interorganizational networks across field boundaries,"Network theory has identified different effects that the overall network has on individuals in the network. This research, however, argues that hidden walls exist in social networks that alter these effects. Moreover, these hidden boundaries can act as filters that filter network effects and influences. The aim is to identify different kinds of boundary filters and analyze their importance for the stability of social structures, such as organizations and larger organizational groups.",若手研究,小区分07080:経営学関連,social network analysis,organizational networks,organizational fields,networks,alliance networks,network filters,network friction,management,ネットワーク,新制度学派,フィールド,組織論,バウンダリー,,,,,,,,,,,,,,,,,,,,,,,,,,,,,,,,,,,,,,,,,,,
22K13486,金沢星稜大学,杉山 裕子,地域起業家による価値創出プロセスと地域発展,本研究は、地域人材（地域のキーパーソン）を活用して新たな事業機会の創出を重ねている起業家の活動を参与観察し、当該地域における価値共創システムの構築を実践的に明らかにするものである。具体的には次の３点、①地域人材の活用による知識創造体制の構築プロセスの分析、②起業家による市場創造プロセスの分析、③価値共創システムの展開と地域発展を課題とする。分析視座に、Sarasvathy氏が提案したエフェクチュエーションを用いることで、マーケティング研究と企業家研究の理論的接合を行う。,若手研究,小区分07080:経営学関連,価値創造,市場創造プロセス,アントレプレナー,エフェクチュエーション,地域人材,,,,,,,,,,,,,,,,,,,,,,,,,,,,,,,,,,,,,,,,,,,,,,,,,,,
22K13485,産業能率大学,本橋 潤子,組織の倫理風土が従業員の仕事の意味深さに及ぼす影響とその変化,企業倫理は、その実践者としての従業員の職業人生に対しても、影響を及ぼすことが予見される。本研究は、従業員の「仕事の意味深さ」に着目し、企業倫理に係る事象のひとつである「組織の倫理風土」からの影響を実証分析により明らかにしようとするものである。,若手研究,小区分07080:経営学関連,企業倫理,組織の倫理風土,職場風土,倫理的意思決定,仕事の有意味感,ミーニングフル・ワーク,仕事の意味深さ,ミーニングフルワーク,,,,,,,,,,,,,,,,,,,,,,,,,,,,,,,,,,,,,,,,,,,,,,,,
22K13484,早稲田大学,高田 真也,合併前のステークホルダー構造が合併プロセスや統合効果に与える影響の分析,研究目的は、合併前のステークホルダー構造が合併に与える影響を分析することであり、大きくデューデリジェンス等を通じて合併相手先選択に対する影響と、統合効果に与える影響の分析にわけて研究を行う。ステークホルダーの影響について、主力銀行への融資依存度や大株主の出資比率等、個別の関係による依存の「強さ」と、株主関係と取引関係、株主関係と銀行関係等複数の異なる関係に基づき「複合性」に着目して検討する点に独自性があり、統計分析による関係と統合効果のモデル化に加え、兼任役員の分析、子会社合併に与える影響に加え、合併企業間で流通するステークホルダー情報の実態把握のためのアンケート調査やインタビュー調査も行う。,若手研究,小区分07080:経営学関連,合併・買収,ステークホルダー,デューデリジェンス,PMI,ステークホルダー構造,関係の複合性,統合効果,ステークホルダー・アプローチ,,,,,,,,,,,,,,,,,,,,,,,,,,,,,,,,,,,,,,,,,,,,,,,,
22K13483,立教大学,平井 直樹,アジャイル型思考の日本の企業組織への適用,本研究は、ソフトウェア開発手法の一つであるアジャイルについて、その仕組みや考え方を日本の企業組織へどのように適用することが可能なのかを明らかにすることを目的としている。アジャイルの共創と反復的な仕組みや考え方を日本企業に適用することにより、不確実性が激しい環境に対応する手段の一つになりうることが考えられ、海外等の先行研究レビュー、企業事例の調査、日本企業へのインタビュー、アンケート分析を通じて、アジャイルの特性、日本企業におけるアジャイル導入の現状、アジャイル型日本企業の特徴を明らかにしていく。,若手研究,小区分07080:経営学関連,アジャイル,ソフトウェア,スクラム,心理的安全性,組織文化,ふりかえり,レトロスペクティブ,ウォーターフォール,プロジェクトマネジメント,,,,,,,,,,,,,,,,,,,,,,,,,,,,,,,,,,,,,,,,,,,,,,,
22K13482,神田外語大学,叶 尤奇,元中国人留学生の職業的アイデンティティと発達的ネットワークの変容に関する縦断研究,近年、日本で働く元外国人留学生の数は増加傾向にあるものの、彼・彼女らは就職後に様々な問題に直面しており、日本社会において活躍・定着しにくいことが指摘されている。そこで、本研究の目的は、日本で働く元中国人留学生を対象とした縦断研究を通じて、彼・彼女らの「職業的アイデンティティ」と「発達的ネットワーク」の変容過程を明確にし、この両者の因果関係を解明することである。これにより、元中国人留学生が日本で長期的なキャリアを形成するための重要な手がかりを提供し、日本企業のグローバル人材マネジメント戦略の構築に寄与できると考える。,若手研究,小区分07080:経営学関連,職業的アイデンティティ,キャリア発達,キャリア満足度,転職意思,ジョブ・パフォーマンス,縦断研究,発達的ネットワーク,,,,,,,,,,,,,,,,,,,,,,,,,,,,,,,,,,,,,,,,,,,,,,,,,
22K13481,麗澤大学,内藤 知加恵,「柔軟な働き方」をめぐる職場の分断メカニズムの解明：フォールトラインによる分析,近年、我が国における女性労働者の比率が高まる中、「柔軟な働き方（Flexible Work Arrangement: 以下、FWA）」が可能となった。FWA利用の高まりは、その利用対象者にとってみれば好ましいが、職場レベルでは様々な負の影響も想定される。本研究は、集団の分断を表す客観指標「フォールトライン」を用いて、職場の分断プロセスの可視化と、サブグループ特性を把握するものである。,若手研究,小区分07080:経営学関連,フォールトライン,ダイバーシティ,分断,柔軟な働き方,多様な働き方,,,,,,,,,,,,,,,,,,,,,,,,,,,,,,,,,,,,,,,,,,,,,,,,,,,
22K13480,兵庫県立大学,キョウ 園園,新興国企業の国際化と優位性構築：非市場的要素に起因する制度的環境の変化とその対応,近年の貿易摩擦、技術戦争をめぐる米中間の衝突や、コロナ禍によるグローバル化後退の兆し等の背景から、政治的・地政学的リスク、国の制度的環境の変化等の非市場的要素による多国籍企業の企業活動への影響を検討する重要性がよく指摘されている。,若手研究,小区分07080:経営学関連,国際経営,多国籍企業,新興国企業,非市場戦略,制度的環境,国際化プロセス,非市場的要素,海外直接投資,,,,,,,,,,,,,,,,,,,,,,,,,,,,,,,,,,,,,,,,,,,,,,,,
22K13479,長崎大学,辺見 英貴,職場における従業員の沈黙動機の帰属一致プロセスの解明,本研究課題は、職場におけるマネジャーと従業員の沈黙動機に対する帰属一致（すなわち、思い込みの解消）のプロセスを明らかにし、従業員の沈黙が業務進行に対してポジティブな影響を与える状況を検証する。従業員の沈黙 (employee silence)とは、従業員がマネジャーに対してアイデアや情報や意見の主張を控える行動である。先行研究では従業員の沈黙動機が精査されておらず、沈黙行動の全体像の把握が必要である。本研究の成果として期待されるのは、企業の人事施策に対して新たな示唆を与えることである。,若手研究,小区分07080:経営学関連,従業員の沈黙,従業員の発言,沈黙動機,コンテクスト,理論研究,質的研究,,,,,,,,,,,,,,,,,,,,,,,,,,,,,,,,,,,,,,,,,,,,,,,,,,
22K13478,中京大学,加藤 政仁,ESG経営と企業価値創造の関連性に関する実証研究,持続可能な社会の実現のため、気候変動問題や人権問題などの社会的な課題に取り組む企業が増えてきている。こうした環境、社会、ガバナンスを意識したESG経営は、社会的価値（貢献）として評価される反面、それらが企業価値にどのように結びついているかはよく分かっていない。本研究は、現代ファイナンス理論における企業価値評価法（DCF法）をベースに、ESG経営が企業価値にどのような影響を及ぼすかを明らかにする。,若手研究,小区分07080:経営学関連,ESG経営,ESG投資,ESG債,ESGインデックス,株価パフォーマンス,財務パフォーマンス,GHG排出量,株式市場,ESG,CSR,企業価値,資本コスト,アナリストカバレッジ,,,,,,,,,,,,,,,,,,,,,,,,,,,,,,,,,,,,,,,,,,,
22K13477,京都大学,羽田 祥子,スタートアップから見たオープンイノベーションマネジメント,既存企業が起業エコシステムに関わる機会が2010年代から急速に増加した。一方で、スタートアップからは知財盗用等の被害が多く聞かれ、公正取引委員会(2020)の実態調査は既存企業による優越的地位の濫用を指摘している。本研究は、技術や知見を核に成長を目指すスタートアップと起業家がどのように既存企業との関係性をマネジメントしているのか、防御や相手選択等に焦点を当てて理論的に説明する枠組みを検討する。企業間提携やイノベーションの研究に貢献するとともに、関係相手との望まぬ衝突や得るべき果実の喪失を回避してオープンイノベーション促進に資する、実務的な知見の提供を目指す。,若手研究,小区分07080:経営学関連,オープンイノベーション,スタートアップ,起業家,起業エコシステム,定性研究,企業間提携,提携相手選択,起業家の学習,,,,,,,,,,,,,,,,,,,,,,,,,,,,,,,,,,,,,,,,,,,,,,,,
22K13476,金沢大学,鈴木 智気,サーバント・リーダーシップの実践プロセスと日常行動に関する事例研究,本研究は、具体的には、以下二つの課題を明らかにすることを目的とする。,若手研究,小区分07080:経営学関連,サーバントリーダーシップ,マネジャー,マネジメント,サーバント・リーダーシップ,管理者行動論,リーダーシップ論,マネジメント論,管理者行動,実践プロセス,日常行動,,,,,,,,,,,,,,,,,,,,,,,,,,,,,,,,,,,,,,,,,,,,,,
22K13475,東洋大学,木村 裕斗,組織内の創造的パフォーマンスを導く「逸脱」に関する研究,一般に，組織成員と周囲の価値観のギャップはネガティブに作用すると考えられているが，成員の逸脱行動を促すことで，むしろ創造的なパフォーマンスを生む可能性がある。よって，本研究では，個人と集団の志向性のギャップが，創造的逸脱および創造的パフォーマンスに結びつく条件を特定することを目的とする。具体的には，職務遂行場面のデータおよび定性的・定量的な調査を組み合わせ，総合的にこれらの現象にアプローチする。,若手研究,小区分07080:経営学関連,創造的逸脱,革新指向生,組織コミットメント,職務満足,社会的交換関係,チーム学習,逸脱行動,創造的パフォーマンス,個人・集団の志向性,志向性のギャップ知覚,適応・逸脱行動のモデレータ,構造的緊張理論,社会的交換理論,社会的学習理論,,,,,,,,,,,,,,,,,,,,,,,,,,,,,,,,,,,,,,,,,,
22K13474,横浜国立大学,佐々木 秀綱,組織成員の社会的勢力感を規定する先行要因の探索,本研究の目的は，組織成員の「社会的勢力感（sense of social power）」を規定する要因を明らかにすることである。近年，主に社会心理学の領域を中心に，勢力感の上昇が個人の思考や行動に様々な影響を及ぼすことが明らかにされてきた。こうした知見は組織現象を理解するうえで有益な示唆を持つ一方，組織におけるどのような要因が成員個人の勢力感を左右しているかについては明らかにされてこなかった。そこで本研究では，主に質問票調査を通じて，成員個人の勢力感を規定する組織的要因について探索・検証を行う。,若手研究,小区分07080:経営学関連,経営学,組織行動論,社会的勢力感,,,,,,,,,,,,,,,,,,,,,,,,,,,,,,,,,,,,,,,,,,,,,,,,,,,,,
22K13473,京都産業大学,Shin Hayoung,仕事における他者志向的意欲としての向社会的モチベーションの促進・抑制要因,本研究の目的は、仕事や職場における向社会的モチベーションの先行要因を明らかにすることである。向社会的モチベーションとは、他者に恩恵を与えようとする意欲を指し、成員と組織の双方に概ね好影響を与えることが示され、これを高めることの重要性が強調されてきた。ところが、仕事における向社会的モチベーションの促進させ持続させる要因に関する研究蓄積は少ない。,若手研究,小区分07080:経営学関連,向社会的モチベーション,仕事における向社会性,労働意欲,先行要因,向社会性,自律的・統制的側面,モチベーション,組織行動論,,,,,,,,,,,,,,,,,,,,,,,,,,,,,,,,,,,,,,,,,,,,,,,,
