awardnumber,organization,name,title,abstract,section,review_section,keyword1,keyword2,keyword3,keyword4,keyword5,keyword6,keyword7,keyword8,keyword9,keyword10,keyword11,keyword12,keyword13,keyword14,keyword15,keyword16,keyword17,keyword18,keyword19,keyword20,keyword21,keyword22,keyword23,keyword24,keyword25,keyword26,keyword27,keyword28,keyword29,keyword30,keyword31,keyword32,keyword33,keyword34,keyword35,keyword36,keyword37,keyword38,keyword39,keyword40,keyword41,keyword42,keyword43,keyword44,keyword45,keyword46,keyword47,keyword48,keyword49,keyword50,keyword51,keyword52,keyword53,keyword54,keyword55,keyword56
22K05451,名古屋大学,山田 早人,ケミカルゲノミクスによるカイコ休眠誘導機構の解明,昆虫の繁栄を支える環境適応応答の分子基盤の解明は、地球温暖化による生態系、生物多様性、農業生産への悪影響を克服する突破口となるため、喫緊の課題の1つとして位置付けられる。昆虫の環境適応応答は休眠と呼ばれ、胚期で休眠するカイコの休眠制御機構の研究が先行しているが、その詳細は未だ明らかでない。本研究では、休眠開始シグナルを自在に操作する低分子化合物 (カイコ休眠操作分子) とRNA-seqを組み合わせたケミカルゲノミクスを実施する。これにより、休眠開始シグナル下流因子の同定と機能解析を推進し、カイコ休眠誘導機構の全容解明を目指す。,基盤研究(C),小区分38040:生物有機化学関連,休眠,ケミカルバイオロジー,カイコ,RNA-seq,,,,,,,,,,,,,,,,,,,,,,,,,,,,,,,,,,,,,,,,,,,,,,,,,,,,
22K05450,東京農工大学,岡田 洋平,次世代中分子医薬品の体系的合成法の確立,生物の高効率な物質生産プロセスは，光エネルギーによる電子移動反応の制御と，主としてリン脂質によって水中に構築された疎水性反応場の活用が基盤技術となっている．研究代表者はこのような生物プロセスから着想を得て，これまでに電子移動反応の制御に基づく独自の分子変換技術ならびにナノ反応場を活かした中分子の液相合成技術に関する研究開発を推進してきた．これまでの研究において，いずれの手法も生体分子の選択的な活性化や高度な修飾に広く応用可能であることを実証している．本研究ではこれらの学術基盤を深化・融合させることでhead-to-tail型の環状ペプチドを高純度かつ大量に供給できる新たな化学合成法を確立する．,基盤研究(C),小区分38040:生物有機化学関連,中分子,液相合成,中分子医薬品,,,,,,,,,,,,,,,,,,,,,,,,,,,,,,,,,,,,,,,,,,,,,,,,,,,,,
22K05449,東京大学,小倉 由資,骨形成の調節に関わる天然有機化合物の立体化学決定と全合成および構造活性相関研究,"本研究は、天然骨芽細胞様細胞増殖物質の立体化学決定と量的供給法の確立、骨芽胞に対する天然分化誘導剤の構造活性相関研究、破骨細胞に対する天然分化抑制剤の量的供給法の確立を目指す３つの研究によって、骨粗鬆症の新規治療法開発に向けた基盤創成を目的とする。本研究は骨芽細胞の活性化と破骨細胞の不活性化を標的とした従来法とは異なり, 骨芽細胞の増殖と破骨細胞の分化抑制によって骨形成と骨破壊の不均衡を改善するという新発想に基づく。申請者はワンポット反応やダブル反応および酵素利用合成等の効率的手法を駆使した方法論を展開し, 3年間での計画達成を目指す。",基盤研究(C),小区分38040:生物有機化学関連,全合成,絶対立体配置,骨芽細胞,酵素反応,,,,,,,,,,,,,,,,,,,,,,,,,,,,,,,,,,,,,,,,,,,,,,,,,,,,
22K05448,弘前大学,高田 晃,タマネギの鱗茎貯蔵物質による糖分集積機構の解明,タマネギは葉の根元を肥大させ鱗茎（栄養貯蔵器官）を形成する。鱗茎形成には「日長の感受」・「細胞壁の弛緩」・「糖分の集積」が複合的に関わっている。研究代表者はタマネギに鱗茎肥大促進を示す貯蔵物質が存在することを見出した。タマネギの糖分集積に貯蔵物質によるポジティブ・フィードバック機構が関与している可能性がある。,基盤研究(C),小区分38040:生物有機化学関連,タマネギ,鱗茎肥大,フルクタン,糖集積,ケストース,,,,,,,,,,,,,,,,,,,,,,,,,,,,,,,,,,,,,,,,,,,,,,,,,,,
23K05068,公益財団法人サントリー生命科学財団,堀川 学,植物におけるリグナン類の生理機能の解明,植物二次代謝物（植物特化代謝物）の植物自身に対する生理機能は十分に理解されていない。ゴマ植物では、セサミン等のリグナン類は種子に局在し、登熟過程で高蓄積し、発芽後数日でセサミン等が酸化・配糖化を受け、急激に代謝変化する。油糧作物であるゴマ種子中の油脂の増減と、脂溶性リグナン類の増減の相関から、脂溶性リグナン類は脂質の貯蔵や代謝と密接に関連していると考えた。そこで、本研究では、ゴマの脂溶性リグナン類により阻害活性を示すリパーゼを明らかにし、それらと脂質代謝の関係を分子レベルで明らかにすることにより、他の植物におけるリグナン類による発芽阻害活性を理解する足掛かりを作る。,基盤研究(C),小区分38040:生物有機化学関連,リグナン,リパーゼ阻害活性,セサミン,オイルボディ,ゴマ植物,,,,,,,,,,,,,,,,,,,,,,,,,,,,,,,,,,,,,,,,,,,,,,,,,,,
23K05067,明星大学,冨宿 賢一,酵素反応場でのジエノラート生成を基盤とする不斉合成プロセスの開発,生体触媒である酵素の示す高い物質変換能と柔軟な分子認識能、優れた立体選択性という３つの特徴を活かし、酵素の作用により生じるジエノラートと酵素の形成する反応場を活かし、立体選択的な炭素－炭素結合の形成や不斉炭素骨格の構築を可能にする生体触媒反応を開発する。すなわち、酵素の活性部位や近傍のアミノ酸残基の形成する不斉反応場でのジエノラートと求電子剤の反応が、立体選択的に炭素－炭素結合を形成し、不斉炭素骨格を構築する。立体構造と反応機構に基づき、酵素の活性部位や近傍のアミノ酸残基を最適化する。適切に設計した基質を用い、優れた収率や不斉収率を達成する。,基盤研究(C),小区分38040:生物有機化学関連,生体触媒,不斉合成,ブテノライド,異性化,ジエノラート,プロトン移動,エナンチオ面選択性,光学活性物質,,,,,,,,,,,,,,,,,,,,,,,,,,,,,,,,,,,,,,,,,,,,,,,,
23K05066,東洋大学,廣津 直樹,低フィチン酸玄米作出のためのフィチン酸合成酵素阻害剤の開発,亜鉛や鉄などのミネラルは穀物に含まれるフィチン酸と結合するとヒト体内で消化・吸収されることなく排出されてしまう。そのため穀物からの亜鉛や鉄の摂取量を増加させ欠乏リスクを低下させるためには、フィチン酸含量を低下させることも必要である。これまでに申請者らは、種子のフィチン酸含量は開花後10日におけるINO1遺伝子の発現量が制御していることを明らかにしてきた。そこで本研究では、INO1タンパク質の時期特異的阻害によって、種子のフィチン酸含量を低下させる薬剤の開発を目指す。,基盤研究(C),小区分38040:生物有機化学関連,イネ,フィチン酸,フラグメントスクリーニング,玄米,創薬,,,,,,,,,,,,,,,,,,,,,,,,,,,,,,,,,,,,,,,,,,,,,,,,,,,
23K05065,東洋大学,梅原 三貴久,トマトの変異体を使った活性型ストリゴラクトン分子の探索,植物の枝分かれの数を制御することは、作物の収量に大きな影響を与えるため重要である。枝分かれ抑制ホルモンとして知られるストリゴラクトン (SL)はこれまでに数多くの分子種が同定され、それらの生合成経路も明らかにされてきた。それにも関わらず、実はどのSLが枝分かれ抑制ホルモンの真の活性型なのかまだ確定していない。そこで本研究では、SL生合成遺伝子の欠損変異体とSL受容体遺伝子の欠損変異体sld14を使って活性型SLを同定する。ネガティブフィードバック制御のはたらきでsld14に蓄積するSLをLC-MS/MSで分析し、枝分かれ抑制に関わる活性型SLを探索する。,基盤研究(C),小区分38040:生物有機化学関連,ストリゴラクトン,マイクロトム,DWARF14,LC-MS/MS,枝分かれ,Micro-Tom,,,,,,,,,,,,,,,,,,,,,,,,,,,,,,,,,,,,,,,,,,,,,,,,,,
23K05064,東京理科大学,倉持 幸司,天然物ネオエキヌリンBをリード化合物とした広域抗ウイルス薬の創製と作用機序解明,天然物ネオエキヌリン Bをリード化合物として、低毒性で広域な抗ウイルススペクトルを有する誘導体の創製と作用機序の解析に取り組む。これまでの研究で、本天然物が新型コロナウイルス、C型肝炎ウイルス、ポリオウイルスといった一本鎖プラス鎖 RNAウイルスに対して抗ウイルス活性を示すことを見出している。従来の抗ウイルス薬は、特定のウイルスが引き起こす感染症の治療にしか使用できないが、本化合物は様々な感染症の治療に汎用的に用いられる広域抗ウイルス薬としての用途が期待できる。本研究では製品化・実用化の足掛かりをつかむことを目指す。さらに、高活性な誘導体の標的タンパク質を生物有機化学的手法により明らかにする。,基盤研究(C),小区分38040:生物有機化学関連,ネオエキヌリン B,抗ウイルス活性,ジケトピペラジン,ネオエキヌリンB,広域抗ウイルス薬,新型コロナウイルス,C型肝炎ウイルス,,,,,,,,,,,,,,,,,,,,,,,,,,,,,,,,,,,,,,,,,,,,,,,,,
23K05063,東京農業大学,石神 健,微生物の成育に関わる環状ポリペプチドの疎水性タグを活用した合成研究,医農薬の開発分野では、コンフォメーションが固定された環状ペプチドは種々の薬効を示す化合物群として期待され、候補物質の合成においては効率性や簡便性が求められる。従来の液相合成と固相合成の利点を併せ持つ「疎水性タグ法」に着目し、本手法の環状ペプチド合成への応用を検討する。合成標的として二種の環状ペプチドを選択し、本化合物群の合成を通じて「疎水性タグ法」の有効性を示す。Surfactinに関しては天然からは入手困難な単一類縁体の選択的な作り分けによる活性試験への試料供給を行い、Fusahexinに関しては提唱される異常な縮環構造の新奇合成法開発と天然物の構造決定を試みる。,基盤研究(C),小区分38040:生物有機化学関連,天然物化学,有機化学,有機合成,環状ペプチド,疎水性タグ,Surfactin,Fusahexin,有機合成化学,環状ポリペプチド,生物活性物質,疎水タグ法,,,,,,,,,,,,,,,,,,,,,,,,,,,,,,,,,,,,,,,,,,,,,
23K05062,東京農業大学,松島 芳隆,抗菌剤への応用を志向したトウモロコシのフィトアレキシンの合成研究,トウモロコシのフィトアレキシンとして、ゼアレキシンやコスト酸などが報告されている。これらの供給は、イネ科穀物の生物活性物質の化学、生合成、抗菌活性研究の推進力となる。また、天然の抗菌剤として食品保存の観点からも期待されるが、植物体からは極めて微量しか得られないため、有機合成による物質供給が必須である。ゼアレキシン類の合成例はわずかであり、β-コスト酸の合成も工程数が多い合成に限られるなど、これらの有機合成化学的研究は十分とは言えない。,基盤研究(C),小区分38040:生物有機化学関連,トウモロコシ,フィトアレキシン,ゼアレキシン,β-コスト酸,抗菌剤,殺ダニ活性,抗トリパノソーマ原虫活性,有機合成,,,,,,,,,,,,,,,,,,,,,,,,,,,,,,,,,,,,,,,,,,,,,,,,
23K05061,北海道医療大学,佐藤 浩輔,汎用性の高い核酸-タンパク質相互作用阻害法の開発,本研究では包括的に核酸－タンパク質相互作用を阻害できる新たなコンセプトを提供するために、芳香族求核置換反応を用いる汎用性の高い核酸－タンパク質相互作用阻害法の開発を行う。これまでに開発してきた核酸によるDNA cytosine-5-methyltransferase（DNMT）阻害法を一般的な核酸－タンパク質相互作用阻害法へ拡張するために多くの核酸－タンパク質相互作用で核酸のリン酸部近傍に存在するLysやArg残基と共有結合する架橋ヌクレオシドを設計・合成し、新規の核酸－タンパク質相互作用阻害剤の創製を行う。,基盤研究(C),小区分38040:生物有機化学関連,核酸化学,核酸ータンパク質相互作用,ヌクレオシド,核酸医薬品,,,,,,,,,,,,,,,,,,,,,,,,,,,,,,,,,,,,,,,,,,,,,,,,,,,,
23K05060,大阪公立大学,谷森 紳治,水を溶媒とした医農薬・天然物ビルディングブロックの有機溶媒フリー合成法の開発,本申請は、精製操作を含めて有機溶媒を使用しない、水を唯一の溶媒とした各種複素環化合物などの合成法を開発する。水中でのアリール塩化スルホニルとヒドラジンの反応によるスルホノヒドラジドの合成、ヒドラジンとイソシアナ―トの付加反応によるカルボキサミドならびにカルボチオアミドの合成、２―イソチオシアナト安息香酸メチルとアミン類の反応によるキナゾリノン誘導体の合成、o-フェニレンジアミンとアセチレンジカルボン酸エステル、続くイソシアナートの反応によるジヒドロキノキサリノン誘導体のワンポット３成分連結型合成、サリチルアルデヒドとβ―ニトロスチレンの縮合によるクロメンの不斉合成を検討する。,基盤研究(C),小区分38040:生物有機化学関連,有機溶媒フリー,キナゾリン誘導体,ヨウ素触媒,水溶媒,三成分連結反応,複素環化合物,グリーンケミストリー,持続可能性,水中反応,持続可能性・環境調和,医農薬・天然物ビルディングブロック,,,,,,,,,,,,,,,,,,,,,,,,,,,,,,,,,,,,,,,,,,,,,
23K05059,富山県立大学,野村 泰治,植物培養細胞における「休眠二次代謝」覚醒技術の基盤開拓,植物培養細胞においては、元の植物体でみられていた二次代謝産物が生合成されなくなる「休眠」が高頻度で起こる。本研究では、培養細胞において休眠した二次代謝を薬剤投与によって簡便に覚醒させることを可能にする新たな技術開拓を行う。種々の植物培養細胞への薬剤投与実験を通して、休眠二次代謝覚醒技術の汎用化に向けた課題の洗い出しとその解決策を検討するとともに、本技術の実効性を分子レベルで証明する。これによって、植物培養細胞を用いた有用物質生産における最大の課題である「二次代謝の休眠問題」を解決することを目指す。,基盤研究(C),小区分38040:生物有機化学関連,植物培養細胞,休眠二次代謝,エピジェネティック修飾,生合成,遺伝子発現制御,,,,,,,,,,,,,,,,,,,,,,,,,,,,,,,,,,,,,,,,,,,,,,,,,,,
23K05058,九州大学,鳥飼 浩平,"アルコキシメチル基を用いる1,2-transグリコシル化の深化","私達は糖を順序良く正しい方向でつなぐ化学反応（立体選択的グリコシル化）について研究している．これまでに，糖の2番目の酸素原子上にアルコキシメチル基を導入した化合物をグリコシル化反応に供すると，1番と2番の酸素原子が互い違いになった糖鎖（1,2-transグリコシド）が選択的に得られ，またそのグリコシル化反応が大変速いことを見出した．本研究ではこの反応が通常のグリコシル化と比べて何故速いのかを計算化学を用いて調べる．またどれくらい速いのか，世界最速なのか，を数値で示す．さらに昨年度までに達成できなかった1,2-transマンノシル化を，2位に新たな機能性を持たせた官能基を導入することで達成する．",基盤研究(C),小区分38040:生物有機化学関連,グリコシル化,保護基,立体選択的反応,隣接基関与,アルコキシメチル基,アルコキシプロピル基,糖鎖,,,,,,,,,,,,,,,,,,,,,,,,,,,,,,,,,,,,,,,,,,,,,,,,,
23K05057,高知大学,手林 慎一,野生植物からの植物ホルモン様物質の同定と特性解析：新奇アゴニストか？,植物ホルモンは植物の生長や環境応答などの生命現象に係わる因子であり、その重要性から生理学的な研究が精力的になされている。そのような研究においては植物ホルモンのアゴニストやアンタゴニスト、特に植物ホルモンと構造が大きく異なるアゴニストは未知の生理作用を示すことがあるため、重要なケミカルツールとなる。申請者は偶然ではあるが高知県産野生植物の地上部から植物ホルモン様活性の検出に成功した。新奇構造の可能性もあるこの植物ホルモン様物質を単離・同定し、その生理活性の特性を解明する。さらに、植物における一般性を調べ該当物質の植物ホルモンとしての可能性も探る。,基盤研究(C),小区分38040:生物有機化学関連,植物ホルモン様物質,生長促進活性,アカバナ科,植物生長促進物質,イネ,植物ホルモン,,,,,,,,,,,,,,,,,,,,,,,,,,,,,,,,,,,,,,,,,,,,,,,,,,
23K05056,愛知工業大学,吉田 久美,アントシアニンを高集積する植物における新規生合成経路と液胞集積の生物有機化学研究,本研究では、アントシアニンを多量に集積する黒色ないし紫色の豆類、果実類を標的とし、申請者が見いだした、配糖化-2-フラベノールを経由するアントシアニン生合成機構と液胞輸送機構を解明することを目的とする。,基盤研究(C),小区分38040:生物有機化学関連,アントシアニン,黒ダイズ,フラべノール,配糖化-2-フラベノール,生合成,,,,,,,,,,,,,,,,,,,,,,,,,,,,,,,,,,,,,,,,,,,,,,,,,,,
23K05055,岐阜大学,河村 奈緒子,合成化学を基盤とした癌関連ドメインの機能理解と応用,ガングリオシド（シアル酸含有糖脂質）は癌細胞膜上でタンパク質やコレステロールとの集合体（脂質ラフト）を形成することによって癌関連シグナルに深く関与するが、その機能の詳細はあまり明らかにされていない。本研究では、シアル酸部分に修飾を受けたガングリオシドを標的とし、独自の合成技術をもとに解析用の分子プローブを開発する。分子プローブを用いたイメージングにより癌細胞の増殖・浸潤の分子基盤を解明し、脂質ラフトの機能制御を試みる。,基盤研究(C),小区分38040:生物有機化学関連,糖脂質,ガングリオシド,シアル酸,脂質ラフト,,,,,,,,,,,,,,,,,,,,,,,,,,,,,,,,,,,,,,,,,,,,,,,,,,,,
23K05054,岐阜大学,今村 彰宏,特発性肺線維症治療に向けたシアリダーゼ阻害剤の開発,本研究では、国の指定難病であるヒト特発性肺線維症（IPF）治療薬の開発を目指し、ヒトシアリダーゼNEU1の選択的阻害剤の創出を目的とする。我々は、先行研究において、IPF患者の肺ではNEU1の発現が優位に増加していることを見出しており、NEU1の酵素活性を阻害することはIPFの治療につながると期待できる。これまでに我々は、世界に先駆けてNEU1を選択的に阻害する有望なリード化合物を見出している。しかし、その阻害活性は治療薬として上市できるレベルには未だ達していない。そこで本研究では、NEU1との結合親和性および酵素選択性の更なる向上を目指し、新規阻害剤候補化合物を化学合成により創出する。,基盤研究(C),小区分38040:生物有機化学関連,シアリダーゼ,特発性肺線維症,酵素阻害剤,シアル酸,NEU1,,,,,,,,,,,,,,,,,,,,,,,,,,,,,,,,,,,,,,,,,,,,,,,,,,,
23K05053,信州大学,真壁 秀文,ピロガロール基を持つプロアントシアニジン重合体の合成と抗腫瘍活性の作用機序解明,1. ピロガロール基を有するプロアントシアニジンの作用機序の解明,基盤研究(C),小区分38040:生物有機化学関連,proanthocyanidin,pyrogallol,antitumor,fluorecent probe,プロアントシアニジン,分子プローブ,,,,,,,,,,,,,,,,,,,,,,,,,,,,,,,,,,,,,,,,,,,,,,,,,,
23K05052,横浜国立大学,武田 穣,糸状性細菌が分泌する繊維状タンパク質からなるマイクロチューブの形成機構の解明,河川、湖沼などに生息する糸状性細菌の中には菌体を包み込むマイクロチューブ（鞘）を形成するものがおり、有鞘細菌と総称される。鞘は天然の微細中空糸であり、特殊な高分子物質から形成されている。本研究では、知られている限り最も細いマイクロチューブを形成する有鞘細菌に着目し、鞘形成の機構の解明を目指す。この細菌の鞘形成高分子は新規な繊維状タンパク質である可能性が高い。繊維状タンパク質としては、哺乳動物由来のコラーゲンやケラチンなど、昆虫や蜘蛛などの節足動物由来のシルクなどがよく知られているが、これらとは似て非なる細菌由来の繊維状タンパク質の発見が期待される。将来の応用を見据えて発酵生産の検討も行う。,基盤研究(C),小区分38040:生物有機化学関連,有鞘細菌,繊維状タンパク質,,,,,,,,,,,,,,,,,,,,,,,,,,,,,,,,,,,,,,,,,,,,,,,,,,,,,,
23K05051,東京大学,中村 英光,ケミカルバイオロジー的手法を用いたカリキン受容体の新機能探索,,基盤研究(C),小区分38040:生物有機化学関連,,,,,,,,,,,,,,,,,,,,,,,,,,,,,,,,,,,,,,,,,,,,,,,,,,,,,,,,
23K05050,茨城大学,長谷川 守文,植物の動的防御物質フィトアレキシンの構造的多様性と病原菌による代謝に関する研究,イネ病原菌やイネ以外を宿主とする菌によるイネフィトアレキシン代謝能の検討，代謝産物の同定などを行う．また，イネ以外の植物でも従来知られているよりもフィトアレキシンが多様であると想定されるため，他の植物における新たなフィトアレキシンの同定を目指す．さらに同じ植物でも地上部と地下部ではストレスに対して異なった応答をする可能性があるため，イネの根における新たなフィトアレキシンの同定も試みる．,基盤研究(C),小区分38040:生物有機化学関連,フィトアレキシン,ファイトアレキシン,イネ,テルペノイド,いもち病菌,二次代謝,フラボノイド,,,,,,,,,,,,,,,,,,,,,,,,,,,,,,,,,,,,,,,,,,,,,,,,,
23K05049,秋田大学,藤原 憲秀,細胞毒性天然物ポーチミンの構造活性相関と作用機序の解明を指向した合成展開,生命を脅かす疾病としての「がん」について、効果的な化学療法を探索するため、その候補となる強力な細胞毒性を持つポーチミンを対象として、合成法を確立し、構造活性相関と作用機序を解明する。ポーチミンは渦鞭毛藻から単離された強力なアポトーシス誘導活性天然物である。本研究では、特に、その構造中の５員環と８員環および９員環のトリシクロ構造をとる特異なアセタールの空間配置が活性発現に関わると推定し、空間配置を模倣した複数の類縁物質を合成して構造活性相関を調査してその仮説を検証する。これはポーチミンの活性中心構造の同定につながり、中心構造を用いる抗体薬物複合体抗がん剤の開発にも展開できる。,基盤研究(C),小区分38040:生物有機化学関連,有機合成化学,天然物の全合成,人工類縁体の合成,構造活性相関,天然物全合成,人工類縁体,作用機序解明,,,,,,,,,,,,,,,,,,,,,,,,,,,,,,,,,,,,,,,,,,,,,,,,,
