awardnumber,organization,name,title,abstract,section,review_section,keyword1,keyword2,keyword3,keyword4,keyword5,keyword6,keyword7,keyword8,keyword9,keyword10,keyword11,keyword12,keyword13,keyword14,keyword15,keyword16,keyword17,keyword18,keyword19,keyword20,keyword21,keyword22,keyword23,keyword24,keyword25,keyword26,keyword27,keyword28,keyword29,keyword30,keyword31,keyword32,keyword33,keyword34,keyword35,keyword36,keyword37,keyword38,keyword39,keyword40,keyword41,keyword42,keyword43,keyword44,keyword45,keyword46,keyword47,keyword48,keyword49,keyword50,keyword51,keyword52,keyword53,keyword54,keyword55,keyword56
18K05469,国立研究開発法人産業技術総合研究所,鵜沢 浩隆,クロストリジウム細菌生産毒素の分子認識機構の解明,クロストリジウム属の細菌が生産するボツリヌス毒素（BTX）と糖脂質との結合相互作用を解析するため、糖還元部位にアンカーを有する人工糖脂質をケモエンザイム法により合成した。水晶振動子電極の金薄膜に合成糖脂質を固定化し解析チップを開発した。差動型水晶振動子マイクロバランス（QCM）による相互作用解析を行い、合成糖脂質とBTXとの結合を検証した。その結果、従来の報告では結合しないとされた合成糖脂質に対して強く結合することを明らかにした。又、これまで未検討であった合成糖脂質に対して、BTXが結合することを初めて明らかにするなど、これまでに報告例のない学術的に重要な知見を得た。,基盤研究(C),小区分38040:生物有機化学関連,糖脂質,合成,ガングリオシド,検知チップ,相互作用解析,毒素,相互作用,ケモエンザイム合成,固定化,リガンド,細菌性毒素,認識,ライブラリー,,,,,,,,,,,,,,,,,,,,,,,,,,,,,,,,,,,,,,,,,,,
18K05468,京都学園大学,清水 伸泰,コナダニ類の脂質代謝に関わる酸化的な炭素鎖短縮反応の分子基盤,コナダニの脂肪酸由来代謝物の生合成に深く関与する新規なBaeyer-Villiger 酸化酵素（BVMO）の同定を目的とし、粗酵素の遠心分離、塩析、各種クロマトグラフィーによる精製を進めた。それに並行して本酵素の同定を目指したトランスクリプトーム解析により生合成遺伝子群の絞り込みを行った。コナダニのトランスクリプトーム塩基配列について、既知のBVMOと配列類似性を示すタンパク質を検索したところ、6種のタンパク質が特有のBVMOモチーフ配列と2カ所のRossmanモチーフ配列をもつことが明らかとなった。候補遺伝子の酵素機能を調べるため、コナダニからmRNAを抽出し、候補遺伝子をクローニングした。,基盤研究(C),小区分38040:生物有機化学関連,コナダニ,脂質代謝,炭化水素,ギ酸エステル,Baeyer-Villiger酸化,生合成,炭素鎖短縮反応,,,,,,,,,,,,,,,,,,,,,,,,,,,,,,,,,,,,,,,,,,,,,,,,,
18K05467,日本大学,明石 智義,複合フラボノイド生合成に関わるP450型プレニル基環化酵素遺伝子の探索,ダイズのファイトアレキシンのglyceollinは，フラボノイド骨格にC5イソプレン単位が付加し，環状エーテルを形成した特有の構造を持つ．今回環状エーテルの生成に関与する2つのP450 cDNAをダイズからクローニングした．エリシター処理したダイズ培養細胞では，glyceollinの蓄積に先立って，両P450の発現が誘導され，これらがglyceollin生合成の最終段階で働くことが強く示唆された. またisoflav-3-ene synthase cDNAをクローニングし，ダイズではisoflav-3-eneからcoumestrolが生合成されることがわかった．,基盤研究(C),小区分38040:生物有機化学関連,フラボノイド,シトクロムP450,マメ科植物,ファイトアレキシン,生合成,P450,,,,,,,,,,,,,,,,,,,,,,,,,,,,,,,,,,,,,,,,,,,,,,,,,,
18K05466,東洋大学,佐々木 伸大,二次代謝産物生合成において細胞質型と液胞型酵素はどのように使い分けられるのか？,キンジソウや紫キャベツが持つアントシアニンは複数の糖と有機酸で高次に修飾されている。これらの修飾反応がどのような酵素によって触媒されるかについて検討を行った。その結果、キンジソウでは、最初の2段階の反応が細胞質局在型の酵素によって、それより後の反応が液胞局在型の酵素によって触媒されることが示唆された。紫キャベツでは、最初の3つの糖修飾が細胞質型の酵素によって、その後の2段階のアシル化が液胞型の酵素によって触媒されることが示唆された。,基盤研究(C),小区分38040:生物有機化学関連,ポリアシルアントシアニン,糖転移酵素,アシルトランスフェラーゼ,ポリアシル化アントシアニン,グルコシルトランスフェラーゼ,アシル基転移酵素,アントシアニン,二次代謝合成経路,液胞型タンパク質,,,,,,,,,,,,,,,,,,,,,,,,,,,,,,,,,,,,,,,,,,,,,,,
18K05465,東京農業大学,矢島 新,見過ごされていた立体選択的反応の開発を起点とする薬剤耐性菌克服に関する研究,本研究では新規な3つの立体選択的反応、1)不斉ジヒドロキシ化による立体選択的ヒドロキシ基の導入と炭素鎖伸張法の開発、2)α－リボフラノシドの立体選択的合成法の開発、3）酵素法によるキラルビルディングブロックの合成について全て実現することができた。開発した反応を用いていくつかの生物活性天然物の合成への応用について展開し、ビサボラン型セスキテルペン類、vioraceoid類の合成を達成した。また、amphidinの配糖化部位の合成や、北側部位の合成にも成功した。さらに酵素反応の検討による知見を生かし、zealexin類の合成への展開にも成功した。,基盤研究(C),小区分38040:生物有機化学関連,有機合成化学,天然物合成化学,不斉合成,天然物合成,全合成,光学分割,生物活性物質,天然物化学,生合成,,,,,,,,,,,,,,,,,,,,,,,,,,,,,,,,,,,,,,,,,,,,,,,
18K05464,北里大学,小山 信裕,微生物資源からの抗酸菌症治療薬リードの開拓,本研究では、医薬産業において創薬リードとして大きな実績を残してきた微生物由来の化合物に焦点を当て、治療期間の短縮化を実現できる薬効を有し、既存薬の治療効果よりも優れる、薬剤耐性菌にも有効な抗酸菌症の新規治療薬の創製を目的に、これまでの治療上の問題点を克服することを目指す。先行研究により発見したリード候補化合物を基軸に、生化学的、分子遺伝学的な手法を駆使して、病原微生物を用いて、化合物の活性発現に重要な責任分子（標的分子）を同定するなどケミカルバイオロジー研究を中心に、創薬の基盤研究を展開する。,基盤研究(C),小区分38040:生物有機化学関連,抗酸菌,MAC,微生物由来化合物,ケミカルバイオロジー,標的分子,,,,,,,,,,,,,,,,,,,,,,,,,,,,,,,,,,,,,,,,,,,,,,,,,,,
18K05463,富山県立大学,野村 泰治,植物二次代謝生合成におけるユニークなラクトン化酵素の分子多様性の解明,本研究は、植物の属や科を横断して存在する植物二次代謝産物の生合成系がどのような分子進化過程を経て獲得されているのかを明らかにすることを目的とした。主にチューリップの二次代謝産物として知られているチューリッポシド類/チューリッパリン類の生合成系を対象とし、特に、チューリッポシド類をチューリッパリン類へと変換する「チューリッポシド変換酵素」の複数の植物種からの同定と機能解析を行った。その結果、少なくともユリ科チューリップ属に属する同属異種植物におけるPos変換酵素は、共通祖先に存在していた祖先型酵素が種分化に伴って分岐進化することで獲得されたものであることが分かった。,基盤研究(C),小区分38040:生物有機化学関連,二次代謝,生合成,酵素,分子進化,チューリッポシド,チューリッパリン,チューリッポシド変換酵素,カルボキシルエステラーゼ,植物二次代謝,生合成酵素,,,,,,,,,,,,,,,,,,,,,,,,,,,,,,,,,,,,,,,,,,,,,,
18K05462,九州大学,鳥飼 浩平,アルコキシメチル基を利用する立体選択的グリコシル化の開発と全合成への応用,"研究開始当初，2-O-アルコキシメチル（AM）糖供与体を用いたグリコシル化は，メトキシメチル基の1例に限られており，その反応は1,2-cis選択性を示すと報告されていた．これに対し我々は，AM基の酸素原子がオキソカルベニウムイオンに隣接基関与するならば，逆の選択性が発現するはずであると考えた．種々検討の結果，反応は我々の想定通り，数十例全てにおいて1,2-trans選択的に進行することがわかった．また上記糖供与体が既存の2-O-アシル体よりも高い反応性を有していることも見出し，ワンポット連続グリコシル化反応の開発にも成功した．さらにその過程で，嫌気条件で固体を添加できる簡便な装置も開発した．",基盤研究(C),小区分38040:生物有機化学関連,グリコシル化,"1,2-トランス",糖鎖,隣接基関与,アルコキシメチル基,β選択的,NAPOM基,ワンポット,"1,2-trans",固体添加,器具,コック,嫌気,無水,糖,天然物,糖化学,立体選択的グリコシル化,,,,,,,,,,,,,,,,,,,,,,,,,,,,,,,,,,,,,,
18K05461,岐阜大学,田中 秀則,保護基フリー液相セグメント連結法によるＡＤＰリボシル化ペプチド高効率合成,ADPリボシル化はタンパク質の翻訳後修飾の一つであり、NAD+からADPリボースをタンパク質に転移させる反応である。本翻訳後修飾は、DNA修復、転写制御など、様々な細胞プロセスに重要である。生物学的重要性は明らかになってきたが、ADPリボシル化の詳細な機能については未だ解明されていない。分子レベルでの機能解明研究の妨げとなっている主な問題点として、構造均一なADPリボシル化分子の供給の難しさが挙げられる。そこで本研究では、ADPリボシル化分子の高効率合成法の開発を目的とした。リン酸クロスカップリング反応による無保護ピロリン酸結合形成を確立し、モノ及びジADPリボースの化学合成に応用した。,基盤研究(C),小区分38040:生物有機化学関連,ADPリボース,無保護合成,ピロリン酸,ADPリボシル化アミノ酸,ADPリボシル化ペプチド,N-グリコシド化,ＡＤＰリボシル化ペプチド,ＡＤＰリボース,ピロリン酸結合形成,Ｎ-グリコシド,ADPリボシル化,化学合成,無保護,N-グリコシド,,,,,,,,,,,,,,,,,,,,,,,,,,,,,,,,,,,,,,,,,,
18K05460,奈良先端科学技術大学院大学,谷本 裕樹,複素環の発光プローブ誘導化を指向したインドールテルペン類天然物の合成研究,複素環とテルペン部位で構成される天然物の発光プローブ誘導体化に向け、様々なサンプル分子の合成と供給を可能にするテルペン骨格の短工程かつ迅速な合成法を確立した。当初は30時間をかけ数百ミリグラムが限界だった経路を、その1/10である3時間程度かつ数グラムまで合成できるよう改良し、大量供給による応用展開を容易にした。あわせて、複素環部位の典型元素誘導化に向けた生物活性超配位ケイ素化合物の構造解析、ならびに多様なプローブ合成のための自在分子連結クリック法の確立も行った。以上、天然物の構成要素を基に、各骨格部位とそれらの連結に資する他方面での新技術を確立したことから、機能分子の迅速な創出が期待できる。,基盤研究(C),小区分38040:生物有機化学関連,天然物合成,誘導体合成,テルペン,化学プローブ,クライゼン転位,インドールテルペン,ラジカルカップリング,分子力場計算,クリック反応,シグマトロピー転位,Diels-alder反応,クロスカップリング,複素環化学,蛍光発光分子プローブ,典型元素化学,,,,,,,,,,,,,,,,,,,,,,,,,,,,,,,,,,,,,,,,,
18K05459,神戸大学,水谷 正治,シストセンチュウ孵化促進物質の生合成の解明,ジャガイモシストセンチュウは、ナス属作物の根に寄生し甚大な被害をもたらす重大害虫である。線虫卵の孵化は宿主根から分泌される孵化促進物質（Hatching Factor: HF）であるソラノエクレピン A （SEA）により誘導される。本課題の目的は、（1）植物自身がHFを生合成していることを実証する、（2）HFの精製方法を確立する、（3）HFの生合成系を解明する、である。（1）HFはジャガイモ根から分泌される物質であることが明らかとなった。（2）ジャガイモ水耕液からHF精製法を確立し、水耕液中には SEA以外のHFの存在が示唆された。（3）HF生合成に関与する酵素を候補として選抜した。,基盤研究(C),小区分38040:生物有機化学関連,シストセンチュウ,孵化促進物質,ジャガイモ,トマト,トリテルペノイド,毛状根,cyst nematode,solanoeclepin,glycinoeclepin,,,,,,,,,,,,,,,,,,,,,,,,,,,,,,,,,,,,,,,,,,,,,,,
18K05458,京都大学,村井 正俊,エポキシシクロヘキセンジオン類によるADP/ATP輸送体の凝集メカニズムの解明,ミトコンドリアADP/ATP輸送体(AAC)は、ミトコンドリア内膜上でADPとATPの交換輸送を行う分子質量約30 kDaの膜輸送体であり、マトリックス側で生産されたATPを細胞質へ供給する細胞のエネルギー代謝の要となる膜輸送体である。申請者は、所属研究室が保有する化合物ライブラリーからAACに対する新規阻害剤の探索を行った結果、既知のAAC阻害剤であるBKA類やCATR類と分子骨格の異なるエポキシシクロヘキセンジオン類（ECHD類）がAACの新規阻害剤であることを見出した。本化合物はAAC表面のシステイン残基に対して共有結合を形成し、AACの顕著な凝集を誘導することがわかった。,基盤研究(C),小区分38040:生物有機化学関連,ミトコンドリア,ADP/ATP輸送体,ECHD類,ケミカルバイオロジー,阻害剤,,,,,,,,,,,,,,,,,,,,,,,,,,,,,,,,,,,,,,,,,,,,,,,,,,,
18K05457,名古屋大学,尾山 公一,多アシル化アントシアニンの合成と青色花色発現に関与する超分子金属錯体の機能解析,多アシル化アントシアニンの前駆体となるフラボノール配糖体の合成方法を検討し、プラチコニンの前駆体ユニットとなるミリセチン配糖体を合成した。また、アントシアニンへの変換反応としてZn還元-空気酸化法を用いて、フラボノール配糖体やアシル化フラボノール配糖体を使ったアントシアニン合成を行った。ESI-MSを用いて種々の青色超分子金属錯体色素の分析も行った。アジサイの青色超分子金属錯体色素をESI-MSで初めて検出することに成功した。,基盤研究(C),小区分38040:生物有機化学関連,多アシル化アントシアニン,青色超分子金属錯体色素,配糖化フラボノール,グルコシル化反応,ESI-MS,酸化反応,ミリセチン,質量分析,青色花色発現,超分子金属錯体,ケルセチン,相関移動触媒,フラボノイド,超分子,分子認識,,,,,,,,,,,,,,,,,,,,,,,,,,,,,,,,,,,,,,,,,
18K05456,名古屋大学,安立 昌篤,特異な生態機構を制御する寄主植物由来超微量多環性天然有機化合物の合成研究,本研究では、特異な多環性骨格を効率的に合成し、生理活性の詳細が明らかにされていない希少天然有機化合物の収束的な化学合成と系統的な構造活性相関研究を目的としている。具体的には、植物寄生性農害虫であるジャガイモシスト線虫の孵化機構において重要な因子であり、高度に歪んだシクロブタン骨格を含むソラノエクレピンAの合成研究を行う。この研究は、共役付加によるラジカル環化反応および7員環構築法の確立を機軸として、高度に多官能基化されたシクロブタンを含む特異な架橋型多環性骨格の効率的な合成法を確立する。,基盤研究(C),小区分38040:生物有機化学関連,有機化学,合成化学,天然物化学,生理活性,,,,,,,,,,,,,,,,,,,,,,,,,,,,,,,,,,,,,,,,,,,,,,,,,,,,
18K05455,岐阜大学,今村 彰宏,フコイダンがもつ血管新生抑制活性の発現機構解明を指向した構造活性相関研究,"天然フコイダン分子を化学的に再構築するための新規合成法を開発した。本法では、α-L-フコシド結合を構築するにあたり、まず高立体選択的にα-L-ガラクトシド結合を構築する。続いてガラクトース6位をデオキシ化することでL-フコースへと導くことができる。また、本研究では、多糖であるフコイダンの実用的合成法の確立に向けてフルオラスケミストリーの利用を検討し、精製工程においてFSPE法が有用であることを見出した。そして、確立した手法を用いることで、α(1,3)結合でつながったL-フコースオリゴマーの構築に成功し、最後に水酸基を硫酸化することで構造均一なフコイダン分子を創出した。",基盤研究(C),小区分38040:生物有機化学関連,フコイダン,糖鎖,有機合成,立体選択的グリコシル化,化学合成,構造活性相関,血管新生,硫酸化多糖,,,,,,,,,,,,,,,,,,,,,,,,,,,,,,,,,,,,,,,,,,,,,,,,
18K05454,信州大学,真壁 秀文,癌の転移と浸潤を抑制するプロアントシアニジン類の合成と化学生物学的研究,"本研究ではまずピロガロール基を有するエピガロカテキン4,5量体の合成と抗腫瘍活性の評価を行った。合成の鍵反応としては縮合反応であるが，亜鉛やトリメチルシリルトリフラートを用いたところ反応が進行した。抗腫瘍活性としては，ガン細胞増殖阻害活性を転移に関わるFABP5遺伝子の抑制効果が見られた。続いて，顕著なガン細胞増殖阻害活性を示すエピガロカテキン2量体の蛍光プローブ分子の創製を行った。この化合物の4""位にカルボン酸側鎖を導入してfluorescein amineを導入したが，収率に課題を残した。最後に，自己縮合反応を用いてエピカテキンがレートの2, 3量体の合成も達成した。",基盤研究(C),小区分38040:生物有機化学関連,プロアントシアニジン,抗腫瘍,プロシアニジン,ポリフェノール,天然物合成,ルイス酸,縮合反応,蛍光プローブ,proanthocyaidin,antituor,pyrogallol group,cancer metastasis,癌転移原因遺伝子,ピロガロール基,,,,,,,,,,,,,,,,,,,,,,,,,,,,,,,,,,,,,,,,,,
18K05453,東京大学,中村 英光,植物ホルモン受容体の過剰発現による植物免疫促進機構の解明とその応用研究,代表者らはイネのストリゴラクトン（SL）受容体D14の過剰発現体(OsD14ox)においていもち病への抵抗性が向上していることを見出していた。そこで本研究課題ではOsD14ox における抵抗誘導性について詳しく解析した。OsD14oxでは活性酸素種やファイトアレキシンが増加していた。またRNA-seqを用いて、遺伝子発現パターンの網羅的解析を行った結果、OsD14oxにおいて、特に病原菌耐性を付与する受容体様遺伝子群の発現が上昇していることを見出した。さらにD14と相互作用する因子について解析し、 D14と他のシグナル伝達因子との相互作用も新たに見出した。,基盤研究(C),小区分38040:生物有機化学関連,ストリゴラクトン,イネ,病害抵抗性誘導,いもち病,サリチル酸,ジャスモン酸,ファイトアレキシン,全身獲得抵抗性,植物免疫応答,受容体,植物ホルモン,,,,,,,,,,,,,,,,,,,,,,,,,,,,,,,,,,,,,,,,,,,,,
18K05452,宇都宮大学,謝 肖男,カーラクトンから派生した新奇発芽刺激物質に関する生物有機化学的研究,植物の根から根圏に放出されたストリゴラクトン(SL)は、根寄生植物の種子発芽刺激物質として、また、AM菌の菌糸分岐誘導物質として、それぞれ寄生と共生のシグナルとして働いている。本研究は、ABC環を有しない非典型的SLの単離・構造解析、生理機能および生合成経路の解明を行った。その結果、マメ科、イネ科、キク科およびコケ植物から計5種類の新規非典型SLを単離・構造決定した。多種多様な植物種が非典型SLを生産していることがわかった。さらに、イオンモビリティ型質量分析装置を用いるSLの超高感度分析法を開発し、1mg以下の微小組織からSLを検出することに成功した。,基盤研究(C),小区分38040:生物有機化学関連,ストリゴラクトン,植物ホルモン,非典型ストリゴラクトン,イオンモビリティ,質量分析,非典型SL,非典型的SL,,,,,,,,,,,,,,,,,,,,,,,,,,,,,,,,,,,,,,,,,,,,,,,,,
18K05451,山形大学,豊増 知伸,低分子有機化合物を利用した転写因子の人為的な機能制御,糸状菌が生産する二次代謝ジテルペノイド配糖体のフシコクシンは、植物において膜H+-ATPaseと真核生物に普遍的に存在する制御アダプタータンパク質である14-3-3タンパク質との相互作用を安定化させ、H+-ATPaseを恒常的に活性化する。本研究では、シロイヌナズナの花成関連転写因子FDに着目し、H+-ATPaseを参考にして、フシコクシン依存的にフロリゲン受容体である14-3-3と相互作用するFDを創製することに成功した。しかし、その改変FDを組み込んだシロイヌナズナの花成時期をフシコクシン処理により早めることはできなかった。,基盤研究(C),小区分38040:生物有機化学関連,14-3-3タンパク質,転写因子,フシコクシン,タンパク質-タンパク質相互作用,生命現象制御,花成,低分子有機化合物,人為制御,生命現象,,,,,,,,,,,,,,,,,,,,,,,,,,,,,,,,,,,,,,,,,,,,,,,
18K05450,秋田大学,藤原 憲秀,海藻産強毒素ポリカバノシドAとDの標的生物分子の探索を目指した合成展開,カタオゴノリの致死毒と推定されるポリカバノシドAと藍藻由来の細胞毒ポリカバノシドDは構造が酷似したマクロライド配糖体である。毒性発現機構の解明のため、これらの合成供給を目指した。合成例のないポリカバノシドDについて、マクロライド部と糖鎖を最後に連結し、マクロライド部を上半分とテトラヒドロピラン(THP)環に分割して合成する計画を遂行した。上半分とTHP環はR-パントラクトンを共通原料として合成できた。特にTHP環は不斉ビニロガス向山反応と金属触媒環化による新経路で効率合成できた。これ以降の合成は、申請者の過去のポリカバノシドAの合成法を踏襲できるため、ポリカバノシドDの合成供給の目処がついた。,基盤研究(C),小区分38040:生物有機化学関連,全合成研究,有機合成化学,不斉合成,海藻毒,細胞毒性,神経毒性,標的生体分子探索,天然物全合成,プローブ分子,毒性発現機構解明,標的分子探索,合成供給法開拓,マクロライド配糖体,天然物合成,合成供給法開発,分子プローブ,毒性機構解明,,,,,,,,,,,,,,,,,,,,,,,,,,,,,,,,,,,,,,,
18K05449,北海道大学,小笠原 泰志,ペプチドを基質とする新規立体反転酵素の解析,一般に生体を構成するアミノ酸はL体であるが、D体のアミノ酸も細菌や動植物を問わず広く分布している。D-アミノ酸含有ペプチドの生合成では、L-アミノ酸からなるペプチドに対するエピメリ化 (立体反転反応) でD体残基が導入される例はあまり知られていなかった。本研究では細胞壁の構成成分であるペプチドグリカンと天然物であるMS-271の生合成に新規なペプチドエピメリ化酵素が関わることを見出し、その反応の詳細について解明した。,基盤研究(C),小区分38040:生物有機化学関連,天然物化学,生合成,ペプチド,エピメラーゼ,酵素,阻害剤,天然物,反応機構,,,,,,,,,,,,,,,,,,,,,,,,,,,,,,,,,,,,,,,,,,,,,,,,
